Unnamed: 0,title,date,stock,sentiment
146177.0,Build-A-Bear Workshop shares are trading lower after the company reported weak Q1 earnings results.,2020-06-02 07:25:00-04:00,BBW,negative
146178.0,Build-A-Bear Workshop: Q1 Earnings Insights,2020-06-02 06:50:00-04:00,BBW,neutral
146179.0,"Build-A-Bear Workshop Q1 EPS $(0.83) Does Not Compare To $0.08 Estimate, Sales $46.60M May Not Compare To $81.38M Estimate",2020-06-02 06:47:00-04:00,BBW,neutral
146180.0,"Earnings Scheduled For June 2, 2020",2020-06-02 04:56:00-04:00,BBW,neutral
146181.0,"Build-A-Bear Workshop Believes That Its Current Cash Balance, Other Actions Taken, Will Provide It With Sufficient Liquidity For Next 12 Months; Continues To Explore Other Options To Access Alternative Liquidity Sources",2020-06-01 16:48:00-04:00,BBW,neutral
146182.0,Companies Protect C-Suite Pay As Furloughed Workers Collect Unemployment: Report,2020-05-28 17:21:00-04:00,BBW,negative
146183.0,78 Biggest Movers From Yesterday,2020-04-21 04:32:00-04:00,BBW,neutral
146184.0,54 Stocks Moving In Monday's Mid-Day Session,2020-04-20 12:43:00-04:00,BBW,neutral
146185.0,"Build-A-Bear Workshop 8-K Shows Lay Offs For 90% Of Workforce, 20% Pay Reductions For Employees On Temporary Leave",2020-03-27 07:09:00-04:00,BBW,negative
146186.0,Build-A-Bear Workshop: Q4 Earnings Insights,2020-03-11 13:32:00-04:00,BBW,neutral
146187.0,"Build-A-Bear Workshop Q4 Adj. EPS $0.4 Beats $0.27 Estimate, Sales $104.58M Beat $103.29M Estimate",2020-03-11 06:47:00-04:00,BBW,neutral
146188.0,"Earnings Scheduled For March 11, 2020",2020-03-11 04:28:00-04:00,BBW,neutral
146189.0,90 Biggest Movers From Yesterday,2020-01-30 04:15:00-05:00,BBW,neutral
146190.0,13 Consumer Cyclical Stocks Moving In Tuesday's After-Market Session,2020-01-28 23:50:00-05:00,BBW,neutral
146191.0,71 Biggest Movers From Yesterday,2020-01-28 04:14:00-05:00,BBW,neutral
146192.0,10 Specialty Retail Stocks Moving In Wednesday's Session,2020-01-22 12:30:00-05:00,BBW,neutral
146193.0,58 Consumer Cyclical Stocks Moving In Wednesday's Session,2020-01-22 12:19:00-05:00,BBW,neutral
146194.0,75 Biggest Movers From Yesterday,2020-01-16 04:37:00-05:00,BBW,neutral
146195.0,14 Consumer Cyclical Stocks Moving In Wednesday's Pre-Market Session,2020-01-15 08:15:00-05:00,BBW,neutral
146196.0,80 Biggest Movers From Yesterday,2020-01-15 04:48:00-05:00,BBW,neutral
146197.0,48 Stocks Moving In Tuesday's Mid-Day Session,2020-01-14 12:06:00-05:00,BBW,neutral
146198.0,Build-A-Bear Workshop Sees Prelim. FY19 Sales $334M-$338M,2020-01-14 06:46:00-05:00,BBW,neutral
146199.0,"Build-A-Bear Sees Q4 Sales Slightly Positive To Down Low Single Digit, Cites 'lower than expected quarter-to-date traditional mall traffic and sales associated with a key licensed movie property'",2019-12-05 06:52:00-05:00,BBW,neutral
146200.0,"Build-A-Bear Workshop Q3 EPS $(0.4) Misses $(0.28) Estimate, Sales $70.384M Beat $70.3M Estimate",2019-12-05 06:52:00-05:00,BBW,negative
146201.0,"Earnings Scheduled For December 5, 2019",2019-12-05 04:23:00-05:00,BBW,neutral
146202.0,42 Biggest Movers From Yesterday,2019-10-09 05:05:00-04:00,BBW,neutral
146203.0,45 Biggest Movers From Friday,2019-10-07 06:11:00-04:00,BBW,neutral
146204.0,52 Biggest Movers From Friday,2019-09-30 03:39:00-04:00,BBW,neutral
146205.0,58 Biggest Movers From Yesterday,2019-09-13 07:04:00-04:00,BBW,neutral
146206.0,50 Stocks Moving In Thursday's Mid-Day Session,2019-09-12 13:39:00-04:00,BBW,neutral
146207.0,65 Biggest Movers From Friday,2019-09-03 05:14:00-04:00,BBW,neutral
146208.0,48 Stocks Moving In Friday's Mid-Day Session,2019-08-30 13:27:00-04:00,BBW,neutral
146209.0,70 Biggest Movers From Yesterday,2019-08-30 04:05:00-04:00,BBW,neutral
146210.0,Jefferies Cuts Build-A-Bear Workshop Price Target From $8 to $7,2019-08-29 16:56:00-04:00,BBW,negative
146211.0,Build-A-Bear Expects Total Revenue For The Year To Increase In The Low Single-Digits; Announces New Relationship With Sony Pictures Worldwide Acquisitions,2019-08-29 06:52:00-04:00,BBW,positive
146212.0,"Build-A-Bear Workshop Q2 EPS $(0.08) Misses $(0.01) Estimate, Sales $79.2M Miss $86.8M Estimate",2019-08-29 06:50:00-04:00,BBW,negative
146213.0,"Earnings Scheduled For August 29, 2019",2019-08-29 03:55:00-04:00,BBW,neutral
146214.0,Build-A-Bear Workshop Q2 Earnings Outlook,2019-08-28 14:25:00-04:00,BBW,neutral
146215.0,Stocks That Hit 52-Week Lows On Friday,2019-08-23 11:08:00-04:00,BBW,negative
146216.0,Stocks That Hit 52-Week Lows Of Monday,2019-08-12 11:14:00-04:00,BBW,negative
146217.0,Stocks That Fell Through 52-Week Lows Wednesday,2019-08-07 14:22:00-04:00,BBW,negative
146218.0,New 52-Week Lows For Monday Morning,2019-08-05 13:16:00-04:00,BBW,negative
146219.0,"Small Cap Consumer Research Initiates Coverage On Build-A-Bear Workshop with Buy Rating, Announces $7.5 Price Target",2019-06-05 08:09:00-04:00,BBW,neutral
146220.0,54 Biggest Movers From Yesterday,2019-06-05 06:14:00-04:00,BBW,neutral
146221.0,44 Stocks Moving In Tuesday's Mid-Day Session,2019-06-04 12:44:00-04:00,BBW,neutral
146222.0,64 Biggest Movers From Friday,2019-06-03 06:12:00-04:00,BBW,neutral
146223.0,45 Stocks Moving In Friday's Mid-Day Session,2019-05-31 12:33:00-04:00,BBW,neutral
146224.0,"Build-A-Bear Sees FY19 Sales Up In Mid To High Single Digit Range, Pre-Tax Income Slightly Positive",2019-05-31 06:47:00-04:00,BBW,positive
146225.0,"Build-A-Bear Workshop Q1 EPS $0.08 Misses $0.15 Estimate, Sales $84.362M Miss $86.6M Estimate",2019-05-31 06:47:00-04:00,BBW,negative
146226.0,"Earnings Scheduled For May 31, 2019",2019-05-31 05:13:00-04:00,BBW,neutral
146227.0,Build-A-Bear Workshop's Q1 Earnings Outlook,2019-05-30 14:52:00-04:00,BBW,neutral
146228.0,"Build A Bear Workshop Amended 13D Filing From Cannell Capital Shows Cut Stake From 846K Shares To 641K Shares, Or 4.3%",2019-05-22 06:13:00-04:00,BBW,positive
146229.0,"Build A Bear 13D Filing From Cannell Capital Shows Cut Stake Modestly From ~856K Shares To 846K Shares, Or 5.66% Stake, Changed Filing Type From 13G",2019-04-02 17:35:00-04:00,BBW,positive
146230.0,David Kanen Reports 9.7% Stake in Build-A-Bear Workshop; Says Shares Undervaulued,2019-03-26 06:06:00-04:00,BBW,positive
146231.0,71 Biggest Movers From Yesterday,2019-03-15 05:24:00-04:00,BBW,neutral
146232.0,56 Stocks Moving In Thursday's Mid-Day Session,2019-03-14 12:24:00-04:00,BBW,neutral
146233.0,35 Stocks Moving In Thursday's Pre-Market Session,2019-03-14 08:07:00-04:00,BBW,neutral
146234.0,40 Stocks Moving In Wednesday's Pre-Market Session,2019-03-13 08:10:00-04:00,BBW,neutral
146235.0,Build-A-Bear Workshop Sees FY19 Sales Increase In Mid-To-High Single Digits,2019-03-13 06:50:00-04:00,BBW,positive
146236.0,"Build-A-Bear Workshop Q4 Adj. EPS $(0.05) May Not Compare To $0.35 Estimate, Sales $101.53M Beat $99.9M Estimate",2019-03-13 06:49:00-04:00,BBW,neutral
146237.0,"Earnings Scheduled For March 13, 2019",2019-03-13 05:17:00-04:00,BBW,neutral
146238.0,UPDATE: Build-A-Bear Cuts FY18 Sales Guidance From $340M-$345M To $335M-$340M vs $343.6M Estimate,2019-01-14 06:46:00-05:00,BBW,negative
146239.0,Build-A-Bear Workshop Cuts FY18 Sales Guidance,2019-01-14 06:45:00-05:00,BBW,negative
146240.0,"Stocks Which Set New 52-Week Low Yesterday, Tues., Dec. 20, 2018",2018-12-20 11:33:00-05:00,BBW,negative
146241.0,"Stocks Which Set New 52-Week Low Yesterday, Thurs., Dec. 13, 2018",2018-12-14 11:03:00-05:00,BBW,negative
146242.0,"Stocks Which Set New 52-Week Low Yesterday, Mon., Dec. 3, 2018",2018-12-04 09:21:00-05:00,BBW,negative
146243.0,52 Biggest Movers From Friday,2018-12-03 05:42:00-05:00,BBW,neutral
146244.0,48 Biggest Movers From Yesterday,2018-11-30 05:39:00-05:00,BBW,neutral
146245.0,Mid-Afternoon Market Update: U.S. Stocks Turn Higher; Tilly's Shares Plunge,2018-11-29 14:42:00-05:00,BBW,positive
146246.0,32 Stocks Moving In Thursday's Mid-Day Session,2018-11-29 12:42:00-05:00,BBW,neutral
146247.0,"Build-A-Bear Sees Q4 GAAP Sales $105M-$110M, FY18 GAAP Sales $340M-$345M",2018-11-29 06:49:00-05:00,BBW,neutral
146248.0,"Build-A-Bear Workshop Q3 EPS $(0.42) Down From $0.07 YoY, Sales $68.694M Miss $73.6M Estimate",2018-11-29 06:48:00-05:00,BBW,negative
146249.0,"Earnings Scheduled For November 29, 2018",2018-11-29 05:03:00-05:00,BBW,neutral
146250.0,"Stocks Which Set New 52-Week Low Yesterday, Mon., Nov. 19, 2018",2018-11-20 09:12:00-05:00,BBW,negative
146251.0,Build-A-Bear Workshop Expands Licensing Program With Exclusive Plush Launch At Walmart And Walmart.com,2018-10-04 15:53:00-04:00,BBW,positive
146252.0,62 Biggest Movers From Yesterday,2018-08-31 05:19:00-04:00,BBW,neutral
146253.0,45 Stocks Moving In Thursday's Mid-Day Session,2018-08-30 12:44:00-04:00,BBW,neutral
146254.0,"Build-A-Bear Cuts, Narrows FY18 Guidance Range: EPS From $0.53-$0.57 As Of Feb. 15, 2018 To $0.40-$0.57 vs $0.43 Estimate",2018-08-30 06:50:00-04:00,BBW,negative
146255.0,"Build-A-Bear Workshop Q2 EPS $(0.12) Up From $(0.15) YoY, Sales $83.178M Beat $72.4M Estimate",2018-08-30 06:49:00-04:00,BBW,neutral
146256.0,"Earnings Scheduled For August 30, 2018",2018-08-30 05:19:00-04:00,BBW,neutral
146257.0,58 Biggest Movers From Yesterday,2018-06-01 04:47:00-04:00,BBW,neutral
146258.0,44 Stocks Moving In Thursday's Mid-Day Session,2018-05-31 12:42:00-04:00,BBW,neutral
146259.0,Build-A-Bear Workshop Sees FY2018 EPS $0.40-0.57 vs $0.57 Est; Sees Sales $345.0M-355.0M vs $356.80M Est,2018-05-31 06:54:00-04:00,BBW,neutral
146260.0,"Build-A-Bear Workshop Q1 EPS $0.02, Sales $83.184M Miss $90.2M Estimate",2018-05-31 06:53:00-04:00,BBW,negative
146261.0,"Earnings Scheduled For May 31, 2018",2018-05-31 04:02:00-04:00,BBW,neutral
146262.0,46 Biggest Movers From Yesterday,2018-02-16 05:19:00-05:00,BBW,neutral
146263.0,Mid-Afternoon Market Update: Build-A-Bear Surges On Upbeat Earnings; Inpixon Shares Drop,2018-02-15 14:28:00-05:00,BBW,neutral
146264.0,"Build-A-Bear Workshop Shares Up 16% Following Q4 Earnings Beat, Despite FY18 EPS Guidance At Lower End Of Analyst Consensus Range",2018-02-15 14:13:00-05:00,BBW,neutral
146265.0,Mid-Day Market Update: SolarEdge Technologies Gains Following Q4 Earnings Beat; Avid Bioservices Shares Slide,2018-02-15 12:35:00-05:00,BBW,positive
146266.0,40 Stocks Moving In Thursday's Mid-Day Session,2018-02-15 12:11:00-05:00,BBW,neutral
146267.0,"Build-A-Bear Workshop Sees FY18 EPS $0.53-$0.57 vs $0.56 Est., Sales Growth Slightly Positive",2018-02-15 06:51:00-05:00,BBW,positive
146268.0,"Build-A-Bear Workshop Reports Q4 Adj. EPS $0.43 vs $0.34 Est., Sales $107.6M vs $104.4M Est.",2018-02-15 06:50:00-05:00,BBW,neutral
146269.0,"Earnings Scheduled For February 15, 2018",2018-02-15 04:12:00-05:00,BBW,neutral
146270.0,40 Biggest Movers From Yesterday,2018-01-10 04:34:00-05:00,BBW,neutral
146271.0,40 Stocks Moving In Tuesday's Mid-Day Session,2018-01-09 12:28:00-05:00,BBW,neutral
146272.0,"Express Shares Down 12.6% Following Earlier Reduction Of Q4, FY17 Guidance; Retail Sector Under Pressure Amid Concerning Guidance Out Of Express, Big 5, Citi Trends, American Eagle, Build-A-Bear; SPDR S&P Retail ETF Down 1.2%",2018-01-09 11:11:00-05:00,BBW,neutral
146273.0,"ICR Conference 2018 Continues Today, Presenters Include: Jack in the Box, SunOpta, FAT Brands, Envestnet, Kohl's, Noodles & Company, Build-A-Bear Workshop, Carrols Restaurant Group, Del Frisco's Restaurant, Planet Fitness",2018-01-09 09:08:00-05:00,BBW,positive
146274.0,Build-A-Bear Workshop Sees FY17 Comp. Sales To Decrease 6.5%,2018-01-09 06:05:00-05:00,BBW,neutral
146275.0,"Build-A-Bear Workshop Reports Q4 Prelim Sales Of $105M vs $111M Est., FY17 Sales $356M vs $361M Est.",2018-01-09 06:05:00-05:00,BBW,neutral
146276.0,"Build A Bear Workshop 10%+ Owner Steven A Cohen Buys 50,000 @ Avg Price: $8.66 -Form4",2017-12-14 03:47:00-05:00,BBW,neutral
146277.0,Build-A-Bear Workshop Reports New Licensed Partnership With Nintendo,2017-12-13 10:50:00-05:00,BBW,neutral
146278.0,Hearing Dougherty Downgrades Shares of Build-A-Bear Workshop From Buy to Neutral,2017-10-27 09:24:00-04:00,BBW,positive
146279.0,"Build-A-Bear Workshop Reports Q3 EPS $0.09 vs $0.10 Est., Sales $82.4M vs $85.6M Est.",2017-10-26 06:47:00-04:00,BBW,neutral
146280.0,"Benzinga's Top Upgrades, Downgrades For September 13, 2017",2017-09-13 09:21:00-04:00,BBW,positive
146281.0,"Jefferies Initiates Coverage On Build-A-Bear Workshop with Buy Rating, Announces $12.00 Price Target",2017-09-13 06:49:00-04:00,BBW,neutral
146282.0,A Peek Into The Markets: U.S. Stock Futures Mostly Flat In Pre-Market Trading,2017-08-21 07:12:00-04:00,BBW,neutral
146283.0,Build-A-Bear Announces $20M Buyback Following Review of Strategic Alternatives,2017-08-21 06:45:00-04:00,BBW,neutral
146284.0,"Build-A-Bear Workshop Reports Q2 Adj. EPS $(0.15) vs $(0.20) Est., Sales $77.2M vs $78.67M Est.",2017-07-27 06:46:00-04:00,BBW,neutral
146292.0,"Build A Bear Workshop 10%+ Owner Steven A  Cohen Buys 39,204 @ Avg Price: $10.76 -Form4",2017-05-24 16:46:00-04:00,BBW,neutral
146293.0,"Notable Insider Buys After-Hours on Friday May 19, 2017",2017-05-22 06:40:00-04:00,BBW,neutral
146294.0,Build-A-Bear Workshop Reports Q1 Adj. EPS $0.17 vs $0.19 in Same Qtr. Last Year,2017-04-27 09:13:00-04:00,BBW,neutral
146295.0,25 Stocks Moving In Wednesday's Pre-Market Session,2017-03-01 08:19:00-05:00,BBW,neutral
146296.0,12 Biggest Mid-Day Losers For Monday,2017-02-27 13:21:00-05:00,BBW,negative
146297.0,18 Biggest Mid-Day Losers For Friday,2017-02-17 13:08:00-05:00,BBW,negative
146298.0,8 Biggest Price Target Changes For Friday,2017-02-17 10:09:00-05:00,BBW,neutral
146299.0,"Benzinga's Top Upgrades, Downgrades For February 17, 2017",2017-02-17 09:26:00-05:00,BBW,positive
146300.0,The Market In 5 Minutes,2017-02-17 09:16:00-05:00,BBW,neutral
146301.0,A Peek Into The Markets: U.S. Stock Futures Fall Ahead Of Campbell Earnings,2017-02-17 07:16:00-05:00,BBW,neutral
146302.0,"PiperJaffray Downgrades Build-A-Bear Workshop To Neutral, Lowers Price Target To $10.50",2017-02-17 06:42:00-05:00,BBW,negative
146303.0,Mid-Afternoon Market Update: NetEase Rises On Upbeat Earnings; Avon Products Shares Plunge,2017-02-16 14:34:00-05:00,BBW,positive
146304.0,22 Biggest Mid-Day Losers For Thursday,2017-02-16 12:54:00-05:00,BBW,negative
146305.0,Mid-Day Market Update: Build-A-Bear Falls On Earnings Miss; Denny's Shares Surge,2017-02-16 12:11:00-05:00,BBW,positive
146306.0,Mid-Morning Market Update: Markets Mostly Higher; Wendys Posts Mixed Q4 Report,2017-02-16 09:49:00-05:00,BBW,neutral
146307.0,25 Stocks Moving In Thursday's Pre-Market Session,2017-02-16 08:17:00-05:00,BBW,neutral
146308.0,"Build-A-Bear Q4 EPS $0.31 vs $0.71 Est, Revenue $110.34M vs $126.20M Est",2017-02-16 06:47:00-05:00,BBW,neutral
146309.0,"Top Performing Industries For December 9, 2016",2016-12-09 13:35:00-05:00,BBW,positive
146310.0,"Top Performing Industries For December 1, 2016",2016-12-01 10:51:00-05:00,BBW,positive
146311.0,"Worst Performing Industries For November 21, 2016",2016-11-21 11:57:00-05:00,BBW,negative
146312.0,"Worst Performing Industries For November 18, 2016",2016-11-18 11:20:00-05:00,BBW,negative
146313.0,"Top Performing Industries For October 31, 2016",2016-10-31 10:55:00-04:00,BBW,positive
146314.0,20 Biggest Mid-Day Gainers For Thursday,2016-10-27 12:26:00-04:00,BBW,neutral
146315.0,"Top Performing Industries For October 27, 2016",2016-10-27 10:53:00-04:00,BBW,positive
146316.0,"Build-A-Bear Q3 EPS $0.11 vs $0.11 Est, Revenue $83.7M vs $86.5M Est",2016-10-27 06:48:00-04:00,BBW,neutral
146317.0,"Worst Performing Industries  For October 20, 2016",2016-10-20 11:28:00-04:00,BBW,negative
146318.0,"Top Performing Industries For October 14, 2016",2016-10-14 11:12:00-04:00,BBW,positive
146319.0,"Top Performing Industries For October 10, 2016",2016-10-10 10:50:00-04:00,BBW,positive
146320.0,"Worst Performing Industries For September 28, 2016",2016-09-28 11:18:00-04:00,BBW,negative
146321.0,"Top Performing Industries For September 27, 2016",2016-09-27 11:00:00-04:00,BBW,positive
146322.0,"Worst Performing Industries For September 22, 2016",2016-09-22 11:34:00-04:00,BBW,negative
146323.0,"Worst Performing Industries For September 21, 2016",2016-09-21 11:25:00-04:00,BBW,negative
146324.0,"Worst Performing Industries For September 15, 2016",2016-09-15 11:56:00-04:00,BBW,negative
146325.0,Stocks Hitting 52-Week Lows,2016-09-14 10:19:00-04:00,BBW,negative
146326.0,"Worst Performing Industries For September 12, 2016",2016-09-12 11:52:00-04:00,BBW,negative
146327.0,"Worst Performing Industries For September 8, 2016",2016-09-08 11:26:00-04:00,BBW,negative
146328.0,"Worst Performing Industries For September 1, 2016",2016-09-01 11:28:00-04:00,BBW,negative
146329.0,"Worst Performing Industries For August 29, 2016",2016-08-29 11:12:00-04:00,BBW,negative
146330.0,"Worst Performing Industries For August 22, 2016",2016-08-22 12:33:00-04:00,BBW,negative
146331.0,"Top Performing Industries For August 16, 2016",2016-08-16 10:47:00-04:00,BBW,positive
146332.0,"Worst Performing Industries For August 9, 2016",2016-08-09 11:20:00-04:00,BBW,negative
146333.0,20 Biggest Mid-Day Losers For Thursday,2016-08-04 13:05:00-04:00,BBW,negative
146334.0,"Worst Performing Industries For August 4, 2016",2016-08-04 11:41:00-04:00,BBW,negative
146335.0,"Build-A-Bear Workshop Reports Q2 EPS $(0.28) vs $(0.29) Est., Sales $75.1M vs $79M Est.",2016-08-04 06:54:00-04:00,BBW,neutral
146336.0,"Earnings Scheduled For August 4, 2016",2016-08-04 04:03:00-04:00,BBW,neutral
146337.0,"Worst Performing Industries For July 28, 2016",2016-07-28 11:33:00-04:00,BBW,negative
146338.0,"Top Performing Industries For July 18, 2016",2016-07-18 11:18:00-04:00,BBW,positive
146339.0,"Top Performing Industries For July 11, 2016",2016-07-11 11:07:00-04:00,BBW,positive
146340.0,"Top Performing Industries For May 27, 2016",2016-05-27 10:54:00-04:00,BBW,positive
146341.0,"Top Performing Industries For May 20, 2016",2016-05-20 10:51:00-04:00,BBW,positive
146342.0,"Worst Performing Industries For May 4, 2016",2016-05-04 11:51:00-04:00,BBW,negative
146343.0,"Craig Hallum Says Build-A-Bear May Be Setting Up For A Company Sale, Maintains Buy And $24 PT",2016-05-03 12:41:00-04:00,BBW,neutral
146344.0,"Top Performing Industries For May 3, 2016",2016-05-03 10:45:00-04:00,BBW,positive
146345.0,Build-A-Bear Workshop Reaffirms FY 2016 Guidance,2016-05-03 06:51:00-04:00,BBW,neutral
146346.0,"Build-A-Bear Workshop Q1 EPS $0.22 vs $0.37 est, Revenue $94.98M vs $96.70M est",2016-05-03 06:50:00-04:00,BBW,neutral
146347.0,"Earnings Scheduled For May 3, 2016",2016-05-03 04:02:00-04:00,BBW,neutral
146348.0,"Top Performing Industries For April 15, 2016",2016-04-15 10:32:00-04:00,BBW,positive
146349.0,"Worst Performing Industries For April 14, 2016",2016-04-14 11:02:00-04:00,BBW,negative
146350.0,"Top Performing Industries For April 11, 2016",2016-04-11 10:37:00-04:00,BBW,positive
146351.0,"Worst Performing Industries For March 31, 2016",2016-03-31 11:23:00-04:00,BBW,negative
146352.0,"Worst Performing Industries For March 22, 2016",2016-03-22 12:03:00-04:00,BBW,negative
146353.0,"Worst Performing Industries For March 14, 2016",2016-03-14 11:26:00-04:00,BBW,negative
146354.0,"Worst Performing Industries For March 1, 2016",2016-03-01 12:06:00-05:00,BBW,negative
146355.0,"Top Performing Industries For February 29, 2016",2016-02-29 11:02:00-05:00,BBW,positive
146356.0,J. Carlo Cannell Reports 8.18% Stake in Build-A-Bear Workshop;,2016-02-18 06:23:00-05:00,BBW,neutral
146357.0,"Top Performing Industries For February 16, 2016",2016-02-16 10:33:00-05:00,BBW,positive
146358.0,Build A Bear Reiterates Guidance,2016-02-16 07:01:00-05:00,BBW,neutral
146359.0,"Build A Bear Q4 EPS $0.62 vs $0.53 est, Revenue $117.7M vs $117.8M est",2016-02-16 07:00:00-05:00,BBW,neutral
146360.0,"Earnings Scheduled For February 16, 2016",2016-02-16 04:07:00-05:00,BBW,neutral
146361.0,"Top Performing Industries For January 29, 2016",2016-01-29 10:40:00-05:00,BBW,positive
146362.0,"Worst Performing Industries For January 27, 2016",2016-01-27 12:01:00-05:00,BBW,negative
146363.0,"Top Performing Industries For January 21, 2016",2016-01-21 10:31:00-05:00,BBW,positive
146364.0,"Top Performing Industries For January 19, 2016",2016-01-19 10:33:00-05:00,BBW,positive
146365.0,"Top Performing Industries For January 13, 2016",2016-01-13 10:30:00-05:00,BBW,positive
146366.0,Mid-Afternoon Market Update: Crude Oil Falls Over 4%; Apollo Education Shares Spike Higher,2016-01-12 15:21:00-05:00,BBW,negative
146367.0,Mid-Day Market Update: US Stocks Turn Lower; Super Micro Computer Shares Rise On Strong Outlook,2016-01-12 12:50:00-05:00,BBW,positive
146368.0,"Top Performing Industries For January 12, 2016",2016-01-12 10:23:00-05:00,BBW,positive
146369.0,Build a Bear Says Comp Sales to Increase in Low Single Digits,2016-01-12 07:02:00-05:00,BBW,positive
146370.0,Build-A-Bear Workshop Sees Q4 Sales $117.70M vs $118.22M Est,2016-01-12 07:01:00-05:00,BBW,neutral
146371.0,"Worst Performing Industries For January 8, 2016",2016-01-08 11:33:00-05:00,BBW,negative
146372.0,"Worst Performing Industries For January 5, 2016",2016-01-05 11:21:00-05:00,BBW,negative
146373.0,Benzinga's Top Downgrades,2016-01-05 09:27:00-05:00,BBW,positive
146374.0,BMO Capital Downgrades Build-A-Bear Workshop to Market Perform,2016-01-05 07:02:00-05:00,BBW,neutral
146375.0,"Top Performing Industries For December 28, 2015",2015-12-28 10:41:00-05:00,BBW,positive
146376.0,"Top Performing Industries For December 21, 2015",2015-12-21 10:19:00-05:00,BBW,positive
146377.0,"Top Performing Industries For December 17, 2015",2015-12-17 10:30:00-05:00,BBW,positive
146378.0,Option Alert: BBW Jan16 12.5 Puts: 720 @  ASK  $1.50: 720 traded vs 175 OI: $11.82 Ref,2015-12-17 10:12:00-05:00,BBW,positive
146379.0,"Worst Performing Industries For December 14, 2015",2015-12-14 12:20:00-05:00,BBW,negative
146380.0,Guggenheim Securities Initiates Coverage on Build-A-Bear Workshop at Neutral,2015-12-14 08:52:00-05:00,BBW,positive
146381.0,"Worst Performing Industries For December 11, 2015",2015-12-11 12:20:00-05:00,BBW,negative
146382.0,"Top Performing Industries For December 2, 2015",2015-12-02 10:33:00-05:00,BBW,positive
146383.0,"Worst Performing Industries For November 30, 2015",2015-11-30 11:40:00-05:00,BBW,negative
146384.0,"Worst Performing Industries For November 27, 2015",2015-11-27 11:59:00-05:00,BBW,negative
146385.0,"Top Performing Industries For November 25, 2015",2015-11-25 10:31:00-05:00,BBW,positive
146386.0,"Worst Performing Industries For November 24, 2015",2015-11-24 11:30:00-05:00,BBW,negative
146387.0,"Worst Performing Industries For November 23, 2015",2015-11-23 11:31:00-05:00,BBW,negative
146388.0,8-K from Build-A-Bear Shows New $10M Buyback Plan,2015-11-19 16:34:00-05:00,BBW,neutral
146389.0,"Worst Performing Industries For November 19, 2015",2015-11-19 12:15:00-05:00,BBW,negative
146390.0,"Worst Performing Industries For November 18, 2015",2015-11-18 11:05:00-05:00,BBW,negative
146391.0,"Top Performing Industries For November 16, 2015",2015-11-16 10:32:00-05:00,BBW,positive
146392.0,"Worst Performing Industries For November 11, 2015",2015-11-11 11:08:00-05:00,BBW,negative
146393.0,"Worst Performing Industries For November 9, 2015",2015-11-09 11:09:00-05:00,BBW,negative
146394.0,"Worst Performing Industries For November 2, 2015",2015-11-02 12:05:00-05:00,BBW,negative
146395.0,"Top Performing Industries For October 30, 2015",2015-10-30 10:52:00-04:00,BBW,positive
146396.0,"Build-A-Bear's 'Violent' Crash Unwarranted, Say These Experts",2015-10-30 10:12:00-04:00,BBW,negative
146397.0,Mid-Afternoon Market Update: Rayonier Advanced Materials Gains On Upbeat Results; Rovi Shares Slide,2015-10-29 15:55:00-04:00,BBW,positive
146398.0,Mid-Day Market Update: Build-A-Bear Declines On Weak Results; Lifelock Shares Surge,2015-10-29 12:29:00-04:00,BBW,negative
146399.0,"Worst Performing Industries For October 29, 2015",2015-10-29 11:10:00-04:00,BBW,negative
146400.0,Stocks Hitting 52-Week Lows,2015-10-29 10:33:00-04:00,BBW,negative
146401.0,Mid-Morning Market Update: Markets Edge Lower; Mastercard Earnings Beat Estimates,2015-10-29 10:18:00-04:00,BBW,negative
146402.0,Morning Market Losers,2015-10-29 09:58:00-04:00,BBW,negative
146403.0,"Build-A-Bear Reports Q3 Adj. EPS $0.10 vs $0.21 Est., Comps Up 2.1%, Sales $85.6M vs $89M Est.",2015-10-29 07:08:00-04:00,BBW,neutral
146404.0,"Top Performing Industries For October 19, 2015",2015-10-19 10:45:00-04:00,BBW,positive
146405.0,"Top Performing Industries For October 15, 2015",2015-10-15 10:52:00-04:00,BBW,positive
146406.0,"Worst Performing Industries For October 14, 2015",2015-10-14 11:28:00-04:00,BBW,negative
146407.0,"Top Performing Industries For October 13, 2015",2015-10-13 10:36:00-04:00,BBW,positive
146408.0,"Top Performing Industries For October 12, 2015",2015-10-12 10:37:00-04:00,BBW,positive
146409.0,"Worst Performing Industries For October 9, 2015",2015-10-09 13:31:00-04:00,BBW,negative
146410.0,"Top Performing Industries For October 8, 2015",2015-10-08 10:37:00-04:00,BBW,positive
146411.0,"Worst Performing Industries For October 7, 2015",2015-10-07 11:43:00-04:00,BBW,negative
146412.0,"Worst Performing Industries For October 5, 2015",2015-10-05 11:30:00-04:00,BBW,negative
146413.0,"Worst Performing Industries For October 1, 2015",2015-10-01 12:12:00-04:00,BBW,negative
146414.0,"Worst Performing Industries For September 29, 2015",2015-09-29 11:25:00-04:00,BBW,negative
146415.0,"Worst Performing Industries For September 28, 2015",2015-09-28 12:00:00-04:00,BBW,negative
146416.0,"Worst Performing Industries For September 25, 2015",2015-09-25 11:50:00-04:00,BBW,negative
146417.0,"Top Performing Industries For September 18, 2015",2015-09-18 10:32:00-04:00,BBW,positive
146418.0,"Top Performing Industries For September 17, 2015",2015-09-17 10:49:00-04:00,BBW,positive
146419.0,"Worst Performing Industries For September 9, 2015",2015-09-09 12:35:00-04:00,BBW,negative
146420.0,"Worst Performing Industries For September 8, 2015",2015-09-08 11:28:00-04:00,BBW,negative
