Unnamed: 0,title,date,stock,sentiment
164213.0,Benzinga's Top Initiations,2012-07-03 07:52:00-04:00,BIOC,positive
164214.0,"The Benchmark Company Initiates Coverage on BioClinica at Buy, Announces PT of $8",2012-07-03 06:38:00-04:00,BIOC,neutral
164215.0,BioClinica Partners with Paragon Solutions to Create Clinical Architecture   ,2012-04-17 08:35:00-04:00,BIOC,positive
164216.0,From Earlier: BioClinica Partners With Mirada Medical ,2012-03-30 08:24:00-04:00,BIOC,neutral
164217.0,A Peek Into The Market Before The Trading Starts,2012-03-23 07:18:00-04:00,BIOC,neutral
164218.0,BioClinica Partners with NextDocs to Streamline Clinical Trial Submission Process   ,2012-03-23 07:00:00-04:00,BIOC,neutral
164219.0,A Peek Into The Market Before The Trading Starts,2012-03-05 07:21:00-05:00,BIOC,neutral
164220.0,Grünenthal Selects BioClinica OnPoint Clinical Trial Management System   ,2012-03-05 06:38:00-05:00,BIOC,neutral
164221.0,UPDATE: Benchmark Raises Price Target on BioClinica to $8,2012-01-17 08:40:00-05:00,BIOC,neutral
164222.0,BioClinica WebSend Effects Rapid Change in Clinical Trial Image Management with Adoption Rate Surpassing 90%   ,2011-09-21 06:39:00-04:00,BIOC,neutral
164223.0,Paragon Solutions and BioClinica Reveal Findings from First Clinical Trial Supplies Industry Forecasting Survey ,2011-06-30 10:55:00-04:00,BIOC,positive
164224.0,BioClinica Inks Seven New Trident IWR Deals in First Quarter 2011   ,2011-04-07 07:03:00-04:00,BIOC,neutral
164225.0,"NASDAQ Stocks Hitting 52-Week Highs (BRNC, BIOC, ATEA, TORM)",2011-03-23 10:15:00-04:00,BIOC,neutral
164226.0,BioClinica CTMS Achieves Growing Market Acceptance   ,2011-03-23 08:07:00-04:00,BIOC,positive
164227.0,BioClinica Announces Share Repurchase of $2.0M,2010-12-17 07:19:00-05:00,BIOC,positive
164228.0,BioClinica Responds to Shareholder Letter (BIOC)  ,2010-09-30 15:18:00-04:00,BIOC,neutral
164229.0,Garry D. Johnson Joins BioClinica as Senior Vice President ,2010-09-08 09:35:00-04:00,BIOC,neutral
164230.0, BioClinica  (BIOC)  Announces  2009 Q3 Financial Results,2009-11-04 07:12:00-05:00,BIOC,neutral
