Unnamed: 0,title,date,stock,sentiment
187646.0,Brooks Automation Reports Q1 EPS of $0.41 vs. $0.42 Estimate; Revenues $192.7M vs. $190M Estimate (BRKS),2011-05-05 16:02:00-04:00,BRKS,neutral
187647.0,"Top Computer Hardware Stock Picks on 5/5/11- DGII, EFII, AAPL, DELL, MXWL, SEAC, IM, BRKS, AGYS, TECD, MIPS",2011-05-05 07:45:00-04:00,BRKS,positive
187648.0,"Benzinga's Top Downgrades (BBT, CEVA, ALXN, BRKS)",2011-04-25 08:14:00-04:00,BRKS,positive
187649.0,Strong Yearly Growth as IVAC Beats - Analyst Blog,2011-02-02 17:01:00-05:00,BRKS,positive
187650.0,Strong Yearly Growth as IVAC Beats - Analyst Blog,2011-02-02 16:17:00-05:00,BRKS,positive
187651.0,Pall Corp. and Entegris  - Zacks #1 Rank Top Performers,2011-01-31 17:24:00-05:00,BRKS,positive
187652.0,Pall Corp. and Entegris  - Zacks #1 Rank Top Performers,2011-01-31 00:00:00-05:00,BRKS,positive
187653.0,Zacks #1 Rank Additions for Thursday - Tale of the Tape,2011-01-27 08:31:00-05:00,BRKS,neutral
187654.0,Zacks #1 Rank Additions for Thursday - Tale of the Tape,2011-01-27 08:14:00-05:00,BRKS,neutral
187655.0,Zacks #1 Rank Additions for Thursday - Tale of the Tape,2011-01-20 08:31:00-05:00,BRKS,neutral
187656.0,Zacks #1 Rank Additions for Thursday - Tale of the Tape,2011-01-20 08:14:00-05:00,BRKS,neutral
187657.0,Brooks Automation Up 12% To 52-Week High (BRKS),2011-01-14 14:38:00-05:00,BRKS,neutral
187658.0,"Small Caps on the Move:(SSN),(CHGI),(EGY),(SRZ),(TPLM) More Below",2011-01-13 22:37:00-05:00,BRKS,neutral
187659.0,"Low Priced Movers (ASTM),(OMEX), (EDAP), (RUTH), (GU),(BRKS)",2011-01-10 11:26:00-05:00,BRKS,negative
187660.0,"Market Roundup (NVDA, KLAC, CCMP, BRKS, JOSB, EURX)",2010-12-01 12:50:00-05:00,BRKS,neutral
187661.0,Brooks Automation Shares Climb 8% On Earnings Beat (BRKS),2010-11-10 18:36:00-05:00,BRKS,positive
187662.0,Brooks Automation Beats Estimates (BRKS),2010-11-10 16:14:00-05:00,BRKS,neutral
187663.0,"Brigantine Initiates Coverage On SYNA, AMAT, BRKS, IMMR, ORBK, PANL, GLW",2010-10-11 11:21:00-04:00,BRKS,neutral
187664.0,Brooks Enters Oversold Territory  - Tale of the Tape,2010-09-04 11:03:00-04:00,BRKS,neutral
187665.0,"Brooks Automation Beats, Citi Maintains Sell (BRKS)",2010-08-06 12:52:00-04:00,BRKS,neutral
187666.0,"Citi Downgrades 7 Semi Equip Stocks (KLAC, ATMI, BRKS, ENTG, AEIS, AMAT, NVLS)",2010-01-22 15:03:00-05:00,BRKS,neutral
187667.0,"Benzinga’s Volume Movers (TKTM, ANGO, NICE, BRKS, FAST)",2010-01-06 14:12:00-05:00,BRKS,positive
187668.0,Barclay Capital Technology Conference Takeaways,2009-12-09 11:15:00-05:00,BRKS,neutral
