Unnamed: 0,title,date,stock,sentiment
224884.0,"JP Morgan Maintains Neutral on Century Communities, Raises Price Target to $24",2020-05-06 09:51:00-04:00,CCS,positive
224885.0,"B. Riley FBR Maintains Buy on Century Communities, Raises Price Target to $30",2020-04-30 11:04:00-04:00,CCS,neutral
224886.0,"Century Communities Q1 EPS $0.800 Beats $0.640 Estimate, Sales $602.600M Beat $544.900M Estimate",2020-04-29 16:14:00-04:00,CCS,neutral
224887.0,Century Communities shares are trading lower JP Morgen downgraded the stock from Overweight to Neutral and announced a price target of $15.50 per share.,2020-03-18 09:07:00-04:00,CCS,positive
224888.0,"JP Morgan Downgrades Century Communities to Neutral, Announces $15.5 Price Target",2020-03-18 05:43:00-04:00,CCS,positive
224889.0,"B. Riley FBR Maintains Buy on Century Communities, Lowers Price Target to $28",2020-03-17 07:47:00-04:00,CCS,negative
224890.0,"Wedbush Downgrades Century Communities to Neutral, Announces $38 Price Target",2020-02-13 08:14:00-05:00,CCS,neutral
224891.0,"Wedbush Maintains Outperform on Century Communities, Raises Price Target to $38",2020-02-07 08:12:00-05:00,CCS,neutral
224892.0,"B. Riley Maintains Buy on Century Communities, Raises Price Target to $44",2020-02-07 07:26:00-05:00,CCS,neutral
224893.0,Century Communities shares are trading higher after the company reported better-than-expected Q4 EPS and sales results.,2020-02-06 16:35:00-05:00,CCS,positive
224894.0,"Century Communities Q4 EPS $1.5 Beats $1.27 Estimate, Sales $775.7M Beat $743M Estimate",2020-02-06 16:21:00-05:00,CCS,neutral
224895.0,"Century Communities Raises FY19 Home Deliveries Guidance To 7.7-8.1K Homes, Home Sales $2.4B-$2.5B",2019-10-29 16:33:00-04:00,CCS,neutral
224896.0,"Century Communities Q3 EPS $0.87, Inline, Sales $590.362M Beat $581.12M Estimate",2019-10-29 16:33:00-04:00,CCS,neutral
224897.0,Century Communities Announces Model Grand Opening Event For 55+ Active Adult Community In Fremont On Oct 19,2019-10-16 16:11:00-04:00,CCS,positive
224898.0,"JP Morgan Upgrades Century Communities to Overweight, Raises Price Target to $32.5",2019-09-11 11:00:00-04:00,CCS,neutral
224899.0,"Wedbush Remains Buyers Of 'OUTPERFORM-rated LEN, TMHC, WLH, CCS, and BZH' As Firm Believes 'Each of these names should benefit from lower mortgage rates along with their focus on affordable price point homes'",2019-08-27 13:00:00-04:00,CCS,positive
224900.0,"Century Communities Q2 EPS $0.51 Misses $0.73 Estimate, Sales $608.6M Beat $574.53M Estimate",2019-07-30 16:31:00-04:00,CCS,negative
224901.0,Wedbush Upgrades Century Communities to Outperform,2019-05-31 06:25:00-04:00,CCS,neutral
224902.0,Century Communities Launches An Offering Of $400M Of New Senior Notes Due 2027; The Net Proceeds From The Offering Are Expected To Be Used To Finance Co's Cash Tender Offer For Any And All Of The $385.0M Aggregate 6.875% Notes Due In 2022,2019-05-09 08:41:00-04:00,CCS,neutral
224903.0,Century Communities Sees FY19 Sales $2.2B-$2.5B vs $2.25B Est.,2019-05-02 16:43:00-04:00,CCS,neutral
224904.0,"Century Communities Q1 Adj. EPS $0.6 Beats $0.45 Estimate, Sales $523.3M Beat $461.75M Estimate",2019-05-02 16:42:00-04:00,CCS,neutral
224905.0,Century Communities shares are trading higher after it was announced that the company would replace Semtech in the S&P SmallCap 600.,2019-04-05 09:37:00-04:00,CCS,positive
224906.0,Semtech And PS Business Parks Set to Join S&P MidCap 400; Century Communities And Boot Barn Holdings To Join S&P SmallCap 600,2019-04-04 17:18:00-04:00,CCS,positive
224907.0,UPDATE: Wedbush Downgrades Century Communities As Firm Is 'concerned that demand for the WJ product has not been as robust as we expected especially given WJ's ultra-low price approach',2019-02-08 09:48:00-05:00,CCS,negative
224908.0,"Wedbush Downgrades Century Communities to Neutral, Lowers Price Target to $24",2019-02-08 08:43:00-05:00,CCS,negative
224909.0,"Century Communities Says Will Not Issue Sales, Closing Guidance For FY19 At This Time",2019-02-07 16:37:00-05:00,CCS,neutral
224910.0,"Century Communities Q4 EPS $1.11 Up From $1.01 YoY, Home Sales $640.2M Up From $523.946M YoY",2019-02-07 16:37:00-05:00,CCS,neutral
224911.0,"Stocks Which Set New 52-Week Low Last Trading Session, Fri., Dec. 14, 2018",2018-12-17 11:48:00-05:00,CCS,negative
224912.0,"Stocks Which Set New 52-Week Low Yesterday, Wed., Nov. 14, 2018",2018-11-15 11:37:00-05:00,CCS,negative
224913.0,"Century Communities Q3 EPS $0.86 Beats $0.72 Estimate, Sales $561.729M Miss $586.06M Estimate",2018-11-06 17:22:00-05:00,CCS,negative
224914.0,Century Communities Announces 4.5M Share Buyback,2018-11-06 16:34:00-05:00,CCS,positive
224915.0,"Stocks Which Set New 52-Week Low Yesterday, October 23rd",2018-10-24 10:06:00-04:00,CCS,negative
224916.0,"Stocks Which Set New 52-Week Low Yesterday, October 22nd",2018-10-23 09:54:00-04:00,CCS,negative
224917.0,"Stocks Which Set New 52-Week Low Yesterday, October 11th",2018-10-12 11:30:00-04:00,CCS,negative
224918.0,"Stocks Which Set New 52-Week Low Yesterday, October 10th",2018-10-11 09:11:00-04:00,CCS,negative
224919.0,"Stocks Which Set New 52-Week Low Friday, October 5th",2018-10-08 09:27:00-04:00,CCS,negative
224920.0,"JP Morgan Downgrades Century Communities to Neutral, Lowers Price Target to $31.50",2018-09-21 07:34:00-04:00,CCS,positive
224921.0,Century Communities Acquires Land For New Neighborhoods In Skye Canyon And Southwest Las Vegas,2018-08-14 16:38:00-04:00,CCS,neutral
224922.0,"Century Communities Q2 Adj. EPS $1.10 Beats $0.88 Estimate, Sales $531.89M Beat $504.61M Estimate",2018-08-02 16:51:00-04:00,CCS,neutral
224923.0,Zelman Initiates Coverage On Century Communities with Hold Rating,2018-06-20 09:12:00-04:00,CCS,neutral
224924.0,"Century Communities Shares Up 5.6% From Session Low; Co. Earlier Reported Purchase Of Remaining 50% Ownership Interest In WJH, No Terms Disclosed",2018-06-14 11:43:00-04:00,CCS,positive
224925.0,"Century Communities Q1 EPS $0.75 Beats $0.47 Estimate, Sales $394.8M Beat $386.2M Estimate",2018-05-08 17:20:00-04:00,CCS,neutral
224926.0,"Century Communities Inc Shares Up 12.6% After Hours As Co. Reports Record Q4 Results, Beats On EPS, Revenue",2018-02-13 16:49:00-05:00,CCS,positive
224927.0,Century Communities Sees FY18 Home Sales Rev. $1.75-$2.0B,2018-02-13 16:47:00-05:00,CCS,neutral
224928.0,"Century Communities Reports Q4 Adj. EPS $1.01 vs $0.71 In Prior Year Period, Sales $516.5M vs $507M Est.",2018-02-13 16:46:00-05:00,CCS,neutral
224929.0,"Century Communities Reports Q3 Adj. EPS $0.37 vs $0.41, Sales $379M vs $417M Est.",2017-11-02 17:47:00-04:00,CCS,neutral
224930.0,"JP Morgan Upgrades Century Communities to Overweight, Raises Price Target to $32.00",2017-09-14 06:54:00-04:00,CCS,neutral
224931.0,Century Communities Sees FY17 Home Sales $1.3-$1.5B,2017-08-03 17:52:00-04:00,CCS,neutral
224932.0,"Century Communities Reports Q2 EPS $0.66 vs $0.67 Est., Sales $291M vs $304M Est.",2017-08-03 17:52:00-04:00,CCS,neutral
224933.0,Century Communities Sees FY17 Sales $1B-$1.2B,2017-05-04 18:10:00-04:00,CCS,neutral
224934.0,"Century Communities Reports Q1 EPS $0.38 vs $0.33 Est., Sales $228.316M vs $199.63M Est.",2017-05-04 18:10:00-04:00,CCS,neutral
224935.0,"Century Communities Reports Business Combination with UCP, Deal Valued at $336M",2017-04-11 07:30:00-04:00,CCS,positive
224936.0,"UCP and Century Communities to Merge, UCP Shareholders to Receive $5.32 Cash and 0.2309 Shares of Century Stock",2017-04-11 06:21:00-04:00,CCS,positive
224937.0,"Century Communities Reports Q4 EPS $0.71 vs $0.69 Est., Sales $297.289M vs $273.36M Est.",2017-02-14 16:44:00-05:00,CCS,neutral
224938.0,"Wedbush Initiates Coverage on Century Communities at Outperform, Announces $20.00 PT",2016-09-20 02:30:00-04:00,CCS,neutral
224939.0,"Citigroup Initiates Coverage on Century Communities at Buy, Announces $23.00 PT",2016-09-01 06:06:00-04:00,CCS,neutral
224940.0,"JP Morgan Downgrades Century Communities to Neutral, Lowers PT to $19.00",2015-02-23 05:56:00-05:00,CCS,positive
224941.0,Century Communities Reports Q2 EPS of $0.30 vs $0.17 Est; Revenue of $77.30M vs $82.97M Est,2014-08-07 16:33:00-04:00,CCS,neutral
224942.0,UPDATE: Sterne Agee Raises United Technologies' PT,2012-03-12 07:42:00-04:00,CCS,positive
224943.0,"Moving Away From The Materials Sector, Toward A Growth/Momentum Style",2011-11-16 02:41:00-05:00,CCS,neutral
224944.0,AFC Energy signs fire prevention deal for alkaline fuel cells,2011-05-10 04:46:00-04:00,CCS,negative
224945.0,"Shell Profit Rises, But Misses View - Analyst Blog",2011-02-03 09:01:00-05:00,CCS,negative
224946.0,"Shell Profit Rises, But Misses View - Analyst Blog",2011-02-03 08:31:00-05:00,CCS,negative
224947.0,Infineon's Solid Fourth Quarter - Analyst Blog,2010-11-19 13:30:00-05:00,CCS,positive
224948.0,Infineon's Solid Fourth Quarter - Analyst Blog,2010-11-19 07:48:00-05:00,CCS,positive
224949.0,Shell Continues to Outperform - Analyst Blog,2010-10-28 08:33:00-04:00,CCS,neutral
224950.0,Wilmington Trust Skyrocketing On Buyout Talk (WL),2010-10-22 14:38:00-04:00,CCS,positive
224951.0,BP Q3 Profit Will Lag Rivals...Duh,2010-10-22 05:18:00-04:00,CCS,positive
224952.0,10-18-10 Daily Small Cap Market News and Stock Highlights from SmallCapVoice.com,2010-10-18 12:04:00-04:00,CCS,neutral
224953.0,4 Stocks That Benefit from the 60 Mile Traffic Jam in China. ,2010-08-27 14:53:00-04:00,CCS,positive
224954.0,"Shell Boosted by Volumes, Cost Cuts - Analyst Blog",2010-07-29 08:54:00-04:00,CCS,positive
224955.0,Jefferies Reiterates Buy Rating on Air Products (APD),2010-06-24 12:34:00-04:00,CCS,neutral
224956.0,Infineon Exceeds Estimates - Analyst Blog,2010-06-08 09:10:00-04:00,CCS,neutral
224957.0,Shell Profit Jumps - Analyst Blog,2010-04-28 08:45:00-04:00,CCS,positive
224958.0,BP Invests in Alternative Energy  - Analyst Blog,2010-04-14 10:30:00-04:00,CCS,positive
224959.0,"Shell Disappoints, Freezes Dividend - Analyst Blog",2010-02-04 08:51:00-05:00,CCS,negative
224960.0,"January 30, 2010: Dividend Hungry?  A Buffet Of Higher Yields",2010-01-29 16:12:00-05:00,CCS,neutral
224961.0,Joy Global Inc. (JOYG) Announces Q4 and Fiscal 2009 Year-End Operating Result,2009-12-16 08:06:00-05:00,CCS,positive
224962.0,"Property Rights Issues Could Stymie Geologic Carbon Sequestration, an Industrial Info News Alert",2009-08-17 07:01:00-04:00,CCS,positive
224963.0,"Deans Knight Income Corporation Releases Interim Financial Statements and Management Report of Fund Performance for the Period Ended June 30, 2009",2009-08-14 15:19:00-04:00,CCS,neutral
224964.0,"Pure Energy Services Ltd. Announces Results for the Second Quarter Ended June 30, 2009",2009-08-12 19:42:00-04:00,CCS,positive
224965.0,OPINION: Integrated CO2 Network-Alberta CCS Development Council Got it Right. By Eric Beynon,2009-08-12 12:50:00-04:00,CCS,neutral
224966.0,CustomerCentric Selling(R) Helps Decision Dynamics Technology Produce Record Revenue Through Facilitating Greater Value for Customers,2009-08-10 09:18:00-04:00,CCS,positive
