Unnamed: 0,title,date,stock,sentiment
244522.0,88 Biggest Movers From Yesterday,2020-03-26 04:07:00-04:00,CIB,neutral
244523.0,Stocks That Hit 52-Week Lows On Monday,2020-03-23 10:34:00-04:00,CIB,negative
244524.0,"Benzinga's Top Upgrades, Downgrades For March 13, 2020",2020-03-13 10:20:00-04:00,CIB,positive
244525.0,Credit Suisse Downgrades BanColombia to Underperform,2020-03-13 06:13:00-04:00,CIB,positive
244526.0,Stocks That Hit 52-Week Lows On Thursday,2020-03-12 12:10:00-04:00,CIB,negative
244527.0,Stocks That Hit 52-Week Lows On Friday,2020-03-06 11:22:00-05:00,CIB,negative
244528.0,"Benzinga's Top Upgrades, Downgrades For February 26, 2020",2020-02-26 10:02:00-05:00,CIB,positive
244529.0,HSBC Upgrades BanColombia to Buy,2020-02-26 06:12:00-05:00,CIB,neutral
244530.0,"JP Morgan Maintains Overweight on BanColombia, Lowers Price Target to $55",2020-02-24 08:12:00-05:00,CIB,negative
244531.0,Some Market Stats In 5 Minutes,2020-02-21 14:30:00-05:00,CIB,neutral
244532.0,Some Market Stats In 5 Minutes,2020-02-21 10:10:00-05:00,CIB,neutral
244533.0,"Shares of several banks and companies in the broader financial sector are trading higher with the overall market after the U.S. Trade Representative reported that some tariffs will be delayed to Dec 15 on some products including cell phones, monitors, and laptops.",2019-08-13 10:26:00-04:00,CIB,positive
244534.0,Shares of several financial companies are trading higher with the overall market on seemingly no company-specific news.,2019-08-08 14:22:00-04:00,CIB,neutral
244535.0,BanColombia shares are trading higher after the company reported Q2 results. Multiple firms then upgraded the stock after the company reported earnings.,2019-08-06 10:02:00-04:00,CIB,positive
244536.0,"Benzinga's Top Upgrades, Downgrades For August 6, 2019",2019-08-06 09:49:00-04:00,CIB,positive
244537.0,"JP Morgan Upgrades BanColombia to Overweight, Raises Price Target to $55",2019-08-06 06:25:00-04:00,CIB,neutral
244538.0,"Credit Suisse Upgrades BanColombia to Neutral, Announces $53 Price Target",2019-08-06 06:23:00-04:00,CIB,positive
244539.0,Shares of several companies in the financial sector are trading higher amid renewed global economic optimism following comments from China's Commerce Ministry indicating the country is open to dialogue to resolve trade tenisons. Mexico trade concerns also eased after GOP lawmakers reportedly implied they would work to prevent Mexico tariffs and Mexican officials said it could find common ground with the US.,2019-06-04 09:49:00-04:00,CIB,positive
244540.0,"Earnings Scheduled For May 9, 2019",2019-05-09 04:07:00-04:00,CIB,neutral
244541.0,Credit Suisse Downgrades BanColombia S.A. Common Stock to Underperform,2019-04-30 06:47:00-04:00,CIB,positive
244542.0,Citigroup Upgrades BanColombia to Buy,2019-04-17 09:43:00-04:00,CIB,neutral
244543.0,Shares of several South American companies are trading lower in a continued momentum from Thursday news ex-Brazilian President Michel Temer was arrested on corruption charges.,2019-03-22 08:49:00-04:00,CIB,negative
244544.0,Santander Downgrades BanColombia to Underperform,2018-11-19 10:14:00-05:00,CIB,neutral
244545.0,"Stocks Which Set New 52-Week Low Friday, October 26th",2018-10-29 09:56:00-04:00,CIB,negative
244546.0,Standpoint Research Upgrades BanColombia to Accumulate,2018-03-07 10:58:00-05:00,CIB,neutral
244547.0,"Seeing Strength In South American Financials In Monday's Session; Itau Corpbanca +5.02%, Banco de Chile +2.97%, Banco Santander-Chile +3.81%, BaColombia +1.38%",2017-12-11 14:40:00-05:00,CIB,positive
244548.0,"Earnings Scheduled For August 17, 2017",2017-08-17 04:46:00-04:00,CIB,neutral
244549.0,HSBC Downgrades BanColombia S.A. Common Stock to Hold,2017-08-15 09:55:00-04:00,CIB,neutral
244550.0,"Earnings Scheduled For May 23, 2017",2017-05-23 05:33:00-04:00,CIB,neutral
244551.0,Standpoint Research Downgrades BanColombia S.A. Common Stock to Hold,2017-05-22 12:32:00-04:00,CIB,neutral
244552.0,"Benzinga's Top Upgrades, Downgrades For December 13, 2016",2016-12-13 09:11:00-05:00,CIB,positive
244553.0,Morgan Stanley Upgrades BanColombia S.A. Common Stock to Overweight,2016-12-13 06:21:00-05:00,CIB,negative
244554.0,"Earnings Scheduled For November 21, 2016",2016-11-21 04:07:00-05:00,CIB,neutral
244555.0,"With Bancolombia Shares Fairly Valued, Credit Suisse Steps To The Sidelines",2016-10-06 16:54:00-04:00,CIB,positive
244556.0,8 Biggest Price Target Changes For Thursday,2016-10-06 09:46:00-04:00,CIB,neutral
244557.0,"Credit Suisse Downgrades BanColombia to Neutral, Raises PT to $40.00",2016-10-06 06:40:00-04:00,CIB,positive
244558.0,Benzinga's Top Upgrades,2016-08-22 09:50:00-04:00,CIB,positive
244559.0,Deutsche Bank Upgrades BanColombia to Buy,2016-08-22 06:16:00-04:00,CIB,neutral
244560.0,"Earnings Scheduled For August 18, 2016",2016-08-18 04:21:00-04:00,CIB,neutral
244561.0,"Earnings Scheduled For May 23, 2016",2016-05-23 04:45:00-04:00,CIB,neutral
244562.0,"Earnings Scheduled For May 19, 2016",2016-05-19 04:12:00-04:00,CIB,neutral
244563.0,Benzinga's Top Downgrades,2016-03-29 08:49:00-04:00,CIB,positive
244564.0,Goldman Sachs Downgrades BanColombia to Neutral,2016-03-29 06:40:00-04:00,CIB,neutral
244565.0,"Worst Performing Industries For March 24, 2016",2016-03-24 12:02:00-04:00,CIB,negative
244566.0,"Barclays Maintains Underweight on BanColombia, Raises PT to $30.50",2016-03-24 03:35:00-04:00,CIB,neutral
244567.0,UBS Downgrades BanColombia to Sell,2016-03-16 03:54:00-04:00,CIB,neutral
244568.0,Bank of America Downgrades BanColombia to Neutral,2016-03-14 08:12:00-04:00,CIB,neutral
244569.0,"Credit Suisse Upgrades BanColombia to Outperform, Lowers PT to $38.00",2016-03-07 05:28:00-05:00,CIB,positive
244570.0,HSBC Upgrades BanColombia to Buy,2015-12-16 08:38:00-05:00,CIB,neutral
244571.0,"Barclays Downgrades BanColombia to Underweight, Lowers PT to $29.50",2015-12-02 11:10:00-05:00,CIB,negative
244572.0,Stocks Hitting 52-Week Lows,2015-11-30 10:21:00-05:00,CIB,negative
244573.0,"Latin American ADRs Getting Slaughtered, Brazilian Real And Crude Continue To Tumble",2015-09-22 16:28:00-04:00,CIB,negative
244574.0,One Foreign Banking Stock To Play On The Brazilian Rebound,2015-08-15 18:00:00-04:00,CIB,positive
244575.0,"UPDATE: Standpoint's Ronnie Moas Notes Bancolombia Shares Down 45% Over Last Year, Cites 'over-reaction to the oil price collapse, lower Colombian peso, problems in Brazil...'",2015-08-14 12:35:00-04:00,CIB,negative
244576.0,Standpoint Research Upgrades BanColombia to Buy,2015-08-14 12:20:00-04:00,CIB,neutral
244577.0,Benzinga's Top Upgrades,2015-07-23 09:34:00-04:00,CIB,positive
244578.0,"JP Morgan Upgrades BanColombia to Overweight, Lowers PT to $51.00",2015-07-23 06:15:00-04:00,CIB,negative
244579.0,"Earnings Scheduled For May 13, 2015",2015-05-13 04:14:00-04:00,CIB,neutral
244580.0,"Shares of Bancolombia Spike Higher Following Comment from Downtown Josh Brown on CNBC, Says Stock is 'One of Most Oversold' Right Now",2015-03-12 12:27:00-04:00,CIB,positive
244581.0,Stocks Hitting 52-Week Lows,2015-02-24 10:15:00-05:00,CIB,negative
244582.0,"Earnings Scheduled For February 17, 2015",2015-02-17 04:46:00-05:00,CIB,neutral
244583.0,Credit Suisse Analyst Sees Exceptions Among Latin American Banks,2015-01-21 11:56:00-05:00,CIB,positive
244584.0,"Earnings Scheduled For November 10, 2014",2014-11-10 05:36:00-05:00,CIB,neutral
244585.0,Top 4 Large-Cap Stocks In The Foreign Regional Banks Industry With The Highest ROA,2014-05-07 04:57:00-04:00,CIB,positive
244586.0,UPDATE: Credit Suisse Upgrades Bancolombia SA as Valuation Seems Attractive,2014-02-28 07:59:00-05:00,CIB,positive
244587.0,Benzinga's Top Upgrades,2014-02-28 07:57:00-05:00,CIB,positive
244588.0,"Credit Suisse Upgrades BanColombia S.A. to Outperform, Lowers PT to $61.00",2014-02-28 06:48:00-05:00,CIB,positive
244589.0,BTG Upgrades BanColombia S.A. to Buy,2014-02-04 08:42:00-05:00,CIB,neutral
244590.0,Benzinga's Volume Movers,2014-01-06 10:35:00-05:00,CIB,neutral
244591.0,Stocks Hitting 52-Week Lows,2013-12-24 10:55:00-05:00,CIB,negative
244592.0,Top 4 Large-Cap Stocks In The Foreign Regional Banks Industry With The Highest EPS,2013-04-30 04:21:00-04:00,CIB,positive
244593.0,"Earnings Scheduled For March 4, 2013",2013-03-04 04:11:00-05:00,CIB,neutral
244594.0,JP Morgan Upgrades BanColombia S.A. to Neutral,2012-12-21 10:22:00-05:00,CIB,positive
244595.0,Benzinga's Top Upgrades,2012-12-21 08:35:00-05:00,CIB,positive
244596.0,2 Sleeping Giants to Watch (or Own) in 2013,2012-12-16 13:37:00-05:00,CIB,neutral
244597.0,Selling in Colombia ETF Overdone After Interbolsa Decline,2012-11-02 15:46:00-04:00,CIB,neutral
244598.0,Top 4 Large-Cap Stocks In The Foreign Regional Banks Industry With The Highest Dividend Yield,2012-11-01 03:50:00-04:00,CIB,positive
244599.0,"Barclays Maintains Bancolombia at Underweight, Raises PT from $57 to $63",2012-08-07 14:06:00-04:00,CIB,neutral
244600.0,Top 4 NYSE Stocks In The Foreign Regional Banks Industry With The Highest ROE,2012-08-07 04:45:00-04:00,CIB,positive
244601.0,"Colombia: Compelling Country, Compelling Valuation (AND, EC, GXG)",2012-06-20 15:15:00-04:00,CIB,positive
244602.0,Top 4 NYSE Stocks In The Foreign Regional Banks Industry With The Highest Profit Margin,2012-06-05 03:27:00-04:00,CIB,positive
244603.0,"Nine Emerging Markets ETFs on a Roll (BRAF, TAO, IGEM)",2012-03-14 06:59:00-04:00,CIB,neutral
244604.0,Bancolombia S.A. Prices Offering of 4.45M American Depository Shares at $60 ,2012-02-01 08:47:00-05:00,CIB,positive
244605.0,Raymond James Upgrades Bancolombia to Outperform,2012-01-31 08:02:00-05:00,CIB,neutral
244606.0,Benzinga's Top Upgrades,2012-01-31 07:52:00-05:00,CIB,positive
244607.0,"Financial Breakfast: Morning News Summary for January 31, 2012",2012-01-31 07:24:00-05:00,CIB,neutral
244608.0,Raymond James Upgrades Bancolombia to Outperform,2012-01-31 06:59:00-05:00,CIB,neutral
244609.0,"Fast Money Picks For January 27th (CIB, PACD, CNX, SPY)",2012-01-26 20:26:00-05:00,CIB,neutral
244610.0,Five Latin America Stocks For 2012,2011-12-13 15:43:00-05:00,CIB,neutral
244611.0,Another Reason To Avoid Financials,2011-09-07 08:17:00-04:00,CIB,negative
244612.0,"Mad Money Lightning Round OT: Cramer Is A Seller Of CEL (CIB, CEL, POT, TNH)",2011-06-15 19:57:00-04:00,CIB,negative
244613.0,Five ETFs Littered With Takeover Targets,2011-06-07 14:33:00-04:00,CIB,neutral
244614.0,Goldman Sachs Raising Price Target On Bancolombia S.A. ,2011-05-24 08:21:00-04:00,CIB,neutral
244615.0,"Updates- GrouponLive, Softbank, Volkswagen, Wal-Mart, Toshiba, AAPL, GOOG, LYV, WMT, DYN, MCD, UAL",2011-05-09 08:54:00-04:00,CIB,neutral
244616.0,"Top 4 Large-Cap Stocks In The Foreign Regional Banks Industry With The Lowest PEG Ratio (BSBR, SHG, IBN, CIB)",2011-04-26 00:43:00-04:00,CIB,negative
244617.0,Standpoint Research Downgrades Bancolombia to Hold (CIB),2011-04-08 11:45:00-04:00,CIB,neutral
244618.0,"Standpoint Research Upgrades (PRSP, VLTR, CBRL, CIB, SBS, TEO)",2011-03-15 13:38:00-04:00,CIB,neutral
244619.0,A Look Ahead: Next Week's ETFs To Watch,2011-03-04 16:12:00-05:00,CIB,neutral
244620.0,Bancolombia S.A. - Value,2011-02-01 02:01:00-05:00,CIB,positive
244621.0,Bancolombia S.A. - Value,2011-02-01 00:00:00-05:00,CIB,positive
244622.0,Zacks #1 Rank Additions for Thursday - Tale of the Tape,2011-01-27 08:31:00-05:00,CIB,neutral
244623.0,Zacks #1 Rank Additions for Thursday - Tale of the Tape,2011-01-27 08:14:00-05:00,CIB,neutral
244624.0,"Goldman Sachs Reiterates Positive View on Brazil Banks (BSBR, SAN, CIB)",2011-01-21 11:52:00-05:00,CIB,positive
244625.0,"ETF Argument, This Nerd Weighs In",2010-12-14 08:25:00-05:00,CIB,negative
244626.0,Bancolombia Appoints New President ,2010-11-26 13:17:00-05:00,CIB,neutral
244627.0,"Growth & Income Stock Picks-Nov.18, 2010 - Zacks Rank Buys",2010-11-18 11:42:00-05:00,CIB,positive
244628.0,"Growth & Income Stock Picks-Nov.18, 2010 - Zacks Rank Buys",2010-11-17 19:00:00-05:00,CIB,positive
244629.0,Non-U.S. Banks Stock Update - Nov. 2010 - Zacks Analyst Interviews,2010-11-16 16:33:00-05:00,CIB,neutral
244630.0,Non-U.S. Banks Stock Update - Nov. 2010 - Industry Outlook,2010-11-16 16:33:00-05:00,CIB,neutral
244631.0,Non-U.S. Banks Stock Update - Nov. 2010 - Industry Outlook,2010-11-16 16:33:00-05:00,CIB,neutral
244632.0,"Zacks Releases Four Powerful ''Buy'' Stocks: Osiris Therapeutics, Bancolombia, JAKKS Pacific and ReneSola Limited   - Press Releases",2010-11-11 10:33:00-05:00,CIB,positive
244633.0,Bancolombia S.A. - Growth & Income,2010-11-11 02:00:00-05:00,CIB,positive
244634.0,In Play: Ecopetrol Could Jolt Colombia ETF,2010-10-27 08:54:00-04:00,CIB,positive
244635.0,"Not The Final Frontier, But Worth A Look Anyway",2010-08-08 22:59:00-04:00,CIB,positive
244636.0,Latin American Banks See Improving Trends,2010-07-22 08:09:00-04:00,CIB,positive
244637.0,Presidential Election Makes Colombia ETF One To Watch,2010-05-11 06:45:00-04:00,CIB,neutral
244638.0,Taking A Look At The Colombia ETF (GXG),2009-11-17 14:33:00-05:00,CIB,neutral
244639.0,"CIB Marine Bancshares, Inc. Extends Time for Holders of Trust Preferred Securities to Vote on Reorganization Plan",2009-08-18 16:30:00-04:00,CIB,positive
244640.0,BNP Paribas Corporate and Investment Banking Creates Insurance Solutions Group for the Americas,2009-08-10 15:48:00-04:00,CIB,positive
244641.0,BNP Paribas Corporate and Investment Banking Creates Insurance Solutions Group for the Americas,2009-08-10 15:48:00-04:00,CIB,positive
244642.0,"CIB Marine Bancshares, Inc. Announces Second Quarter Results",2009-08-07 16:44:00-04:00,CIB,neutral
