Unnamed: 0,title,date,stock,sentiment
310084.0,"Earnings Scheduled For July 16, 2013",2013-07-16 05:06:00-04:00,CSX,neutral
310085.0,Weekly Preview: Earnings Back With A Bang,2013-07-12 16:47:00-04:00,CSX,neutral
310086.0,"Buckingham Research Initiates Coverage on CSX Corporation at Buy, Announces $27.00 PT",2013-07-11 09:08:00-04:00,CSX,neutral
310087.0,"CSX Sees Year EPS Growth 10-15 Percent Off Its 2013 Base Forward, Targets High 60's Operating Ratio by 2015",2013-06-12 14:02:00-04:00,CSX,positive
310088.0,Top 4 Large-Cap Stocks In The Railroads Industry With The Highest Dividend Yield,2013-06-07 06:50:00-04:00,CSX,positive
310089.0,"UPDATE: CSX Says At Least One Car Contained Hazardous Material, Says Train Crew Was Not Seriously Injured",2013-05-28 17:14:00-04:00,CSX,positive
310090.0,"CSX Confirms Derailment of Freight Train in Rosedale, Maryland, No Toxic Inhalants Were Burned at the Wreck",2013-05-28 17:13:00-04:00,CSX,negative
310091.0,Shares of CSX Tumbling as Reports of Train Derailment Outside Baltimore Hitting the Wires,2013-05-28 14:44:00-04:00,CSX,positive
310092.0,UPDATE: Jefferies Lowers PT on CSX Corporation Following Market Overreaction,2013-04-18 11:07:00-04:00,CSX,negative
310093.0,"Jefferies Maintains Buy on CSX Corporation, Lowers PT to $29.00",2013-04-18 07:19:00-04:00,CSX,negative
310094.0,Mark Ward: CSX Moving Forward and Running Efficiently ,2013-04-17 08:50:00-04:00,CSX,positive
310095.0,"Benzinga Market Primer: Wednesday, April 17",2013-04-17 06:45:00-04:00,CSX,neutral
310096.0,CSX Reports Better Than Expected Q1 Earnings and Revenue ,2013-04-16 17:21:00-04:00,CSX,positive
310097.0,CSX Raises Qtr. Dividend from $0.14 to $0.15/Share,2013-04-16 16:03:00-04:00,CSX,neutral
310098.0,CSX Corporation Reports Q1 EPS of $0.45 vs $0.40 Est,2013-04-16 16:02:00-04:00,CSX,neutral
310099.0,"Benzinga Market Primer: Tuesday, April 16",2013-04-16 06:31:00-04:00,CSX,neutral
310100.0,US Stock Futures Signal Higher Start On Wall Street,2013-04-16 06:18:00-04:00,CSX,neutral
310101.0,"Earnings Scheduled For April 16, 2013",2013-04-16 04:13:00-04:00,CSX,neutral
310102.0,Likely Winners and Losers in Obama's 2014 Budget,2013-04-11 10:21:00-04:00,CSX,negative
310103.0,UPDATE: Jefferies Raises PT on CSX Corporation on 1Q Earnings Preview,2013-04-10 12:53:00-04:00,CSX,neutral
310104.0,"Jefferies Maintains Buy on CSX Corporation, Raises PT to $30.00",2013-04-10 08:03:00-04:00,CSX,neutral
310105.0,"Deutsche Bank Maintains Hold on CSX Corporation, Raises PT to $25.00",2013-04-10 07:31:00-04:00,CSX,neutral
310106.0,"Citigroup Maintains Buy on CSX Corporation, Raises PT to $27.00",2013-04-05 06:26:00-04:00,CSX,neutral
310107.0,"JP Morgan Maintains Neutral on CSX Corporation, Raises PT to $26.00",2013-04-03 08:40:00-04:00,CSX,positive
310108.0,"Rail Stocks Continue Multi-Year Rally, What Next?",2013-03-28 12:50:00-04:00,CSX,neutral
310109.0,Sterne Agee Reiterates Buy Rating on CSX Corporation on Possible Coal Weakness Bottoming,2013-03-18 13:39:00-04:00,CSX,negative
310110.0,"From CSX Business Update Call: Expecting $130M in Productivity Gains Over 2014-2015, to Review Buyback, Dividend Policy",2013-03-14 10:44:00-04:00,CSX,positive
310112.0,Barron's Recap for March 9: Wall Street's Favorite Guru,2013-03-09 14:55:00-05:00,CSX,positive
310113.0,"BMO Capital Markets Reiterates Outperform Rating, $27 PT on CSX Corporation on Positive Outlook",2013-03-06 13:16:00-05:00,CSX,positive
310114.0,Golden Crosses Over The Past Trading Week (50 SMA Crossed Above 200 SMA) ,2013-03-05 13:06:00-05:00,CSX,neutral
310115.0,CSX Attempting To Break Out Over $23 Resistance ,2013-03-01 12:15:00-05:00,CSX,neutral
310116.0,Transports Head South,2013-02-26 16:02:00-05:00,CSX,neutral
310117.0,CSX Files Automatic Mixed Securities Shelf,2013-02-15 16:18:00-05:00,CSX,positive
310118.0,Barron's Recap (2/9/12): Best Fund Families,2013-02-09 15:05:00-05:00,CSX,positive
310119.0,"UPDATE: Jefferies Reiterates Buy Rating, Raises PT on CSX Corporation",2013-01-28 09:05:00-05:00,CSX,neutral
310120.0,"Jefferies Maintains Buy on CSX Corporation, Raises PT to $29.00",2013-01-28 08:46:00-05:00,CSX,neutral
310121.0,"RBC Capital Upgrades CSX Corporation to Outperform, Raises PT to $27.00",2013-01-24 08:27:00-05:00,CSX,neutral
310122.0,"BMO Capital Maintains Outperform on CSX Corporation, Raises PT to $27.00",2013-01-24 07:41:00-05:00,CSX,neutral
310123.0,"Jefferies Maintains Buy on CSX Corporation, Lowers PT to $25.00",2013-01-24 07:24:00-05:00,CSX,negative
310124.0,"UPDATE: BMO Capital Markets Reiterates Outperform Rating, Raises PT on CSX Corporation",2013-01-23 13:51:00-05:00,CSX,neutral
310125.0,"BMO Capital Maintains Outperform on CSX Corporation, Raises PT to $27.00",2013-01-23 12:16:00-05:00,CSX,neutral
310126.0,UPDATE: CSX Posts Upbeat Q4 Profit,2013-01-23 02:12:00-05:00,CSX,positive
310127.0,CSX Corporation Reports Q4 EPS of $0.43 vs $0.40 Est; Revenue of $2.95B vs $2.85B Est,2013-01-22 16:02:00-05:00,CSX,neutral
310128.0,Rail Stocks Earnings In Focus,2013-01-22 12:54:00-05:00,CSX,neutral
310129.0,"Benzinga Market Primer: Tuesday, January 22",2013-01-22 06:30:00-05:00,CSX,neutral
310130.0,"US Stock Futures Flat Ahead Of Economic Data, Earnings",2013-01-22 05:53:00-05:00,CSX,neutral
310131.0,"Earnings Scheduled For January 22, 2013",2013-01-22 01:25:00-05:00,CSX,neutral
310132.0,UPDATE: Credit Suisse Downgrades CSX Corporation to Neutral  on Downside Risk  ,2013-01-18 08:12:00-05:00,CSX,negative
310133.0,"Credit Suisse Downgrades CSX Corporation to Neutral, Lowers PT to $22.00",2013-01-18 06:41:00-05:00,CSX,positive
310134.0,"Deutsche Bank Maintains Hold on CSX Corporation, Raises PT to $23.00",2013-01-14 08:22:00-05:00,CSX,neutral
310135.0,Raymond James Downgrades CSX Corporation to Market Perform,2013-01-10 09:16:00-05:00,CSX,neutral
310136.0,UPDATE: Goldman Sachs Downgrades CSX Corporation to Neutral on Lack of Relative Upside  ,2013-01-10 08:18:00-05:00,CSX,negative
310137.0,Benzinga's Top Downgrades,2013-01-10 07:33:00-05:00,CSX,positive
310138.0,Goldman Sachs Downgrades CSX Corporation to Neutral,2013-01-10 06:23:00-05:00,CSX,neutral
310139.0,Top 4 Large-Cap Stocks In The Railroads Industry With The Highest ROA,2013-01-09 04:00:00-05:00,CSX,positive
310140.0,"Barclays Maintains Overweight on CSX Corporation, Raises PT to $27.00",2013-01-07 13:42:00-05:00,CSX,negative
310141.0,"Jefferies Maintains Buy on CSX Corporation, Lowers PT to $26.00",2013-01-03 08:20:00-05:00,CSX,negative
310142.0,"Short Interest in Railroad Stocks on the Rise (CNI, CP, KSU)",2012-12-29 14:39:00-05:00,CSX,positive
310143.0,"UBS Maintains Neutral on CSX Corporation, Lowers PT to $21.75",2012-12-19 10:25:00-05:00,CSX,negative
310144.0,"JP Morgan Maintains Neutral on CSX Corporation, Lowers PT to $24.00",2012-12-13 08:51:00-05:00,CSX,positive
310145.0,Top 4 Large-Cap Stocks In The Railroads Industry With The Highest Operating Margin,2012-12-10 01:58:00-05:00,CSX,positive
310146.0,"Cuomo Announces Deal Between CSX, Amtrak for Hudson Rail Line Lease",2012-12-04 15:44:00-05:00,CSX,neutral
310147.0,CSX Ticks Lower Following Avondale Downgrade,2012-11-20 12:44:00-05:00,CSX,negative
310148.0,Top 4 Large-Cap Stocks In The Railroads Industry With The Highest Cash,2012-11-14 02:34:00-05:00,CSX,positive
310149.0,"Barclays Maintains CSX at Overweight, Lowers PT from $26 to $25",2012-10-18 12:46:00-04:00,CSX,negative
310150.0,UPDATE: Deutsche Bank Downgrades CSX to Hold on Coal Headwinds  ,2012-10-18 08:24:00-04:00,CSX,neutral
310151.0,"Jefferies & Company Maintains CSX at Buy, Lowers PT from $28 to $27",2012-10-18 07:35:00-04:00,CSX,negative
310152.0,"Deutsche bank Downgrades CSX from Buy to Hold, Announces PT of $20",2012-10-18 05:53:00-04:00,CSX,neutral
310153.0,CSX Conference Call Ends,2012-10-17 09:52:00-04:00,CSX,neutral
310154.0,UPDATE: CSX Says Labor Inflation Moderate in Q4,2012-10-17 08:57:00-04:00,CSX,neutral
310155.0,"UPDATE: CSX Says US Will Grow Moderately in 2012, Company Well Positioned for When Good Growth Resumes",2012-10-17 08:37:00-04:00,CSX,positive
310156.0,UPDATE: CSX Says It Has a Neutral Outlook on Q4,2012-10-17 08:32:00-04:00,CSX,neutral
310157.0,UPDATE: CSX Sees Merchandise Revenue Up 3% on Flat Volume; Intermodal Revenue Up 10% on 8% Higher Volume,2012-10-17 08:30:00-04:00,CSX,neutral
310158.0,UPDATE: CSX Says Strong Auto Demand is Driving Industrial Shipments,2012-10-17 08:29:00-04:00,CSX,positive
310159.0,CSX Says Coal Volumes Up 20% in Q3 Compared to 2011; Lower Fuel Recovery Reduced Q3 Revenues by $24M,2012-10-17 08:23:00-04:00,CSX,negative
310160.0,Benzinga's Top Pre-Market Gainers,2012-10-17 08:15:00-04:00,CSX,positive
310161.0,"CSX's Ward Sees US Economy Moderating; Sees Growth in Inter-modal, Automotive Markets -CNBC",2012-10-17 07:41:00-04:00,CSX,positive
310162.0,"Benzinga Market Primer, Wednesday October 17",2012-10-17 06:09:00-04:00,CSX,neutral
310163.0,CSX Reports Q3 EPS $0.44 vs $0.43 Est; Revenues $2.89B vs $2.94B Est,2012-10-16 16:07:00-04:00,CSX,neutral
310164.0,"Benzinga Market Primer, Tuesday October 16",2012-10-16 06:12:00-04:00,CSX,neutral
310165.0,"Earnings Scheduled For October 16, 2012 ",2012-10-16 02:26:00-04:00,CSX,neutral
310166.0,"Barclays Maintains CSX at Overweight, Lowers PT from $27 to $26",2012-10-15 12:10:00-04:00,CSX,negative
310167.0,Earnings Expectations for the Week of October 15,2012-10-15 06:54:00-04:00,CSX,neutral
310168.0,US Railroads: Great Plays on Shale,2012-10-03 12:19:00-04:00,CSX,positive
310169.0,Bernstein Upgrades CSX from Underperform to Market Perform,2012-10-03 09:00:00-04:00,CSX,neutral
310170.0,Norfolk Southern Earnings Warning Weighs on Rail Stocks,2012-09-20 13:51:00-04:00,CSX,negative
310171.0,"BMO Capital Markets Maintains CSX at Outperform, Lowers PT from $27 to $26",2012-09-20 06:49:00-04:00,CSX,negative
310172.0,"Deutsche Bank Maintains CSX at Buy, Lowers PT from $26 to $25",2012-09-20 06:23:00-04:00,CSX,negative
310173.0,"Benzinga Market Primer, Wednesday September 19",2012-09-19 08:17:00-04:00,CSX,neutral
310174.0,5 Railroads Stocks With The Highest ROA,2012-09-12 07:24:00-04:00,CSX,neutral
310175.0,"Goldman Sachs Maintains CSX at Buy, Lowers PT from $25 to $24",2012-09-06 06:38:00-04:00,CSX,negative
310176.0,CSX CEO Ward: 'We Expect the Drought to Severely Impact Our Agricultural Business',2012-07-26 18:26:00-04:00,CSX,negative
310177.0,CSX CEO Ward: 'I Think Bakken Could Produce Landlocked Oil and We Could Move it East',2012-07-26 18:25:00-04:00,CSX,neutral
310178.0,CSX CEO Ward: 'We're Providing High Levels of Service to Our Customers',2012-07-26 18:24:00-04:00,CSX,neutral
310179.0,Jim Cramer Interviews CEO Michael Jon Ward of CSX on Mad Money,2012-07-26 18:23:00-04:00,CSX,negative
310180.0,Top 4 Large-Cap Stocks In The Railroads Industry With The Highest Operating Margin,2012-07-25 04:45:00-04:00,CSX,positive
310181.0,UPDATE: Deutsche Bank Lowers PT to $26 on CSX Corporation on Moderating Core Pricing  ,2012-07-19 10:26:00-04:00,CSX,negative
310182.0,"Deutsche Bank Maintains CSX at Buy, Lowers PT from $27 to $26",2012-07-19 06:12:00-04:00,CSX,negative
310183.0,"Jefferies Reiterates Buy Rating, $28 PT on CSX Corporation",2012-07-18 12:20:00-04:00,CSX,neutral
310184.0,"UPDATE: CSX Says Intermodal Growth Driven By Highway-to-Rail Conversion, Export Coal Volume Grew 41% In 2Q",2012-07-18 08:43:00-04:00,CSX,positive
310185.0,"CSX Says Automotive Market Will Continue To Drive Growth in Conference Call, Fuel Recovery Increased $17 Million in 2Q",2012-07-18 08:37:00-04:00,CSX,positive
310186.0,Stocks Point Lower Ahead Of More Corporate Earnings,2012-07-18 07:19:00-04:00,CSX,negative
310187.0,CSX Reports Q2 EPS $0.49 vs $0.47 Est; Revenues $3.01B vs $3.05B Est,2012-07-17 16:02:00-04:00,CSX,neutral
310188.0,"Benzinga Market Primer, Tuesday July 17",2012-07-17 06:54:00-04:00,CSX,neutral
310189.0,Earnings Scheduled For July 17,2012-07-17 02:39:00-04:00,CSX,neutral
310190.0,Two-year Low for Euro May Spell More US Earnings Trouble,2012-07-12 10:58:00-04:00,CSX,negative
310191.0,"Goldman Sachs Resumes Coverage on CSX at Buy, Announces PT of $25",2012-07-12 07:08:00-04:00,CSX,neutral
310192.0,Bernstein Raises PT on CSX from $18 to $20,2012-07-11 07:26:00-04:00,CSX,neutral
310193.0,Moody's Sees US Railroads Volume To Slow 1-2% In 2013,2012-07-10 14:01:00-04:00,CSX,neutral
310194.0,"CSX Announces Tariff Update, 4.3% Increase For Export Coal",2012-06-08 16:02:00-04:00,CSX,positive
310195.0,"CSX Commenting on CP Strike: Monitoring Work Stoppage, WIll Take Added Actions if Strike Unresolved, Continuing to Accept and Move Any Traffic Billed",2012-05-23 10:17:00-04:00,CSX,positive
310196.0,Pacer International Announces New Agreement with CSX   ,2012-05-08 08:10:00-04:00,CSX,positive
310197.0,"Sterne Agee Maintains CSX at Buy, Raises PT from $26 to $27",2012-04-19 06:48:00-04:00,CSX,neutral
310198.0,CSX: Same-Store Sales Pricing Was in Range of 5-6%,2012-04-18 09:05:00-04:00,CSX,neutral
310199.0,"BMO Capital Markets Reiterates Buy, $27 PT on CSX  ",2012-04-18 06:28:00-04:00,CSX,neutral
310200.0,CSX Reports Q1 EPS $0.43 vs $0.38 Est; Revenues $3B vs $2.93B Est,2012-04-17 16:04:00-04:00,CSX,neutral
310201.0,Earnings Scheduled For April 17,2012-04-17 06:46:00-04:00,CSX,neutral
310202.0,US Stock Futures Up Ahead Of Earnings,2012-04-17 06:44:00-04:00,CSX,neutral
310203.0,US Stock Futures Up Ahead Of Earnings,2012-04-17 06:26:00-04:00,CSX,neutral
310204.0,Earnings Scheduled For April 17,2012-04-17 04:31:00-04:00,CSX,neutral
310205.0,Earnings Scheduled For April 17,2012-04-17 04:23:00-04:00,CSX,neutral
310206.0,"Earnings Expectations for the Week of April 16 (GS, MSFT, MCD)",2012-04-15 10:45:00-04:00,CSX,neutral
310207.0,UPDATE: Jefferies Cuts Target to $28 on CSX,2012-04-02 07:42:00-04:00,CSX,negative
310208.0,"Jefferies & Company Maintains CSX at Buy, Lowers PT from $29 to $28",2012-04-02 07:15:00-04:00,CSX,negative
310209.0,"BMO Capital Markets Reiterates Outperform, $27 PT on CSX",2012-03-30 07:06:00-04:00,CSX,neutral
310210.0,"ETFs For Warren Buffett's Next Takeover (KOL, EWJ, XLF)",2012-03-15 14:17:00-04:00,CSX,neutral
310211.0,"Bank of America Maintains CSX at Buy, Lowers PO from $26 to $25",2012-03-15 10:33:00-04:00,CSX,negative
310212.0,Watch these Rail Stocks for Tell on Market's Direction,2012-03-07 03:26:00-05:00,CSX,neutral
310213.0,Benzinga's Top Pre-Market Losers,2012-02-28 08:13:00-05:00,CSX,negative
310214.0,UPDATE: BMO Capital Markets Lowers PT to $27 on CSX,2012-02-17 06:27:00-05:00,CSX,negative
310215.0,UPDATE: Bank of America Lowers Price Target on CSX to $26,2012-02-06 10:36:00-05:00,CSX,negative
310216.0,Bank of America Lowers PO on CSX to $26,2012-02-06 06:40:00-05:00,CSX,negative
310217.0,"UPDATE: Deutsche Bank Lowers PT to $27 on CSX Corp, Maintains Buy",2012-01-25 08:33:00-05:00,CSX,negative
310218.0,Benzinga's Top Upgrades,2012-01-25 07:38:00-05:00,CSX,positive
310219.0,Dahlman Rose Maintains Buy Rating on CSX,2012-01-25 07:34:00-05:00,CSX,neutral
310220.0,BMO Capital Markets Comments on CSX,2012-01-24 15:39:00-05:00,CSX,neutral
310221.0,JP Morgan Reiterates Overweight on CSX Following Conference Call,2012-01-24 13:30:00-05:00,CSX,neutral
310222.0,Transports Ship Markets To The Downside,2012-01-24 10:11:00-05:00,CSX,negative
310223.0,Deutsche Bank Reports CSX Management Changes,2012-01-24 09:47:00-05:00,CSX,neutral
310224.0,"BMO Capital Markets Maintains Outperform, $28 PT on CSX Corporation",2012-01-24 06:21:00-05:00,CSX,neutral
310225.0,CSX Corp. Misses Earnings and Revenue Estimates; Stock Down 3% ,2012-01-23 16:37:00-05:00,CSX,negative
310226.0,CSX Reports Q4 EPS $0.43 vs $0.44 Est; Revenues $2.95B vs $2.99B Est	 				,2012-01-23 16:03:00-05:00,CSX,neutral
310227.0,CSX Names New Chief Operating Officer and Chief Financial Officer ,2012-01-23 16:03:00-05:00,CSX,neutral
310228.0,CSX Earnings Preview,2012-01-23 13:48:00-05:00,CSX,neutral
310229.0,US Stock Futures Up; Halliburton To Report Earnings,2012-01-23 06:31:00-05:00,CSX,neutral
310230.0,Earnings Scheduled For January 23,2012-01-23 04:36:00-05:00,CSX,neutral
310231.0,Earnings Expectations for the Week of January 23,2012-01-22 14:13:00-05:00,CSX,neutral
310232.0,Transports Fail To Participate In Rally,2012-01-17 10:57:00-05:00,CSX,negative
310233.0,Transports Go South Side Early,2012-01-13 10:21:00-05:00,CSX,neutral
310234.0,Top 4 Large-Cap Stocks In The Railroads Industry With The Highest Dividend Yield,2011-12-08 04:25:00-05:00,CSX,positive
310235.0,Locomotive Engineers' Union Continues Negotiation with Railways,2011-11-23 16:23:00-05:00,CSX,neutral
310236.0,Transport Stocks Fail To Deliver,2011-11-21 10:18:00-05:00,CSX,negative
310237.0,"End-of-Day Market Summary for November 14, 2011",2011-11-14 16:16:00-05:00,CSX,neutral
310238.0,"Sterne Agee Upgrades CSX to Buy, $26 PT",2011-11-14 08:19:00-05:00,CSX,neutral
310239.0,Mad Money Lightning Round: Cramer Likes Visa,2011-11-14 04:21:00-05:00,CSX,negative
310240.0,Transports Turn Negative,2011-11-08 11:24:00-05:00,CSX,negative
310241.0,J.P. Morgan Maintains Overweight Rating and $29 PT on CSX ,2011-11-07 07:34:00-05:00,CSX,negative
310242.0,"CSX, State of Florida Close on SunRail Transaction ",2011-11-03 15:58:00-04:00,CSX,neutral
310243.0,Why Bill Ackman is Going To Be a Train Conductor For Halloween ,2011-10-31 10:12:00-04:00,CSX,neutral
310244.0,Norfolk Southern Says Economy Chugging Right Along,2011-10-27 12:29:00-04:00,CSX,neutral
310245.0,"Earnings Preview: Norfolk Southern's EPS, Revenue Expected to Rise",2011-10-21 17:28:00-04:00,CSX,neutral
310246.0,Did Union Pacific Give Us the All Aboard Signal?,2011-10-20 11:20:00-04:00,CSX,neutral
310247.0,Jefferies Maintains its Buy Rating and $27 PT on CSX,2011-10-20 08:59:00-04:00,CSX,neutral
310248.0,"Wells Fargo Downgrades CSX, FSC to Market Perform",2011-10-20 08:38:00-04:00,CSX,positive
310249.0,BMO Maintains Outperform on CSX,2011-10-19 10:03:00-04:00,CSX,neutral
310250.0,CSX in Call Says it Has Three Announced Mine Opening in Its Territory,2011-10-19 09:12:00-04:00,CSX,neutral
310251.0,CSX in Call Says Feels Good About Coal Export Next Year,2011-10-19 09:09:00-04:00,CSX,positive
310252.0,JP Morgan Maintains Overweight Rating and $29 PT on CSX ,2011-10-19 08:40:00-04:00,CSX,neutral
310253.0,Deutsche Bank Maintains Buy on CSX,2011-10-19 08:02:00-04:00,CSX,neutral
310254.0,Citi Has Buy on CSX ,2011-10-19 07:58:00-04:00,CSX,neutral
310255.0,CSX Announces Increased Earnings,2011-10-18 16:51:00-04:00,CSX,positive
310256.0,CSX Corp Reports Q3 EPS $0.43 vs $0.44 Est; Revenues $3.00B vs $2.97B Est				,2011-10-18 16:01:00-04:00,CSX,neutral
310257.0,US Stock Futures Mixed Ahead Of Earnings Reports; IBM Shares Down In Pre-Market,2011-10-18 06:02:00-04:00,CSX,positive
310258.0,Earnings Scheduled For October 18,2011-10-18 04:45:00-04:00,CSX,neutral
310259.0,"Earnings Preview: Union Pacific's EPS, Revenue Expected to Rise",2011-10-17 12:55:00-04:00,CSX,neutral
310260.0,Earnings Expectations for the Week of October 17,2011-10-16 09:36:00-04:00,CSX,neutral
310261.0,"Earnings Preview: CSX's EPS, Revenue Expected to Rise",2011-10-14 10:19:00-04:00,CSX,neutral
310262.0,CSX Announces Significant National Gateway Progress ,2011-10-11 15:38:00-04:00,CSX,positive
310263.0,Deutsche Bank Has Buy on CSX,2011-10-11 07:40:00-04:00,CSX,neutral
310264.0,"Fast Money Picks For October 7th (ACH, CSX, CMI, S)",2011-10-06 19:35:00-04:00,CSX,neutral
310265.0,CSX Entered $1B Credit Pact,2011-10-04 17:27:00-04:00,CSX,positive
310266.0,CSX Corporation Announces Notice of Purchase Option and Rate Reset for Convertible Debentures ,2011-09-23 08:32:00-04:00,CSX,neutral
310267.0,"Transports Surge Early, Can They Be Trusted?",2011-09-13 10:28:00-04:00,CSX,positive
310268.0,Benzinga's Top Pre-Market Losers,2011-09-12 07:35:00-04:00,CSX,negative
310269.0,Transports Plummet,2011-09-06 11:02:00-04:00,CSX,neutral
310270.0,Bank of America Merrill Lynch Lowering Estimates On CSX ,2011-09-02 08:04:00-04:00,CSX,negative
310271.0,Bank of America Lowers PO On CSX To $26,2011-09-02 06:05:00-04:00,CSX,negative
310272.0,CSX to Invest $59M for Intermodal Terminal Expansion in Columbus ,2011-08-29 15:00:00-04:00,CSX,neutral
310273.0,"Fast Money Picks For August 25th (TS, CSX, M, AAPL)",2011-08-24 19:44:00-04:00,CSX,neutral
310274.0,Benzinga's Top Pre-Market Losers,2011-08-19 07:35:00-04:00,CSX,negative
310275.0,Benzinga's Top Pre-Market Gainers,2011-08-09 07:48:00-04:00,CSX,positive
310276.0,Goldman Sachs Adds CSX To CL-Buy List,2011-08-09 07:27:00-04:00,CSX,neutral
310277.0,"Morning In America, Again, The Redux",2011-08-05 09:01:00-04:00,CSX,neutral
310279.0,Transports Sink Again,2011-08-02 11:21:00-04:00,CSX,neutral
310280.0,Global X Files Plans For Five More Sector ETFs,2011-08-01 13:52:00-04:00,CSX,neutral
310281.0,All Aboard Union Pacific!,2011-07-21 15:14:00-04:00,CSX,positive
310282.0,"Earnings Preview: Norfolk Southern EPS, Revenue Expected to Rise from Previous Quarter",2011-07-21 14:45:00-04:00,CSX,neutral
310283.0,UPDATE: JP Morgan Raises Price Target on CSX from $28.00 to $29.00,2011-07-21 10:24:00-04:00,CSX,positive
310284.0,Sterne Agee Adjusts Estimates On CSX,2011-07-21 09:28:00-04:00,CSX,neutral
310285.0,UPDATE: Dahlman Rose Raises PT on CSX to $31,2011-07-21 08:43:00-04:00,CSX,neutral
310286.0,Dahlman Rose Maintains Buy Rating on CSX Corp; Raises PT to $31 from $30,2011-07-21 08:27:00-04:00,CSX,neutral
310287.0,Deutsche Bank Comments On CSX Q2 EPS,2011-07-21 08:04:00-04:00,CSX,neutral
310288.0,JP Morgan Raises PT on CSX To $29,2011-07-21 07:25:00-04:00,CSX,positive
310289.0,Deutsche Bank Raises PT On CSX To $31,2011-07-21 06:45:00-04:00,CSX,neutral
310291.0,"Dahlman Rose Maintains CSX Outperform, Raises PT",2011-07-20 15:09:00-04:00,CSX,neutral
310292.0,CSX Chugging Right Along,2011-07-20 14:08:00-04:00,CSX,neutral
310293.0,JP Morgan Reports CSX Solid 2Q,2011-07-20 08:52:00-04:00,CSX,positive
310294.0,Jefferies Updates on CSX 2Q,2011-07-20 08:45:00-04:00,CSX,neutral
310295.0,UPDATE: CSX Anticipates Continued Weakness in Housing Market,2011-07-20 08:43:00-04:00,CSX,negative
310296.0,CSX Shipped 10.4M Tons of Export Coal in Q2,2011-07-20 08:39:00-04:00,CSX,neutral
310297.0,Benzinga's Top Pre-Market Gainers,2011-07-20 08:06:00-04:00,CSX,positive
310299.0,CSX Will Add Up to 250 Locomotives in the Second Half,2011-07-20 07:50:00-04:00,CSX,neutral
310302.0,CSX Rises on the Back of Its Q2 Earnings Beat,2011-07-19 17:02:00-04:00,CSX,neutral
310303.0,CSX Corp Reaffirms Previous 2011 Near- and Long-Term Guidance,2011-07-19 16:38:00-04:00,CSX,neutral
310304.0,CSX Reaffirms Forecasts for Targets,2011-07-19 16:05:00-04:00,CSX,neutral
310305.0,CSX Reports Q2 EPS of $0.46 vs. $0.44 Est; Revenues $3.0B vs. $2.98B Est,2011-07-19 16:03:00-04:00,CSX,neutral
310306.0,"Notable Companies Reporting After The Close: AAPL, CMG, CTAS, CSX, FIS, ISRG, SYK, VMW, YHOO",2011-07-19 15:51:00-04:00,CSX,neutral
310307.0,Update: Jefferies Raising Price Target On CSX,2011-07-19 07:38:00-04:00,CSX,neutral
310308.0,Earnings Scheduled For July 19,2011-07-19 03:20:00-04:00,CSX,neutral
310309.0,Earnings Preview: Union Pacific Revenue Expected to Rise,2011-07-18 14:55:00-04:00,CSX,neutral
310310.0,Earnings Expectations for the Week of July 18,2011-07-17 09:18:00-04:00,CSX,neutral
310311.0,CSX Earnings Preview: Analysts Expect Rising Revenue,2011-07-15 10:46:00-04:00,CSX,neutral
310312.0,"Dahlman Rose Reiterates CSX Buy, Maintains $30 PT",2011-07-13 16:36:00-04:00,CSX,neutral
310313.0,Dahlman Rose Reiterates Buy Rating on CSX Corp.,2011-07-13 16:30:00-04:00,CSX,neutral
310314.0,CSX Increases 2011 Capital Investment to $2.2B,2011-07-13 15:02:00-04:00,CSX,neutral
310315.0,Goldman Sachs Maintains Buy on CSX,2011-07-12 07:36:00-04:00,CSX,neutral
310316.0,Stocks to Watch for 07/8/11: Fresh 52 Week Highs and Lows,2011-07-08 00:59:00-04:00,CSX,positive
310317.0,Is The Soft Patch Over? How To Trade It,2011-07-07 09:05:00-04:00,CSX,neutral
310318.0,"Goldman Sachs Reiterates Buy Rating on CSX Corp., its Top Transportation Pick",2011-06-30 08:37:00-04:00,CSX,positive
310319.0,"BMO Capital Markets Takes a Look at Railroads; Reiterates Norfolk Southern, CSX Outperform",2011-06-28 17:20:00-04:00,CSX,neutral
310320.0,"Mad Money Lightning Round: Cramer Likes Schlumberger, Oracle",2011-06-28 01:02:00-04:00,CSX,negative
310321.0,"Sterne Agee Downgrades CSX To Neutral, $26 PT",2011-06-23 07:35:00-04:00,CSX,neutral
310322.0,Earnings Preview: FedEx & How To Trade It,2011-06-21 13:19:00-04:00,CSX,neutral
310323.0,Transport Stocks Continue To Deliver,2011-06-21 10:35:00-04:00,CSX,neutral
310324.0,CSX Corporation At Highs Of The Session After Split,2011-06-20 13:13:00-04:00,CSX,neutral
310325.0,Industrials Stocks Surging Ahead,2011-06-17 12:58:00-04:00,CSX,neutral
310326.0,"Good Deed of the Day: CSX, City Year and Worcester Tree Initiative Volunteers to Plant 100 Trees in Park Decimated by Beetles ",2011-06-10 09:56:00-04:00,CSX,positive
310327.0,Dahlman Rose Provides Color on the Rail Sector,2011-05-23 08:21:00-04:00,CSX,neutral
310328.0,"Top Transportation, Courier, Railroads and Airline stocks to watch- Weekly Sector Performance",2011-05-22 16:16:00-04:00,CSX,positive
310329.0,Goldman Sachs Says Buy CSX ,2011-05-19 10:26:00-04:00,CSX,neutral
310330.0,Bank of America Merrill Lynch Reiterates Buy on CSX,2011-05-19 09:42:00-04:00,CSX,neutral
310331.0,Dahlman Rose Reiterates Buy and PT of $90 on CSX Corporation ,2011-05-19 09:38:00-04:00,CSX,neutral
310332.0,Morgan Stanley Reiterates Overweight on CSX ,2011-05-19 08:36:00-04:00,CSX,negative
310333.0,Deutsche Bank Reports On CSX Following Investor Day,2011-05-19 08:18:00-04:00,CSX,neutral
310334.0,Citigroup Reports on CSX Corp ,2011-05-19 08:08:00-04:00,CSX,neutral
310335.0,"Jefferies Comments on CSX Corp.'s ""Well-Attended Investor Day""",2011-05-19 07:57:00-04:00,CSX,neutral
310336.0,CSX Targets At Least $1B Share Buyback/Yr After Current Program And Dividend Payout Ratio Of 30-35% Of EPS,2011-05-18 11:22:00-04:00,CSX,positive
