Unnamed: 0,title,date,stock,sentiment
309859.0,"CSX Chairman And CEO Michael Ward On CNBC Says 'we expected low double digit growth, challenge from low coal shipments'; Q2 and FY Will Be Announced On call Tomorrow",2015-04-14 16:23:00-04:00,CSX,negative
309860.0,CSX Chairman And CEO Michael Ward On CNBC Says 'natural gas prices at $3 displaces coal shipments',2015-04-14 16:22:00-04:00,CSX,positive
309861.0,"CSX Chairman And CEO Michael Ward On CNBC Says 'there's upside to the strong dollar, our consumers have more spending power'",2015-04-14 16:22:00-04:00,CSX,positive
309862.0,CSX Corp. Announces $2B Buyback,2015-04-14 16:03:00-04:00,CSX,neutral
309863.0,CSX Corp. Reports Increase In Qtr. Dividend From $0.16 To $0.18/Share,2015-04-14 16:03:00-04:00,CSX,positive
309864.0,"CSX Reports Q1 EPS $0.45 Vs Est $0.44, Sales $3.0B Vs Est $3.02B",2015-04-14 16:02:00-04:00,CSX,neutral
309865.0,Morning Market Losers,2015-04-14 09:52:00-04:00,CSX,negative
309866.0,Benzinga's Top #PreMarket Losers,2015-04-14 08:30:00-04:00,CSX,negative
309867.0,"Earnings Scheduled For April 14, 2015",2015-04-14 04:53:00-04:00,CSX,neutral
309868.0,7 Stocks You Should Be Watching Today,2015-04-14 04:01:00-04:00,CSX,neutral
309869.0,Rail Stocks Slip After Hours On Profit Warning From Norfolk Southern,2015-04-13 20:42:00-04:00,CSX,positive
309870.0,"GW Pharma, Builders FirstSource Lead Monday's After-Hours Movers",2015-04-13 19:26:00-04:00,CSX,neutral
309871.0,Pete Najarian Sees Unusual Options Activity In CSX,2015-04-01 15:08:00-04:00,CSX,neutral
309873.0,4 Industrial Stocks That Are Technical Buys (According To Oppenheimer),2015-03-27 16:29:00-04:00,CSX,neutral
309874.0,Kansas City Southern's Profit Warning Is Sparking A Railroad Sell-Off,2015-03-23 11:05:00-04:00,CSX,positive
309875.0,CP Rail CEO Hunter Harrison Speakign at JP Morgan Conference Says He Believes 'we've bottomed on crude' Sees 'crude rebounding to $65-$75/barrel range',2015-03-04 13:43:00-05:00,CSX,negative
309876.0,"CSX Offers Slideshow Presentation Ahead of JPMorgan Aviation, Transportation, Industrials Conference: Sees Strong EPS Growth in Q1, Continues to Aim for Double-Digit Earnings Growth for FY",2015-03-04 07:35:00-05:00,CSX,positive
309877.0,BMO Capital Upgrades CSX to Outperform,2015-02-27 07:00:00-05:00,CSX,neutral
309878.0,JP Morgan Initiates Coverage On 6 Transport Companies,2015-02-23 11:22:00-05:00,CSX,positive
309879.0,"JP Morgan Initiates Coverage on CSX at Overweight, Announces $41.00 PT",2015-02-23 05:55:00-05:00,CSX,neutral
309880.0,CSC Says Cause of Monday's Oil Train Derailment Still Under Investigation; 20 of 25 Derailed Cars Caught Fire; No Oil Train Tank Cars Entered Kanawha River,2015-02-17 14:16:00-05:00,CSX,negative
309881.0,UPDATE: CSX Announces Management Changes,2015-02-11 15:14:00-05:00,CSX,neutral
309882.0,"CSX Names Munoz As President, Ward To Remain Chairman & CEO, Sanborn Promoted to EVP Of Operations",2015-02-11 15:13:00-05:00,CSX,positive
309883.0,Fast Money Halftime Report Final Trade From January 28,2015-01-29 06:24:00-05:00,CSX,neutral
309884.0,Morgan Stanley On CSX: 'Do They Know Something We Don't?',2015-01-15 11:38:00-05:00,CSX,neutral
309885.0,CSX Offers Q4 Earnings Presentation Ahead of Conference Call: Q1 Outlook Classified as 'Favorable',2015-01-14 07:36:00-05:00,CSX,neutral
309886.0,"Keep an Eye on These 7 Stocks for January 14, 2015",2015-01-14 04:05:00-05:00,CSX,neutral
309887.0,CSX Corp. Meets Q4 Views; Stock Unmoved In Extended Session,2015-01-13 17:54:00-05:00,CSX,neutral
309888.0,CSX Expecting FY15 EPS Growth in the Double-Digit Range,2015-01-13 16:02:00-05:00,CSX,positive
309889.0,"CSX Reports Q4 EPS of $0.49, Up 17% YOY; Revenue of $3.20B, Up 6% YOY",2015-01-13 16:02:00-05:00,CSX,neutral
309890.0,CSX Shares Fall Ahead Of Q4 Earnings Report,2015-01-13 15:55:00-05:00,CSX,positive
309891.0,Notes From The Street: 'FLASHBACK....Oil Going To $200/Barrel',2015-01-13 08:20:00-05:00,CSX,neutral
309892.0,"Earnings Scheduled For January 13, 2015",2015-01-13 04:50:00-05:00,CSX,neutral
309893.0,7 Stocks You Should Be Watching Today,2015-01-13 04:06:00-05:00,CSX,neutral
309894.0,"Cramer Weighs In On Micron Technology, Sirius XM And CSX",2015-01-07 21:29:00-05:00,CSX,neutral
309895.0,"Option Alert: CSX Jan $35 Call; 1,506 Contract Trade Above Ask @$0.37, Currently $34.07",2015-01-07 10:06:00-05:00,CSX,positive
309896.0,Hearing Unconfirmed Market Chatter CP has Made $45/Share Bid for CSX,2015-01-07 10:05:00-05:00,CSX,negative
309897.0,Morning Market Losers,2015-01-06 09:58:00-05:00,CSX,negative
309898.0,Benzinga's Top Downgrades,2015-01-06 08:44:00-05:00,CSX,positive
309899.0,3 Sectors That Could Get Killed By Lower Oil Prices,2015-01-06 08:34:00-05:00,CSX,negative
309900.0,Benzinga's Top #PreMarket Losers,2015-01-06 08:21:00-05:00,CSX,negative
309901.0,UBS Downgrades CSX To Neutral,2015-01-06 07:51:00-05:00,CSX,neutral
309902.0,"UBS Downgrades CSX to Neutral, Lowers PT to $38.00, UBS Citing Concerns for 2015 EPS Growth",2015-01-06 05:22:00-05:00,CSX,positive
309903.0,16 Stocks 2 Experts Are Watching This Week,2014-12-23 09:42:00-05:00,CSX,neutral
309904.0,Ackman Makes More Noise About Rail Consolidation,2014-12-18 13:34:00-05:00,CSX,neutral
309905.0,"CSX Creates Opportunities For Increased Cross-Border Trade With New Intermodal Terminal In Montreal, $100M Terminal Spanning 89 Acres",2014-12-16 14:02:00-05:00,CSX,positive
309906.0,Bank Of America Cites Declining Crude Prices In Lower Rail Estimates,2014-12-16 09:02:00-05:00,CSX,negative
309907.0,"Bank of America Maintains Buy on CSX Corporation, Lowers PT to $37.00",2014-12-16 06:53:00-05:00,CSX,negative
309908.0,Is It Time To Ride Rail Stocks?,2014-12-15 09:03:00-05:00,CSX,neutral
309909.0,CSX's Donna Cerwonka Says At Coal Conference:  CSX To Open New Railyard Designed To Service Growth In The Illinois Basin,2014-12-09 11:33:00-05:00,CSX,positive
309910.0,CNBC's Stock Pops & Drops From December 4,2014-12-05 08:03:00-05:00,CSX,neutral
309911.0,Benzinga's Top Upgrades,2014-12-04 09:07:00-05:00,CSX,positive
309912.0,Citigroup Upgrades CSX To Buy,2014-12-04 09:05:00-05:00,CSX,neutral
309913.0,UPDATE: Citigroup Upgrades CSX As Stock Feels Like A Must Own,2014-12-04 08:37:00-05:00,CSX,positive
309914.0,"Citigroup Upgrades CSX Corporation to Buy, Raises PT to $41.00",2014-12-04 08:10:00-05:00,CSX,neutral
309915.0,"Fast Money Picks For December 4: U.S. Steel, CSX, Pilgrim's Pride",2014-12-04 07:39:00-05:00,CSX,positive
309916.0,CSX Moves Higher As Q4 Outlook Is Re-Affirmed,2014-12-03 14:00:00-05:00,CSX,neutral
309917.0,UPDATE: CSX CFO Reaffirms Q4 Outlook,2014-12-03 11:05:00-05:00,CSX,neutral
309918.0,"CSX, KSU Shares Move Higher on Positive Guidance from CSX",2014-12-03 11:04:00-05:00,CSX,positive
309919.0,CSX Shares Tick Higher Over Last Half Hour as Unconfirmed Chatter of Renewed CP Interest Making the Twittersphere Rounds,2014-12-02 10:19:00-05:00,CSX,positive
309920.0,"Bank Of America/Merrill Lynch Adds FedEx To ""US 1 List"", Removes CSX Corp.",2014-12-02 06:51:00-05:00,CSX,neutral
309921.0,TD Securities Downgrades CSX Corporation to Hold,2014-12-01 07:09:00-05:00,CSX,positive
309922.0,Stocks Hitting 52-Week Highs,2014-11-24 10:18:00-05:00,CSX,neutral
309923.0,Benzinga's Top #PreMarket Losers,2014-11-14 08:10:00-05:00,CSX,negative
309924.0,"CSX Shares Edge Higher as Co. Issues Release Reiterating Long-Term Expectations, Strategy, Says Expecting Growth in Q4 EPS Similar to Q3",2014-11-12 11:08:00-05:00,CSX,positive
309925.0,"Benzinga's M&A Chatter for Thursday November 6, 2014",2014-11-06 20:50:00-05:00,CSX,neutral
309926.0,Bill Ackman's Comments On Rail Merger Move Shares Higher,2014-11-06 17:36:00-05:00,CSX,positive
309927.0,Bill Ackman Comments at Invest for Kids 'CP May Be Looking to Merge with CSX' Moving Entire Rail Sector,2014-11-06 17:01:00-05:00,CSX,neutral
309928.0,CSX Jury Determines Company Will Be Paid $7.3M By Defendants,2014-11-06 12:44:00-05:00,CSX,neutral
309929.0,Federal Highway Administration Approves Construction Alternative For CSX's Virginia Avenue Tunnel Project,2014-11-04 16:40:00-05:00,CSX,positive
309930.0,Can CSX Railroad's Run Continue?,2014-11-03 09:25:00-05:00,CSX,neutral
309931.0,Top 4 Stocks In The Railroads Industry With The Highest Revenue,2014-10-30 04:29:00-04:00,CSX,positive
309932.0,Morgan Stanley: Freight Cycle Favors Shippers Over Truckers,2014-10-29 07:44:00-04:00,CSX,positive
309933.0,"Amtrak Considering Selling Assets In NYC, D.C., Chicago, Baltimore And Philidelphia ",2014-10-23 15:10:00-04:00,CSX,positive
309934.0,"CP CEO Hunter Harrison, Rgarding Being Buyer or Seller in Major Railway Consolidation, Says Both Work; Says His Team Has Strong Track Record -Reuters",2014-10-21 13:30:00-04:00,CSX,positive
309935.0,"Watch Railroad Names Here as Canadian Pacific Exec on Earnings Call Suggesting Co. Has 'Significant' Dry Power Available, Calls Balance Sheet 'Fantastic'",2014-10-21 11:36:00-04:00,CSX,neutral
309936.0,"CNBC's Stock Pops & Drops From October 20: Pandora, Hertz, CSX And NewLink Genetics",2014-10-20 20:34:00-04:00,CSX,neutral
309937.0,"IBM's Report Weighs On The Dow, Apple Helps Boost The Nasdaq, S&P 500 Extends Winning Streak",2014-10-20 16:57:00-04:00,CSX,positive
309938.0,Morning Market Losers ,2014-10-20 09:51:00-04:00,CSX,negative
309939.0,"Canadian Pacific Railway, CSX Shares React To Termination Of Exploratory Talks",2014-10-20 08:06:00-04:00,CSX,positive
309940.0,UPDATE: CP Confirms Termination Of Exploratory Talks With CSX,2014-10-20 07:02:00-04:00,CSX,neutral
309941.0,CP Confirms Termination of Exploratory Talks with CSX,2014-10-20 07:00:00-04:00,CSX,neutral
309942.0,Benzinga Weekly Preview: Earnings Season Is In Full Swing,2014-10-19 10:19:00-04:00,CSX,neutral
309943.0,"Dow's Losing Streak Now Stands At 6 Days, S&P 500 And Nasdaq Slightly Positive",2014-10-16 17:07:00-04:00,CSX,positive
309944.0,UPDATE: Ackman Says Canadian Pacific CEO Harrison's View is that Some Consolidation Could Improve Competition in Rail Industry,2014-10-16 11:33:00-04:00,CSX,positive
309945.0,Bill Ackman Makes Positive Comments on Rail Mergers; Does Not Comment Specifically on Rumored Canadian Pacific-CSX Merger Talks -DJ,2014-10-16 11:29:00-04:00,CSX,positive
309946.0,New Credit Suisse Coverage Offers Potential Pair Trade,2014-10-16 11:04:00-04:00,CSX,positive
309947.0,UPDATE: Credit Suisse Upgrades CSX Corporation On Strong Pricing Outlook,2014-10-16 08:41:00-04:00,CSX,positive
309948.0,"Credit Suisse Upgrades CSX Corporation to Outperform, Raises PT to $38.00",2014-10-16 06:28:00-04:00,CSX,positive
309949.0,From CSX Call: Expecting Q4 Profit Growth Similar QoQ,2014-10-15 08:55:00-04:00,CSX,positive
309950.0,"From CSX Earnings Conference Call: 79% of Volume Related to Q4 Outlook Categorized as 'Favorable,' 4% Categorized as 'Unfavorable'",2014-10-15 08:42:00-04:00,CSX,neutral
309951.0,Benzinga's Top #PreMarket Gainers,2014-10-15 08:10:00-04:00,CSX,positive
309952.0,Fast Money Picks For October 15,2014-10-15 07:51:00-04:00,CSX,neutral
309953.0,"#PreMarket Primer: Wednesday, October 15: Falling Oil Prices Threaten Global Stability",2014-10-15 07:49:00-04:00,CSX,negative
309954.0,"Stocks To Watch For October 15, 2014",2014-10-15 04:13:00-04:00,CSX,neutral
309955.0,CSX Corporation Surges On Record Q3 Results,2014-10-14 16:50:00-04:00,CSX,neutral
309956.0,Markets Unable To Hold On To Gains As Oil Continues To Plunge,2014-10-14 16:47:00-04:00,CSX,positive
309957.0,CSX Corp. Shares Gaining ~1.5% After Hours,2014-10-14 16:07:00-04:00,CSX,positive
309958.0,CSX Expecting FY15 Earnings Growth in Double Digit Percent Range,2014-10-14 16:02:00-04:00,CSX,positive
309959.0,CSX Corporation Reports Q3 EPS of $0.51 vs $0.47 Est; Revenue of $3.20B vs $3.12B Est,2014-10-14 16:02:00-04:00,CSX,neutral
309960.0,"#PreMarket Primer: Tuesday, October 14: US Hospitals To Receive More Ebola Training",2014-10-14 07:21:00-04:00,CSX,neutral
309961.0,"Earnings Scheduled For October 14, 2014",2014-10-14 05:23:00-04:00,CSX,neutral
309962.0,Markets Debut Week On Negative Note; S&P 500 Falls Through Key Level,2014-10-13 16:57:00-04:00,CSX,negative
309963.0,U.S. Stocks Fluctuate; Shutterfly Shares Decline On Aborted Merger Talks,2014-10-13 15:18:00-04:00,CSX,positive
309964.0,Big Railroad Stocks Gain Steam On Merger Rumor,2014-10-13 13:49:00-04:00,CSX,positive
309965.0,Lithia Motors Dips On Lowered Earnings Forecast; CSX Shares Gain,2014-10-13 12:30:00-04:00,CSX,positive
309966.0,CSX Shares Jump On Reported Merger Talks With Canadian Pacific Railway,2014-10-13 11:26:00-04:00,CSX,positive
309967.0,"Markets Down; Targa To Acquire Atlas Pipeline, Atlas Energy",2014-10-13 11:05:00-04:00,CSX,positive
309968.0,Hearing Cautious Note from Credit Suisse on Rumored Canadian Pacific-CSX Contact,2014-10-13 10:22:00-04:00,CSX,positive
309969.0,Benzinga's Volume Movers,2014-10-13 10:12:00-04:00,CSX,neutral
309970.0,Stocks Hitting 52-Week Highs ,2014-10-13 10:01:00-04:00,CSX,neutral
309971.0,Morning Market Movers ,2014-10-13 09:39:00-04:00,CSX,neutral
309972.0,Benzinga's Top #PreMarket Gainers,2014-10-13 08:05:00-04:00,CSX,positive
309973.0,"Stocks To Watch For October 13, 2014",2014-10-13 04:06:00-04:00,CSX,neutral
309974.0,Benzinga's Weekend M&A Chatter,2014-10-12 20:54:00-04:00,CSX,neutral
309975.0,"WSJ Reports CSX Rejects Approach from Canadian Pacific, According to Sources; Combined Companies Would Have $62B Value",2014-10-12 17:50:00-04:00,CSX,negative
309976.0,Benzinga Weekly Preview: Earnings Season Begins,2014-10-12 12:11:00-04:00,CSX,neutral
309977.0,UPDATE: CSX Says Q3 Overall Volume Growth at 'Slightly Higher Than Expected' Rate,2014-09-11 12:13:00-04:00,CSX,positive
309978.0,"CSX Issues Release, Says 'Well-Positioned for Continued Profitable Growth as Long-Term Trends Favor Rail Transporation'",2014-09-11 12:11:00-04:00,CSX,positive
309979.0,"Option Alert: CSX Oct $31 Call; 3,399 Contracts Traded vs 1,407 OI; Currently $30.85",2014-08-29 13:45:00-04:00,CSX,positive
309980.0,3 Reasons To Ride Railroad Stocks,2014-08-14 13:33:00-04:00,CSX,neutral
309981.0,"Macquarie Upgrades Union Pacific, Kansas City; Revisits Railroad Sector",2014-08-12 11:18:00-04:00,CSX,neutral
309982.0,Macquarie Downgrades CSX Corporation to Neutral,2014-08-12 08:57:00-04:00,CSX,neutral
309983.0,Earnings Continue Driving Markets Higher,2014-07-16 17:23:00-04:00,CSX,neutral
309984.0,Morgan Stanley Believes CSX Might Be Getting Its Groove Back,2014-07-16 09:27:00-04:00,CSX,neutral
309985.0,"Traders Watch Construction, Trucking, Railroad, Materials Names Following Lew Comments About Rebuilding Infrastructure",2014-07-16 09:09:00-04:00,CSX,neutral
309986.0,UPDATE: Bank Of America Reiterates On CSX On Confidence In Future,2014-07-16 08:59:00-04:00,CSX,positive
309987.0,From CSX Call: Expecting 'Favorable Conditions' in ~88% of Its Markets During Q3,2014-07-16 08:48:00-04:00,CSX,positive
309988.0,"From CSX Earnings Conf. Call: Expecting Strength in Ag, Food, Chemicals, Autos Sectors During Q3, Sees Weakness in Coal Exports, Minerals, Industrial Waste",2014-07-16 08:48:00-04:00,CSX,negative
309989.0,"Markets Mixed, NASDAQ Lower As Yellen Suggests Valuations Are Stretched",2014-07-15 16:35:00-04:00,CSX,negative
309990.0,CSX Shares Reacting To Mixed Quarterly Results,2014-07-15 16:35:00-04:00,CSX,positive
309991.0,CSX Corporation Reports Q2 EPS of $0.53 vs $0.51 Est; Revenue of $3.20B vs $3.21B Est,2014-07-15 16:02:00-04:00,CSX,neutral
309992.0,"Option Alert: CSX Aug $30 Put; 9,000 Contracts Traded vs 4,017 OI; Currently $31.05",2014-07-15 14:22:00-04:00,CSX,positive
309993.0,"Earnings Scheduled For July 15, 2014",2014-07-15 05:01:00-04:00,CSX,neutral
309994.0,Benzinga Weekly Preview: Earnings Season Kicks Into High Gear,2014-07-11 16:44:00-04:00,CSX,neutral
309995.0,CSX Says It Halts Some Operations Before Hurricane,2014-07-03 11:29:00-04:00,CSX,neutral
309996.0,Markets Little Changed As The Quarter Comes To An End,2014-06-30 16:34:00-04:00,CSX,neutral
309997.0,Stocks Mildly Higher To End The Week,2014-06-27 16:33:00-04:00,CSX,neutral
309998.0,7 Railroad Stocks With Revised Estimates At Bank of America,2014-06-25 12:27:00-04:00,CSX,neutral
309999.0,Consumer Confidence And Housing Data Take A Back-Seat To Markets,2014-06-24 16:36:00-04:00,CSX,positive
310000.0,"Stocks To Watch For June 06, 2014",2014-06-06 07:39:00-04:00,CSX,neutral
310001.0,"CSX Shares Edge Higher as Bloomberg Reporting Co. Expecting Q2 EPS Flat to Up Slightly on a YoY Basis, Cites Volume Strength",2014-06-05 12:36:00-04:00,CSX,positive
310002.0,Coal: A 'Million Dollar Mile' Getting Longer In the U.S.,2014-05-21 14:48:00-04:00,CSX,neutral
310003.0,CSX Reports Train That Derailed in Virginia Was Carrying Bakken Crude,2014-05-01 11:32:00-04:00,CSX,negative
310004.0,"WNCT Reporting, CNBC Now Highlighting CSX Train Has Derailed in Greenville, NC, Hearing of Leak",2014-04-30 15:15:00-04:00,CSX,negative
310005.0,Top 4 Large-Cap Stocks In The Railroads Industry With The Highest Dividend Yield,2014-04-23 05:10:00-04:00,CSX,positive
310006.0,UPDATE: Bank of America Reiterates on CSX Following Solid Results,2014-04-16 10:12:00-04:00,CSX,positive
310007.0,"Bank of America Maintains Buy on CSX Corporation, Raises PO to $33.00",2014-04-16 07:12:00-04:00,CSX,negative
310008.0,"#PreMarket Primer: Wednesday, April 16: Chinese GDP Slows, But Surpasses Expectations",2014-04-16 07:03:00-04:00,CSX,neutral
310009.0,CSX Raises Qtr. Dividend from $0.15 to $0.16/Share,2014-04-15 16:03:00-04:00,CSX,neutral
310010.0,CSX Corporation Reports Q1 EPS of $0.40 vs $0.41 Est; Revenue of $3.01B vs $2.99B Est,2014-04-15 16:02:00-04:00,CSX,neutral
310011.0,"#PreMarket Primer: Tuesday, April 15: Hopes For Diplomacy In Ukraine Help Settle Markets",2014-04-15 07:20:00-04:00,CSX,positive
310012.0,"Earnings Scheduled For April 15, 2014",2014-04-15 05:11:00-04:00,CSX,neutral
310013.0,"Macquarie Initiates Coverage on CSX Corporation at Outperform, Announces $32.00 PT",2014-04-10 16:56:00-04:00,CSX,neutral
310014.0,Benzinga's Top Downgrades,2014-04-03 07:47:00-04:00,CSX,positive
310015.0,"Barclays Downgrades CSX Corporation to Equal-weight, Lowers PT to $30.00",2014-04-03 07:44:00-04:00,CSX,negative
310016.0,CSX Urges STB to Reject Flawed Switching Scheme,2014-03-26 11:51:00-04:00,CSX,negative
310017.0,CSX Shares Edge Higher in Pre-Market Trade as BofA Earlier Added to 'US 1' List,2014-03-25 08:50:00-04:00,CSX,positive
310018.0,"Market Wrap For March 12: Nasdaq Ends Losing Streak, Dow Mildly Lower",2014-03-12 16:51:00-04:00,CSX,negative
310019.0,From CSX Presentation: Expecting Double-Digit EPS Growth in FY15,2014-03-12 08:48:00-04:00,CSX,positive
310020.0,"Shares of CSX Quiet Following Comments from Exec at JP Morgan's Aviation, Transportation, Industrials Conf.: Believes FY Profit Will Be More Modest, Sees Q1 Earnings Impacted by Harsh Winter",2014-03-12 08:44:00-04:00,CSX,positive
310021.0,CSX CEO Ward: 'We Have a Partnership with GE Looking to See if we can Convert Engines to Natural Gas',2014-03-06 18:32:00-05:00,CSX,positive
310022.0,CSX CEO Ward: 'There's a Shortage of Truck Drivers in the US. Rail is Benefiting from That',2014-03-06 18:31:00-05:00,CSX,negative
310023.0,CSX CEO Ward: 'We've Grown the Other Businesses More than We've Lost the Coal Business',2014-03-06 18:29:00-05:00,CSX,negative
310024.0,Jim Cramer Interviews CEO Michael Jon Ward of CSX on Mad Money,2014-03-06 18:28:00-05:00,CSX,negative
310025.0,Morgan Stanley Sees Silver Linings in 1Q Operating Challenges For CSX,2014-03-03 09:39:00-05:00,CSX,positive
310026.0,Barron's Recap: Trouble In The Pipeline?,2014-02-23 08:56:00-05:00,CSX,negative
310027.0, Union Pacific vs. CSX - Which Is The Better Ride for 2014?,2014-01-27 13:20:00-05:00,CSX,positive
310028.0,"Atlantic Equities Downgrades CSX Corporation to Neutral, Lowers PT to $29.00",2014-01-27 08:10:00-05:00,CSX,negative
310029.0,Are Railroad Stocks The Best Way To Benefit From The Remodeling Boom In The United States?,2014-01-21 15:08:00-05:00,CSX,positive
310030.0,UPDATE: Stifel Downgrades CSX,2014-01-16 09:31:00-05:00,CSX,neutral
310031.0,Benzinga's Top #PreMarket Losers,2014-01-16 08:22:00-05:00,CSX,negative
310032.0,"From CSX Call: Q1 Outlook is Favorable on Chemicals, Domestic Coal, Expecting Steady Macro Growth in 2014",2014-01-16 08:22:00-05:00,CSX,positive
310033.0,Argus Research Upgrades CSX Corporation to Buy,2014-01-16 08:21:00-05:00,CSX,neutral
310034.0,Benzinga's Top Downgrades,2014-01-16 07:44:00-05:00,CSX,positive
310035.0,"Stifel Nicolaus Downgrades CSX Corporation to Hold, Removes $30.00 PT",2014-01-16 07:03:00-05:00,CSX,neutral
310036.0,"Stocks To Watch For January 16, 2014",2014-01-16 04:43:00-05:00,CSX,neutral
310037.0,CSX Falls 3% After In-Line Q4,2014-01-15 16:35:00-05:00,CSX,neutral
310038.0,CSX Reaffirms Outlook for Operating Ratio by 2015,2014-01-15 16:03:00-05:00,CSX,neutral
310039.0,"CSX Corporation Reports Q4 EPS of $0.42, Inline; Revenue of $3.0B vs $2.98B Est",2014-01-15 16:02:00-05:00,CSX,neutral
310040.0,"#PreMarket Primer: Wednesday, January 15: Big Earnings Day",2014-01-15 07:07:00-05:00,CSX,neutral
310041.0,"Earnings Scheduled For January 15, 2014",2014-01-15 04:18:00-05:00,CSX,neutral
310042.0,"Stocks To Watch For January 15, 2014",2014-01-15 04:08:00-05:00,CSX,neutral
310043.0,Canadian Officials Proposing New Standards for Rail Tank Cars,2014-01-10 14:23:00-05:00,CSX,neutral
310044.0,UPDATE: Deutsche Bank Raises PT on CSX Corporation on Expected Growth Recovery,2013-12-16 12:28:00-05:00,CSX,positive
310045.0,UPDATE: Bank of America Reiterates on CSX as Volumes Are Well Above Target,2013-12-13 08:59:00-05:00,CSX,positive
310046.0,"Bank of America Maintains Buy on CSX Corporation, Raises PO to $32.00",2013-12-13 06:34:00-05:00,CSX,negative
310047.0,Bloomberg Reporting California Rail Chair Has Said the State Will Break Ground on a High-Speed Rail by February,2013-12-05 15:37:00-05:00,CSX,neutral
310048.0,S&P Upgrades CSX Corp. from BBB to BBB+; Outlook Stable,2013-10-31 16:39:00-04:00,CSX,positive
310049.0,UPDATE: RBC Capital Markets Downgrades CSX Corporation on Negative Trends in Multiple Key Areas,2013-10-17 10:17:00-04:00,CSX,negative
310050.0,UPDATE: BMO Capital Markets Downgrades CSX Corporation Following Q3/13 EPS Report,2013-10-17 09:14:00-04:00,CSX,neutral
310051.0,Benzinga's Top Downgrades,2013-10-17 07:33:00-04:00,CSX,positive
310052.0,"RBC Capital Downgrades CSX Corporation to Sector Perform, Raises PT to $28.00",2013-10-17 06:56:00-04:00,CSX,neutral
310053.0,"BMO Capital Downgrades CSX Corporation to Market Perform, Lowers PT to $28.00",2013-10-16 16:34:00-04:00,CSX,negative
310054.0,From CSX Call: CFO Reiterates Outlook for 10-15% EPS Growth Over 2014-2015,2013-10-16 08:52:00-04:00,CSX,positive
310055.0,CSX Announces Positive Q3 Earnings Beating Estimates (CSX),2013-10-16 07:12:00-04:00,CSX,positive
310056.0,"UPDATE: CSX Corp. Says Now Expecting FY EPS Up Slightly, Had Previously Expected Unch",2013-10-15 16:05:00-04:00,CSX,neutral
310057.0,CSX Raises FY EPS Outlook,2013-10-15 16:03:00-04:00,CSX,neutral
310058.0,CSX Corporation Reports Q3 EPS of $0.46 vs $0.43 Est; Revenue of $3.0B vs $2.95B Est,2013-10-15 16:02:00-04:00,CSX,neutral
310059.0,"Earnings Scheduled For October 15, 2013",2013-10-15 04:56:00-04:00,CSX,neutral
310060.0,Benzinga Weekly Preview: Earnings Season Gets Into Full Swing,2013-10-11 16:29:00-04:00,CSX,neutral
310061.0,Credit Suisse Announces Transport Preview with Top Ideas for Investors,2013-10-10 16:19:00-04:00,CSX,positive
310062.0,Mid-Day Market Update: Aaron's Shares Fall After Lowered Q3 Outlook; Facebook Surges,2013-10-04 12:26:00-04:00,CSX,positive
310063.0,Mid-Morning Market Update: Markets Rise; Comtech Posts Upbeat Results,2013-10-04 10:33:00-04:00,CSX,neutral
310064.0,Benzinga's Top Downgrades,2013-10-04 07:34:00-04:00,CSX,positive
310065.0,"Citigroup Downgrades CSX Corporation to Neutral, Maintains $27.00 PT",2013-10-04 07:24:00-04:00,CSX,neutral
310066.0,Non-Operating Unconsolidated Subsidiaries—Invested Capital Adjustment,2013-09-20 16:06:00-04:00,CSX,neutral
310067.0,CSX Acquires Eastern Associated Terminal in Tampa ,2013-08-07 13:40:00-04:00,CSX,neutral
310068.0,CSX Shares Trading Higher as Bernstein Predicts Volume Increase from New Contracts,2013-08-02 13:22:00-04:00,CSX,positive
310069.0,Top 4 NYSE Stocks In The Railroads Industry With The Highest Dividend Yield,2013-07-25 04:42:00-04:00,CSX,positive
310070.0,"NTSB Says CSX Freight Train Derailed Yesterday in New York, NTSB Sending Investigators to NYC to Probe Derailment - Twitter",2013-07-19 15:06:00-04:00,CSX,negative
310071.0,"18 Railcars Derail In Benbrook, Texas, Hazmat Teams Checking For Ammonium Nitrate Spill - Watch Rail Stocks",2013-07-18 06:58:00-04:00,CSX,negative
310072.0,BB&T Capital Downgraded CSX Corporation to Hold,2013-07-17 13:52:00-04:00,CSX,neutral
310073.0,BB&T Capital Downgrades CSX Corporation to Hold,2013-07-17 11:36:00-04:00,CSX,neutral
310074.0,CEO Michael Ward On CSX Q2 Results Chugging Past Analysts' Estimates (CSX),2013-07-17 09:13:00-04:00,CSX,neutral
310075.0,"Benzinga's PreMarket Info Recap for July 17, 2013: Big Earnings, Credit Cards Hurting",2013-07-17 09:05:00-04:00,CSX,neutral
310076.0,"Benzinga Market Primer: Wednesday, July 17: Bernanke Is Back",2013-07-17 06:30:00-04:00,CSX,neutral
310077.0,US Stock Futures Down; All Eyes On Bernanke,2013-07-17 05:42:00-04:00,CSX,neutral
310078.0,"Stocks To Watch For July 17, 2013",2013-07-17 04:21:00-04:00,CSX,neutral
310079.0,CSX Rises After Beating Q2 Estimates (CSX),2013-07-16 22:10:00-04:00,CSX,negative
310080.0,CSX Reaffirms FY Outlook,2013-07-16 16:03:00-04:00,CSX,neutral
310081.0,CSX Corporation Reports Q2 EPS of $0.52 vs $0.47 Est,2013-07-16 16:02:00-04:00,CSX,neutral
310082.0,"Benzinga Market Primer: Tuesday, July 16: Futures Flat Ahead of Earnings",2013-07-16 06:35:00-04:00,CSX,neutral
310083.0,"US Stock Futures Edge Higher; Goldman Sachs Earnings, CPI In Focus",2013-07-16 06:18:00-04:00,CSX,neutral
