Unnamed: 0,title,date,stock,sentiment
324112.0,Shares of several basic material companies are trading lower as equities sell off following the recent rally. Stocks have rallied over the past week amid optimism towards the US economy reopening and investors have potentially taken some profits following run up. NOTE: Investors are awaiting the FOMC meeting on Wednesday.,2020-06-09 10:52:00-04:00,CX,positive
324113.0,Shares of several basic materials companies are trading higher following strong US jobs data and continued optimism amid the reopening of the economy. These have lead hopes of an economic rebound and an increase in materials demand.,2020-06-05 10:29:00-04:00,CX,positive
324114.0,"Shares of several basic materials companies are trading higher amid market strength as investors watch for continued US business reopenings, which could lead to a rebound in economic activity and demand for materials.",2020-06-02 11:45:00-04:00,CX,positive
324115.0,Shares of several basic materials companies are trading higher amid economic optimism as some US states reopen businesses and investors weigh vaccine progress. A pickup in economic activity would be a potential positive catalyst for basic materials demand.,2020-05-27 10:10:00-04:00,CX,positive
324116.0,"Shares of several basic materials companies are trading higher following positive data from a study of Gilead's Remdesivir, a potential coronavirus treatment candidate. A successful treatment could make a sooner return to economic activity and investment",2020-04-29 11:10:00-04:00,CX,positive
324117.0,Shares of several basic material companies are trading higher for the session as some US states ease lockdown restrictions and as investors weigh quarterly earnings from blue chip companies.,2020-04-28 10:35:00-04:00,CX,positive
324118.0,Shares of several material stocks are trading lower amid a warning that oil demand will reach a 25-year low. This has negative implications for industrial production and construction.,2020-04-15 09:02:00-04:00,CX,negative
324119.0,Shares of several basic material companies are trading higher amid overall market strength after the US Federal Reserve announced a further $2.3 trillion in financing programs to support the economy.,2020-04-09 10:29:00-04:00,CX,positive
324120.0,Shares of several basic materials companies are trading higher amid positive market sentiment on optimism of coronavirus cases in some hotspots potentially leveling off. Slowing cases could mean a sooner return to economic activity.,2020-04-07 08:46:00-04:00,CX,positive
324121.0,"Shares of several basic materials companies are trading higher, potentially rebounding from this quarter's weakness.",2020-03-31 11:50:00-04:00,CX,negative
324122.0,Stocks That Hit 52-Week Lows On Monday,2020-03-23 10:34:00-04:00,CX,negative
324123.0,Stocks That Hit 52-Week Lows On Friday,2020-03-20 14:26:00-04:00,CX,negative
324124.0,Stocks That Hit 52-Week Lows On Thursday,2020-03-12 12:10:00-04:00,CX,negative
324125.0,15 Basic Materials Stocks Moving In Friday's Pre-Market Session,2020-03-06 08:17:00-05:00,CX,neutral
324126.0,Shares of several basic material companies are trading lower as global markets continue to experience volatility amid the coronavirus spread.,2020-03-05 07:35:00-05:00,CX,neutral
324127.0,"Shares of several basic materials companies are trading lower as the global coronavirus spread continues to cause economic fears among investors, hampering the demand outlook for such materials.",2020-02-28 08:57:00-05:00,CX,negative
324128.0,Cemex SAB De CV shares are trading lower after Bank Of America lowered its price target on the stock from $5 to $4.8 per share.,2020-02-13 15:38:00-05:00,CX,positive
324129.0,"B of A Securities Maintains Buy on Cemex, Lowers Price Target to $4.8",2020-02-13 11:42:00-05:00,CX,positive
324130.0,Cemex shares are trading lower despite the company reporting better-than-expected Q4 sales results.,2020-02-12 10:14:00-05:00,CX,neutral
324131.0,Cemex Q4 Sales $3.3B Beat $3.29B Estimate,2020-02-12 06:18:00-05:00,CX,neutral
324132.0,"Earnings Scheduled For February 12, 2020",2020-02-12 04:22:00-05:00,CX,neutral
324133.0,7 Stocks To Buy Under $5,2020-02-06 10:35:00-05:00,CX,neutral
324134.0,23 Basic Materials Stocks Moving In Wednesday's Session,2020-01-22 12:23:00-05:00,CX,neutral
324135.0,Cemex SAB De CV shares are trading higher. Not seeing any company-specific news to justify the price action.,2020-01-17 15:32:00-05:00,CX,positive
324136.0,Cemex Option Alert: Apr 17 $4 Calls Sweep (2) near the Ask: 1650 @ $0.196 vs 3243 OI; Earnings 2/6 Before Open [est] Ref=$3.805,2020-01-15 11:06:00-05:00,CX,positive
324137.0,"Cemex Option Alert: Jan, 2021 $4 Calls at the Ask: 5000 @ $0.48 vs 32998 OI; Ref=$3.585",2019-12-04 10:46:00-05:00,CX,positive
324138.0,"CEMEX Reports Divestiture Of Kentucky Cement Plant, Related Assets To Eagle Materials For $665M",2019-11-26 06:13:00-05:00,CX,positive
324139.0,17 Stocks Moving in Friday's Pre-Market Session,2019-10-25 08:44:00-04:00,CX,neutral
324140.0,Cemex SAB De CV shares are trading lower after the company reported Q3 operating EBITDA down 7% from last year and worse-than-expected Q3 sales results.,2019-10-24 10:06:00-04:00,CX,neutral
324141.0,"Cemex Q3 Operating EBITDA $681M, Down 7% Year Over Year, Sales $3.5B Miss $3.6B Estimate",2019-10-24 06:18:00-04:00,CX,negative
324142.0,CEMEX Bets On Canadian Final-Mile Startup GoFor's US Expansion,2019-09-17 09:59:00-04:00,CX,neutral
324143.0,Cemex SAB De CV shares are trading lower on seemingly no company-specific news.,2019-09-11 14:19:00-04:00,CX,negative
324144.0,Mid-Afternoon Market Update: U.S. Stocks Turn Lower; Ulta Beauty Shares Fall After Q2 Miss,2019-08-30 15:17:00-04:00,CX,positive
324145.0,Stocks That Fell Through 52-Week Lows Wednesday,2019-08-07 14:22:00-04:00,CX,negative
324146.0,"CEMEX USA Sees Delivering Expected 155K Cubic Yards Of Ready-Mix Concrete To Supply Construction Of The Estates At Acqualina In Sunny Isles Beach, Florida",2019-08-07 11:36:00-04:00,CX,positive
324147.0,Stocks That Set New 52-Week Lows Friday Morning,2019-08-02 10:46:00-04:00,CX,negative
324148.0,Stocks that Reached Yearly Lows Thursday Morning,2019-08-01 11:09:00-04:00,CX,negative
324149.0,"Cemex Q2 EPS $0.06 Misses $0.14 Estimate, Sales $3.523B Miss $3.7B Estimate",2019-07-25 06:31:00-04:00,CX,negative
324150.0,List of Companies Reaching Yearly Lows Tuesday,2019-07-23 14:58:00-04:00,CX,neutral
324151.0,9 US-Traded Mexico-Based Stocks To Keep An Eye On,2019-05-31 08:42:00-04:00,CX,neutral
324152.0,CEMEX Signs Final Agreement To Divest Aggregates And Ready-Mix Assets In Germany,2019-05-13 17:30:00-04:00,CX,positive
324153.0,"Morgan Stanley Downgrades Cemex, S.A.B. de C.V. Sponsored ADR to Equal-Weight, Lowers Price Target to $5.5",2019-04-29 08:31:00-04:00,CX,negative
324154.0,Cemex Q1 Sales $3.2B Miss $3.35B Estimate,2019-04-25 06:20:00-04:00,CX,negative
324155.0,"CEMEX Reports Its Ventures Unit Invested In LINKX, No Terms Disclsoed",2019-04-11 17:00:00-04:00,CX,negative
324156.0,"Benzinga's Top Upgrades, Downgrades For April 11, 2019",2019-04-11 09:09:00-04:00,CX,positive
324157.0,"Goldman Sachs Initiates Coverage On Cemex with Neutral Rating, Announces $5.50 Price Target",2019-04-11 07:19:00-04:00,CX,neutral
324158.0,CEMEX Reports Has Closed Or Reached Binding Deals For Sales Of $750M Related To Divestment Program,2019-03-21 06:07:00-04:00,CX,positive
324159.0,CEMEX Reaches Binding Agreement To Divest White Cement Business For Approximately $180M,2019-03-20 11:30:00-04:00,CX,positive
324160.0,CEMEX Reaches Binding Agreement To Divest Aggregates And Ready-Mix Assets In Germany For Approximately €87M,2019-03-19 06:09:00-04:00,CX,positive
324161.0,"CEMEX Reports Q4 Sales $3.5B, Up 4% Year Over Year",2019-02-07 06:16:00-05:00,CX,neutral
324162.0,"Stocks Which Set New 52-Week Low The Last Trading Session, Wed., Nov. 21, 2018",2018-11-23 09:09:00-05:00,CX,negative
324163.0,"Stocks Which Set New 52-Week Low Yesterday, October 29th",2018-10-30 12:40:00-04:00,CX,negative
324164.0,"Stocks Which Set New 52-Week Low Friday, October 26th",2018-10-29 09:56:00-04:00,CX,negative
324165.0,"CEMEX Q3 Operating Earnings Before Other Expenses $490M, Operating EBITDA $704M",2018-10-25 07:43:00-04:00,CX,neutral
324166.0,"Stocks Which Set New 52-Week Low Yesterday, October 23rd",2018-10-24 10:06:00-04:00,CX,negative
324167.0,"Stocks Which Set New 52-Week Low Yesterday, October 22nd",2018-10-23 09:54:00-04:00,CX,negative
324168.0,"Cemex Shares Down ~2%, Hearing Citi Out Positive On The Co.",2018-09-04 10:11:00-04:00,CX,positive
324169.0,"Benzinga's Top Upgrades, Downgrades For August 16, 2018",2018-08-16 08:54:00-04:00,CX,positive
324170.0,HSBC Downgrades Cemex to Hold,2018-08-16 06:48:00-04:00,CX,neutral
324171.0,"CEMEX Q2 Net Income $382M, Up 32% Year Over Year, Sales $3.8B, Up 7% Year Over Year",2018-07-26 06:46:00-04:00,CX,neutral
324172.0,25 Stocks Moving In Friday's Pre-Market Session,2018-06-15 08:16:00-04:00,CX,neutral
324173.0,Seeing Notable Block Trade In Cemex Of 2.4M Shares At $5.99 At The Bid,2018-06-04 10:55:00-04:00,CX,negative
324174.0,CEMEX Shares Tick Slightly Lower Following 4M Share Block Trade At $5.91/Share,2018-05-31 10:38:00-04:00,CX,negative
324175.0,"CEMEX Reports CEMEX Ventures Invested In PRYSMEX, No Terms Disclosed",2018-05-16 16:30:00-04:00,CX,negative
324176.0,"Benzinga's Top Upgrades, Downgrades For April 27, 2018",2018-04-27 09:27:00-04:00,CX,positive
324177.0,"Longbow Research Downgrades Cemex, S.A.B. de C.V. Sponsored ADR to Neutral",2018-04-27 07:11:00-04:00,CX,neutral
324178.0,"CEMEX Earlier Reported Q1 Operating EBITDA $545M, Down 4% On YoY Basis",2018-04-26 09:09:00-04:00,CX,neutral
324179.0,"Benzinga's Top Upgrades, Downgrades For April 9, 2018",2018-04-09 09:18:00-04:00,CX,positive
324180.0,"The Market In 5 Minutes: Deutsche Bank, GM, Trump, WrestleMania And More",2018-04-09 09:00:00-04:00,CX,neutral
324181.0,"Bank of America Upgrades Cemex, S.A.B. de C.V. Sponsored ADR to Buy, Raises Price Target to $8.50",2018-04-09 07:29:00-04:00,CX,neutral
324182.0,24 Stocks Moving In Wednesday's Pre-Market Session,2018-03-14 08:11:00-04:00,CX,neutral
324183.0,The Most Attractively Priced Stocks In Leon Cooperman's Portfolio,2018-03-08 11:27:00-05:00,CX,positive
324184.0,"Benzinga's Top Upgrades, Downgrades For February 15, 2018",2018-02-15 10:24:00-05:00,CX,positive
324185.0,"UBS Downgrades Cemex, S.A.B. de C.V. Sponsored ADR to Sell",2018-02-15 06:54:00-05:00,CX,neutral
324186.0,13F From Cooperman's Omega Shows New 1.7M Share Stake In CEMEX,2018-02-14 12:31:00-05:00,CX,positive
324187.0,CEMEX Reports Deal To Raise Participation In Lehigh White Cement Co. For $34M,2018-02-14 11:56:00-05:00,CX,neutral
324188.0,"President Trump Expected to Unveil Budget Plan Including Request For Funds For Infrastructure Today; Watch Stocks and ETFs including: IGF, KMI, USCR, CX, JEC, etc",2018-02-12 06:28:00-05:00,CX,neutral
324189.0,CEMEX Reports Q4 Sales $3.4B vs $3.4B Est.,2018-02-08 06:18:00-05:00,CX,neutral
324190.0,"Earnings Scheduled For February 8, 2018",2018-02-08 04:36:00-05:00,CX,neutral
324191.0,"AT&T, Cemex, Twitter, Taiwan Semiconductor: 'Fast Money' Picks For January 30",2018-01-30 07:43:00-05:00,CX,neutral
324192.0,"Kroger, Valeant, Walmart: 'Fast Money' Picks For January 3",2018-01-03 11:01:00-05:00,CX,neutral
324193.0,Seeing Notable Block Trade In Cemex; 1M Shares at $7.52,2017-12-04 13:30:00-05:00,CX,negative
324194.0,"Cemex Shares Tick Toward Session Highs, Up 1%, Following 2M Share Block Trade At $7.80/Share",2017-11-16 12:50:00-05:00,CX,positive
324195.0,"Benzinga's Top Upgrades, Downgrades For October 23, 2017",2017-10-23 09:19:00-04:00,CX,positive
324196.0,"Citigroup Upgrades Cemex, S.A.B. de C.V. Sponsored ADR to Buy",2017-10-23 07:43:00-04:00,CX,neutral
324197.0,28 Stocks Moving In Friday's Pre-Market Session,2017-10-13 08:03:00-04:00,CX,neutral
324198.0,"Seeing Notable Block Trade In Cemex; 1M Shares At $8.34, Above The Ask",2017-10-11 11:58:00-04:00,CX,negative
324199.0,Cemex Sells 9.47% Stake in GCC,2017-09-28 04:43:00-04:00,CX,neutral
324200.0,A Lack Of Catalysts Sinks Cemex Rating,2017-08-29 10:44:00-04:00,CX,negative
324201.0,"Benzinga's Top Upgrades, Downgrades For August 29, 2017",2017-08-29 09:19:00-04:00,CX,positive
324202.0,"Bank of America Downgrades Cemex, S.A.B. de C.V. Sponsored ADR to Neutral",2017-08-29 08:34:00-04:00,CX,neutral
324203.0,Seeing Notable Block Trade In Cemex SAB de CV Of 1.2M Shares At $9.06/Share,2017-08-24 13:19:00-04:00,CX,negative
324204.0,"CEMEX Q2 Sales $3.6B vs $3.7B Est., Net Income $289M",2017-07-26 06:24:00-04:00,CX,neutral
324205.0,Benzinga's Option Alert Recap From July 18,2017-07-18 16:17:00-04:00,CX,positive
324206.0,CX Option Alert: Oct 20 $10 Calls Sweep (2) at the Bid: 1347 @ $0.57 vs 1127 OI; Ref=$9.78,2017-07-18 12:16:00-04:00,CX,positive
324207.0,Watch These 7 Huge Call Purchases In Wednesday Trade,2017-07-12 04:26:00-04:00,CX,positive
324208.0,Benzinga's Option Alert Recap From July 11,2017-07-11 16:20:00-04:00,CX,positive
324209.0,CX Option Alert: Aug 18 $11 Calls Sweep (21) at the Ask: 5000 @ $0.13 vs 405 OI; Ref=$10.15,2017-07-11 10:05:00-04:00,CX,positive
324210.0,CEMEX Finalizes Divestment of Its Pacific Northwest Materials Business in the U.S. For ~$150M,2017-06-30 16:32:00-04:00,CX,neutral
324215.0,CEMEX Q1 Sales $3.1B vs $3.2B Est,2017-04-27 08:49:00-04:00,CX,neutral
324216.0,"Earnings Scheduled For April 26, 2017",2017-04-26 04:51:00-04:00,CX,neutral
324217.0,EU Rules That Cemex Cannot Sell its Croatian Operation,2017-04-05 06:24:00-04:00,CX,neutral
324218.0,EU Rules Cemex Cannot Sell its Croatian Operations,2017-04-05 06:23:00-04:00,CX,neutral
324219.0,"Morgan Stanley Upgrades Cemex, S.A.B. de C.V. Sponsored ADR to Overweight, Announces $11.00 Price Target",2017-04-04 08:43:00-04:00,CX,negative
324220.0,"Benzinga's Top Upgrades, Downgrades For March 31, 2017",2017-03-31 09:58:00-04:00,CX,positive
324221.0,"Longbow Research Upgrades Cemex, S.A.B. de C.V. Sponsored ADR to Buy, Announces $12.00 Price Target",2017-03-31 08:41:00-04:00,CX,neutral
324222.0,"Cemex Launches Venture Capital Unit ""CEMEX Ventures""",2017-03-14 17:00:00-04:00,CX,neutral
324223.0,Hundreds Of Companies Bid To Build Trump's Security Wall,2017-03-03 08:20:00-05:00,CX,positive
324224.0,Watch These 8 Huge Call Purchases In Wednesday Trade,2017-03-01 04:12:00-05:00,CX,positive
324225.0,Benzinga's Option Alert Recap From February 28,2017-02-28 17:07:00-05:00,CX,positive
324226.0,Option Alert: Cemex Mar 9.0 Calls Sweep: 669 @  ASK  $0.16: 26k traded vs 5650 OI:  Earnings 4/26 Before Open (est)  $8.48 Ref,2017-02-28 15:29:00-05:00,CX,positive
324227.0,CEMEX Expects Proceeds from Sale of Shares of Grupo Cementos De Chinhuahua of $240M,2017-02-10 06:39:00-05:00,CX,positive
324228.0,"Cemex Reports Q4 Operating Earnings Before Other Expenses $453M, Operating EBITDA $654M",2017-02-09 06:19:00-05:00,CX,neutral
324229.0,Meet The Entrepreneur Who Destroyed And Rebuilt Investment Fund Trading,2017-02-08 13:37:00-05:00,CX,negative
324230.0,CEMEX and QUIKRETE Finalize Sale of U.S. Reinforced Concrete Pipe Manufacturing Business For ~$500M,2017-01-31 17:30:00-05:00,CX,neutral
324231.0,CEMEX to Sell ~76.5M Shares of Grupo Cementos de Chihuahua for 95 Pesos to 115 Pesos,2017-01-25 06:34:00-05:00,CX,positive
324232.0,CEMEX Subsidiary Announces Successful Offer and Take-over Bid of Trinidad Cement Limited For $0.76/Share Cash,2017-01-24 18:00:00-05:00,CX,positive
324233.0,CEMEX Increases Bid for Trinidaad Cement to $101M,2017-01-09 06:37:00-05:00,CX,neutral
324234.0,Watch These 5 Huge Call Purchases In Monday Trade,2017-01-09 04:17:00-05:00,CX,positive
324235.0,Option Alert: Cemex Feb 9.0 Calls Sweep: 2500 @  ASK  $0.14: 2500 traded vs 467 OI:  Earnings 2/9 Before Open  $8.00 Ref,2017-01-06 09:43:00-05:00,CX,positive
324236.0,"Top Performing Industries For December 8, 2016",2016-12-08 15:13:00-05:00,CX,positive
324237.0,"Another Election, Another Rapid Boom In Infrastructure",2016-12-05 16:58:00-05:00,CX,neutral
324238.0,CEMEX Announces Take-over Bid for Trinidad Cement Limited at 33.1% Premium,2016-12-05 06:34:00-05:00,CX,negative
324239.0,"Top Performing Industries For November 21, 2016",2016-11-21 11:52:00-05:00,CX,positive
324240.0,"Bank of America Downgrades Cemex, S.A.B. de C.V. Sponsored ADR to Neutral",2016-11-09 11:12:00-05:00,CX,neutral
324241.0,"Disney, Silver And More: Fast Money Picks For November 8",2016-11-08 06:33:00-05:00,CX,neutral
324242.0,Fast Money Traders Share Their Picks Ahead Of The Election,2016-11-08 06:31:00-05:00,CX,positive
324243.0,"Top Performing Industries For November 7, 2016",2016-11-07 10:48:00-05:00,CX,positive
324244.0,Barron's: Stock Pickers Are Leading The Charge,2016-11-06 19:49:00-05:00,CX,neutral
324245.0,"Worst Performing Industries For November 4, 2016",2016-11-04 11:10:00-04:00,CX,negative
324246.0,"Worst Performing Industries For November 1, 2016",2016-11-01 11:14:00-04:00,CX,negative
324247.0,Trump Or Clinton: Who Would Create More Jobs?,2016-10-27 09:50:00-04:00,CX,positive
324248.0,CEMEX Q3 Revenue $3.6B vs $3.7B Est,2016-10-27 06:20:00-04:00,CX,neutral
324249.0,"Top Performing Industries For October 17, 2016",2016-10-17 11:05:00-04:00,CX,positive
324250.0,"Worst Performing Industries For October 12, 2016",2016-10-12 11:05:00-04:00,CX,negative
324251.0,"Top Performing Industries For October 10, 2016",2016-10-10 10:50:00-04:00,CX,positive
324252.0,Jim Strugger's Cemex Trade,2016-09-26 17:46:00-04:00,CX,neutral
324253.0,"Worst Performing Industries For September 16, 2016",2016-09-16 11:04:00-04:00,CX,negative
324254.0,"Worst Performing Industries For September 13, 2016",2016-09-13 11:17:00-04:00,CX,negative
324255.0,UPDATE: Eagle Materials is the Acquirer of Cemex's Ohio Plant for $400M,2016-09-12 06:36:00-04:00,CX,neutral
324256.0,"CEMEX To Sell Ohio Plant for $400M, EBITDA for Divested Assets is $33M",2016-09-12 06:31:00-04:00,CX,positive
324257.0,"Worst Performing Industries For September 9, 2016",2016-09-09 11:57:00-04:00,CX,negative
324258.0,Benzinga's  Top Initiations,2016-09-06 09:24:00-04:00,CX,positive
324259.0,"Goldman Sachs Initiates Coverage on Cemex at Buy, Announces $10.40 PT",2016-09-06 08:46:00-04:00,CX,neutral
324260.0,Benzinga's Top Initiations,2016-09-02 09:34:00-04:00,CX,positive
324261.0,CEMEX To Own 23% of Grupo Cementos de Chihuahua As Part of GCC Restructuring,2016-08-29 06:36:00-04:00,CX,neutral
324262.0,CEMEX To Receive $306M For Assets Sold to GCC,2016-08-29 06:35:00-04:00,CX,positive
324263.0,Cramer Gives His Opinion On The Housing Sector,2016-08-25 06:38:00-04:00,CX,neutral
324264.0,"Worst Performing Industries For August 19, 2016",2016-08-19 11:29:00-04:00,CX,negative
324265.0,What Cemex Needs To Do For Morgan Stanley To Turn Bullish,2016-08-15 10:55:00-04:00,CX,neutral
324266.0,Stocks Hitting 52-Week Highs,2016-08-15 10:19:00-04:00,CX,neutral
324267.0,Benzinga's Top Downgrades,2016-08-15 09:14:00-04:00,CX,positive
324268.0,Santander Downgrades Cemex to Hold,2016-08-15 07:53:00-04:00,CX,neutral
324269.0,"Top Performing Industries For August 10, 2016",2016-08-10 10:48:00-04:00,CX,positive
324270.0,"Top Performing Industries For August 9, 2016",2016-08-09 10:54:00-04:00,CX,positive
324271.0,Option Alert: CX Jan17 8.0 Calls Sweep: 677 @  ASK  $0.65: 3464 traded vs 2144 OI:  Earnings today Before Open  $7.23 Ref,2016-07-27 14:11:00-04:00,CX,positive
324272.0,"Top Performing Industries For July 27, 2016",2016-07-27 10:55:00-04:00,CX,positive
324273.0,CEMEX Q2 Revenue $3.7B vs $3.7B est,2016-07-27 06:17:00-04:00,CX,neutral
324274.0,"Worst Performing Industries For July 19, 2016",2016-07-19 11:10:00-04:00,CX,negative
324275.0,"Top Performing Industries For July 11, 2016",2016-07-11 11:07:00-04:00,CX,positive
324276.0,"Top Performing Industries For July 7, 2016",2016-07-07 10:56:00-04:00,CX,positive
324277.0,"CEMEX Holdings Philippines Prices 2,032,980,830 Shares IPO @10.75 Philippine Pesos/Share",2016-06-30 04:26:00-04:00,CX,positive
324278.0,"Worst Performing Industries For June 24, 2016",2016-06-24 11:41:00-04:00,CX,negative
324279.0,"Jim Cramer Advises Viewers On Cemex, Northstar Realty Finance And Cypress Semiconductor",2016-06-21 06:22:00-04:00,CX,neutral
324280.0,CEMEX Subsidiary in the Philippines Receives Pre-Effective Approval for Sale of a Minority Stake in Its Capital Stock,2016-06-20 06:31:00-04:00,CX,positive
324281.0,"Top Performing Industries For June 7, 2016",2016-06-07 10:57:00-04:00,CX,positive
324282.0,"Top Performing Industries For May 16, 2016",2016-05-16 10:51:00-04:00,CX,positive
324283.0,"JP Morgan Bullish On Mexican Housing Market, Expects Residential 'Self-Construction' To Drive Strong Cement Demand",2016-05-12 15:17:00-04:00,CX,positive
324284.0,"Worst Performing Industries For May 9, 2016",2016-05-09 12:02:00-04:00,CX,negative
324285.0,"Worst Performing Industries For May 3, 2016",2016-05-03 11:18:00-04:00,CX,negative
324286.0,Cemex Strikes Deal To Sell Some Assets To Grupco Cementos For $400 Million,2016-05-02 07:03:00-04:00,CX,negative
324287.0,CEMEX Announces Sale of US Assets for $400M,2016-05-02 06:30:00-04:00,CX,positive
324288.0,"Citigroup Reinstates Neutral on Cemex, Raises PT to $8.30",2016-04-26 23:40:00-04:00,CX,neutral
324289.0,"Barclays Upgrades Cemex to Overweight, Raises PT to $10.00, CItes 'impressive value generation in the first quarter'",2016-04-21 10:00:00-04:00,CX,positive
324290.0,"CEMEX Q1 EPS $0.03 vs ($0.04) est, First Positive Net Income in 7 Years",2016-04-21 06:17:00-04:00,CX,positive
324291.0,CEMEX Q1 Revenue $3.2B vs $3.3B est,2016-04-21 06:15:00-04:00,CX,neutral
324292.0,Scotiabank Downgrades Cemex to Sector Perform,2016-04-06 10:01:00-04:00,CX,neutral
324293.0,"Top Performing Industries For March 31, 2016",2016-03-31 10:43:00-04:00,CX,positive
324294.0,"Top Performing Industries For March 21, 2016",2016-03-21 10:38:00-04:00,CX,positive
324295.0,BB&T Capital Upgrades Cemex to Buy,2016-03-21 07:55:00-04:00,CX,neutral
324296.0,Benzinga's Top Upgrades,2016-03-18 09:34:00-04:00,CX,positive
324297.0,"Credit Suisse Upgrades Cemex to Outperform, Raises PT to $7.80",2016-03-18 07:43:00-04:00,CX,positive
324298.0,"Worst Performing Industries For March 15, 2016",2016-03-15 11:49:00-04:00,CX,negative
324299.0,Cemex CEO Looking to Sell Minority Stake in Philippine Unit as Market Conditions Permit -Reuters,2016-03-14 12:44:00-04:00,CX,neutral
324301.0,"Top Performing Industries For March 9, 2016",2016-03-09 10:31:00-05:00,CX,positive
324302.0,"Worst Performing Industries For March 8, 2016",2016-03-08 11:34:00-05:00,CX,negative
324303.0,Mexico Stock Exchange Resumes Trading,2016-02-26 13:09:00-05:00,CX,neutral
324304.0,"Top Performing Industries For February 22, 2016",2016-02-22 10:32:00-05:00,CX,positive
324305.0,"Top Performing Industries For February 17, 2016",2016-02-17 10:31:00-05:00,CX,positive
324306.0,"Worst Performing Industries For February 8, 2016",2016-02-08 11:12:00-05:00,CX,negative
324307.0,"Top Performing Industries For February 4, 2016",2016-02-04 10:38:00-05:00,CX,positive
324308.0,Citigroup Upgrades Cemex to Buy,2016-02-02 09:36:00-05:00,CX,neutral
324309.0,"Worst Performing Industries For February 1, 2016",2016-02-01 11:14:00-05:00,CX,negative
324310.0,Jefferies Upgrades Cemex to Buy,2016-01-29 06:38:00-05:00,CX,neutral
324311.0,"Worst Performing Industries For January 25, 2016",2016-01-25 12:16:00-05:00,CX,negative
324312.0,Option Alert: CX Jun16 5.0 Puts Sweep: 1455 @  ASK  $1.26: 1653 traded vs 177 OI:  Earnings 2/4  $4.11 Ref,2016-01-25 11:10:00-05:00,CX,positive
324313.0,"Worst Performing Industries For January 20, 2016",2016-01-20 11:18:00-05:00,CX,negative
324314.0,"Worst Performing Industries For January 15, 2016",2016-01-15 11:06:00-05:00,CX,negative
324315.0,"Worst Performing Industries For January 8, 2016",2016-01-08 11:33:00-05:00,CX,negative
324316.0,"Macquarie Downgrades Cemex to Neutral, Lowers PT to $7.30",2016-01-08 06:19:00-05:00,CX,negative
324317.0,"Top Performing Industries For December 23, 2015",2015-12-23 10:55:00-05:00,CX,positive
324318.0,"Top Performing Industries For December 15, 2015",2015-12-15 10:32:00-05:00,CX,positive
324319.0,"Credit Suisse Downgrades Cemex, Sees Vulnerability From Leverage And Currency Mismatch",2015-12-14 09:02:00-05:00,CX,positive
324320.0,"Credit Suisse Downgrades Cemex to Neutral, Lowers PT to $6.00",2015-12-13 21:00:00-05:00,CX,positive
324321.0,"Worst Performing Industries For December 11, 2015",2015-12-11 12:20:00-05:00,CX,negative
324322.0,Ignacio Madridejos Fernández Named President of CEMEX USA.,2015-12-02 04:14:00-05:00,CX,neutral
324323.0,"Top Performing Industries For November 30, 2015",2015-11-30 10:37:00-05:00,CX,positive
324324.0,"Top Performing Industries For November 20, 2015",2015-11-20 10:52:00-05:00,CX,positive
324325.0,"Top Performing Industries For November 17, 2015",2015-11-17 10:59:00-05:00,CX,positive
324326.0,Mid-Day Market Update: Starwood Drops Following Announcement of Acquisition Deal With Marriott; Sunoco Shares Gain,2015-11-16 12:16:00-05:00,CX,positive
324327.0,"Worst Performing Industries For November 6, 2015",2015-11-06 11:19:00-05:00,CX,negative
324328.0,"Barclays Downgrades Cemex to Equal-weight, Lowers PT to $9.00",2015-10-23 05:03:00-04:00,CX,negative
324329.0,Cemex SAB De CV Reports Q3 Revs $3.7B Vs Est $3.98B,2015-10-22 06:50:00-04:00,CX,neutral
324330.0,"Worst Performing Industries For October 19, 2015",2015-10-19 11:26:00-04:00,CX,negative
324331.0,"Top Performing Industries For October 14, 2015",2015-10-14 10:33:00-04:00,CX,positive
324332.0,"Top Performing Industries For October 7, 2015",2015-10-07 10:50:00-04:00,CX,positive
324333.0,"Top Performing Industries For September 29, 2015",2015-09-29 10:48:00-04:00,CX,positive
324334.0,"Worst Performing Industries For September 24, 2015",2015-09-24 14:26:00-04:00,CX,negative
324335.0,"Worst Performing Industries For September 23, 2015",2015-09-23 11:13:00-04:00,CX,negative
324336.0,"Latin American ADRs Getting Slaughtered, Brazilian Real And Crude Continue To Tumble",2015-09-22 16:28:00-04:00,CX,negative
324337.0,"Worst Performing Industries For September 22, 2015",2015-09-22 11:41:00-04:00,CX,negative
324338.0,"Worst Performing Industries For September 17, 2015",2015-09-17 11:21:00-04:00,CX,negative
324339.0,"Worst Performing Industries For September 1, 2015",2015-09-01 11:21:00-04:00,CX,negative
324340.0,CEMEX Completes First Phase of Construction of Cement Grinding Plant in Nicaragua,2015-08-28 04:36:00-04:00,CX,neutral
324341.0,"Worst Performing Industries For August 21, 2015",2015-08-21 12:48:00-04:00,CX,negative
324342.0,Option Alert: Cemex Oct $10 Call; Vol 8067 vs 5899 OI; Now $9.11,2015-07-22 10:45:00-04:00,CX,positive
324343.0,Option Alert: Cemex Aug $10 Call Sweep; 3000 Contracts @Ask @$0.24,2015-07-02 11:39:00-04:00,CX,positive
324344.0,"Worst Performing Industries For June 1, 2015",2015-06-01 11:56:00-04:00,CX,negative
324345.0,Longbow: Time To Buy Cemex SAB,2015-05-27 10:25:00-04:00,CX,neutral
324346.0,Benzinga's Top Upgrades,2015-05-27 09:12:00-04:00,CX,positive
324347.0,Longbow Research Upgrades Cemex To Buy,2015-05-27 08:19:00-04:00,CX,neutral
324348.0,"Longbow Research Upgrades Cemex to Buy, Announces $12.00 PT",2015-05-27 06:58:00-04:00,CX,neutral
324349.0,"Top Performing Industries For April 22, 2015",2015-04-22 10:34:00-04:00,CX,positive
324350.0,"Worst Performing Industries For March 19, 2015",2015-03-19 11:16:00-04:00,CX,negative
324351.0,"Top Performing Industries For March 12, 2015",2015-03-12 11:01:00-04:00,CX,positive
324352.0,Cemex Launches CEMEX Energia,2015-02-19 08:34:00-05:00,CX,neutral
324354.0,"Notable Option Activity For February 9: HIMX, CX, FNSR, WMB, OLN, NCR, MSFT",2015-02-09 15:35:00-05:00,CX,neutral
324355.0,Option Alert: Cemex Feb $10 Call; 3469 Contract Trade at Ask @$0.39; Now $10.10,2015-02-09 13:32:00-05:00,CX,positive
324356.0,UPDATE: Cemex Latam Net Sales Fell 13% to $400 vs Q4 2013,2015-02-04 12:06:00-05:00,CX,neutral
324357.0,CX Shares Resume Now Trading Down 2.1%,2015-02-04 12:05:00-05:00,CX,positive
324358.0,"Cemex Latam Holdings, Subsidiary of Cemex, Reports Net Profit of $64M in Q4; +144% vs Prior Year",2015-02-04 12:04:00-05:00,CX,positive
324359.0,CX Shares Halted News Pending,2015-02-04 10:25:00-05:00,CX,positive
324360.0,Optiin Alert: Cemex Feb $10 Call; 3164 Contract Trade at Ask @$0.21; Now $9.39,2015-01-29 13:53:00-05:00,CX,positive
324361.0,CEMEX Closes Series of Transactions With Holcim,2015-01-06 05:01:00-05:00,CX,neutral
324362.0,"Option Alert: Cemex Jan $13 Call; 2,500 Contract Trade at Ask @$0.24; Currently $12.23",2014-11-04 13:20:00-05:00,CX,positive
324363.0,CEMEX Increases New Bank Loan to U.S.$1.87 Billion and Successfully Concludes Amendment to Facilities Agreement ,2014-11-03 17:21:00-05:00,CX,positive
324364.0,"CEMEX, Holcim Sign Agreements on Previously Announced Transactions in Europe ",2014-10-30 05:07:00-04:00,CX,positive
324365.0,"Jefferies Maintains Hold on Cemex S.A.B. de C.V., Lowers PT to $12.80",2014-10-20 08:38:00-04:00,CX,negative
324366.0,CEMEX Announces Expiration And Final Settlement Of Its Tender Offer For Certain Senior Secured Notes,2014-10-02 09:08:00-04:00,CX,positive
324367.0,CEMEX to Construct New CLH Cement Plant in Colombia ,2014-08-14 12:42:00-04:00,CX,neutral
324368.0,"Reuters Reports EU Antitrust Regulators Will Approve Cemex Proposed Acquisition of Holcim's Spanish Units, According to Source",2014-08-04 11:00:00-04:00,CX,neutral
324369.0,Morgan Stanley Does Not See Near-Term Catalysts For Cemex SAB de CV,2014-07-03 08:13:00-04:00,CX,neutral
324370.0,"Option Alert: Cemex Oct $14 Call; 10,100 Contracts Traded vs 3,873 OI; Currently $13.54",2014-07-02 16:03:00-04:00,CX,positive
324371.0,700K Share Block Trade in Cemex @$13.15 at 11:23 AM ET,2014-06-25 11:54:00-04:00,CX,negative
324372.0,900K Share Block Trade in Cemex @$13.26 at 11:46 AM ET,2014-06-24 11:47:00-04:00,CX,negative
324373.0,"Option Alert: Cemex Jul $14 Call; 14,898 Contracts Traded vs 536 OI; Currently $13.45",2014-06-10 14:52:00-04:00,CX,positive
324374.0,"Option Alert: Cemex Jan 2016 $15 Call; 7,000 Contracts Traded vs 6 OI; Currently $12.50",2014-05-19 14:11:00-04:00,CX,positive
324375.0,"Cemex Names Fernando A. Gonzalez as CEO, Rogelio Zambrano as Chairman",2014-05-15 19:23:00-04:00,CX,neutral
324376.0,Market Wrap For May 13: Markets Close Again At Record Highs,2014-05-13 16:36:00-04:00,CX,neutral
324377.0," Cemex Announces CEO, Chairman Lorenzo Zambrano Has Passed Away, Operations Will Continue as Normal - Bloomberg",2014-05-12 18:19:00-04:00,CX,neutral
324378.0,Top 4 NYSE Stocks In The Cement Industry With The Highest Revenue,2014-04-16 04:35:00-04:00,CX,positive
324379.0,UPDATE: Lafarge Holcim to Merge; Merged Company to Be Named LafargeHolcim; Companies to Discuss Anti-Trust Issues with EC,2014-04-07 06:56:00-04:00,CX,neutral
324380.0,Benzinga's Weekend M&A Chatter,2014-04-06 21:15:00-04:00,CX,neutral
324381.0,UPDATE: Holcim Confirms Merger Talks With Lafarge; Says No Agreement Reached Yet,2014-04-04 11:03:00-04:00,CX,positive
324382.0,Holcim Confirms Advanced M&A Talks with Lafarge - Bloomberg,2014-04-04 10:59:00-04:00,CX,positive
324383.0,"UPDATE: Cemex Share Move Related to Rumor of M&A Between Holcim, Lafarge",2014-04-04 10:05:00-04:00,CX,positive
324384.0,UPDATE: Cemex Shares Spike Higher; May be Attributed to Unconfirmed Merger Chatter,2014-04-04 10:04:00-04:00,CX,positive
324385.0,Cemex Spikes Higher,2014-04-04 10:02:00-04:00,CX,neutral
324386.0,"Option Alert: Cemex Jan $15 Call; 15,000 Contract Trade Between Bid and Ask @$0.66; Currently $12.43",2014-03-13 15:50:00-04:00,CX,positive
324387.0,Sterne Agee Upgrades Cemex S.A.B. de C.V. to Buy,2014-02-19 08:51:00-05:00,CX,neutral
324388.0,Morgan Stanley Remains Bullish On Cemex Following Company Analyst Day,2014-02-14 08:51:00-05:00,CX,neutral
324389.0,"Credit Suisse Maintains Outperform on Cemex S.A.B. de C.V., Raises PT to $15.20",2014-01-24 07:21:00-05:00,CX,positive
324390.0,Morgan Stanley Maintains on Cemex,2014-01-22 07:54:00-05:00,CX,neutral
324391.0,"Option Alert: Cemex January 2015 $13 / January 2015 $15 Call; 10,000 Contract Trade Between Bid and Ask @$0.68 Currently $12.17",2014-01-09 15:52:00-05:00,CX,positive
324392.0,"Option Alert: Cemex January 2014 $13 / January 2015 $15 Call Spread; 10,000 Spread Contract Trade; Currently $10.65",2013-11-22 15:48:00-05:00,CX,positive
324393.0,"Option Alert: Cemex April 11 Put; 10,000 Contracts Traded @$1.12; Currently $10.91",2013-10-24 14:53:00-04:00,CX,positive
324394.0,EU to investigate Holcim Takeover of Cemex Operations in Germany -Reuters,2013-10-22 06:21:00-04:00,CX,neutral
324395.0,"Option Alert: Cemex January 2015 14.42 Call; 14,634 Contracts Traded @$0.66; Currently $10.72",2013-10-14 13:14:00-04:00,CX,positive
324396.0,Top 4 NYSE Stocks In The Cement Industry With The Highest Operating Margin,2013-09-24 05:01:00-04:00,CX,positive
324397.0,"CEMEX, Holcim Agree to Series of Transactions in Europe",2013-08-28 06:01:00-04:00,CX,positive
324398.0,Benzinga's Top Initiations,2013-08-12 07:50:00-04:00,CX,positive
324399.0,"Exane BNP Paribas Initiates Coverage on Cemex S.A.B. de C.V. at Outperform, Announces $14.00 PT",2013-08-12 07:28:00-04:00,CX,neutral
324400.0,Citigroup Upgrades Cemex S.A.B. de C.V. to Buy,2013-08-12 07:28:00-04:00,CX,neutral
324401.0,UBS Upgrades Cemex S.A.B. de C.V. to Buy,2013-07-25 09:50:00-04:00,CX,neutral
324402.0,"Cemex S.A.B. de C.V. Reports Q2 Revenue of $4.0B vs $3.97B Est, EBITDA of $451 Million",2013-07-25 07:36:00-04:00,CX,neutral
324403.0,UPDATE: Jefferies Lowers PT on Cemex Following Reduced Estimates,2013-07-10 10:24:00-04:00,CX,negative
324404.0,"Jefferies Maintains Buy on Cemex S.A.B. de C.V., Lowers PT to $12.30",2013-07-10 07:26:00-04:00,CX,negative
324405.0,Morgan Stanley Upgrades Cemex S.A.B. de C.V. to Overweight,2013-06-25 08:17:00-04:00,CX,negative
324406.0,Barclays Upgrades Cemex to Overweight,2013-06-19 07:44:00-04:00,CX,negative
324407.0,Top 4 NYSE Stocks In The Cement Industry With The Highest EPS Estimates For The Next Quarter,2013-05-06 04:20:00-04:00,CX,positive
324408.0,Top 4 NYSE Stocks In The Cement Industry With The Highest Operating Margin,2013-04-30 04:20:00-04:00,CX,positive
324409.0,Potential Bullish Setups to Watch Next Week,2013-04-08 10:50:00-04:00,CX,neutral
324410.0,UPDATE: Bank of America Raises PT on Cemex on Higher Earnings,2013-03-13 09:18:00-04:00,CX,neutral
324411.0,"Bank of America Maintains Buy on Cemex S.A.B. de C.V., Raises PT to $13.75",2013-03-13 08:40:00-04:00,CX,neutral
324412.0,Standpoint Research Downgrades Cemex S.A.B. de C.V. to Hold,2013-01-25 14:21:00-05:00,CX,neutral
324413.0,"UPDATE: Jefferies & Company Reiterates Buy Rating, Raises PT on Cemex",2013-01-16 09:57:00-05:00,CX,neutral
324414.0,"Jefferies Maintains Buy on Cemex S.A.B. de C.V., Raises PT to $13.00",2013-01-16 08:51:00-05:00,CX,neutral
324415.0,Top 4 NYSE Stocks In The Cement Industry With The Highest Operating Margin,2013-01-11 03:26:00-05:00,CX,positive
324416.0,"Texas Industries Earnings Preview: Narrower Loss, Revenue Growth Expected",2013-01-07 13:13:00-05:00,CX,positive
324417.0,"Barclays Maintains Cemex at Equal-weight, Raises PT from $8 to $10",2012-11-14 14:03:00-05:00,CX,neutral
324418.0,"CEMEX Prices IPO of  Subsidiary, CEMEX Latam Holdings, S.A. ",2012-11-07 06:10:00-05:00,CX,neutral
324419.0,CEMEX to Participate in $300M Clean Energy Fund ,2012-10-30 09:12:00-04:00,CX,positive
324420.0,"CEMEX Announces Offering by CEMEX Latam Holdings, S.A. ",2012-10-19 06:58:00-04:00,CX,neutral
324421.0,IBM Earnings Preview: Another Revenue Decline Expected,2012-10-15 10:21:00-04:00,CX,neutral
324422.0,UPDATE: Cemex Reports Narrower Third-Quarter Loss,2012-10-15 08:27:00-04:00,CX,negative
324423.0,Cemex Reports Q3  Revenues $$3.9B vs $3.95B Est,2012-10-15 07:56:00-04:00,CX,neutral
324424.0,"US Stock Futures Up; Citigroup Earnings, Retail Sales Data In Focus",2012-10-15 06:02:00-04:00,CX,neutral
324425.0,"Earnings Scheduled For October 15, 2012",2012-10-15 02:04:00-04:00,CX,neutral
324426.0,"Earnings for Monday October 15, 2012 Pre-Market",2012-10-14 17:32:00-04:00,CX,neutral
324427.0,Top 4 NYSE Stocks In The Cement Industry With The Highest Cash,2012-10-03 03:22:00-04:00,CX,positive
324428.0,CEMEX Announces Completion of Refinancing of $6.155B in Loans and $500M in Notes,2012-09-17 09:03:00-04:00,CX,neutral
324429.0,CEMEX Says Completing Refinancing,2012-09-17 09:01:00-04:00,CX,neutral
324430.0,Top 4 NYSE Stocks In The Cement Industry With The Highest Operating Margin,2012-09-14 04:22:00-04:00,CX,positive
324431.0,CEMEX Reaffirms Commitment to Neoris   ,2012-09-04 08:08:00-04:00,CX,positive
324432.0,UPDATE: Jefferies Raises PT to $9.70 on Cemex on Profitability Improvement  ,2012-08-29 13:09:00-04:00,CX,positive
324433.0,"Jefferies & Company Maintains Cemex at Buy, Raises PT from $9 to $9.70",2012-08-29 06:10:00-04:00,CX,neutral
324434.0,"UPDATE: Imperial Capital Upgrades Cemex to In-Line, Raises PT",2012-08-27 10:10:00-04:00,CX,neutral
324435.0,"Imperial Capital Upgrades Cemex from Underperform to In-Line, Raises PT from $3.50 to $7",2012-08-27 08:53:00-04:00,CX,neutral
324436.0,Benzinga's Top Upgrades,2012-08-22 07:58:00-04:00,CX,positive
324437.0,CEMEX Subsidiary Presents Application to Colombian Authorities for Potential Sale of a Minority Stake in Its Latin American Assets ,2012-08-21 20:01:00-04:00,CX,positive
324438.0,CEMEX Signs Strategic Agreement With IBM to Provide Business Process Outsourcing And IT Services ,2012-07-30 09:02:00-04:00,CX,positive
324439.0,Top 4 Stocks In The Cement Industry With The Highest ROA,2012-07-11 02:53:00-04:00,CX,positive
324440.0,House Approves $120 Billion Highway Bill Extending Transportation Funding Through Fiscal 2014,2012-06-29 13:26:00-04:00,CX,positive
324441.0,Cemex Presents Refinancing Proposal to Its Lenders under Its Financing Agreement   ,2012-06-29 09:20:00-04:00,CX,positive
324442.0,Mexico's Cemex Predicts Cement Sales Will Grow 2% In 2012,2012-04-26 10:54:00-04:00,CX,neutral
324443.0,Top 4 NYSE Stocks In The Cement Industry With The Highest Revenue,2012-04-26 03:13:00-04:00,CX,positive
324444.0,CEMEX Announces Results of Exchange Offers for Its 2014 Eurobonds and Perpetual Securities   ,2012-03-26 09:02:00-04:00,CX,positive
324445.0,Notable Call Options Activity in CEMEX,2012-03-06 12:55:00-05:00,CX,neutral
324446.0,CEMEX Announces Exchange Offers for Its 2014 Eurobonds and Perpetual Securities,2012-02-27 09:19:00-05:00,CX,positive
324447.0,"Mexico's Antitrust Commission Fines Cemex, Company To Appeal -DJ",2012-02-14 16:39:00-05:00,CX,neutral
324448.0,The Real Deal on Wall Street: Markets Twist China Inflation News,2012-02-10 05:15:00-05:00,CX,neutral
324449.0,Scotia Capital Raises PT on Cemex to $8,2012-02-06 08:41:00-05:00,CX,neutral
324450.0,Deutsche Bank Upgrades Cemex to Buy,2012-02-02 10:04:00-05:00,CX,neutral
324451.0,"Financial Breakfast: Morning News Summary for February 1, 2012",2012-02-01 07:26:00-05:00,CX,neutral
324452.0,UPDATE: Bank of America Upgrades Cemex to Buy,2012-01-31 11:54:00-05:00,CX,neutral
324453.0,Bank of America Upgrades Cemex to Buy,2012-01-31 07:53:00-05:00,CX,neutral
324454.0,"Fast Money Picks For January 24th (CX, IDCC)",2012-01-23 19:28:00-05:00,CX,neutral
324455.0,Notable Put Options Activity on CEMEX,2011-12-28 15:37:00-05:00,CX,neutral
324456.0,CEMEX Breaks Out; How to Play It,2011-12-22 14:36:00-05:00,CX,positive
324457.0,Top Performing Industries For December 22,2011-12-22 12:45:00-05:00,CX,positive
324458.0,UPDATE: Sterne Agee Initiates Neutral on CEMEX ,2011-12-06 09:24:00-05:00,CX,neutral
324459.0,Sterne Agee Initiates CEMEX at Neutral (Yesterday),2011-12-06 07:47:00-05:00,CX,neutral
324460.0,CEMEX and Venezuela Sign Agreement on Compensation for Nationalization of CEMEX Venezuela,2011-12-01 10:53:00-05:00,CX,positive
324461.0,"End-of-Day Market Summary for November 28, 2011",2011-11-28 16:14:00-05:00,CX,neutral
324462.0,Afternoon Movers; All Sectors Higher,2011-11-28 15:51:00-05:00,CX,neutral
324463.0,Scotia Capital Has Sector Perform on CEMEX,2011-10-21 08:44:00-04:00,CX,neutral
324464.0,CEMEX Completes Debt Prepayment Strategy   ,2011-10-19 10:42:00-04:00,CX,negative
324465.0,UPDATE: Cemex Says it Has Nothing to Disclose After Surge in Stock price,2011-10-12 14:36:00-04:00,CX,neutral
324466.0,Hearing Cemex Shares in Mexico Have Been Halted,2011-10-12 14:12:00-04:00,CX,positive
324467.0,Cemex Spiking Higher on Heavy Volume,2011-10-12 14:10:00-04:00,CX,neutral
324468.0,Resistance  10-05-2011,2011-10-05 19:02:00-04:00,CX,neutral
324469.0,Market Doing Laundry  09-30-2011,2011-10-03 15:32:00-04:00,CX,neutral
324470.0,Notable Put Options Activity in Cemex SAB de CV,2011-09-20 16:41:00-04:00,CX,neutral
324471.0,Benzinga's Top Downgrades,2011-09-19 07:41:00-04:00,CX,positive
324472.0,How To Play President Obama's Speech,2011-09-08 14:56:00-04:00,CX,positive
324473.0,"Benzinga's Top ETF Gainers, August 31st (EDC, LBJ, UBR, TMV)",2011-08-31 19:17:00-04:00,CX,positive
324474.0,Market Vertigo  08-10-2011,2011-08-15 15:03:00-04:00,CX,neutral
324475.0,"Red Light, Green Light  08-10-2011",2011-08-15 15:01:00-04:00,CX,neutral
324476.0,Stocks to Watch for Wednesday 8/03/2011: Fresh 52 Week Highs and Lows,2011-08-03 01:05:00-04:00,CX,positive
324477.0,Monday's Mid-Day Options Volume Leaders,2011-08-01 12:36:00-04:00,CX,neutral
324478.0,Watch Ex-Dividends  07-29-2011,2011-07-29 17:52:00-04:00,CX,neutral
324479.0,Bonds Tell the Story  07-29-2011,2011-07-29 15:07:00-04:00,CX,neutral
324480.0,Options Brief: CEMEX,2011-07-29 10:58:00-04:00,CX,neutral
324481.0,Stocks to Watch for Friday 7/29/2011: Fresh 52-Week Highs and Lows,2011-07-29 01:41:00-04:00,CX,positive
324482.0,Puts Purchased on CEMEX,2011-07-28 10:49:00-04:00,CX,neutral
324483.0,Can It Be? A Toll Road ETF?,2011-07-28 08:14:00-04:00,CX,neutral
324484.0,Monday's Put/Call Ratio Leaders,2011-07-25 12:15:00-04:00,CX,neutral
324485.0,Options Brief: CEMEX,2011-07-25 10:52:00-04:00,CX,neutral
324486.0,"Citi Downgrades Cemex to Hold, Reduces PT to $9.50",2011-07-25 09:03:00-04:00,CX,neutral
324487.0,Citigroup Downgrades Cemex from Buy to Hold and Lowers PT from $12.50 to $9.50,2011-07-25 07:21:00-04:00,CX,negative
324488.0,Jefferies Lowers PT on Cemex to $11,2011-07-06 09:14:00-04:00,CX,negative
324489.0,Morgan Stanley Downgrades Cemex To Underweight,2011-07-05 08:19:00-04:00,CX,neutral
324490.0,Thursday's Put/Call Ratio Leaders,2011-06-23 12:29:00-04:00,CX,neutral
324491.0,Bears Stop for a Pic-a-Nic  06-17-2011,2011-06-17 16:37:00-04:00,CX,negative
324492.0,Bottom-Picking - Leave It to the Proctologists  06-16-2011,2011-06-16 15:54:00-04:00,CX,negative
324493.0,Top 4 NYSE Stocks In The Cement Industry With The Highest Cash,2011-06-09 01:51:00-04:00,CX,positive
324494.0,"Puts Purchased on CEMEX, S.A.B. (CX)",2011-05-19 11:42:00-04:00,CX,neutral
324495.0,Daily Long and Short Setup,2011-05-19 11:24:00-04:00,CX,neutral
324496.0,"Fast Money Picks For April 26th (X, CX, DIA, GLW, JPM)",2011-04-26 19:49:00-04:00,CX,neutral
324497.0,Jumping Mid-term Support  04-19-2011,2011-04-19 19:24:00-04:00,CX,positive
324498.0,Trend Continues to be Your Friend  04-15-2011,2011-04-15 18:52:00-04:00,CX,positive
324499.0,"Puts Purchased on CEMEX, S.A.B. (CX)",2011-04-15 11:28:00-04:00,CX,neutral
324500.0,"Mad Money Lightning Round OT: Cramer Shares His Thoughts On CX, CPLP And APA ",2011-04-03 16:50:00-04:00,CX,negative
324501.0,"Top 4 Stocks In The Cement Industry With The Highest Revenue (CRH, CX, JHX, TXI)",2011-03-30 00:59:00-04:00,CX,positive
324502.0,"Fast Money Picks For March 25th (CX, TRN, BAC, ORCL)",2011-03-24 21:20:00-04:00,CX,neutral
324503.0,Impact Difficult to Price Into Market  03-14-2011,2011-03-14 15:06:00-04:00,CX,negative
324504.0,Puts are Your Friend  03-10-11,2011-03-10 18:41:00-05:00,CX,positive
324505.0,Sold!  03-10-2011,2011-03-10 14:29:00-05:00,CX,neutral
324506.0,"Options Brief: CEMEX, S.A.B. (CX) ",2011-03-08 15:47:00-05:00,CX,neutral
324507.0,Enter Today's Date into Your Trading Diary  02-23-2011,2011-02-23 19:00:00-05:00,CX,neutral
324508.0,"Top Performing Industries For February 16 (SKY, PAG, CX, AAP)",2011-02-16 10:11:00-05:00,CX,positive
324509.0,"Friday's Put/Call Ratio Leaders (BSBR, FLEX, CX, YRCW, OREX)",2011-02-11 12:25:00-05:00,CX,neutral
324510.0,"Wednesday's Put/Call Ratio Leaders (CX, GIL, CIT, SLE, TGT)",2011-02-09 12:10:00-05:00,CX,neutral
324511.0,The Infrastructure Stocks Highway,2011-02-08 23:32:00-05:00,CX,neutral
324512.0,Zacks #5 Rank Additions for Tuesday - Tale of the Tape,2011-02-01 08:24:00-05:00,CX,neutral
324513.0,Zacks #5 Rank Additions for Tuesday - Tale of the Tape,2011-02-01 08:14:00-05:00,CX,neutral
324514.0,Making Use Of All Tools Available.,2011-01-27 08:26:00-05:00,CX,neutral
324515.0,"Trade Ideas From The State Of The Union (CSX, FSLR, APOL, GVA, FNSR)",2011-01-26 13:50:00-05:00,CX,neutral
324516.0,Zacks #5 Rank Additions for Tuesday  - Tale of the Tape,2011-01-25 08:31:00-05:00,CX,neutral
324517.0,Zacks #5 Rank Additions for Tuesday  - Tale of the Tape,2011-01-25 08:14:00-05:00,CX,neutral
324518.0,"Benzinga's Top Performing Industries, January 24th (NVDA, SOLF, FSLR, CX, TXI, AAPL, DELL, TMRK, FTE, CAB)",2011-01-24 18:10:00-05:00,CX,positive
324519.0,"How To Trade The State Of The Union Address (X, JKS, MWW, CSIQ)",2011-01-24 11:59:00-05:00,CX,neutral
324520.0,Crumbling Cement - Zacks Industry Rank Analysis,2011-01-05 17:03:00-05:00,CX,neutral
324521.0,Crumbling Cement - Zacks Industry Rank Analysis,2011-01-05 17:03:00-05:00,CX,neutral
324522.0,Crumbling Cement - Zacks Industry Rank Analysis,2011-01-05 00:00:00-05:00,CX,neutral
324523.0,Crumbling Cement - Zacks Industry Rank Analysis,2011-01-05 00:00:00-05:00,CX,neutral
324524.0,"Wednesday's Put/Call Ratio Leaders (HERO, FAST, AUXL, COF, CX)",2010-12-29 12:31:00-05:00,CX,neutral
324525.0,Ratio Call Spread as a Stock Repair Strategy  12-08-2010,2010-12-08 19:11:00-05:00,CX,neutral
324526.0,2 ETFs Closer to Home,2010-12-08 06:00:00-05:00,CX,neutral
324527.0,4 Stocks Selling at a Huge Discount,2010-11-23 12:50:00-05:00,CX,positive
324528.0,"Top 4 Stocks In The Cement Industry With The Highest Cash (CRH, CX, TXI, JHX)",2010-11-04 04:03:00-04:00,CX,positive
324529.0,CEMEX Reports a Loss - Analyst Blog,2010-10-27 16:33:00-04:00,CX,negative
324530.0,CEMEX Reports Third Quarter Loss of $86M  ,2010-10-26 07:33:00-04:00,CX,negative
324531.0,"Top 4 Stocks In The Cement Industry With The Highest Cash (CRH, CX, TXI, JHX)",2010-10-07 05:36:00-04:00,CX,positive
324532.0,"Wednesday's Put/Call Ratio Leaders (CX, VRSN, WM, LRCX, HERO)",2010-10-06 12:27:00-04:00,CX,neutral
324533.0,"Monday's Put/Call Ratio Leaders (EXEL, DIN, CAVM, NSM, CX)",2010-10-04 12:23:00-04:00,CX,neutral
324534.0,"Goldman Sachs Initiates Coverage for CFN, VAR, CX",2010-09-27 10:51:00-04:00,CX,neutral
324535.0,"Top 4 Stocks In The Cement Industry With The Highest Cash (CRH. CX. TXI, JHX)",2010-09-22 05:53:00-04:00,CX,positive
324536.0,Jefferies Int'l Prime Time AM,2010-09-21 06:52:00-04:00,CX,neutral
324537.0,"Benzinga's Political Round Up (CX, GS, X)",2010-09-09 13:23:00-04:00,CX,neutral
324538.0,Can Cement Rise To The Top? (CX),2010-09-07 10:16:00-04:00,CX,positive
324539.0,Corporate Incubators and New Business Creation,2010-09-01 05:36:00-04:00,CX,positive
324540.0,CEMEX Reduces Debt - Analyst Blog,2010-08-30 18:36:00-04:00,CX,negative
324541.0,Bond Markets React to Potential Fed QE Program,2010-08-25 14:59:00-04:00,CX,neutral
324542.0,Calls Purchased on Cemex (CX),2010-08-25 11:08:00-04:00,CX,neutral
324543.0,Existing Home Sales Well Below Expectations  08-24-2010,2010-08-24 15:13:00-04:00,CX,positive
324544.0,Vulcan Faces Credit Rating Cut - Analyst Blog,2010-08-09 17:51:00-04:00,CX,positive
324545.0,Big Ben Chimes In  07-21-2010,2010-07-21 18:41:00-04:00,CX,neutral
324546.0,Market Waiting on Bernanke Talk  07-21-2010,2010-07-21 15:26:00-04:00,CX,neutral
324547.0,Puts Purchased on Cemex SAB (CX),2010-07-21 14:37:00-04:00,CX,neutral
324548.0,Cement ETF?,2010-07-08 08:17:00-04:00,CX,neutral
324549.0,CX Assumed With Buy At Citigroup,2010-05-27 08:49:00-04:00,CX,neutral
324550.0,CX Upgraded To Outperform At Credit Suisse,2010-05-10 09:44:00-04:00,CX,positive
324551.0,Bullish Put Trade in Cemex,2010-05-07 15:47:00-04:00,CX,neutral
324552.0,"Top Performing Industries For April 23 (SII, CX, CHCI, APPY, BYI)",2010-04-23 15:35:00-04:00,CX,positive
324553.0,Bookkeeping: Restarting Bucryus (BUCY) on Muted Response to Earnings,2010-04-23 15:20:00-04:00,CX,neutral
324554.0,Cemex Sees Big Call Buying,2010-04-16 11:01:00-04:00,CX,neutral
324555.0,2010 Fund Performance Period 3,2010-04-01 16:37:00-04:00,CX,neutral
324556.0,"Cramer Gives His Advice On CX,  VMC, CHU, CTL, WIN, TEVA, THC, AIG, S, Q, AINV, FSLR, EQT  ",2010-03-25 23:10:00-04:00,CX,positive
324557.0,"Bookkeeping: Weekly Changes to Fund Positions Year 3, Week 33",2010-03-22 08:00:00-04:00,CX,neutral
324558.0,"You Can Still Make Money on the Short Side, but It's Tough",2010-03-17 10:29:00-04:00,CX,negative
324559.0,Moving Mental Stops on Index Up About 10 S&P Points; Stopped Out of Cemex (CX) Short,2010-03-17 10:20:00-04:00,CX,negative
324560.0,Bookkeeping: 2 New Shorts,2010-03-15 15:01:00-04:00,CX,neutral
324561.0,"Top 5 NYSE Stocks In the Industrial Goods Sector With The Highest 5-Y Earnings Estimates (CX, USG, GFA, GFF, ACO)",2010-03-11 08:09:00-05:00,CX,positive
324562.0,"Top 5 Large-Cap NYSE Stocks With The Highest 5-Y Earnings Estimates (PRX, CRY, TCM, VRX, MR)",2010-03-08 09:55:00-05:00,CX,negative
324563.0,"Fast Money Picks For March 5th (CX, BX, TEX, WSM)",2010-03-04 19:38:00-05:00,CX,neutral
324564.0,What Does Dubai’s Financial Crisis Mean for Emerging Markets?,2009-11-30 18:35:00-05:00,CX,negative
324565.0, CEMEX   (CX) Receives Approval from the Mexican Securities Authority to Launch Convertible Securities Transaction,2009-11-12 04:28:00-05:00,CX,positive
