Unnamed: 0,title,date,stock,sentiment
393237.0,"Baird Maintains Outperform on DexCom, Raises Price Target to $186",2019-08-01 09:47:00-04:00,DXCM,neutral
393238.0,"UBS Maintains Neutral on DexCom, Raises Price Target to $160",2019-08-01 08:30:00-04:00,DXCM,neutral
393239.0,"Raymond James Maintains Outperform on DexCom, Raises Price Target to $172",2019-08-01 07:29:00-04:00,DXCM,neutral
393240.0,DexCom shares are trading lower despite the company reporting strong Q2 earnings.,2019-07-31 16:17:00-04:00,DXCM,positive
393241.0,Dexcom Raises FY19 Sales Guidance From $1.25B-$1.3B To $1.325B-$1.375B vs $1.29B Estimate,2019-07-31 16:15:00-04:00,DXCM,neutral
393242.0,"DexCom Q2 EPS $0.08 Beats $0.01 Estimate, Sales $336.4M Beat $307.04M Estimate",2019-07-31 16:14:00-04:00,DXCM,neutral
393243.0,Stocks That Managed to Breach 52-Week Highs Wednesday Morning,2019-07-31 11:01:00-04:00,DXCM,neutral
393244.0,"The Daily Biotech Pulse: Roche-Spark Deal Faces Further Delay, Bayer's Prostate Cancer Drug Passes FDA Muster",2019-07-31 07:06:00-04:00,DXCM,negative
393245.0,"The Week Ahead In Biotech: Pending Clinical Readouts, Earnings Dominate",2019-07-27 14:32:00-04:00,DXCM,negative
393246.0,DexCom Shares Do Not Appear To Be Impacted Following Earlier Article Highlighting Possible Competitor In Diabetes Space 'Apple continues expanding into health care by selling its first diabetes product in stores',2019-06-27 11:55:00-04:00,DXCM,positive
393247.0,DexCom Shares Closed Up Nearly 10% On Mon.; Piper Jaffray Analyst JP McKim Tells Benzinga Upside Attributed To 'Positive Developments At The American Diabetes Association',2019-06-11 11:04:00-04:00,DXCM,positive
393248.0,DexCom shares are trading higher on elevated volume. Not seeing any fundamental news to justify price action.,2019-06-10 14:04:00-04:00,DXCM,positive
393249.0,"Dexcom Shares Volatile Over Last Few Mins. Following Senseonics FDA Doc On Eversense, Very Large Volume Spike As Doc Was Circulated By Traders; Piper Jaffray Noted Co. Also Has A Non-Adjunctive Claim",2019-06-06 15:27:00-04:00,DXCM,positive
393250.0,"Shares of several healthcare companies are trading higher as the US market rebounds from recent weakness, driven by renewed cautious optimism surrounding US-China trade talks.",2019-05-14 13:32:00-04:00,DXCM,positive
393251.0,"Jim Cramer Weighs In On CVS, Starbucks, Tilray And More",2019-05-08 07:45:00-04:00,DXCM,neutral
393252.0,"Shares of companies in the diagnostics and research space are trading higher in sympathy with Bruker, which reported better-than-expected Q1 EPS and sales results.",2019-05-03 13:21:00-04:00,DXCM,positive
393253.0,"BMO Capital Maintains Outperform on DexCom, Inc. - Common Stock, Raises Price Target to $172",2019-05-02 10:37:00-04:00,DXCM,neutral
393254.0,DexCom shares are trading higher after the company reported better-than-expected Q1 financial results and announced 2019 EPS guidance above the analyst consensus estimate.,2019-05-02 09:47:00-04:00,DXCM,positive
393255.0,"Raymond James Maintains Outperform on DexCom, Inc. - Common Stock, Lowers Price Target to $150",2019-05-02 07:53:00-04:00,DXCM,negative
393256.0,Dexcom Guides FY19 Revenues Of $1.25-1.3B Vs. $1.23B Estimate,2019-05-01 16:48:00-04:00,DXCM,neutral
393257.0,"DexCom Q1 EPS $(0.05) May Not Compare To $(0.16) Estimate, Sales $280.5M Beat $246.39M Estimate",2019-05-01 16:47:00-04:00,DXCM,neutral
393258.0,DexCom Q1 Earnings Preview,2019-05-01 11:46:00-04:00,DXCM,neutral
393259.0,"UBS Maintains Neutral on DexCom, Inc. - Common Stock, Lowers Price Target to $140",2019-04-30 08:46:00-04:00,DXCM,negative
393260.0,"Jim Cramer Gives His Opinion On Sarepta, Blackstone, Tractor Supply And More",2019-04-26 07:57:00-04:00,DXCM,neutral
393261.0,Shares of several healthcare companies are trading lower after Trump renewed his efforts to repeal and replace the Affordable Care Act; the Department of Justice moved to accelerate the appeal process in hopes to invalidate the ACA as unconstitutional.,2019-04-17 10:38:00-04:00,DXCM,positive
393262.0,DexCom shares are trading higher. Not currently seeing any company-specific news.,2019-04-10 13:15:00-04:00,DXCM,positive
393263.0,60 Biggest Movers From Friday,2019-03-25 05:42:00-04:00,DXCM,neutral
393264.0,41 Stocks Moving In Friday's Mid-Day Session,2019-03-22 12:30:00-04:00,DXCM,neutral
393265.0,DexCom shares trading lower following a nearly 3 percent decline on Thursday amid a negative report from Spruce Point. Shares traded below the $140 level Friday.,2019-03-22 10:23:00-04:00,DXCM,negative
393266.0,Spruce Point: Dexcom Could Fall 45-60%,2019-03-21 15:46:00-04:00,DXCM,neutral
393267.0,Spruce Point Sees 60% Downside In Dexcom (approximately $65-$85/Share),2019-03-21 13:07:00-04:00,DXCM,negative
393268.0,'Amazon-exclusive medical brand Choice expands services with One Drop partnership' -Digiday Reported On Tuesday,2019-03-21 10:36:00-04:00,DXCM,negative
393269.0,Hearing Hedgeye Sees Over 305 Downside In Dexcom; Likes Co. And Its Products But Believe Stock Has 'Gotten Ahead Of Itself',2019-03-05 14:28:00-05:00,DXCM,positive
393270.0,Dexcom Discussed As New Short Idea By Hedgeye,2019-03-05 14:16:00-05:00,DXCM,neutral
393271.0,'Diabetes-tech giant Dexcom plans to lay off 13% of its workers and outsource jobs. People who rely on the products say it's endangering a key part of its business.' -Business Insider Earlier Reported,2019-03-05 12:06:00-05:00,DXCM,neutral
393272.0,"US Senator Ron Wyden Says Finance Committee Continuing To Investigate How Major Insulin Manufacturers Set, Increase 'Outrageous Price Of Insulin'",2019-03-04 12:28:00-05:00,DXCM,negative
393273.0,"Morgan Stanley Maintains Equal-Weight on DexCom, Raises Price Target to $160",2019-02-25 10:27:00-05:00,DXCM,neutral
393274.0,"DexCom Q4 Adj. EPS $0.54 May Not Compare To $0.17 Estimate, Sales $338M Beat $299.67M Estimate",2019-02-21 17:23:00-05:00,DXCM,neutral
393275.0,"The Daily Biotech Pulse: Genomic Health Earnings, AbbVie's Humira Approved For Another Indication In Japan",2019-02-21 07:32:00-05:00,DXCM,positive
393276.0,"The Week Ahead In Biotech: Conferences, Clinical Trials And Earnings",2019-02-15 14:00:00-05:00,DXCM,neutral
393277.0,"Jim Cramer Gives His Opinion On Cleveland-Cliffs, SINA, Take-Two And More",2019-01-11 08:23:00-05:00,DXCM,neutral
393278.0,DexCom shares are trading higher after the company announced it expects preliminary Q4 sales to have increased 50% since last year.,2019-01-07 09:56:00-05:00,DXCM,positive
393279.0,DexCom Sees FY2019 Sales $1.18B-1.23B vs $1.18B Est,2019-01-07 07:45:00-05:00,DXCM,neutral
393280.0,DexCom,2019-01-07 07:45:00-05:00,DXCM,neutral
393281.0,DexCom,2019-01-07 07:44:00-05:00,DXCM,neutral
393282.0,"Morgan Stanley Maintains Equal-Weight on DexCom, Lowers Price Target to $135",2019-01-02 10:28:00-05:00,DXCM,negative
393283.0,DexCom Option Alert: Fri $120 Calls Sweep (2) near the Ask: 540 @ $1.75 vs 283 OI; Ref=$116.85,2018-12-19 11:04:00-05:00,DXCM,positive
393284.0,Health insurers and healthcare providers are trading down today after a Texas court ruled that ObamaCare was unconstitutional.,2018-12-17 11:06:00-05:00,DXCM,neutral
393285.0,"UBS Initiates Coverage On DexCom with Neutral Rating, Announces $135 Price Target",2018-11-28 07:59:00-05:00,DXCM,neutral
393286.0,"The Daily Biotech Pulse: Mylan Recalls Blood Pressure Drug, Heat Biologics Offering, New Novelion CEO",2018-11-21 08:04:00-05:00,DXCM,negative
393287.0,"DexCom, Inc. Q3 EPS $0.17, Sales $266.7M Beat $241.3M Estimate",2018-11-06 16:06:00-05:00,DXCM,neutral
393288.0,DexCom Raises FY18 Sales Guidance From $925M To $975M vs $930.8M Estimate,2018-11-06 16:03:00-05:00,DXCM,neutral
393289.0,"DexCom, Inc. Q3 EPS $0.17 Beats $(0.10) Estimate, Sales $266.7M Beat $241.3M Estimate",2018-11-06 16:03:00-05:00,DXCM,neutral
393290.0,"The Daily Biotech Pulse: EyePoint Licenses Eye Inflammation Drug, Insys Strategic Review Of Opioid Assets, Neos Offering",2018-11-06 07:04:00-05:00,DXCM,positive
393291.0,"The Week Ahead In Biotech: Earnings, Conferences, PDUFA Dates, Clinical Trial Results And IPOs",2018-11-04 13:35:00-05:00,DXCM,neutral
393292.0,"Benzinga's Top Upgrades, Downgrades For October 19, 2018",2018-10-19 09:17:00-04:00,DXCM,positive
393293.0,"Goldman Sachs Upgrades DexCom to Neutral, Announces $125 Price Target",2018-10-19 06:02:00-04:00,DXCM,neutral
393294.0,Dexcom Announces G6 Continuous Glucose Monitoring System Will Be Available To Medicare Beneficiaries With Diabetes In Early 2019,2018-10-18 08:05:00-04:00,DXCM,positive
393295.0,"Morgan Stanley Maintains Equal-Weight on DexCom, Raises Price Target to $150",2018-10-11 09:13:00-04:00,DXCM,neutral
393296.0,Novo Nordisk Announces First Global Launch Of Connected Insulin Pens,2018-10-01 05:00:00-04:00,DXCM,neutral
393297.0,"Jim Cramer Gives His Opinion on McDonald's, PayPal And More",2018-09-18 11:13:00-04:00,DXCM,neutral
393298.0,"Once Again, Baird Predicts End To Tandem's 'Fantastic' Run",2018-09-14 10:24:00-04:00,DXCM,neutral
393299.0,"Stocks Which Set New 52-Week High Yesterday, September 13th",2018-09-14 09:26:00-04:00,DXCM,neutral
393300.0,"Stocks Which Set New 52-Week High Yesterday, September 11th",2018-09-12 12:17:00-04:00,DXCM,neutral
393301.0,"Benzinga's Top Upgrades, Downgrades For September 12, 2018",2018-09-12 09:15:00-04:00,DXCM,positive
393302.0,Northland Securities Upgrades DexCom to Market Perform,2018-09-12 08:34:00-04:00,DXCM,positive
393303.0,"Stocks Which Set New 52-Week High Friday, September 7th",2018-09-10 16:36:00-04:00,DXCM,neutral
393304.0,"Stocks Which Set New 52-Week High Yesterday, September 4th",2018-09-05 10:22:00-04:00,DXCM,neutral
393305.0,"The Daily Biotech Pulse: Biohaven In-Licenses Drug, Retrophin's Debt Offering, ProQR And Bluebird Report Positive Trial Results",2018-09-05 08:28:00-04:00,DXCM,positive
393306.0,"Stocks Which Set New 52-Week High Friday, August 31",2018-09-04 10:29:00-04:00,DXCM,neutral
393307.0,"Stocks Which Set New 52-Week High Yesterday, August 30th",2018-08-31 10:11:00-04:00,DXCM,neutral
393308.0,"Stocks Which Set New 52-Week High Yesterday, August 23rd",2018-08-24 09:11:00-04:00,DXCM,neutral
393309.0,"The Daily Biotech Pulse: Immunomedics' Bottom-Line Miss; Kala, Regeneron Await FDA Verdict",2018-08-24 08:47:00-04:00,DXCM,positive
393310.0,"Stocks Which Set New 52-Week High Yesterday, August 22nd",2018-08-23 10:51:00-04:00,DXCM,neutral
393311.0,10 Biggest Price Target Changes For Thursday,2018-08-23 10:20:00-04:00,DXCM,neutral
393312.0,"The Daily Biotech Pulse: Novartis Breast Cancer Trial Meets Endpoint, Medpace's Offering, Dexcom Buys TypeZero",2018-08-23 08:23:00-04:00,DXCM,negative
393313.0,"Baird Maintains Outperform on DexCom, Raises Price Target to $160",2018-08-23 08:06:00-04:00,DXCM,neutral
393314.0,"Stephens & Co. Maintains Overweight on DexCom, Raises Price Target to $160",2018-08-23 07:49:00-04:00,DXCM,negative
393315.0,"Canaccord Genuity Maintains Buy on DexCom, Raises Price Target to $150",2018-08-23 07:31:00-04:00,DXCM,neutral
393316.0,"Dexcom To Acquire TypeZero Tech, No Financial Terms Disclosed",2018-08-22 16:05:00-04:00,DXCM,negative
393317.0,"Stocks Which Set New 52-Week High Yesterday, August 21st",2018-08-22 09:06:00-04:00,DXCM,neutral
393318.0,"The Daily Biotech Pulse: FDA Snub For Allergan, Myriad's Q4 Beat, Mallinckrodt's Stannsoporfin",2018-08-22 08:20:00-04:00,DXCM,negative
393319.0,"Stocks Which Set New 52-Week High Tues., Aug. 21, 2018",2018-08-21 14:50:00-04:00,DXCM,neutral
393320.0,"The Daily Biotech Pulse: Merck's Keytruda Secures Approval For Expanded Label, ProPhase Labs Q2 Loss Narrows",2018-08-21 08:40:00-04:00,DXCM,positive
393321.0,"Stocks Which Set New 52-Week High Yesterday, August 15th",2018-08-16 10:22:00-04:00,DXCM,neutral
393322.0,"Stocks Which Set New 52-Week High Yesterday, August 14th",2018-08-15 12:29:00-04:00,DXCM,neutral
393323.0,"Bank of America Maintains Buy on DexCom, Raises Price Target to $145",2018-08-15 09:17:00-04:00,DXCM,neutral
393324.0,"The Daily Biotech Pulse: Vertex Awaits FDA Verdict, Strongbridge Falls On Offering, ReShape's Woes Continue",2018-08-15 08:48:00-04:00,DXCM,negative
393325.0,"Stocks Which Set New 52-Week High Yesterday, August 6th",2018-08-07 11:27:00-04:00,DXCM,neutral
393326.0,Berenberg Upgrades DexCom to Buy,2018-08-06 08:47:00-04:00,DXCM,neutral
393327.0,"Stocks Which Set New 52-Week High Yesterday, August 2nd",2018-08-03 11:16:00-04:00,DXCM,neutral
393328.0,10 Biggest Price Target Changes For Friday,2018-08-03 09:58:00-04:00,DXCM,neutral
393329.0,DexCom shares are trading down 3.5% despite strong Q2 results reported Wednesday and positive analyst activity over past two days.,2018-08-03 09:42:00-04:00,DXCM,positive
393330.0,"Morgan Stanley Maintains Equal-Weight on DexCom, Raises Price Target to $130",2018-08-03 07:16:00-04:00,DXCM,neutral
393331.0,75 Biggest Movers From Yesterday,2018-08-03 06:10:00-04:00,DXCM,neutral
393332.0,Mid-Afternoon Market Update: Crude Oil Up Over 2%; Boingo Wireless Shares Spike Higher,2018-08-02 14:41:00-04:00,DXCM,negative
393333.0,65 Stocks Moving In Thursday's Mid-Day Session,2018-08-02 12:26:00-04:00,DXCM,neutral
393334.0,"Jefferies Maintains Buy on DexCom, Raises Price Target to $125",2018-08-02 10:49:00-04:00,DXCM,neutral
393335.0,"Bank of America Maintains Buy on DexCom, Raises Price Target to $127",2018-08-02 10:42:00-04:00,DXCM,neutral
393336.0,"Canaccord Genuity Maintains Buy on DexCom, Raises Price Target to $125",2018-08-02 10:42:00-04:00,DXCM,neutral
393337.0,Mid-Morning Market Update: Markets Open Lower; Aetna Profit Beats Expectations,2018-08-02 10:17:00-04:00,DXCM,positive
393338.0,"The Daily Biotech Pulse: Denali's Parkinson's Candidate Clears Early-Stage Trials, Dexcom's Strong Quarter",2018-08-02 08:54:00-04:00,DXCM,positive
393339.0,"BMO Capital Maintains Outperformer on DexCom, Raises Price Target to $125",2018-08-02 08:45:00-04:00,DXCM,neutral
393340.0,Benzinga Pro's 5 Stocks To Watch Today,2018-08-02 08:44:00-04:00,DXCM,neutral
393341.0,32 Stocks Moving In Thursday's Pre-Market Session,2018-08-02 08:05:00-04:00,DXCM,neutral
393342.0,"DexCom Shares Gain20% After Hours; Co. Beat Q2 EPs And Sales Estimates, Raised FY18 Sales Guidance Above Estimates",2018-08-01 17:37:00-04:00,DXCM,positive
393343.0,"DexCom Executive Chairman and Director Terry Gregg Retires, President and CEO Kevin Sayer Appointed Chairman of the Board",2018-08-01 16:11:00-04:00,DXCM,neutral
393344.0,DexCom Raises FY18 Sales Outlook From $850-$860M To $925M vs $862.25M Est.,2018-08-01 16:05:00-04:00,DXCM,neutral
393345.0,"DexCom Q2 Adj. EPS $(0.10) Beats $(0.18) Estimate, Sales $242.5M Beat $205.68M Estimate",2018-08-01 16:04:00-04:00,DXCM,neutral
393346.0,'A New Revolution Of Medicine': Senseonics Brings Automation To Diabetes Care,2018-07-16 15:09:00-04:00,DXCM,positive
393347.0,"Benzinga's Daily Biotech Pulse: Amgen Resubmits Osteoporosis Drug BLA, Auris Medical Prices Offering",2018-07-13 08:34:00-04:00,DXCM,neutral
393348.0,"Benzinga's Daily Biotech Pulse: AbbVie Files sNDA For Leukemia Drug, AcelRx Offering, Aurinia Starts Mid-Stage Trial",2018-07-12 08:37:00-04:00,DXCM,neutral
393349.0,DexCom Shares Up 2% Following Earlier Upgrade From Market Perform To Outperform At Raymond James,2018-07-02 09:59:00-04:00,DXCM,positive
393350.0,"Benzinga's Top Upgrades, Downgrades For July 2, 2018",2018-07-02 09:21:00-04:00,DXCM,positive
393351.0,"The Market In 5 Minutes: More Trade Threats, July PDUFA Dates, Tesla's Goal And More",2018-07-02 09:00:00-04:00,DXCM,negative
393352.0,"William Blair Growth Stock Conference Begins Today, Presenters Include: Aspen Technology, Ellie Mae, FleetCor, Catalent, SendGrid, DexCom, Discover Financial, and Okta",2018-06-12 07:16:00-04:00,DXCM,positive
393353.0,Dexcom Reports Co. Received CE Mark For Dexcom G6 System For People With Diabetes Ages 2 Years And Up,2018-06-12 07:08:00-04:00,DXCM,neutral
393354.0,"Andrew Left Goes Long Fitbit, Sees 130% Upside",2018-06-11 15:33:00-04:00,DXCM,neutral
393355.0,30 Stocks Moving In Friday's Mid-Day Session,2018-06-08 12:31:00-04:00,DXCM,neutral
393356.0,"The Market In 5 Minutes: China, ZTE, McDonald's And More",2018-06-08 09:00:00-04:00,DXCM,neutral
393357.0,"Benzinga's Top Upgrades, Downgrades For June 8, 2018",2018-06-08 08:58:00-04:00,DXCM,positive
393358.0,A Peek Into The Markets: US Stock Futures Signal Lower Start On Wall Street,2018-06-08 06:55:00-04:00,DXCM,negative
393359.0,CORRECTION: JP Morgan Upgrades DexCom to Overweight,2018-06-08 06:14:00-04:00,DXCM,neutral
393361.0,Dexcom Shares Down 4.2% Thurs.; Traders Attributing Weakness To Earlier Circulation Apple Planning Device To Help Monitor Blood Pressure,2018-06-07 12:09:00-04:00,DXCM,neutral
393362.0,Piper Jaffray: Tandem Diabetes Is Entering A 'Goldilocks Period',2018-05-14 14:59:00-04:00,DXCM,neutral
393363.0,"Bank of America Initiates Coverage On DexCom with Buy Rating, Announces $100 Price Target",2018-05-11 09:11:00-04:00,DXCM,neutral
393364.0,"Benzinga's Daily Biotech Pulse: Valeant Earnings, Lipocine's FDA Watch, Invivo CFO Departure",2018-05-08 07:55:00-04:00,DXCM,neutral
393365.0,55 Biggest Movers From Yesterday,2018-05-04 04:41:00-04:00,DXCM,neutral
393366.0,DexCom Raises FY18 Outlook From $830M-$850M To $850M-$860M vs $842.79M Est.,2018-05-02 16:46:00-04:00,DXCM,neutral
393367.0,"DexCom Q1 Adj. EPS $(0.32) Beats $(0.33) Est., Sales $184.40M Beats $172.08M Est.",2018-05-02 16:44:00-04:00,DXCM,neutral
393368.0,Guggenheim Initiates Coverage On DexCom with Neutral Rating,2018-04-04 09:12:00-04:00,DXCM,neutral
393369.0,"Goldman Sachs Initiates Coverage On DexCom with Sell Rating, Announces $57.00 Price Target",2018-04-04 08:36:00-04:00,DXCM,neutral
393370.0,"Benzinga's Top Analyst Calls From March 29, 2018",2018-03-29 11:25:00-04:00,DXCM,positive
393371.0,"BMO Increases DexCom Price Target From $68 To $78 And Reiterates Their Outperform Rating As Co. Received G6 CGM FDA Approval Ahead Of Schedule; Believes Approval Gives Co. Momentum And Awaits An Update On Product Pricing, Guidance On Q1 Earnings Call",2018-03-29 10:05:00-04:00,DXCM,positive
393372.0,28 Stocks Moving In Wednesday's Pre-Market Session,2018-03-28 08:19:00-04:00,DXCM,neutral
393373.0,DexCom Shares Indicated Up 3.5% Near Tues. High Around $72.50; A Co. Press Release Tues. Evening Confirmed Marketing Authorization For Co.'s New G6 CGM System,2018-03-28 06:27:00-04:00,DXCM,positive
393374.0,"DexCom Shares Spike ~$0.50 As Traders Circulate FDA.gov Alert Showing Approval For G6 iCGM System For Determining Sugar Levels In Children 2+, Adults With Diabetes",2018-03-27 15:20:00-04:00,DXCM,positive
393375.0,Baird Upgrades DexCom to Outperform,2018-03-23 07:23:00-04:00,DXCM,neutral
393376.0,"WaveForm  Receives Favorable Decision On Glucose Monitoring Patents, PTAB Haqs Ruled Two Early Patents Held By WaveForm Are Not Invalid; Watch For Downside In Dexcom",2018-03-08 13:38:00-05:00,DXCM,positive
393377.0,"DexCom Reports Q4 EPS $0.10 vs. $0.03 Est., Sales $221M vs. $$215.87M Est.",2018-02-27 16:02:00-05:00,DXCM,neutral
393378.0,DexCom Q4 Earnings Preview,2018-02-27 12:29:00-05:00,DXCM,neutral
393379.0,Weakness In Dexcom Being Attributed To New Coverage Policy From Cigna That Cover Abbott's Libre Glucose Monitoring System,2018-01-18 11:36:00-05:00,DXCM,negative
393380.0,"UnitedHealthcare, Dexcom Report Will Bring Wearable Technology Solution, 1-on-1 Coaching To People Battling Type-2 Diabetes",2018-01-10 10:01:00-05:00,DXCM,positive
393381.0,"DexCom Shares Down 3.048%; Earlier Co. Presented At JP Morgan Health Care Conf., Reported FY18 Outlook, Sees Sales $830M-$850M vs $853.06M Est.",2018-01-09 14:13:00-05:00,DXCM,positive
393382.0,"JP Morgan Healthcare Conference Continues Today, Presenters Include: Bluebird Bio, Agilent, Insulet, Cigna, DexCom, Eli Lilly, LifePoint, Acadia, Alkermes, Juno Therapeutics",2018-01-09 09:02:00-05:00,DXCM,positive
393383.0,DexCom Sees FY18 Sales ~$830M-$850M vs $854.6M Est.,2018-01-08 16:06:00-05:00,DXCM,neutral
393384.0,DexCom Sees Q4 Sales ~$218M vs $212.7M Est.; FY17 Sales ~$715M vs $710.2M Est.,2018-01-08 16:05:00-05:00,DXCM,neutral
393385.0,36 Biggest Movers From Yesterday,2018-01-05 05:48:00-05:00,DXCM,neutral
393386.0,"Dexcom Shares Down 8%, Potentially Following News Abbott's CGM System, FreeStyle Libre Is Now Available To Medicare Patients; Northland Issued Mid-Day Downgrade On Stock",2018-01-04 13:19:00-05:00,DXCM,positive
393387.0,Northland Securities Downgrades DexCom to Underperform,2018-01-04 11:13:00-05:00,DXCM,positive
393388.0,Dexcom Shares Ticking Lower As Hearing Northland Issued Mid-Day Downgrade On Stock,2018-01-04 11:11:00-05:00,DXCM,neutral
393389.0,"DexCom 13G From Wellington Mgmt. Group Shows Raised Stake From ~7.97M Shares To ~8.7M Shares, Or 10.05% Stake",2017-12-11 11:03:00-05:00,DXCM,positive
393390.0,"Piper Jaffray Healthcare Conference Concludes Today, Presenters Include: Kadmon, Ignyta, Eagle Pharmaceuticals, Tandem Diabetes Care, DexCom, and Alnylam Pharmaceuticals",2017-11-29 09:30:00-05:00,DXCM,positive
393391.0,Dexcom Reports Development Agreement with Lilly to Integrate Dexcom CGM into Connected Diabetes Ecosystem,2017-11-21 10:33:00-05:00,DXCM,positive
393392.0,"PPG, Dexcom Shares Ticking Modestly Higher Here Amid Report Out Of Chatroom Co.'s Will Be Featured On CNBC's 'Mad Money'",2017-11-16 11:02:00-05:00,DXCM,negative
393393.0,"DexCom Q3 Adj. EPS $(0.04) vs $(0.16) Est., Sales $184.6M vs $184.2M Est.",2017-11-01 16:38:00-04:00,DXCM,neutral
393394.0,DexCom's Quiet Consolidation After Huge Decline,2017-10-09 13:26:00-04:00,DXCM,positive
393395.0,16 Stocks Moving In Friday's Pre-Market Session,2017-09-29 09:02:00-04:00,DXCM,neutral
393396.0,Mid-Afternoon Market Update: AngioDynamics Drops On Earnings Miss; Zynerba Pharmaceuticals Shares Spike Higher,2017-09-28 15:07:00-04:00,DXCM,positive
393397.0,18 Biggest Mid-Day Losers For Thursday,2017-09-28 13:09:00-04:00,DXCM,negative
393398.0,Canaccord Sticks With Dexcom As Shares Tumble Amid Unexpected Label Addition,2017-09-28 12:58:00-04:00,DXCM,positive
393399.0,Mid-Day Market Update: Exa Corp Rises On Acquisition News; Comtech Shares Plunge,2017-09-28 12:08:00-04:00,DXCM,positive
393400.0,Mid-Morning Market Update: Markets Edge Lower; BlackBerry Tops Q2 Expectations,2017-09-28 10:32:00-04:00,DXCM,positive
393401.0,Canaccord Stick With Buy Rating On Dexcom Following Abbott's Libre Receiving Unexpected Label Addition To Include Insulin Dosing Indication,2017-09-28 09:56:00-04:00,DXCM,neutral
393402.0,5 Biggest Price Target Changes For Thursday,2017-09-28 09:27:00-04:00,DXCM,neutral
393403.0,"Benzinga's Top Upgrades, Downgrades For September 28, 2017",2017-09-28 09:08:00-04:00,DXCM,positive
393404.0,20 Stocks Moving In Thursday's Pre-Market Session,2017-09-28 08:35:00-04:00,DXCM,neutral
393405.0,Tandem Diabetes Reports 1/3 Of t:slim X2 Pump Users Already Updated Their Pumps Via Personal Computer To Add New Dexcom G5 CGM Integration,2017-09-28 08:34:00-04:00,DXCM,neutral
393406.0,The Market In 5 Minutes: The Market Wakes Up To The Trump Tax Plan,2017-09-28 08:25:00-04:00,DXCM,neutral
393407.0,"Dexcom Shares Fall 22% Premarket Following FDA Approval of Abbott's Blood Glucose Monitoring Device, Analyst Downgrades",2017-09-28 07:43:00-04:00,DXCM,positive
393408.0,Raymond James Downgrades DexCom to Market Perform,2017-09-28 06:46:00-04:00,DXCM,neutral
393409.0,JP Morgan Downgrades DexCom to Neutral,2017-09-28 06:17:00-04:00,DXCM,positive
393410.0,"Hearing Northland Securities Initiates Coverage On DexCom with Outperform Rating, Announces $85.00 Price Target",2017-09-26 10:03:00-04:00,DXCM,positive
393411.0,"Benzinga's Top Upgrades, Downgrades For September 15, 2017",2017-09-15 09:29:00-04:00,DXCM,positive
393412.0,"Barclays Initiates Coverage On DexCom with Equal-Weight Rating, Announces $76.00 Price Target",2017-09-15 07:11:00-04:00,DXCM,neutral
393413.0,Fitbit Tracking Higher After Deal With Dexcom,2017-09-08 09:43:00-04:00,DXCM,neutral
393414.0,"Fitbit, Dexcom to Develop Continuous Glucose Monitoring Experience for People Living with Diabetes",2017-09-07 09:01:00-04:00,DXCM,neutral
393415.0,DexCom Reports Publication Of New Study Showing People With Type-2 Diabetes On MDI Insulin Therapy Benefit From Use Of CGM: 'Participants in the study achieved significant A1C reduction...',2017-08-21 17:01:00-04:00,DXCM,positive
393416.0,"Wedbush PacGrow Healthcare Conference Begins Today, Presenters Include: Omeros, Bovie Medical, Bluebird Bio, Juno Therapeutics, DexCom, Tandem Diabetes, and Insulet",2017-08-15 08:40:00-04:00,DXCM,neutral
393417.0,"DexCom Names Quentin Blackford CFO Effective September 1, 2017",2017-08-01 16:18:00-04:00,DXCM,positive
393418.0,"DexComn Reports Adj. EPS $(0.16) vs $(0.21) Est., Sales $170.6M vs $166.3M Est.",2017-08-01 16:18:00-04:00,DXCM,neutral
393419.0,"Dexcom Reports Q2 Loss/Share $(0.16) vs. $(0.21) Est., Sales $170.6M vs. $166.3M Est.",2017-08-01 16:15:00-04:00,DXCM,neutral
393420.0,DexCom Reports FDA Approval of G5 Mobile App for Android Devices,2017-06-07 08:01:00-04:00,DXCM,positive
393421.0,DexCom Shares Now Up 3.3%,2017-06-05 13:29:00-04:00,DXCM,positive
393422.0,DexCom Shares Spike Higher as Co. Named During Apple Watch Presentation at WWDC,2017-06-05 13:29:00-04:00,DXCM,positive
393423.0,"PiperJaffray Reinstates Overweight on DexCom, Announces $78.00",2017-05-22 07:19:00-04:00,DXCM,negative
393424.0,Benzinga's Option Alert Recap From May 16,2017-05-16 16:59:00-04:00,DXCM,positive
393425.0,Option Alert: Dexcom Jun 70.0 Puts: 500 @  Above Ask!  $2.85: 1305 traded vs 1384 OI:  Earnings 8/1 After Close (est)  $69.65 Ref,2017-05-16 13:44:00-04:00,DXCM,positive
393426.0,BTIG Research Downgrades DexCom to Neutral,2017-05-03 06:57:00-04:00,DXCM,neutral
393427.0,"DexCom Reports Q1 EPS $(0.49) vs $(0.50) Est., Sales $142.3M vs $144.47M Est.",2017-05-02 16:05:00-04:00,DXCM,neutral
393428.0,"Benzinga's Top Upgrades, Downgrades For April 27, 2017",2017-04-27 09:24:00-04:00,DXCM,positive
