Unnamed: 0,title,date,stock,sentiment
393429.0,William Blair Initiates Coverage On DexCom with Outperform Rating,2017-04-27 08:58:00-04:00,DXCM,neutral
393430.0,"Barclays Global Healthcare Conference Concludes Today; Presenters Include DexCom, NantKwest, Juno, Humana, And Ironwood Pharma",2017-03-16 08:36:00-04:00,DXCM,neutral
393431.0,"Cowen Annual Healthcare Conference Continues Today; Presenters Include Regulus, Eli Lilly, Oculus, DexCom, Illumina, Allergan, Kite Pharma, Pfizer, and bluebird bio",2017-03-07 08:59:00-05:00,DXCM,neutral
393432.0,"Raymond James Institutional Investors Conference Begins Today; Presenters Include Ruth's Hospitality, DexCom, MAYCOM, Rayonier, TD Ameritrade, & Envision Healthcare",2017-03-06 08:18:00-05:00,DXCM,neutral
393433.0,"DexCom Reports Q4 EPS $(0.09) vs $(0.10) Est., Sales $171.2M vs $167.97M Est.",2017-02-28 16:23:00-05:00,DXCM,neutral
393434.0,"DexCom Diamond 2 Results Positive, Or At Least Not As Bad As Expected",2017-02-16 16:09:00-05:00,DXCM,positive
393435.0,"Downside in Dexcom Shares Intensifies as $82 Level Support Level Breaks; Shares Down 1.3% Over Last Few Mins, Down 2.7% for Session, Down 4.3% Since Open",2017-02-16 10:52:00-05:00,DXCM,positive
393436.0,Dexcom Shares Tick Below $83 Level Over Last Few Mins as Hearing Piper Jaffray Negative on Name,2017-02-16 09:57:00-05:00,DXCM,negative
393437.0,Baillie Gifford Reports 7.25% Passive Stake In Dexcom,2017-01-20 10:21:00-05:00,DXCM,positive
393438.0,DexCom Jumps 25% As It Becomes Only Continuous Glucose Monitoring With Medicare Coverage,2017-01-13 16:12:00-05:00,DXCM,neutral
393439.0,Mid-Afternoon Market Update: Dow Turns Negative; Sanchez Energy Shares Spike Higher,2017-01-13 14:36:00-05:00,DXCM,negative
393440.0,Technical Alert: Dexcom Leaps After Raised Q4 Guidance,2017-01-13 09:55:00-05:00,DXCM,positive
393441.0,"DexCom Sees Prelim. Q4 Rev. ~$168M vs. Est. $167M, FY16 Rev. ~$570M vs. Est. $569M; FY17 Rev. $710-$740M vs. Est. $753M",2017-01-10 08:31:00-05:00,DXCM,neutral
393442.0,"JP Morgan Healthcare Conf. Continues Today; Presenters Include Cooper Companies, Mckesson, Dexcom, CVS, Bristol-Myers, & NanoString",2017-01-10 08:07:00-05:00,DXCM,positive
393443.0,"Morgan Stanley Downgrades DexCom to Neutral, Lowers price target to $66.00",2017-01-03 07:32:00-05:00,DXCM,negative
393444.0,FDA Approval of Dexcom's Non-Adjunctive Indication Triggers a New Era in Diabetes Management,2016-12-20 16:04:00-05:00,DXCM,positive
393445.0,Traders Attributing Recent Strength In Dexcom To FDA Release Highlighting Approval Of Dexcom's G5 Mobile Continuous Glucose Monitoring System Non-Adjunctive Label Claim,2016-12-20 14:28:00-05:00,DXCM,positive
393446.0,15 Biggest Mid-Day Gainers For Monday,2016-12-19 12:43:00-05:00,DXCM,neutral
393447.0,"Benzinga's Top Upgrades, Downgrades For December 19, 2016",2016-12-19 09:08:00-05:00,DXCM,positive
393448.0,"Oppenheimer Upgrades DexCom to Outperform, Maintains $84.00 Target",2016-12-19 07:49:00-05:00,DXCM,neutral
393449.0,B. Riley Upgrades DexCom to Buy,2016-12-15 06:02:00-05:00,DXCM,neutral
393450.0,SkyTides: Insulet's President Provided 'Critical Misinformation To Investors',2016-12-02 11:01:00-05:00,DXCM,negative
393451.0,New Report Questions Insulet Management's 'Baseless' Claims: 'Investors Being Led To The Slaughter',2016-11-29 10:16:00-05:00,DXCM,neutral
393452.0,"PiperJaffray Healthcare Conference Begins Today, Day 1 of 2; Presenters Include NantKwest, Ignyta, Gilead Sciences, DexCom, Incyte, bluebird bio",2016-11-29 08:53:00-05:00,DXCM,neutral
393453.0,"Exclusive: Dexcom CEO Talks Health Canada Approval, International Markets, Investments And Competition",2016-11-17 09:07:00-05:00,DXCM,positive
393454.0,8 Stocks That Rallied Three Days On Increasing Volume,2016-11-16 05:30:00-05:00,DXCM,neutral
393455.0,JP Morgan Says DexCom Data Over The Weekend Was 'Way Above' Expectations,2016-11-14 09:53:00-05:00,DXCM,positive
393456.0,Dexcom Reports Health Canada Approval for G5 Mobile CGM System,2016-11-14 09:51:00-05:00,DXCM,positive
393457.0,18 Biggest Mid-Day Losers For Wednesday,2016-11-02 13:14:00-04:00,DXCM,negative
393458.0,Dexcom Shares Spike to High of $65.25 Following Positive Jim Cramer/CNBC Mention,2016-11-02 09:37:00-04:00,DXCM,positive
393459.0,"Dexcom -19.78% Premarket @$62.51 Following Tuesday's Earnings Miss, Multiple PT Cuts by Analysts",2016-11-02 08:52:00-04:00,DXCM,negative
393460.0,18 Stocks Moving In Wednesday's Pre-Market Session,2016-11-02 08:43:00-04:00,DXCM,neutral
393461.0,"DexCom Reports Q3 non-GAAP Loss/Share $0.07 vs $0.13 Est, Rev $148.6M vs $146.26M Est",2016-11-01 16:24:00-04:00,DXCM,neutral
393462.0,"BTIG Research Upgrades DexCom, Inc. - Common Stock to Buy",2016-10-31 06:32:00-04:00,DXCM,neutral
393463.0,Hearing JP Morgan Defending DexCom,2016-09-28 15:37:00-04:00,DXCM,positive
393464.0,"BZ NOTE: Shares of Tandem Diabetes Care, DexCom Both Down ~7% On Medtronic's Earlier Approval Of Automated Insulin Delivery Device For Type 1 Diabetes",2016-09-28 14:13:00-04:00,DXCM,positive
393465.0,Shares of DexCom Down 7% For The Session At $87.43/Share,2016-09-28 14:06:00-04:00,DXCM,positive
393466.0,Dexcom Sells off to Low of $86.77 on Volume,2016-09-28 14:06:00-04:00,DXCM,negative
393467.0,Benzinga's Top Initiations,2016-09-27 09:34:00-04:00,DXCM,positive
393468.0,"B. Riley Initiates Coverage on DexCom at Neutral, Announces $97.00 PT",2016-09-27 04:01:00-04:00,DXCM,neutral
393469.0,Benzinga's Top Upgrades,2016-09-16 08:44:00-04:00,DXCM,positive
393470.0,Desjardins Upgrades DexCom to Buy,2016-09-16 06:36:00-04:00,DXCM,neutral
393471.0,"BTIG Moves To Neutral On DexCom, But Says Shares Are Not Overvalued",2016-09-14 10:01:00-04:00,DXCM,positive
393472.0,BTIG Research Downgrades DexCom to Neutral,2016-09-14 06:43:00-04:00,DXCM,neutral
393473.0,Reimbursement of Dexcom CGM Technology for Patients with Type 1 and Type 2 Insulin-Dependent Diabetes is Now Available in Germany,2016-09-07 16:09:00-04:00,DXCM,neutral
393474.0,"DexCom Reports Q2 GAAP EPS $(0.24) vs $(0.05) in Same Qtr. Last Year, Sales $137.3M vs $132.6M Est.",2016-08-02 17:36:00-04:00,DXCM,neutral
393475.0,BMO Capital Highlights This Week's MedTech Earnings,2016-08-01 15:14:00-04:00,DXCM,neutral
393476.0,DexCom Says FDA Advisory Committee Votes For Its Non-Adjunctive Label For G5 Mobile CGM System,2016-07-22 13:01:00-04:00,DXCM,neutral
393477.0,10 Biggest Mid-Day Gainers For Tuesday,2016-07-19 12:37:00-04:00,DXCM,neutral
393478.0,Benzinga's Volume Movers,2016-07-19 10:40:00-04:00,DXCM,neutral
393479.0,Dexcom Says FDA Published Briefing Documents Before Advisory Committee Meeting,2016-07-19 10:19:00-04:00,DXCM,neutral
393480.0,Mid-Morning Market Update: Markets Edge Lower; Goldman Sachs Profit Beats Estimates,2016-07-19 09:56:00-04:00,DXCM,positive
393481.0,Dexcom Reports FDA Posted Briefing Doc Ahead of Panel Meeting,2016-07-19 08:34:00-04:00,DXCM,neutral
393482.0,JPMorgan Bullish On Dexcom Heading Into July 21 FDA Panel,2016-06-20 14:04:00-04:00,DXCM,neutral
393483.0,Sohn Contest Winner Says Future Revenue Miss Is 'Key Catalyst' To DexCom Short Thesis,2016-05-04 16:32:00-04:00,DXCM,positive
393484.0,DexCom Shares Falling ~2% Off Sohn Idea Contest Winner's Short Thesis,2016-05-04 16:30:00-04:00,DXCM,positive
393485.0,"Sohn Idea Contest Winner On DexCom Short, Says Co. Has Insulin Pump Competition From Medtronic And Abbott",2016-05-04 16:29:00-04:00,DXCM,positive
393486.0,Sohn Idea Contest Winner Unveils Short Thesis On DexCom,2016-05-04 16:27:00-04:00,DXCM,positive
393487.0,Ira Sohn Conference 2016: The Live Blog,2016-05-04 11:52:00-04:00,DXCM,neutral
393488.0,"Dexcom Reports Purchase of Nintamed, Co.'s Distributor in Germany, Switzerland, Austria, No Terms Disclosed",2016-05-02 16:25:00-04:00,DXCM,negative
393489.0,"DexCom Reports Q1 EPS $(0.23) vs. Est. $(0.20), Rev. $116.2M vs. Est. $110.38M",2016-04-27 17:25:00-04:00,DXCM,neutral
393490.0,"BTIG Research Initiates Coverage on DexCom at Buy, Announces $80.00 PT, Says 'Valuation is Hyperglycemic, But We See More Quarterly Beats'",2016-04-14 16:26:00-04:00,DXCM,neutral
393491.0,"DexCom Reports Q4 Adj. EPS $(0.26) vs $0.01 Est., Sales $130.8M vs $123.7M Est.",2016-02-23 16:18:00-05:00,DXCM,neutral
393492.0,"Cowen Defending DXCM, Says Incorrect Reports Circulating Are Driving Selloff",2016-02-08 14:57:00-05:00,DXCM,neutral
393493.0,Benzinga's Top Downgrades,2016-02-08 09:38:00-05:00,DXCM,positive
393494.0,"Baird Downgrades DexCom to Neutral, Lowers PT to $74.00",2016-02-08 07:20:00-05:00,DXCM,negative
393495.0,"Sterne Agee CRT Defending DXCM, Says Buy on Weakness, Says Co Has Industry Leading Product And Strong Product Pipeline",2016-02-05 13:54:00-05:00,DXCM,positive
393496.0,"UPDATE: DexCom Sees Global Patient Base 140-150K as of Dec. 31, '15",2016-01-12 08:37:00-05:00,DXCM,neutral
393497.0,UPDATE: DexCom Sees FY15 Unaudited Sales of ~$400M vs $391M Est.,2016-01-12 08:36:00-05:00,DXCM,neutral
393498.0,8-K from DexCom Shows Expecting Q4 Unaudited Sales ~$129M vs $120M Est.,2016-01-12 08:36:00-05:00,DXCM,neutral
393499.0,"Dexcom Reports Q3 Adj. EPS $(0.07) vs $(0.01) Est., Sales $105.2M vs $99.9M Est.",2015-11-04 16:21:00-05:00,DXCM,neutral
393500.0,"Morgan Stanley Initiates Coverage on DexCom at Overweight, Announces $106.00 PT",2015-11-02 09:46:00-05:00,DXCM,negative
393501.0,Mid-Afternoon Market Update: Dow Jumps 175 Points; Garmin Shares Slip On Weak Preliminary Q3 Results,2015-10-15 15:28:00-04:00,DXCM,negative
393502.0,Mid-Day Market Update: Crude Oil Down 2%; Five Prime Therapeutics Shares Spike Higher,2015-10-15 12:25:00-04:00,DXCM,negative
393503.0,Mid-Morning Market Update: Markets Rise; Citigroup Profit Tops Estimates,2015-10-15 10:18:00-04:00,DXCM,positive
393504.0,Benzinga's Top Upgrades,2015-10-15 10:01:00-04:00,DXCM,positive
393505.0,Morning Market Gainers,2015-10-15 09:48:00-04:00,DXCM,neutral
393506.0,Benzinga's Top #PreMarket Gainers,2015-10-15 08:30:00-04:00,DXCM,positive
393507.0,"Leerink Swann Upgrades DexCom to Outperform, Raises PT to $100.00",2015-10-15 08:06:00-04:00,DXCM,neutral
393508.0,"Sterne Agee CRT Upgrades DexCom to Buy, Announces $90.00 PT",2015-10-15 06:04:00-04:00,DXCM,neutral
393509.0,"5 After-Hours Movers: Netflix, MBIA And More",2015-10-14 16:49:00-04:00,DXCM,neutral
393510.0,DexCom Reports Q3 Prelim Revs $105M vs Est $97.47M,2015-10-14 16:07:00-04:00,DXCM,neutral
393511.0,Dexcom Spikes to High on Volume,2015-09-10 13:08:00-04:00,DXCM,neutral
393512.0,FDA Approves Dexcom G5® Mobile Continuous Glucose Monitoring System,2015-08-25 08:31:00-04:00,DXCM,positive
393513.0,DexCom Reports Collaboration with The Life Sciences Team at Google Related to Breakthrough Technologies to Change Future of Diabetes Mgmt,2015-08-11 08:02:00-04:00,DXCM,neutral
393514.0,"DexCom Reports Q2 EPS $(0.05) vs. Est. $(0.03), Rev. $93.2M vs. Est. $84.81M",2015-08-05 16:13:00-04:00,DXCM,neutral
393515.0,Benzinga's Top Initiations,2015-07-08 09:51:00-04:00,DXCM,positive
393516.0,"Baird Initiates DexCom, Tandem Diabetes At Outperform On Large Growth Expectations",2015-07-08 09:47:00-04:00,DXCM,positive
393517.0,"Baird Initiates Coverage on DexCom at Outperform, Announces $95.00 PT",2015-07-08 07:13:00-04:00,DXCM,neutral
393518.0,Stocks Hitting 52-Week Highs,2015-07-01 10:29:00-04:00,DXCM,neutral
393519.0,Stocks Hitting 52-Week Highs,2015-06-29 10:31:00-04:00,DXCM,neutral
393520.0,Dexcom Reports Follow App Available/Compatible with Android Devices,2015-06-02 08:05:00-04:00,DXCM,neutral
393521.0,5 Mid-Cap Healthcare Stocks With The Highest EPS Growth Forecast For Next 5 Years,2015-03-17 08:59:00-04:00,DXCM,positive
393522.0,DexCom Reports Fourth Quarter EPS of $0.02,2015-02-25 16:21:00-05:00,DXCM,neutral
393523.0,Good News For Apple Watch: FDA Steps Back From App Regulation,2015-02-09 10:51:00-05:00,DXCM,positive
393524.0,'FDA permits marketing of first system of mobile medical apps for continuous glucose monitoring',2015-01-23 16:07:00-05:00,DXCM,neutral
393525.0,From 8-K: DexCom Sees FY2014 Sales $257.0M vs $250.0M Est,2015-01-13 08:36:00-05:00,DXCM,neutral
393526.0,"Sterne Agee Downgrades DexCom to Neutral, Removes $56.00 PT",2015-01-06 06:38:00-05:00,DXCM,neutral
393527.0,"DexCom Inc Names Kevin Sayer As President, CEO; Terry Gregg Assumes Role Of Executive Chairman",2015-01-05 08:33:00-05:00,DXCM,neutral
393528.0,"Cowen & Company Initiates Coverage on DexCom, Inc. at Outperform, Announces $65.00 PT",2014-12-08 06:24:00-05:00,DXCM,neutral
393529.0,Dexcom Registers 89.3K Shares For Sale,2014-11-07 16:20:00-05:00,DXCM,positive
393530.0,"Midday Gainers From November 7: Channel Advisor, Eaton Vance, Envestnet, Interval Leisure, DexCom",2014-11-07 12:39:00-05:00,DXCM,neutral
393531.0,FDA Approves Dexcom Software With Artificial Pancreas Algorithm ,2014-11-06 08:30:00-05:00,DXCM,positive
393532.0,FDA Approves Dexcom SHARE ,2014-10-20 09:26:00-04:00,DXCM,positive
393533.0,"DexCom, Inc. Reports Q2 EPS of $(0.09) vs $(0.10) Est; Revenue of $58.80M vs $52.45M Est",2014-08-06 16:39:00-04:00,DXCM,neutral
393534.0,5 New Medical Technologies For Diabetics,2014-07-18 13:10:00-04:00,DXCM,neutral
393535.0,"8-K from Dexcom Shows Co. Entered Settlement, License Deal July 2nd with Abbott Diabetes, Party Not Acquired in Change of Control to Be Paid $25M",2014-07-07 08:33:00-04:00,DXCM,positive
393536.0,Shares of Dexcom Moving Higher Following CEO Gregg's Appearance on CNBC's Fast Money,2014-06-04 17:39:00-04:00,DXCM,positive
393537.0,DexCom CEO Gregg: 'Our Long-Term Goal is to Replace Finger Sticks',2014-05-15 18:42:00-04:00,DXCM,neutral
393538.0,DexCom CEO Gregg: 'The Individuals Who Have Diabetes Make the Choice and they Choose Us',2014-05-15 18:42:00-04:00,DXCM,neutral
393539.0,DexCom CEO Gregg: 'Our Products Allow Patients to Have Constant Monitoring of Glucose Levels',2014-05-15 18:40:00-04:00,DXCM,positive
393540.0,Jim Cramer Interviews CEO Terrance H. Gregg of DexCom on Mad Money,2014-05-15 18:37:00-04:00,DXCM,negative
393541.0,"DexCom, Inc. Reports Q1 EPS of $(0.17) vs $(0.08) Est; Revenue of $47.10M vs $44.15M Est",2014-05-01 16:20:00-04:00,DXCM,neutral
393542.0,"Sterne Agee Upgrades DexCom, Inc. to Buy, Maintains $50.00 PT",2014-04-10 08:47:00-04:00,DXCM,neutral
393543.0,"DexCom Wins FDA Warning Letter for Admin Deficiencies, Will Submit Materials to Demonstrate Compliance, Says No Sanctions Levied by FDA",2014-03-25 08:37:00-04:00,DXCM,neutral
393544.0,Mid-Morning Market Update: Markets Open Higher; Groupon Issues Weak Outlook,2014-02-21 10:34:00-05:00,DXCM,negative
393545.0,"DexCom, Inc. Reports Q4 EPS of $(0.04) vs $(0.07) Est; Revenue of $51.70M vs $48.53M Est",2014-02-20 16:24:00-05:00,DXCM,neutral
393546.0,"Feltl & Co. Downgrades DexCom, Inc. to Sell",2014-02-20 09:36:00-05:00,DXCM,neutral
393547.0,Innovative Dexcom G4® PLATINUM Continuous Glucose Monitor (CGM) Receives FDA Approval for Use in Children Ages 2-17 Years,2014-02-03 18:00:00-05:00,DXCM,positive
393548.0,FDA Approves Pediatric Use of Dexcom's G4 Platinum Continuous Glucose Monitoring System,2014-02-03 17:52:00-05:00,DXCM,positive
393549.0,"DexCom, Inc. Sees Q3 Sales $51.0M vs $45.80M Est",2014-01-14 08:35:00-05:00,DXCM,neutral
393550.0,"DexCom, Inc. Sees FY2014 Sales $205.0M-225.0M vs $212.70M Est",2014-01-14 08:35:00-05:00,DXCM,neutral
393551.0,Market Wrap For November 7: Markets Take A Breather As Twitter Takes Center Stage,2013-11-07 16:42:00-05:00,DXCM,neutral
393552.0,"Wedbush Maintains Outperform on DexCom, Inc., Raises PT to $39.00",2013-11-07 09:12:00-05:00,DXCM,neutral
393553.0,"Northland Securities Upgrades DexCom, Inc. to Market Perform, Raises PT to $30.00",2013-11-07 07:43:00-05:00,DXCM,positive
393554.0,"DexCom, Inc. Reports Q3 EPS of $(0.08) vs $(0.13) Est; Revenue of $42.90M vs $35.87M Est",2013-11-06 16:08:00-05:00,DXCM,neutral
393555.0,UPDATE: Benchmark Initiates Coverage on DexCom on Upside From New G4 Platinum Sensor,2013-10-15 11:30:00-04:00,DXCM,neutral
393556.0,"Benchmark Initiates Coverage on DexCom, Inc. at Buy, Announces $37.00 PT",2013-10-15 06:30:00-04:00,DXCM,neutral
393557.0,UPDATE: J.P. Morgan Initiates Coverage on DexCom on Market Leader Position,2013-09-13 11:32:00-04:00,DXCM,neutral
393558.0,Benzinga's Top Initiations,2013-09-13 07:58:00-04:00,DXCM,positive
393559.0,"JP Morgan Initiates Coverage on DexCom, Inc. at Overweight, Announces $32.00 PT",2013-09-13 07:27:00-04:00,DXCM,neutral
393560.0,"JP Morgan Initiates Coverage on DexCom, Inc. at Overweight, Announces $32.00 PT",2013-09-13 07:24:00-04:00,DXCM,neutral
393561.0,"Market Wrap for Thursday, August 8: Stocks Snap Losing Streak With Modest Rally ",2013-08-08 16:27:00-04:00,DXCM,negative
393562.0,UPDATE: Jefferies Raises PT on DexCom Following Strong 2Q Results,2013-08-08 10:42:00-04:00,DXCM,positive
393563.0,"Jefferies Maintains Buy on DexCom, Inc., Raises PT to $27.00",2013-08-08 07:43:00-04:00,DXCM,neutral
393564.0,"Wunderlich Suspends Hold Rating on DexCom, Inc., Removes $20.00 PT",2013-08-08 07:20:00-04:00,DXCM,neutral
393565.0,"DexCom, Inc. Reports Q2 EPS of $(0.14) vs $(0.16) Est; Revenue of $35.80M vs $31.13M Est",2013-08-07 16:17:00-04:00,DXCM,neutral
393566.0,"Northland Securities Downgrades DexCom, Inc. to Underperform, Raises PT to $17.00",2013-07-24 09:28:00-04:00,DXCM,positive
393567.0,UPDATE: Canaccord Genuity Raises PT on Dexcom on Multiple Catalysts Ahead,2013-06-24 10:14:00-04:00,DXCM,neutral
393568.0,"Canaccord Genuity Maintains Buy on DexCom, Inc., Raises PT to $25.00",2013-06-24 09:58:00-04:00,DXCM,neutral
393569.0,"Feltl & Co. Downgrades DexCom, Inc. to Sell",2013-06-13 09:40:00-04:00,DXCM,neutral
393570.0,UPDATE: Wunderlich Securities Downgrades DexCom to Hold on Valuation,2013-06-10 08:17:00-04:00,DXCM,positive
393571.0,"Wunderlich Downgrades DexCom, Inc. to Hold, Maintains $20.00 PT",2013-06-10 07:05:00-04:00,DXCM,neutral
393572.0,"DexCom, Inc. Reports Q1 EPS of $(0.16) vs $(0.17) Est; Revenue of $29.60M vs $28.33M Est",2013-05-01 17:00:00-04:00,DXCM,neutral
393573.0,"Wunderlich Maintains Buy on DexCom, Inc., Raises PT to $20.00",2013-03-13 06:47:00-04:00,DXCM,neutral
393574.0,"UPDATE: Oppenheimer Reiterates Perform Rating, Raises PT on DexCom on 4Q12 Revenues",2013-02-22 13:40:00-05:00,DXCM,neutral
393575.0,"DexCom, Inc. Reports Q4 EPS of $(0.12) vs $(0.16) Est; Revenue of $33.30M vs $31.09M Est",2013-02-21 16:28:00-05:00,DXCM,neutral
393576.0,"UPDATE: Wunderlich Securities Reiterates Buy Rating, Raises PT on DexCom",2013-01-14 09:17:00-05:00,DXCM,positive
393577.0,"Wunderlich Maintains Buy on DexCom, Inc., Raises PT to $18.00",2013-01-14 07:46:00-05:00,DXCM,neutral
393578.0,"Dexcom Names Kevin Sayer as COO; Sees Q4 Product Sales $31.6M, FY13 Sales $120-130M",2013-01-07 08:39:00-05:00,DXCM,neutral
393579.0,"UPDATE: Jefferies & Company Reiterates Buy Rating, Lowers PT on DexCom",2012-11-02 12:30:00-04:00,DXCM,negative
393580.0,"Canaccord Maintains DexCom at Buy, Lowers PT from $20 to $19",2012-11-02 08:56:00-04:00,DXCM,negative
393581.0,"Jefferies & Company Maintains DexCom at Buy, Lowers PT from $18 to $16.50",2012-11-02 07:00:00-04:00,DXCM,negative
393582.0,DexCom Reports Q3 EPS $-0.25 vs $-0.22 Est,2012-11-01 16:23:00-04:00,DXCM,neutral
393583.0,"Wedbush Securities Maintains DexCom at Outperform, Raises PT from $15 to $16",2012-10-09 08:20:00-04:00,DXCM,positive
393584.0,"Feltl and Company Maintains DexCom at Hold, Raises PT from $10.75 to $14",2012-10-08 13:28:00-04:00,DXCM,neutral
393585.0,"Canaccord Maintains DexCom at Buy, Raises PT from $14 to $20",2012-10-08 12:07:00-04:00,DXCM,neutral
393586.0,U.S. FDA Approves the Dexcom G4 PLATINUM Continuous Glucose Monitor ,2012-10-08 08:01:00-04:00,DXCM,positive
393587.0,"Option Alert: Dexcom October 15 Call; Block Trade: 2,500 Contracts @$0.65",2012-09-21 10:43:00-04:00,DXCM,negative
393588.0,"Piper Jaffray Maintains DexCom at Overweight, Raises PT from $14 to $17",2012-09-20 06:42:00-04:00,DXCM,negative
393589.0,"Jefferies & Company Maintains DexCom at Buy, Raises PT from $15 to $18",2012-09-20 06:21:00-04:00,DXCM,neutral
393590.0,"Jefferies & Company Maintains DexCom at Buy, Raises PT from $14 to $15",2012-08-07 08:31:00-04:00,DXCM,neutral
393591.0,DexCom Reports Q2 EPS $-0.21 vs $-0.20 Est; Revenues $23.5M vs $22.24M Est,2012-08-06 17:17:00-04:00,DXCM,neutral
393592.0,McNicoll Lewis Vlak Suspends Coverage on DexCom,2012-07-16 07:01:00-04:00,DXCM,neutral
393593.0,Dexcom Receives CE Mark Approval for the Dexcom G4 Continuous Glucose Monitoring System   ,2012-06-14 08:30:00-04:00,DXCM,positive
393594.0,"McNicoll Lewis Vlak Maintains DexCom at Hold, Raises PT from $9 to $10",2012-05-03 08:56:00-04:00,DXCM,neutral
393595.0,"Feltl and Company Maintains DexCom at Hold, Raises PT from $9 to $Sat Dec 30 1899 08:15:00 GMT-0800 (PST)",2012-05-03 08:35:00-04:00,DXCM,neutral
393596.0,DexCom Reports Q1 EPS $-0.21 vs $-0.19 Est; Revenues $20.1M vs $19.88M Est,2012-05-02 17:00:00-04:00,DXCM,neutral
393597.0,UPDATE: Brean Murray Carret Raises Target on DexCom to $13.50,2012-02-24 16:09:00-05:00,DXCM,neutral
393598.0,UPDATE: Canaccord Genuity Raises Target on DexCom to $11.50,2012-02-24 12:19:00-05:00,DXCM,neutral
393599.0,UPDATE: Wunderlich Securities Raises Price Target on DexCom to $15,2012-02-24 09:46:00-05:00,DXCM,positive
393600.0,"Brean Murray Carret & Co. Maintains DexCom at Buy, Raises PT from $12.5 to $13.5",2012-02-24 07:06:00-05:00,DXCM,neutral
393601.0,"Wunderlich Securities Maintains DexCom at Buy, Raises PT from $12 to $15",2012-02-24 06:05:00-05:00,DXCM,positive
393602.0,DexCom Reports Q4 EPS $(0.18) vs $(0.17) Est; Revenues $22.40M vs $21.63M Est	 				,2012-02-23 16:13:00-05:00,DXCM,neutral
393603.0,DexCom Announces Acquisition of SweetSpot Diabetes Care for $4.5M  ,2012-02-23 16:04:00-05:00,DXCM,positive
393604.0,"UPDATE: Brean Murray Carret Initiates Buy, $12.50 Target on DexCom",2012-01-17 10:56:00-05:00,DXCM,neutral
393605.0,Brean Murray Initiates DexCom at Buy,2012-01-17 07:22:00-05:00,DXCM,neutral
393606.0,Piper Jaffray Reiterates Overweight Rating on DexCom,2012-01-11 09:06:00-05:00,DXCM,negative
393607.0,Feltl and Company Lowers PT on DexCom to $9,2012-01-11 08:47:00-05:00,DXCM,negative
393608.0,Oppenheimer Reiterates Perform on DexCom,2012-01-11 08:12:00-05:00,DXCM,neutral
393609.0,Afternoon Movers; Positive US News,2011-12-29 16:07:00-05:00,DXCM,positive
393610.0,UPDATE: Wunderlich Initiates Coverage on DexCom at Buy,2011-12-29 07:41:00-05:00,DXCM,neutral
393611.0,"Wunderlich Securities Initiates DexCom at Buy, $12 PT",2011-12-29 07:04:00-05:00,DXCM,positive
393612.0,"MLV & Co. Starts Coverage Of DexCom With Buy, $11 PT",2011-12-20 11:11:00-05:00,DXCM,neutral
393613.0,McNicoll Lewis & Vlak Initiates DexCom at Buy,2011-12-20 08:38:00-05:00,DXCM,neutral
393614.0,DexCom Hits 52-Week Low of $6.75,2011-11-23 09:30:00-05:00,DXCM,negative
393615.0,DexCom Hits 52-Week Low of $6.86,2011-11-22 11:41:00-05:00,DXCM,negative
393616.0,DexCom Hits 52-Week Low of $6.89,2011-11-21 10:06:00-05:00,DXCM,negative
393617.0,Top Narrow Based Indexes For September 20,2011-09-20 10:21:00-04:00,DXCM,positive
393618.0,Morgan Keegan Maintains Outperform on DexCom,2011-09-20 09:21:00-04:00,DXCM,neutral
393619.0,Pre-Market Losers; Cincinnati Bell Down 13%,2011-08-19 09:23:00-04:00,DXCM,negative
393620.0,UPDATE: Feltl & Co Upgrades DexCom from Hold to Buy and Lowers PT from $15.85 to $15.35,2011-08-16 09:44:00-04:00,DXCM,negative
393621.0,"Feltl Upgrades DexCom To Buy, PT Raised To $15.85",2011-08-16 08:53:00-04:00,DXCM,neutral
393622.0,Hearing Negative Twitter Chatter on DexCom,2011-07-19 09:49:00-04:00,DXCM,negative
393623.0,Wedbush Reiterates Outperform and PT of $18 on DexCom,2011-06-30 08:31:00-04:00,DXCM,neutral
393624.0,Piper Jaffray Reiterates Overweight and PT of $20 on DexCom,2011-06-27 06:18:00-04:00,DXCM,negative
393625.0,Piper Jaffray Highlights DXCM's Early Continuous Glucose Management Data,2011-05-26 08:17:00-04:00,DXCM,neutral
393626.0,"Jefferies Reiterates Buy On DexCom, Raises PT To $19.50 (DXCM)",2011-05-04 13:00:00-04:00,DXCM,neutral
393627.0,UPDATE: Jefferies Raises Price Target On DexCom Following Earnings (DXCM),2011-05-04 09:05:00-04:00,DXCM,neutral
393628.0,Wedbush Raises PT On DexCom To $18 After In-Line 1Q Results,2011-05-04 09:05:00-04:00,DXCM,neutral
393629.0,DexCom Announces Board Additions; Names Kevin Sayer President (DXCM),2011-05-03 16:02:00-04:00,DXCM,neutral
393630.0,Jefferies Initiating Coverage On DexCom At Buy,2011-03-29 07:52:00-04:00,DXCM,neutral
393631.0,"Jefferies Initiates DexCom At Buy, $17 PT",2011-03-29 07:10:00-04:00,DXCM,neutral
393632.0,Piper Jaffray Reiterating Overweight On DexCom (DXCM),2011-03-04 07:49:00-05:00,DXCM,negative
393633.0,DexCom Inc. Reports Fourth Quarter and Full Year 2010 Financial Results ,2011-03-03 16:07:00-05:00,DXCM,neutral
393634.0,Takeover Candidates In Medical Tech ,2010-12-20 14:31:00-05:00,DXCM,neutral
393635.0,"Benzinga's Volume Movers (ATLS, DXCM, APEI, BSFT)",2010-11-09 10:56:00-05:00,DXCM,neutral
393636.0,DexCom EPS Meets but Sales Misses - Analyst Blog,2010-11-08 17:33:00-05:00,DXCM,negative
393637.0,DexCom Announces the Sale of 2.85 Million Shares ,2010-11-08 16:27:00-05:00,DXCM,positive
393638.0,DexCom Falls Out of Bed (DXCM),2010-11-05 12:18:00-04:00,DXCM,neutral
393639.0,DexCom Plummets 21% On Earnings And Revenue Miss(DXCM),2010-11-05 11:28:00-04:00,DXCM,neutral
393640.0,DexCom Shares Plummet 20% After Hours (DXCM),2010-11-04 19:03:00-04:00,DXCM,positive
393641.0,DexCom Inc. Reports Third Quarter 2010 Financial Results: Loss Per Share of $0.23,2010-11-04 17:00:00-04:00,DXCM,neutral
393642.0,DXCM Expects To Reach Profitability On Existing And Milestone Cash,2010-08-13 13:21:00-04:00,DXCM,positive
393643.0,"DexCom Meets, Beats on Sales - Analyst Blog",2010-08-04 12:48:00-04:00,DXCM,neutral
393644.0,William Blair Reiterates Outperform on DexCom (DXCM),2010-08-04 09:52:00-04:00,DXCM,neutral
393645.0,"Mad Money Lightning Round OT (BRCM, MGA, JCI, DXCM, ABT)",2010-07-20 20:07:00-04:00,DXCM,negative
