Unnamed: 0,title,date,stock,sentiment
393056.0,10 Biggest Price Target Changes For Tuesday,2020-06-09 08:15:00-04:00,DXCM,neutral
393057.0,"Raymond James Maintains Outperform on DexCom, Raises Price Target to $395",2020-06-09 07:15:00-04:00,DXCM,neutral
393058.0,"DexCom shares are trading lower, not currently seeing company-specific news for the session. NOTE: Stock has gained on heavy momentum this year and appears to be giving back some gains following run up.",2020-06-04 13:27:00-04:00,DXCM,positive
393059.0,"Shares of several healthcare companies are trading higher amid market strength. Strength potentially related to coronavirus efforts including testing, vaccine development and treatment measures from several names in the sector.",2020-05-28 12:33:00-04:00,DXCM,positive
393060.0,"Piper Sandler Maintains Overweight on DexCom, Raises Price Target to $450",2020-05-27 08:16:00-04:00,DXCM,negative
393061.0,Trump Says Reached 'Breakthrough' Agreement On Cost Of Insulin,2020-05-26 16:34:00-04:00,DXCM,positive
393062.0,"The Daily Biotech Pulse: FDA Nod For Roche, Arbutus Releases Positive Readout For HBV Therapy, Moderna Announces $1.34B Common Stock Offering",2020-05-19 08:24:00-04:00,DXCM,positive
393063.0,Stocks That Hit 52-Week Highs On Monday,2020-05-18 10:44:00-04:00,DXCM,neutral
393064.0,"Benzinga's Top Upgrades, Downgrades For May 14, 2020",2020-05-14 09:31:00-04:00,DXCM,positive
393065.0,"Wells Fargo Initiates Coverage On DexCom with Equal-Weight Rating, Announces Price Target of $420",2020-05-14 07:27:00-04:00,DXCM,positive
393066.0,"The Daily Biotech Pulse: NASH Disappointment For Genfit, Novavax Lands $384M CEPI Funding For Coronavirus Vaccine, GW Pharma Earnings",2020-05-12 08:06:00-04:00,DXCM,negative
393067.0,'Jim Cramer reviews top 10 stocks 'for this difficult moment' on the 'Cramer Covid-19 Index'' -CNBC,2020-05-11 21:48:00-04:00,DXCM,negative
393068.0,Stocks That Hit 52-Week Highs On Monday,2020-05-11 10:28:00-04:00,DXCM,neutral
393069.0,DexCom Announces Proposed Offering of $850M of Convertible Senior Notes,2020-05-11 07:40:00-04:00,DXCM,neutral
393070.0,"The Daily Biotech Pulse: Ayala IPO, Pluristem Starts Phase 2 Trial Of COVID Treatment, European Nod For Takeda",2020-05-08 07:59:00-04:00,DXCM,neutral
393071.0,Stocks That Hit 52-Week Highs On Thursday,2020-05-07 10:33:00-04:00,DXCM,neutral
393072.0,DexCom shares are trading higher after S&P Dow Jones Indices announced DexCom is set to join the S&P 500.,2020-05-07 08:41:00-04:00,DXCM,positive
393073.0,"The Daily Biotech Pulse: FDA Approves Novartis Lung Cancer Drug, 2-Way Contest Emerging For Tetraphase Pharma, Dexcom To Join S&P 500",2020-05-07 07:41:00-04:00,DXCM,negative
393074.0,S&P Dow Jones Indices Announces 'DexCom & Domino's Pizza Set to Join S&P 500; Salesforce.com to Join S&P 100; STORE Capital to Join S&P MidCap 400; Capri Holdings to Join S&P SmallCap 600',2020-05-06 17:18:00-04:00,DXCM,positive
393075.0,Stocks That Hit 52-Week Highs On Wednesday,2020-05-06 10:43:00-04:00,DXCM,neutral
393076.0,"The Daily Biotech Pulse: FDA Nod For AstraZeneca, AbbVie-Allergan Deal Clears Antitrust Hurdle",2020-05-06 08:42:00-04:00,DXCM,positive
393077.0,"Cramer Gives His Opinion On Tandem Diabetes, JPMorgan And More",2020-05-06 07:15:00-04:00,DXCM,neutral
393078.0,Shares of several healthcare companies are trading higher amid positive investor sentiment as some US states begin to reopen their economies and as oil prices gain for the session.,2020-05-05 12:44:00-04:00,DXCM,positive
393079.0,Stocks That Hit 52-Week Highs On Tuesday,2020-05-05 10:48:00-04:00,DXCM,neutral
393080.0,"The Daily Biotech Pulse: Bio-Rad's Coronavirus Test Gets EUA, Beat-And-Raise Quarter From GenMark, Adverum's Positive Gene Therapy Readout",2020-05-05 08:00:00-04:00,DXCM,positive
393081.0,Watching Dexcom Shares As Hearing David Einhorn Q1 Letter To Greenlight Investors Shows Covered Short In Stock,2020-05-01 09:44:00-04:00,DXCM,positive
393082.0,"The Daily Biotech Pulse: Gilead Slips Despite Forecast-Beating Q1, Moderna Partners With Lonza For Coronavirus Vaccine Production, Lyra Therapeutics IPO",2020-05-01 07:54:00-04:00,DXCM,neutral
393083.0,Stocks That Hit 52-Week Highs On Thursday,2020-04-30 10:31:00-04:00,DXCM,neutral
393084.0,"UBS Maintains Neutral on DexCom, Raises Price Target to $335",2020-04-30 09:31:00-04:00,DXCM,neutral
393085.0,"The Daily Biotech Pulse: FDA Nod For GlaxoSmithKline, Hologic To Launch Coronavirus Test, Amarin's Strong Q1",2020-04-30 07:19:00-04:00,DXCM,positive
393086.0,108 Biggest Movers From Yesterday,2020-04-30 05:30:00-04:00,DXCM,neutral
393087.0,"Guggenheim Maintains Buy on DexCom, Raises Price Target to $395",2020-04-29 13:35:00-04:00,DXCM,neutral
393088.0,82 Stocks Moving In Wednesday's Mid-Day Session,2020-04-29 12:50:00-04:00,DXCM,neutral
393089.0,"Citigroup Maintains Buy on DexCom, Raises Price Target to $361",2020-04-29 11:36:00-04:00,DXCM,neutral
393090.0,"Piper Sandler Maintains Overweight on DexCom, Raises Price Target to $375",2020-04-29 10:06:00-04:00,DXCM,negative
393091.0,"Stifel Maintains Buy on DexCom, Raises Price Target to $385",2020-04-29 09:40:00-04:00,DXCM,neutral
393092.0,"JP Morgan Maintains Overweight on DexCom, Raises Price Target to $360",2020-04-29 09:36:00-04:00,DXCM,neutral
393093.0,"Morgan Stanley Maintains Equal-Weight on DexCom, Raises Price Target to $377",2020-04-29 08:46:00-04:00,DXCM,neutral
393094.0,"The Daily Biotech Pulse: Inovio's MERS Vaccine Data, Fast Track Designation For Erytech, FDA Approves Higher Dose Of Merck's Keytruda",2020-04-29 08:40:00-04:00,DXCM,positive
393095.0,"Oppenheimer Maintains Outperform on DexCom, Raises Price Target to $360",2020-04-29 08:31:00-04:00,DXCM,neutral
393096.0,"Raymond James Maintains Outperform on DexCom, Raises Price Target to $360",2020-04-29 08:30:00-04:00,DXCM,neutral
393097.0,DexCom shares are trading higher after the company reported better-than-expected Q1 sales results.,2020-04-29 07:50:00-04:00,DXCM,positive
393098.0,35 Stocks Moving in Wednesday's Pre-Market Session,2020-04-29 07:21:00-04:00,DXCM,neutral
393099.0,23 Stocks Moving In Tuesday's After-Hours Session,2020-04-28 17:20:00-04:00,DXCM,neutral
393100.0,DexCom shares are trading higher after the company reported better-than-expected Q1 sales results.,2020-04-28 16:10:00-04:00,DXCM,positive
393101.0,"DexCom Q1 EPS $0.440 May Not Compare To $0.140 Estimate, Sales $405.100M Beat $358.620M Estimate",2020-04-28 16:03:00-04:00,DXCM,neutral
393102.0,"The Daily Biotech Pulse: Pfizer Earnings, Roche's Spinal Muscular Dystrophy Treatment, Moderna COVID-19 Vaccine Update",2020-04-28 07:36:00-04:00,DXCM,neutral
393103.0,"Raymond James Maintains Outperform on DexCom, Raises Price Target to $350",2020-04-27 11:38:00-04:00,DXCM,neutral
393104.0,Stocks That Hit 52-Week Highs On Monday,2020-04-27 10:21:00-04:00,DXCM,neutral
393105.0,"The Week Ahead In Biotech (April 26-May 2): Cancer Conference, Earnings News Flow In The Spotlight",2020-04-26 16:37:00-04:00,DXCM,negative
393106.0,Shares of several healthcare companies are trading higher as equities gain amid oil prices potentially stabilizing following the recent crash.,2020-04-22 12:03:00-04:00,DXCM,positive
393107.0,Stocks That Hit 52-Week Highs On Friday,2020-04-17 10:19:00-04:00,DXCM,neutral
393108.0,"The Daily Biotech Pulse: Moderna Secures $483M In BARDA Funding, Gilead Remdesivir Data, Veracyte's Positive Pre-Announcement",2020-04-17 07:35:00-04:00,DXCM,positive
393109.0,Stocks That Hit 52-Week Highs On Thursday,2020-04-16 10:19:00-04:00,DXCM,neutral
393110.0,Shares of several healthcare companies are trading higher amid overall market strength after the US Federal Reserve announced a further $2.3 trillion in financing programs to support the economy. Other potential positive sector catalysts include demand for therapies and medical supplies amid the coronavirus pandemic and US Senator Sanders exiting the Presidential race.,2020-04-09 09:58:00-04:00,DXCM,positive
393111.0,Shares of several healthcare companies are trading higher amid overall market strength. Several companies in the sector may also be benefiting from increased demand for therapies and medical supplies amid the coronavirus pandemic. UPDATE: Shares of some names in the sector moved higher later in the session following news that US Senator Sanders has suspended his presidential campaign.,2020-04-08 09:34:00-04:00,DXCM,positive
393112.0,Shares of several healthcare companies are trading lower amid market weakness as growing coronavirus concerns in the US weigh on equities.,2020-04-01 09:20:00-04:00,DXCM,negative
393113.0,DexCom shares are trading higher despite market weakness. Morgan Stanley analysts today maintained an Equal-Weight rating on the stock and raised the price target from $270 to $278.,2020-03-27 11:55:00-04:00,DXCM,positive
393114.0,"Morgan Stanley Maintains Equal-Weight on DexCom, Raises Price Target to $278",2020-03-27 09:27:00-04:00,DXCM,neutral
393115.0,"Shares of several healthcare companies are trading higher following Senate passage of a $2 trillion economic stimulus package, which has lifted stocks across sectors.",2020-03-26 11:49:00-04:00,DXCM,positive
393116.0,"Stephens & Co. Maintains Overweight on DexCom, Lowers Price Target to $240",2020-03-23 11:26:00-04:00,DXCM,negative
393117.0,DexCom shares are trading higher despite overall market weakness. Not currently seeing company-specific news.,2020-03-18 11:10:00-04:00,DXCM,positive
393118.0,Shares of several healthcare companies are trading lower in sympathy with the overall market on continued downward momentum caused by the coronavirus. The virus has had a negative impact on the global economy.,2020-03-16 09:40:00-04:00,DXCM,negative
393119.0,DexCom shares are trading lower despite market strength. Not currently seeing negative company-specific news.,2020-03-13 11:21:00-04:00,DXCM,positive
393120.0,"Oppenheimer Maintains Outperform on DexCom, Raises Price Target to $305",2020-03-06 11:39:00-05:00,DXCM,neutral
393121.0,Lipper Award Winners Pick Healthcare and Technology Stocks Amidst Coronavirus Downturn,2020-03-06 08:33:00-05:00,DXCM,positive
393122.0,"Benzinga's Top Upgrades, Downgrades For March 5, 2020",2020-03-05 10:05:00-05:00,DXCM,positive
393123.0,"Citigroup Initiates Coverage On DexCom with Buy Rating, Announces $330 Price Target",2020-03-05 05:16:00-05:00,DXCM,neutral
393124.0,Shares of several healthcare and biotech companies are trading lower amid continued spread of coronavirus including notable upticks in Iran and Italy. NOTE: The virus has raised fear of a global economic slowdown.,2020-02-24 08:37:00-05:00,DXCM,negative
393125.0,"The Daily Biotech Pulse: FDA Approves Baudax Bio's Non-Opioid Pain Drug, Aerie Rallies On Q4 Results, D-Day For Esperion",2020-02-21 07:46:00-05:00,DXCM,negative
393126.0,"The Daily Biotech Pulse: Heron Pain Drug Review Extended, Disappointment For Teva In Tourette Syndrome Study",2020-02-20 07:06:00-05:00,DXCM,negative
393127.0,Stocks That Hit 52-Week Highs On Wednesday,2020-02-19 10:32:00-05:00,DXCM,neutral
393128.0,"The Daily Biotech Pulse: FDA Snub For Merck, Priority Review For Roche's Tecentriq sBLA",2020-02-19 07:21:00-05:00,DXCM,negative
393129.0,Dexcom And Insulet Announce Commercial Agreement To Integrate The Dexcom G6 And Future G7 CGM Into Insulet's Omnipod Horizon Automated Insulin Delivery System,2020-02-19 07:10:00-05:00,DXCM,positive
393130.0,"Morgan Stanley Maintains Equal-Weight on DexCom, Raises Price Target to $270",2020-02-18 07:47:00-05:00,DXCM,neutral
393131.0,76 Biggest Movers From Friday,2020-02-18 05:13:00-05:00,DXCM,neutral
393132.0,50 Stocks Moving In Friday's Mid-Day Session,2020-02-14 12:23:00-05:00,DXCM,neutral
393133.0,"CFRA Maintains Hold on DexCom, Raises Price Target to $258",2020-02-14 11:58:00-05:00,DXCM,neutral
393134.0,"Canaccord Genuity Maintains Buy on DexCom, Raises Price Target to $300",2020-02-14 10:18:00-05:00,DXCM,neutral
393135.0,Stocks That Hit 52-Week Highs On Friday,2020-02-14 10:15:00-05:00,DXCM,neutral
393136.0,"Oppenheimer Maintains Outperform on DexCom, Raises Price Target to $285",2020-02-14 09:49:00-05:00,DXCM,neutral
393137.0,10 Biggest Price Target Changes For Friday,2020-02-14 08:44:00-05:00,DXCM,neutral
393138.0,DexCom shares are trading higher after the company reported better-than-expected Q4 EPS and sales results.,2020-02-14 08:35:00-05:00,DXCM,positive
393139.0,"The Daily Biotech Pulse: Epizyme's Tazemetostat sNDA Accepted For Priority Review, Eisai To Withdraw Weight Loss Drug, Sol-Gel Prices Offering",2020-02-14 08:23:00-05:00,DXCM,negative
393140.0,"Raymond James Maintains Outperform on DexCom, Raises Price Target to $288",2020-02-14 07:46:00-05:00,DXCM,neutral
393141.0,"UBS Maintains Neutral on DexCom, Raises Price Target to $275",2020-02-14 07:22:00-05:00,DXCM,neutral
393142.0,30 Stocks Moving in Friday's Pre-Market Session,2020-02-14 07:11:00-05:00,DXCM,neutral
393143.0,"Stephens & Co. Maintains Overweight on DexCom, Raises Price Target to $300",2020-02-14 06:29:00-05:00,DXCM,negative
393144.0,DexCom shares are trading higher after the company reported better-than-expected Q4 EPS and sales results.,2020-02-13 16:27:00-05:00,DXCM,positive
393145.0,DexCom Sees FY20 Sales $1.725B-$1.775B vs $1.77B Estimate,2020-02-13 16:02:00-05:00,DXCM,neutral
393146.0,"DexCom Q4 Adj. EPS $1.15 Beats $0.74 Estimate, Sales $462.8M Beat $442.38M Estimate",2020-02-13 16:01:00-05:00,DXCM,neutral
393147.0,"The Daily Biotech Pulse: Deciphera Cancer Drug Gets Priority Review, Fast Track Designation For Soligenix, Revolution Medicines IPO",2020-02-13 08:05:00-05:00,DXCM,negative
393148.0,"Earnings Scheduled For February 13, 2020",2020-02-13 04:27:00-05:00,DXCM,neutral
393149.0,Stocks That Hit 52-Week Highs On Wednesday,2020-02-12 11:45:00-05:00,DXCM,neutral
393150.0,"The Daily Biotech Pulse: J&J Intensifies Efforts On COVID-19 Cure, Adamas Reports Positive, Long-Term Gocovri Data",2020-02-12 09:18:00-05:00,DXCM,positive
393151.0,Stocks That Hit 52-Week Highs On Tuesday,2020-02-11 10:17:00-05:00,DXCM,neutral
393152.0,"The Daily Biotech Pulse: LogicBio Slapped With Clinical Hold, Agile Inks Debt Deal Ahead of Twirla Approval, Gilead Builds Stake In Sierra Oncology",2020-02-11 07:23:00-05:00,DXCM,positive
393153.0,The Week Ahead In Biotech: SMID-Cap Earnings In The Spotlight,2020-02-09 15:22:00-05:00,DXCM,neutral
393154.0,Stocks That Hit 52-Week Highs On Friday,2020-01-31 10:23:00-05:00,DXCM,neutral
393155.0,"DexCom Sees Prelim. Q4 Sales ~$457M vs $431.47M Est., Prelim. FY19 Sales $1.47B vs $1.44B Est.; Sees FY20 Sales $1.725B-$1.775B vs $1.75B Est.",2020-01-13 07:34:00-05:00,DXCM,neutral
393156.0,Stocks That Hit 52-Week Highs On Friday,2020-01-10 12:18:00-05:00,DXCM,neutral
393157.0,"The Daily Biotech Pulse: Positive Data Readouts To Spur Aclaris, Moderna And Ultragenyx",2020-01-10 07:13:00-05:00,DXCM,positive
393158.0,Stocks That Hit 52-Week Highs On Thursday,2020-01-09 15:15:00-05:00,DXCM,neutral
393159.0,"The Daily Biotech Pulse: Merck's Keytruda Snags Another FDA Approval, DBV Announces Positive Peanut Allergy Study Findings, Applied Genetic Soars On Trial Results",2020-01-09 08:39:00-05:00,DXCM,positive
393160.0,"The Daily Biotech Pulse: Verastem In-Licenses Chughai's Tumor Drug, Midatech Surges On Positive Study Results",2020-01-08 08:12:00-05:00,DXCM,positive
393161.0,"JP Morgan Maintains Overweight on DexCom, Raises Price Target to $255",2019-12-20 09:32:00-05:00,DXCM,neutral
393162.0,"UPDATE: Bank Of America On Dexcom Notes 'We do not expect a potential Libre 2 approval to be a major negative with G7 coming, with DXCM winning preferred payer agreements, and with out-of-pocket costs quickly narrowing between G6 and Libre'",2019-12-18 11:43:00-05:00,DXCM,positive
393163.0,"UPDATE: Bank Of America Reiterates Buy On Dexcom, Raises Target To $250, Names A Top Idea For 2020 Notes 'Street estimates remain too low in our view, and the stock likely works into a year-end G7 launch'",2019-12-18 11:43:00-05:00,DXCM,negative
393164.0,"Bank of America Reiterates Buy on DexCom, Raises Price Target to $250",2019-12-18 10:21:00-05:00,DXCM,neutral
393165.0,"DexCom Shares Down 0.2%; BofA Earlier Issued Note Calling Stock 'A top idea for 2020,' Raised Price Target From $220 To $250",2019-12-18 10:06:00-05:00,DXCM,positive
393166.0,"Morgan Stanley Maintains Equal-Weight on DexCom, Raises Price Target to $225",2019-12-17 09:02:00-05:00,DXCM,neutral
393167.0,DexCom Says Eli Lilly Will Integrate its Continuous Glucose Monitoring into Lilly's Personalized Diabetes Management System,2019-12-16 06:46:00-05:00,DXCM,neutral
393168.0,Watching shares of DexCom And Insulet After Rival Tandem Received FDA Marketing Authorization For Diabetes Care Control-IQ Technology,2019-12-13 11:56:00-05:00,DXCM,positive
393169.0,"The Daily Biotech Pulse: Cassava Gains On Alzheimer's Presentation, Bristol-Myers Hikes Dividend",2019-12-06 07:39:00-05:00,DXCM,positive
393170.0,Stocks That Hit 52-Week Highs On Thursday,2019-12-05 10:16:00-05:00,DXCM,neutral
393171.0,"The Daily Biotech Pulse: Aurinia Rips Higher On Positive Readout, Sesen Bio On Track For Vicinium BLA Submission",2019-12-05 07:14:00-05:00,DXCM,positive
393172.0,Stocks That Hit 52-Week Highs On Wednesday,2019-12-04 10:30:00-05:00,DXCM,neutral
393173.0,"The Daily Biotech Pulse: Roche's Tecentriq Snags FDA Nod For Lung Cancer, Rapt Out-Licenses Cancer Drug",2019-12-04 07:06:00-05:00,DXCM,negative
393174.0,Shares of several healthcare stocks are trading lower as US equities dip following escalating US-China tensions over Hong Kong. US Stocks further fell on worse-than-expected manufacturing data.,2019-12-02 11:31:00-05:00,DXCM,negative
393175.0,Stocks That Hit 52-Week Highs On Friday,2019-11-29 10:28:00-05:00,DXCM,neutral
393176.0,Stocks That Hit 52-Week Highs On Wednesday,2019-11-27 10:14:00-05:00,DXCM,neutral
393177.0,"The Daily Biotech Pulse: Tonix Says No Surprises In FDA Meeting Minutes, Aravive Offering, FDA Nod For Qiagen",2019-11-27 07:26:00-05:00,DXCM,negative
393178.0,Stocks That Hit 52-Week Highs On Tuesday,2019-11-26 11:03:00-05:00,DXCM,neutral
393179.0,"The Daily Biotech Pulse: ChemoCentryx Triples On Data Readout, Global Blood Given FDA Nod, Positive Safety Review For Genfit's NASH Drug",2019-11-26 08:06:00-05:00,DXCM,positive
393180.0,Stocks That Hit 52-Week Highs On Monday,2019-11-25 10:19:00-05:00,DXCM,neutral
393181.0,"The Daily Biotech Pulse: Patent Win For Cellectis, Hepion Proves Efficacy In Animal Model, Job Cuts At Neon",2019-11-21 07:22:00-05:00,DXCM,positive
393182.0,Stocks That Hit 52-Week Highs On Wednesday,2019-11-20 10:12:00-05:00,DXCM,neutral
393183.0,"The Daily Biotech Pulse: Endo's Cellulite Treatment Accepted For Review, Diffusion Pharma Reports Positive Glioblastoma Data",2019-11-20 07:25:00-05:00,DXCM,positive
393184.0,Stocks That Hit 52-Week Highs On Tuesday,2019-11-19 10:21:00-05:00,DXCM,neutral
393185.0,Stocks That Hit 52-Week Highs On Monday,2019-11-18 11:01:00-05:00,DXCM,neutral
393186.0,"The Daily Biotech Pulse: Merck Goes Shopping, Nuvectra Files For Bankruptcy Protection, Opiant Rips Higher",2019-11-13 07:10:00-05:00,DXCM,neutral
393187.0,Stocks That Hit 52-Week Highs On Tuesday,2019-11-12 10:11:00-05:00,DXCM,neutral
393188.0,"The Daily Biotech Pulse: Reata, Kadmon Clinical Readouts, Apyx Medical's Earnings Beat",2019-11-12 07:20:00-05:00,DXCM,neutral
393189.0,These Are The Winners Of The Inaugural WeTrader Paper Trading Competition,2019-11-11 10:53:00-05:00,DXCM,positive
393190.0,Stocks That Hit 52-Week Highs On Monday,2019-11-11 10:15:00-05:00,DXCM,neutral
393191.0,"The Daily Biotech Pulse: Therapix Calls Off Merger, Alimera's Reverse Split, 2 Biotechs To Debut",2019-11-08 08:14:00-05:00,DXCM,neutral
393192.0,94 Biggest Movers From Yesterday,2019-11-08 06:01:00-05:00,DXCM,neutral
393193.0,Mid-Afternoon Market Update: DexCom Gains Following Strong Q3 Results; Obseva Shares Plunge,2019-11-07 14:09:00-05:00,DXCM,positive
393194.0,Mid-Day Market Update: Crude Oil Up Over 2%; Party City Shares Fall After Downbeat Q3 Results,2019-11-07 12:34:00-05:00,DXCM,positive
393195.0,"Raymond James Maintains Outperform on DexCom, Raises Price Target to $189",2019-11-07 12:29:00-05:00,DXCM,neutral
393196.0,75 Stocks Moving In Thursday's Mid-Day Session,2019-11-07 12:19:00-05:00,DXCM,neutral
393197.0,"Piper Jaffray Maintains Overweight on DexCom, Raises Price Target to $200",2019-11-07 11:51:00-05:00,DXCM,negative
393198.0,"Canaccord Genuity Maintains Buy on DexCom, Raises Price Target to $195",2019-11-07 10:52:00-05:00,DXCM,neutral
393199.0,"Stifel Nicolaus Maintains Buy on DexCom, Raises Price Target to $200",2019-11-07 10:41:00-05:00,DXCM,neutral
393200.0,Stocks That Hit 52-Week Highs On Thursday,2019-11-07 10:16:00-05:00,DXCM,neutral
393201.0,"Morgan Stanley Maintains Equal-Weight on DexCom, Raises Price Target to $202",2019-11-07 09:30:00-05:00,DXCM,neutral
393202.0,"Baird Maintains Outperform on DexCom, Raises Price Target to $240",2019-11-07 09:03:00-05:00,DXCM,neutral
393203.0,DexCom shares are trading higher after the company reported better-than-expected Q3 results and raised FY19 sales guidance.,2019-11-07 08:21:00-05:00,DXCM,positive
393204.0,23 Healthcare Stocks Moving In Thursday's Pre-Market Session,2019-11-07 08:04:00-05:00,DXCM,neutral
393205.0,"JP Morgan Maintains Overweight on DexCom, Raises Price Target to $215",2019-11-07 08:01:00-05:00,DXCM,neutral
393206.0,30 Stocks Moving in Thursday's Pre-Market Session,2019-11-07 07:58:00-05:00,DXCM,neutral
393207.0,"UBS Maintains Neutral on DexCom, Raises Price Target to $185",2019-11-07 07:36:00-05:00,DXCM,neutral
393208.0,"The Daily Biotech Pulse: Obseva Sinks On Adverse Clinical Readout, BioNano Surges On Saphyr Adoption, 2 IPOs",2019-11-07 07:18:00-05:00,DXCM,negative
393209.0,DexCom Raises FY2019 Sales Guidance from $1.325B-1.375B to $1.425B-1.45B,2019-11-06 17:09:00-05:00,DXCM,neutral
393210.0,"DexCom Q3 EPS $0.65 Beats $0.21 Estimate, Sales $396.3M Beat $348.12M Estimate",2019-11-06 17:08:00-05:00,DXCM,neutral
393211.0,"The Daily Biotech Pulse: Sesen Rallies On Positive FDA Meeting, Supernus Flunks Late-Stage ADHD Trial, GW Pharma Earnings",2019-11-06 08:21:00-05:00,DXCM,positive
393212.0,"Stifel Initiates Coverage On DexCom with Buy Rating, Announces $190 Price Target",2019-10-23 06:52:00-04:00,DXCM,neutral
393213.0,DexCom shares are trading lower after the company's competitor Abbott announced a partnership to develop a glucose monitoring system with Tandem Diabetes.,2019-10-15 13:02:00-04:00,DXCM,neutral
393214.0,Dexcom Reports Quentin Blackford Promoted As COO,2019-09-17 16:16:00-04:00,DXCM,positive
393215.0,"Shares of companies in the diagnostics and research space are trading lower, potentially on continued weakness after DexCom provided bearish commentary at a Morgan Stanley healthcare conference on Monday.",2019-09-10 11:22:00-04:00,DXCM,negative
393216.0,DexCom shares are trading lower after the company said it still sees pressure on Q3 comps at the Morgan Stanley Healthcare Conference.,2019-09-09 10:20:00-04:00,DXCM,negative
393217.0,Hearing DexCom At Morgan Stanley Healthcare Conference Says Still Sees Pressure On Q3 Comps,2019-09-09 10:06:00-04:00,DXCM,negative
393218.0,10 Biggest Price Target Changes For Tuesday,2019-09-03 09:12:00-04:00,DXCM,neutral
393219.0,"BMO Capital Maintains Outperform on DexCom, Raises Price Target to $190",2019-09-03 07:43:00-04:00,DXCM,neutral
393220.0,"Baird Maintains Outperform on DexCom, Raises Price Target to $195",2019-08-29 09:09:00-04:00,DXCM,neutral
393221.0,Stocks That Hit 52-Week Highs On Tuesday,2019-08-27 10:30:00-04:00,DXCM,neutral
393222.0,Court Rules That Patents Asserted Against Dexcom CGM Systems Are Invalid,2019-08-23 16:26:00-04:00,DXCM,neutral
393223.0,Stocks That Hit 52-Week Highs On Friday,2019-08-23 10:33:00-04:00,DXCM,neutral
393224.0,Stocks That Hit 52-Week Highs On Thursday,2019-08-22 10:32:00-04:00,DXCM,neutral
393225.0,"The Daily Biotech Pulse: ViiV's Long-Acting HIV Drug Meets Study Goal, Chinese Cheer For FibroGen, Retrophin Flunks Late-Stage Study",2019-08-22 07:18:00-04:00,DXCM,positive
393226.0,Stocks That Hit 52-Week Highs On Wednesday,2019-08-21 10:17:00-04:00,DXCM,neutral
393227.0,"The Daily Biotech Pulse: Ra Pharma Earns Milestone, Aimmune Doses Patient In Egg Allergy Trial, Cara In-Licenses Platform",2019-08-21 07:40:00-04:00,DXCM,neutral
393228.0,Shares of several healthcare companies are trading higher as optimism increased for a resolution to the US-China trade war.,2019-08-19 12:31:00-04:00,DXCM,positive
393229.0,Stocks That Hit 52-Week Highs On Monday,2019-08-19 10:53:00-04:00,DXCM,neutral
393230.0,"Shares of healthcare companies are trading higher as US markets rebound from recent weakness following a yield curve inversion, which caused recession fears. Trump also recently announced the US would delay China tariffs, renewing hopes of a trade deal.",2019-08-16 13:27:00-04:00,DXCM,negative
393231.0,Stocks That Hit 52-Week Highs On Friday,2019-08-16 10:35:00-04:00,DXCM,neutral
393232.0,"Shares of several healthcare companies are trading lower in sympathy with the overall market after the spread between the 2-year and 10-year yield curve inverted for the first time since 2007, potentially signaling an oncoming recession.",2019-08-14 11:17:00-04:00,DXCM,negative
393233.0,﻿Shares of several healthcare companies are trading higher with the overall market after the U.S. announced it is excluding and delaying the additional 10% tariff on certain products.,2019-08-13 11:53:00-04:00,DXCM,positive
393234.0,DexCom shares are trading higher on seemingly no company-specific news.,2019-08-08 14:11:00-04:00,DXCM,neutral
393235.0,"Shares of diagnostics and research companies are trading higher in sympathy with Syneos Health, which reported strong Q2 results and raised FY19 guidance.",2019-08-06 13:54:00-04:00,DXCM,positive
393236.0,"Bank of America Maintains Buy on DexCom, Raises Price Target to $185",2019-08-01 11:42:00-04:00,DXCM,neutral
