Unnamed: 0,title,date,stock,sentiment
419070.0,Stocks That Hit 52-Week Lows On Thursday,2020-05-14 10:47:00-04:00,EMCF,negative
419071.0,Shares of several financial services companies are trading lower amid market weakness following US unemployment data and recent cautious comments from the WHO. Sentiment is also negative following cautious comments from Fed Chair Powell and bearish outlook from some major US investors on Wednesday. The financial sector has been impacted by lower business investment and spending as a result of the pandemic. Shares have reversed and are now trading higher.,2020-05-14 10:32:00-04:00,EMCF,negative
419072.0,Emclaire Financial Q1 EPS $0.440 Down From $0.770 YoY,2020-04-22 16:37:00-04:00,EMCF,neutral
419073.0,Stocks That Hit 52-Week Lows On Wednesday,2020-03-11 11:41:00-04:00,EMCF,negative
419074.0,Stocks That Hit 52-Week Lows On Tuesday,2020-03-10 10:37:00-04:00,EMCF,negative
419075.0,Stocks That Hit 52-Week Lows On Friday,2020-03-06 11:22:00-05:00,EMCF,negative
419076.0,Emclaire Financial Raises Quarterly Dividend From $0.29 To $0.30/Share,2020-02-19 16:48:00-05:00,EMCF,neutral
419077.0,Emclaire Financial Q4 EPS $0.54 Up From $0.07 YoY,2020-01-31 16:31:00-05:00,EMCF,neutral
419078.0,Emclaire Financial Q3 EPS $0.8 Up From $0.51 YoY,2019-10-18 16:31:00-04:00,EMCF,neutral
419079.0,Emclaire Financial Q2 EPS $0.75 Up From $0.62 YoY,2019-07-19 16:31:00-04:00,EMCF,neutral
419080.0,Emclaire Financial Q1 EPS $0.77 Up From $0.6 YoY,2019-04-24 16:43:00-04:00,EMCF,neutral
419081.0,Emclaire Financial Raises Qtr. Dividend From $0.28 To $0.29/Share,2019-02-20 17:09:00-05:00,EMCF,neutral
419082.0,Emclaire Financial Corp - Common Stock Q4 EPS $0.07 Down From $0.25 YoY,2019-02-05 16:00:00-05:00,EMCF,neutral
419083.0,"Stocks Trading Ex Dividend For Fri., Nov. 30, 2018",2018-11-30 10:22:00-05:00,EMCF,neutral
419084.0,"Stocks That Will Be Trading Ex Dividend Fri., Nov. 30, 2018",2018-11-29 10:49:00-05:00,EMCF,neutral
419085.0,Emclaire Financial Q3 EPS $0.51 Down From $0.77 YoY,2018-10-24 16:39:00-04:00,EMCF,neutral
419086.0,"Stocks Which Set New 52-Week High Friday, September 7th",2018-09-10 16:36:00-04:00,EMCF,neutral
419087.0,"Stocks Which Set New 52-Week High Yesterday, August 30th",2018-08-31 10:11:00-04:00,EMCF,neutral
419088.0,"Stocks Which Set New 52-Week High Yesterday, August 29th",2018-08-30 11:47:00-04:00,EMCF,neutral
419089.0,"Stocks Which Set New 52-Week High Yesterday, August 21st",2018-08-22 09:06:00-04:00,EMCF,neutral
419090.0,"Stocks Which Set New 52-Week High Tues., Aug. 21, 2018",2018-08-21 14:50:00-04:00,EMCF,neutral
419091.0,"Stocks Which Set New 52-Week High Friday, July 27th",2018-07-30 12:05:00-04:00,EMCF,neutral
419092.0,Stocks Which Set New 52-Week Highs Friday,2018-07-23 11:08:00-04:00,EMCF,neutral
419093.0,"Emclaire Financial Q2 EPS $0.62 Up From $0.48 YoY, Net Interest Income $6.19M Up From $5.34M YoY",2018-07-20 16:31:00-04:00,EMCF,positive
419094.0,Emclaire Financial Q1 EPS $0.60 vs $0.44 In Same Qtr. Last Year,2018-04-25 16:36:00-04:00,EMCF,neutral
419095.0,Emclaire Financial Raises Qtr. Dividend From $0.27 To $0.28/Share,2018-02-21 17:28:00-05:00,EMCF,neutral
419096.0,Emclaire Financial Reports Quarter Ended EPS $0.77 vs $0.49 In Prior Year Period,2017-10-20 16:03:00-04:00,EMCF,neutral
419097.0,Emclaire Financial Corp  Reports Quarter Ended EPS $0.48 vs $0.43 In Prior Year Period,2017-07-21 16:31:00-04:00,EMCF,neutral
419098.0,Emclaire Financial Reports Quarter Ended EPS $0.44 vs $0.28 Est.,2017-04-25 16:34:00-04:00,EMCF,neutral
419099.0,Emclaire Financial Raises Qtr. Dividend from $0.26 to $0.27/Share,2017-02-15 16:35:00-05:00,EMCF,neutral
419100.0,Emclaire Financial Reports Quarter EPS $0.49 vs. Prior Year Quarter $0.70,2016-10-21 16:30:00-04:00,EMCF,neutral
419101.0,Emclaire Financial Reports Quarter Ended EPS $0.43 vs. Prior Year Quarter $0.48,2016-07-22 16:35:00-04:00,EMCF,neutral
419102.0,Emclaire Financial Group Reports Quarter Eps $0.37 vs. Prior Year Quarter $0.42,2016-04-26 16:34:00-04:00,EMCF,neutral
419103.0,Emclaire Financial Corp Increases Qtr. Dividend Form $0.24 To $0.26/Share,2016-02-17 16:32:00-05:00,EMCF,neutral
419104.0,Emclaire Financial Corp Reports Quarter Ended EPS $0.43 vs. Prior Year Quarter $0.71,2016-01-29 16:31:00-05:00,EMCF,neutral
419105.0,Emclaire Financial Corp Announces Merger Agreement With United-American Savings Bank - $42.67/ Share in Cash,2015-12-30 16:01:00-05:00,EMCF,positive
419106.0,Emclaire Financial Reports Quarter EPS $0.70,2015-11-04 16:32:00-05:00,EMCF,neutral
419107.0,Emclaire Financial Corp Exits SBLF Program,2015-09-30 16:30:00-04:00,EMCF,neutral
419108.0,"Emclaire Financial Reports Q1 EPS $0.42, no estimates available",2015-04-21 16:32:00-04:00,EMCF,negative
419109.0,Emclaire Raises Qtr Dividend From $0.22 to $0.24/share,2015-02-18 16:32:00-05:00,EMCF,neutral
419110.0,Emclaire Financial Corp Reports Q3 EPS of $0.54,2013-10-23 16:32:00-04:00,EMCF,neutral
419111.0,Emclaire Financial Declares $0.10/Share Special Dividend,2012-12-10 16:04:00-05:00,EMCF,positive
419112.0,Emclaire Financial Corp. Announces 12.5% Quarterly Dividend Increase ,2012-02-15 10:00:00-05:00,EMCF,positive
419113.0,Emclaire Financial Corp. Exits TARP With Warrant Buyback,2011-12-07 16:30:00-05:00,EMCF,neutral
