Unnamed: 0,title,date,stock,sentiment
446878.0,33 Stocks Moving in Monday's Pre-Market Session,2020-06-08 07:15:00-04:00,EVGN,neutral
446879.0,"Evogene Posts Q1 Results, Suffers 67% YoY Revenue Decline",2020-05-26 15:31:00-04:00,EVGN,negative
446880.0,"Evogene Sends Letter to Shareholders, Colleagues, Business Partners",2020-05-05 07:35:00-04:00,EVGN,neutral
446881.0,Corteva Agriscience And AgPlenus Announce Collaboration For Development Of Novel Herbicides,2020-03-25 08:17:00-04:00,EVGN,positive
446882.0,"The Daily Biotech Pulse: AbbVie, Allergan Agree On Divestments, Obalon Stops Obesity Balloon Sale, COVID-19 Updates",2020-03-18 07:36:00-04:00,EVGN,positive
446883.0,"The Daily Biotech Pulse: Mesoblast To Test Candidate On Coronavirus Symptoms, Proxy Battle Ahead For Rockwell Medical, Glaukos to Join S&P SmallCap 600 Index",2020-03-10 09:19:00-04:00,EVGN,negative
446884.0,"The Daily Biotech Pulse: Breakthrough Device Designation For Neuronetics, AbbVie Receives European Label Expansion, AstraZeneca Flunks Late-Stage Study",2020-03-06 08:49:00-05:00,EVGN,negative
446885.0,Stocks That Hit 52-Week Lows On Thursday,2020-03-05 10:29:00-05:00,EVGN,negative
446886.0,"The Daily Biotech Pulse: Trevana Pain Drug Resubmission Accepted For Review, Can-Fite To Explore Treatment For COVID-19",2020-03-05 08:05:00-05:00,EVGN,negative
446887.0,"Evogene Trades Down On Q4 Results, CEO Says 2019 Was 'Turning Point'",2020-03-04 11:54:00-05:00,EVGN,neutral
446888.0,Stocks That Hit 52-Week Lows On Wednesday,2020-03-04 11:12:00-05:00,EVGN,negative
446889.0,"The Week In Cannabis: MedMen And Sundial Lose Their CEOs, Santa Cruz Gets Trippy And Much More",2020-02-02 16:36:00-05:00,EVGN,negative
446890.0,Canonic Partners With Hadassah Medical Center For Pre-Clinical Studies To Help Cannabis Product Development,2020-01-27 10:13:00-05:00,EVGN,positive
446891.0,Canonic Announces an Agreement With Hadassah Medical Center for Pre-Clinical Studies to Support the Development of Canonic's Medical Cannabis Products,2020-01-27 07:13:00-05:00,EVGN,positive
446892.0,"The Daily Biotech Pulse: Cassava Gains On Alzheimer's Presentation, Bristol-Myers Hikes Dividend",2019-12-06 07:39:00-05:00,EVGN,positive
446893.0,"The Daily Biotech Pulse: Astellas To Buy Audentes For $3B, Applied Genetics Chief Medical Officer Quits, Axsome Aces Midstage Trial",2019-12-03 07:59:00-05:00,EVGN,neutral
446894.0,"Evogene Q3 EPS $(0.16) Up From $(0.19) YoY, Sales $97K Do Not Compare To $1.9M Estimate",2019-11-13 07:04:00-05:00,EVGN,neutral
446895.0,"Evogene Reports Its Canonic Wholly-Owned Subsidiary Initiates Cultivation, Breeding Program Of Cannabis Varieties",2019-11-06 08:23:00-05:00,EVGN,neutral
446896.0,Biomica Reports Will Collaborate With Weizmann Institute To Develop Selective Treatment Against Antibiotic Resistant Bacteria,2019-10-23 07:20:00-04:00,EVGN,neutral
446897.0,Biomica Reports Will Collaborate With Weizmann Institute To Develop Selective Treatment Against Antibiotic Resistant Bacteria,2019-10-23 07:20:00-04:00,EVGN,neutral
446898.0,"The Daily Biotech Pulse: Novartis Stands By Zolgensma, GW Pharma Q2 Propelled By Epidiolex Sales, Ionis-Akcea Clinical Readout",2019-08-07 07:34:00-04:00,EVGN,neutral
446899.0,"Corteva Agriscience to Invest in Evogene's Agriculture Biologicals Subsidiary, Lavie Bio",2019-08-07 07:15:00-04:00,EVGN,neutral
446900.0,Stocks That Broke Yearly Lows Tuesday Morning,2019-08-06 12:06:00-04:00,EVGN,negative
446901.0,New 52-Week Lows For Monday Morning,2019-08-05 13:16:00-04:00,EVGN,negative
446902.0,"Evogene Q2 EPS $(0.16) Up From $(0.19) YoY, Sales $192K Miss $1.9M Estimate",2019-07-31 07:22:00-04:00,EVGN,negative
446903.0,Evogene Tackles Corn Crop Fungal Diseases With Bayer,2019-07-16 10:59:00-04:00,EVGN,neutral
446904.0,Evogene Amends its Collaboration Agreement With Bayer To Include Genome Editing Targets,2019-07-16 07:05:00-04:00,EVGN,positive
446905.0,Evogene Subsidiary Lavie Bio Announces  2nd Year Field Results In Its Bio-Stimulant Program For Wheat,2019-07-10 07:08:00-04:00,EVGN,neutral
446906.0,"The Daily Biotech Pulse: ASCO Presentations From Roche, Celgene & More, Edwards Recommends Rejection Of Mini-Tender Offer",2019-06-04 07:45:00-04:00,EVGN,negative
446907.0,"Evogene Q1 EPS $(0.15) Up From $(0.21) YoY, Sales $348K Miss $1.9M Estimate",2019-05-28 07:05:00-04:00,EVGN,negative
446908.0,"Earnings Scheduled For May 28, 2019",2019-05-28 04:11:00-04:00,EVGN,neutral
446909.0,"Agribiotech Evogene Launches Medical Cannabis Subsidiary, CEO Expects 'Significant Impact' In Sector",2019-04-03 13:14:00-04:00,EVGN,positive
446910.0,"Evogene to Develop Next Generation Medical Cannabis Products Through New Subsidiary, Canonic Ltd",2019-04-03 07:04:00-04:00,EVGN,neutral
446911.0,"The Daily Biotech Pulse: Japanese Cheer For AbbVie, Myokardia Offering, CytomX CFO Departs",2019-03-26 07:36:00-04:00,EVGN,positive
446912.0,"The Daily Biotech Pulse: Biogen Plummets, FDA Greenlights Sleep Disorder Drug, Cellular Biomedicine Offering",2019-03-21 07:51:00-04:00,EVGN,negative
446913.0,"The Daily Biotech Pulse: KaryoPharm's Selinexor Review Delayed, FDA Accepts Adamis Opioid Overdose Drug NDA",2019-03-15 07:39:00-04:00,EVGN,positive
446914.0,"Evogene Reports Establishment Of Ag-Biologics Subsidiary, LaVie Bio",2019-02-26 07:28:00-05:00,EVGN,neutral
446915.0,"The Daily Biotech Pulse: Proteostasis Delays Data, Akron Gets New CEO, Pfizer Halts Vaccine Trial",2018-12-21 07:58:00-05:00,EVGN,neutral
446916.0,"The Daily Biotech Pulse: Puma Aces Late-Stage Trial, Chinese Cheer For FibroGen, J&J $5B Buyback Plan",2018-12-18 08:00:00-05:00,EVGN,positive
446917.0,Evogene And TMG Announce Collaboration To Develop Nematode Resistant Soybean Through Genome Editing,2018-12-18 07:07:00-05:00,EVGN,neutral
446918.0,"Stocks Which Set New 52-Week Low Yesterday, Thurs., Dec. 13, 2018",2018-12-14 11:03:00-05:00,EVGN,negative
446919.0,"The Daily Biotech Pulse: Vivus Extends Supply Deal With Sandoz, Applied Genetic Snaps Ties With Biogen",2018-12-13 07:56:00-05:00,EVGN,positive
446920.0,"Stocks Which Set New 52-Week Low Yesterday, Tues., Dec. 11, 2018",2018-12-12 11:47:00-05:00,EVGN,negative
446921.0,"The Daily Biotech Pulse: Management Change At Merck, Jazz Buyback, Arrowhead Earnings",2018-12-11 08:22:00-05:00,EVGN,neutral
446922.0,"The Daily Biotech Pulse: FDA Nod For Roche, Bristol-Myers Hikes Dividend, 2 Biotechs To Debut",2018-12-07 08:04:00-05:00,EVGN,neutral
446923.0,Evogene Establishes an Agro-Chemical Subsidiary,2018-11-19 07:08:00-05:00,EVGN,neutral
446924.0,"Evogene Q3 EPS $(0.19) Up From $(0.20) YoY, Sales $367K Miss $1.9M Estimate",2018-11-14 07:06:00-05:00,EVGN,negative
446925.0,"Stocks Which Set New 52-Week Low Friday, October 26th",2018-10-29 09:56:00-04:00,EVGN,negative
446926.0,Evofuel and Fantini s.r.l Announce Development of a Mechanical Harvesting Solution for Castor Bean,2018-10-29 07:17:00-04:00,EVGN,positive
446927.0,26 Stocks Moving In Wednesday's Pre-Market Session,2018-09-05 08:01:00-04:00,EVGN,neutral
446928.0,Evogene Announces Milestone In Its Next Generation Herbicide Pipeline,2018-09-05 07:01:00-04:00,EVGN,neutral
446929.0,"Stocks Which Set New 52-Week Low Yesterday, August 14th",2018-08-15 12:34:00-04:00,EVGN,negative
446930.0,"Evogene Q2 EPS $(0.19) Down From $(0.18) YoY, Sales $379K Miss $1.9M Estimate",2018-08-08 07:42:00-04:00,EVGN,negative
446931.0,Evogene And IMAmt Enter Collaboration In Field Of Insect Resistance Traits In Cotton,2018-07-17 07:04:00-04:00,EVGN,neutral
446932.0,20 Stocks Moving In Tuesday's Pre-Market Session,2018-07-10 08:01:00-04:00,EVGN,neutral
446933.0,Evogene Announces Positive Yield Results In Its Bio-Stimulant Program For Wheat,2018-07-10 07:09:00-04:00,EVGN,positive
446934.0,"Roundup Of Biotech Stocks Up On No Positive Catalyst; Dare Bioscience Inc Up 23.2%, ATyr Pharma Up 17.7%, AzurRx BioPharma Up 16.8%, VIVUS Up 8.9%, Innovate Biopharmaceuticals Up 7.7%, IBio Up 6.5%, Evogene Up 6.0%",2018-06-08 10:36:00-04:00,EVGN,positive
446935.0,26 Stocks Moving In Tuesday's Pre-Market Session,2018-05-29 08:13:00-04:00,EVGN,neutral
446936.0,"Evogene Q1 EPS $(0.21), Sales $366K Miss $1.9M Estimate",2018-05-29 07:02:00-04:00,EVGN,negative
446937.0,"Earnings Scheduled For May 29, 2018",2018-05-29 04:12:00-04:00,EVGN,neutral
446938.0,"Evogene, Marrone Bio Innovations Announce Phase Advancement in their Insect Control Collaboration",2018-05-08 07:23:00-04:00,EVGN,neutral
446939.0,Evogene and Marrone Bio Innovations Announce Phase Advancement in their Insect Control Collaboration,2018-05-08 07:15:00-04:00,EVGN,neutral
446940.0,"Evogene Shares Unaffected, Trading On Very Light Volume As Traders Circulate 2 US PTO Docs For Polynucleotides",2018-03-20 09:42:00-04:00,EVGN,positive
446941.0,"Evogene Reports Q4 EPS $(0.81) vs $(0.77) In Same Qtr. Last Year, Sales $3.381M vs $700K Est.",2018-02-28 07:04:00-05:00,EVGN,neutral
446942.0,Evogene Announces 'Positive' Results in its Novel Mode-of-Action Herbicide Program,2018-02-27 07:58:00-05:00,EVGN,positive
446943.0,Migdal Insurance & Financial Holdings Shows a 7.59% Stake in Evogene,2018-01-22 06:18:00-05:00,EVGN,neutral
446944.0,Evogen Reports 2nd-Year Field Trial Results In Corn Bio-Stimulant Ag-Biologicals Program: 'demonstrated significant yield improvement; selected microbial strains to be tested as part of the collaboration with DuPont-Pioneer',2018-01-10 07:12:00-05:00,EVGN,positive
446945.0,35 Biggest Movers From Yesterday,2018-01-03 05:03:00-05:00,EVGN,neutral
446946.0,"Shares Of Agriculture Bioscience Cos. Showing Strength Tuesday: SEED +8.21%, YTEN +14.69%, EVGN +12.38%",2018-01-02 14:53:00-05:00,EVGN,positive
446947.0,28 Stocks Moving In Tuesday's Mid-Day Session,2018-01-02 13:09:00-05:00,EVGN,neutral
446948.0,28 Stocks Moving In Wednesday's Pre-Market Session,2017-12-20 08:12:00-05:00,EVGN,neutral
446949.0,"Evogene Reports Q3 EPS $(0.20) vs $(0.17) Est., Sales $748K vs $2.72M Est.",2017-11-22 07:04:00-05:00,EVGN,neutral
446950.0,"Earnings Scheduled For November 22, 2017",2017-11-22 04:02:00-05:00,EVGN,neutral
446951.0,Evogene Announces 'Positive' Results in Second Year Field Trials Addressing Black Sigatoka,2017-09-26 07:10:00-04:00,EVGN,neutral
446952.0,20 Stocks Moving In Monday's Pre-Market Session,2017-09-25 08:07:00-04:00,EVGN,neutral
446953.0,"Evogene Reports Q2 EPS $(0.37) vs $(0.19) Est., Sales $1.899M vs $710K Est.",2017-08-10 07:38:00-04:00,EVGN,neutral
446954.0,12 Biggest Mid-Day Gainers For Tuesday,2017-07-11 12:24:00-04:00,EVGN,neutral
446955.0,20 Stocks Moving In Tuesday's Pre-Market Session,2017-07-11 08:10:00-04:00,EVGN,neutral
446956.0,"Evogene Says Reached Milestone for Partnership with Monsanto, Announces Completion of the Candidate Gene Discovery Stage",2017-07-11 07:07:00-04:00,EVGN,positive
446957.0,Evogene Announces 'Positive' Results from Insect Control Program,2017-06-20 07:05:00-04:00,EVGN,neutral
446958.0,"Evogene Q1 EPS $(0.19) vs $(0.18) Est, Sales $721K vs $4.9M",2017-05-17 07:07:00-04:00,EVGN,neutral
446959.0,"Evogene Reports Q4 EPS $(0.26) vs. $(0.18) Est., Sales $1.18M vs. $2.5M",2017-02-27 07:06:00-05:00,EVGN,neutral
446960.0,Stocks Hitting 52-Week Lows,2016-12-05 10:25:00-05:00,EVGN,negative
446961.0,"Evogene Reports Q3 EPS $(0.51) Does Not Compare To Est. $(0.07), Rev. $5.3M vs. Est. $3.4M",2016-11-21 07:02:00-05:00,EVGN,neutral
446962.0,"Earnings Scheduled For November 21, 2016",2016-11-21 04:07:00-05:00,EVGN,neutral
446963.0,Evogene Announces Positive Field Trial Results in Ag-biologicals Program,2016-11-16 07:09:00-05:00,EVGN,positive
446964.0,"Evogene Reports Collobartion Deal with IMAmt for Genomic Promotor Discovery, Validation in Cotton",2016-10-19 11:50:00-04:00,EVGN,neutral
446965.0,"Evogene Names Yuval Ben-Galim COO, Replacing Assaf Kacen",2016-08-11 07:18:00-04:00,EVGN,neutral
446966.0,"Evogene Reports Q2 EPS $(0.31) vs $(0.33) in Same Qtr. Last Year, Sales $3.824M vs $4.5M Est.",2016-08-11 07:06:00-04:00,EVGN,neutral
446967.0,"Evogene Reports Q1 EPS $(0.13) vs $(0.11) Est., Sales $2.016M vs $4.5M Est.",2016-05-19 07:10:00-04:00,EVGN,neutral
446968.0,"Evogene,  Marrone Bio Innovations Disclose Positive Results in Insect Control Collaboration",2016-05-16 07:05:00-04:00,EVGN,positive
446969.0,"Friday's After-Hours Movers: Energy, Pharmaceuticals Active",2016-04-08 16:41:00-04:00,EVGN,positive
446970.0,"Evogene Reports Q4 EPS $(0.22) vs. Est. $(0.17), Rev. $2.414M vs. Est. $3.9M",2016-03-01 07:10:00-05:00,EVGN,neutral
446971.0,Evogene Reports Results in Yield Improvement Collaboration with Monsanto Utilizing Novel 'Trait-First' Methodology,2016-02-23 07:17:00-05:00,EVGN,positive
446972.0,Evogene Names Eyal Leibovitz as CFO,2015-12-22 07:10:00-05:00,EVGN,neutral
446973.0,"Evogene, BASF Partner ON Novel Herbicide Discovery & Development",2015-12-08 07:15:00-05:00,EVGN,positive
446974.0,"Evogene Reports Q3 EPS ($0.13) vs. Est. ($0.15), Rev. $3.309M vs. Est. $3.5M",2015-11-18 07:22:00-05:00,EVGN,neutral
446975.0,"Earnings Scheduled For November 18, 2015",2015-11-18 04:10:00-05:00,EVGN,neutral
446976.0,Stocks Hitting 52-Week Lows,2015-11-03 10:16:00-05:00,EVGN,negative
446977.0,"Evogene Reports Q2 EPS $(0.20) vs. Est. $(0.19), Rev. $5.357M vs. Est. $4.4M",2015-08-05 07:05:00-04:00,EVGN,neutral
446978.0,Evogene Announces Successful Completion of First Computational Discovery of Novel Microbial Genes for Insect Control,2015-08-04 07:14:00-04:00,EVGN,positive
446979.0,"Evogene Announces Discovery, Validation of Novel Plant Targets for Herbicides",2015-07-29 07:07:00-04:00,EVGN,positive
446980.0,"Evogene Reports Q1 EPS $(0.13) vs. Est. $(0.20), Rev. $2.701M vs. Est. $3.65M",2015-05-19 07:06:00-04:00,EVGN,neutral
446981.0,"Evogene Reports Q4 EPS $(0.19), Rev. $14.5M",2015-02-26 07:07:00-05:00,EVGN,neutral
446982.0,Evofuel Announces Agreement in Brazil With Insolo,2015-02-17 07:06:00-05:00,EVGN,positive
446983.0,"CNH Industrial, Evogene Subsidiary Announce Collaboration for Development of  Mechanized Harvesting Solution for Castor Beans",2014-12-15 07:08:00-05:00,EVGN,positive
446984.0,Stocks Hitting 52-Week Lows,2014-11-24 10:23:00-05:00,EVGN,negative
446985.0,Stocks Hitting 52-Week Lows,2014-11-17 10:23:00-05:00,EVGN,negative
446986.0,"Credit Suisse Maintains Outperform on Evogene Ltd., Lowers PT to $22.00",2014-11-12 12:14:00-05:00,EVGN,positive
446987.0,Evogene Expands Crop Protection Activities ,2014-10-29 04:58:00-04:00,EVGN,positive
446988.0,"Evogene Subsidiary Evofuel, Embrapa Sign Joint Research Agreement on Castor Cultivation in Brazil ",2014-10-20 04:56:00-04:00,EVGN,positive
446989.0,Morning Market Losers ,2014-08-25 09:54:00-04:00,EVGN,negative
446990.0,Stocks Hitting 52-Week Lows,2014-08-20 10:20:00-04:00,EVGN,negative
446991.0,Evogene Ltd. Reports Q2 EPS of $(0.13) vs $(0.11) Est; Revenue of $3.85M vs $4.66M Est,2014-08-20 07:09:00-04:00,EVGN,neutral
446992.0,Evogene And Marrone Bio Innovations Sign Multi-Year Collaborative Agreement,2014-07-22 07:08:00-04:00,EVGN,positive
446993.0,Stocks Hitting 52-Week Lows,2014-07-07 10:12:00-04:00,EVGN,negative
446994.0,7 Stocks To Watch Ahead Of Lockup Expirations And PDUFA Dates ,2014-05-19 16:00:00-04:00,EVGN,neutral
446995.0,"Deutsche Bank Initiates Coverage on Evogene Ltd. at Buy, Announces $22.00 PT",2013-12-17 07:21:00-05:00,EVGN,neutral
446996.0,UPDATE: Credit Suisse Initiates Coverage on Evogene on Best-in-Class Position,2013-12-16 09:45:00-05:00,EVGN,positive
446997.0,"Credit Suisse Initiates Coverage on Evogene Ltd. at Outperform, Announces $25.00 PT",2013-12-16 06:28:00-05:00,EVGN,positive
446998.0,Evogene Ltd. Files IPO for 5M Shares,2013-11-06 17:29:00-05:00,EVGN,positive
