Unnamed: 0,title,date,stock,sentiment
504148.0,"Citigroup Maintains Fleetcor Technologies at Neutral, Raises PT from $40 to $43",2012-04-30 08:03:00-04:00,FLT,neutral
504149.0,FleetCor Renews Major Partner Contract   ,2012-03-15 08:31:00-04:00,FLT,neutral
504150.0,FleetCor Announces Pricing of Secondary Offering by Selling Stockholders at $36.50/Share,2012-03-14 09:19:00-04:00,FLT,neutral
504151.0,FleetCor Announces Secondary Offering of 6M Shares by Selling Stockholders  ,2012-03-13 16:34:00-04:00,FLT,positive
504152.0,FleetCor Announces 6M Share Secondary Offering by Selling Stockholders   ,2012-03-13 16:32:00-04:00,FLT,positive
504153.0,Fleetcor Tech Files Automatic Common Stock Shelf,2012-03-13 16:17:00-04:00,FLT,neutral
504154.0,FleetCor Acquires Assets of NovoPayment in Mexico,2012-03-12 08:30:00-04:00,FLT,positive
504155.0,"Goldman Sachs Maintains Fleetcor Technologies at Neutral, Raises PT from $32 to $35",2012-02-09 07:36:00-05:00,FLT,neutral
504156.0,Fleetcor Technologies Reports Q4 EPS $0.56 vs $0.50 Est; Revenues $140.20M vs $128.44M Est			 ,2012-02-08 16:25:00-05:00,FLT,neutral
504157.0,FleetCor Signs Agreement with PHH Arval,2012-02-06 09:01:00-05:00,FLT,positive
504158.0,UPDATE: Citigroup Raises Target to $36 on FleetCor,2012-02-06 06:46:00-05:00,FLT,neutral
504159.0,Wells Fargo Upgrades FleetCor Technologies to Outperform,2011-12-16 09:32:00-05:00,FLT,positive
504160.0,"J.P. Morgan Upgrades FleetCor to Overweight, $41 PT",2011-12-14 15:45:00-05:00,FLT,negative
504161.0,"UPDATE: Citigroup Maintains Neutral, Ups Target to $32 on FleetCor ",2011-12-14 07:53:00-05:00,FLT,neutral
504162.0,"Financial Breakfast: Morning News Summary for December 14, 2011",2011-12-14 07:39:00-05:00,FLT,neutral
504163.0,UPDATE: Goldman Sachs Raises Price Target on FleetCor to $30,2011-12-14 07:14:00-05:00,FLT,neutral
504164.0,JP Morgan Upgrades FleetCor to Overweight,2011-12-14 06:34:00-05:00,FLT,neutral
504165.0,Citigroup Raises PT on FleetCor Technologies to $32,2011-12-14 06:09:00-05:00,FLT,neutral
504166.0,Market Update,2011-12-13 09:35:00-05:00,FLT,neutral
504167.0,FleetCor Acquires AllStar Business Solutions For $304M,2011-12-13 09:06:00-05:00,FLT,positive
504168.0,FleetCor Acquires UK Fuel Card Company for approximately $304 Million,2011-12-13 08:04:00-05:00,FLT,neutral
504169.0,UPDATE: J.P. Morgan Raises Price Target on FleetCor to $39,2011-11-10 07:36:00-05:00,FLT,neutral
504170.0,JP Morgan Raises PT on FleetCor to $39,2011-11-10 06:57:00-05:00,FLT,positive
504171.0,FleetCor Guides 2011 EPS $2.08-$2.12 vs $2.04 Est; Revenues $500M-$510M vs $489 M Est,2011-11-09 16:09:00-05:00,FLT,neutral
504172.0,FleetCor Tech Reports Q3 EPS $0.56 vs $0.51 Est; Revenues $134.2M vs $125.06M Est,2011-11-09 16:06:00-05:00,FLT,neutral
504173.0,"Citigroup Initiates Coverage on FLT, PAY, WXS",2011-11-07 07:18:00-05:00,FLT,negative
504174.0,"Earnings Preview: Western Union Company's EPS, Revenue Expected to Rise",2011-10-20 11:15:00-04:00,FLT,neutral
504175.0,Goldman Sachs Comments on FleetCor Technologies,2011-09-14 08:15:00-04:00,FLT,neutral
504176.0,"Fleetcor Chief Information Officer Huff Resigns, Effective September 2",2011-08-15 07:29:00-04:00,FLT,positive
504177.0,FleetCor Announces New $900 Million Credit Agreement ,2011-06-24 16:17:00-04:00,FLT,positive
504178.0,Morgan Stanley Maintains Equal-Weight on FleetCor Technologies (FLT),2011-05-13 08:22:00-04:00,FLT,neutral
504179.0,Goldman Sachs Remains Neutral On FleetCor (FLT) ,2011-05-13 07:43:00-04:00,FLT,neutral
504180.0,J.P. Morgan Increases PT On FleetCor From $35.00 To $37.00  (FLT) ,2011-05-13 07:37:00-04:00,FLT,neutral
504181.0,JP Morgan Raises PT On FleetCor To $37,2011-05-13 06:06:00-04:00,FLT,positive
504182.0,FleetCor Tech Reports EPS of $0.47 vs. $0.44 Estimate; Revenues $111M vs. $109.33M Estimate (FLT),2011-05-12 16:04:00-04:00,FLT,neutral
504183.0,Goldman Sachs Initiates Neutral Rating on FleetCor Technologies (FLT),2011-01-24 09:25:00-05:00,FLT,neutral
504184.0,Wells Fargo Opens FLT With Market Perform,2011-01-24 06:22:00-05:00,FLT,positive
504185.0,Fleetcor Technologies CEO Sells 1 Million Shares of FLT,2010-12-22 16:24:00-05:00,FLT,positive
