Unnamed: 0,title,date,stock,sentiment
503775.0,Shares of several companies in the broader technology sector are trading higher as markets rally on strong US jobs data.,2020-06-05 09:54:00-04:00,FLT,positive
503776.0,Shares of several technology companies are trading higher in sympathy with the overall market as equities rally on coronavirus vaccine hopes as well as a pickup in economic activity as some US states reopen businesses.,2020-05-26 11:12:00-04:00,FLT,positive
503777.0,Shares of several technology companies are trading higher amid market strength as news from a Moderna trial stoked optimism about a potential coronavirus vaccine.,2020-05-18 09:39:00-04:00,FLT,positive
503778.0,"Shares of several technology companies are trading lower amid market weakness, selling off from recent sector strength. Equities have moved lower for the session, potentially related to cautious comments from Fed Chair Powell, who suggested uncertainty and 'significant' downside risks in the economy.",2020-05-13 12:11:00-04:00,FLT,negative
503779.0,"SunTrust Robinson Humphrey Maintains Buy on Fleetcor Technologies, Raises Price Target to $290",2020-05-11 13:42:00-04:00,FLT,neutral
503780.0,"Barclays Maintains Overweight on Fleetcor Technologies, Raises Price Target to $291",2020-05-11 11:45:00-04:00,FLT,negative
503781.0,"CFRA Reiterates Hold on Fleetcor Technologies, Lowers Price Target to $275",2020-05-11 10:44:00-04:00,FLT,negative
503782.0,"Credit Suisse Maintains Neutral on Fleetcor Technologies, Lowers Price Target to $250",2020-05-08 10:30:00-04:00,FLT,positive
503783.0,"Fleetcor Technologies Q1 Adj. EPS $3.000 Beats $2.830 Estimate, Sales $661.100M Beat $650.310M Estimate",2020-05-07 16:56:00-04:00,FLT,neutral
503784.0,"Earnings Scheduled For May 7, 2020",2020-05-07 05:02:00-04:00,FLT,neutral
503785.0,"Baird Maintains Neutral on Fleetcor Technologies, Raises Price Target to $258",2020-05-04 09:19:00-04:00,FLT,neutral
503786.0,Shares of several technology companies are trading lower on market weakness as investor uncertainty grows following quarterly earnings results from multiple companies. NOTE: This could potentially be a sell-off after the S&P 500 rallied 12.7% over the past month.,2020-05-01 09:10:00-04:00,FLT,negative
503787.0,"Shares of several technology companies are trading higher amid market strength following positive data from a study of Gilead's Remdesivir, which is being evaluated for coronavirus. A successful treatment could mean a sooner return to economic activity. NOTE: Some names may also be moving in sympathy following recent earnings from Google and some semiconductor companies.",2020-04-29 10:53:00-04:00,FLT,positive
503788.0,"Morgan Stanley Maintains Equal-Weight on Fleetcor Technologies, Lowers Price Target to $265",2020-04-29 08:52:00-04:00,FLT,negative
503789.0,Shares of several technology companies are trading lower amid overall market weakness following a collapse in oil prices. Oil has been negatively impacted by excess supply and low demand amid the coronavirus pandemic.,2020-04-21 10:52:00-04:00,FLT,negative
503790.0,"Shares of several technology companies are trading lower as equities fall amid mixed earnings results from banks, a significant decline in the price of oil and worse than expected retail sales in March.",2020-04-15 09:14:00-04:00,FLT,negative
503791.0,"Shares of several technology companies are trading higher as markets gain on positive coronavirus outlook. Optimism surrounding the virus has led to hopes of an upcoming return to economic activity, which would benefit the sector.",2020-04-14 10:53:00-04:00,FLT,positive
503792.0,Shares of several technology companies are trading lower amid uncertainty around demand outlook caused by the coronavirus pandemic which has significantly staggered consumer spending and economic activity.,2020-04-13 11:39:00-04:00,FLT,negative
503793.0,"Barclays Maintains Overweight on Fleetcor Technologies, Lowers Price Target to $281",2020-04-09 08:19:00-04:00,FLT,negative
503794.0,"Wells Fargo Maintains Overweight on Fleetcor Technologies, Lowers Price Target to $250",2020-04-08 08:19:00-04:00,FLT,negative
503795.0,"SunTrust Robinson Humphrey Maintains Buy on Fleetcor Technologies, Lowers Price Target to $220",2020-04-06 12:35:00-04:00,FLT,negative
503796.0,"Shares of several technology, semiconductor, and software companies are trading lower amid market weakness as macro concerns continue to grow as a result of the coronavirus pandemic.",2020-04-01 11:12:00-04:00,FLT,negative
503797.0,"Shares of several technology, semiconductor and software companies are trading lower as a potential sell-off from this week's strength. While U.S. stimulus legislation has boosted economic optimism, demand concerns still exist amid the coronavirus.",2020-03-27 11:48:00-04:00,FLT,positive
503798.0,Comdata Launches New Solution to Support Same-Day Shipper Payments for Trucking Fleets,2020-03-26 08:01:00-04:00,FLT,positive
503799.0,"Deutsche Bank Maintains Buy on Fleetcor Technologies, Lowers Price Target to $273",2020-03-20 09:26:00-04:00,FLT,negative
503800.0,"Morgan Stanley Maintains Equal-Weight on Fleetcor Technologies, Lowers Price Target to $275",2020-03-16 11:11:00-04:00,FLT,negative
503801.0,Stocks That Hit 52-Week Lows On Thursday,2020-03-12 12:10:00-04:00,FLT,negative
503802.0,"Baird Maintains Neutral on Fleetcor Technologies, Lowers Price Target to $304",2020-03-11 09:40:00-04:00,FLT,negative
503803.0,"Citigroup Maintains Buy on Fleetcor Technologies, Lowers Price Target to $325",2020-03-03 08:08:00-05:00,FLT,negative
503804.0,"UPDATE: CFRA Reiterates Hold On Fleetcor Technologies, Raises Tgt To $325 Remains 'cautiously optimistic at current levels and need further proof that FLT can restore prior organic growth rates in Fuel Card processing of 9%+ before revisiting our opinion'",2020-02-10 12:23:00-05:00,FLT,positive
503805.0,"CFRA Reiterates Hold on Fleetcor Technologies, Raises Price Target to $325",2020-02-10 12:19:00-05:00,FLT,neutral
503806.0,FLEETCOR Technologies Surpasses Fourth-Quarter Earnings Estimates,2020-02-07 09:58:00-05:00,FLT,neutral
503807.0,"Morgan Stanley Maintains Equal-Weight on Fleetcor Technologies, Raises Price Target to $317",2020-02-07 09:34:00-05:00,FLT,neutral
503808.0,29 Stocks Moving In Thursday's After-Hours Session,2020-02-06 17:23:00-05:00,FLT,neutral
503809.0,Fleetcor shares trading lower following mixed Q4 results and weaker-than-expected FY20 guidance.,2020-02-06 16:53:00-05:00,FLT,neutral
503810.0,"FleetCor Sees FY20 Adj. EPS $13.35-$13.75 vs $13.66 Estimate, Sales $2.9B-$2.96B vs $2.95B Est.",2020-02-06 16:52:00-05:00,FLT,neutral
503811.0,"Fleetcor Technologies Q4 EPS $3.17 Beats $3.13 Estimate, Sales $698.9M Miss $705.55M Estimate",2020-02-06 16:32:00-05:00,FLT,negative
503812.0,Stocks That Hit 52-Week Highs On Thursday,2020-02-06 10:39:00-05:00,FLT,neutral
503813.0,"Earnings Scheduled For February 6, 2020",2020-02-06 04:30:00-05:00,FLT,neutral
503814.0,Stocks That Hit 52-Week Highs On Wednesday,2020-02-05 10:16:00-05:00,FLT,neutral
503815.0,Stocks That Hit 52-Week Highs On Tuesday,2020-02-04 10:18:00-05:00,FLT,neutral
503816.0,"Baird Maintains Neutral on Fleetcor Technologies, Raises Price Target to $358",2020-01-27 08:35:00-05:00,FLT,neutral
503817.0,Stocks That Hit 52-Week Highs On Friday,2020-01-24 10:41:00-05:00,FLT,neutral
503818.0,"Credit Suisse Initiates Coverage On Fleetcor Technologies with Neutral Rating, Announces $335 Price Target",2020-01-24 06:52:00-05:00,FLT,positive
503819.0,"Morgan Stanley Maintains Equal-Weight on Fleetcor Technologies, Raises Price Target to $316",2020-01-23 09:00:00-05:00,FLT,neutral
503820.0,Stocks That Hit 52-Week Highs On Wednesday,2020-01-22 10:17:00-05:00,FLT,neutral
503821.0,10 Biggest Price Target Changes For Wednesday,2020-01-22 08:22:00-05:00,FLT,neutral
503822.0,"Citigroup Maintains Buy on Fleetcor Technologies, Raises Price Target to $360",2020-01-22 07:54:00-05:00,FLT,neutral
503823.0,83 Software—Infrastructure Stocks Moving In Friday's Session,2020-01-17 14:54:00-05:00,FLT,neutral
503824.0,"FLEETCOR  Says 'Strongly Disagrees' With FTC Lawsuit, Highlights Customer Transparency Measures",2019-12-20 16:25:00-05:00,FLT,negative
503825.0,FTC Says Commission Vote Authorizing Staff To File Fleetcor Complaint Was 4-1,2019-12-20 11:05:00-05:00,FLT,negative
503826.0,"FTC Says Alleges Fuel Card Marketer Fleetcor Charged Hundreds Of Millions In Hidden Fees; Says Co. 'Made False Promises Of Fuel Savings, Deliberately Hid Large Fees From Customers'",2019-12-20 11:03:00-05:00,FLT,positive
503827.0,Fleetcor Reports $500M Accelerated Buyback,2019-12-19 09:16:00-05:00,FLT,neutral
503828.0,Citron Says FTC Is 'Within Weeks' Of Filing Lawsuit Against Fleetcor,2019-12-18 10:53:00-05:00,FLT,negative
503829.0,"Deutsche Bank Maintains Buy on Fleetcor Technologies, Raises Price Target to $362",2019-12-16 09:31:00-05:00,FLT,neutral
503830.0,Stocks That Hit 52-Week Highs On Monday,2019-12-02 10:15:00-05:00,FLT,neutral
503831.0,Stocks That Hit 52-Week Highs On Wednesday,2019-11-27 10:14:00-05:00,FLT,neutral
503832.0,Stocks That Hit 52-Week Highs On Tuesday,2019-11-26 11:03:00-05:00,FLT,neutral
503833.0,"Morgan Stanley Maintains Equal-Weight on Fleetcor Technologies, Raises Price Target to $306",2019-11-15 08:34:00-05:00,FLT,neutral
503834.0,"Barclays Maintains Overweight on Fleetcor Technologies, Raises Price Target to $341",2019-11-11 09:43:00-05:00,FLT,negative
503835.0,FLEETCOR Reports Increases In Fuel And Toll Revenue,2019-11-07 09:07:00-05:00,FLT,neutral
503836.0,"JP Morgan Maintains Overweight on Fleetcor Technologies, Raises Price Target to $344",2019-11-07 08:02:00-05:00,FLT,neutral
503837.0,Fleetcor Technologies Sees FY19 Sales Guidance Of $2.64B - $2.66B vs $2.65b Estimates,2019-11-06 16:49:00-05:00,FLT,neutral
503838.0,"Fleetcor Technologies Q3 EPS $2.49 Misses $3.05 Estimate, Sales $681M Beat $679.66M Estimate",2019-11-06 16:48:00-05:00,FLT,negative
503839.0,"Benzinga's Top Upgrades, Downgrades For October 7, 2019",2019-10-07 09:33:00-04:00,FLT,positive
503840.0,"RBC Capital Initiates Coverage On Fleetcor Technologies with Sector Perform Rating, Announces $324 Price Target",2019-10-07 08:03:00-04:00,FLT,neutral
503841.0,Raymond James Reinstates Market Perform on Fleetcor Technologies,2019-10-01 06:54:00-04:00,FLT,neutral
503842.0,Shares of stocks in the business/payment services industry trading lower with the broader stock market. Not seeing any industry-specific news but note the broader financial sector is -- in opposition to the payment services sub sector -- higher today.,2019-09-27 15:25:00-04:00,FLT,neutral
503843.0,"Citigroup Maintains Buy on Fleetcor Technologies, Raises Price Target to $340",2019-09-09 07:50:00-04:00,FLT,neutral
503844.0,"Baird Maintains Neutral on Fleetcor Technologies, Raises Price Target to $316",2019-09-05 09:48:00-04:00,FLT,neutral
503845.0,"FLEETCOR Reports Partnership With Nissan For Contactless Payments In Brazil, No Terms Disclosed",2019-09-05 08:41:00-04:00,FLT,negative
503846.0,"Shares of several business service companies are trading lower after the spread between the 2-year and 10-year yield curve inverted for the first time since 2007, potentially signaling an oncoming recession.",2019-08-14 13:40:00-04:00,FLT,negative
503847.0,90 Biggest Movers From Yesterday,2019-08-08 05:17:00-04:00,FLT,neutral
503848.0,75 Stocks Moving In Wednesday's Mid-Day Session,2019-08-07 13:16:00-04:00,FLT,neutral
503849.0,Fleetcor Sees Many Opportunities For Growth,2019-08-07 11:30:00-04:00,FLT,positive
503850.0,Fleetcor Technologies shares are trading higher after the company reported better-than-expected Q2 EPS and sales results. The company also issued Q3 and FY19 guidance inline with analyst estimates.,2019-08-07 09:53:00-04:00,FLT,positive
503851.0,"FLEETCOR Sees Q3 Adj. EPS $3-$3.10 vs $3.05 Estimate; FY19 Adj. EPS $11.53-$11.83 vs $11.70 Est., Sales $2.625B-$2.675B vs $2.64B Est.",2019-08-06 16:07:00-04:00,FLT,neutral
503852.0,"Fleetcor Technologies Q2 Adj. EPS $2.85 Beats $2.8 Estimate, Sales $647.1M Beat $633.99M Estimate",2019-08-06 16:07:00-04:00,FLT,neutral
503853.0,"Earnings Scheduled For August 6, 2019",2019-08-06 04:00:00-04:00,FLT,neutral
503854.0,"Benzinga's Top Upgrades, Downgrades For July 25, 2019",2019-07-25 09:48:00-04:00,FLT,positive
503855.0,"Baird Initiates Coverage On Fleetcor Technologies with Neutral Rating, Announces $302 Price Target",2019-07-25 06:24:00-04:00,FLT,neutral
503856.0,Fleetcor's Comdata to Acquire Payroll Card Provider SOLE Financial; Terms Not Disclosed,2019-07-15 08:37:00-04:00,FLT,neutral
503857.0,"UPDATE: Morgan Stanley Downgrades Fleetcor Technologies To Equal-Weight, Raises Target To $284 As Firm Notes Co's 'valuation versus its Payments peers now sufficiently accounts for its earnings trajectory and levers for long-term growth'",2019-07-11 09:57:00-04:00,FLT,positive
503858.0,"Morgan Stanley Downgrades Fleetcor Technologies to Equal-Weight, Raises Price Target to $284",2019-07-11 07:19:00-04:00,FLT,neutral
503859.0,Fleetcor To Acquire Payroll Provider,2019-07-09 12:25:00-04:00,FLT,neutral
503860.0,"FLEETCOR to Acquire SOLE Financial, Terms Not Disclosed",2019-07-08 08:33:00-04:00,FLT,neutral
503861.0,"Deutsche Bank Maintains Buy on Fleetcor Technologies, Raises Price Target to $305",2019-06-21 09:08:00-04:00,FLT,neutral
503862.0,Drone Delivery Canada Names Michael Zahra CEO,2019-06-10 09:44:00-04:00,FLT,neutral
503863.0,"Citron Research Targets Fleetcor Technologies, Calls For CEO's Resignation",2019-06-06 12:24:00-04:00,FLT,negative
503864.0,Citron Research Calls Fleetcor 'Largest Clean Energy Fraud In US History',2019-06-06 09:59:00-04:00,FLT,neutral
503865.0,Citron Research Releases Negative Report On Fleetcor Technologies,2019-06-06 09:58:00-04:00,FLT,negative
503866.0,"Benzinga's Top Upgrades, Downgrades For June 5, 2019",2019-06-05 09:10:00-04:00,FLT,positive
503867.0,"Goldman Sachs Upgrades Fleetcor Technologies to Buy, Raises Price Target to $305",2019-06-05 06:13:00-04:00,FLT,neutral
503868.0,"Bank of America Initiates Coverage On Fleetcor Technologies with Neutral Rating, Announces $275 Price Target",2019-06-03 07:08:00-04:00,FLT,neutral
503869.0,95 Biggest Movers From Yesterday,2019-05-09 05:01:00-04:00,FLT,neutral
503870.0,75 Stocks Moving In Wednesday's Mid-Day Session,2019-05-08 12:24:00-04:00,FLT,neutral
503871.0,Fleetcor Technologies shares are trading higher after the company reported mixed Q1 financial results and announced in-line 2019 EPS and sales guidance.,2019-05-08 09:49:00-04:00,FLT,positive
503872.0,"Mizuho Maintains Neutral on FleetCor Technologies, Inc. Common Stock, Raises Price Target to $247",2019-05-08 07:50:00-04:00,FLT,neutral
503873.0,"Fleetcor Sees Fy19 Adj. EPS $11.47-$11.77 vs $11.64 Estimate, Sales $2.6B-$2.66B vs $2.61B Est.",2019-05-07 16:23:00-04:00,FLT,neutral
503874.0,"Fleetcor Technologies Q1 Adj. EPS $2.62 Misses $2.64 Estimate, Sales $621.825M Beat $608.22M Estimate",2019-05-07 16:23:00-04:00,FLT,negative
503875.0,"UPDATE: Citi Maintains Buy, Raises Fleetcor Target From $235 To $280 As Firm Notes 'macro has been incrementally positive since the company last reported, while fuel prices continue to rebound significantly since the late December lows'",2019-03-19 08:16:00-04:00,FLT,positive
503876.0,"Citigroup Maintains Buy on Fleetcor Technologies, Raises Price Target to $280",2019-03-19 07:20:00-04:00,FLT,neutral
503877.0,FLEETCOR To Acquire AP Automation Software Company Nvoicepay,2019-03-05 08:40:00-05:00,FLT,neutral
503878.0,"SunTrust Robinson Humphrey Maintains Buy on Fleetcor Technologies, Raises Price Target to $260",2019-02-19 08:22:00-05:00,FLT,neutral
503879.0,Tiger Global 13F Shows Raised Stake In Fleetcor Technologies,2019-02-14 13:17:00-05:00,FLT,neutral
503880.0,FleetCor Beats Wall Street Consensus,2019-02-11 12:05:00-05:00,FLT,neutral
503881.0,CORRECTION: FLEETCOR Q4 Adj. EPS $2.78 Compared To (Beat) $2.72 Estimate; Initial headline compared the GAAP EPS figure of $3.33 to the non-GAAP estimate; this was incorrect,2019-02-07 13:18:00-05:00,FLT,neutral
503882.0,Fleetcor Technologies shares are trading higher after the company reported Q4 EPS of $3.33 beating the $2.72 estimate and sales of $643.4 million beating the $620.11 million estimate; the company provided strong FY19 sales guidance.,2019-02-07 11:59:00-05:00,FLT,negative
503883.0,Fleetcor Technologies Sees Q1 EPS $2.55-2.65 vs $2.72 Est,2019-02-06 16:51:00-05:00,FLT,neutral
503884.0,Fleetcor Technologies Sees FY2019 EPS $11.40-11.70 vs $11.71 Est; Sees Sales $2.57B-2.63B vs $2.57B Est,2019-02-06 16:51:00-05:00,FLT,neutral
503885.0,"Fleetcor Technologies Q4 GAAP EPS $3.33, Adj. EPS $2.78 Beats $2.72 Estimate, Sales $643.4M Beat $620.11M Estimate",2019-02-06 16:50:00-05:00,FLT,neutral
503886.0,Fleetcor Technologies Q4 Earnings Preview,2019-02-06 08:36:00-05:00,FLT,neutral
503887.0,"Earnings Scheduled For February 6, 2019",2019-02-06 04:10:00-05:00,FLT,neutral
503888.0,"Jefferies Initiates Coverage On Fleetcor Technologies with Hold Rating, Announces $210 Price Target",2019-01-29 06:35:00-05:00,FLT,neutral
503889.0,"BTIG Research Initiates Coverage On Fleetcor Technologies with Buy Rating, Announces $253 Price Target",2019-01-18 07:25:00-05:00,FLT,neutral
503890.0,"Stocks Which Set New 52-Week Low Last Trading Session, Fri., Dec. 14, 2018",2018-12-17 11:48:00-05:00,FLT,negative
503891.0,FLEETCOR Announces $220M Accelerated Buyback Program,2018-12-17 08:04:00-05:00,FLT,neutral
503892.0,"Stocks Which Set New 52-Week Low Yesterday, Thurs., Dec. 13, 2018",2018-12-14 11:03:00-05:00,FLT,negative
503893.0,"Benzinga's Top Upgrades, Downgrades For December 11, 2018",2018-12-11 09:18:00-05:00,FLT,positive
503894.0,"Goldman Sachs Downgrades Fleetcor Technologies to Neutral, Lowers Price Target to $215",2018-12-11 06:15:00-05:00,FLT,negative
503895.0,"Barclays Initiates Coverage Of Payments Sector, Names PayPal As Top Pick",2018-11-18 16:34:00-05:00,FLT,positive
503896.0,"Barclays Initiates Coverage On Fleetcor Technologies with Overweight Rating, Announces $245 Price Target",2018-11-15 08:07:00-05:00,FLT,negative
503897.0,Fleetcor Technologies shares are up 8.6% after the company beat Q3 earnings estimates and raised FY18 sales estimates.,2018-10-31 13:06:00-04:00,FLT,positive
503898.0,FLEETCOR Announces McDonald's Brazil Customers Can Pay With Their Voice Using Sem Parar,2018-10-30 17:09:00-04:00,FLT,negative
503899.0,Fleetcor Technologies Narrows FY2018 EPS Guidance from $10.32-10.52 to $10.40-10.50 vs $10.46 Est; Raises FY2018 Sales Guidance from $2.37B-2.42B to $2.39B-2.42B vs $2.40B Est,2018-10-30 17:07:00-04:00,FLT,neutral
503900.0,"FleetCor Technologies Q3 EPS $1.71 May Not Compare to $2.66 Estimate, Sales $619.6M Beat $609.41M Estimate",2018-10-30 17:05:00-04:00,FLT,neutral
503901.0,"Earnings Scheduled For October 30, 2018",2018-10-30 04:01:00-04:00,FLT,neutral
503902.0,"Stocks Which Set New 52-Week High Yesterday, October 1st",2018-10-02 09:20:00-04:00,FLT,neutral
503903.0,"Stocks Which Set New 52-Week High Friday, September 21",2018-09-24 09:43:00-04:00,FLT,neutral
503904.0,Freight Alley: A Region Where Logistics Contributes To More Than 40% Of The Economy,2018-09-19 11:54:00-04:00,FLT,neutral
503905.0,"Morgan Stanley Maintains Overweight on Fleetcor Technologies, Raises Price Target to $240",2018-08-03 07:18:00-04:00,FLT,negative
503906.0,"FLEETCOR Technologies Sees FY18 Adj. EPS $10.32-$10.52 vs $10.43 Est., Sales $2.37B-$2.42B vs $2.43B Est.",2018-08-02 16:46:00-04:00,FLT,neutral
503907.0,"Fleetcor Technologies Q2 Adj. EPS $2.57 Beats $2.53 Estimate, Sales $608.3M Beat $596.49M Estimate",2018-08-02 16:45:00-04:00,FLT,neutral
503908.0,"Stocks Which Set New 52-Week High Yesterday, July 25th",2018-07-26 11:00:00-04:00,FLT,neutral
503909.0,"Citigroup Maintains Buy on Fleetcor Technologies, Raises Price Target to $260",2018-07-20 07:41:00-04:00,FLT,neutral
503910.0,"Morgan Stanley Upgrades The Payment Industry, But Leaves OnDeck, LendingClub Behind",2018-07-19 10:45:00-04:00,FLT,neutral
503911.0,S&P Dow Jones Indices Announces 'NVIDIA Set to Join S&P 100; FleetCor Technologies to Join S&P 500; Penn Virginia to Join S&P SmallCap 600',2018-06-18 17:17:00-04:00,FLT,positive
503912.0,"FLEETCOR Technologies Reports Contract With Casey's General Stores For Mgmt. Of Private-Label Corporate Fuel Card Program For All Of Casey's Retail Locations, No Terms Disclosed",2018-06-13 08:32:00-04:00,FLT,negative
503913.0,"William Blair Growth Stock Conference Begins Today, Presenters Include: Aspen Technology, Ellie Mae, FleetCor, Catalent, SendGrid, DexCom, Discover Financial, and Okta",2018-06-12 07:16:00-04:00,FLT,positive
503914.0,"Comdata Announces Partnership Renewal With Infintech To Support ePayables Vendor Enrollment, No Terms Disclosed",2018-05-08 09:01:00-04:00,FLT,positive
503915.0,"Morgan Stanley Maintains Overweight on Fleetcor Technologies, Raises Price Target to $238.00",2018-05-04 10:36:00-04:00,FLT,negative
503916.0,FLEETCOR And P97 Form Strategic Partnership To Accelerate Mobile Payments At Gas Stations,2018-05-03 18:16:00-04:00,FLT,neutral
503917.0,Shell Completes Fuel Card System Conversion Onto FLEETCOR Platform Across Europe and Asia,2018-05-03 18:06:00-04:00,FLT,neutral
503918.0,FLEETCOR And Shell Extend Fuel Card Agreement In Europe,2018-05-03 18:04:00-04:00,FLT,positive
503919.0,"FleetCor Technologies Sees FY18 EPS $10.20-$10.50 vs $10.33 Est., Sales $2.39B-$2.45B vs $2.55B Est.",2018-05-03 17:53:00-04:00,FLT,neutral
503920.0,"Fleetcor Technologies Q1 EPS $2.50 Beats $2.37 Estimate, Sales $609.7M Beat $602.47M Estimate",2018-05-03 17:51:00-04:00,FLT,neutral
503921.0,FLEETCOR Technologies Reports Uber Freight Partnership For Launch Of Uber Freight Fuel Card,2018-03-21 09:07:00-04:00,FLT,neutral
503922.0,"Morgan Stanley Maintains Overweight on Fleetcor Technologies, Raises Price Target to $235.00",2018-03-14 09:54:00-04:00,FLT,negative
503923.0,Tiger Global 13F Shows Lowered Stake In Fleetcor Technologies And JD.Com,2018-02-14 13:32:00-05:00,FLT,negative
503924.0,"Credit Suisse Maintains Neutral on Fleetcor Technologies, Raises price target to $211.00",2018-02-09 09:30:00-05:00,FLT,positive
503925.0,"FleetCor Sees FY18 Adj. EPS $10.05-$10.35 vs $10.16 Est., Sales $2.49B-$2.55B vs $2.54B Est.",2018-02-08 16:36:00-05:00,FLT,neutral
503926.0,"FleetCor Technologies Reports Q4 Adj. EPS $2.42 vs $2.33 Est., Adj. Sales $579.5M, GAAP Sales $610M vs $604.89M Est.",2018-02-08 16:35:00-05:00,FLT,neutral
503927.0,Fleetcor's Earnings Preview,2018-02-08 08:38:00-05:00,FLT,neutral
503928.0,"FLEETCOR To Report Q4 Earnings On Thurs., Feb. 8 After Market Close",2018-01-29 16:33:00-05:00,FLT,neutral
503929.0,Oppenheimer Serves Up 29 Top Stock Ideas For January,2017-12-19 17:43:00-05:00,FLT,positive
503930.0,Oppenheimer's Top Stock Picks For December,2017-11-30 10:17:00-05:00,FLT,positive
503931.0,"Citi Fintech Conference Concludes Today, Presenters Include: Western Union, NCR, WEX, Fleetcor Technologies, Total System Services, and Mastercard",2017-11-07 09:07:00-05:00,FLT,neutral
503932.0,"FleetCor Acquires Creative Lodging Solutions, No Terms Disclosed",2017-11-01 17:43:00-04:00,FLT,positive
503933.0,FleetCor Enters Exclusive Agreement To Manage GES Roznitsa Fuel Card Program,2017-11-01 17:42:00-04:00,FLT,positive
503934.0,FleetCor Selected By Walmart As Fuel Payment Provider,2017-11-01 17:41:00-04:00,FLT,neutral
503935.0,16 Stocks Moving In Wednesday's After-Hours Session,2017-11-01 17:28:00-04:00,FLT,neutral
503936.0,"FleetCor Sees FY17 Adj. EPS $8.38-$8.48 vs $8.39 Est., Sales $2.225B-$2.255B vs $2.23B Est.",2017-11-01 16:10:00-04:00,FLT,neutral
503937.0,FleetCor Increases Buyback By $350M,2017-11-01 16:10:00-04:00,FLT,neutral
503938.0,"FleetCor Technologies Reports Q3 Adj. EPS $2.18 vs $2.15 Est., Adj. Sales $550.2M vs $576.96M Est.",2017-11-01 16:09:00-04:00,FLT,neutral
503939.0,"FleetCor Shares Are 'Too Compelling To Ignore,' According To Oppenheimer",2017-09-21 13:38:00-04:00,FLT,positive
503940.0,"Oppenheimer Analyst Reiterated Outperform Rating, $185 Price Target On FleetCor, Said 'FleetCor Too Compelling To Ignore'",2017-09-21 07:57:00-04:00,FLT,negative
503941.0,Delaware Court Has Ruled In Favor Of TravelCenters Of America Related To Suit Against Fleetcor's Comdata Unit,2017-09-11 14:44:00-04:00,FLT,positive
503942.0,FLEETCOR Technologies Reports Renewal Of Deal To Manage Commercial Fleet Card Program For ARCO,2017-08-23 09:02:00-04:00,FLT,neutral
503943.0,13F From Tiger Global Shows Increased Stake In Fleetcor From ~1.4M Shares To ~2.28M Shares,2017-08-14 15:10:00-04:00,FLT,positive
503944.0,Watch These 7 Huge Call Purchases In Tuesday Trade,2017-08-08 04:04:00-04:00,FLT,positive
503945.0,Fleetcor Tech Option Alert: Aug 18 $145 Calls Sweep (22) at the Bid: 577 @ $1.65 vs 123 OI; Ref=$142.43,2017-08-07 12:05:00-04:00,FLT,positive
503946.0,"FLEETCOR Sees FY17 Sales $2.195-$2.245B vs $2.22B Est., Adj. EPS $8.24-$8.44 vs $8.34 Est.",2017-08-03 16:08:00-04:00,FLT,neutral
503947.0,"FLEETCOR Reports Q2 Adj. EPS $1.99 vs $1.97 Est., Sales $541.2M vs $527.5M Est.",2017-08-03 16:08:00-04:00,FLT,neutral
503948.0,"Fleetcor Shares Earlier Spiked To Session Lows Following Capital Forum Alert Suggesting BP Pressuring Co. Related To Customer Complaints; Stock Quickly Pared Losses, Is Now Up From Where Stock Was Trading When Alert Went Out",2017-07-17 15:59:00-04:00,FLT,negative
503949.0,10 Reasons To Own FleetCor During The Second Half Of 2017,2017-07-13 10:55:00-04:00,FLT,neutral
503950.0,Oppenheimer Analysts Release 28 Best Ideas List,2017-06-29 13:24:00-04:00,FLT,positive
503951.0,"Companies Holding Shareholder Meetings Today Include: Adaptimmune Therapeutics, Aurinia Pharma, BlackBerry, Box, FleetCor, and IAC",2017-06-21 08:58:00-04:00,FLT,neutral
503952.0,Michelin to Acquire NexTraq from FLEETCOR Technologies in All-Cash Transction,2017-06-14 04:22:00-04:00,FLT,neutral
