Unnamed: 0,title,date,stock,sentiment
503953.0,"FLEETCOR Technologies Head Of Local Fuel Card Business Todd House To Resign, Names Ashley Thekkekara Successor",2017-05-31 12:16:00-04:00,FLT,negative
503954.0,FleetCor 8-K Filing Shows Co. Announcing Lawsuit With Chevron In Texas District Court Has Been Dismissed,2017-05-30 16:47:00-04:00,FLT,negative
503955.0,"JP Morgan Tech, Media And Telecom Conference Concludes Today, Presenters Include: Rambus, Micron Tech, Snap, Fleetcor, And Zebra Technologies",2017-05-24 08:29:00-04:00,FLT,positive
503956.0,The Top 11 Analysts On TipRanks And What They Cover,2017-05-18 07:50:00-04:00,FLT,positive
503957.0,Tiger Global Cuts Stake In FleetCor,2017-05-15 14:32:00-04:00,FLT,negative
503958.0,FleetCor Will Be On Road Show Next Week With Evercore ISI and William Blair To Speak With Investors To Alleviate Fears With Business Model,2017-05-05 11:16:00-04:00,FLT,negative
503959.0,"Evercore ISI Out Defending FleetCor, Says Valuation Has Been Compelling and Spoke Directly With CFO Eric Dey Regarding Dispute",2017-05-03 15:25:00-04:00,FLT,negative
503960.0,"FleetCor Shares Up ~3.5% Over Last Few Mins, Continue to Push to Fresh Afternoon Highs; Hearing Morgan Stanley Has Called Chevron Suit News 'Not Material'",2017-05-03 14:59:00-04:00,FLT,positive
503961.0,FleetCor Shares Spike ~$3 Over $125 Level Over Last Few Mins; Hearing Co. Has Said Court Denied Chevron's Request for Immediate Info,2017-05-03 14:55:00-04:00,FLT,negative
503962.0,UPDATE: SunTrust on FleetCor Says News of Chevron Portfolio Loss to WEX is 'Already in Street Numbers',2017-05-03 13:32:00-04:00,FLT,negative
503963.0,UPDATE: SunTrust on FleetCor Says 'Concerns over business practices remain but likely overblown',2017-05-03 13:32:00-04:00,FLT,neutral
503964.0,SunTrust on FleetCor: 'Feels Like Market Overreaction',2017-05-03 13:30:00-04:00,FLT,positive
503965.0,A Bull-Bear Battle Over FleetCor,2017-05-03 13:26:00-04:00,FLT,negative
503966.0,JPMorgan Now Defending FleetCor Says Stock Reaction To Chevron Petition Seems Overdone,2017-05-03 12:37:00-04:00,FLT,neutral
503967.0,Hearing Compass Point Has Upgraded FleetCor,2017-05-03 12:29:00-04:00,FLT,neutral
503968.0,"Citron's Andrew Left Responds to Mid-Day Rebound in FleetCor Shares Amid Trader/Publication Skepticism on Size of Damages, Timing of Chevron Suit Disclosure: Suit 'Validates That the Possible Reason Why Chevron Left Them was for Bad Behavior'",2017-05-03 12:19:00-04:00,FLT,negative
503969.0,FleetCor Shares Down Nearly $6 Over Last Few Mins as Hearing Capitol Forum Making Mid-Day Negative Comments,2017-05-03 11:57:00-04:00,FLT,negative
503970.0,"FleetCor Shares Continue to Rebound from Session Lows, Now Down ~4-5%; Traders Highlighting Recent Headlines Suggesting Damages from Chevron Suit Will Not Be More Than $10K",2017-05-03 11:45:00-04:00,FLT,negative
503971.0,"FleetCor Shares Up $6.50 Over Last Few Mins, Sharply Off Session Lows as Traders Circulating Dec. 20, 2016 Barron's Article 'How WEX Won Chevron From FleetCor,' Some Suggest Damages Highlighted by Left Were Already Announced 4 Months Ago",2017-05-03 11:33:00-04:00,FLT,positive
503972.0,Citron Research Tweets: $FLT being sued by Chevron.  Delaying transfer and Charging FEES.  Is that fake news? See you at $100 a share Read the lawsuit,2017-05-03 10:45:00-04:00,FLT,negative
503973.0,"Benzinga's Top Upgrades, Downgrades For May 2, 2017",2017-05-02 09:21:00-04:00,FLT,positive
503974.0,25 Stocks Moving In Tuesday's Pre-Market Session,2017-05-02 08:05:00-04:00,FLT,neutral
503975.0,Raymond James Upgrades Fleetcor Technologies to Strong Buy,2017-05-02 07:08:00-04:00,FLT,positive
503976.0,Watch These Huge Put Purchases In Tuesday Trade,2017-05-02 04:22:00-04:00,FLT,positive
503977.0,Benzinga's Option Alert Recap From May 1,2017-05-01 18:14:00-04:00,FLT,positive
503978.0,"FLEETCOR Technologies Sees FY 2017 EPS $8.21 to $8.41 vs $8.24 Est, Sales $2.175B to $2.235B vs $2.2B Est",2017-05-01 16:07:00-04:00,FLT,neutral
503979.0,"FLEETCOR Technologies Q1 EPS $1.96 vs $1.87 Est, GAAP Sales $520.4M vs $512.8M Est",2017-05-01 16:07:00-04:00,FLT,neutral
503980.0,"FLEETCOR Reports Deal to Buy 'Cambridge Global Payments,' No Terms Dislcosed",2017-05-01 16:05:00-04:00,FLT,negative
503981.0,Seeing Notable Options Activity In FleetCor May $130 Puts; BZ Note: Implies Trader Expects 14% Downside Within Roughly 2 And A Half Weeks,2017-05-01 14:37:00-04:00,FLT,neutral
503982.0,Option Alert: Fleetcor May 130 Puts: 1151 @  ASK  $1.45: 1840 traded vs 84 OI:  Earnings 5/3 After Close  $148.92 Ref,2017-05-01 14:33:00-04:00,FLT,positive
503983.0,"FLEETCOR Technologies Reschedules First Quarter 2017 Earnings Conference Call From May 3 To Today, May 1st After The Market Closes",2017-05-01 08:06:00-04:00,FLT,neutral
503984.0,The Market In 5 Minutes,2017-04-28 09:00:00-04:00,FLT,neutral
503985.0,Citron's Left Says He Believes Fleetcor Thesis Will Play Out A Lot Faster Than USANA,2017-04-27 14:36:00-04:00,FLT,positive
503986.0,"Citron's Left Says He Believes FleetCor Issues Can Get Into Criminal Territory, They Circumvent The System With Fine Print to Point Where They Aren't Compliant Anymore; It Takes One Attorney General to Take Criminal Action",2017-04-27 14:31:00-04:00,FLT,negative
503987.0,"Citron's Andrew Left Tells Benzinga FleetCor Is Unscrupulous, Like Everything Else, When You Have A Business Based on Unknown Hidden Concerns, Company Will Have To Pull It In; Spoke To More Than 25 Former Employees",2017-04-27 14:26:00-04:00,FLT,positive
503988.0,Citron's Andrew Left Is Talking FleetCor Short Position Live With Benzinga on premarket.benzinga.com,2017-04-27 14:24:00-04:00,FLT,neutral
503989.0,"Citron Investigation Reveals FleetCor Fee Scheme, Bets It Could Get Into The Criminal Round",2017-04-27 14:09:00-04:00,FLT,negative
503990.0,Citron Research 'Just read the todays  piece from C.F. today on $FLT  just shorted more ..uglier than we initially thought.  Jail or fines for management?',2017-04-27 13:30:00-04:00,FLT,neutral
503991.0,"UPDATE: Citron Report Titled, 'Citron Exposes the Dirty Illegal Secrets of FleetCor, and Proof the Company is Already in Cover-Up Mode'",2017-04-27 13:03:00-04:00,FLT,negative
503992.0,Citron Research Tweets: Citron publishes the only thing you have to read on $FLT.  Earnings are meaningless without knowing their business.   TGT $80,2017-04-27 13:02:00-04:00,FLT,negative
503993.0,UPDATE: Oppenheimer on Fleetcor: 'Upside/downside appears highly attractive over any intermediate term time horizon',2017-04-07 11:28:00-04:00,FLT,positive
503994.0,UPDATE: Oppenheimer on Citron Claims on Fleetcor: 'Nothing is inherently wrong with charging customers fees',2017-04-07 11:27:00-04:00,FLT,positive
503995.0,"Oppenheimer Commenting on Citron's Report on Fleetcor from Earlier This Week, Believes Report 'contains various misstatement and inaccuracies, and flawed comparative logic'",2017-04-07 11:26:00-04:00,FLT,neutral
503996.0,FleetCor Defended By Wells Fargo Against Citron Short Report: 'We Disagree With The Thesis',2017-04-05 09:59:00-04:00,FLT,negative
503997.0,"Wells Fargo Out Defending FleetCor; Of Citron Short Report On FLT Says 'We Disagree With The Thesis And The Facts Supporting It,' Reiterates Outperform",2017-04-05 08:14:00-04:00,FLT,positive
503998.0,Citron Goes Short On FleetCor,2017-04-04 13:16:00-04:00,FLT,neutral
503999.0,"Credit Suisse's Condra Tells Benzinga FleetCor Could Benefit from More Disclosure, Mgmt Will Say They Don't Raise Prices, But Sell More Higher Cost Products",2017-04-04 12:37:00-04:00,FLT,positive
504000.0,Credit Suisse's Condra Believes Investors Like FleetCor Shares for Mgmt's Ability to Raise Prices,2017-04-04 12:36:00-04:00,FLT,positive
504001.0,"Credit Suisse Analyst Paul Condra Comments on FleetCor, Plausability of Citron Report, Tells Benzinga He Has A Tough Time Understanding Co.'s Model, Highlights Low Visibility On Fundamentals",2017-04-04 12:36:00-04:00,FLT,neutral
504002.0,UPDATE: Citron Says Stock Should Hit A Short-Term Price Target Of $100,2017-04-04 10:20:00-04:00,FLT,neutral
504003.0,"Citron Research Tweets: Citron Research exposes the fraud at $FLT   ""Just a computer glitch""  I think we have heard that before",2017-04-04 10:19:00-04:00,FLT,negative
504004.0,"Hearing Capitol Forum Out Negative On FleetCor, Cites Concerns Over Customers Paying Higher Than Retail Price For Gas With Company's Fuel Cards After Fees, Elimination Of Discounts Under Certain Conditions",2017-03-20 11:00:00-04:00,FLT,negative
504005.0,20 Biggest Mid-Day Gainers For Thursday,2017-02-09 12:31:00-05:00,FLT,neutral
504006.0,Mid-Morning Market Update: Markets Open Higher; Twitter Q4 Sales Miss Expectations,2017-02-09 09:49:00-05:00,FLT,negative
504007.0,25 Stocks Moving In Thursday's Pre-Market Session,2017-02-09 08:35:00-05:00,FLT,neutral
504008.0,Fleetcor Sees Q1 Adj. EPS $1.82-$1.88 vs $1.89 Est.,2017-02-08 16:18:00-05:00,FLT,neutral
504009.0,"Fleetcor Reports Q4 Adj. EPS $1.90 vs $1.87 Est., Sales $515M vs $502.7M Est.",2017-02-08 16:17:00-05:00,FLT,neutral
504010.0,Here's Oppenheimer's List Of The 29 Best Stocks For 2017,2016-12-19 09:33:00-05:00,FLT,positive
504011.0,Fulton Financial CFO Patrick Barrett To Resign,2016-12-06 16:05:00-05:00,FLT,negative
504012.0,"The Market In 5 Minutes: Salesforce Has Strong Quarter, Tesla-SolarCity Deal Approved By Shareholders",2016-11-18 09:00:00-05:00,FLT,positive
504013.0,Benzinga's Top Upgrades,2016-11-18 08:56:00-05:00,FLT,positive
504014.0,Wells Fargo Upgrades FleetCor to Outperform,2016-11-18 06:50:00-05:00,FLT,positive
504015.0,Tiger Global Cuts Stake In Fleetcor Technologies By 26.2% To 2.4M Shares,2016-11-14 14:50:00-05:00,FLT,neutral
504016.0,Mid-Afternoon Market Update: Tandem Diabetes Drops Following Weak Q3 Results; Novocure Shares Spike Higher,2016-11-02 14:46:00-04:00,FLT,negative
504017.0,Mid-Day Market Update: Crude Oil Down Over 3%; Office Depot Shares Gain On Upbeat Earnings,2016-11-02 12:27:00-04:00,FLT,positive
504018.0,"FleetCor Reports Q3 non-GAAP EPS $1.92 vs $1.86 Est, Rev $484.4M vs $491.52M",2016-11-01 17:22:00-04:00,FLT,neutral
504019.0,"William Blair Earlier Initiated Coverage On FleetCor Technologies, Inc. Common Stock at Outperform",2016-10-14 11:40:00-04:00,FLT,neutral
504020.0,6 Reasons For Upside Potential In FleetCor,2016-09-21 12:28:00-04:00,FLT,neutral
504021.0,"Tiger Global Management Reduces Fleetcor Technologies, Mastercard, Pure Storage, And On Deck Stakes",2016-08-15 15:11:00-04:00,FLT,neutral
504022.0,Oppenheimer Upgrades Fleetcor Technologies to Outperform,2016-08-05 07:39:00-04:00,FLT,neutral
504023.0,"FleetCor Sees FY16 Rev. $1.74-$1.78B vs. Est. $1.76B, EPS $6.61-$6.75 vs. Est. $6.62",2016-08-04 17:33:00-04:00,FLT,neutral
504024.0,"FleetCor Reports Q2 EPS $1.56 vs. Est. $1.54, Rev. $395.6M vs. Est. $415M",2016-08-04 17:32:00-04:00,FLT,neutral
504025.0,"FleetCor Sees FY16 Adj. EPS $6.61-$6.75 vs $6.62 Est., Sales $1.74B-$1.78B vs $1.76B Est.",2016-08-04 16:38:00-04:00,FLT,neutral
504026.0,"FleetCor Reports Q2 Adj. EPS $1.56 vs $1.54 Est., Sales $417.9M vs $415.2M Est.",2016-08-04 16:38:00-04:00,FLT,neutral
504027.0,FleetCor Acquires Travelcard,2016-08-04 16:10:00-04:00,FLT,neutral
504028.0,FleetCor Awarded Speedway Commercial Fleet Card Contract,2016-08-04 16:10:00-04:00,FLT,positive
504029.0,FleetCor Upgraded At JPMorgan On Potential Positive EPS Revisions,2016-07-12 09:49:00-04:00,FLT,positive
504030.0,Benzinga's Top Upgrades,2016-07-12 08:59:00-04:00,FLT,positive
504031.0,"JP Morgan Upgrades Fleetcor Technologies to Overweight, Maintains $159.00 PT",2016-07-12 06:01:00-04:00,FLT,neutral
504032.0,Benzinga's Top Initiations,2016-06-24 09:07:00-04:00,FLT,positive
504033.0,SunTrust Robinson Humphrey Initiates Coverage on Fleetcor Technologies at Buy,2016-06-24 06:58:00-04:00,FLT,neutral
504034.0,"MasterCard, Visa Investors: Goldman Says Macro Data More Predicative Than Retailer Data",2016-05-31 08:49:00-04:00,FLT,neutral
504035.0,"Fleetcor Sees FY16 Sales $1.73B-$1.78B vs $1.77B Est., Adj. EPS $6.43-$6.63 vs $6.58 Est.",2016-05-04 17:46:00-04:00,FLT,neutral
504036.0,"Fleetcor Reports Q1 Adj. EPS $1.53 vs $1.50 Est., Sales $414.3M vs $417.6M Est.",2016-05-04 17:46:00-04:00,FLT,neutral
504037.0,"Fleetcor Technologies Sees FY 2016 Adj EPS $6.43-$6.63 Vs Est $6.58, Sales $1.73B-$1.78B Vs Est $1.77B",2016-05-04 16:36:00-04:00,FLT,neutral
504038.0,JPMorgan Upgrades WEX Away From Underweight Following Q1 Results,2016-04-29 16:18:00-04:00,FLT,neutral
504039.0,"Compass Point Initiates Coverage on Fleetcor Technologies at Neutral, Announces $145.00 PT",2016-04-15 07:55:00-04:00,FLT,neutral
504040.0,Compass Point Initiates Financial Technology Names,2016-04-15 06:49:00-04:00,FLT,neutral
504041.0,Evercore ISI Group Upgrades Fleetcor Technologies to Buy,2016-03-18 05:36:00-04:00,FLT,neutral
504042.0,Option Alert: FLT Apr16 140 Calls Sweep: 822 @  ASK  $6.38: 828 traded vs 30 OI:  Earnings 5/5  $142.73 Ref,2016-03-17 15:54:00-04:00,FLT,positive
504043.0,FleetCor to Purchase STP for ~$1.05B,2016-03-15 07:00:00-04:00,FLT,neutral
504044.0,Everything You Might Have Missed This 13F Season: Part 2,2016-02-17 15:58:00-05:00,FLT,negative
504045.0,"FleetCor Sees FY16 Adj. EPS $6.40-$6.60 vs $6.69 Est., Sales $1.73B-$1.78B vs $1.75B Est.",2016-02-04 16:34:00-05:00,FLT,neutral
504046.0,"FleetCor Reports Q4 Adj. EPS $1.70 vs $1.61 Est., Non-GAAP Sales $403.1M, Total Sales $430.6M vs $432M Est.",2016-02-04 16:33:00-05:00,FLT,neutral
504047.0,FleetCor Reports $500M Buyback,2016-02-04 16:07:00-05:00,FLT,neutral
504048.0,"Keefe Bruyette & Woods Maintains Outperform on Fleetcor Technologies, Lowers PT to $147.00",2016-02-03 03:53:00-05:00,FLT,negative
504049.0,"Credit Suisse Initiates Coverage on Fleetcor Technologies at Neutral, Announces $152.00 PT",2015-12-10 16:23:00-05:00,FLT,positive
504050.0,FLEETCOR Announces New North America Partners Business Unit,2015-12-02 16:10:00-05:00,FLT,neutral
504051.0,Tiger Global Shows ~1.4M Share Increase in Fleetcor Stake,2015-11-16 14:41:00-05:00,FLT,positive
504052.0,"Fleetcor Technologies Reports Q3 Adj. EPS $1.67 vs $1.61 Est., Sales $451.4M vs $430.5M Est.; Sees FY15 Adj. EPS $6.18-$6.26 vs $6.22 Est.",2015-11-04 17:45:00-05:00,FLT,neutral
504053.0,1 Bank And 1 Card Company KBW Analysts Are Buying,2015-09-14 08:13:00-04:00,FLT,neutral
504054.0,"Keefe Bruyette & Woods Initiates Coverage on Fleetcor Technologies at Outperform, Announces $185.00 PT",2015-09-14 03:57:00-04:00,FLT,neutral
504055.0,Virtual Cards: The Large 'Untapped' Market That Could Disrupt Commercial Payments,2015-09-11 12:22:00-04:00,FLT,neutral
504056.0,Susquehanna Upgrades Fleetcor Technologies to Positive,2015-08-06 07:28:00-04:00,FLT,positive
504057.0,"FleetCor Reports Q2 EPS $1.48 vs. Est. $1.46, Rev. $404.6M vs. Est. $403.23M",2015-08-05 16:09:00-04:00,FLT,neutral
504058.0,"Topeka Capital Initiates Coverage on Fleetcor Technologies at Hold, Announces $160.00 PT",2015-06-16 06:58:00-04:00,FLT,neutral
504059.0,"Box, Bazaarvoice, Krispy Kreme Lead Wednesday's After-Hours Movers",2015-06-10 18:08:00-04:00,FLT,neutral
504060.0,FleetCor Announces Winning of Uber Fuel Card Contract,2015-06-09 16:11:00-04:00,FLT,positive
504061.0,FleetCor Wins Uber Fuel Card Contract,2015-06-09 16:03:00-04:00,FLT,positive
504062.0,"Monness Crespi Hardt Initiates Coverage on Fleetcor Technologies at Buy, Announces $184.00 PT",2015-05-13 09:19:00-04:00,FLT,neutral
504063.0,"FleetCor Reports Q1 EPS $1.00 Vs Est $1.40 , Sales $416.2M Vs Est $390.63M",2015-04-30 16:05:00-04:00,FLT,neutral
504064.0,Goldman Sachs: FleetCor No Longer A Conviction Buy,2015-04-14 09:07:00-04:00,FLT,negative
504065.0,A Look At Dan Loeb's Diversified 13F,2015-02-18 18:04:00-05:00,FLT,neutral
504066.0,Tiger Global Posts 17% Gain; Likes Chinese Internet Stocks,2015-02-12 14:34:00-05:00,FLT,positive
504067.0,"FleetCor Technologies Reports Q4 Adj EPS $1.39 Vs Est $1.36, Sales $376.7M Vs Est $330.77M",2015-02-05 16:11:00-05:00,FLT,neutral
504068.0,"FleetCor Technologies 'M&A Potential Intact,' Goldman Sachs Says",2015-02-02 13:40:00-05:00,FLT,neutral
504069.0,Civeo Loses More Than 50%; What Are Some Other Stocks In the Business Services Industry?,2014-12-31 14:40:00-05:00,FLT,negative
504070.0,UPDATE: Deutsche Bank Initiates Coverage On FleetCor Technologies,2014-12-05 11:53:00-05:00,FLT,neutral
504071.0,"Deutsche Bank Initiates Coverage on FleetCor Technologies, Inc. at Buy, Announces $178.00 PT",2014-12-05 06:03:00-05:00,FLT,neutral
504072.0,Morgan Stanley Raises FleetCor Technologies Price Target,2014-11-26 11:45:00-05:00,FLT,neutral
504073.0,"Morgan Stanley Maintains Overweight on FleetCor Technologies, Inc., Raises PT to $153.00",2014-11-26 04:30:00-05:00,FLT,negative
504074.0,"FleetCor Technologies, Inc. Sees FY2014 EPS $5.07-5.11 vs $5.08 Est; Sees Sales $1.10B-1.11B vs $1.10B Est",2014-10-30 16:55:00-04:00,FLT,neutral
504075.0,"FleetCor Technologies, Inc. Reports Q3 EPS of $1.37 vs $1.34 Est; Revenue of $295.30M vs $282.74M Est",2014-10-30 16:22:00-04:00,FLT,neutral
504076.0,"UPDATE: Morgan Stanley Upgrades FleetCor Technologies, Inc. On Multiple Positive Factors",2014-10-16 09:33:00-04:00,FLT,positive
504077.0,"Morgan Stanley Upgrades FleetCor Technologies, Inc. to Overweight",2014-10-16 07:43:00-04:00,FLT,negative
504078.0,"Evercore Adds Fleetcor Technologies To ""Conviction Buy List""",2014-10-15 06:18:00-04:00,FLT,neutral
504079.0,"Stocks To Watch For August 13, 2014",2014-08-13 04:01:00-04:00,FLT,neutral
504080.0,"Benzinga's M&A Chatter for Tuesday August 12, 2014",2014-08-12 19:34:00-04:00,FLT,neutral
504081.0,FleetCor Announces Acquisition of Comdata for $3.45B,2014-08-12 16:02:00-04:00,FLT,neutral
504082.0,"FleetCor Technologies, Inc. Raises FY2014 EPS Guidance from $4.97-5.07 to $5.04-5.10 vs $5.05 Est; Raises FY2014 Sales Guidance from $1.07B-1.09B to $1.08B-1.10B vs $1.10B Est",2014-07-31 16:14:00-04:00,FLT,neutral
504083.0,"FleetCor Technologies, Inc. Reports Q2 EPS of $1.27 vs $1.25 Est; Revenue of $273.50M vs $273.70M Est",2014-07-31 16:13:00-04:00,FLT,neutral
504084.0,"Piper Jaffray Initiated Auto, Truck, Motorcycle Parts Group",2014-07-16 19:12:00-04:00,FLT,neutral
504085.0,FleetCor Awarded Private Label Commercial Card Program Contract with Kwik Trip,2014-06-18 16:01:00-04:00,FLT,positive
504086.0,Summit Partners Announces JV with FleetCor for Purchase of Masternaut Group,2014-06-04 08:35:00-04:00,FLT,neutral
504087.0,Morgan Stanley Sees Streak Of Beat And Raise Continue For FleetCor Technologies,2014-05-02 10:02:00-04:00,FLT,neutral
504088.0,"FleetCor Technologies, Inc. Sees FY2014 EPS $4.97-5.07 vs $4.97 Est; Sees Sales $1.08B-1.09B vs $1.09B Est",2014-05-01 16:16:00-04:00,FLT,neutral
504089.0,"FleetCor Technologies, Inc. Reports Q1 EPS of $1.12 vs $1.07 Est; Revenue of $253.90M vs $242.61M Est",2014-05-01 16:15:00-04:00,FLT,neutral
504090.0,"Jefferies Initiates Coverage on FleetCor Technologies, Inc. at Buy, Announces $138.00 PT",2014-02-21 07:09:00-05:00,FLT,neutral
504091.0,Morgan Stanley Sees Significant Upside Potential for FleetCor Technologies,2014-02-06 09:29:00-05:00,FLT,positive
504092.0,"FleetCor Technologies, Inc. Sees FY2014 EPS $4.90-5.00 vs $4.91 Est; Sees Sales $1.07B-1.09B vs $1.10B Est",2014-02-05 16:58:00-05:00,FLT,neutral
504093.0,"FleetCor Technologies, Inc. Reports Q4 EPS of $1.08 vs $1.06 Est; Revenue of $255.50M vs $240.20M Est",2014-02-05 16:02:00-05:00,FLT,neutral
504094.0,"Option Alert: Fleetcor Feb $110 Call; 1,750 Contract Trade Between Bid and Ask @$2.70; Currently $106.40",2014-01-22 09:39:00-05:00,FLT,positive
504095.0,"FleetCor Acquires NexTraq, A Leading Telematics Provider ",2013-10-30 16:53:00-04:00,FLT,neutral
504096.0,"FleetCor Acquires Epyx, A Leading Provider to the Fleet Maintenance Marketplace ",2013-10-30 16:52:00-04:00,FLT,neutral
504097.0,"FleetCor Technologies, Inc. Sees FY2013 EPS $4.01-4.03 vs $3.92 Est; Sees Sales $875.0M-880.0M vs $866.48M Est",2013-10-30 16:24:00-04:00,FLT,neutral
504098.0,"FleetCor Technologies, Inc. Reports Q3 EPS of $1.08 vs $0.98 Est; Revenue of $225.20M vs $217.58M Est",2013-10-30 16:23:00-04:00,FLT,neutral
504099.0,FleetCor Awarded Quarles Private Label Fuel Card Contract ,2013-09-18 16:03:00-04:00,FLT,positive
504100.0,FleetCor Announces Secondary Offering of 2.75M by Selling Holders,2013-09-10 16:34:00-04:00,FLT,neutral
504101.0,FleetCor Announces Acquisitions in Brazil ,2013-09-10 16:17:00-04:00,FLT,neutral
504102.0,"Barclays Upgrades FleetCor Technologies, Inc. to Overweight, Raises PT to $115.00",2013-08-02 08:07:00-04:00,FLT,negative
504103.0,Sporadic Trading In FleetCor Technologies Following Q2 Earnings,2013-08-01 17:55:00-04:00,FLT,neutral
504104.0,FleetCor Signs Partnership Agreement with Visa Europe ,2013-07-25 16:01:00-04:00,FLT,positive
504105.0,FleetCor Awarded Canadian Commercial Fleet Card Contract ,2013-07-23 16:04:00-04:00,FLT,positive
504106.0,UPDATE: Morgan Stanley Initiates FleetCor Technologies at Equal-Weight on Balanced Risk/Reward,2013-06-19 08:43:00-04:00,FLT,neutral
504107.0,"Morgan Stanley Initiates Coverage on FleetCor Technologies, Inc. at Equal-weight",2013-06-18 16:43:00-04:00,FLT,neutral
504108.0,Summary of 13F from Tiger Global,2013-05-16 07:19:00-04:00,FLT,neutral
504109.0,"Mid-Morning Market Update: Markets Surge On Jobs Data, Dow Breaks 15,000 for the First Time in History",2013-05-03 10:32:00-04:00,FLT,neutral
504110.0,"FleetCor Technologies, Inc. Sees FY2013 Sales $810.0M-820.0M vs $812.60M Est",2013-05-02 16:42:00-04:00,FLT,neutral
504111.0,"FleetCor Technologies, Inc. Reports Q1 EPS of $0.77 vs $0.83 Est; Revenue of $193.70M vs $182.35M Est",2013-05-02 16:23:00-04:00,FLT,neutral
504112.0,"FleetCor Acquires CardLink, New Zealand-based Fuel Card Business ",2013-04-30 16:02:00-04:00,FLT,neutral
504113.0,FleetCor Announces Acquisition of GE Capital's Fuel Card Business in Australia ,2013-03-26 22:39:00-04:00,FLT,neutral
504114.0,FleetCor to Acquire Mobile Tracking Business ,2013-03-14 08:32:00-04:00,FLT,neutral
504115.0,Fleetcor Reports Secondary Offering of 4.5M Shares for Selling Holders,2013-03-06 16:36:00-05:00,FLT,positive
504116.0,"Mid-Day Market Update: Markets Remain in the Green, Caesar's Gets a Boost",2013-02-08 13:34:00-05:00,FLT,positive
504117.0,"UPDATE: Goldman Sachs Reiterates Neutral Rating, Raises PT on FleetCor Technologies on Q4 Beat",2013-02-08 12:46:00-05:00,FLT,neutral
504118.0,"Compass Point Maintains Neutral on FleetCor Technologies, Inc., Raises PT to $65.00",2013-02-08 07:12:00-05:00,FLT,neutral
504119.0,"Compass Point Maintains Neutral on FleetCor Technologies, Inc., Raises PT to $65.00",2013-02-08 07:12:00-05:00,FLT,neutral
504120.0,"FleetCor Technologies, Inc. Reports Q4 EPS of $0.82 vs $0.75 Est; Revenue of $185.0M",2013-02-07 16:11:00-05:00,FLT,neutral
504121.0,"Option Alert: Fleetcor Technologies Call Volume at 2,653% of Average; Currently $59.68",2013-02-07 14:51:00-05:00,FLT,positive
504122.0,MasterCard Earnings Preview: Strong Fourth Quarter Expected,2013-01-30 13:02:00-05:00,FLT,positive
504123.0,Fleetcor Technologies Spikes Lower,2013-01-23 11:24:00-05:00,FLT,negative
504124.0,"JP Morgan Downgrades FleetCor Technologies, Inc. to Neutral, Raises PT to $(aN)",2013-01-11 10:04:00-05:00,FLT,positive
504125.0,"Citigroup Maintains Buy on FleetCor Technologies, Inc., Raises PT to $65.00",2013-01-10 06:52:00-05:00,FLT,neutral
504126.0,Fertile Market Yields Big Movers -- But Don't Chase,2013-01-07 07:27:00-05:00,FLT,neutral
504127.0,Fleetcor Technologies Spokesperson Says No Company News to Account for Selloff,2012-12-10 16:07:00-05:00,FLT,negative
504128.0,Fleetcor Technologies Spikes Lower,2012-12-10 15:44:00-05:00,FLT,negative
504129.0,"Compass Point Research & Trading Reiterates Neutral Rating, $50 PT on FleetCor Technologies",2012-11-28 09:46:00-05:00,FLT,neutral
504130.0,Fleetcor Adds 4M Shares to Buyback Plan,2012-11-28 08:35:00-05:00,FLT,positive
504131.0,"Compass Point Reiterates FleetCor Technologies, Inc. ",2012-11-28 07:21:00-05:00,FLT,neutral
504132.0,FleetCor Announces Secondary Offering by Selling Stockholders of 4.5M Shares and Repurchase of its Common Stock  ,2012-11-27 16:38:00-05:00,FLT,positive
504133.0,Benzinga's Top Initiations,2012-11-19 07:45:00-05:00,FLT,positive
504134.0,"Barclays Maintains Fleetcor Technologies at Equal-weight, Raises PT from $45 to $48",2012-11-09 14:30:00-05:00,FLT,neutral
504135.0,UPDATE: Citigroup Upgrades FleetCor Technologies to Buy on Execution and Outlook  ,2012-11-09 07:58:00-05:00,FLT,neutral
504136.0,Benzinga's Top Upgrades,2012-11-09 07:00:00-05:00,FLT,positive
504137.0,"Compass Point Maintains Fleetcor Technologies at Neutral, Raises PT from $40 to $50",2012-11-09 06:42:00-05:00,FLT,neutral
504138.0,"Citigroup Upgrades Fleetcor Technologies from Neutral to Buy, Raises PT from $49 to $56",2012-11-09 05:57:00-05:00,FLT,neutral
504139.0,Fleetcor Technologies Reports Q3 EPS $0.83 vs $0.73 Est; Revenues $186.9M vs $176.67M Est,2012-11-08 16:12:00-05:00,FLT,neutral
504140.0,"Barclays Maintains Fleetcor Technologies at Equal-weight, Raises PT from $41 to $45",2012-08-09 14:00:00-04:00,FLT,neutral
504141.0,"Goldman Sachs Maintains Fleetcor Technologies at Neutral, Raises PT from $39 to $43",2012-08-09 10:23:00-04:00,FLT,neutral
504142.0,"Compass Point Maintains Fleetcor Technologies at Neutral, Raises PT from $37 to $40",2012-08-09 08:39:00-04:00,FLT,neutral
504143.0,Fleetcor Technologies Reports Q2 EPS $0.73 vs $0.65 Est; Revenues $154.3M vs $159.40M Est,2012-08-08 17:17:00-04:00,FLT,neutral
504144.0,FleetCor Acquires Fuel Card Company in Russia; Terms Not Disclosed    ,2012-07-11 08:31:00-04:00,FLT,neutral
504145.0,FleetCor Holders Will Sell 6.75M Shares,2012-06-07 16:46:00-04:00,FLT,positive
504146.0,Fleetcor Technologies Reports Q1 EPS $0.6 vs $0.58 Est; Revenues $146.2M vs $142.80M Est,2012-05-09 16:28:00-04:00,FLT,neutral
504147.0,UPDATE: Citi Increases Fleet Card PT's,2012-04-30 09:26:00-04:00,FLT,neutral
