Unnamed: 0,title,date,stock,sentiment
504622.0,Flexsteel Industries Lowers Qtr Dividend From $0.22 to $0.05/Share,2020-06-01 08:09:00-04:00,FLXS,negative
504623.0,Stocks That Hit 52-Week Lows On Thursday,2020-05-14 10:47:00-04:00,FLXS,negative
504624.0,Flexsteel Industries Says On Apr. 28 Announced Will Exit Vehicle Seating And Hospitality Product Lines,2020-05-01 15:31:00-04:00,FLXS,neutral
504625.0,Stocks That Hit 52-Week Lows On Wednesday,2020-04-15 11:46:00-04:00,FLXS,negative
504626.0,Flexsteel Industries Announces Temporary Lay Off Of Employees Aligned With Business Requirements And Location Shutdowns,2020-04-13 08:11:00-04:00,FLXS,neutral
504627.0,"Derek P. Schmidt Joins Flexsteel Industries, Inc As Chief Financial Officer And Chief Operating Officer",2020-03-18 08:14:00-04:00,FLXS,neutral
504628.0,Stocks That Hit 52-Week Lows On Tuesday,2020-03-10 10:37:00-04:00,FLXS,negative
504629.0,Stocks That Hit 52-Week Lows On Friday,2020-03-06 11:22:00-05:00,FLXS,negative
504630.0,7 Furnishings Fixtures & Appliances Stocks Moving In Tuesday's Session,2020-01-28 12:39:00-05:00,FLXS,neutral
504631.0,"Flexsteel Industries Q2 Adj. EPS $(0.19) Down From $0.27 YoY, Sales $102.9M Down From $118.352M YoY",2020-01-27 16:06:00-05:00,FLXS,neutral
504632.0,Flexsteel Industries Q1 Sales $100.348M Down From $113.487M YoY,2019-10-28 16:20:00-04:00,FLXS,neutral
504633.0,Stocks That Hit 52-Week Lows On Tuesday,2019-08-27 11:29:00-04:00,FLXS,negative
504634.0,"Flexsteel Industries Q4 EPS $(2.52) May Not Compare $0.28 YoY, Sales $100.21M Down From $113.093M YoY",2019-08-26 16:07:00-04:00,FLXS,neutral
504635.0,"Earnings Scheduled For August 26, 2019",2019-08-26 04:15:00-04:00,FLXS,neutral
504636.0,Stocks That Hit 52-Week Lows On Friday,2019-08-23 11:08:00-04:00,FLXS,negative
504637.0,68 Biggest Movers From Friday,2019-06-24 04:25:00-04:00,FLXS,neutral
504638.0,"Flexsteel Industries Reports Restructuring: Will Cut Headcount By ~130 Employees, Incur ~$4M In 1-Time Charges, $9M In Non-Cash Charges For Inventory Impairments",2019-05-15 12:00:00-04:00,FLXS,negative
504639.0,68 Biggest Movers From Yesterday,2019-05-01 06:01:00-04:00,FLXS,neutral
504640.0,50 Stocks Moving In Tuesday's Mid-Day Session,2019-04-30 12:26:00-04:00,FLXS,neutral
504641.0,"Flexsteel Industries Q3 EPS $0.12 Down From $0.72 YoY, Sales $111.542M Down From $126.861M YoY",2019-04-29 16:14:00-04:00,FLXS,neutral
504642.0,50 Biggest Movers From Yesterday,2019-02-06 05:03:00-05:00,FLXS,neutral
504643.0,42 Stocks Moving In Tuesday's Mid-Day Session,2019-02-05 12:35:00-05:00,FLXS,neutral
504644.0,"Flexsteel Industries Q2 EPS $0.20 Down From $0.62 YoY, Sales $118.352M Down From $129.392M YoY",2019-02-04 16:32:00-05:00,FLXS,neutral
504645.0,"Stocks Which Set New 52-Week Low Yesterday, Tues., Dec. 20, 2018",2018-12-20 11:33:00-05:00,FLXS,negative
504646.0,"Stocks That Will Be Trading Ex Dividend Thurs., Dec. 20, 2018",2018-12-19 12:40:00-05:00,FLXS,neutral
504647.0,"Stocks Which Set New 52-Week Low Friday, October 26th",2018-10-29 09:56:00-04:00,FLXS,negative
504648.0,71 Biggest Movers From Friday,2018-10-29 05:33:00-04:00,FLXS,neutral
504649.0,56 Stocks Moving In Friday's Mid-Day Session,2018-10-26 12:49:00-04:00,FLXS,neutral
504650.0,"Flexsteel Industries Late Thursday Reported Q1 EPS $0.29 Down From $0.64 YoY, Sales $113.487M Down From $119.834M YoY",2018-10-26 08:33:00-04:00,FLXS,neutral
504651.0,"Stocks Which Set New 52-Week Low Yesterday, October 23rd",2018-10-24 10:06:00-04:00,FLXS,negative
504652.0,"Stocks Which Set New 52-Week Low Yesterday, October 9th",2018-10-10 11:01:00-04:00,FLXS,negative
504653.0,"Stocks Which Set New 52-Week Low Yesterday, October 2nd",2018-10-03 13:01:00-04:00,FLXS,negative
504654.0,"Stocks Which Set New 52-Week Low Yesterday, September 26th",2018-09-27 09:14:00-04:00,FLXS,negative
504655.0,"Stocks Which Set New 52-Week Low Yesterday, September 24th",2018-09-25 09:16:00-04:00,FLXS,negative
504656.0,"Stocks Which Set New 52-Week Low Yesterday, September 20th",2018-09-21 08:19:00-04:00,FLXS,negative
504657.0,"Stocks Which Set New 52-Week Low Yesterday, September 19th",2018-09-20 11:26:00-04:00,FLXS,negative
504658.0,"Stocks Trading Ex Dividend For Thurs., Sep. 20, 2018",2018-09-20 06:25:00-04:00,FLXS,neutral
504659.0,"Stocks Which Set New 52-Week Low Yesterday, September 12th",2018-09-13 10:19:00-04:00,FLXS,negative
504660.0,"Flexsteel Industries Announces that Karel Czanderna has Retired as President, CEO and Director, effective September 9, 2018.",2018-09-11 04:12:00-04:00,FLXS,positive
504661.0,"Stocks Which Set New 52-Week Low Yesterday, September 6th",2018-09-07 16:49:00-04:00,FLXS,negative
504662.0,"Stocks Which Set New 52-Week Low Friday, August 24th",2018-08-27 09:27:00-04:00,FLXS,negative
504663.0,44 Biggest Movers From Friday,2018-08-27 04:34:00-04:00,FLXS,neutral
504664.0,40 Stocks Moving In Friday's Mid-Day Session,2018-08-24 12:47:00-04:00,FLXS,neutral
504665.0,"Flexsteel Industries Late Thursday Reported Q4 EPS $0.28 Down From $0.76 YoY, Sales $113.093M Down From $117.434M YoY",2018-08-24 08:24:00-04:00,FLXS,neutral
504666.0,"Earnings Scheduled For August 23, 2018",2018-08-23 04:08:00-04:00,FLXS,neutral
504667.0,"Flexsteel Late Thursday Reported Q3 EPS $0.72 Down From $0.96 In same Qtr. Last Year, Sales $126.86M Up From $120.75M YoY",2018-04-27 09:23:00-04:00,FLXS,neutral
504668.0,"Flexsteel Industries Shares Unch Following Q2 Earnings Late Thurs.: EPS GAAP EPS $0.78 vs $0.68 In Same Qtr. Last Year, Sales $129.4M",2018-01-26 08:44:00-05:00,FLXS,positive
504669.0,Flexsteel Reports Planned CFO Retirement; Marcus Hamilton Named Replacement,2018-01-03 17:45:00-05:00,FLXS,neutral
504670.0,"Flexsteel Reports Q1 Adj. EPS $0.64, Sales $119.8M vs $112.1M In Same Qtr. Last Year",2017-10-19 18:42:00-04:00,FLXS,neutral
504671.0,Flexsteel Raises Qtr. Dividend From $0.20 To $0.22/Share,2017-09-12 11:23:00-04:00,FLXS,neutral
504672.0,Flexsteel Reports Tentative Agreements for Dubuque Manufacturing,2017-05-12 16:00:00-04:00,FLXS,positive
504673.0,"Flexsteel Reports Q3 EPS $0.96 vs $0.89 in Same Qtr. Last Year, Sales $120.75M vs $125.4M YoY",2017-04-20 18:16:00-04:00,FLXS,neutral
504674.0,"10 Notable Stocks Trading Ex-Dividend Wednesday, December 14",2016-12-13 11:12:00-05:00,FLXS,neutral
504675.0,"Furniture Stocks Trading Up: La-Z-Boy 5%, Stanley Furniture 4%, Flexsteel 2%, Nova Lifestyle 1.5%",2016-12-02 12:12:00-05:00,FLXS,neutral
504676.0,18 Biggest Mid-Day Losers For Thursday,2016-10-20 13:07:00-04:00,FLXS,negative
504677.0,"Flexsteel to Retire Aging Dubuque Manufacturing Facility, Company to Invest $25M In North American Manufacturing Infrastructure",2016-09-21 11:30:00-04:00,FLXS,neutral
504678.0,"10 Notable Stocks Trading Ex-Dividend Wednesday, September 21",2016-09-20 11:57:00-04:00,FLXS,neutral
504679.0,Flexsteel Industries Raises Qtr. Dividend from $0.18 to $0.20/Share,2016-09-13 13:12:00-04:00,FLXS,neutral
504680.0,"Chairman Westphal Buys 5,900 Shares of Flex Pharma @$12.25/Share -Form 4",2016-06-09 12:31:00-04:00,FLXS,positive
504681.0,Mid-Afternoon Market Update: Dow Rises 0.5%; Argos Therapeutics Shares Drop,2016-04-20 15:34:00-04:00,FLXS,neutral
504682.0,Mid-Afternoon Market Update: Dow Up 0.5%; Argos Therapeutics Shares Drop,2016-04-20 15:33:00-04:00,FLXS,neutral
504683.0,Mid-Day Market Update: VMware Surges On Earnings Beat; Flexsteel Shares Tumble,2016-04-20 12:35:00-04:00,FLXS,positive
504684.0,Mid-Morning Market Update: Markets Mostly Flat; Coca-Cola Earnings Top Expectations,2016-04-20 10:04:00-04:00,FLXS,positive
504686.0,Top 4 Small-Cap Stocks In The Home Furnishings & Fixtures Industry With The Highest ROI,2015-09-29 05:34:00-04:00,FLXS,positive
504687.0,"Singular Research Reiterates Buy, $42.50 Price Target on Shares of Flexsteel Industries",2015-09-10 14:49:00-04:00,FLXS,positive
504688.0,Mid-Afternoon Market Update: Dot Hill Jumps On Acquisition News; Canadian Solar Shares Decline,2015-08-19 15:05:00-04:00,FLXS,positive
504689.0,"Mid-Day Market Update: Wednesday's Movers, Fed Releasing Minutes And More",2015-08-19 13:01:00-04:00,FLXS,neutral
504690.0,Morning Market Losers,2015-08-19 09:52:00-04:00,FLXS,negative
504691.0,Flexsteel Increases Dividend To $0.18 From $0.15,2014-09-09 16:53:00-04:00,FLXS,neutral
504692.0,Top 4 Stocks In The Home Furnishings & Fixtures Industry With The Highest Dividend Yield,2014-05-29 05:46:00-04:00,FLXS,positive
504693.0,Flexsteel Industries Reports Q3 EPS of $0.58 vs $0.50 Est; Revenue of $110.50M vs $108.20M Est,2014-04-16 18:47:00-04:00,FLXS,neutral
504694.0,"Flexsteel Industries, Inc. Reports Q2 EPS of $0.60 vs $0.47 Est; Revenue of $112.50M vs $108.19M Est",2014-02-05 18:26:00-05:00,FLXS,neutral
504695.0,"Flexsteel Industries, Inc. Reports Q1 EPS of $0.51; Revenue of $104.30M",2013-10-15 18:15:00-04:00,FLXS,neutral
504696.0,Top 4 Stocks In The Home Furnishings & Fixtures Industry With The Highest Dividend Yield,2013-03-25 04:32:00-04:00,FLXS,positive
504697.0,Flexsteel Appoints Karel K. Czanderna President and CEO   ,2012-07-02 09:28:00-04:00,FLXS,neutral
504698.0,Flexsteel Increases Dividend to $0.15 from $0.10,2012-06-05 12:00:00-04:00,FLXS,neutral
504699.0,Flexsteel Reports Q3 EPS $0.48 vs $0.45 Prior Year,2012-04-17 16:52:00-04:00,FLXS,neutral
504700.0,"Flexsteel Industries Announces R. J. Klosterman, President & CEO to Retire",2011-09-30 08:45:00-04:00,FLXS,neutral
504701.0,Flexsteel Announces 33% Dividend Increase to $0.10,2011-09-12 17:32:00-04:00,FLXS,positive
504702.0,Leggett Misses but Outlook Bright - Analyst Blog,2011-02-02 11:15:00-05:00,FLXS,positive
504703.0,Flexsteel Announces Dividend of 7.5 Cents,2010-12-07 11:47:00-05:00,FLXS,neutral
504704.0,Flexsteel Industries Reports Huge EPS Beat (FLXS),2010-08-18 17:56:00-04:00,FLXS,positive
