Unnamed: 0,title,date,stock,sentiment
506457.0,"Needham Maintains Buy on Fabrinet, Raises Price Target to $81",2020-06-08 06:27:00-04:00,FN,neutral
506458.0,"JP Morgan Maintains Neutral on Fabrinet, Lowers Price Target to $64",2020-05-05 09:50:00-04:00,FN,positive
506459.0,"B. Riley FBR Maintains Neutral on Fabrinet, Lowers Price Target to $59",2020-05-05 07:48:00-04:00,FN,negative
506460.0,"Fabrinet Sees Q3 Adj. EPS $0.80-$0.92 vs $1.00 Est., Sales $370M-$400M vs $429.29M Est.",2020-05-04 16:16:00-04:00,FN,neutral
506461.0,"Fabrinet Q3 Adj. EPS $0.920 Misses $0.930 Estimate, Sales $411.200M Miss $414.090M Estimate",2020-05-04 16:15:00-04:00,FN,negative
506462.0,"Earnings Scheduled For May 4, 2020",2020-05-04 04:07:00-04:00,FN,neutral
506463.0,68 Biggest Movers From Yesterday,2020-02-05 05:56:00-05:00,FN,neutral
506464.0,55 Stocks Moving In Tuesday's Mid-Day Session,2020-02-04 12:35:00-05:00,FN,neutral
506465.0,Stocks That Hit 52-Week Highs On Tuesday,2020-02-04 10:18:00-05:00,FN,neutral
506466.0,"B. Riley FBR Maintains Neutral on Fabrinet, Raises Price Target to $60",2020-02-04 09:10:00-05:00,FN,neutral
506467.0,"Fabrinet Sees Q3 Adj. EPS $0.92-$0.95 vs $0.95 Est., Sales $410M-$418M vs $414.21M Est.",2020-02-03 16:16:00-05:00,FN,neutral
506468.0,"Fabrinet Q2 Adj. EPS $1 Beats $0.93 Estimate, Sales $426.2M Beat $413.21M Estimate",2020-02-03 16:15:00-05:00,FN,neutral
506469.0,"Earnings Scheduled For February 3, 2020",2020-02-03 04:28:00-05:00,FN,neutral
506470.0,Stocks That Hit 52-Week Highs On Wednesday,2020-01-22 10:17:00-05:00,FN,neutral
506471.0,Stocks That Hit 52-Week Highs On Thursday,2020-01-09 15:15:00-05:00,FN,neutral
506472.0,Stocks That Hit 52-Week Highs On Monday,2019-12-16 10:16:00-05:00,FN,neutral
506473.0,Stocks That Hit 52-Week Highs On Friday,2019-12-13 11:19:00-05:00,FN,neutral
506474.0,Stocks That Hit 52-Week Highs On Thursday,2019-12-12 10:21:00-05:00,FN,neutral
506475.0,"Fabrinet Sees Q2 Adj. EPS $0.91-$0.94 vs $0.91 Estimate, Sales $408M-$416M vs $403.9M Est.",2019-11-04 16:23:00-05:00,FN,neutral
506476.0,"Fabrinet Q1 EPS $0.86 Beats $0.82 Estimate, Sales $399.3M Beat $390.3M Estimate",2019-11-04 16:22:00-05:00,FN,neutral
506477.0,"Northland Upgrades Fabrinet to Outperform, Raises Price Target to $57",2019-09-30 11:01:00-04:00,FN,neutral
506478.0,55 Biggest Movers From Yesterday,2019-08-21 05:07:00-04:00,FN,neutral
506479.0,Mid-Afternoon Market Update: Dow Falls 100 Points; Fabrinet Shares Plunge On Weak Forecast,2019-08-20 14:57:00-04:00,FN,negative
506480.0,44 Stocks Moving In Tuesday's Mid-Day Session,2019-08-20 12:21:00-04:00,FN,neutral
506481.0,"Stifel Nicolaus Maintains Buy on Fabrinet, Lowers Price Target to $60",2019-08-20 09:03:00-04:00,FN,negative
506482.0,Fabrinet shares are trading lower after the company issued Q1 EPS and sales guidance below analyst estimates.,2019-08-20 08:51:00-04:00,FN,neutral
506483.0,11 Technology Stocks Moving In Tuesday's Pre-Market Session,2019-08-20 08:39:00-04:00,FN,neutral
506484.0,32 Stocks Moving in Tuesday's Pre-Market Session,2019-08-20 07:49:00-04:00,FN,neutral
506485.0,A Peek Into The Markets: US Stock Futures Flat Ahead Of Retail Earnings,2019-08-20 07:04:00-04:00,FN,neutral
506486.0,"8 Stocks To Watch For August 20, 2019",2019-08-20 05:03:00-04:00,FN,neutral
506487.0,Fabrinet shares are trading lower after the company issued Q1 EPS and sales guidance below analyst estimates.,2019-08-19 16:28:00-04:00,FN,neutral
506488.0,"Fabrinet Sees Q1 Adj. EPS $0.80-$0.84 vs $0.96 Est., Sales $386M-$394M vs $407.32M Est.",2019-08-19 16:26:00-04:00,FN,neutral
506489.0,"Fabrinet Q4 Adj. EPS $1 Beats $0.94 Estimate, Sales $405.1M Beat $399.68M Estimate",2019-08-19 16:25:00-04:00,FN,neutral
506490.0,Q4 Earnings Preview For Fabrinet,2019-08-19 07:26:00-04:00,FN,neutral
506491.0,"5 Stocks To Watch For August 19, 2019",2019-08-19 04:38:00-04:00,FN,neutral
506492.0,"Earnings Scheduled For August 19, 2019",2019-08-19 04:05:00-04:00,FN,neutral
506493.0,"Shares of several technology companies are trading lower after the spread between the 2-year and 10-year yield curve inverted for the first time since 2007, potentially signaling an oncoming recession.",2019-08-14 09:21:00-04:00,FN,negative
506494.0,"Shares of several technology companies are trading higher after the U.S. Trade Representative reported that some tariffs will be delayed to Dec 15 on some products including cell phones, monitors, and laptops.",2019-08-13 10:18:00-04:00,FN,positive
506495.0,"Benzinga's Top Upgrades, Downgrades For July 29, 2019",2019-07-29 09:55:00-04:00,FN,positive
506496.0,"JP Morgan Initiates Coverage On Fabrinet with Neutral Rating, Announces $57 Price Target",2019-07-29 07:14:00-04:00,FN,positive
506497.0,"Needham Lowers Fabrinet's Price Target, Cites Loss Of Huawei Sales",2019-05-28 15:38:00-04:00,FN,negative
506498.0,"Needham Maintains Buy on Fabrinet, Lowers Price Target to $62 Price Target",2019-05-28 10:19:00-04:00,FN,negative
506499.0,60 Biggest Movers From Friday,2019-05-20 05:06:00-04:00,FN,neutral
506500.0,"Needham Maintains Buy on Fabrinet Ordinary Shares, Raises Price Target to $70",2019-05-07 11:31:00-04:00,FN,positive
506501.0,"Fabrinet Sees Q4 Adj. EPS $0.92-$0.96 vs $0.93 Est., Sales $396M-$404M vs $399.26M Est.",2019-05-06 16:18:00-04:00,FN,neutral
506502.0,"Fabrinet Q3 Adj. EPS $0.92 Beats $0.89 Estimate, Sales $398.95M Beat $389.6M Estimate",2019-05-06 16:17:00-04:00,FN,neutral
506503.0,"Needham Maintains Buy on Fabrinet Ordinary Shares, Raises Price Target to $68",2019-05-06 10:57:00-04:00,FN,positive
506504.0,Shares of several multinational companies are trading lower following a tweet from President Trump which hinted at additional tariffs on China and China indicated it may back out of upcoming trade negotiations.,2019-05-06 09:17:00-04:00,FN,neutral
506505.0,"Earnings Scheduled For May 6, 2019",2019-05-06 04:39:00-04:00,FN,neutral
506506.0,50 Biggest Movers From Yesterday,2019-02-06 05:03:00-05:00,FN,neutral
506507.0,"Fabrinet Sees Q3 Adj. EPS $0.86-$0.90, Sales $384M-$392M",2019-02-04 16:28:00-05:00,FN,neutral
506508.0,"Fabrinet Q2 EPS $0.97 Beats $0.92 Estimate, Sales $403.1M Beat $385.76M Estimate",2019-02-04 16:28:00-05:00,FN,neutral
506509.0,Q2 Earnings Preview For Fabrinet,2019-02-04 07:33:00-05:00,FN,neutral
506510.0,"Earnings Scheduled For February 4, 2019",2019-02-04 04:02:00-05:00,FN,neutral
506511.0,"Stocks Which Set New 52-Week High Fri., Jan. 11, 2019",2019-01-14 09:47:00-05:00,FN,neutral
506512.0,"Stocks Which Set New 52-Week High Yesterday, Thurs., Jan. 10, 2019",2019-01-11 13:04:00-05:00,FN,neutral
506513.0,William O'Neil & Co Initiates Coverage On Fabrinet with Buy Rating,2018-11-09 09:09:00-05:00,FN,neutral
506514.0,75 Biggest Movers From Yesterday,2018-11-07 04:00:00-05:00,FN,neutral
506515.0,60 Stocks Moving In Tuesday's Mid-Day Session,2018-11-06 12:36:00-05:00,FN,neutral
506516.0,Shares of Fabrinet are trading up 10.5% after the company announced it beat Q3 EPS estimates and issued Q2 guidance above analyst estimates.,2018-11-06 11:57:00-05:00,FN,positive
506517.0,24 Stocks Moving In Tuesday's Pre-Market Session,2018-11-06 08:07:00-05:00,FN,neutral
506518.0,"Fabrinet Sees Q2 Adj. EPS $0.91-$0.94 vs $0.84 Est., Sales 380M-$388M vs $366.07M Est.",2018-11-05 16:20:00-05:00,FN,neutral
506519.0,"Fabrinet Q1 Adj. EPS $0.92 Beats $0.81 Estimate, Sales $377.2M Beat $352.28M Estimate",2018-11-05 16:19:00-05:00,FN,neutral
506520.0,"Earnings Scheduled For November 5, 2018",2018-11-05 04:03:00-05:00,FN,neutral
506521.0,"B. Riley Downgrades Fabrinet, II-VI, Says Optical Companies 'Will Suffer The Consequences' Of Tariffs",2018-09-04 15:20:00-04:00,FN,negative
506522.0,B. Riley FBR Downgrades Fabrinet to Neutral,2018-09-04 08:36:00-04:00,FN,neutral
506523.0,"Stocks Which Set New 52-Week High Yesterday, August 23rd",2018-08-24 09:11:00-04:00,FN,neutral
506524.0,"Stocks Which Set New 52-Week High Yesterday, August 22nd",2018-08-23 10:51:00-04:00,FN,neutral
506525.0,"Stocks Which Set New 52-Week High Yesterday, August 21st",2018-08-22 09:06:00-04:00,FN,neutral
506526.0,50 Biggest Movers From Yesterday,2018-08-22 04:33:00-04:00,FN,neutral
506527.0,"Stocks Which Set New 52-Week High Tues., Aug. 21, 2018",2018-08-21 14:50:00-04:00,FN,neutral
506528.0,38 Stocks Moving In Tuesday's Mid-Day Session,2018-08-21 12:38:00-04:00,FN,neutral
506529.0,10 Biggest Price Target Changes For Tuesday,2018-08-21 09:41:00-04:00,FN,neutral
506530.0,Fabrinet shares are trading 7.4% higher premarket to $47.25 after the company announce better-than-expected Q4 financial results and issued positive guidance for Q1 2019.,2018-08-21 09:26:00-04:00,FN,positive
506531.0,"Benzinga's Top Upgrades, Downgrades For August 21, 2018",2018-08-21 09:26:00-04:00,FN,positive
506532.0,25 Stocks Moving In Tuesday's Pre-Market Session,2018-08-21 08:02:00-04:00,FN,neutral
506533.0,"Needham Downgrades Fabrinet to Buy, Raises Price Target to $55",2018-08-21 07:42:00-04:00,FN,neutral
506534.0,A Peek Into The Markets: US Stock Futures Up; Crude Oil Gains,2018-08-21 07:25:00-04:00,FN,negative
506535.0,"10 Stocks To Watch For August 21, 2018",2018-08-21 05:01:00-04:00,FN,neutral
506536.0,Fabrinet shares up 6.8% in after-hours trading following Q4 earnings beat and strong Q1 guidance.,2018-08-20 16:47:00-04:00,FN,positive
506537.0,"Fabrinet Sees Q1 Sales $347-$355M vs $348M Est., EPS $0.80-$0.83 vs $0.79 Est.",2018-08-20 16:16:00-04:00,FN,neutral
506538.0,"Fabrinet Q4 EPS $0.81 Beats $0.75 Estimate, Sales $345.3M Beat $338.12M Estimate",2018-08-20 16:15:00-04:00,FN,neutral
506539.0,"6 Stocks To Watch For August 20, 2018",2018-08-20 04:46:00-04:00,FN,neutral
506540.0,"Earnings Scheduled For August 20, 2018",2018-08-20 04:27:00-04:00,FN,neutral
506541.0,"Stocks Which Set New 52-Week High Yesterday, August 16th",2018-08-17 10:39:00-04:00,FN,neutral
506542.0,"Stocks Which Set New 52-Week High Yesterday, August 14th",2018-08-15 12:29:00-04:00,FN,neutral
506543.0,Potential Winners And Losers In The Optical Space From The Tariff Dispute,2018-07-18 13:47:00-04:00,FN,negative
506544.0,"Piper Jaffray Out With A Note On Opticals, Says They Are Incrementally More Upbeat On The Sector And Believe Investors Need To Revisit The Group; Says Their Favorite Names Are Fabrinet, Lumentum And II-VI",2018-07-18 12:36:00-04:00,FN,positive
506545.0,"B. Riley Says That While Tariffs Will Have A Negative Effect On The Optical Industry As A Whole, But Believes This Could Be A Beneficiary To Fabrinet, As Well As Finisar And Oclaro, As Optical Co.'s May Seek Out Non-Chinese Contract Manufacturer",2018-07-18 09:46:00-04:00,FN,positive
506546.0,"Fabrinet 8-K Shows Executive Chairman Of Board, David Mitchell, Notified His Intention To Resign From All Officer And Employee Positions With Co., Intends To Transition To Non-Employee Chairman Of Board",2018-06-20 16:30:00-04:00,FN,negative
506547.0,"'Kudlow was just asked about ZTE deal. ""No decision has been reached on both sides""'-CNBC Reporter Sally Shin Tweets",2018-06-06 13:15:00-04:00,FN,negative
506548.0,"Optical Stocks Continue Higher Wednesday Premarket On Tuesday's News ZTE Has Reached Deal With U.S. To Lift Commerce Department Ban; FNSR +1.4%, ACIA +2.6%, OCLR +3.1%, LITE +2.1%, FN +1.3%; BZ NOTE: Commerce Dept. Emphasizes No Final Agreement Has Been Signed",2018-06-06 08:51:00-04:00,FN,neutral
506549.0,UPDATE: ZTE Deal With US Dept. Of Commerce Includes Unfettered Site Visits To Verify US Components Are Being Used As Claimed,2018-06-05 16:01:00-04:00,FN,neutral
506550.0,Watching Optical Stocks Related To Report ZTE Has Signed Agreement With US Dept. Of Commerce To Lift Ban,2018-06-05 15:59:00-04:00,FN,negative
506551.0,UPDATE: US Will Claim Penalty Of As Much As $1.7B Against ZTE,2018-06-05 15:58:00-04:00,FN,negative
506552.0,ZTE Has Signed Deal With US To Lift Dept. Of Commerce Ban,2018-06-05 15:57:00-04:00,FN,negative
506553.0,Form 4 Filing Late Friday Showed Fabrinet CFO Sold 27.188K Shares at $36.91,2018-05-29 10:04:00-04:00,FN,positive
506554.0,Form 4 Filing Late Friday Showed Fabrinet COO Harpal Gill Sold 40.044K Shares at $37.04,2018-05-29 10:03:00-04:00,FN,positive
506555.0,Trump Says No ZTE Deal with China,2018-05-22 12:17:00-04:00,FN,negative
506556.0,FBI Director Says He Remains Concerned About Any Involvement By ZTE In US Telecom Market,2018-05-16 15:07:00-04:00,FN,neutral
506557.0,"Optical Stocks Fail To React Following Report US, China Are Discussing A Deal Related To ZTE",2018-05-14 12:06:00-04:00,FN,negative
506558.0,Watch Optical Stocks Following Trump Tweet He's Working With Chinese Pres Xi To Aid ZTE In Recovering,2018-05-13 12:34:00-04:00,FN,neutral
506559.0,Fabrinet Shares Up 10.2% After Hours Following Q3 Sales Beat And In-Line EPS; Co. Issued In-Line To Upbeat Q4 Sales Guidance,2018-05-07 17:42:00-04:00,FN,positive
506560.0,"Fabrinet Sees Q4 Adj. EPS $0.73-$0.77 vs $0.76 Est., Sales $334M-$342M vs $334.47M Est.",2018-05-07 16:57:00-04:00,FN,neutral
506561.0,"Fabrinet Q3 EPS $0.71, Inline, Sales $332.213M Beat $319.17M Estimate",2018-05-07 16:55:00-04:00,FN,neutral
506562.0,Fabrinet Q3 Earnings Outlook,2018-05-07 07:45:00-04:00,FN,neutral
506563.0,"Earnings Scheduled For May 7, 2018",2018-05-07 04:23:00-04:00,FN,neutral
506564.0,'China Asks U.S. to Amend ZTE Business Ban-Sources',2018-05-04 08:50:00-04:00,FN,neutral
506565.0,38 Biggest Movers From Yesterday,2018-04-17 04:46:00-04:00,FN,neutral
506566.0,Fabrinet Says 'ZTE Is Not A Direct Fabrinet Customer',2018-04-16 12:57:00-04:00,FN,neutral
506567.0,31 Stocks Moving In Monday's Mid-Day Session,2018-04-16 12:19:00-04:00,FN,neutral
506568.0,"Lumentum Shares Down 7.5%, Acacia Communications Down 21.8%; Hearing Dept. Of Commerce To Ban Sales To ZTE",2018-04-16 09:11:00-04:00,FN,negative
506569.0,Form 4 Filing Late Friday Shows Fabrinet Exec. Chairman Mitchell Sold Total of 32.021K Shares at Avg. Price $29.30,2018-02-20 11:37:00-05:00,FN,positive
506570.0,40 Biggest Movers From Yesterday,2018-02-07 05:09:00-05:00,FN,neutral
506571.0,Fabrinet Shares Down 22.2% After Monday Reporting A Q2 Beat,2018-02-06 12:40:00-05:00,FN,positive
506572.0,30 Stocks Moving In Tuesday's Mid-Day Session,2018-02-06 12:06:00-05:00,FN,neutral
506573.0,"Fabrinet Shares Up 25.8% Tues. Morning; Co. Reported Late Mon. Q2 Adj. EPS $0.72 vs $0.70 Est., Sales $337.1M vs $330M Est.",2018-02-06 11:25:00-05:00,FN,positive
506574.0,Mid-Morning Market Update: Market Open Higher; General Motors Profit Tops Estimates,2018-02-06 10:24:00-05:00,FN,positive
506575.0,20 Stocks Moving In Tuesday's Pre-Market Session,2018-02-06 08:03:00-05:00,FN,neutral
506576.0,"Earnings Scheduled For February 5, 2018",2018-02-05 04:28:00-05:00,FN,neutral
506577.0,"Optical Stocks Performing Strongly Thurs., Over Last 2 Hours: Acacia Shares Up 5%, Oclaro Up 3.8%, Sanmina Up 2.9%, Ciena Up 2.7%, Applied Optoelectronics Up 2.4%, II-VI Up 2.2%, Lumentum Up 1.5%, Fabrinet Up 1.2%, Viavi Solutions Up 0.9%, IPG Up 0.7%",2018-02-01 13:34:00-05:00,FN,positive
506578.0,Zack's Bear Of The Day: Fabrinet,2017-11-20 12:18:00-05:00,FN,neutral
506579.0,56 Biggest Movers From Yesterday,2017-11-08 04:40:00-05:00,FN,neutral
506580.0,45 Stocks Moving In Tuesday's Mid-Day Session,2017-11-07 12:41:00-05:00,FN,neutral
506581.0,"Benzinga's Top Upgrades, Downgrades For November 7, 2017",2017-11-07 09:16:00-05:00,FN,positive
506582.0,40 Stocks Moving In Tuesday's Pre-Market Session,2017-11-07 08:07:00-05:00,FN,neutral
506583.0,JP Morgan Downgrades Fabrinet to Neutral,2017-11-07 07:56:00-05:00,FN,positive
506584.0,12 Stocks Moving In Monday's After-Hours Session,2017-11-06 17:03:00-05:00,FN,neutral
506585.0,"Fabrinet Sees Q2 Adj. EPS $0.69-$0.71 vs $0.85 Est., Sales $328M-$332M vs $373.93M Est.",2017-11-06 16:19:00-05:00,FN,neutral
506586.0,"Fabrinet Reports Q1 Adj. EPS $0.75 vs $0.80 Est., Sales $357.3M vs $358.62M Est.",2017-11-06 16:19:00-05:00,FN,neutral
506587.0,"Earnings Scheduled For November 6, 2017",2017-11-06 04:47:00-05:00,FN,neutral
506588.0,Fabrinet Names Seamus Grady CEO,2017-09-25 16:15:00-04:00,FN,neutral
506589.0,"Fabrinet COO Gill Sells 50,000 @ Avg Price: $39.07 -Form 4",2017-08-31 04:36:00-04:00,FN,neutral
506590.0,15 Biggest Mid-Day Losers For Tuesday,2017-08-22 12:52:00-04:00,FN,negative
506591.0,5 Biggest Price Target Changes For Tuesday,2017-08-22 10:10:00-04:00,FN,neutral
506592.0,A Peek Into The Markets: U.S. Stock Futures Signal Higher Start On Wall Street,2017-08-22 07:06:00-04:00,FN,neutral
506593.0,"10 Stocks To Watch For August 22, 2017",2017-08-22 04:58:00-04:00,FN,neutral
506594.0,Fabrinet Announces $30M Buyback With Repurchased Shares Being Held As Treasury Stock,2017-08-21 16:17:00-04:00,FN,positive
506595.0,"Fabrinet Sees Q1 Sales $356-$360M vs $375M Est., EPS $0.78-$0.80 vs $0.87 Est.",2017-08-21 16:17:00-04:00,FN,neutral
506596.0,"Fabrinet Reports Q4 Adj. EPS $0.86 vs $0.83 Est., Sales $370.5M vs $362M Est.",2017-08-21 16:16:00-04:00,FN,neutral
506597.0,"7 Stocks To Watch For August 21, 2017",2017-08-21 05:10:00-04:00,FN,neutral
506598.0,"Earnings Scheduled For August 21, 2017",2017-08-21 04:28:00-04:00,FN,neutral
506599.0,22 Stocks Moving In Monday's Pre-Market Session,2017-07-10 08:24:00-04:00,FN,neutral
506600.0,Mid-Afternoon Market Update: Dow Surges 100 Points; Cherokee Shares Drop After Q1 Loss,2017-07-07 14:32:00-04:00,FN,negative
506601.0,Mid-Day Market Update: Crude Oil Down Over 3%; Digital Ally Shares Spike Higher,2017-07-07 12:13:00-04:00,FN,negative
506602.0,"Mid-Morning Market Update: Markets Open Higher; U.S. Economy Creates 222,000 Jobs In June",2017-07-07 10:11:00-04:00,FN,positive
506604.0,Watch These 8 Huge Call Purchases In Tuesday Trade,2017-06-27 04:08:00-04:00,FN,positive
506605.0,Benzinga's Option Alert Recap From June 26,2017-06-26 16:18:00-04:00,FN,positive
506606.0,18 Biggest Mid-Day Gainers For Monday,2017-06-26 12:19:00-04:00,FN,neutral
506607.0,Option Alert: Fabrinet Oct 48.0 Calls Sweep: 511 @  Above Ask!  $2.213: 511 traded vs 0 OI:  Earnings 8/14 After Close (est)  $42.39 Ref,2017-06-26 09:56:00-04:00,FN,positive
506608.0,JPMorgan Adds Fabrinet To Focus List After Stock's 30% Decline,2017-06-01 11:57:00-04:00,FN,neutral
506609.0,20 Biggest Mid-Day Gainers For Tuesday,2017-05-09 12:17:00-04:00,FN,neutral
506610.0,25 Stocks Moving In Tuesday's Pre-Market Session,2017-05-09 08:16:00-04:00,FN,neutral
506611.0,Fabrinet Sees FY17 Adj. EPS $0.82-$0.84 vs $0.88 Est.,2017-05-08 16:21:00-04:00,FN,neutral
506612.0,"Fabrinet Reports Q3 Adj. EPS $0.80 vs $0.88 Est., Sales $366.8M vs $362.6M Est.",2017-05-08 16:20:00-04:00,FN,neutral
506613.0,"Earnings Scheduled For May 8, 2017",2017-05-08 04:42:00-04:00,FN,neutral
506614.0,25 Stocks Moving In Friday's Pre-Market Session,2017-02-24 08:25:00-05:00,FN,neutral
506615.0,Fabrinet Sells Off to Low of $46.78 on Volume,2017-02-22 14:35:00-05:00,FN,negative
506616.0,12 Biggest Mid-Day Gainers For Tuesday,2017-02-07 12:37:00-05:00,FN,neutral
506617.0,5 Biggest Price Target Changes For Tuesday,2017-02-07 10:33:00-05:00,FN,neutral
506618.0,20 Stocks Moving In Tuesday's Pre-Market Session,2017-02-07 08:15:00-05:00,FN,neutral
506619.0,"Fabrinet Sees Q3 Rev. $360-$364M vs. Est. $334M, EPS $0.87-$0.89 vs. Est. $0.78",2017-02-06 16:17:00-05:00,FN,neutral
506620.0,"Fabrinet Reports Q2 EPS $0.91 vs. Est. $0.79, Rev. $351.2M vs. Est. $335M",2017-02-06 16:17:00-05:00,FN,neutral
506621.0,"8 Must Watch Stocks for February 6, 2017",2017-02-06 05:05:00-05:00,FN,neutral
506622.0,"Earnings Scheduled For February 6, 2017",2017-02-06 04:36:00-05:00,FN,neutral
506623.0,Needham Upgrades Fabrinet Ordinary Shares To Strong Buy,2017-01-17 09:17:00-05:00,FN,positive
506624.0,15 Biggest Mid-Day Gainers For Tuesday,2016-11-08 13:42:00-05:00,FN,neutral
506625.0,Benzinga's Volume Movers,2016-11-08 10:41:00-05:00,FN,neutral
506626.0,"Fabrinet Sees Q2 Adj. EPS $0.78-$0.80 vs $0.69 Est., Sales $332M-$336M vs $305.4M Est.",2016-11-07 16:19:00-05:00,FN,neutral
506627.0,"Fabrinet Reports Q1 Adj. EPS $0.80 vs $0.71 Est., Sales $332M vs $309.4M Est.",2016-11-07 16:19:00-05:00,FN,neutral
506628.0,"Earnings Scheduled For November 7, 2016",2016-11-07 04:46:00-05:00,FN,neutral
506629.0,20 Biggest Mid-Day Losers For Tuesday,2016-08-16 13:23:00-04:00,FN,negative
506630.0,7 Biggest Price Target Changes For Tuesday,2016-08-16 09:52:00-04:00,FN,neutral
506631.0,20 Stocks Moving In Tuesday's Pre-Market Session,2016-08-16 08:30:00-04:00,FN,neutral
506632.0,A Peek Into The Markets: U.S. Stock Futures Decline Ahead Of Consumer Price Report,2016-08-16 07:48:00-04:00,FN,neutral
506633.0,"Keep an Eye on These 10 Stocks for August 16, 2016",2016-08-16 05:43:00-04:00,FN,neutral
506634.0,"After-Hours Gainers Aug. 15, '16: CAPR Up 16%, BLIN 8.3%, FN 4.3%, VIPS 2.6%, IMMY 2.5%, PNK 2%, MARA 2%",2016-08-15 17:59:00-04:00,FN,neutral
506635.0,"Hain Celestial, VipShop And 3 Other Stocks Moving After Hours",2016-08-15 17:45:00-04:00,FN,neutral
506636.0,"Fabrinet Sees Q1 Rev. $306-$310M vs. Est. $269M, EPS $0.70-$0.72 vs. Est. $0.60",2016-08-15 16:32:00-04:00,FN,neutral
506637.0,"Fabrinet Reported Q4 EPS $0.60 vs. Est. $0.60, Rev. $276.4M vs. Est. $262M",2016-08-15 16:31:00-04:00,FN,neutral
506638.0,"Fabrinet Outperforms Expectations, Issues Strong Q1 2017 Guidance",2016-08-15 16:30:00-04:00,FN,positive
506639.0,Benzinga's Volume Movers,2016-08-15 10:34:00-04:00,FN,neutral
506640.0,"Must Watch Stocks for August 15, 2016",2016-08-15 04:31:00-04:00,FN,neutral
506641.0,"Earnings Scheduled For August 15, 2016",2016-08-15 04:00:00-04:00,FN,neutral
506642.0,Benzinga's Volume Movers,2016-05-03 10:26:00-04:00,FN,neutral
506643.0,Stocks Hitting 52-Week Highs,2016-05-03 10:03:00-04:00,FN,neutral
506644.0,"Fabrinet Sees Q4 2016 EPS $0.59-$0.61 Vs Est $0.55, Sales $260M-$264M Vs Est $249.96M",2016-05-02 16:24:00-04:00,FN,neutral
506645.0,"Fabrinet Reports Q3 EPS $0.56 Vs Est $0.53, Sales $250.9M Vs Est $242.80M",2016-05-02 16:24:00-04:00,FN,neutral
506646.0,"Earnings Scheduled For May 2, 2016",2016-05-02 04:18:00-04:00,FN,neutral
506647.0,"JP Morgan Maintains Overweight on Fabrinet, Raises PT to $33.00, Says 'We think FN will benefit from increasing demand from Telco'",2016-03-31 05:55:00-04:00,FN,positive
506648.0,"Worst Performing Industries For February 17, 2016",2016-02-17 11:43:00-05:00,FN,negative
506649.0,Mid-Day Market Update: Michael Kors Surges On Earnings Beat; Carbylan Therapeutics Shares Slide,2016-02-02 12:20:00-05:00,FN,positive
506650.0,Benzinga's Volume Movers,2016-02-02 10:18:00-05:00,FN,neutral
506651.0,Stocks Hitting 52-Week Highs,2016-02-02 10:04:00-05:00,FN,neutral
506652.0,"Fabrinet Sees Q3 Rev. $240-$244m vs. Est. $216.68M, EPS $0.52-$0.54 vs. Est. $0.45",2016-02-01 16:17:00-05:00,FN,neutral
506653.0,"Fabrinet Reports Q2 EPS $0.50 vs. Est. $0.46, Rev. $233M vs. Est. $220.75M",2016-02-01 16:16:00-05:00,FN,neutral
506654.0,"Earnings Scheduled For February 1, 2016",2016-02-01 04:01:00-05:00,FN,neutral
506655.0,Fabrinet Names Dr. Hong Hou Chief Technology Officer,2016-01-11 16:18:00-05:00,FN,neutral
506656.0,Mid-Afternoon Market Update: Dow Rises 125 Points; RetailMeNot Shares Climb On Earnings Beat,2015-11-03 15:13:00-05:00,FN,positive
506657.0,Stocks Hitting 52-Week Highs,2015-11-03 10:09:00-05:00,FN,neutral
506658.0,Morning Market Gainers,2015-11-03 09:40:00-05:00,FN,neutral
506659.0,"Fabrinet Sees Q2 Rev. $218-$222M vs. Est. $213.07M, EPS $0.45-$0.47 vs. Est. $0.44",2015-11-02 16:16:00-05:00,FN,neutral
506660.0,"Fabrinet Reports Q1 EPS $0.45 vs. Est. $0.42, Rev. $216.4M vs. Est. $208.72M",2015-11-02 16:15:00-05:00,FN,neutral
506661.0,Watch These After-Hours Movers On Tuesday,2015-08-18 07:46:00-04:00,FN,neutral
506662.0,Fabrinet Posts Higher Q4 Profit,2015-08-17 16:55:00-04:00,FN,positive
506663.0,"Fabrinet Sees Q1 Sales $206M-$210M vs $203.5M Est., Adj. EPS $0.41-$0.43 vs $0.42 Est.",2015-08-17 16:16:00-04:00,FN,neutral
506664.0,"Fabrinet Reports Q4 EPS $0.40 vs. Est. $0.39, Rev. $206.5M vs. Est. $197.73M",2015-08-17 16:15:00-04:00,FN,neutral
506665.0,"Earnings Scheduled For August 17, 2015",2015-08-17 04:14:00-04:00,FN,neutral
506666.0,Benzinga's Top Upgrades,2015-07-10 09:02:00-04:00,FN,positive
506667.0,Needham Upgrades Fabrinet to Buy,2015-07-10 06:50:00-04:00,FN,neutral
506668.0,Top 4 Stocks In The Electronic Equipment Industry With The Highest EPS,2015-07-09 04:21:00-04:00,FN,positive
506669.0,Top 4 Small-Cap Stocks In The Electronic Equipment Industry With The Highest EPS,2015-06-10 04:02:00-04:00,FN,positive
506670.0,"Fabrinet Reports Q3 Adj. EPS $0.36 vs $0.35 Est., Sales $189.5M vs $185M Est.; Sees Q4 Adj. EPS $0.37-$0.39 vs $0.37 Est., Sales $195M-$199M vs $188.5M Est.",2015-05-04 16:17:00-04:00,FN,neutral
506671.0,"Earnings Scheduled For May 4, 2015",2015-05-04 04:06:00-04:00,FN,neutral
506672.0,Top 4 Stocks In The Electronic Equipment Industry With The Lowest PEG Ratio,2015-03-10 05:16:00-04:00,FN,negative
506673.0,"Fabrinet Beats Q2 Expectations, Gives Strong Q3 Guidance",2015-02-02 17:00:00-05:00,FN,positive
506674.0,Fabrinet Sees Q3 EPS $0.27 to $0.29,2015-02-02 16:16:00-05:00,FN,neutral
506675.0,Fabrinet Q2 EPS $0.40 vs $0.38. Sales $188.4M,2015-02-02 16:15:00-05:00,FN,neutral
506676.0,"Earnings Scheduled For February 2, 2015",2015-02-02 04:57:00-05:00,FN,neutral
506677.0,Fabrinet Reports Q1 EPS of $0.41 vs $0.40 Est; Revenue of $189.30M vs $188.39M Est,2014-11-03 16:16:00-05:00,FN,neutral
506678.0,"Earnings Scheduled For November 3, 2014",2014-11-03 05:18:00-05:00,FN,neutral
506679.0,Markets Open Higher; GE Profit Beats Estimates,2014-10-17 10:56:00-04:00,FN,positive
506680.0,Morning Market Movers ,2014-10-17 09:49:00-04:00,FN,neutral
506681.0,"B. Riley Upgrades Fabrinet to Buy, Lowers PT to $20.00",2014-10-17 06:13:00-04:00,FN,negative
506682.0,Fabrinet Sees Q1 EPS $0.40 vs $0.39 Est; Sees Sales $189.0M vs $179.20M Est,2014-10-16 16:23:00-04:00,FN,neutral
506683.0,Fabrinet Reports Q2 EPS of $0.34 vs $0.35 Est,2014-10-16 16:16:00-04:00,FN,neutral
