Unnamed: 0,title,date,stock,sentiment
506684.0,8-K from Farbinet Shows NYSE Sent Noncompliance Notice,2014-10-02 17:07:00-04:00,FN,neutral
506685.0,"Top Performing Industries For September 26, 2014",2014-09-26 10:28:00-04:00,FN,positive
506686.0,Fabrinet Announces Delay In Form 10-K Filing,2014-09-10 16:32:00-04:00,FN,negative
506687.0,"#PreMarket Primer: Friday, September 5: US Labor Market Expected To Show Improvement",2014-09-05 06:54:00-04:00,FN,positive
506688.0,"Earning and Economic Calendar for Friday September 5, 2014",2014-09-05 05:39:00-04:00,FN,neutral
506689.0,"#PreMarket Primer: Tuesday, September 2: Russian Sanctions Hit Eurozone Economy Hard",2014-09-02 07:20:00-04:00,FN,negative
506690.0,Dow Posts Triple-Digit Point Gain; S&P 500 And NASDAQ Also Higher As Global Concerns Calm,2014-08-18 16:59:00-04:00,FN,positive
506691.0,Dow Surges 175 Points; Fabrinet Shares Slide,2014-08-18 13:41:00-04:00,FN,positive
506692.0,Markets Open Higher; Dollar General Offers $9.7 Billon To Buy Family Dollar,2014-08-18 11:25:00-04:00,FN,neutral
506693.0,Morning Market Losers ,2014-08-18 10:02:00-04:00,FN,negative
506694.0,"Fabrinet Reports Audit Committee Probe Into Accounting Matter, Has Postponed Q4 Earnings Release, Conf. Call",2014-08-18 08:30:00-04:00,FN,negative
506695.0,"Earnings Scheduled For August 18, 2014 ",2014-08-18 04:55:00-04:00,FN,neutral
506696.0,"B Riley Downgrades Fabrinet to Neutral, Lowers PT to $21.00",2014-08-14 06:35:00-04:00,FN,negative
506697.0,Mid-After Market Update; Markets Rise As Apple Dominates Headlines,2014-05-29 15:44:00-04:00,FN,positive
506698.0,Mid-Day Market Update: Palo Alto Surges On Upbeat Earnings; Fabrinet Shares Slide,2014-05-29 12:58:00-04:00,FN,positive
506699.0,Mid-Morning Market Update: Markets Gain; Apple To Buy Beats For $3B,2014-05-29 10:20:00-04:00,FN,positive
506700.0,Morning Market Losers ,2014-05-29 09:46:00-04:00,FN,negative
506701.0,Fabrinet Announces Secondary By Selling Shareholder Priced Yesterday In Negotiations,2014-05-29 08:16:00-04:00,FN,neutral
506702.0,Fabrinet Reports Offering of 3.15M Shares by  Selling Holders,2014-05-28 16:33:00-04:00,FN,positive
506703.0,Morning Market Losers,2014-05-06 09:52:00-04:00,FN,negative
506704.0,UPDATE: Deutsche Bank Reiterates On Fabrinet On Roughly In-Line Results,2014-05-06 09:44:00-04:00,FN,neutral
506705.0,"Needham Downgrades Fabrinet to Hold, Removes $23.00 PT",2014-05-06 08:18:00-04:00,FN,neutral
506706.0,Fabrinet Reports Q3 EPS of $0.34; Revenue of $167.70M,2014-05-05 16:16:00-04:00,FN,neutral
506707.0,"Earnings Scheduled For May 5, 2014",2014-05-05 05:46:00-04:00,FN,neutral
506708.0,"Fabrinet, Albany Molecular Research to Join S&P SmallCap 600",2014-03-26 17:19:00-04:00,FN,positive
506709.0,Fabrinet Sees Q3 EPS $0.32-0.34; Sees Sales $162.0M-166.0M,2014-02-03 16:16:00-05:00,FN,neutral
506710.0,Fabrinet Reports Q2 EPS of $0.45; Revenue of $178.60M,2014-02-03 16:15:00-05:00,FN,neutral
506711.0,"Earnings Scheduled For February 3, 2014",2014-02-03 04:23:00-05:00,FN,neutral
506712.0,"B. Riley & Co. Initiates Coverage on Fabrinet at Buy, Announces $24.50 PT",2013-12-18 07:42:00-05:00,FN,neutral
506713.0,UPDATE: Stifel Raises PT on Fabrinet on Expectation of Healthy Optical Trends,2013-12-11 13:34:00-05:00,FN,positive
506714.0,"Stifel Nicolaus Maintains Buy on Fabrinet, Raises PT to $24.00",2013-12-11 08:16:00-05:00,FN,neutral
506715.0,Fabrinet Sees Q2 EPS $0.40-0.42 vs $0.38 Est; Sees Sales $170.0M-174.0M vs $169.20M Est,2013-11-04 16:18:00-05:00,FN,neutral
506716.0,Fabrinet Reports Q1 EPS of $0.40; Revenue of $171.60M,2013-11-04 16:18:00-05:00,FN,neutral
506717.0,Top 4 NYSE Stocks In The Electronic Equipment Industry With The Highest ROA,2013-10-25 05:55:00-04:00,FN,positive
506718.0,Benzinga's Volume Movers,2013-09-26 10:57:00-04:00,FN,neutral
506719.0,UPDATE: Stifel Upgrades Fabrinet on Multiple Positive Factors,2013-09-26 10:23:00-04:00,FN,positive
506720.0,Benzinga's Top Upgrades,2013-09-26 07:48:00-04:00,FN,positive
506721.0,"Stifel Nicolaus Upgrades Fabrinet to Buy, Announces $20.00 PT",2013-09-26 07:46:00-04:00,FN,neutral
506722.0,UPDATE: Deutsche Bank Raises PT on Fabrinet on Limited Upside,2013-08-13 10:06:00-04:00,FN,negative
506723.0,Fabrinet Reports Q4 EPS of $0.35; Revenue of $159.90M,2013-08-12 16:12:00-04:00,FN,neutral
506724.0,Fabrinet Sees Q1 EPS $0.31-0.33; Sees Sales $158.0M-162.0M vs $159.50M Est,2013-08-12 16:11:00-04:00,FN,neutral
506725.0,"Earnings Scheduled For August 12, 2013",2013-08-12 04:54:00-04:00,FN,neutral
506726.0,Top 4 NYSE Stocks In The Electronic Equipment Industry With The Highest Operating Margin,2013-06-14 04:07:00-04:00,FN,positive
506727.0,UPDATE: Deutsche Bank Downgrades Fabrinet to Hold on Slower than Expected Recovery,2013-05-23 09:00:00-04:00,FN,neutral
506728.0,Benzinga's Top Downgrades,2013-05-23 07:55:00-04:00,FN,positive
506729.0,"Deutsche Bank Downgrades Fabrinet to Hold, lowers PT to $15.00",2013-05-23 07:17:00-04:00,FN,negative
506730.0,Fabrinet Sees Q4 EPS $0.26-0.28; Sees Sales $148.0M-152.0M,2013-04-29 16:27:00-04:00,FN,neutral
506731.0,"Earnings Scheduled For April 29, 2013",2013-04-29 04:13:00-04:00,FN,neutral
506732.0,Fabrinet Announces 3.8M Common Secondary Offering by Holders,2013-03-12 16:58:00-04:00,FN,neutral
506733.0,Fabrinet Announces 3.8M Share Secondary Offering By Selling Shareholders ,2013-03-12 16:57:00-04:00,FN,positive
506734.0,"Deutsche Bank Maintains Buy on Fabrinet, Raises PT to $18.00",2013-02-05 08:35:00-05:00,FN,neutral
506735.0,Fabrinet Sees Q3 EPS $0.29-0.31; Sees Sales $147.0M-151.0M,2013-02-04 16:16:00-05:00,FN,neutral
506736.0,Fabrinet Reports Q2 EPS of $0.39; Revenue of $167.40M,2013-02-04 16:16:00-05:00,FN,neutral
506737.0,"Earnings Scheduled For February 4, 2013",2013-02-04 01:16:00-05:00,FN,neutral
506738.0,UPDATE: Piper Jaffray Upgrades Fabrinet to Overweight on Carrier Capital Spending Outlook  ,2013-01-18 08:12:00-05:00,FN,negative
506739.0,"JP Morgan Upgrades Fabrinet to Overweight, Raises PT to $16.50",2013-01-18 06:27:00-05:00,FN,neutral
506740.0,Top 4 NYSE Stocks In The Electronic Equipment Industry With The Highest Operating Margin,2013-01-07 03:11:00-05:00,FN,positive
506741.0,UPDATE: JP Morgan Downgrades Fabrinet to Neutral on Valuation  ,2012-11-08 13:39:00-05:00,FN,positive
506742.0,"JP Morgan Downgrades Fabrinet from Overweight to Neutral, Maintains PT at $14",2012-11-08 05:57:00-05:00,FN,neutral
506743.0,Needham Upgraded Fabrinet from Hold to Buy,2012-11-06 10:00:00-05:00,FN,neutral
506744.0,Fabrinet Reports Q1 EPS $0.36; Revenues $158.6M,2012-11-05 16:11:00-05:00,FN,neutral
506745.0,"Piper Jaffray Maintains Fabrinet at Overweight, Raises PT from $16 to $17",2012-08-21 06:16:00-04:00,FN,negative
506746.0,"Deutsche Bank Maintains Fabrinet at Buy, Lowers PT from $17 to $16",2012-08-21 05:57:00-04:00,FN,negative
506747.0,Fabrinet Reports Q4 EPS $0.31,2012-08-20 16:06:00-04:00,FN,neutral
506748.0,"Earnings Scheduled For August 20, 2012",2012-08-20 04:58:00-04:00,FN,neutral
506749.0,Top 4 Small-Cap Stocks In The Electronic Equipment Industry With The Highest Cash,2012-07-03 02:09:00-04:00,FN,positive
506750.0,"GigOptix Appoints Mr. Tom Mitchell, Chairman and CEO of Fabrinet, to its Board of Directors  ",2012-06-25 09:01:00-04:00,FN,neutral
506751.0,"GigOptix Appoints Mr. Tom Mitchell, Chairman and CEO of Fabrinet, to its Board of Directors",2012-06-25 09:00:00-04:00,FN,neutral
506752.0,UPDATE: Piper Jaffray Reduces PT to $16 on Conservative Growth Expectations  ,2012-06-12 14:20:00-04:00,FN,positive
506753.0,"Piper Jaffray Lowers PT on Fabrinet from $20 to $16, Maintains Overweight",2012-06-12 08:44:00-04:00,FN,negative
506754.0,UPDATE: Piper Jaffray Lowers Fabrinet's PT,2012-05-08 09:40:00-04:00,FN,negative
506755.0,UPDATE: Morgan Stanley Lowers Fabrinet's PT,2012-05-08 07:47:00-04:00,FN,negative
506756.0,"Piper Jaffray Maintains Fabrinet at Overweight, Lowers PT from $22 to $20",2012-05-08 07:24:00-04:00,FN,negative
506757.0,"Morgan Stanley Maintains Fabrinet at Overweight, Lowers PT from $24 to $19",2012-05-08 06:32:00-04:00,FN,negative
506758.0,Top 4 Small-Cap Stocks In The Electronic Equipment Industry With The Highest Cash,2012-04-24 03:46:00-04:00,FN,positive
506759.0,UPDATE: Credit Suisse Raises Target on Fabrinet to $25,2012-02-07 08:00:00-05:00,FN,positive
506760.0,Benzinga's Top Upgrades,2012-02-07 07:23:00-05:00,FN,positive
506761.0,UPDATE: Morgan Stanley Upgrades Fabrinet to Overweight,2012-02-07 07:20:00-05:00,FN,negative
506762.0,Morgan Stanley Upgrades Fabrinet from Underweight to Overweight,2012-02-07 06:40:00-05:00,FN,negative
506763.0,Earnings Scheduled For February 6,2012-02-06 03:55:00-05:00,FN,neutral
506764.0,"Collins Stewart Reiterates Buy, $18 PT on Fabrinet",2012-02-01 08:35:00-05:00,FN,neutral
506765.0,Earnings Scheduled For November 7,2011-11-07 04:21:00-05:00,FN,neutral
506766.0,UPDATE: Collins Stewart Upgrades Fabrinet to Buy ,2011-11-03 09:20:00-04:00,FN,neutral
506767.0,"Collins Stewart Upgrades Fabrinet to Buy, $18 PT",2011-11-03 08:26:00-04:00,FN,neutral
506768.0,Benzinga's Top Upgrades,2011-11-03 08:20:00-04:00,FN,positive
506769.0,"Fabrinet Hits New 52-Week Low, $12.52",2011-10-25 13:05:00-04:00,FN,negative
506770.0,Fabrinet Reports Impact Due to Severe Flooding in Thailand; Flood Waters Infiltrated Offices and Manufacturing Floorspace at Chokchai Campus ,2011-10-24 09:23:00-04:00,FN,negative
506771.0,Fabrinet Provides Update on Thailand Flooding Impacts; Suspends Production Temporarily   ,2011-10-21 09:46:00-04:00,FN,neutral
506772.0,Top 4 Small-Cap Stocks In The Electronic Equipment Industry With The Highest Revenue,2011-10-21 03:52:00-04:00,FN,positive
506773.0,Afternoon Movers; Fabrinet up 12%,2011-09-14 15:55:00-04:00,FN,neutral
506774.0,Afternoon Losers; Travelzoo Down 11%,2011-08-17 15:57:00-04:00,FN,negative
506775.0,UPDATE: Fabrinet Thai Unit Gets $40M Hedging Facility,2011-08-16 16:26:00-04:00,FN,neutral
506776.0,Fabrinet Thai Unit Gets 960M Thai Baht Pact,2011-08-16 16:25:00-04:00,FN,neutral
506777.0,Morning Gainers; Renaissance Learning up After Being Acquired,2011-08-16 10:01:00-04:00,FN,neutral
506778.0,Morning Market Movers,2011-08-16 09:47:00-04:00,FN,neutral
506779.0,UPDATE: Stifel Nicolaus Lowers PT on Fabrinet to $25,2011-08-16 08:57:00-04:00,FN,negative
506780.0,After-Hours Gainers,2011-08-15 16:54:00-04:00,FN,neutral
506781.0,Fabrinet Reports Q4 EPS $0.50; Revenues $190.3M,2011-08-15 16:07:00-04:00,FN,neutral
506782.0,Earnings Scheduled For August 15,2011-08-15 01:05:00-04:00,FN,neutral
506783.0,Morning Market Losers ,2011-07-11 10:02:00-04:00,FN,negative
506784.0,Deutsche Bank Maintains Buy on Fabrinet,2011-05-31 08:14:00-04:00,FN,neutral
506785.0,Planning to invest in an IPO- Must watch list of recent IPOs with Booming potential,2011-05-18 04:26:00-04:00,FN,neutral
506786.0,"CEOWORLD Top Semiconductors Stocks on 5/13/11- SPRD, DSTI, MSPD, TXCC, CREE, FSLR, SPA, MTSN, NVLS, NVDA, KBALB, ASYS…",2011-05-13 08:17:00-04:00,FN,positive
506787.0,"Top Semiconductors Stock Picks to buy on 5/6/11- KLIC, DIOD, SPRD, NPTN, PSEM, SQNS, NVLS, ONNN, FSII, AUTH, NVMI, SIMO",2011-05-06 05:52:00-04:00,FN,positive
506788.0,Morgan Stanley Reiterates Equal-Weight On Fabrinet (FN),2011-05-03 06:31:00-04:00,FN,neutral
506789.0,"Top 4 Small-Cap Stocks In The Electronic Equipment Industry With The Highest Profit Margin (DTSI, NIV, GNRC, FN)",2011-04-20 00:13:00-04:00,FN,positive
506790.0,Deutsche Bank Lowers PT On Fabrinet To $24,2011-03-18 09:26:00-04:00,FN,negative
506791.0,Morgan Stanley Assumes Coverage Of FN,2011-03-16 08:05:00-04:00,FN,neutral
506792.0,Fabrinet Announces Secondary Public Offering of 6M Shares,2011-02-22 08:12:00-05:00,FN,positive
506793.0,"Deutsche Bank Raises Fabrinet Estimates, Price Target",2010-11-02 08:03:00-04:00,FN,neutral
506794.0,Fabrinet Announces First Quarter 2011 EPS of $.44,2010-11-01 16:18:00-04:00,FN,neutral
