Unnamed: 0,title,date,stock,sentiment
557532.0,Globant Announces Proposed 2M Share Common Stock Offering,2020-06-03 16:17:00-04:00,GLOB,positive
557533.0,Stocks That Hit 52-Week Highs On Wednesday,2020-06-03 10:45:00-04:00,GLOB,neutral
557534.0,Stocks That Hit 52-Week Highs On Tuesday,2020-05-26 10:32:00-04:00,GLOB,neutral
557535.0,"Piper Sandler Initiates Coverage On Globant with Overweight Rating, Announces Price Target of $152",2020-05-22 06:02:00-04:00,GLOB,negative
557536.0,Globant SA shares are trading higher after the company reported better-than-expected Q1 EPS and sales results.,2020-05-15 09:43:00-04:00,GLOB,positive
557537.0,"Citigroup Maintains Neutral on Globant, Raises Price Target to $121",2020-05-15 09:39:00-04:00,GLOB,neutral
557538.0,"Globant Sees Q2 Sales At Least $179M, Adj. EPS At Least $0.47",2020-05-14 16:24:00-04:00,GLOB,neutral
557539.0,"Globant Q1 Adj. EPS $0.640 Beats $0.620 Estimate, Sales $191.600M Beat $188.790M Estimate",2020-05-14 16:24:00-04:00,GLOB,neutral
557540.0,"Earnings Scheduled For May 14, 2020",2020-05-14 05:03:00-04:00,GLOB,neutral
557541.0,"Shares of several technology companies are trading lower amid market weakness, selling off from recent sector strength. Equities have moved lower for the session, potentially related to cautious comments from Fed Chair Powell, who suggested uncertainty and 'significant' downside risks in the economy.",2020-05-13 12:11:00-04:00,GLOB,negative
557542.0,Shares of several technology companies are trading lower amid overall market weakness following a collapse in oil prices. Oil has been negatively impacted by excess supply and low demand amid the coronavirus pandemic.,2020-04-21 10:52:00-04:00,GLOB,negative
557543.0,"UPDATE: Globant Sees Q1 Sales At Least $190M vs $187M Estimate, Adj. EPS At Least $0.62 vs $0.62 Est.",2020-04-15 16:46:00-04:00,GLOB,neutral
557544.0,Globant Withdraws FY20 Guidance,2020-04-15 16:45:00-04:00,GLOB,neutral
557545.0,Globant Raises Q1 Sales Guidance,2020-04-15 16:45:00-04:00,GLOB,neutral
557546.0,KeyBanc Downgrades Globant to Sector Weight,2020-03-10 11:02:00-04:00,GLOB,neutral
557547.0,94 Biggest Movers From Friday,2020-02-24 04:53:00-05:00,GLOB,neutral
557548.0,68 Stocks Moving In Friday's Mid-Day Session,2020-02-21 12:29:00-05:00,GLOB,neutral
557549.0,Stocks That Hit 52-Week Highs On Friday,2020-02-21 10:26:00-05:00,GLOB,neutral
557550.0,Globant shares are trading higher after the company reported better-than-expected Q4 EPS and sales results. The company reported Q1 EPS and sales guidance above analyst estimates.,2020-02-21 09:56:00-05:00,GLOB,positive
557551.0,"Citigroup Maintains Neutral on Globant, Raises Price Target to $128",2020-02-21 07:43:00-05:00,GLOB,neutral
557552.0,"Cantor Fitzgerald Maintains Neutral on Globant, Raises Price Target to $120",2020-02-21 06:51:00-05:00,GLOB,neutral
557553.0,"KeyBanc Maintains Overweight on Globant, Raises Price Target to $144",2020-02-21 05:02:00-05:00,GLOB,negative
557554.0,"Globant Sees FY20 Adj. EPS At Least $2.74 vs $2.74 Estimate, Sales At Least $810M vs $809.4M Est.",2020-02-20 16:38:00-05:00,GLOB,neutral
557555.0,"Globant Sees Q1 Adj. EPS At Least $0.62 vs $0.60 Estimate, Sales At Least $188M vs $181.8M Est.",2020-02-20 16:38:00-05:00,GLOB,neutral
557556.0,"Globant Q4 Adj. EPS $0.64 Beats $0.61 Estimate, Sales $184.3M Beat $183.16M Estimate",2020-02-20 16:37:00-05:00,GLOB,neutral
557557.0,Stocks That Hit 52-Week Highs On Thursday,2020-02-20 10:26:00-05:00,GLOB,neutral
557558.0,"Wedbush Maintains Outperform on Globant, Raises Price Target to $150",2020-02-20 08:46:00-05:00,GLOB,neutral
557559.0,"JP Morgan Maintains Overweight on Globant, Raises Price Target to $129",2020-02-18 08:27:00-05:00,GLOB,neutral
557560.0,Stocks That Hit 52-Week Highs On Friday,2020-01-24 10:41:00-05:00,GLOB,neutral
557561.0,21 Software—Application Stocks Moving In Thursday's Session,2020-01-23 12:45:00-05:00,GLOB,neutral
557562.0,Stocks That Hit 52-Week Highs On Tuesday,2020-01-21 10:11:00-05:00,GLOB,neutral
557563.0,Stocks That Hit 52-Week Highs On Friday,2020-01-17 13:23:00-05:00,GLOB,neutral
557564.0,Stocks That Hit 52-Week Highs On Wednesday,2020-01-15 13:14:00-05:00,GLOB,neutral
557565.0,"Citigroup Maintains Neutral on Globant, Raises Price Target to $125",2020-01-15 07:58:00-05:00,GLOB,neutral
557566.0,"KeyBanc Maintains Overweight on Globant, Raises Price Target to $121",2020-01-13 06:02:00-05:00,GLOB,negative
557567.0,Stocks That Hit 52-Week Highs On Thursday,2020-01-09 15:15:00-05:00,GLOB,neutral
557568.0,22 Stocks Moving in Friday's Pre-Market Session,2019-11-22 07:20:00-05:00,GLOB,neutral
557569.0,66 Biggest Movers From Friday,2019-11-18 05:37:00-05:00,GLOB,neutral
557570.0,41 Stocks Moving In Friday's Mid-Day Session,2019-11-15 12:15:00-05:00,GLOB,neutral
557571.0,35 Stocks Moving in Friday's Pre-Market Session,2019-11-15 07:52:00-05:00,GLOB,neutral
557572.0,Globant SA shares are trading lower after the company issued Q4 EPS guidance below analyst estimates.,2019-11-14 16:50:00-05:00,GLOB,neutral
557573.0,"Globant Sees Q4 Adj. EPS $0.58-$0.62 vs $0.63 Est., Sales $182M-$184M vs $181.58M Est.; Sees FY19 Adj. EPS $2.23-$2.27 vs $2.24 Est., Sales $657M-$659M vs $656.08M Est.",2019-11-14 16:26:00-05:00,GLOB,neutral
557574.0,"Globant Q3 Adj. EPS $0.62 Beats $0.59 Estimate, Sales $171.3M Beat $170.64M Estimate",2019-11-14 16:25:00-05:00,GLOB,neutral
557575.0,"Earnings Scheduled For November 14, 2019",2019-11-14 04:43:00-05:00,GLOB,neutral
557576.0,"Benzinga's Top Upgrades, Downgrades For October 23, 2019",2019-10-23 10:20:00-04:00,GLOB,positive
557577.0,"Benzinga's Top Upgrades, Downgrades For October 21, 2019",2019-10-21 10:32:00-04:00,GLOB,positive
557578.0,"KeyBanc Upgrades Globant to Overweight, Announces $114 Price Target",2019-10-21 05:54:00-04:00,GLOB,negative
557579.0,"Benzinga's Top Upgrades, Downgrades For September 10, 2019",2019-09-10 09:38:00-04:00,GLOB,positive
557580.0,10 Biggest Price Target Changes For Tuesday,2019-09-10 09:12:00-04:00,GLOB,neutral
557581.0,"HSBC Downgrades Globant to Reduce, Raises Price Target to $80",2019-09-10 06:25:00-04:00,GLOB,neutral
557582.0,72 Biggest Movers From Yesterday,2019-08-20 05:24:00-04:00,GLOB,neutral
557583.0,48 Stocks Moving In Monday's Mid-Day Session,2019-08-19 13:33:00-04:00,GLOB,neutral
557584.0,Globant S.A. shares are trading lower after the company reported Q2 earnings.,2019-08-16 08:30:00-04:00,GLOB,neutral
557585.0,26 Stocks Moving in Friday's Pre-Market Session,2019-08-16 08:17:00-04:00,GLOB,neutral
557586.0,"Globant Sees Q3 Adj. EPS $0.57-$0.61 vs $0.58 Est., Sales $170M-$172M vs $166.24M Est.; Sees FY19 Adj. EPS $2.19-$2.25 vs $2.21 Est., Sales $654M-$660M vs $642.84M Est.",2019-08-15 16:19:00-04:00,GLOB,neutral
557587.0,"Globant Q2 Adj. EPS $0.53 Beats $0.52 Estimate, Sales $157.5M Beat $157.42M Estimate",2019-08-15 16:17:00-04:00,GLOB,neutral
557588.0,A Preview Of Globant's Earnings,2019-08-15 07:34:00-04:00,GLOB,neutral
557589.0,"Earnings Scheduled For August 15, 2019",2019-08-15 05:07:00-04:00,GLOB,neutral
557590.0,31 Stocks Moving In Wednesday's Pre-Market Session,2019-08-14 07:51:00-04:00,GLOB,neutral
557591.0,A Peek Into The Markets: US Stock Futures Down; Dow Futures Fall Over 200 Points,2019-08-12 07:38:00-04:00,GLOB,neutral
557592.0,"Globant Reports Purchase Of Belatrix Software, No Terms Disclosed",2019-08-12 07:22:00-04:00,GLOB,negative
557593.0,48 Stocks Moving In Friday's Pre-Market Session,2019-08-02 08:19:00-04:00,GLOB,neutral
557594.0,New Equities that Broke Through 52-Week Highs Monday Morning,2019-07-29 10:13:00-04:00,GLOB,negative
557595.0,Companies That Achieved 52-Week Highs Friday,2019-07-26 15:37:00-04:00,GLOB,neutral
557596.0,"Citigroup Downgrades Globant to Neutral, Raises Price Target to $115",2019-07-17 08:39:00-04:00,GLOB,neutral
557597.0,"Benzinga's Top Upgrades, Downgrades For June 21, 2019",2019-06-21 09:15:00-04:00,GLOB,positive
557598.0,Itau BBA Upgrades Globant to Outperform,2019-06-21 06:46:00-04:00,GLOB,neutral
557599.0,28 Stocks Moving In Monday's Pre-Market Session,2019-06-17 08:06:00-04:00,GLOB,neutral
557600.0,"Globant Sees Q2 Adj. EPS $0.50-$0.54 vs $0.52 Est., Sales $156M-$158M vs $156.57M; Sees FY19 Adj. EPS $2.13-$2.21 vs $2.16 Est., Sees Sales $638M-$646M vs $639.69M Est.",2019-05-09 16:27:00-04:00,GLOB,neutral
557601.0,"Globant Q1 Adj. EPS $0.50 Beats $0.47 Estimate, Sales $146.15M Beat $145.23M Estimate",2019-05-09 16:24:00-04:00,GLOB,neutral
557602.0,33 Stocks Moving In Wednesday's Mid-Day Session,2019-04-10 13:17:00-04:00,GLOB,neutral
557603.0,Morgan Stanley Initiates Coverage On Globant with Overweight Rating,2019-04-10 10:54:00-04:00,GLOB,negative
557604.0,Globant shares are trading higher after Morgan Stanley initiated coverage of the stock with an Overweight rating.,2019-04-10 10:38:00-04:00,GLOB,negative
557605.0,31 Stocks Moving In Friday's Pre-Market Session,2019-02-15 08:20:00-05:00,GLOB,neutral
557606.0,"Globant Q4 EPS $0.50 Beats $0.48 Estimate, Sales $140.138M Beat $139.76M Estimate",2019-02-14 16:59:00-05:00,GLOB,neutral
557607.0,"Stocks Which Set New 52-Week High Mon., Jan. 28, 2019",2019-01-28 15:32:00-05:00,GLOB,neutral
557608.0,"Globant Sees FY18 Adj. EPS $1.69-$1.73 vs $1.68 Estimate, Sales $520M-$522M vs $515.1M Est.",2018-11-15 16:33:00-05:00,GLOB,neutral
557609.0,"Globant Sees Q4 Adj. EPS $0.45-$0.49 vs $0.46 Estimate, Sales $138M-$140M vs $136.3M Est.",2018-11-15 16:32:00-05:00,GLOB,neutral
557610.0,"Globant Q3 EPS $0.46 Beats $0.44 Estimate, Sales $134.568M Beat $132.6M Estimate",2018-11-15 16:31:00-05:00,GLOB,neutral
557611.0,"Earnings Scheduled For November 15, 2018",2018-11-15 04:54:00-05:00,GLOB,neutral
557612.0,"Stocks Which Set New 52-Week High Friday, August 31",2018-09-04 10:29:00-04:00,GLOB,neutral
557613.0,"Stocks Which Set New 52-Week High Yesterday, August 30th",2018-08-31 10:11:00-04:00,GLOB,neutral
557614.0,"Stocks Which Set New 52-Week High Yesterday, August 29th",2018-08-30 11:47:00-04:00,GLOB,neutral
557615.0,"Stocks Which Set New 52-Week High Yesterday, August 28th",2018-08-29 11:13:00-04:00,GLOB,neutral
557616.0,"Stocks Which Set New 52-Week High Friday, August 24th",2018-08-27 09:24:00-04:00,GLOB,neutral
557617.0,"Globant Q2 EPS $0.40 Beats $0.39 Estimate, Sales $127.892M Beat $125.23M Estimate",2018-08-23 16:17:00-04:00,GLOB,neutral
557618.0,"Earnings Scheduled For August 23, 2018",2018-08-23 04:08:00-04:00,GLOB,neutral
557619.0,"Globant Sees FY18 Adj. EPS $1.56-$1.64 vs $1.58 Est., Sales $502M-$510M vs $504.1M Est.",2018-05-10 16:25:00-04:00,GLOB,neutral
557620.0,"Globant Sees Q2 Sales $124M-$126M vs $120.73M Est., Adj. EPS $0.36-$0.40 vs $0.36 Est.",2018-05-10 16:24:00-04:00,GLOB,neutral
557621.0,"Globant Q1 EPS $0.38 Beats $0.34 Estimate, Sales $119.7M Beat $114.01M Estimate",2018-05-10 16:22:00-04:00,GLOB,neutral
557622.0,"Benzinga's Top Upgrades, Downgrades For April 20, 2018",2018-04-20 09:16:00-04:00,GLOB,positive
557623.0,"HSBC Initiates Coverage On Globant with Hold Rating, Announces $48.00 Price Target",2018-04-20 07:32:00-04:00,GLOB,neutral
557624.0,"'$GLOB board of advisor Martin Sorrell resigned from $WPP over the weekend. We reviewed $GLOB 20-F and found a worrisome restatement. Love how insiders sold on the press release news n the $50s, only to later revise numbers down?'-Spruce Point Tweet",2018-04-16 09:50:00-04:00,GLOB,positive
557625.0,Globant Launches Its Media Over-the-Top Studio,2018-04-06 10:00:00-04:00,GLOB,neutral
557626.0,"'Form 144 out. $GLOB CEO and founder and a trust dumped 60,000 shares earlier this week. We are following the paper trail #bearish #negative'- Spruce Point Capital Tweet",2018-04-06 10:00:00-04:00,GLOB,positive
557627.0,"Spruce Point Issues Strong Sell Opinion On Globant, Sees 45-50% Downside Risk",2018-04-04 11:06:00-04:00,GLOB,positive
557628.0,Hearing Spruce Point Out Negative on Globant,2018-04-04 11:03:00-04:00,GLOB,negative
557629.0,"Benzinga's Top Upgrades, Downgrades For April 4, 2018",2018-04-04 09:45:00-04:00,GLOB,positive
557630.0,SunTrust Robinson Humphrey Upgrades Globant to Buy,2018-04-04 07:50:00-04:00,GLOB,neutral
557631.0,"Globant Sees Q1 Adj. EPS $0.31-$0.35 vs $0.33 Est., Sales $113M-$115M vs $108.8M Est.; Sees FY18 Adj. EPS $1.52-$1.62 vs $1.57 Est., Sales $495M-$505M vs $492.3M Est.",2018-02-15 16:25:00-05:00,GLOB,neutral
557632.0,"Globant Reports Q4 Adj. EPS $0.39 vs $0.38 Est., Sales $115.4M vs $109.1M Est.",2018-02-15 16:24:00-05:00,GLOB,neutral
557633.0,Globant Reports Collaboration With Google Cloud For Comprehensive OTT Solution,2018-01-04 10:02:00-05:00,GLOB,positive
557634.0,"Globant Sees Q4 Adj. EPS $0.38-$0.40 vs $0.37 Est., Sales $108M-$110M vs $108.42M Est.; FY17 Adj. EPS $1.25-$1.29 vs $1.25 Est., Sales $406M-$408M vs $400.79M Est.",2017-11-16 16:21:00-05:00,GLOB,neutral
557635.0,"Globulant Reports Q3 Adj. EPS $0.34 In-line With Est., Sales $109.7M vs $104.05M Est.",2017-11-16 16:19:00-05:00,GLOB,neutral
557636.0,"Globant Sees FY17 Adj. EPS $1.22-$1.30 vs $1.27 Est., Sales $397M-$403M vs $391.1M Est.",2017-08-17 16:12:00-04:00,GLOB,neutral
557637.0,Globant Sees Q3 Adj. EPS $0.32-$0.36 vs $0.34 Est.,2017-08-17 16:11:00-04:00,GLOB,neutral
557638.0,Globant Sees Q3 Sales $103M-$105M vs $100.7M Est.,2017-08-17 16:11:00-04:00,GLOB,neutral
557639.0,"Globant Reports Q2 Adj. EPS $0.27 vs $0.28 Est., Sales $99.6M vs $95.76M Est.",2017-08-17 16:10:00-04:00,GLOB,neutral
557640.0,"Earnings Scheduled For August 17, 2017",2017-08-17 04:46:00-04:00,GLOB,neutral
557641.0,SunTrust Robinson Humphrey Downgrades Globant S.A. Common Shares to Hold,2017-07-27 07:15:00-04:00,GLOB,positive
557642.0,15 Biggest Mid-Day Losers For Friday,2017-07-07 12:59:00-04:00,GLOB,negative
557643.0,"Benzinga's Top Upgrades, Downgrades For July 7, 2017",2017-07-07 09:23:00-04:00,GLOB,positive
557644.0,The Market In 5 Minutes,2017-07-07 09:05:00-04:00,GLOB,neutral
557645.0,KeyBanc Downgrades Globant S.A. Common Shares to Sector Weight,2017-07-07 06:05:00-04:00,GLOB,positive
557647.0,"Globant Reports Purchase of PointSource, No Terms Disclosed",2017-06-01 16:21:00-04:00,GLOB,negative
557648.0,"Globant Sees Q2 EPS $0.26-$0.28 vs $0.33 Est., Sales $95M-$97M vs $96.03M Est.; FY17 EPS $1.22-$1.30 vs $1.35 Est., Sales $386M-$394M vs $390.84M Est.",2017-05-18 16:12:00-04:00,GLOB,neutral
557649.0,"Globant Reports Q1 Adj. EPS $0.27 In-line With Est., Sales $88.7M vs $87.72M Est.",2017-05-18 16:10:00-04:00,GLOB,neutral
557650.0,"Earnings Scheduled For May 18, 2017",2017-05-18 04:46:00-04:00,GLOB,neutral
557651.0,"Globant Reports Q4 Adj. EPS $0.31, Inline, Sales $87.3M vs $86M Est.",2017-02-16 16:25:00-05:00,GLOB,neutral
557652.0,Pacific Crest Upgrades Globant S.A. Common Shares to Overweight,2017-01-12 09:03:00-05:00,GLOB,negative
557653.0,Globant SA Shares Down 3.34% Today On Above Average Volume,2016-12-06 14:24:00-05:00,GLOB,positive
557654.0,15 Biggest Mid-Day Losers For Tuesday,2016-11-15 13:04:00-05:00,GLOB,negative
557655.0,Mid-Day Market Update: Crude Oil Up Over 4%; Advance Auto Parts Shares Rise On Earnings Beat,2016-11-15 12:25:00-05:00,GLOB,negative
557656.0,"Globant Acquires L4, Terms Not Disclosed",2016-11-14 16:20:00-05:00,GLOB,neutral
557657.0,"Globant Sees Q4 Rev. $84.5-$86.5M vs. Est. $85M, EPS $0.30-$0.33 vs. Est. $0.35; FY16 Rev. $320-$322M vs. Est. $321M, EPS $1.12-$1.15 vs. Est. $1.18",2016-11-14 16:12:00-05:00,GLOB,neutral
557658.0,"Globant Reports Q3 EPS $0.30 vs. Est. $0.30, Rev. $82.4M vs. Est. $81.7M",2016-11-14 16:11:00-05:00,GLOB,neutral
557659.0,"Suntrust Robinson Humphrey Financial Technology, Business & Government Services Conf Today",2016-11-10 10:05:00-05:00,GLOB,neutral
557660.0,"Wedbush Initiates Coverage on Globant at Outperform, Announces $48.00 PT",2016-09-09 03:50:00-04:00,GLOB,neutral
557661.0,"Globant Beats Expectations, Issues Strong FY 2016 Guidance",2016-08-10 16:33:00-04:00,GLOB,positive
557662.0,"Globant Sees FY16 Adj. EPS $1.14-$1.20 vs $1.16 Est., Sales $318M-$322M vs $313.5M Est.",2016-08-10 16:17:00-04:00,GLOB,neutral
557663.0,"Globant Sees Q3 Adj. EPS $0.27-$0.31 vs $0.32 Est., Sales $80M-$82M vs $79.8M Est.",2016-08-10 16:16:00-04:00,GLOB,neutral
557664.0,"Globant Reports Q2 Adj. EPS $0.29 vs $0.28 Est., Sales $79.9M vs $76.8M Est.",2016-08-10 16:16:00-04:00,GLOB,neutral
557665.0,"Analysts At Pacific Crest Begin Coverage On Accenture, Cognizant And Other IT Stocks",2016-07-12 10:11:00-04:00,GLOB,neutral
557666.0,Pacific Crest Initiates Coverage on Globant at Sector Weight,2016-07-12 06:53:00-04:00,GLOB,neutral
557667.0,"Globant Sees FY 2016 EPS $1.12-$1.20 Vs Est $1.15, Sales $309M-$315M vs Est $310.13M",2016-05-09 16:13:00-04:00,GLOB,neutral
557668.0,"Globant Sees Q2 2016 EPS $0.25-$0.29 Vs Est $0.29, Sales $76M-$78M vs Est $74.83M",2016-05-09 16:12:00-04:00,GLOB,neutral
557669.0,"Globant Reports Q1 EPS $0.24 Vs Est $0.23, Sales $73.3M Vs Est $69.84M",2016-05-09 16:11:00-04:00,GLOB,neutral
557670.0,StreetSweeper Sees 'Ugly' Decline Coming For Globant,2016-03-15 12:32:00-04:00,GLOB,neutral
557671.0,TheStreetSweeper issues a brand-new report on Globant S.A,2016-03-15 10:20:00-04:00,GLOB,neutral
557672.0,"Globant Reports Q4 Adj. EPS $0.26 vs $0.24 Est., Sales $71.6M vs $68.71M Est.",2016-02-17 16:15:00-05:00,GLOB,neutral
557673.0,"BWS Financial  Initiates Coverage on Globant at Sell, Announces $16.00 PT, Macro Headwinds And Competition Dampen Growth Outlook",2016-02-08 14:10:00-05:00,GLOB,positive
557674.0,"Citigroup Upgrades Globant SA, Says Key To Co Is Well-Diversified Client Base And Emerging Tech Portfolio",2016-02-08 07:25:00-05:00,GLOB,neutral
557675.0,Citigroup Upgrades Globant to Buy,2016-02-08 07:23:00-05:00,GLOB,neutral
557676.0,Benzinga's Top Initiations,2015-12-21 10:20:00-05:00,GLOB,positive
557677.0,"SunTrust Robinson Humphrey Initiates Coverage on Globant at Buy, Announces $42.00 PT",2015-12-21 08:16:00-05:00,GLOB,neutral
557678.0,Sterne Agee CRT Earlier Initiated Coverage on 16 Payment/Payroll/IT Stocks,2015-12-17 10:27:00-05:00,GLOB,neutral
557679.0,Globant Sees FY15 Sales $250M-$252M vs $248.8M Est.,2015-11-05 16:54:00-05:00,GLOB,neutral
557680.0,"Globant Reports Q3 Adj. EPS $0.26 vs $0.23 Est., Sales $67.1M vs $65M Est.; Sees Q4 EPS $0.21-$0.25 vs $0.25 Est., Sales $68M-$70M vs $68.6M Est.",2015-11-05 16:54:00-05:00,GLOB,neutral
557681.0,4 Wearable Tech Stocks That Could Be A Good Fit,2015-09-04 13:33:00-04:00,GLOB,positive
557682.0,Benzinga's Top Initiations,2015-08-12 09:58:00-04:00,GLOB,positive
557683.0,"Jefferies Initiates Coverage on Globant at Hold, Announces $30.00 PT",2015-08-12 06:13:00-04:00,GLOB,neutral
557684.0,Citi Downgrades Globant; Stock Trades At High Premium To Peers,2015-07-27 14:22:00-04:00,GLOB,neutral
557685.0,"Citigroup Downgrades Globant to Neutral, Raises PT to $34.00",2015-07-27 07:43:00-04:00,GLOB,neutral
557686.0,Benzinga's Volume Movers,2015-07-09 10:32:00-04:00,GLOB,neutral
557687.0,Globant Prices Offering of Shares at $28.31/Share,2015-07-09 09:05:00-04:00,GLOB,positive
557688.0,Globant Announces Commencement of 3.5M Share Offering,2015-07-07 06:47:00-04:00,GLOB,positive
557689.0,Blbant Files Secondary For Up To $125M,2015-06-26 16:09:00-04:00,GLOB,neutral
557690.0,Automation To Reduce IT Labor? JP Morgan Weighs In,2015-06-01 12:54:00-04:00,GLOB,positive
557691.0,"Globant Reports Q1 EPS $0.22 Vs Est $0.16, Sales $54.5M Vs Est $52.22M, Sees Q2 Revs $58M-$60M",2015-05-14 16:09:00-04:00,GLOB,neutral
557692.0,Benzinga's Volume Movers,2015-03-27 10:27:00-04:00,GLOB,neutral
557693.0,Amended F-1 from Globant SA Shows Registration for 2.9M Share Offering via Selling Shareholders,2015-03-23 16:18:00-04:00,GLOB,positive
557694.0,"Globant Reports Q4 EPS $0.24 Vs Est $0.19, Sales $53.81M Vs Est $55.1M",2015-02-11 16:01:00-05:00,GLOB,neutral
557695.0,Top 4 Small-Cap Stocks In The Information Technology Services Industry With The Highest ROE,2015-01-30 04:32:00-05:00,GLOB,positive
557696.0,UPDATE: Credit Suisse Downgrades Globant SA On Valuation,2015-01-07 07:30:00-05:00,GLOB,positive
557697.0,"Credit Suisse Downgrades Globant to Underperform, Maintains $14.00 PT",2015-01-07 06:53:00-05:00,GLOB,positive
557698.0,Top 4 Small-Cap Stocks In The Information Technology Services Industry With The Highest ROI,2014-12-19 04:23:00-05:00,GLOB,positive
557699.0,"Credit Suisse Maintains Neutral on Globant, Raises PT to $14.00",2014-11-10 19:11:00-05:00,GLOB,positive
557700.0,Globant Reports Q2 EPS of $0.20; Revenue of $49.40M,2014-08-14 16:01:00-04:00,GLOB,neutral
557701.0,William Blair Initiates Coverage on Globant at Outperform,2014-08-12 09:19:00-04:00,GLOB,neutral
557702.0,"JP Morgan Initiates Coverage on Globant at Overweight, AN $15.00 PT",2014-08-12 06:27:00-04:00,GLOB,neutral
557703.0,"Cowen & Company Initiates Coverage on Globant at Outperform, Announces $15.00 PT",2014-08-12 06:27:00-04:00,GLOB,neutral
557704.0,How Did Investors Beat The Market On Friday?,2014-07-19 15:53:00-04:00,GLOB,neutral
557705.0,"Globant SA IPO Opens at $12.95/Share, IPO Priced at $10",2014-07-18 09:44:00-04:00,GLOB,neutral
557706.0,Waiting on 6 IPOs This Morning,2014-07-18 08:15:00-04:00,GLOB,neutral
557707.0,Globant Announces 5.85M Share Offering Priced at $10/Share,2014-07-18 08:02:00-04:00,GLOB,positive
557708.0,9 IPOs To Watch For This Week,2014-07-14 11:06:00-04:00,GLOB,neutral
557709.0,Globant Expects 6.3M Share IPO to Price $11.00-$13.00/Share,2014-07-07 06:20:00-04:00,GLOB,positive
