Unnamed: 0,title,date,stock,sentiment
565506.0,"25 Stocks Which Rallied Four Days, Then Sold Off Yesterday",2016-09-22 09:47:00-04:00,GNMK,neutral
565507.0,Mid-Afternoon Market Update: Dow Falls 100 Points; Crude Oil Down 2.3%,2016-09-16 14:33:00-04:00,GNMK,negative
565508.0,12 Biggest Mid-Day Gainers For Friday,2016-09-16 12:39:00-04:00,GNMK,neutral
565509.0,Mid-Day Market Update: Novavax Tumbles Following Failed Trial; Depomed Shares Surge,2016-09-16 12:19:00-04:00,GNMK,negative
565510.0,Investors Taking Note Of Cowen's GenMark Diagnostics Upgrade,2016-09-16 11:15:00-04:00,GNMK,neutral
565511.0,Benzinga's Volume Movers,2016-09-16 10:27:00-04:00,GNMK,neutral
565512.0,Mid-Morning Market Update: Markets Open Lower; Intel Lifts Q3 Revenue Outlook,2016-09-16 10:05:00-04:00,GNMK,negative
565513.0,12 Stocks Moving In Friday's Pre-Market Session,2016-09-16 08:21:00-04:00,GNMK,neutral
565514.0,Cowen & Co. Upgrades GenMark Diagnostics to Outperform,2016-09-16 06:18:00-04:00,GNMK,neutral
565515.0,GenMark Sees FY16 Rev. $47-$51M vs. Est. $47M,2016-07-28 16:12:00-04:00,GNMK,neutral
565516.0,"GenMark Diagnostics Reports Q2 EPS $(0.30) vs. Est. $(0.33), Rev. $12.5M vs. Est. $9.62M",2016-07-28 16:11:00-04:00,GNMK,neutral
565517.0,UPDATE: StreetSweeper on Genmark: 'Seven Signs of Sickness',2016-07-07 09:56:00-04:00,GNMK,neutral
565518.0,UPDATE: ALERT: TheStreetSweeper issues a new report on GenMark Diagnostics (GNMK)!,2016-07-07 09:55:00-04:00,GNMK,positive
565519.0,StreetSweeper to Issue Alert on GenMark,2016-07-07 09:55:00-04:00,GNMK,positive
565520.0,"GenMark, T2 And Accelerate Diagnostics Impress Analysts At Microbiology Forum",2016-06-27 11:35:00-04:00,GNMK,positive
565521.0,GenMark Reports Received CE Mark for ePlex Sample-to-Answer System,2016-06-08 16:05:00-04:00,GNMK,neutral
565522.0,Mid-Day Market Update: ServiceNow Jumps On Strong Q1 Results; Trueblue Shares Slide,2016-04-21 12:04:00-04:00,GNMK,positive
565523.0,GenMark Sees FY16 Sales $47M-$51M vs $48.5M Est.,2016-02-23 16:29:00-05:00,GNMK,neutral
565524.0,"GenMark Reports Q4 EPS $(0.21) vs $(0.27) Est., Sales $13.2M vs $12.3M Est.",2016-02-23 16:28:00-05:00,GNMK,neutral
565525.0,6 Stocks Moving On Monday's After-Hours Session,2016-02-22 17:16:00-05:00,GNMK,neutral
565526.0,GenMark Sees Prelim Q4 Revs $13.2M Vs Est $12.34M; Sees FY 2015 Revs $39.4M vs Est $38.56M; Says XT-8 Installed Base Grew By 17 to 633,2016-01-12 16:06:00-05:00,GNMK,neutral
565527.0,"Genmark Diagnostics CFO Mendel Buys 10,000 Shares @$6.47/Share -Form 4",2015-11-02 11:42:00-05:00,GNMK,positive
565528.0,Stocks Hitting 52-Week Lows,2015-10-28 10:28:00-04:00,GNMK,negative
565529.0,Morning Market Losers,2015-10-28 09:57:00-04:00,GNMK,negative
565530.0,Genmark Diagnostic Shares Down ~30%,2015-10-28 09:51:00-04:00,GNMK,positive
565531.0,"GenMark Diagnostics Reports Q3 Loss $0.27 Vs Est Loss $0.37, Sales $8.47M Vs Est $8.24M; Reaffirms 2015 Revs $38M-$40M Vs Est $38.43M",2015-10-27 16:27:00-04:00,GNMK,negative
565532.0,"GenMark Diagnostics Reports Q3 EPS $(0.27) vs. Est. $(0.31), Rev. $8.5M vs. Est. $8.24M",2015-10-27 16:07:00-04:00,GNMK,neutral
565533.0,"GenMark Reports Q2 EPS $(0.29) vs. Est. $(0.31), Rev. $7.6M vs. Est. $7.59M",2015-08-06 17:53:00-04:00,GNMK,neutral
565534.0,Option Alert: Genmark Diagnostics Sep $10 Call; 1500 Contracts Above Ask @$0.22,2015-08-06 15:42:00-04:00,GNMK,positive
565535.0,Mid-Afternoon Market Update: Standard Pacific Rises On Ryland Merger Deal; Micron Shares Slip,2015-06-15 15:58:00-04:00,GNMK,positive
565536.0,Mid-Afternoon Market Update: Wingstop Shares Surge in Stock Market Debut; ExOne Shares Tumble,2015-06-12 15:17:00-04:00,GNMK,positive
565537.0,GenMark Announces Preliminary Q1 Rev. Of $10.1M; FY15 Rev. Between $38-40M,2015-04-16 16:10:00-04:00,GNMK,neutral
565538.0,"GenMark Reports Q4 EPS -$0.21 Vs -$0.28, Sales $9.83M Vs Est $9.12M",2015-02-24 16:10:00-05:00,GNMK,neutral
565539.0,GenMark Diagnostics Reports Prelim Q4 Sales $9.80M,2015-01-12 16:07:00-05:00,GNMK,neutral
565540.0,GenMark Announces Completion of ePlex; Expects Q4 Revenue Of $9.8M,2015-01-12 16:06:00-05:00,GNMK,neutral
565541.0,"GenMark Diagnostics, Inc. Reports Q2 EPS of $(0.03) vs $(0.29) Est; Revenue of $6.56M vs $4.79M Est",2014-08-11 16:18:00-04:00,GNMK,neutral
565542.0,Upcoming Corporate Events/Presentations for the Week of Aug. 11-15th,2014-08-11 11:54:00-04:00,GNMK,neutral
565543.0,"GenMark Diagnostics, Inc. Reports Prelim Q2 Sales $6.60M vs $4.79M Est",2014-07-28 16:06:00-04:00,GNMK,neutral
565544.0,Genmark Announces Scott Mendel CFO,2014-05-12 16:06:00-04:00,GNMK,neutral
565545.0,"GenMark Diagnostics, Inc. Reports Q4 EPS of $(0.26) vs $(0.22) Est; Revenue of $6.45M vs $6.06M Est",2014-03-11 16:06:00-04:00,GNMK,neutral
565546.0,"Needham Initiates Coverage on GenMark Diagnostics, Inc. at Buy, Announces $17.00 PT",2013-12-19 08:26:00-05:00,GNMK,neutral
565547.0,"GenMark Diagnostics, Inc. Reports Q3 EPS of $(0.30) vs $(0.27) Est; Revenue of $4.64M vs $4.60M Est",2013-11-12 16:03:00-05:00,GNMK,neutral
565548.0,GenMark Shares Push Over $12 Level Following Mid-day Raised Price Target to $15 at Raymond James,2013-10-02 14:17:00-04:00,GNMK,positive
565549.0,Benzinga's Top Pre-Market Gainers,2013-08-14 08:07:00-04:00,GNMK,positive
565550.0,GenMark Diagnostics Announces Proposed Public Offering of $60 Million of Common Stock ,2013-08-12 16:01:00-04:00,GNMK,neutral
565551.0,"GenMark Diagnostics, Inc. Reports Q2 EPS of $(0.25) vs $(0.26) Est; Revenue of $5.22M vs $5.05M Est",2013-08-07 16:28:00-04:00,GNMK,neutral
565552.0,"Market Wrap for Tuesday, June 18: Stocks Rally Ahead of Fed Statement ",2013-06-18 16:22:00-04:00,GNMK,neutral
565553.0,UPDATE: J.P. Morgan Lowers PT on GenMark Diagnostics on Lowered 2013 Guidance,2013-06-18 14:16:00-04:00,GNMK,negative
565554.0,Afternoon Market Losers,2013-06-18 12:35:00-04:00,GNMK,negative
565555.0,"JP Morgan Maintains Overweight on GenMark Diagnostics, Inc., Lowers PT to $15.00",2013-06-18 09:19:00-04:00,GNMK,negative
565556.0,Benzinga's Top Pre-Market Losers,2013-06-18 08:25:00-04:00,GNMK,negative
565557.0,"Benzinga Market Primer: Tuesday, June 18",2013-06-18 06:20:00-04:00,GNMK,neutral
565558.0,US Stock Futures Up; Inflation Data In Focus,2013-06-18 06:19:00-04:00,GNMK,neutral
565559.0,"UPDATE: Genmark Cuts Annual Revenue Guidance, Shares Slide",2013-06-17 16:32:00-04:00,GNMK,neutral
565560.0,Genmark Lowers Annual Revenue Guidance to $30 Million From $35 Million Prior,2013-06-17 16:06:00-04:00,GNMK,negative
565561.0,Afternoon Market Losers,2013-06-12 14:10:00-04:00,GNMK,negative
565562.0,Mid-Afternoon Market Update: Markets Turn Red as Dole Offer Sends Shares Soaring,2013-06-11 15:20:00-04:00,GNMK,positive
565563.0,Afternoon Market Losers,2013-06-11 13:24:00-04:00,GNMK,negative
565564.0,"GenMark Diagnostics, Inc. Reports Q1 EPS of $(0.13) vs $(0.17) Est; Revenue of $11.10M vs $9.53M Est",2013-05-08 17:25:00-04:00,GNMK,neutral
565565.0,"Cowen & Company Initiates Coverage on GenMark Diagnostics, Inc. at Outperform",2013-04-22 08:20:00-04:00,GNMK,neutral
565566.0,"Canaccord Genuity Maintains Buy on GenMark Diagnostics, Inc., Raises PT to $18.00",2013-04-15 10:55:00-04:00,GNMK,neutral
565567.0,UPDATE: J.P. Morgan Raises PT on GenMark Diagnostics on Strong 4Q12 Revenue,2013-03-13 12:18:00-04:00,GNMK,positive
565568.0,"JP Morgan Maintains Overweight on GenMark Diagnostics, Inc., Raises PT to $13.00",2013-03-13 08:27:00-04:00,GNMK,neutral
565569.0,"GenMark Diagnostics, Inc. Sees FY2013 Sales $35.0M vs $30.60M Est",2013-03-12 16:16:00-04:00,GNMK,neutral
565570.0,"GenMark Diagnostics, Inc. Reports Q4 EPS of $(0.15) vs $(0.21) Est",2013-03-12 16:16:00-04:00,GNMK,neutral
565571.0,"From Earlier: Raymond James Initiates Coverage on GenMark Diagnostics, Inc. at Outperform, Announces $12.00 PT",2012-12-21 11:00:00-05:00,GNMK,neutral
565572.0,Genmark Diagnostics Reports Q2 EPS $-0.26 vs $-0.27 Est; Revenues $3.61M vs $3.13M Est,2012-08-07 17:25:00-04:00,GNMK,neutral
565573.0,GenMark Diagnostics and Advanced Liquid Logic Finalize Technology and Collaboration Agreements to Develop an All-Digital Fully Integrated Diagnostic Platform   ,2012-07-31 09:02:00-04:00,GNMK,positive
565574.0,UPDATE: J.P. Morgan Initiates Coverage on GenMark Diagnostics,2012-07-12 10:09:00-04:00,GNMK,neutral
565575.0,"JP Morgan Initiates Coverage on Genmark Diagnostics at Overweight, Announces PT of $8",2012-07-12 05:53:00-04:00,GNMK,neutral
565576.0,Benzinga's Top Pre-Market Gainers,2012-06-21 08:08:00-04:00,GNMK,positive
565577.0,GenMark Diagnostics Announces Proposed Public Offering of 10M Shares,2012-06-19 16:20:00-04:00,GNMK,positive
565578.0,Top Narrow Based Indexes For June 12,2012-06-12 10:05:00-04:00,GNMK,positive
565579.0,GenMark Diagnostics Increases 2012 Revenue Guidance   ,2012-06-12 09:01:00-04:00,GNMK,neutral
565580.0,A Peek Into The Market Before The Trading Starts,2012-04-05 07:27:00-04:00,GNMK,neutral
565581.0,GenMark and Advanced Liquid Logic Enter into Agreement to Develop an All-Electronic Fully Integrated Diagnostic Platform   ,2012-04-05 06:43:00-04:00,GNMK,positive
565582.0,GenMark Diagnostics Appoints Richard B. Slansky Chief Financial Officer   ,2012-04-02 16:30:00-04:00,GNMK,neutral
565583.0,GenMark Submits Respiratory Viral Panel Test for FDA 510(k) Clearance,2011-12-21 14:56:00-05:00,GNMK,neutral
565584.0,GenMark Diagnostics Gas Reports Q2 EPS $(0.39) vs $(0.53) Est; Revenues $901K vs $860.00K Est,2011-08-05 07:16:00-04:00,GNMK,neutral
565585.0,GenMark Diagnostics Trading Over 40% Higher ,2011-06-17 09:39:00-04:00,GNMK,neutral
565586.0,UPDATE: GenMark Pricing Public Offering of 7.07M Shares at $4.25,2011-06-17 08:33:00-04:00,GNMK,positive
565587.0,GenMark Pricing Public Offering of 7.07M Shares at $4.25   ,2011-06-17 08:31:00-04:00,GNMK,positive
565588.0,William Blair & Co. Initiates Outperform Rating on GenMark Diagnostics (GNMK),2010-07-12 09:59:00-04:00,GNMK,neutral
