Unnamed: 0,title,date,stock,sentiment
725747.0,Kinross Gold Reports Sold 10.925M Shares In Pinecrest Resources At C$0.36/Share For Gross Proceeds ~C$3.9M,2020-06-09 09:10:00-04:00,KGC,negative
725748.0,9 Basic Materials Stocks Moving In Thursday's Pre-Market Session,2020-06-04 07:41:00-04:00,KGC,neutral
725749.0,Kinross Announces Suspension Of Strike At Tasiast Mine,2020-05-22 09:00:00-04:00,KGC,negative
725750.0,Stocks That Hit 52-Week Highs On Wednesday,2020-05-20 10:38:00-04:00,KGC,neutral
725751.0,Stocks That Hit 52-Week Highs On Tuesday,2020-05-19 10:43:00-04:00,KGC,neutral
725752.0,"Shares of several precious metals companies are trading higher amid market uncertainty as Fed Chair Powell and Treasury Secretary Mnuchin testify on the CARES act. Gold and silver have been seen as 'safe haven' assets amid the coronavirus pandemic, which has caused global recession fears. While some US states begin to reopen, fears of a recession and a resurgence in cases have been potential positive catalysts for gold.",2020-05-19 10:42:00-04:00,KGC,positive
725753.0,Stocks That Hit 52-Week Highs On Monday,2020-05-18 10:44:00-04:00,KGC,neutral
725754.0,"Shares of several precious metals companies are trading higher amid market uncertainty following a drop in US retail sales and US-China tensions, which have made equities volatile for the session.",2020-05-15 11:23:00-04:00,KGC,negative
725755.0,Stocks That Hit 52-Week Highs On Friday,2020-05-15 10:33:00-04:00,KGC,neutral
725756.0,Shares of several precious metals companies are trading higher amid weakness in equities. Uncertainty surrounding the outlook in coronavirus cases after WHO released comments on the coronavirus has potentially driven investors to 'safe-haven' assets.,2020-05-14 13:19:00-04:00,KGC,positive
725757.0,Stocks That Hit 52-Week Highs On Thursday,2020-05-14 10:35:00-04:00,KGC,neutral
725758.0,"CIBC Maintains Outperformer on Kinross Gold, Raises Price Target to $9",2020-05-12 10:51:00-04:00,KGC,neutral
725759.0,"Shares of several gold companies are trading higher. Despite market strength, global uncertainty still persists amid the coronavirus outbreak and high US unemployment figures.",2020-05-07 14:04:00-04:00,KGC,negative
725760.0,Shares of several precious metals companies are trading lower amid strength in equities. News of some US states easing lockdown restrictions has raised hopes of a rebound in economic activity and moved stocks higher for the session.,2020-05-06 14:00:00-04:00,KGC,positive
725761.0,"Kinross Gold Q1 EPS $0.100 Beats $0.080 Estimate, Production ~567K Gold Equivalent Oz.",2020-05-05 17:04:00-04:00,KGC,neutral
725762.0,"Shares of several precious metals companies are trading higher amid market uncertainty, driven by investor concerns of US-China tensions and the reopenings of some US states.",2020-05-04 13:06:00-04:00,KGC,positive
725763.0,Shares of several precious metals companies are trading higher as equities gain driven by a rebound in oil.,2020-04-23 10:41:00-04:00,KGC,positive
725764.0,Stocks That Hit 52-Week Highs On Thursday,2020-04-23 10:41:00-04:00,KGC,neutral
725765.0,Shares of several gold and silver companies are trading higher as equities gain amid oil prices potentially stabilizing following the recent crash.,2020-04-22 10:22:00-04:00,KGC,positive
725766.0,Stocks That Hit 52-Week Highs On Wednesday,2020-04-22 10:20:00-04:00,KGC,neutral
725767.0,8 Basic Materials Stocks Moving In Monday's Pre-Market Session,2020-04-20 07:37:00-04:00,KGC,neutral
725768.0,20 Basic Materials Stocks Moving In Friday's Pre-Market Session,2020-04-17 07:45:00-04:00,KGC,neutral
725769.0,"Shares of several gold companies are trading lower as equities fall amid mixed earnings results from banks, a significant decline in the price of oil and worse than expected retail sales in March.",2020-04-15 09:02:00-04:00,KGC,negative
725770.0,Stocks That Hit 52-Week Highs On Tuesday,2020-04-14 10:31:00-04:00,KGC,neutral
725771.0,Shares of several precious metals companies are trading higher amid weakness in equities. Uncertainty surrounding the outlook in coronavirus cases and the reopening of the economy has potentially driven investors to 'safe-haven' assets.,2020-04-13 11:37:00-04:00,KGC,positive
725772.0,Shares of several gold stocks are trading higher amid overall market strength after the US Federal Reserve announced a further $2.3 trillion in financing programs to support the economy.,2020-04-09 11:49:00-04:00,KGC,positive
725773.0,"Shares of several previous metals companies are trading higher. Strength potentially related to overall market volatility, as the coronavirus pandemic has caused weakness in equities, which has increased investor interest in safe-haven assets. Many company shares have reversed and are now trading lower.",2020-04-03 10:01:00-04:00,KGC,positive
725774.0,Shares of several precious metals companies are trading higher amid mixed performance in equities. US jobs data and market uncertainty have potentially been a positive catalyst for safe-haven assets such as previous metals.,2020-04-02 10:12:00-04:00,KGC,positive
725775.0,"Shares of several precious metals companies are trading higher amid weakness in equities. The coronavirus pandemic has caused economic disruption and geopolitical uncertainty, potentially leading investors to 'safe-haven' assets.",2020-04-01 12:04:00-04:00,KGC,neutral
725776.0,"Shares of several precious metals companies are trading higher amid global market volatility. The global spread of the coronavirus has caused economic disruption and negatively impacted equities, potentially leading investors to 'safe-haven' assets.",2020-03-23 13:54:00-04:00,KGC,positive
725777.0,"Shares of several basic materials companies are trading higher. The Federal Reserve on Monday Morning announced new stimulus measures, which has moved stocks higher. Basic materials demand outlook has been pressured by global economic disruption.",2020-03-23 09:19:00-04:00,KGC,negative
725778.0,130 Biggest Movers From Yesterday,2020-03-18 06:06:00-04:00,KGC,neutral
725779.0,94 Stocks Moving In Tuesday's Mid-Day Session,2020-03-17 12:41:00-04:00,KGC,neutral
725780.0,"Shares of several gold and silver companies are trading higher. The coronavirus outbreak has led to a steep dip in equities recently, potentially driving investors to safe-haven assets such as precious metals.",2020-03-16 12:37:00-04:00,KGC,positive
725781.0,"Shares of several precious metal stocks are trading lower amid a decline in the price of several metals including silver and gold. UPDATE: Shares have since reversed, now higher.",2020-03-16 08:10:00-04:00,KGC,positive
725782.0,144 Biggest Movers From Friday,2020-03-16 05:03:00-04:00,KGC,neutral
725783.0,Shares of several precious metals companies are trading lower amid global market volatility due to the coronavirus spread. Equities are rebounding for the session following Thursday's crash.,2020-03-13 14:36:00-04:00,KGC,positive
725784.0,10 Basic Materials Stocks Moving In Thursday's Pre-Market Session,2020-03-12 08:34:00-04:00,KGC,neutral
725785.0,Kinross Gold Says Coronavirus Has Not Impacted Production Or Product Shipments,2020-03-11 17:32:00-04:00,KGC,neutral
725786.0,Kinross Gold Says Closed Toronto Office Wed. After Employee Tested Positive For Coronavirus,2020-03-11 17:32:00-04:00,KGC,positive
725787.0,Shares of several gold and silver companies are trading higher. Gold prices spiked after the Federal Reserve announced a surprise 50 bps rate cut as investors may be attracted to gold as a hedge against potential inflation.,2020-03-03 10:39:00-05:00,KGC,positive
725788.0,Kinross Issues Press Release Highlighting Moody's Upgraded Co. Credit Rating To Investment Grade,2020-03-03 09:04:00-05:00,KGC,positive
725789.0,Shares of several precious metals companies are trading higher as global markets continue to expect volatility amid the coronavirus spread.,2020-03-02 09:02:00-05:00,KGC,positive
725790.0,"Shares of several precious metals companies are trading lower, potentially as investors take profits following recent strength amid the selloff in equities. NOTE: Coronavirus fears still persist and equities continue to move lower amid concerns.",2020-02-28 09:10:00-05:00,KGC,positive
725791.0,Shares of several gold and silver companies are trading higher amid a dip in global equities on growing coronavirus fears.,2020-02-24 08:56:00-05:00,KGC,neutral
725792.0,21 Basic Materials Stocks Moving In Monday's Pre-Market Session,2020-02-24 07:24:00-05:00,KGC,neutral
725793.0,Shares of several silver and gold companies are trading higher as continued coronavirus fears push up precious metals prices. NOTE: Precious metals are seen as 'safe-haven' assets and may attract investors during periods of market volatility.,2020-02-21 11:22:00-05:00,KGC,positive
725794.0,Stocks That Hit 52-Week Highs On Friday,2020-02-21 10:26:00-05:00,KGC,neutral
725795.0,6 Basic Materials Stocks Moving In Friday's Pre-Market Session,2020-02-21 07:45:00-05:00,KGC,neutral
725796.0,Stocks That Hit 52-Week Highs On Thursday,2020-02-20 10:26:00-05:00,KGC,neutral
725797.0,"Shares of several silver and gold companies are trading higher as investors still see a demand for safe-haven assets following weakness in the overall market potentially related to continued coronavirus fears as well as reports suggesting the US is weighing trade restrictions on China. NOTE: Precious metals are seen as safe-haven assets, which are typically used as insurance against volatile market action and uncertainty.",2020-02-18 10:45:00-05:00,KGC,positive
725798.0,7 Ways To Invest In Gold Amid Coronavirus Fears,2020-02-14 16:38:00-05:00,KGC,negative
725799.0,"Shares of several silver and gold companies are trading higher as investors still see a demand for safe-haven assets following renewed Coronavirus fears as the number of new confirmed cases in China increased. NOTE: Precious metals are seen as safe-haven assets, which are typically used as insurance against volatile market action and uncertainty.",2020-02-13 11:07:00-05:00,KGC,positive
725800.0,"Kinross Gold Reports Added 7.7M Gold Oz. To Estimated Measure, Indicated Resources; Co. To Proceed With La Coipa Restart Project In Chile",2020-02-12 17:02:00-05:00,KGC,neutral
725801.0,"Kinross Gold Q4 Adj. EPS $0.13 Beats $0.1 Estimate, Sales $996.2M Beat $988.82M Estimate",2020-02-12 17:01:00-05:00,KGC,neutral
725802.0,"Earnings Scheduled For February 12, 2020",2020-02-12 04:22:00-05:00,KGC,neutral
725803.0,"Shares of several gold companies are trading higher as markets rebound, potentially leading investors to rotate out of safe-haven assets.",2020-02-04 10:46:00-05:00,KGC,positive
725804.0,5 Basic Materials Stocks Moving In Monday's Pre-Market Session,2020-02-03 08:01:00-05:00,KGC,neutral
725805.0,"Credit Suisse Reinstates Neutral on Kinross Gold, Announces $5.25 Price Target",2020-01-23 06:57:00-05:00,KGC,positive
725806.0,Shares of precious metals companies are trading lower amid optimism in equities ahead of the expected signing of a US-China Phase 1 trade deal this week and deescalation in Middle East.,2020-01-13 10:43:00-05:00,KGC,positive
725807.0,"Shares of precious metals companies are trading higher on geopolitical volatility amid US-Iran tensions this past week. While tensions appear to have de-escalated, uncertainty remains amid investigations into a downed Ukrainian passenger jet in Iran.",2020-01-10 11:00:00-05:00,KGC,negative
725808.0,Shares of precious metals companies are trading lower as trader ease concerns of escalation in the Middle East.,2020-01-08 11:45:00-05:00,KGC,positive
725809.0,17 Basic Materials Stocks Moving In Monday's Pre-Market Session,2020-01-06 07:47:00-05:00,KGC,neutral
725810.0,Shares of several gold & silver stocks are trading higher after the U.S. confirmed an airstrike that killed a top Iranian commander. Investors are looking for safe-haven stocks as the death of Soleimani has raised geopolitical concerns in the Middle East.,2020-01-03 08:26:00-05:00,KGC,negative
725811.0,20 Stocks Moving in Monday's Pre-Market Session,2019-12-23 07:44:00-05:00,KGC,neutral
725812.0,"RBC Capital Assumes Kinross Gold at Sector Perform, Announces $5 Price Target",2019-12-05 07:07:00-05:00,KGC,neutral
725813.0,Kinross Gold Sells Royalty Portfolio To Maverix Metals For $74M,2019-12-02 08:37:00-05:00,KGC,neutral
725814.0,94 Biggest Movers From Yesterday,2019-11-08 06:01:00-05:00,KGC,neutral
725815.0,75 Stocks Moving In Thursday's Mid-Day Session,2019-11-07 12:19:00-05:00,KGC,neutral
725816.0,Kinross Gold shares are trading lower after the company reported worse-than-expected Q3 sales results.,2019-11-07 08:34:00-05:00,KGC,neutral
725817.0,"Kinross Gold Q3 EPS $0.08, Inline, Sales $877.1M Miss $878.78M Estimate",2019-11-06 17:25:00-05:00,KGC,negative
725818.0,Shares of silver and gold companies are trading lower as US-China trade tensions ease.,2019-11-05 09:19:00-05:00,KGC,negative
725819.0,"Shares of several gold and silver companies shares are trading lower as the U.S. and China progress in trade talks. Investors are also being cautious ahead of this week's Federal Reserve meeting. Gold and silver are safe-haven assets, which usually rise during times of economic uncertainty and downturn.",2019-10-28 10:16:00-04:00,KGC,positive
725820.0,"Shares of precious metals companies are trading higher amid global macro uncertainties such as Brexit, mixed US earnings and US-China trade talks. Gold companies may also be trading in sympathy with Yamana following strong Q3 results.",2019-10-25 10:15:00-04:00,KGC,positive
725821.0,"Shares of several gold and silver companies are trading higher amid investors looking for a safe haven asset to avoid Brexit tensions after the EU delayed a decision on granting an extension to Britain, US-China trade tension and weak US earnings.",2019-10-24 13:37:00-04:00,KGC,negative
725822.0,"Shares of several gold companies are trading higher amid the uncertainty over Britain's upcoming exit from the European Union. There are also concerns over a slowdown in the global technology sector, which has heavily weighed on stocks.",2019-10-23 10:28:00-04:00,KGC,negative
725823.0,Shares of several gold companies are trading higher amid strength in gold prices.,2019-10-17 11:59:00-04:00,KGC,positive
725824.0,"Shares of several gold & several silver companies are trading lower on renewed US-China trade optimism. NOTE: Precious metals are seen safe haven assets, which are typically used as insurance against volatile market action and uncertainty.",2019-10-15 15:28:00-04:00,KGC,positive
725825.0,"Shares of several gold & several silver companies are trading lower on renewed US-China trade optimism. NOTE: Precious metals are seen safe haven assets, which are typically used as insurance against volatile market action and uncertainty.",2019-10-11 10:52:00-04:00,KGC,positive
725826.0,"Shares of several silver and gold companies are trading higher as investors still see a demand for safe-haven assets after optimism around the upcoming U.S.-China trade talks waned. NOTE: Precious metals are seen as safe-haven assets, which are typically used as insurance against volatile market action and uncertainty.",2019-10-08 10:56:00-04:00,KGC,positive
725827.0,Shares of several gold companies are trading higher following worse-than-expected US PMI data.,2019-10-01 10:49:00-04:00,KGC,positive
725828.0,Shares of several gold and silver companies are trading lower amid strength in the US dollar.,2019-09-30 09:39:00-04:00,KGC,positive
725829.0,Shares of several silver & gold companies are trading lower amid weakness in silver & gold prices.,2019-09-27 09:59:00-04:00,KGC,negative
725830.0,Shares of several gold companies are trading lower amid weakness in gold prices.,2019-09-25 11:32:00-04:00,KGC,negative
725831.0,Shares of several gold and silver companies are trading higher in sympathy with the prices of gold and silver. The increase in prices could potentially be due to lower interest rates and global growth concerns.,2019-09-23 10:59:00-04:00,KGC,positive
725832.0,"Shares of several silver and gold companies are trading higher as investors still see a demand for safe-haven assets after Iran threatens 'all-out war' if military aggression is taken against Iran following the US hinting that Tehran was behind the drone attack on a oil field in Saudi Arabia. NOTE: There is still uncertainty around who is behind the attack and what, if any, actions will be taken.",2019-09-19 10:38:00-04:00,KGC,negative
725833.0,"Shares of several silver and gold companies are trading higher as investors still see a demand for safe-haven assets after a recent drone strike on oil fields in Saudi Arabia. NOTE: There is still uncertainty around who is behind the attack and what, if any, actions will be taken.",2019-09-17 10:35:00-04:00,KGC,negative
725834.0,"Shares of several gold and several silver companies are trading higher amid heightened tensions after an attack on a Saudi Arabian oil field. NOTE: Precious metals are seen safe haven assets, which are typically used as insurance against volatile market action and uncertainty.",2019-09-16 09:22:00-04:00,KGC,positive
725835.0,"Citigroup Maintains Neutral on Kinross Gold, Raises Price Target to $5",2019-09-11 08:05:00-04:00,KGC,neutral
725836.0,"Shares of several gold & several silver companies are trading lower on renewed US-China trade optimism. Precious metals are seen safe haven assets, which are typically used as insurance against volatile market action and uncertainty.",2019-09-05 09:50:00-04:00,KGC,positive
725837.0,Shares of several gold companies are trading higher amid heightened US-China trade tensions after Trump added a 15% tariff on $112 billion worth of Chinese goods on Sunday. Concerns of a trade war have led investors into 'safe-haven' assets such as gold.,2019-09-03 11:58:00-04:00,KGC,negative
725838.0,28 Stocks Moving in Friday's Pre-Market Session,2019-08-30 08:10:00-04:00,KGC,neutral
725839.0,Shares of several gold & several silver companies are trading higher on renewed escalation on the trade tension between the U.S.-China. Precious metals are safe-haven assets which are typically used as insurance against volatile market action.,2019-08-27 13:51:00-04:00,KGC,positive
725840.0,60 Biggest Movers From Friday,2019-08-26 05:08:00-04:00,KGC,neutral
725841.0,42 Stocks Moving In Friday's Mid-Day Session,2019-08-23 14:14:00-04:00,KGC,neutral
725842.0,Shares of many gold companies are trading higher on escalated trade tensions after China retaliated with tariffs on $75 billion worth of U.S goods. Precious metals are safe-haven assets which are typically used as insurance against market volatility.,2019-08-23 11:13:00-04:00,KGC,positive
725843.0,Shares of several gold & several silver companies are trading lower on renewed optimism of a resolution to the U.S.-China trade war. Precious metals are safe haven assets which are typically used as insurance against volatile market action.,2019-08-19 10:21:00-04:00,KGC,positive
725844.0,Shares of several gold companies are trading lower following a renewed optimism surrounding US-China trade talk after President Trump announced earlier in the week that he would delay additional tariffs on Chinese goods until December.,2019-08-16 11:43:00-04:00,KGC,positive
725845.0,"Shares of several gold companies are trading higher after the spread between the 2-year and 10-year yield curve inverted, potentially signaling a recession. Gold is a safe haven asset, which is used as a form of insurance against economic events.",2019-08-14 09:44:00-04:00,KGC,positive
725846.0,"Shares of gold companies are trading lower as gold prices dip after the US agreed to delay China tariffs, pushing US stocks higher and decreasing the demand safe-haven assets like gold.",2019-08-13 10:23:00-04:00,KGC,positive
725847.0,Shares of several gold companies are trading lower at what looks to be a potential pullback following the sector witnessing growth over the last months.,2019-08-09 13:44:00-04:00,KGC,positive
725848.0,"Shares of several gold and silver companies are trading higher as gold prices rise, contrasting the overall negative sentiment of the market.",2019-08-07 10:16:00-04:00,KGC,negative
725849.0,Stocks That Achieved 52-Week Highs Monday Morning,2019-08-05 12:40:00-04:00,KGC,neutral
725850.0,Shares of several gold companies are trading higher amid heightened US-China trade tensions. Concerns of a trade war have led investors into 'safe-haven' assets such as gold.,2019-08-05 09:41:00-04:00,KGC,negative
725851.0,Stocks that Broke Yearly Highs Friday Morning,2019-08-02 10:36:00-04:00,KGC,negative
725852.0,100 Biggest Movers From Yesterday,2019-08-02 05:53:00-04:00,KGC,neutral
725853.0,"Kinross Gold Q2 EPS $0.06 Beats $0.03 Estimate, Sales $837.8M Beat $816.71M Estimate",2019-07-31 17:44:00-04:00,KGC,neutral
725854.0,Earnings Preview: Kinross Gold,2019-07-31 08:14:00-04:00,KGC,neutral
725855.0,Shares of several mining companies are trading lower amid broad-based weakness in precious metals. Newmont Goldcorp also reported weak Q2 EPS and sales results earlier today.,2019-07-25 14:21:00-04:00,KGC,negative
725856.0,Shares of several gold companies are trading higher as gold prices rise following a Federal Reserve statement implying the Fed could further cut rates to sustain expansion. The Fed's Powell also expressed concern about increased uncertainties.,2019-07-10 09:28:00-04:00,KGC,negative
725857.0,Shares of several gold and silver mining companies are trading lower as the US dollar strengthens following a strong US jobs report.,2019-07-05 09:57:00-04:00,KGC,positive
725858.0,"Shares of several gold and silver mining companies are trading higher amid strength in gold prices. Gold shares passed the $1,400/oz level today.",2019-07-02 14:30:00-04:00,KGC,positive
725859.0,Shares of several gold and silver companies are trading higher as gold prices rise amid weakness in the US dollar due to the renewed possibility of a Fed rate cut. Growing instability in the Middle East has also lead some investors to safe-haven assets.,2019-06-24 09:38:00-04:00,KGC,negative
725860.0,26 Stocks Moving In Friday's Pre-Market Session,2019-06-14 08:01:00-04:00,KGC,neutral
725861.0,"Shares of several gold companies are trading higher as renewed speculation of a Fed rate cut has weighed on the US dollar, leading to strength in gold prices.",2019-06-12 12:34:00-04:00,KGC,positive
725862.0,"Shares of several gold companies are trading higher as gold prices rise amid ongoing global trade concerns. Many investors are worried that US trade tensions with Mexico and China could hurt the global economy, pushing up demand for a 'safe-haven' asset.",2019-06-03 09:50:00-04:00,KGC,negative
725863.0,"Benzinga's Top Upgrades, Downgrades For May 30, 2019",2019-05-30 08:55:00-04:00,KGC,positive
725864.0,JP Morgan Downgrades Kinross Gold to Underweight,2019-05-30 07:49:00-04:00,KGC,positive
725865.0,Kinross Gold shares are trading higher after the company reported better-than-expected Q1 EPS results.,2019-05-08 10:15:00-04:00,KGC,positive
725866.0,"Kinross Gold Q1 Adj. EPS $0.07 Beats $0.02 Estimate, Sales $786.2M Miss $797.5M Estimate",2019-05-07 17:06:00-04:00,KGC,negative
725867.0,"Kinross Q1 Gold Equivalent Production 606K Oz., Production Cost Of Sales $682/Gold Equivalent Oz., Capex $264.8M",2019-05-07 17:05:00-04:00,KGC,neutral
725868.0,"Earnings Scheduled For May 7, 2019",2019-05-07 05:03:00-04:00,KGC,neutral
725869.0,"Shares of several companies in the gold sector are trading higher. Gold prices may be getting pushed higher by the Federal Reserve's pause in rate raises, economic uncertainty surrounding US-China talks and increased gold buying by central banks.",2019-05-03 11:29:00-04:00,KGC,positive
725870.0,Shares of several gold-related companies are trading higher as gold prices rise amid a pullback in the dollar and declining longer-term bond yields in the US and Eurozone.,2019-04-26 10:39:00-04:00,KGC,positive
725871.0,Shares of several gold stocks are trading lower as gold prices fall amid continued strength in equities and the US dollar.,2019-04-16 12:12:00-04:00,KGC,positive
725872.0,"Kinross Gold Reports COO Lauren Roberts, Senior VP, Human Resources, Gina Jardine, Leaving Co.",2019-04-16 09:02:00-04:00,KGC,neutral
725873.0,Shares of several gold mining stocks are trading lower amid weakness in gold prices.,2019-04-11 11:38:00-04:00,KGC,negative
725874.0,26 Stocks Moving In Wednesday's Pre-Market Session,2019-04-10 08:05:00-04:00,KGC,neutral
725875.0,Shares of several gold stocks are trading lower as gold prices fall due to strength in the dollar.,2019-03-28 10:45:00-04:00,KGC,positive
725876.0,"Shares of several gold-related stocks are trading higher as equities fall after the United States announced only 20,000 jobs were created in February; economists estimated 180,000 jobs were to be created in February.",2019-03-08 13:55:00-05:00,KGC,positive
725877.0,"Kinross Gold Reports CFO Tony Giardini Leaving Co., Names Andrea Freeborough Replacement",2019-03-04 17:05:00-05:00,KGC,neutral
725878.0,Merger Mania Could Be Golden For Miner ETFs,2019-02-24 14:11:00-05:00,KGC,neutral
725879.0,"Kinross Gold Sees FY19 Gold Equivalent Production 2.5M Oz. +/- 5%, Production Cost Of Sales $730/Gold Equivalent Oz., Capex $1.05B",2019-02-13 17:07:00-05:00,KGC,neutral
725880.0,"Kinross FY18 Gold Equivalent Production 2.45M Oz., Production Cost Of Sales $734/Gold Equivalent Oz., Capex $1.043B",2019-02-13 17:05:00-05:00,KGC,neutral
725881.0,"Kinross Gold Q4 EPS $0.01, Same YoY",2019-02-13 17:04:00-05:00,KGC,neutral
725882.0,Several gold stocks are trading higher amid strength in the underlying commodity.,2018-12-24 09:35:00-05:00,KGC,positive
725883.0,60 Biggest Movers From Yesterday,2018-12-21 05:11:00-05:00,KGC,neutral
725884.0,Many gold stocks are trading higher in response to a significant move higher in gold prices following the Federal Reserve decision to raise interest rates Wednesday.,2018-12-20 08:57:00-05:00,KGC,positive
725885.0,35 Stocks Moving In Thursday's Pre-Market Session,2018-11-08 08:02:00-05:00,KGC,neutral
725886.0,"Kinross Gold Corporation Q3 EPS $(0.04) Down From $0.07 YoY, Sales $753.9M Miss $787.39M Estimate",2018-11-07 17:54:00-05:00,KGC,negative
725887.0,"Stocks Which Set New 52-Week Low Yesterday, October 29th",2018-10-30 12:40:00-04:00,KGC,negative
725888.0,22 Stocks Moving In Monday's Pre-Market Session,2018-10-15 08:07:00-04:00,KGC,neutral
725889.0,20 Stocks Moving In Friday's Pre-Market Session,2018-10-12 08:20:00-04:00,KGC,neutral
725890.0,"Barclays Earlier Initiated Coverage On Kinross Gold with Overweight Rating, Announced $4 Price Target",2018-10-10 11:36:00-04:00,KGC,negative
725891.0,"Stocks Which Set New 52-Week Low Yesterday, September 11th",2018-09-12 15:29:00-04:00,KGC,negative
725892.0,"Stocks Which Set New 52-Week Low Friday, September 7th",2018-09-10 16:38:00-04:00,KGC,negative
725893.0,"Credit Suisse Reinstates Neutral on Kinross Gold, Announces $4",2018-09-06 08:54:00-04:00,KGC,positive
725894.0,"Benzinga's Top Upgrades, Downgrades For August 20, 2018",2018-08-20 08:53:00-04:00,KGC,positive
725895.0,RBC Capital Downgrades Kinross Gold to Sector Perform,2018-08-20 06:46:00-04:00,KGC,neutral
725896.0,"Stocks Which Set New 52-Week Low Yesterday, August 15th",2018-08-16 11:15:00-04:00,KGC,negative
725897.0,"Stocks Which Set New 52-Week Low Yesterday, August 9th",2018-08-10 10:05:00-04:00,KGC,negative
725898.0,"Stocks Which Set New 52-Week Low Yesterday, August 8th",2018-08-09 11:10:00-04:00,KGC,negative
725899.0,"Stocks Which Set New 52-Week Low Yesterday, August 7th",2018-08-08 11:06:00-04:00,KGC,negative
725900.0,"Stocks Which Set New 52-Week Low Yesterday, August 2nd",2018-08-03 11:22:00-04:00,KGC,negative
725901.0,Kinross Gold Q2 Production 602.05K Gold Equivalent Oz.,2018-08-01 17:07:00-04:00,KGC,neutral
725902.0,"Kinross Gold Q2 EPS $0.03, Inline, Sales $775M May Not Compare $825.07M Estimate",2018-08-01 17:06:00-04:00,KGC,neutral
725903.0,"Kinross Gold Late Tuesday Reported Q1 EPS $0.10 Beat $0.04 Estimate, Sales $897.2M Beat $828.03M Estimate",2018-05-09 09:05:00-04:00,KGC,neutral
725904.0,BMO Capital Downgrades Kinross Gold Corporation Common Stock to Market Perform,2018-04-10 09:12:00-04:00,KGC,neutral
725905.0,Kinross Gold Announces That Its Russia Operations Remain Unaffected By U.S. Sanctions,2018-04-09 16:48:00-04:00,KGC,neutral
725906.0,SEC Says Kinross Gold Charged With FCPA Violations,2018-03-26 13:00:00-04:00,KGC,negative
725907.0,Kinross Adopts New Shareholder Rights Plan,2018-03-15 17:06:00-04:00,KGC,positive
725908.0,Kinross Gold F-10 Filing Shows Registration For $1B Mixed Securities Shelf Offering,2018-03-06 10:39:00-05:00,KGC,positive
725909.0,Kinross Acquires 2 Hydroelectric Power Plants In Brazil From Gerdau SA For $257M,2018-02-14 17:14:00-05:00,KGC,neutral
725910.0,Kinross Sees FY18 Production Of 2.5M Au eq. oz. At A Production Sales Cost Per Au eq. oz. Of $730,2018-02-14 17:08:00-05:00,KGC,neutral
725911.0,"Kinross Reports Q4 EPS $0.01 vs $0.03 Est., Sales $810.3M vs $870M Est.",2018-02-14 17:07:00-05:00,KGC,neutral
725912.0,Kinross Gold's Q4 Earnings Preview,2018-02-14 10:24:00-05:00,KGC,neutral
725913.0,"Earnings Scheduled For February 14, 2018",2018-02-14 04:07:00-05:00,KGC,neutral
725914.0,Seeing Notable Block Trade In Kinross Gold Of 1M Shares At $4.46/Share,2018-01-17 14:16:00-05:00,KGC,negative
725915.0,"UPDATE: Kinross Gold Says As A Result Of Gaining Gilmore Mineral Rights, Added 2.1M Gold Oz. In Estimated Measured, Indicated Resources",2017-12-12 17:03:00-05:00,KGC,positive
725916.0,"Kinross Gold Reports Gaining Of Mineral Rights To Gilmore, 709-Acre Parcel Of Land Located West Of Its Fort Knox Mine In Alaska",2017-12-12 17:02:00-05:00,KGC,positive
725917.0,"Benzinga's Top Upgrades, Downgrades For November 10, 2017",2017-11-10 09:30:00-05:00,KGC,positive
725918.0,Macquarie Upgrades Kinross Gold Corporation Common Stock to Outperform,2017-11-10 06:59:00-05:00,KGC,neutral
725919.0,"Kinross Reports Q3 Adj. EPS $0.07 vs. $0.10 In Same Qtr. Last Year, Sales $828M vs. $910.2M YoY",2017-11-08 17:17:00-05:00,KGC,neutral
725920.0,"Earnings Scheduled For November 8, 2017",2017-11-08 04:11:00-05:00,KGC,neutral
725921.0,25 Stocks Moving In Friday's Pre-Market Session,2017-09-08 08:05:00-04:00,KGC,neutral
725922.0,Citi Digs Up A Neutral Rating For Kinross Gold,2017-09-05 12:34:00-04:00,KGC,neutral
725923.0,"Benzinga's Top Upgrades, Downgrades For September 1, 2017",2017-09-01 09:21:00-04:00,KGC,positive
725924.0,20 Stocks Moving In Friday's Pre-Market Session,2017-09-01 08:02:00-04:00,KGC,neutral
725925.0,Citigroup Upgrades Kinross Gold Corporation Common Stock to Neutral,2017-09-01 07:38:00-04:00,KGC,neutral
725926.0,25 Stocks Moving In Tuesday's Pre-Market Session,2017-08-29 08:07:00-04:00,KGC,neutral
725927.0,"Kinross Reports Q2 Adj. EPS $0.04 vs $0.02 Est., Sales $868.6M vs $828M Est.",2017-08-02 17:02:00-04:00,KGC,neutral
725928.0,"Raymond James Reinstates Outperform on Kinross Gold Corporation Common Stock, Announces $6.00",2017-06-15 08:17:00-04:00,KGC,neutral
725929.0,"Some Gold Stocks Under Pressure Premarket: Gold Fields Indicated Down 5.7%, Sibanye Gold Down 3.6%, Harmony Gold Down 1.4%, AngloGold Ashanti Down 1.3%, Newmont Down 1%, Barrick Down 0.4%,",2017-05-25 09:14:00-04:00,KGC,positive
725930.0,CIBC Upgrades Kinross Gold Corporation Common Stock to Outperform,2017-05-03 07:40:00-04:00,KGC,neutral
725931.0,"Kinross Gold Reports Q1 Adj. EPS $0.02, Sales $796.1M",2017-05-02 17:04:00-04:00,KGC,neutral
725932.0,"Earnings Scheduled For May 2, 2017",2017-05-02 04:31:00-04:00,KGC,neutral
725933.0,"UPDATE: Goldcorp, Barrick Deal Includes Purchase by Goldcorp of Exeter Resource and 100%-Owned Caspiche Project in Maricunga Gold Belt for ~$185M",2017-03-28 07:56:00-04:00,KGC,neutral
725934.0,"UPDATE: Goldcorp Deal with Kinross Also Includes $40M Contingent Payment Payable After Construction Decision at Cerro Casale, Assumption of $20M Obligation to Pay Barrick on Commercial Production",2017-03-28 07:55:00-04:00,KGC,negative
725935.0,"UPDATE: Goldcorp Will Buy Kinross Gold's 25% Interest in Cerro Casale, 100% Interest in Quebrada Seca Exploration Project for Initial Cash Payment of $260M, 1.25% Royalty Interest on 25% of Gross Sales from Payable Metal from Cerro, Quebrada",2017-03-28 07:54:00-04:00,KGC,positive
725936.0,"UPDATE: Goldcorp, Barrick Consolidation Being Effected by 4 Steps",2017-03-28 07:52:00-04:00,KGC,neutral
725937.0,Kinross announces sale of Cerro Casale interest For $260M Cash and $40M Cash Payable Following Construction Decision For Cerro Casale,2017-03-28 07:51:00-04:00,KGC,positive
725938.0,Kinross Sees FY17 Production Of 2.5 - 2.7 million Au eq. oz. At Cost of Sale $660 - $720/ Au eq. oz.,2017-02-15 17:01:00-05:00,KGC,neutral
725939.0,"Kinross Gold Reports Q4 Adj. EPS $(0.04) vs. $0.01 Est., Rev. $902.8M vs. $838M Est.",2017-02-15 17:00:00-05:00,KGC,neutral
725940.0,"Earnings Scheduled For February 15, 2017",2017-02-15 04:45:00-05:00,KGC,neutral
725941.0,18 Stocks Moving In Friday's Pre-Market Session,2017-01-20 08:18:00-05:00,KGC,neutral
725942.0,20 Stocks Moving In Thursday's Pre-Market Session,2017-01-12 08:28:00-05:00,KGC,neutral
725943.0,"The Market In 5 Minutes: 'Rogue One', Bullish Commentary Pumps Disney Up",2016-12-19 09:03:00-05:00,KGC,neutral
725944.0,BMO Capital Downgrades Kinross Gold Corporation Common Stock to Market Perform,2016-12-19 06:30:00-05:00,KGC,neutral
725945.0,"Gold Mining Names Trading Down Premarket: AngloGold 5%, Harmony 5%, Gold Fields 4%, Randgold 4%, McEwen 4%, Kinross 4%, IAMGOLD 3%, NovaGold 3%, Barrick 3%, Royal 3%",2016-12-15 09:18:00-05:00,KGC,positive
725946.0,10 Biggest Mid-Day Losers For Monday,2016-12-05 13:01:00-05:00,KGC,negative
725947.0,Benzinga's Top Downgrades,2016-12-05 09:01:00-05:00,KGC,positive
725948.0,"The Market In 5 Minutes: Gold's New Market, Dakota Pipeline And A Nike Upgrade",2016-12-05 09:00:00-05:00,KGC,neutral
725949.0,18 Stocks Moving In Monday's Pre-Market Session,2016-12-05 08:29:00-05:00,KGC,neutral
725950.0,Citigroup Downgrades Kinross Gold Corporation Common Stock to Sell,2016-12-05 07:40:00-05:00,KGC,neutral
725951.0,16 Stocks Moving In Monday's Pre-Market Session,2016-11-28 08:24:00-05:00,KGC,neutral
725952.0,18 Biggest Mid-Day Losers For Wednesday,2016-11-23 13:06:00-05:00,KGC,negative
725953.0,"Worst Performing Industries For November 23, 2016",2016-11-23 11:22:00-05:00,KGC,negative
725954.0,"Basic Materials Stocks Down After Market Open: Eldorado Gold Down 7.8%, Haynes Intl Down 7.6%, DRD Gold Down 7.5%, Endeavour Silver Down 6.9%, Kinross Down 6.7%",2016-11-23 09:46:00-05:00,KGC,neutral
725955.0,What's Going On With Gold Today?,2016-11-09 12:39:00-05:00,KGC,neutral
725956.0,"Gold-Related Stocks Trading Up Pre Market Post Election: Harmony Gold, Gold Fields Up 10%, Sibanye Gold 9%, Kinross Gold, IAMGOLD, AngloGold Ashanti 8%, Yamana, Randgold Resources, Eldorado 7%, Goldcorp, Newmont 5.2%",2016-11-09 09:09:00-05:00,KGC,positive
725957.0,"Kinross Gold Reports Q3 Adj. EPS $0.10 vs $0.05 Est., Sales $910.2M vs $915.2M Est.",2016-11-02 17:00:00-04:00,KGC,neutral
725958.0,15 Stocks Moving In Wednesday's Pre-Market Session,2016-10-05 08:26:00-04:00,KGC,neutral
725959.0,Kinross Sells Portion of Lundin Gold Shares  For C$30.8M,2016-09-26 07:34:00-04:00,KGC,positive
725960.0,Berenberg Initiates Coverage on Kinross Gold at Hold,2016-09-07 06:37:00-04:00,KGC,neutral
725961.0,"Kinross Announces It Has Repaid $250M In Notes Due Sept 1, 2016",2016-09-01 17:00:00-04:00,KGC,neutral
725962.0,UPDATE: Kinross Says Maricunga Mine Has Been Placed Into Suspension,2016-08-25 17:02:00-04:00,KGC,neutral
725963.0,UPDATE: Kinross Gold Reports Normal Mining At Tasiast Mine Has Resumed Following Temp Suspension,2016-08-25 17:02:00-04:00,KGC,neutral
725964.0,UPDATE: Kinross Gold Says Co. Received Record of Decision on Bald Mountain Mine from Bureau of Land Mgmt to Allow for Increased Exploration Activities,2016-08-25 17:02:00-04:00,KGC,positive
725965.0,"Kinross Announces Operational Updates at Bald Mountain, Tasiast and Maricunga",2016-08-25 17:01:00-04:00,KGC,neutral
725966.0,UPDATE: Hearing Kinross Has Seen Strong Interest in Co.'s Chilean Gold Mine,2016-08-18 13:20:00-04:00,KGC,positive
725967.0,"Hearing Kinross Gold Could Retreat from Chile, Has Put Region's Assets on Sale",2016-08-18 13:19:00-04:00,KGC,positive
725968.0,All That Glitters Ain't Buy-Rated: Citi Goes Neutral On Gold,2016-08-02 14:56:00-04:00,KGC,neutral
725969.0,Citi Might Upgrade Kinross From Neutral If Mine-Life Were To Improve,2016-08-02 11:25:00-04:00,KGC,positive
725970.0,Watch These 10 Huge Put Purchases In Thursday Trade,2016-07-28 02:41:00-04:00,KGC,positive
725971.0,Kinross Reports Q2 EPS $(0.02) vs. Est. $0.01,2016-07-27 17:02:00-04:00,KGC,neutral
725972.0,Option Alert: KGC Aug16 4.5 Puts: 25000 @  Above Ask!  $0.20: 30k traded vs 11k OI:  Earnings today After Close  $4.87 Ref,2016-07-27 11:38:00-04:00,KGC,positive
725973.0,Jefferies Upgrades Kinross Gold to Hold,2016-07-14 06:31:00-04:00,KGC,neutral
725974.0,Retail And Commodities: Fast Money Picks For July 8,2016-07-08 06:43:00-04:00,KGC,neutral
725975.0,Mining The Metals Sector: Deutsche Bank Updates 3 Big Names,2016-07-06 10:25:00-04:00,KGC,neutral
725976.0,Option Alert: KGC Jul16 6.0 Calls Sweep: 2001 @  ASK  $0.15: 4112 traded vs 1742 OI:  Earnings 7/28 Before Open  $5.63 Ref,2016-07-06 10:05:00-04:00,KGC,positive
725977.0,"Deutsche Bank Upgrades Kinross Gold to Hold, Raises PT to $4.50",2016-07-06 06:49:00-04:00,KGC,neutral
725978.0,Mid-Afternoon Market Update: IntriCon Drops On Weak Forecast; Thor Industries Shares Spike Higher,2016-07-01 14:32:00-04:00,KGC,negative
725979.0,12 Biggest Mid-Day Gainers For Friday,2016-07-01 12:36:00-04:00,KGC,neutral
725980.0,EARLIER: Macquarie Upgrades Kinross Gold to Neutral,2016-07-01 11:15:00-04:00,KGC,neutral
725981.0,Mid-Morning Market Update: Markets Open Higher; Micron To Lower Jobs,2016-07-01 10:11:00-04:00,KGC,negative
725982.0,"Kinross Temporarily Suspends Mining and Processing Operations at the Tasiast Mine , Due To Allegations Of Invalid Work Permits",2016-06-20 09:27:00-04:00,KGC,neutral
725983.0,Kinross Temporarily Suspends Mining and Processing Operations at Tasiast Mine Following Work Permit Issues,2016-06-20 09:25:00-04:00,KGC,neutral
725984.0,"Kinross Announces End of Strike at Tasiast Mine, Not Expected To Impact Guidance",2016-06-13 09:00:00-04:00,KGC,negative
725985.0,Mid-Afternoon Market Update: Gold Rises 2.5%; Ambarella Shares Climb On Upbeat Results,2016-06-03 14:34:00-04:00,KGC,positive
725986.0,Mid-Morning Market Update: Markets Open Lower; Broadcom Profit Beats Expectations,2016-06-03 10:06:00-04:00,KGC,positive
725987.0,Canaccord Says Buy Kinross On Pullback,2016-05-26 20:10:00-04:00,KGC,neutral
725988.0,Benzinga's Top Upgrades,2016-05-26 09:24:00-04:00,KGC,positive
725989.0,Canaccord Genuity Upgrades Kinross Gold to Buy,2016-05-26 07:26:00-04:00,KGC,neutral
725990.0,Mid-Afternoon Market Update: Nordson Rises Following Upbeat Results; Seaspan Shares Plunge,2016-05-24 14:31:00-04:00,KGC,positive
725991.0,Option Alert: KGC Jan17 11.0 Calls Sweep: 721 @  ASK  $0.16: 721 traded vs 8013 OI: $5.06 Ref,2016-05-11 12:31:00-04:00,KGC,positive
725992.0,Kinross Gold Shares Push Lower to Session Lows as Hearing Deutsche Bank Has Downgraded Stock from Hold to Sell,2016-05-11 11:31:00-04:00,KGC,negative
725993.0,"Goldman: 2 Upgrades, 2 Downgrades For Gold Miners",2016-05-11 09:59:00-04:00,KGC,neutral
725994.0,Benzinga's Top Upgrades,2016-05-11 08:57:00-04:00,KGC,positive
725995.0,Goldman Sachs Upgrades Kinross Gold To Buy,2016-05-11 07:56:00-04:00,KGC,neutral
725996.0,"Goldman Sachs Upgrades Kinross Gold to Neutral, Raises PT to $5.30",2016-05-11 06:35:00-04:00,KGC,neutral
725997.0,"Kinross Gold Reports Inline Q1 EPS $(0.01), Sales $782.6M Vs Est $808.09M",2016-05-10 17:01:00-04:00,KGC,neutral
725998.0,"Earnings Scheduled For May 10, 2016",2016-05-10 04:29:00-04:00,KGC,neutral
725999.0,Canaccord Genuity Downgrades Kinross Gold to Hold,2016-05-03 06:42:00-04:00,KGC,neutral
726000.0,"Notable Imbalances Before Wednesday's Open: Investors Bullish On Financials, Selling Gold Stocks",2016-04-13 09:21:00-04:00,KGC,neutral
726001.0,Stocks Hitting 52-Week Highs,2016-04-11 10:14:00-04:00,KGC,neutral
726002.0,Benzinga's Top Upgrades,2016-04-11 09:29:00-04:00,KGC,positive
726003.0,RBC Capital Upgrades Kinross Gold From Sector Perform To Outperform,2016-04-11 06:35:00-04:00,KGC,neutral
726004.0,RBC Capital Upgrades Kinross Gold to Outperform,2016-04-11 05:49:00-04:00,KGC,neutral
726005.0,"Credit Suisse Maintains Outperform on Kinross Gold, Raises PT to $3.75",2016-03-31 14:01:00-04:00,KGC,positive
726006.0,Stocks Hitting 52-Week Highs,2016-03-31 10:13:00-04:00,KGC,neutral
726007.0,Benzinga's Top Upgrades,2016-03-31 09:58:00-04:00,KGC,positive
726008.0,"Raymond James Getting Bullish On Kinross Gold, Upgrades To Outperform",2016-03-31 08:22:00-04:00,KGC,neutral
726009.0,"Raymond James Upgrades Kinross Gold to Outperform, Raises PT to $5.00",2016-03-31 07:44:00-04:00,KGC,neutral
726010.0,Upside In Gold Stocks Might Be Limited Without Gold Appreciation,2016-03-28 17:43:00-04:00,KGC,negative
726011.0,"Kinross Responds to Recent SMA Notification Regarding the Maricunga Mine, Disagrees With Allegations",2016-03-21 10:19:00-04:00,KGC,negative
726012.0,Macquarie Downgrades Kinross Gold to Underperform,2016-03-15 10:11:00-04:00,KGC,neutral
726013.0,Bank of America Upgrades Kinross Gold to Buy,2016-03-11 09:52:00-05:00,KGC,neutral
726014.0,"BMO Capital Maintains Outperform on Kinross Gold, Raises PT to $3.75",2016-03-07 08:49:00-05:00,KGC,neutral
726015.0,"Kinross Gold Announces Public Equity Offering, Shares Tumble 10%",2016-02-25 09:33:00-05:00,KGC,positive
726016.0,Benzinga's Top Downgrades,2016-02-25 09:14:00-05:00,KGC,positive
726017.0,UBS Downgrades Kinross Gold to Neutral,2016-02-25 06:57:00-05:00,KGC,neutral
726018.0,Kinross Gold Reports $250M Bought Deal Financing,2016-02-24 17:06:00-05:00,KGC,neutral
726019.0,"Don't Look Now, But Precious Metals Stocks Are Skyrocketing",2016-02-11 09:53:00-05:00,KGC,positive
726020.0,"CIBC Ups Kinross Gold Target, Sees $2.80 Share Price",2016-02-11 09:46:00-05:00,KGC,positive
726021.0,"Kinross Reports Q4 EPS $(0.06) vs. Est. $(0.05), Rev. $706.2M vs. Est. $677.69M",2016-02-10 17:01:00-05:00,KGC,neutral
726022.0,"Earnings Scheduled For February 10, 2016",2016-02-10 04:09:00-05:00,KGC,neutral
726023.0,Kinross Gold Shares Rally Following Credit Suisse Upgrade,2016-02-09 14:48:00-05:00,KGC,positive
726024.0,Benzinga's Top Upgrades,2016-02-09 09:26:00-05:00,KGC,positive
726025.0,"Credit Suisse Upgrades Kinross Gold to Outperform, Raises PT to $2.75",2016-02-09 06:05:00-05:00,KGC,positive
726026.0,Mid-Afternoon Market Update: Crude Oil Down 3%; Biocryst Pharmaceuticals Shares Drop Following Announcement of Failed Avoralstat Trial Results,2016-02-08 14:32:00-05:00,KGC,negative
726027.0,Mid-Day Market Update: Dow Tumbles Over 350 Points; Apollo Education Shares Spike Higher,2016-02-08 12:05:00-05:00,KGC,positive
726028.0,"BMO Says Kinross Gold Is 'Beaten Down,' Upgrades To Outperform",2016-02-08 10:25:00-05:00,KGC,negative
726029.0,Mid-Morning Market Update: Markets Open Lower; Hasbro Beats Q4 Estimates,2016-02-08 09:53:00-05:00,KGC,negative
726030.0,"BMO Capital Upgrading Kinross Gold, Says Investors May Find Appeal In Round Mountain Expansion With Gold Prices Arpund $1,170/Oz",2016-02-08 09:40:00-05:00,KGC,neutral
726031.0,BMO Capital Upgrades Kinross Gold to Outperform,2016-02-08 07:59:00-05:00,KGC,neutral
726032.0,Filing from Kinross Gold Shows Registration for $1B Mixed Securities Shelf Offering,2016-01-07 17:18:00-05:00,KGC,positive
726033.0,Barclays' Year-In-Review On Gold,2015-11-30 16:15:00-05:00,KGC,neutral
726034.0,Benzinga's Top Upgrades,2015-11-24 09:20:00-05:00,KGC,positive
726035.0,RBC Capital Upgrades Kinross Gold to Sector Perform,2015-11-24 08:20:00-05:00,KGC,neutral
726036.0,"Raymond James Downgrades Kinross Gold to Market Perform, Lowers PT to $2.50",2015-11-18 09:01:00-05:00,KGC,negative
726037.0,UPDATE: Barrick Gold Deal for Assets with Kinross; Each Co. Will Own 50% in JV,2015-11-12 07:31:00-05:00,KGC,positive
726038.0,Kinross Gold shares up ~1.1% following earnings release,2015-11-10 16:03:00-05:00,KGC,positive
726039.0,Kinross Gold Reports Q3 Sales $809.4M vs $719M Est.,2015-11-10 16:02:00-05:00,KGC,neutral
726040.0,"Earnings Scheduled For November 10, 2015",2015-11-10 04:03:00-05:00,KGC,neutral
726041.0,Morning Market Gainers,2015-09-18 09:44:00-04:00,KGC,neutral
726042.0,"Kinross Gold: Barclays Expect Muted Share Price Response To Pos. Guidance Revision, Sees Exp. Priced In",2015-09-17 21:12:00-04:00,KGC,positive
726043.0,UPDATE: Kinross Cuts Gold Guidance Figures,2015-09-17 17:23:00-04:00,KGC,negative
726044.0,Kinross Cuts Gold Guidance Figures,2015-09-17 17:22:00-04:00,KGC,negative
726045.0,Stocks Hitting 52-Week Lows,2015-09-09 10:04:00-04:00,KGC,negative
726046.0,"Probes Reporter's Latest Updates: Choice Hotels, GlaxoSmithKline, Itron, Kinross Gold And More",2015-09-04 14:27:00-04:00,KGC,neutral
726047.0,"Pair Trade? RBC Upgrades Randgold Resources, Downgrades Kinross Gold",2015-08-24 16:43:00-04:00,KGC,neutral
726048.0,UPDATE: RBC on Kinross Downgrade: Warns Stock Could Become 'Value Trap' Given Declining Multiples,2015-08-24 08:24:00-04:00,KGC,negative
726049.0,"RBC Capital Downgrades Kinross Gold to Underperform, Lowers PT to $2.25",2015-08-24 07:18:00-04:00,KGC,negative
726050.0,"Kinross Reports Q2 EPS $(0.01) vs. Inline, Rev. $755.2M vs. Est. $752.18M",2015-07-29 17:00:00-04:00,KGC,neutral
726051.0,"Top Performing Industries For July 27, 2015",2015-07-27 10:32:00-04:00,KGC,positive
726052.0,Dividend Heroes To Zeros: 4 'Stingy' Canadian Stocks,2015-07-27 09:39:00-04:00,KGC,positive
726053.0,CIBC Initiates Coverage on Kinross Gold at Sector Perform,2015-07-24 08:24:00-04:00,KGC,neutral
726054.0,"LKA Gold, Kinross Gold USA Report Exploration, Option Deal",2015-07-13 08:36:00-04:00,KGC,positive
726055.0,What's Next For Gold Investors?,2015-06-17 09:24:00-04:00,KGC,neutral
726056.0,"BMO Capital Initiates Coverage on Kinross Gold at Market Perform, Announces $2.75 PT",2015-06-16 06:52:00-04:00,KGC,neutral
726057.0,Benzinga's Top Upgrades,2015-05-29 10:06:00-04:00,KGC,positive
726058.0,UBS Upgrades Kinross Gold To Buy,2015-05-29 09:26:00-04:00,KGC,neutral
726059.0,"UBS Upgrades Kinross Gold to Buy, Maintains $3.00 PT",2015-05-29 06:06:00-04:00,KGC,neutral
726060.0,"Kinross Gold Reports Q1 EPS Loss $0.01 vs Est $0.00, Sales $781.4M Vs Est $762.99M",2015-05-05 17:01:00-04:00,KGC,negative
726061.0,"Groupon, Alibaba, Tesla & Others On Deck: Earnings Season Rolls On",2015-05-03 17:58:00-04:00,KGC,neutral
726062.0,Separating The Precious Metals Saints From The Sinners,2015-04-13 16:59:00-04:00,KGC,positive
726063.0,Credit Suisse Has Uncertainty About Kinross Gold Regarding Tasiast Expansion,2015-04-02 08:38:00-04:00,KGC,positive
726064.0,Expert: Why Goldman Is Wrong About Commodities,2015-03-18 09:13:00-04:00,KGC,negative
726065.0,Do M&As Mean Gold Is Back? 1 Expert May Have An Answer,2015-02-17 20:02:00-05:00,KGC,neutral
726066.0,"Kinross Gold Reports Q4 Adj. Loss of $0.01/Share vs $0.01/Share Gain Est., Sales $791.3M vs $777M Est.",2015-02-10 17:01:00-05:00,KGC,positive
726067.0,"From Coca-Cola To Tesla, Here Are The 68 Most Important Earnings Expectations For The Week",2015-02-08 10:43:00-05:00,KGC,positive
726068.0,Benzinga's Top Downgrades,2014-12-19 09:45:00-05:00,KGC,positive
726069.0,UBS Downgrades Kinross Gold to Neutral,2014-12-19 09:41:00-05:00,KGC,neutral
726070.0,"UBS Downgrades Kinross Gold to Neutral, Lowers PT to $3.00",2014-12-19 08:44:00-05:00,KGC,negative
726071.0,"CIBC Upgrades Kinross Gold Corporation to Sector Outperform, Lowers PT to $4.00",2014-11-14 06:44:00-05:00,KGC,negative
726072.0,Mid-Afternoon Market Update: Lions Gate Surges On Earnings Beat; Abercrombie & Fitch Shares Decline,2014-11-07 15:14:00-05:00,KGC,positive
726073.0,Mid-Day Market Update: Allscripts Healthcare Slides On Downbeat Earnings; Sears Shares Climb,2014-11-07 12:58:00-05:00,KGC,positive
726074.0,Kinross Gold Corporation Reports Q3 EPS of $0.06 vs $0.03 Est; Revenue of $945.70M vs $841.34M Est,2014-11-05 17:00:00-05:00,KGC,neutral
726075.0,"Investors Rewarded With Treats, Not Tricks, As Dow And S&P Close At Record Highs",2014-10-31 16:54:00-04:00,KGC,positive
726076.0,Macquarie Downgrades Kinross Gold Corporation to Neutral,2014-10-29 09:16:00-04:00,KGC,neutral
726077.0,Kinross Reports Temporary Suspension of Mill at Round Mountain Mine ,2014-10-08 17:01:00-04:00,KGC,neutral
726078.0,"RBC Capital Downgrades Kinross Gold Corporation to Sector Perform, Lowers PT to $4.50",2014-10-03 08:51:00-04:00,KGC,negative
726079.0,"Kinross Gold Corporation Reports Q2 EPS of $0.04, Inline; Revenue of $911.90M vs $834.10M Est",2014-07-30 17:01:00-04:00,KGC,neutral
726080.0,Stocks Hitting 52-Week Lows ,2014-05-16 10:07:00-04:00,KGC,negative
726081.0,"Kinross Gold Corporation Reports Q1 EPS of $0.03, Inline; Revenue of $817.40M vs $789.88M Est",2014-05-07 17:00:00-04:00,KGC,neutral
726082.0,"Goldman Sachs Upgrades Kinross Gold Corporation to Neutral, Raises PT to $3.80",2014-03-28 06:53:00-04:00,KGC,neutral
726083.0,Kinross Says Will Report Results from Tasiast Expansion Feasibility Study on Mar. 31st,2014-03-25 17:01:00-04:00,KGC,neutral
726084.0,"Option Alert: Kinross Gold May $5 Call; 10,000 Contract Trade Between Bid and Ask @$0.40; Currently $5.00",2014-03-06 14:16:00-05:00,KGC,positive
726085.0,"Raymond James Initiates Coverage on Kinross Gold Corporation at Outperform, Announces $6.50 PT",2014-03-03 08:46:00-05:00,KGC,neutral
726086.0,UPDATE: Morgan Stanley Reiterates on Kinross Gold on Improved Free Cash Flow,2014-02-27 10:32:00-05:00,KGC,positive
726087.0,"Morgan Stanley Maintains Equal-weight on Kinross Gold Corporation, Raises PT to $5.75",2014-02-27 07:16:00-05:00,KGC,neutral
726088.0,Canaccord Genuity Upgrades Kinross Gold Corporation to Buy,2014-02-25 07:25:00-05:00,KGC,neutral
726089.0,Mackie Research Downgrades Kinross Gold Corporation to Hold,2014-02-14 07:48:00-05:00,KGC,neutral
726090.0,Market Wrap For February 13: Markets Close Higher; Nasdaq on a Six Day Winning Streak,2014-02-13 16:50:00-05:00,KGC,positive
726091.0,Kinross Gold Reports Encouraging Results,2014-02-13 10:39:00-05:00,KGC,positive
726092.0,Kinross Gold Corporation Reports Q4 EPS of $0.02 vs $0.03 Est; Revenue of $877.10M vs $858.76M Est,2014-02-12 17:06:00-05:00,KGC,neutral
726093.0,"Kinross Gold Says Pres, COO Will Retire on Oct. 1st, Names Warwick Morley-Jepson COO",2014-02-10 17:03:00-05:00,KGC,neutral
726094.0,"Earnings Expectations For The Week Of February 10: AIG, Cisco, Deere, PepsiCo And More",2014-02-10 06:33:00-05:00,KGC,neutral
726095.0,"Short Sellers Flee Randgold, Pile On GoldCorp (GG, KGC, GOLD)",2014-01-30 07:33:00-05:00,KGC,neutral
726096.0,"Option Alert: Kinross Gold Mar $5 Call; 43,956 Contract Trade Between Bid and Ask @$0.20; Currently $4.72",2014-01-23 12:12:00-05:00,KGC,positive
726097.0,TD Securities Downgrades Kinross Gold Corporation to Hold,2014-01-09 09:06:00-05:00,KGC,positive
726098.0,"Option Alert: Konross Gold January $6 Call; 9,662 Contract Trade Between Bid and Ask @$0.03; Currently $4.39",2013-12-27 09:41:00-05:00,KGC,positive
726099.0,"JP Morgan Downgrades Kinross Gold Corporation to Neutral, Lowers PT to $5.00",2013-12-18 07:11:00-05:00,KGC,positive
726100.0,UPDATE: Morgan Stanley Upgrades Kinross Gold as Shares Look Attractive,2013-11-26 11:07:00-05:00,KGC,positive
726101.0,Morgan Stanley Downgrades Kinross Gold Corporation to Equalweight,2013-11-26 07:36:00-05:00,KGC,neutral
726102.0,"Gold Short Sellers Seek Direction (AU, NEM, NGD)",2013-11-14 14:26:00-05:00,KGC,neutral
726103.0,Kinross Expecting FY Cost of Sales at the Lower End of Previously-Issued Guidance,2013-11-13 17:04:00-05:00,KGC,negative
726104.0,Kinross Gold Corporation Reports Q3 EPS of $0.05 vs $0.04 Est; Revenue of $876.30M vs $762.84M Est,2013-11-13 17:03:00-05:00,KGC,neutral
726105.0,"13F Filing from Seth Klarman's Baupost Group Just Filed, Shows Liquidated Stake in AIG, Kinross Gold",2013-11-13 16:30:00-05:00,KGC,neutral
726106.0,Top 4 Mid-Cap Stocks In The Gold Industry With The Highest Dividend Yield,2013-11-11 04:45:00-05:00,KGC,positive
726107.0,"Short Interest In Harmony Gold Resumes Rise (EGO, HMY, KGC)",2013-10-26 15:57:00-04:00,KGC,positive
726108.0,"Short Sellers Retreat From Gold Stocks (EGO, HMY, IAG)",2013-10-12 13:06:00-04:00,KGC,positive
726109.0,CORRECTION: Reuters Earlier Reported Knight Capital and SEC May Be Near $12M Settlement,2013-09-26 13:59:00-04:00,KGC,neutral
726110.0,"Short Sellers Pile On Gold Fields And Other Gold Stocks (EGO, GFI, HMY)",2013-09-26 10:49:00-04:00,KGC,neutral
726111.0,"Goldcorp CEO Jeannes at Denver Gold Forum Said Co. Prepared to shut Mines if Gold Drops Below $1,200/Oz",2013-09-24 12:26:00-04:00,KGC,positive
726112.0,"More Surges in Gold Stock Short Interest (AEM, GG, IAG)",2013-09-14 11:48:00-04:00,KGC,positive
726113.0,"Four Mining and Metals Stocks With Upside Potential (ABX, FCX, KGC, SCCO)",2013-09-11 12:56:00-04:00,KGC,neutral
726114.0,"Short Interest Swings In Gold Stocks (AU, EGO, RGLD)",2013-08-29 07:57:00-04:00,KGC,positive
726115.0,"COMEX Gold Up Nearly $20 on Syria Fears; Gold Stocks Moving: IAG Up 3.8%, KGC Up 3.2%, ABX Up 3.2%, ANV Up 2%, NEM Up 1.8%, GG Up 1.8%, AEM Up 1.6%, AUY Up 1.6%, HL Up 1.6%, GLD Up 0.85%",2013-08-27 07:35:00-04:00,KGC,neutral
726116.0,"Kinross Reports End of Strike at Tasiast Mine, Says Impact on Gold Production Minimal",2013-08-19 15:16:00-04:00,KGC,negative
726117.0,"13F from Seth Klarmen's Baupost Shows New Stakes in Kinross Gold, Micron, ChipMOS, Liquidated Stakes in Elan, DirecTV, Raised Stake in BP, Lowered Stake in Oracle",2013-08-14 07:57:00-04:00,KGC,negative
726118.0,"CIBC Upgrades Kinross Gold Corporation to Sector Perform, Raises PT to $6.50",2013-08-06 09:25:00-04:00,KGC,neutral
726119.0,Kinross Gold Corporation Reports Q2 EPS of $0.10 vs $0.07 Est; Revenue of $968.0M vs $929.64M Est,2013-07-31 17:01:00-04:00,KGC,neutral
726120.0,"Short Sellers Still Moving into with Gold Miners (ABX, KGC, NEM)",2013-07-27 12:09:00-04:00,KGC,neutral
726121.0,UPDATE: BMO Capital Markets Downgrades Kinross Gold Following Tasiast Expansion Removal,2013-07-15 11:04:00-04:00,KGC,neutral
726122.0,"BMO Capital Downgrades Kinross Gold Corporation to Market Perform, Lowers PT to $6.00",2013-07-15 06:57:00-04:00,KGC,negative
726123.0,"Short Interest Surges in Barrick Gold and Other Gold Miners (AEM, AU, ABX)",2013-07-13 11:33:00-04:00,KGC,positive
726124.0,Afternoon Market Losers,2013-07-05 13:21:00-04:00,KGC,negative
726125.0,"Jefferies Downgrades Kinross Gold Corporation to Underperform, Lowers PT to $3.75",2013-07-02 07:33:00-04:00,KGC,negative
726126.0,"Short Interest in Agnico-Eagle and Harmony Gold Rises (AEM, HMY, GFI)",2013-06-26 13:19:00-04:00,KGC,positive
726127.0,"UBS Downgrades Kinross Gold Corporation to Neutral, Lowers PT to $5.25",2013-06-21 11:25:00-04:00,KGC,negative
726128.0,UBS Downgrades Kinross Gold Corporation to Neutral,2013-06-21 09:30:00-04:00,KGC,neutral
726129.0,"Short Interest in AngloGold Ashanti, IAMGOLD Continues to Surge (AU, IAG, KGC)",2013-06-13 08:31:00-04:00,KGC,positive
726130.0,Cowen & Company Downgrades Kinross Gold Corporation to Market Perform,2013-06-12 08:01:00-04:00,KGC,neutral
726131.0,"Mid-Morning Market Update: Markets Go Red, Lululemon Chief Executive To Step Down",2013-06-11 10:33:00-04:00,KGC,neutral
726132.0,Canaccord Genuity Downgrades Kinross Gold Corporation to Hold,2013-06-11 07:45:00-04:00,KGC,neutral
726133.0,Vertical Research Downgrades Kinross Gold Corporation to Sell,2013-06-11 07:44:00-04:00,KGC,neutral
726134.0,Kinross Extends Maturity Date of Revolving Credit Facility and Term Loan,2013-06-10 17:01:00-04:00,KGC,positive
726135.0,"Short Interest in AngloGold Ashanti, Harmony Gold Surges",2013-05-28 16:18:00-04:00,KGC,positive
726136.0,"Four Things Einhorn, Soros Are Forgetting About Gold Miners ETF",2013-05-17 06:53:00-04:00,KGC,neutral
726137.0,Reuters Said to Be Near Settlement with SEC Related to Glitch Probe,2013-05-16 17:11:00-04:00,KGC,neutral
726138.0,"Short Interest in Barrick Gold, Randgold Resources Surges",2013-05-10 14:17:00-04:00,KGC,positive
726139.0,UPDATE: BMO Capital Markets Lowers PT on Kinross Gold Following Strong Q1/13 Results,2013-05-08 11:47:00-04:00,KGC,positive
726140.0,"BMO Capital Maintains Outperform on Kinross Gold Corporation, Lowers PT to $8.50",2013-05-08 08:38:00-04:00,KGC,negative
726141.0,Kinross Gold Corporation Reports Q1 EPS of $0.15 vs $0.13 Est; Revenue of $1.06B vs $1.03B Est,2013-05-07 17:02:00-04:00,KGC,neutral
726142.0,Top 4 Mid-Cap Stocks In The Gold Industry With The Highest Revenue,2013-05-06 04:14:00-04:00,KGC,positive
726143.0,"CIBC Downgrades Kinross Gold Corporation to Sector Underperform, Lowers PT to $8.00",2013-04-30 09:32:00-04:00,KGC,negative
726144.0,"UBS Maintains Buy on Kinross Gold Corporation, Lowers PT to $8.50",2013-04-29 10:25:00-04:00,KGC,negative
726145.0,Short Interest Rises in Gold Mining Stocks ,2013-04-25 14:17:00-04:00,KGC,positive
726146.0,UPDATE: Deutsche Bank Downgrades Kinross Gold to Hold on More Cautious Sector View,2013-04-22 09:10:00-04:00,KGC,negative
726147.0,Deutsche Bank Downgrades Kinross Gold Corporation to Hold,2013-04-22 06:20:00-04:00,KGC,neutral
726148.0,"NOVAGOLD Says Ton Giardini Steps Down from Board, to Join Kinross Gold as CFO",2013-02-28 08:03:00-05:00,KGC,positive
726149.0,"UPDATE: Credit Suisse Upgrades Kinross Gold Corporation to Outperform on Valuation, Sentiment",2013-02-15 08:36:00-05:00,KGC,positive
726150.0,"Jefferies Maintains Hold on Kinross Gold Corporation, Lowers PT to $8.50",2013-02-15 07:30:00-05:00,KGC,negative
726151.0,Credit Suisse Upgrades Kinross Gold Corporation to Outperform,2013-02-15 07:25:00-05:00,KGC,positive
726152.0,"BMO Capital Maintains Outperform on Kinross Gold Corporation, Lowers PT to $12.50",2013-02-14 08:14:00-05:00,KGC,negative
726153.0,Kinross Gold Corporation Reports Q4 EPS of $0.24 vs $0.21 Est; Revenue of $1.19B vs $1.17B Est,2013-02-13 17:02:00-05:00,KGC,neutral
726154.0,"UPDATE: Citigroup Reiterates Buy Rating, Lowers PT on Kinross Gold Corporation on Lowered Estimates",2013-02-13 13:16:00-05:00,KGC,negative
726155.0,"Citigroup Maintains Buy on Kinross Gold Corporation, Lowers PT to $10.00",2013-02-13 11:10:00-05:00,KGC,negative
726156.0,"Deutsche Bank Maintains Buy on Kinross Gold Corporation, Lowers PT to $12.00",2013-01-15 08:45:00-05:00,KGC,negative
726157.0,"CIBC Says Agnico-Eagle Best Positioned Miner Ahead of Q4 Earnings, Sees Iamgold Having 'No Room for Error'",2013-01-11 13:34:00-05:00,KGC,positive
726158.0,Kinross Clarifies Announcement by Southridge Enterprises ,2012-12-27 21:58:00-05:00,KGC,positive
726159.0,"Southridge Enterprises, Kinross Announce Joint Partnership",2012-12-26 09:18:00-05:00,KGC,neutral
726160.0,Macquarie Upgraded Kinross Gold from Neutral to Outperform,2012-11-09 10:37:00-05:00,KGC,neutral
726161.0,UPDATE: Canaccord Genuity Upgrades Kinross Gold to Buy on Strong Q3 Results  ,2012-11-08 12:38:00-05:00,KGC,positive
726162.0,Benzinga's Top Upgrades,2012-11-08 07:13:00-05:00,KGC,positive
726163.0,"Canaccord Upgrades Kinross Gold from Hold to Buy, Maintains PT at $13",2012-11-08 06:51:00-05:00,KGC,neutral
726164.0,"Jefferies & Company Maintains Kinross Gold at Hold, Raises PT from $8 to $9.25",2012-10-19 07:58:00-04:00,KGC,neutral
726165.0,"Barclays Initiated Coverage on Kinross Gold at Equal-weight, Announced PT to $13",2012-10-16 09:59:00-04:00,KGC,neutral
726166.0,Morgan Stanley Downgrades Kinross Gold from Equal-weight to Underweight,2012-10-10 06:41:00-04:00,KGC,neutral
726167.0,Benzinga's Top Upgrades,2012-10-02 07:11:00-04:00,KGC,positive
726168.0,"Deutsche Bank Maintains Kinross Gold at Buy, Raises PT from $13 to $16",2012-10-02 06:38:00-04:00,KGC,neutral
726169.0,Dundee Upgrades Kinross Gold from Neutral to Buy,2012-10-01 14:00:00-04:00,KGC,neutral
726170.0,"Citigroup Maintains Kinross Gold at Buy, Raises PT from $10 to $12",2012-09-25 07:14:00-04:00,KGC,neutral
726171.0,"Benzinga Market Primer, Quadruple Witching Friday September 21",2012-09-21 08:52:00-04:00,KGC,neutral
726172.0,"Citigroup Maintains Kinross Gold at Buy, Lowers PT from $14.50 to $13",2012-08-10 06:22:00-04:00,KGC,negative
726173.0,UPDATE: Canaccord Genuity Downgrades Kinross Gold Corporation to Hold,2012-08-09 13:06:00-04:00,KGC,neutral
726174.0,Benzinga's Top Downgrades,2012-08-09 07:04:00-04:00,KGC,positive
726175.0,"Canaccord Downgrades Kinross Gold from Buy to Hold, Lowers PT from $10.50 to $8.75",2012-08-09 05:41:00-04:00,KGC,negative
726176.0,Kinross Gold Reports Q2 EPS $0.14 vs $0.17 Est; Revenues $1.01B vs $1.02B Est,2012-08-08 17:01:00-04:00,KGC,neutral
726177.0,Kinross Gold Spokesperson Declines Comment on Report of RBC Hire as Adviser,2012-08-08 14:01:00-04:00,KGC,neutral
726178.0,Hearing Kinross Gold Hires RBC as Adviser,2012-08-08 13:41:00-04:00,KGC,neutral
726179.0,Algorithm Trading Responsible For Another Glitch,2012-08-06 09:57:00-04:00,KGC,positive
726180.0,"Benzinga Market Primer, Monday August 6",2012-08-06 06:44:00-04:00,KGC,neutral
726181.0,A Look Ahead: Next Week's ETFs to Watch,2012-08-03 19:48:00-04:00,KGC,neutral
726182.0,UPDATE: Citigroup Lowers PT on Kinross Gold to $11,2012-07-16 09:34:00-04:00,KGC,negative
726183.0,"Citigroup Maintains Kinross Gold at Buy, Lowers PT from $13 to $11",2012-07-16 06:52:00-04:00,KGC,negative
726184.0,"Benzinga's M&A Chatter for Friday July 13, 2012",2012-07-14 17:34:00-04:00,KGC,neutral
726185.0,Kinross Gold Spokesperson Won't Comment on Earlier Takeover Rumor Reported in Globe and Mail,2012-07-13 10:52:00-04:00,KGC,neutral
726186.0,Kinross Gold Could be Target for Barrick -Globe and Mail,2012-07-13 10:28:00-04:00,KGC,neutral
726187.0,"NAHB Sees US Multifamily Building Up 26% in 2012, Single-Family Building Up 20%, 33% of Builders Lost Sales Because of Low Appraisals",2012-07-12 14:18:00-04:00,KGC,negative
726188.0,Kinross Gold: No Kinross Personnel On Board Plane ,2012-07-12 09:40:00-04:00,KGC,negative
726189.0,"Kinross Gold: 2 Pilots, 2 Customs Officials, 3 Security Personnel Killed in Crash ",2012-07-12 09:40:00-04:00,KGC,negative
726190.0,"Deutsche Bank Maintains Kinross Gold at Buy, Lowers PT from $16.50 to $14.50",2012-07-09 06:03:00-04:00,KGC,negative
726191.0,"Benzinga's M&A Chatter for Thursday June 14, 2012",2012-06-14 18:25:00-04:00,KGC,neutral
726192.0,Spokesperson for Kinross Gold Declines Comment on dealReporter Story They Have Hired Bank of America to Find a Buyer,2012-06-14 14:59:00-04:00,KGC,neutral
726193.0,"Astoria Financial Corporation Prices $250M, 5.00% Senior Notes Offering ",2012-06-14 14:23:00-04:00,KGC,neutral
726194.0,"KGC Spiking Higher on Volume, Up 3.7%, Reportedly Hiring Advisor to Explore Options: dealreporter",2012-06-14 14:09:00-04:00,KGC,neutral
726195.0,Hearing Unconfirmed Takeover Chatter in Kinross Gold,2012-06-14 14:08:00-04:00,KGC,negative
726196.0,Kinross Announces Tasiast Work Stoppage Ends and Production Resumes ,2012-06-11 07:31:00-04:00,KGC,neutral
726197.0,"Mining Companies in Pershing County, Nevada",2012-06-06 13:06:00-04:00,KGC,neutral
726198.0,"5 Mining ETFs Your Broker Forgot to Mention (PSAU, GLDX, RING)",2012-06-06 12:24:00-04:00,KGC,neutral
726199.0,Kinross Announces Unlawful Work Stoppage at Tasiast,2012-06-06 09:55:00-04:00,KGC,neutral
726200.0,"UPDATE: Kinross: Mining, Processing At Tasiast Temporarily Suspended; Produced Approx 200K Ounces of Gold In 2011 ",2012-06-06 09:53:00-04:00,KGC,negative
726201.0,Kinross Announces Unlawful Work Stoppage at Tasiast ,2012-06-06 09:51:00-04:00,KGC,neutral
726202.0,From Earlier: Kinross Agrees to Sale of Crixas Interest for $220 Million  ,2012-05-29 08:24:00-04:00,KGC,positive
726203.0,"UBS Maintains Kinross Gold at Buy, Lowers PT from $13 to $12",2012-05-10 10:46:00-04:00,KGC,negative
726204.0,UPDATE: Jefferies Cuts PT to $8 on Kinross Gold Corporation; Price Correction Continues  ,2012-05-10 08:40:00-04:00,KGC,negative
726205.0,"Jefferies & Company Maintains Kinross Gold at Hold, Lowers PT from $11 to $8",2012-05-10 06:35:00-04:00,KGC,negative
726206.0,"Canaccord Maintains Kinross Gold at Buy, Lowers PT from $13.5 to $12.75",2012-05-09 09:37:00-04:00,KGC,negative
726207.0,Volatility Ahead for Gold Prices,2012-05-01 11:55:00-04:00,KGC,neutral
726208.0,"Benzinga's M&A Chatter for Monday April 16, 2012",2012-04-16 19:36:00-04:00,KGC,neutral
726209.0,Kinross Gold Spokesperson Would Not Comment on Rumored Acquisition of Jaguar Mining Assets,2012-04-16 11:06:00-04:00,KGC,positive
726210.0,Jaguar Mining Spokesperson Says Company Will Not Make Any Comments Regarding Their Strategic Review Process,2012-04-16 10:36:00-04:00,KGC,neutral
726211.0,Is Gold Overpriced Relative to Other Commodities?,2012-04-02 14:27:00-04:00,KGC,neutral
726212.0,"Benzinga's Top ETF Decliners, March 27th (XIV, NUGT, ERX)",2012-03-27 19:11:00-04:00,KGC,positive
726213.0,"HUI, XAU No Longer Adequately Represent the Mining Stock Universe",2012-03-13 12:13:00-04:00,KGC,negative
726214.0,Notable Call Options Activity in Kinross Gold,2012-03-07 14:14:00-05:00,KGC,neutral
726215.0,"Benzinga's Top ETF Decliners, March 5th (SOXL, YINN, NUGT)",2012-03-05 18:22:00-05:00,KGC,positive
726216.0,"Benzinga's Top ETF Gainers, February 28th (AGQ, NUGT, YINN)",2012-02-28 18:12:00-05:00,KGC,positive
726217.0,"Benzinga's Top ETF Gainers, February 16th",2012-02-16 20:12:00-05:00,KGC,positive
726218.0,Ecuador Minister Says May Not Sign Mine Contract with Kinross,2012-02-16 12:31:00-05:00,KGC,neutral
726219.0,Kinross Gold Reports Q4 EPS $0.17 vs $0.21 Est,2012-02-15 17:03:00-05:00,KGC,neutral
726220.0,Kinross Increases Dividend by 33% to $0.08 ,2012-02-15 17:03:00-05:00,KGC,neutral
726221.0,Notable Put Options Activity in Kinross Gold,2012-02-13 12:17:00-05:00,KGC,neutral
726222.0,UPDATE: Deutsche Bank Lowers Target to $85 on Kinross Gold,2012-02-08 06:50:00-05:00,KGC,negative
726223.0,"Benzinga's Top ETF Decliners, January 30th",2012-01-30 17:38:00-05:00,KGC,positive
726224.0,Notable Call Options Activity in Kinross Gold,2012-01-25 10:39:00-05:00,KGC,neutral
726225.0,"Benzinga's Top ETF Gainers, January 23rd (BOIL, NUGT, UCO, EDC)",2012-01-23 18:50:00-05:00,KGC,positive
726226.0,Kinross Gold Hits 52-Week Low of $10.18,2012-01-19 12:11:00-05:00,KGC,negative
726227.0,"Benzinga's Top ETF Decliners, January 17th (BOIL, EDZ, NUGT, SCO)",2012-01-17 20:39:00-05:00,KGC,positive
726228.0,"End-of-Day Market Summary for January 17, 2012",2012-01-17 16:16:00-05:00,KGC,neutral
726229.0,Afternoon Movers; Markets Moved Higher,2012-01-17 16:04:00-05:00,KGC,neutral
726230.0,Kinross Gold Down After Reporting 2011 Prelim Results and 2012 Outlook ,2012-01-17 09:51:00-05:00,KGC,neutral
726231.0,Kinross Gold Hits 52-Week Low of $10.79,2012-01-17 09:32:00-05:00,KGC,negative
726232.0,From Earlier: Kinross Provides Preliminary 2011 Results and 2012 Outlook  ,2012-01-17 07:17:00-05:00,KGC,neutral
726233.0,Kinross Gold Hits 52-Week Low of $10.93,2011-12-29 09:30:00-05:00,KGC,negative
726234.0,Kinross Gold Hits 52-Week Low of $11.42,2011-12-28 09:39:00-05:00,KGC,negative
726235.0,Kinross Gold Hits 52-Week Low of $11.80,2011-12-14 09:31:00-05:00,KGC,negative
726236.0,Kinross Gold Hits 52-Week Low of $12.07,2011-12-13 15:33:00-05:00,KGC,negative
726237.0,Kinross Gold Spokesperson Says Company has Not Released Any New Disclosures Since Q3 Results; Response to Heavy Buying in January 2012 12.5 Calls,2011-11-22 13:05:00-05:00,KGC,neutral
726238.0,"Option Alert: Heavy Volume in Kinross Gold January 2012 12.5 Call; 43,497 Contracts",2011-11-22 11:36:00-05:00,KGC,positive
726239.0,Notable Call Options Activity in Kinross Gold,2011-11-22 11:17:00-05:00,KGC,neutral
726240.0,Kinross Gold Hits 52-Week Low of $12.55,2011-11-21 09:31:00-05:00,KGC,negative
726241.0,Deutsche Bank Maintains Hold Rating and $18 PT on Kinross Gold ,2011-11-03 08:01:00-04:00,KGC,neutral
726242.0,Kinross Gold Corp Reports Q3 EPS $0.24 vs $0.23 Est,2011-11-02 16:49:00-04:00,KGC,neutral
726243.0,Kinross Gold Corp Reports Q3 EPS $0.19 vs $0.23 Est; Revenues $1.07B vs $1.06B Est		,2011-11-02 16:47:00-04:00,KGC,neutral
726244.0,Kinross Announces 6M Share Investment in Revolution Resources Corp. ,2011-10-03 09:15:00-04:00,KGC,positive
726245.0,"Fast Money Picks For September 30th (TBT, HP, CFN, KGC)",2011-09-29 19:05:00-04:00,KGC,neutral
726246.0,"It's End-of-the-Month, Take Out the Garbage  09-29-2011",2011-09-29 18:43:00-04:00,KGC,neutral
726247.0,Kinross Announces Investment in White Bear Resources,2011-09-29 16:35:00-04:00,KGC,neutral
726248.0,Sector Rotation  09-29-2011,2011-09-29 15:08:00-04:00,KGC,neutral
726249.0,Notable Call Options Activity in Kinross Gold,2011-09-29 13:21:00-04:00,KGC,neutral
726250.0,Notable Put Options Activity in Kinross Gold,2011-09-28 11:18:00-04:00,KGC,neutral
726251.0,Nine Dividend Payers Up More Than 20% in 90 Days,2011-09-22 12:03:00-04:00,KGC,neutral
726252.0,Buy GDX And GDXJ,2011-09-09 11:56:00-04:00,KGC,neutral
726253.0,"Buy Gold, Silver, and Avoid the Miners",2011-09-06 17:18:00-04:00,KGC,negative
726254.0,Gold Is Still the Best Safe Haven We Have,2011-08-31 19:48:00-04:00,KGC,positive
726255.0,Kinross Completes US$1 Billion Unsecured Debt Offering ,2011-08-22 16:31:00-04:00,KGC,negative
726256.0,Don't Forget About This Gold Miners ETF,2011-08-22 15:48:00-04:00,KGC,positive
726257.0,Kinross Announces $1 Billion Unsecured Debt Offering  ,2011-08-16 08:32:00-04:00,KGC,negative
726258.0,Can Support Hold?  08-11-2011,2011-08-15 15:08:00-04:00,KGC,positive
726259.0,Deutsche Bank Maintains Hold on Kinross Gold,2011-08-11 07:52:00-04:00,KGC,neutral
726260.0,J.P. Morgan Maintains Overweight on Kinross Gold,2011-08-11 07:47:00-04:00,KGC,negative
726261.0,PREVIEW: Kinross Gold CEO to Appear on CNBC Soon to Talk about its Quarter,2011-08-10 16:23:00-04:00,KGC,neutral
726262.0,Kinross Increases Dividend by 20% to $0.06,2011-08-10 16:16:00-04:00,KGC,neutral
726263.0,Kinross Gold Reports Q2 EPS $0.20 vs $0.17 Est; Revenues $987.8 vs $931.26M Est			,2011-08-10 16:15:00-04:00,KGC,neutral
726264.0,Options Brief: Kinross Gold,2011-08-08 11:04:00-04:00,KGC,neutral
726265.0,"JP Morgan Reiterates Neutral on Knight Capital, Raises PT to $15",2011-08-05 06:34:00-04:00,KGC,positive
726266.0,Water Balloon Toss  06-29-2011,2011-06-29 18:58:00-04:00,KGC,neutral
726267.0,Rally Extended  06-29-2011,2011-06-29 15:31:00-04:00,KGC,neutral
726268.0,Rally Extended  06-29-2011,2011-06-29 15:31:00-04:00,KGC,neutral
726269.0,Options Brief: Kinross Gold Corporation,2011-06-29 12:20:00-04:00,KGC,neutral
726270.0,Kinross Announces Investment in Edgewater Exploration Ltd. ,2011-06-14 16:58:00-04:00,KGC,positive
726271.0,"The Federal Reserve Cartel, Part II: The Freemason Bank of the US & The House of Rothschild",2011-06-14 12:18:00-04:00,KGC,neutral
726272.0,"The Federal Reserve Cartel, Part II: The Freemason Bank of the US & The House of Rothschild",2011-06-14 12:18:00-04:00,KGC,neutral
726273.0,"Gold Stocks Out of Favor, Will it Change?",2011-06-14 08:53:00-04:00,KGC,positive
726274.0,Liquidity Crisis Intensifies Mining Stock Sell-off,2011-06-13 21:48:00-04:00,KGC,negative
726275.0,"Top Gold and Silver Stocks to watch on 5/23/11- MDW, CGR, BAA, VGZ, SVBL, TLR, KGN, AAU, GRS, XRA, UXG, AXU, MFN, GORO, GSS, TRE",2011-05-23 04:53:00-04:00,KGC,positive
726276.0,Kinross Gold Announces Unionized Workers at Tasiast Return Following Brief Work Stoppage  ,2011-05-20 09:18:00-04:00,KGC,neutral
726277.0,Techs Drag  05-17-2011,2011-05-17 18:28:00-04:00,KGC,negative
726278.0,Watch the Zig-Zag  05-17-2011,2011-05-17 15:28:00-04:00,KGC,neutral
726279.0,Focus is on Dollar & Greece  05-13-2011,2011-05-13 15:11:00-04:00,KGC,neutral
726280.0,"Most Actives Top Basic Materials Stock Picks on 5/5/11- IAG, CGR, PCH, XRA, KGC, CENX, UFPT, KRO, PZG,CBT, FCX, SLW, AA, ABX, CLF",2011-05-05 05:28:00-04:00,KGC,positive
726281.0,Dahlman Rose Comments on Kinross Gold (KGC),2011-05-04 15:38:00-04:00,KGC,neutral
726282.0,Kinross Gold Reports EPS of $0.16 vs. $0.14 Estimate; Revenues $937.0M vs. $925.5M Estimate,2011-05-03 16:50:00-04:00,KGC,neutral
726283.0,Canary in the Coal Mine  04-28-11,2011-04-28 15:27:00-04:00,KGC,neutral
726284.0,JP Morgan On KGC Growth,2011-04-05 08:20:00-04:00,KGC,positive
726285.0,Deutsche Bank Comments On Mine Visit For Kinross Gold,2011-04-05 08:05:00-04:00,KGC,neutral
726286.0,Kinross Signs Share Purchase Agreement to Acquire 100% of Kupol for $350M,2011-04-04 16:34:00-04:00,KGC,positive
726287.0,Kinross Gold Corporation Amends Unsecured Revolving Credit Facility,2011-04-04 11:45:00-04:00,KGC,neutral
726288.0,Kinross Doubles Its Revolving Credit Facility to $1.2B,2011-03-31 16:38:00-04:00,KGC,positive
726289.0,Kinross Gold Corp Announces $2.5 Million in Funding For Construction (KGC),2011-03-30 13:50:00-04:00,KGC,neutral
726290.0,J.P. Morgan Reiterates OW Rating On KGC,2011-03-30 07:30:00-04:00,KGC,neutral
726291.0,Kinross Receives Pre-Approval to Increase Kupol Ownership to 100%  ,2011-03-25 15:20:00-04:00,KGC,positive
726292.0,Global X Distills A Pure Gold Miners ETF,2011-03-17 17:04:00-04:00,KGC,neutral
726293.0,J.P. Morgan Reiterates Overweight on Kinross Gold (KGC) ,2011-03-08 08:38:00-05:00,KGC,negative
726294.0,Kinross Announces Appointment of New CFO,2011-03-07 16:41:00-05:00,KGC,neutral
726295.0,Running Late  03-04-2011,2011-03-04 15:43:00-05:00,KGC,neutral
726296.0,Kinross Reports Q4 EPS of $0.13 vs. $0.15,2011-02-16 16:37:00-05:00,KGC,neutral
726297.0,"Earnings Scheduled For February 16 (CMCSA, GENZ, DVN, DE, ANF, DF, NTAP, FE. CBS, CVC, NVDA, KGC)",2011-02-16 03:26:00-05:00,KGC,neutral
726298.0,Soros Boosts GLD Stake,2011-02-15 14:22:00-05:00,KGC,positive
726299.0,Soros Boosts GLD Stake,2011-02-15 14:22:00-05:00,KGC,positive
726300.0,On the African gold trail with GoldStone Resources,2011-02-03 10:08:00-05:00,KGC,neutral
726301.0,Options Brief: Kinross Gold Corporation (KGC),2011-01-24 10:33:00-05:00,KGC,neutral
726302.0,Kinross Provides Preliminary 2010 Production of 2.3-2.35M Gold Equivalent Ounces ,2011-01-14 08:34:00-05:00,KGC,neutral
726303.0,"Gold Prices Reverse Course, Move Higher",2011-01-13 09:33:00-05:00,KGC,neutral
726304.0,6 Mining Stocks to Sell Immediately: Navellier,2011-01-12 09:36:00-05:00,KGC,neutral
726305.0,"Monday's Put/Call Ratio Leaders (ERIC, PWR, SVU, SWKS, KGC)",2011-01-10 12:21:00-05:00,KGC,neutral
726306.0,Spot Gold Prices Suppressed by Risk Appetite,2011-01-03 15:53:00-05:00,KGC,negative
726307.0,Sectors to Watch into 2011  12-30-2010,2010-12-30 14:47:00-05:00,KGC,neutral
726308.0,What's Hot on TheStreet,2010-12-30 14:16:00-05:00,KGC,neutral
726309.0,What's Hot on TheStreet,2010-12-30 14:16:00-05:00,KGC,neutral
726310.0,10 Metal Stocks for 2011,2010-12-30 13:51:00-05:00,KGC,neutral
726311.0,Gold Prices Fall as 2010 Closes Out,2010-12-30 12:33:00-05:00,KGC,neutral
726312.0,Goldcorp Acquires Andean Resources - Analyst Blog,2010-12-30 10:33:00-05:00,KGC,neutral
726313.0,Goldcorp Acquires Andean Resources - Analyst Blog,2010-12-30 10:15:00-05:00,KGC,neutral
726314.0,Best-Performing Gold Funds Surge Up to 66%,2010-12-29 07:00:00-05:00,KGC,neutral
726315.0,Finding the Next Gold Takeout Target,2010-12-20 07:13:00-05:00,KGC,neutral
726316.0,Gold Stocks: How to Profit From M&A,2010-12-06 07:01:00-05:00,KGC,positive
726317.0,Kinross Invests $10 Million in Developing Mining School in Mauritania ,2010-11-30 11:38:00-05:00,KGC,neutral
726318.0,"Benzinga's Top Upgrades (OFC, KGC, C, POL)",2010-11-30 08:35:00-05:00,KGC,positive
726319.0,Credit Suisse Upgrades KGC To Outperform,2010-11-30 07:51:00-05:00,KGC,positive
726320.0,Will NovaGold Take a Buyout Offer?,2010-11-30 07:07:00-05:00,KGC,neutral
726321.0,"Spot Gold, Silver Show Limited Uptick",2010-11-29 14:59:00-05:00,KGC,negative
726322.0,5 Sleazy Gold Coin Scams,2010-11-22 13:55:00-05:00,KGC,negative
726323.0,Analyst: Top 2 Stocks for High Gold Prices,2010-11-22 07:00:00-05:00,KGC,positive
726324.0,Spot Gold Prices Lag Mining Stocks,2010-11-18 16:29:00-05:00,KGC,negative
726325.0,John Paulson's High-Performance Gold Strategy ,2010-11-18 14:05:00-05:00,KGC,neutral
726326.0,Kinross Beats Estimates - Analyst Blog,2010-11-15 16:42:00-05:00,KGC,neutral
726327.0,"Dahlman Rose Gives Color On KGC, ANV Earnings",2010-11-10 09:57:00-05:00,KGC,neutral
726328.0,Kinross Reports Highest Upside According to JPM,2010-11-08 06:38:00-05:00,KGC,neutral
726329.0,Kinross Earnings Ahead Of J.P. Morgan Estimate; In Line With Consensus,2010-11-04 09:30:00-04:00,KGC,neutral
726330.0,Deutsche Bank Discusses Kinross Gold After Earnings (KGC),2010-11-04 07:19:00-04:00,KGC,neutral
726331.0,"Top 4 Large-Cap Stocks In The Gold Industry With The Highest Cash (ABX, NEM, AU, KGC)",2010-10-27 05:37:00-04:00,KGC,positive
726332.0,Dahlman Rose Maintains Buy On Kinross Gold (KGC),2010-10-19 16:05:00-04:00,KGC,neutral
726333.0,QE2 Has Set Sail  10-13-2010,2010-10-13 15:08:00-04:00,KGC,neutral
726334.0,JP Morgan's Gold & Precious Metals Summary,2010-10-11 07:08:00-04:00,KGC,positive
726335.0,Traders Collaring Up Gains in Kinross (KGC),2010-09-28 13:15:00-04:00,KGC,positive
726336.0,Kinross Pops; Calls Active (KGC),2010-09-16 10:10:00-04:00,KGC,positive
726337.0,Gold Stocks Trading September 15th; Gold Rush is on for KINROSS (NYSE:KGC)(TSX:K)  ,2010-09-15 13:59:00-04:00,KGC,neutral
726338.0,Kinross Shareholders Approve Red Back Combination (KGC),2010-09-15 10:47:00-04:00,KGC,neutral
726339.0,What A Chart Reader's Favorite Pattern Means For Precious Metals,2010-09-14 18:06:00-04:00,KGC,positive
726340.0,Goldcorp Heading for Andean - Analyst Blog,2010-09-03 17:33:00-04:00,KGC,neutral
726341.0,Kinross and Red Back Confident of Friendly Combination  ,2010-09-03 10:39:00-04:00,KGC,positive
726342.0,Kinross-Red Back Merger? - Analyst Blog,2010-09-03 09:06:00-04:00,KGC,neutral
726343.0,Gold Rushing on Into Autumn,2010-09-02 14:54:00-04:00,KGC,neutral
726344.0,Metals and Mining Review - Sept. 2010 - Industry Outlook,2010-08-31 18:12:00-04:00,KGC,neutral
726345.0,Kinross Acquires Dvoinoye Deposit - Analyst Blog,2010-08-30 17:54:00-04:00,KGC,neutral
726346.0,Cramer Says Its Time To Buy Gold ,2010-08-12 08:47:00-04:00,KGC,neutral
726347.0,Fed's Mood Altering Statement  08-10-2010,2010-08-10 19:40:00-04:00,KGC,neutral
726348.0,"Zacks Analyst Blog Highlights: Viacom, News Corporation, Prudential Financial, Kinross Gold Corporation and STMicroelectronics NV - Press Releases",2010-08-06 09:49:00-04:00,KGC,neutral
726349.0,Kinross Reports In-Line - Analyst Blog,2010-08-05 08:52:00-04:00,KGC,neutral
726350.0,Rolling Out & Up  08-03-2010,2010-08-03 16:07:00-04:00,KGC,neutral
726351.0,Talking Ex-Div.  07-23-2010,2010-07-23 18:59:00-04:00,KGC,neutral
726352.0,Not Stressed?  07-23-2010,2010-07-23 15:25:00-04:00,KGC,positive
726353.0,"Kinross Agrees in Principle to Sell Diavik Interest (KGC, HWD)",2010-07-23 09:13:00-04:00,KGC,positive
726354.0,Puts Sold on Kinross Gold Corp. (KGC),2010-06-23 10:41:00-04:00,KGC,neutral
726355.0,Puts Sold on Kinross Gold (KGC),2010-06-16 10:22:00-04:00,KGC,neutral
726356.0,"Top 5 Stocks In The Gold Industry With The Highest Cash (ABX, NEM, KGC, AU, BVN)",2010-05-26 06:21:00-04:00,KGC,positive
726357.0,John Paulson's Q1 2010 Moves,2010-05-18 08:38:00-04:00,KGC,neutral
726358.0,Safety Trade Gold All-Time High  05-11-2010,2010-05-11 18:20:00-04:00,KGC,positive
726359.0,Inflation & Deflation Fighters  05-11-2010,2010-05-11 14:53:00-04:00,KGC,negative
726360.0,"Top 5 Large-Cap Stocks In The Gold Industry With The Highest Dividend (ABX, NEM, AU, GG, KGC)",2010-03-30 08:36:00-04:00,KGC,positive
726361.0,"Top 5 Large-Cap Stocks In The Gold Industry With The Highest Cash (NEM, ABX, AU, GG, KGC)",2010-03-30 08:28:00-04:00,KGC,positive
726362.0,"Top 5 Large-Cap Stocks In Gold Industry With Highest Gross Margins (NEM, KGC, GG, ABX, AU)",2010-03-30 07:41:00-04:00,KGC,positive
726363.0,The Market Vectors Gold Miners ETF (GDX) Appears To Be In A Buying Range,2010-03-29 23:15:00-04:00,KGC,neutral
726364.0,"Hedging With Gold Miners (AEM, GFI, NGD, DGL)",2010-02-09 14:22:00-05:00,KGC,neutral
726365.0,Kingross Gold is Shining ,2010-02-09 10:41:00-05:00,KGC,neutral
726366.0,KGCs Stock Protected Against the Risk of a Pullback in Gold Prices,2009-12-01 10:51:00-05:00,KGC,positive
726367.0,"Benzingas Top Upgrades (LTD, BPFH, CBT, KGC, BBT, FITB, CLWR)",2009-12-01 09:47:00-05:00,KGC,positive
726368.0,"Gold Rush Exhausts Storage Space, GLD, GDX, KGC, AUY, GG ",2009-11-24 12:55:00-05:00,KGC,positive
726369.0,"Gold Continues Its Run (NEM, GLD, GDX, KGC, ABX)",2009-11-24 08:58:00-05:00,KGC,neutral
726370.0,John Paulson Set to Launch Gold (GLD) Hedge Fund,2009-11-19 09:27:00-05:00,KGC,neutral
726371.0,"Newmont Mining, Anglogold Rocket Higher as Gold Futures Rise",2009-11-06 11:01:00-05:00,KGC,neutral
726372.0,Fox's Eric Bolling Explains Why Gold Moved Higher,2009-10-09 15:35:00-04:00,KGC,neutral
726373.0,"Gold breaches $1000 and Silver Reaches 13-Month High, AEM,NGD,KGC,NG climbs",2009-09-11 11:18:00-04:00,KGC,positive
726374.0,"U.S. Gold Futures Hit 6-Month High (ABX, KGC, AUY, GLD)",2009-09-08 08:02:00-04:00,KGC,neutral
726375.0,"WallStSense.com Fundamental & Technical Coverage of SFI, KGC, LNC, SNI, VMC and STLD",2009-08-18 06:28:00-04:00,KGC,neutral
726376.0,"ParagonReport.com Complimentary Stock Review for KGC, RF, TCK, and FO.V",2009-08-14 10:00:00-04:00,KGC,positive
726377.0,Kinross Declares Dividend Increase,2009-08-12 16:37:00-04:00,KGC,positive
726378.0,Kinross Doubles Revenue and Operating Earnings in Q2,2009-08-12 16:36:00-04:00,KGC,neutral
726379.0,Kinross Announces Investment in BCGold Corp.,2009-08-10 18:22:00-04:00,KGC,neutral
