Unnamed: 0,title,date,stock,sentiment
756123.0,Lennar shares are trading higher following a Q4 earnings and sales beat.,2020-01-08 06:53:00-05:00,LEN,positive
756124.0,Lennar Corp shares are trading higher after the company reported better-than-expected Q3 EPS and sales results.,2019-10-02 07:37:00-04:00,LEN,positive
756126.0,"Shares of several consumer discretionary companies are trading lower following an increase in coronavirus cases in some US states that have reopened, leading to concerns of a second wave of the virus. A potential second wave could keep discretionary spending and economic activity low.",2020-06-11 10:41:00-04:00,LEN,positive
756127.0,Shares of several specialty retail companies are trading lower amid market weakness. The sector has run up recently amid business reopenings and a pickup in economic activity and appears to be giving up some gains during the session.,2020-06-04 15:41:00-04:00,LEN,positive
756128.0,Shares of several companies in the broader consumer discretionary space are trading higher as markets continue to gain on optimism over an economic reopening as well as a smaller-than-expected drop in nonfarm payrolls. The economy reopening could mean more consumer spending which is good for the sector.,2020-06-03 10:21:00-04:00,LEN,positive
756129.0,"Benzinga's Top Upgrades, Downgrades For May 28, 2020",2020-05-28 10:07:00-04:00,LEN,positive
756130.0,"Credit Suisse Initiates Coverage On Lennar with Neutral Rating, Announces Price Target of $62",2020-05-28 08:23:00-04:00,LEN,positive
756131.0,"Shares of several consumer discretionary companies are trading higher amid economic optimism, stemming from some US states reopening businesses, an increase in mortgage demand figures and positive vaccine sentiment.",2020-05-27 10:57:00-04:00,LEN,positive
756132.0,In Consumers We Trust: 3 Leveraged ETFs That Surged In April,2020-05-26 09:15:00-04:00,LEN,positive
756133.0,Chop Chop: Strong Earnings Lift Markets After Tuesday Thud; FOMC Minutes Ahead,2020-05-20 12:48:00-04:00,LEN,positive
756134.0,"Who Could Win, Lose As US Homebuilding Starts Decline: Home Depot 'Performing Well' During Coronavirus Crisis",2020-05-19 11:25:00-04:00,LEN,negative
756135.0,"JP Morgan Maintains Neutral on Lennar, Raises Price Target to $57",2020-05-12 10:51:00-04:00,LEN,positive
756136.0,"CFRA Maintains Hold on Lennar, Raises Price Target to $56",2020-05-11 13:05:00-04:00,LEN,neutral
756137.0,Shares of several consumer goods companies are trading higher amid positive investor sentiment as some US states begin to reopen their economies and as oil prices gain for the session.,2020-05-05 12:00:00-04:00,LEN,positive
756138.0,"Apple And Amazon Up To Bat this Afternoon As Investors Ponder Microsoft, Facebook Results",2020-04-30 09:54:00-04:00,LEN,positive
756139.0,Shares of several consumer goods companies are trading higher as equities gain on macro optimism after Gildead's Remdesivir drug showed some effectiveness in treating coronavirus patients. This has raised hopes of a sooner economic recovery.,2020-04-17 10:53:00-04:00,LEN,positive
756140.0,Shares of several consumer goods companies are trading lower amid coronavirus-related demand uncertainty. The pandemic has negatively impacted consumer spending and economic activity.,2020-04-13 13:09:00-04:00,LEN,negative
756141.0,Lennar shares are trading higher in sympathy with the broader market as markets gain amid optimism that coronavirus cases in several US hotspots may be peaking.,2020-04-06 13:30:00-04:00,LEN,positive
756142.0,"Rise In Semiconductor, Cloud Computing Stocks Could Set Tone For Broader Economy",2020-03-24 09:56:00-04:00,LEN,neutral
756143.0,"Raymond James Maintains Outperform on Lennar, Lowers Price Target to $41",2020-03-23 08:10:00-04:00,LEN,negative
756144.0,"Wells Fargo Maintains Overweight on Lennar, Lowers Price Target to $36",2020-03-20 10:47:00-04:00,LEN,negative
756145.0,Mid-Afternoon Market Update: NASDAQ Jumps 4%; Guess? Shares Climb On Earnings Beat,2020-03-19 14:59:00-04:00,LEN,positive
756146.0,"CFRA Reiterates Hold on Lennar, Lowers Price Target to $40",2020-03-19 12:48:00-04:00,LEN,negative
756147.0,Mid-Day Market Update: Crude Oil Surges Over 17%; G-III Apparel Shares Gain On Upbeat Earnings,2020-03-19 12:35:00-04:00,LEN,positive
756148.0,Recap: Lennar Q1 Earnings,2020-03-19 10:38:00-04:00,LEN,neutral
756149.0,Mid-Morning Market Update: Markets Gain; Lennar Beats Q1 Views,2020-03-19 10:18:00-04:00,LEN,positive
756150.0,"Crude Oil, Dollar Index In Focus As Market Weighs Global Stimulus Efforts",2020-03-19 10:10:00-04:00,LEN,negative
756151.0,A Peek Into The Markets: US Stock Futures Down; WTI Crude Oil Rises Over 10%,2020-03-19 06:38:00-04:00,LEN,negative
756152.0,"Lennar Q1 EPS $1.27 Beats $0.84 Estimate, Homebuilding Sales $4.172B Beat $4.16B Estimate, Total Sales $4.505B",2020-03-19 06:02:00-04:00,LEN,neutral
756153.0,"6 Stocks To Watch For March 19, 2020",2020-03-19 05:21:00-04:00,LEN,neutral
756154.0,"Earnings Scheduled For March 19, 2020",2020-03-19 04:54:00-04:00,LEN,neutral
756155.0,Lennar's Q1 Earnings Preview,2020-03-18 14:09:00-04:00,LEN,neutral
756156.0,Lennar shares are trading lower after JP Morgan downgraded the stock from Overweight to Neutral and announced a price target of $38 per share.,2020-03-18 09:00:00-04:00,LEN,positive
756157.0,"JP Morgan Downgrades Lennar to Neutral, Announces $38 Price Target",2020-03-18 05:42:00-04:00,LEN,positive
756158.0,"Banks, Airlines, Apple Among Stocks Being Hit Hard Despite Fed Cutting Rates To Zero",2020-03-16 10:01:00-04:00,LEN,neutral
756159.0,Wild Week Ends With A Late Surge To Nearly Erase Thursday's Losses As Trump Promises Help,2020-03-13 17:41:00-04:00,LEN,positive
756160.0,"Apple Gets Upgrade, Futures Reverse Downward Course As Washington Stimulus Awaited",2020-03-13 09:57:00-04:00,LEN,neutral
756161.0,Stocks That Hit 52-Week Lows On Thursday,2020-03-12 12:10:00-04:00,LEN,negative
756162.0,"Shares of several consumer cyclical companies are trading lower as fears of the coronavirus continue to grow globally, negatively impacting economic growth.",2020-03-11 14:39:00-04:00,LEN,negative
756163.0,"Airlines Continue Suffering As Delta, American Announce Schedule Cuts, But Crude Bounces",2020-03-10 09:42:00-04:00,LEN,negative
756164.0,"Coronavirus Economic Turmoil A Silver Lining For Home Buyers, Builders",2020-03-04 14:43:00-05:00,LEN,negative
756165.0,Shares of several real estate companies and REITs are trading higher after the Federal Reserve announced a 50 bps rate cut.,2020-03-03 10:58:00-05:00,LEN,neutral
756166.0,Stocks That Hit 52-Week Highs On Friday,2020-02-21 10:26:00-05:00,LEN,neutral
756167.0,Stocks That Hit 52-Week Highs On Tuesday,2020-02-11 10:17:00-05:00,LEN,neutral
756168.0,Stocks That Hit 52-Week Highs On Monday,2020-02-10 10:25:00-05:00,LEN,neutral
756169.0,Stocks That Hit 52-Week Highs On Tuesday,2020-01-28 11:05:00-05:00,LEN,neutral
756170.0,Stocks That Hit 52-Week Highs On Friday,2020-01-24 10:41:00-05:00,LEN,neutral
756171.0,"Texas Instruments And Procter & Gamble Results Front And Center, But So Is Asian Virus",2020-01-23 09:37:00-05:00,LEN,neutral
756172.0,Stocks That Hit 52-Week Highs On Wednesday,2020-01-22 10:17:00-05:00,LEN,neutral
756173.0,Stocks That Hit 52-Week Highs On Friday,2020-01-17 13:23:00-05:00,LEN,neutral
756174.0,Stocks That Hit 52-Week Highs On Thursday,2020-01-16 10:22:00-05:00,LEN,neutral
756175.0,Lennar shares are trading higher. Not seeing any news to justify the price action.,2020-01-10 14:38:00-05:00,LEN,positive
756176.0,Lennar Corp Exec Says Housing Market Continued To Strengthen Throughout Q4;  Says Market For New Homes Has Continued A Steady Improvement From Last Year's Pause As Lower Interest Rates Have Stimulated Demand,2020-01-08 11:11:00-05:00,LEN,positive
756177.0,13 Consumer Cyclical Stocks Moving In Wednesday's Pre-Market Session,2020-01-08 08:08:00-05:00,LEN,neutral
756178.0,Lennar shares are trading higher following a Q4 earnings and sales beat.,2020-01-08 06:53:00-05:00,LEN,positive
756179.0,"Lennar Q4 EPS $2.13 Beats $1.9 Estimate, Sales $6.97B Beat $6.55B Estimate",2020-01-08 06:01:00-05:00,LEN,neutral
756180.0,"Earnings Scheduled For January 8, 2020",2020-01-08 04:42:00-05:00,LEN,neutral
756181.0,"8 Stocks To Watch For January 8, 2020",2020-01-08 04:39:00-05:00,LEN,neutral
756182.0,"PreMarket Prep Recap: Impact Of Cowen's Chip Upgrade, Raymond James Makes A Call In The Housing Sector",2020-01-07 11:27:00-05:00,LEN,neutral
756183.0,"Stocks Gain In US, Overseas As Investor Tension About Middle East Eases",2020-01-07 10:01:00-05:00,LEN,positive
756184.0,"Benzinga Pro's Top 5 Stocks To Watch For Tues., Jan. 7, 2020: TSLA, SQ, LEN, APOP, PIR",2020-01-07 08:57:00-05:00,LEN,positive
756185.0,"Perspective Time: Geopolitics Hits Markets, But Losses Not Too Steep Yet And Volatility Tame",2020-01-06 09:42:00-05:00,LEN,negative
756186.0,"Wedbush Reiterates Outperform, $72 Target On Lennar Ahead Of Q4 Results As Firm Views Co. 'as undervalued especially in light of the company's shift to more affordable product'",2019-12-30 07:25:00-05:00,LEN,neutral
756187.0,"Argus Research Maintains Buy on Lennar, Raises Price Target to $65",2019-12-23 10:34:00-05:00,LEN,neutral
756188.0,"Benzinga's Top Upgrades, Downgrades For December 17, 2019",2019-12-17 11:16:00-05:00,LEN,positive
756189.0,"RBC Bullish On Installed Building Products, Downgrades 3 Other Homebuilders",2019-12-17 10:41:00-05:00,LEN,neutral
756190.0,"RBC Capital Downgrades Lennar to Sector Perform, Lowers Price Target to $62",2019-12-17 06:49:00-05:00,LEN,negative
756191.0,"UPDATE: Goldman Initiates Lenar With Buy, $71 Target 'given its indexing to the fastest growing and most affordable MSAs, opportunities to reduce overhead costs, and expected improvement in returns'",2019-12-06 11:54:00-05:00,LEN,positive
756192.0,UPDATE: Goldman Initiates 6 Home Builders With A Positive Sector View As Firm Notes 'Our analysis of the housing market points to an acceleration in activity next year given an accommodative rate environment with broader economic expansion',2019-12-06 11:46:00-05:00,LEN,positive
756193.0,"Benzinga's Top Upgrades, Downgrades For December 6, 2019",2019-12-06 10:24:00-05:00,LEN,positive
756194.0,"Benzinga Pro's Top 5 Stocks To Watch For Fri., Dec. 6, 2019: TSLA, ONTX, XHB, BIG, SFIX",2019-12-06 08:49:00-05:00,LEN,positive
756195.0,"Goldman Sachs Initiates Coverage On Lennar with Buy Rating, Announces $71 Price Target",2019-12-06 06:30:00-05:00,LEN,neutral
756196.0,"Cramer Shares His Thoughts On Twitter, Ventas And More",2019-12-05 11:05:00-05:00,LEN,positive
756197.0,Stocks That Hit 52-Week Highs On Friday,2019-10-25 12:47:00-04:00,LEN,neutral
756198.0,16 Stocks With The Highest Long-Term Sales Growth Rate,2019-10-23 15:26:00-04:00,LEN,positive
756199.0,Stocks That Hit 52-Week Highs On Monday,2019-10-21 11:06:00-04:00,LEN,neutral
756200.0,Stocks That Hit 52-Week Highs On Thursday,2019-10-17 11:00:00-04:00,LEN,neutral
756201.0,"Top 10 Most Overbought Stocks Via Benzinga Pro's Screener Tool For Wed., October 16, 2019",2019-10-16 15:13:00-04:00,LEN,positive
756202.0,Stocks That Hit 52-Week Highs On Wednesday,2019-10-16 10:42:00-04:00,LEN,neutral
756203.0,"Top 10 Most Overbought Stocks Via Benzinga Pro's Screener Tool For Wed., October 09, 2019",2019-10-09 14:25:00-04:00,LEN,positive
756204.0,Stocks That Hit 52-Week Highs On Friday,2019-10-04 12:45:00-04:00,LEN,neutral
756205.0,"Top 10 Most Overbought Stocks Via Benzinga Pro's Screener Tool For Fri., October 04, 2019",2019-10-04 12:20:00-04:00,LEN,positive
756206.0,"Analysts Like Lennar Q3 Print, Say Homebuilder Well Positioned For Growth",2019-10-03 14:33:00-04:00,LEN,positive
756207.0,Stocks That Hit 52-Week Highs On Thursday,2019-10-03 12:47:00-04:00,LEN,neutral
756208.0,"A Look At Benzinga Pro's Most-Searched Tickers For October 3, 2019",2019-10-03 12:29:00-04:00,LEN,neutral
756209.0,"Benzinga Pro's Top 10 Most-Searched Tickers For Morning of Thursday, October 3, 2019",2019-10-03 10:11:00-04:00,LEN,positive
756210.0,"Lots Of Earnings In The Mix as Market Digests PepsiCo Results, Awaits Costco",2019-10-03 10:08:00-04:00,LEN,positive
756211.0,"BTIG Maintains Buy on Lennar, Raises Price Target to $75",2019-10-03 09:00:00-04:00,LEN,neutral
756212.0,10 Biggest Price Target Changes For Thursday,2019-10-03 09:00:00-04:00,LEN,neutral
756213.0,"Buckingham Maintains Buy on Lennar, Raises Price Target to $67",2019-10-03 08:44:00-04:00,LEN,neutral
756214.0,"JMP Securities Reiterates Market Outperform on Lennar, Raises Price Target to $65",2019-10-03 07:42:00-04:00,LEN,positive
756215.0,"RBC Capital Maintains Outperform on Lennar, Raises Price Target to $63",2019-10-03 07:25:00-04:00,LEN,neutral
756216.0,Mid-Afternoon Market Update: Stars Group Jumps On Merger With Flutter Entertainment; Lantheus Shares Plunge,2019-10-02 14:45:00-04:00,LEN,positive
756217.0,Mid-Day Market Update: United Natural Foods Falls On Downbeat Q4 Results; Immuron Shares Surge,2019-10-02 12:27:00-04:00,LEN,positive
756218.0,CORRECTION: Lennar Gave Q4 Deliveries Guidance On Call Of 15.8-16K Homes; Initial headline included incorrect deliveries figures from the source,2019-10-02 12:14:00-04:00,LEN,neutral
756219.0,From Lennar Q3 Earnings Conference Call: Sees Q4 Deliveries 15.8K-16K Homes,2019-10-02 11:47:00-04:00,LEN,neutral
756220.0,From Lennar Q3 Earnings Conference Call: Sees Q4 Gross Margins 21.25-21.5%,2019-10-02 11:43:00-04:00,LEN,negative
756221.0,Stocks That Hit 52-Week Highs On Wednesday,2019-10-02 10:52:00-04:00,LEN,neutral
756222.0,Mid-Morning Market Update: Markets Open Lower; Lennar Beats Q3 Views,2019-10-02 10:19:00-04:00,LEN,negative
756223.0,"Department Of Good News: Lennar Earnings Look Solid, SPX Still Within Long-Term Range",2019-10-02 10:05:00-04:00,LEN,positive
756224.0,23 Stocks Moving in Wednesday's Pre-Market Session,2019-10-02 07:57:00-04:00,LEN,neutral
756225.0,Lennar Reports Q3 Earnings Beat,2019-10-02 07:39:00-04:00,LEN,neutral
756226.0,Lennar Corp shares are trading higher after the company reported better-than-expected Q3 EPS and sales results.,2019-10-02 07:37:00-04:00,LEN,positive
756227.0,Lennar Reports Q3 Home Orders Up 9%,2019-10-02 06:03:00-04:00,LEN,neutral
756228.0,"Lennar Q3 EPS $1.59 Beats $1.32 Estimate, Sales $5.857B Beat $5.49B Estimate",2019-10-02 06:02:00-04:00,LEN,neutral
756229.0,"7 Stocks To Watch For October 2, 2019",2019-10-02 04:08:00-04:00,LEN,neutral
756230.0,"Earnings Scheduled For October 2, 2019",2019-10-02 03:45:00-04:00,LEN,neutral
756231.0,Stocks That Hit 52-Week Highs On Tuesday,2019-10-01 14:25:00-04:00,LEN,neutral
756232.0,"After Resilient Q3, Positive Tone As Fed Speakers Awaited, LEN Earnings Tomorrow",2019-10-01 09:51:00-04:00,LEN,positive
756233.0,"UPDATE: Raymond James On Toll Brothers, Lennar, KB Home Believes 'the August data demonstrated a decided (and perhaps under-appreciated) inflection in supply and pricing conditions, revealing a far more bullish backdrop for homebuilders into year-end'",2019-09-25 13:23:00-04:00,LEN,neutral
756234.0,"UPDATE: Raymond James Upgrades Toll Brothers, Lennar, KB Home To Outperform 'ahead of upcoming earnings announcements that we believe will reveal decidedly improved housing fundamentals and potential upside to current consensus FY20 estimates'",2019-09-25 13:19:00-04:00,LEN,positive
756235.0,"Benzinga's Top Upgrades, Downgrades For September 25, 2019",2019-09-25 10:04:00-04:00,LEN,positive
756236.0,"Raymond James Upgrades Lennar to Outperform, Announces $61 Price Target",2019-09-25 06:43:00-04:00,LEN,neutral
756237.0,Stocks That Hit 52-Week Highs On Monday,2019-09-23 12:51:00-04:00,LEN,neutral
756238.0,"Disney, Lennar And More 'Fast Money' Picks For September 23",2019-09-23 07:34:00-04:00,LEN,neutral
756239.0,"UPDATE: KeyBanc Downgrades Lennar To Sector Weight LEN As Firm Moves 'into a more selective posture as macro catalysts wane, with limited valuation upside as earnings momentum weakens'",2019-09-18 11:24:00-04:00,LEN,negative
756240.0,"Benzinga's Top Upgrades, Downgrades For September 18, 2019",2019-09-18 10:54:00-04:00,LEN,positive
756241.0,KeyBanc Downgrades Lennar to Sector Weight,2019-09-18 05:49:00-04:00,LEN,neutral
756242.0,Stocks That Hit 52-Week Highs On Friday,2019-09-13 14:58:00-04:00,LEN,neutral
756243.0,"Wedbush Remains Buyers Of 'OUTPERFORM-rated LEN, TMHC, WLH, CCS, and BZH' As Firm Believes 'Each of these names should benefit from lower mortgage rates along with their focus on affordable price point homes'",2019-08-27 13:00:00-04:00,LEN,positive
756244.0,"Benzinga's Top Upgrades, Downgrades For August 23, 2019",2019-08-23 09:56:00-04:00,LEN,positive
756245.0,"CORRECTION: Seaport Global Initiates Coverage On Lennar with Buy Rating' A Prior Headline Indicated Stephens Initiated Coverage, This Was Incorrect",2019-08-23 07:29:00-04:00,LEN,neutral
756246.0,"Seaport Global Initiates Coverage On Lennar with Buy Rating, Announces $71 Price Target",2019-08-23 06:57:00-04:00,LEN,neutral
756247.0,"Benzinga's Top Upgrades, Downgrades For August 13, 2019",2019-08-13 09:46:00-04:00,LEN,positive
756248.0,"SunTrust Robinson Humphrey Initiates Coverage On Lennar with Hold Rating, Announces $47 Price Target",2019-08-13 07:32:00-04:00,LEN,neutral
756249.0,Lennar Option Alert: Aug 16 $50 Calls Sweep (2) near the Ask: 2503 @ $0.921 vs 8338 OI; Ref=$47.53,2019-07-01 13:37:00-04:00,LEN,positive
756250.0,Analysts Say Homebuilder Environment Still Looks Good For Lennar,2019-06-26 17:08:00-04:00,LEN,positive
756251.0,8 Biggest Price Target Changes For Wednesday,2019-06-26 12:33:00-04:00,LEN,neutral
756252.0,"Trade Winds, Fed Still In Focus, But Strong Micron Results Might Help Semiconductors",2019-06-26 10:09:00-04:00,LEN,positive
756253.0,"Bank of America Maintains Buy on Lennar, Lowers Price Target to $55",2019-06-26 08:27:00-04:00,LEN,negative
756254.0,"JP Morgan Maintains Overweight on Lennar, Lowers Price Target to $54",2019-06-26 07:54:00-04:00,LEN,negative
756255.0,Mid-Afternoon Market Update: NASDAQ Down 1.5%; Acer Therapeutics Shares Slide,2019-06-25 14:54:00-04:00,LEN,positive
756256.0,Mid-Day Market Update: Allergan Jumps On Acquisition News; Conatus Pharmaceuticals Shares Plunge,2019-06-25 12:56:00-04:00,LEN,positive
756257.0,Lennar shares are trading lower after the company issued Q3 EPS guidance below consensus estimates.,2019-06-25 11:45:00-04:00,LEN,neutral
756258.0,"Lennar Corp Expects Q3 Deliveries Between 13,000 And 13,250 Homes,  Expects Q3 Average Sales Price To Be Between $385,000 And $390,000; Sees Q3 Gross Margin 20.25%-20.50%",2019-06-25 11:43:00-04:00,LEN,negative
756259.0,Hearing Lennar Sees Q3 EPS $1.25-$1.35 vs $1.52 Est.,2019-06-25 11:41:00-04:00,LEN,neutral
756260.0,"Lennar Corp Says US Tariffs On Chinese Goods Has Been A Headwind; On Average, The Impact For Lennar Is About $500 Per Home",2019-06-25 11:29:00-04:00,LEN,neutral
756261.0,Lennar Corp Says Expects To See Margin Improvement Through Remainder Of FY 2019 As Incentives Subside,2019-06-25 11:11:00-04:00,LEN,positive
756262.0,Mid-Morning Market Update: Markets Open Lower; Lennar Tops Q2 Estimates,2019-06-25 10:15:00-04:00,LEN,positive
756263.0,"Anticipation Of Powell Speech, G20 Summit Has Market In Wait-And-See Mode",2019-06-25 10:00:00-04:00,LEN,positive
756264.0,30 Stocks Moving In Tuesday's Pre-Market Session,2019-06-25 08:04:00-04:00,LEN,neutral
756265.0,Lennar Trades Higher After Q2 Earnings Beat,2019-06-25 07:33:00-04:00,LEN,neutral
756266.0,A Peek Into The Markets: US Stock Futures Down Ahead Of Economic Data,2019-06-25 06:47:00-04:00,LEN,neutral
756267.0,"Lennar Q2 EPS $1.3 Beats $1.14 Estimate, Sales $5.6B Beat $5.1B Estimate",2019-06-25 06:06:00-04:00,LEN,neutral
756268.0,"7 Stocks To Watch For June 25, 2019",2019-06-25 04:50:00-04:00,LEN,neutral
756269.0,"Earnings Scheduled For June 25, 2019",2019-06-25 04:01:00-04:00,LEN,neutral
756270.0,"As Anticipation Firms For Trump/Xi Meeting, Focus Is On Earnings, Iran Tensions",2019-06-24 10:24:00-04:00,LEN,negative
756271.0,"Analyst Downgrades Homebuilders On Macro, Cycle Concerns",2019-06-18 15:52:00-04:00,LEN,neutral
756272.0,"UPDATE: Raymond James Also Sees 'softening macro-economic data points and indicators of a late-cycle shift', And 'competitive inventory remains elevated into summer, potentially creating more gross margin pressure for builders later this year'",2019-06-18 10:27:00-04:00,LEN,negative
756273.0,UPDATE: Raymond James Downgrades KB Home And Lennar Ahead Of Both Co's Earnings Next Week As Firm Sees 'above-average cyclical valuations amid declining earnings estimates across the industry',2019-06-18 10:27:00-04:00,LEN,neutral
756274.0,"Benzinga's Top Upgrades, Downgrades For June 18, 2019",2019-06-18 09:11:00-04:00,LEN,positive
756275.0,A Peek Into The Markets: US Stock Futures Gain Ahead Of Fed Meeting,2019-06-18 07:22:00-04:00,LEN,positive
756276.0,"Raymond James Downgrades Lennar to Market Perform, Announces $55 Price Target",2019-06-18 06:49:00-04:00,LEN,neutral
756277.0,"Bulls And Bears Of The Week: Lennar, Dave & Buster's, Broadcom And More",2019-06-16 21:01:00-04:00,LEN,neutral
756278.0,Wedbush Upgrades Lennar Amid Favorable Homebuilder Market,2019-06-13 13:42:00-04:00,LEN,positive
756279.0,"Benzinga's Top Upgrades, Downgrades For June 13, 2019",2019-06-13 10:32:00-04:00,LEN,positive
756280.0,Wedbush Upgrades Lennar to Outperform,2019-06-13 07:20:00-04:00,LEN,neutral
756281.0,"Chubb, Lennar And More: 'Fast Money' Picks For May 20",2019-05-20 08:01:00-04:00,LEN,neutral
756282.0,"After Chilly Winter, Homebuilders To Share Earnings With High Hopes Ahead",2019-04-23 15:06:00-04:00,LEN,positive
756283.0,"Benzinga's Top Upgrades, Downgrades For April 17, 2019",2019-04-17 08:59:00-04:00,LEN,positive
756284.0,"Susquehanna Downgrades Lennar to Neutral, Lowers Price Target to $57",2019-04-17 07:41:00-04:00,LEN,negative
756285.0,"Jim Cramer Weighs In On Oracle, Bluebird Bio And More",2019-04-16 07:51:00-04:00,LEN,neutral
756286.0,"Benzinga's Top Upgrades, Downgrades For April 1, 2019",2019-04-01 09:02:00-04:00,LEN,positive
756287.0,"Raymond James Downgrades Lennar On Valuation, Still Likes Long-Term Prospects",2019-04-01 08:39:00-04:00,LEN,positive
756288.0,Raymond James Downgrades Lennar to Outperform,2019-04-01 07:02:00-04:00,LEN,neutral
756289.0,KeyBanc Raises Lennar's Price Target On Housing Market Optimism,2019-03-28 13:06:00-04:00,LEN,positive
756290.0,10 Biggest Price Target Changes For Thursday,2019-03-28 09:50:00-04:00,LEN,neutral
756291.0,"KeyBanc Maintains Overweight on Lennar, Raises Price Target to $57",2019-03-28 08:36:00-04:00,LEN,negative
756292.0,"Cramer Talks KB Home Earnings, Implications For Housing Sector",2019-03-27 16:21:00-04:00,LEN,neutral
756293.0,Shares of several homebuilding companies are trading higher after earnings reports from KB Home and Lennar.,2019-03-27 13:02:00-04:00,LEN,positive
756294.0,Lennar CEO Says 'We Are Optimistic That The Housing Market Has Found Firm Ground And Is Ready To Move Forward',2019-03-27 12:20:00-04:00,LEN,positive
756295.0,Lennar Ceo Says Co. Expects 5 percent to 7 Percent Unit Growth For Next Year,2019-03-27 12:19:00-04:00,LEN,positive
756296.0,"Lennar CEO On Conference Call Says 'We Believe That As We Move Into Q2, Into Q3, That The Level Of Incentives Is Going To Start To Dissipate'",2019-03-27 12:09:00-04:00,LEN,positive
756297.0,From Lennar Q1 Earnings Conference Call; Co. Sees Q2 EPS $1.07-$1.20 vs $1.38 Est.,2019-03-27 11:45:00-04:00,LEN,neutral
756298.0,"From Lennar Q1 Earnings Conference Call: Sees Q2 New Orders 14K-14.3K, Deliveries 11.7K-12K Homes",2019-03-27 11:41:00-04:00,LEN,neutral
756299.0,"Lennar On Conference Call Says As A Result Of Strategic Transactions, Financial Services Headcount Has Been Reduced From About 3,200 At Year-End To About 1,700",2019-03-27 11:35:00-04:00,LEN,neutral
756300.0,"Lennar On Conference Call Says The Industry Still Faces Headwinds Of Ongoing Labor Prices, Which Pressures Labor Costs, Along With Material Cost Pressures From Tariffs, Factory Labor Shortages, Stricter Energy Codes",2019-03-27 11:27:00-04:00,LEN,negative
756301.0,"Lennar On Conference Call Says Q1 Deliveries Were Hit By Adverse Weather Conditions; These Deliveries Will Shift Into Q2, And Some Q2 Deliveries Will Shift Into Q3",2019-03-27 11:19:00-04:00,LEN,negative
756302.0,"Lennar On Conference Call Says Co. Sees 2019 Deliveries Of Between 50,000 And 51,000 Homes",2019-03-27 11:18:00-04:00,LEN,neutral
756303.0,Yields In Focus Again As 10-Year Falls Below 2.4%; Homebuilder Earnings Digested,2019-03-27 09:57:00-04:00,LEN,neutral
756304.0,Lennar shares are trading higher after the company said it sees the housing market improving.,2019-03-27 09:21:00-04:00,LEN,positive
756305.0,"Lennar Q1 EPS $0.74 Misses $0.76 Estimate, Sales $3.868B Miss $4.11B Estimate",2019-03-27 06:06:00-04:00,LEN,negative
756306.0,"11 Stocks To Watch For March 27, 2019",2019-03-27 04:19:00-04:00,LEN,neutral
756307.0,"Earnings Scheduled For March 27, 2019",2019-03-27 04:07:00-04:00,LEN,neutral
756308.0,"Freddie Mac's Mar. Forecast Report Shows Lower-Than-Expected Mortgage Rates, House Price Moderation Will Help Spring Homebuilding",2019-03-22 09:42:00-04:00,LEN,positive
756309.0,Shares of several stocks in the homebuilding sector are trading higher after 30-year fixed US mortgage rates fell.,2019-03-21 13:22:00-04:00,LEN,positive
756310.0,Wedbush Talks Homebuilders Ahead Of Next Week's Busy Schedule,2019-02-21 11:45:00-05:00,LEN,neutral
756311.0,"UPDATE: Wedbush Downgrades Lennar And DR Horton To Neutral As Firm Is 'cautiously optimistic on new home demand, but we are more apt to take profits in the current environment due to affordability issues and what feels like a slow start to the spring'",2019-02-21 09:28:00-05:00,LEN,positive
756312.0,"Benzinga's Top Upgrades, Downgrades For February 21, 2019",2019-02-21 08:53:00-05:00,LEN,positive
756313.0,"Wedbush Downgrades Lennar to Neutral, Announces $50",2019-02-21 07:35:00-05:00,LEN,neutral
