Unnamed: 0,title,date,stock,sentiment
756993.0,Today's Dysfunctional Markets: Good Economic News Triggers Immediate Headwinds ,2013-07-06 11:19:00-04:00,LEN,positive
756994.0,"Market Wrap for July 5: Stocks, Oil, U.S. Dollar Jump in Wake of Strong Payrolls Report; Treasuries and Precious Metals Plunge ",2013-07-05 16:36:00-04:00,LEN,positive
756995.0,"Short Interest Continues to Rise in NVR and Taylor Morrison (NVR, TMHC, TOL)",2013-06-29 11:56:00-04:00,LEN,positive
756996.0,The Silver Lining in This Earnings Season's Numbers,2013-06-27 10:08:00-04:00,LEN,neutral
756997.0,"CRT Capital Upgrades Lennar Corporation to Buy, Announces $48.50 PT",2013-06-27 07:54:00-04:00,LEN,neutral
756998.0,SLIDESHOW: Top Stocks For The DOMA Ruling,2013-06-26 12:14:00-04:00,LEN,positive
756999.0,UPDATE: Goldman Sachs Raises PT on Lennar on 2Q Results,2013-06-26 10:50:00-04:00,LEN,neutral
757000.0,"Goldman Sachs Maintains Neutral on Lennar Corporation, Raises PT to $37.50",2013-06-26 09:15:00-04:00,LEN,neutral
757001.0,"Benzinga Market Primer: Wednesday, June 26",2013-06-26 06:31:00-04:00,LEN,neutral
757002.0,Summary of Important Points from Lennar Conference Call,2013-06-25 16:00:00-04:00,LEN,positive
757003.0,"Mid-Day Market Update: Lennar Rises On Upbeat Profit, Barnes & Noble Tumbles",2013-06-25 14:15:00-04:00,LEN,positive
757004.0,From Lennar Call: Sees Apartment Pipeline Growing to $2B,2013-06-25 11:41:00-04:00,LEN,positive
757005.0,"Lennar CEO Miller on Call Says Housing Recovery is Based on LT Demand for Homes, Says US Still in Beginning Stages of Housing Recovery",2013-06-25 11:16:00-04:00,LEN,negative
757006.0,Lennar Q2 Call Just Beginning,2013-06-25 11:03:00-04:00,LEN,neutral
757007.0,"New Home Sales Climb Faster Than Forecast, Easing Rate Rise Fears",2013-06-25 10:44:00-04:00,LEN,negative
757008.0,"Mid-Morning Market Update: Markets Open Higher, Walgreen Profit Misses Estimates",2013-06-25 10:33:00-04:00,LEN,positive
757009.0,Benzinga's Volume Movers,2013-06-25 10:22:00-04:00,LEN,neutral
757010.0,Home Prices Rise In April At Record Rate,2013-06-25 10:10:00-04:00,LEN,neutral
757011.0,"Lennar Earnings Squash Estimates, Revenue Jumps, Shares Jump (LEN)",2013-06-25 08:19:00-04:00,LEN,positive
757012.0,Benzinga's Top Pre-Market Gainers,2013-06-25 08:11:00-04:00,LEN,positive
757013.0,A Peek Into The Market Before The Trading Starts,2013-06-25 07:24:00-04:00,LEN,neutral
757014.0,"Lennar Q2 EPS $0.43 Ex-Items, GAAP EPS $0.61",2013-06-25 07:11:00-04:00,LEN,neutral
757015.0,UPDATE: Lennar Posts Upbeat Q2 Profit,2013-06-25 06:34:00-04:00,LEN,positive
757016.0,US Stock Futures Up Ahead Of Economic Data,2013-06-25 06:30:00-04:00,LEN,neutral
757017.0,"Benzinga Market Primer: Tuesday, June 25: Housing In Focus",2013-06-25 06:23:00-04:00,LEN,neutral
757018.0,"Lennar Corporation Reports Q2 GAAP EPS of $0.61, Non-GAAP EPS $0.43 vs $0.33 Est; Revenue of $1.43B vs $1.33B Est",2013-06-25 06:16:00-04:00,LEN,neutral
757019.0,"Earnings Scheduled For June 25, 2013",2013-06-25 04:25:00-04:00,LEN,neutral
757020.0,"Stocks To Watch For June 25, 2013",2013-06-25 04:12:00-04:00,LEN,neutral
757021.0,"Earnings Calendar for June 25, 2013",2013-06-24 14:13:00-04:00,LEN,neutral
757022.0,"Goldman Sachs Reinstates Neutral on Lennar Corporation, Announces $36.00 PT",2013-06-24 06:30:00-04:00,LEN,neutral
757023.0,Earnings Expectations for the Week of June 24,2013-06-23 20:41:00-04:00,LEN,neutral
757024.0,Weekly Preview: Economic Data Takes Center Stage In Earnings Lull,2013-06-21 16:02:00-04:00,LEN,neutral
757025.0,Susquehanna Upgrades Lennar Corporation to Neutral,2013-06-21 08:24:00-04:00,LEN,neutral
757026.0,Lennar Expands to Nashville Market,2013-06-18 08:37:00-04:00,LEN,positive
757027.0,"Short Interest Swings in Home Builder Stocks (KBH, NVR, TMHC)",2013-06-14 10:03:00-04:00,LEN,positive
757028.0,Lennar Increases Unsecured Revolving Credit Facility Agreement To $950M,2013-06-12 08:33:00-04:00,LEN,positive
757029.0,Lennar Raises Unsecured Revolving Credit Facility to $950M,2013-06-12 08:30:00-04:00,LEN,neutral
757030.0,Keefe Bruyette & Woods Upgrades Lennar Corporation to Outperform,2013-06-12 06:57:00-04:00,LEN,neutral
757031.0,"JP Morgan Downgrades Lennar Corporation to Neutral, Lowers PT to $46.50",2013-06-10 08:43:00-04:00,LEN,positive
757032.0,"Homebuilders Lennar, Toll Brothers Trade Down About 5%",2013-05-29 15:05:00-04:00,LEN,neutral
757033.0,Hovnanian Enterprises: Small Cap Analysis,2013-05-23 10:51:00-04:00,LEN,neutral
757034.0,Top 4 NYSE Stocks In The Residential Construction Industry With The Highest Dividend Yield,2013-05-03 05:25:00-04:00,LEN,positive
757035.0,Believe It: A Bear Call on Homebuilder ETFs,2013-04-30 16:22:00-04:00,LEN,neutral
757036.0,Barron's Recap: Here Come the Millennials,2013-04-28 17:25:00-04:00,LEN,neutral
757037.0,Short Interest in Home Builder Stocks ,2013-04-26 13:26:00-04:00,LEN,positive
757038.0,"Barclays Upgrades Lennar Corporation to Overweight, Raises PT to $50.00",2013-04-23 06:49:00-04:00,LEN,negative
757039.0,Supply of Homes Catching Up With Demand as Sales Decline,2013-04-22 12:34:00-04:00,LEN,negative
757040.0,Top 4 Mid-Cap Stocks In The Residential Construction Industry With The Highest EPS,2013-04-19 05:53:00-04:00,LEN,positive
757041.0,UPDATE: Deutsche Bank Raises PT on Lennar Corporation on In-Line Results,2013-04-15 08:33:00-04:00,LEN,neutral
757042.0,"Deutsche Bank Maintains Hold on Lennar Corporation, Raises PT to $38.00",2013-04-14 12:26:00-04:00,LEN,neutral
757043.0,"Short Interest Swings Home Builder Stocks (NVR, SPF, TPH)",2013-04-11 12:46:00-04:00,LEN,positive
757044.0,Trulia Chief Economist Kolko Says Builders' Labor Shortages Likely to Get Worse,2013-04-05 10:44:00-04:00,LEN,negative
757045.0,FBN Securities Upgrades Lennar Corporation to Sector Perform,2013-04-03 16:53:00-04:00,LEN,positive
757046.0,"Short Interest in Home Builder Stocks Rises (MTH, SPF, TPH)",2013-03-29 14:30:00-04:00,LEN,positive
757047.0,UPDATE: Sterne Agee Maintains Lennar at Neutral Following Wednesday's EPS Beat,2013-03-21 12:40:00-04:00,LEN,neutral
757048.0,"Market Wrap for Wednesday, March 20: Stocks Rise as Fed Maintains Asset Purchases",2013-03-20 16:20:00-04:00,LEN,positive
757049.0,"UPDATE: Miller Says Lennar Sees Average Margin Growth of 23-24% in FY 2013, Buying Land Now for 2014 and Beyond, Increased Communities 14% Year Over Year",2013-03-20 11:18:00-04:00,LEN,positive
757050.0,"On Conference Call, Lennar CEO Stuart Miller Says Land Prices Have Moved Up Significantly, Larger Builders Will Increase Market Share, Recovery Will be Sustained for Several Years",2013-03-20 11:16:00-04:00,LEN,positive
757051.0,Lennar Spikes to Highs,2013-03-20 11:13:00-04:00,LEN,neutral
757052.0,UPDATE: Lennar Posts Higher Q1 Profit,2013-03-20 07:54:00-04:00,LEN,positive
757053.0,"US Stock Futures Up, Fed In Focus",2013-03-20 06:52:00-04:00,LEN,neutral
757054.0,"Benzinga Market Primer: Wednesday, March 20",2013-03-20 06:31:00-04:00,LEN,neutral
757055.0,"Earnings Scheduled For March 20, 2013",2013-03-20 04:16:00-04:00,LEN,neutral
757056.0,"Raymond James Upgrades Lennar Corporation to Outperform, Announces $45.00 PT",2013-03-19 09:02:00-04:00,LEN,neutral
757057.0,"Stocks to Watch for the Week of March 18, 2013",2013-03-18 15:58:00-04:00,LEN,neutral
757058.0,"ISI Group Reiterates Buy Rating, $45 PT on Lennar Corporation Ahead of 4Q Earnings Report",2013-03-18 14:12:00-04:00,LEN,negative
757059.0,UPDATE: Sterne Agee Reiterates Lennar Corporation at Neutral Ahead of FQ1 Release,2013-03-18 13:32:00-04:00,LEN,neutral
757060.0,Earnings Expectations for the Week of March 18,2013-03-17 15:16:00-04:00,LEN,neutral
757061.0,"The Week Ahead: Earnings from General Mills, Oracle",2013-03-15 16:56:00-04:00,LEN,neutral
757062.0,The Top 10 Shorted Stocks for February,2013-03-15 09:41:00-04:00,LEN,positive
757063.0,"Lennar CEO Miller on CNBC: Calls Demand Strong, Says Mortgage Market Freeing Up, Says Co. Focused on Strength of Balance Sheet with Liquidity",2013-03-15 08:43:00-04:00,LEN,positive
757064.0,"Short Interest in Home Builder Stocks Returns (HOV, MDC, TPH)",2013-03-14 12:53:00-04:00,LEN,positive
757065.0,UPDATE: Sterne Agee Initiates Lennar Corporation at Neutral; Valuation Fair in Lieu of Catalysts,2013-03-14 08:19:00-04:00,LEN,positive
757066.0,"Sterne Agee Initiates Coverage on Lennar Corporation at Neutral, Announces $45.00 PT",2013-03-13 16:10:00-04:00,LEN,neutral
757067.0,"Short Interest in Homebuilder Stocks Shrinks (DHI, MDC, PHM)",2013-03-02 09:56:00-05:00,LEN,positive
757068.0,New Home Sales Shine and Housing Stocks Power Higher ,2013-02-28 16:23:00-05:00,LEN,neutral
757069.0,Three Potential Short Squeeze Plays,2013-02-25 14:52:00-05:00,LEN,positive
757070.0,Cracking Foundations For Homebuilders ETFs?,2013-02-20 14:15:00-05:00,LEN,neutral
757071.0,"Short Interest in Homebuilder Stocks Falls (HOV, MTH, PHM)",2013-02-12 16:42:00-05:00,LEN,positive
757072.0,"UPDATE: Deutsche Bank Reiterates Hold Rating, Raises PT on Lennar Corporation on 4Q12 Results",2013-02-11 13:45:00-05:00,LEN,neutral
757073.0,"Deutsche Bank Maintains Hold on Lennar Corporation, Raises PT to $37.00",2013-02-11 08:17:00-05:00,LEN,neutral
757074.0,S&P Bearish on Home Builders ETF,2013-01-30 16:55:00-05:00,LEN,neutral
757075.0,"Home Builders D.R. Horton, Ryland Show No Quit",2013-01-30 08:42:00-05:00,LEN,negative
757076.0,Lennar Plans to Sell Senior Notes,2013-01-30 08:37:00-05:00,LEN,neutral
757077.0,Benzinga's Top Downgrades,2013-01-30 07:36:00-05:00,LEN,positive
757078.0,"Credit Suisse Downgrades Lennar Corporation to Neutral, Raises PT to $41.50",2013-01-30 07:18:00-05:00,LEN,positive
757079.0,"Compass Point Upgrades Lennar Corporation to Buy, Raises PT to $49.50",2013-01-29 06:49:00-05:00,LEN,neutral
757080.0,Weyerhaeuser CEO Fulton Sees 30% Jump in Housing Start Within US During 2013,2013-01-25 10:13:00-05:00,LEN,neutral
757081.0,Is The Fed Trying To Create Another Housing Boom?,2013-01-22 15:08:00-05:00,LEN,positive
757082.0,Home Builders: No; Mortgage Service Providers: Yes,2013-01-18 13:25:00-05:00,LEN,positive
757083.0,Lennar Declares $0.04 Dividend,2013-01-17 17:04:00-05:00,LEN,neutral
757084.0,UPDATE: Williams Capital Raises PT to $45 for Lennar on Positive Outlook  ,2013-01-16 13:35:00-05:00,LEN,positive
757085.0,"Williams Capital Markets Maintains Buy on Lennar Corporation, Raises PT to $45.00",2013-01-16 10:05:00-05:00,LEN,neutral
757086.0,"Topeka Capital Suspends Hold Rating on Lennar Corporation, Removes $33.00 PT",2013-01-15 07:43:00-05:00,LEN,neutral
757087.0,A Peek Into The Market Before The Trading Starts,2013-01-15 07:17:00-05:00,LEN,neutral
757088.0,UPDATE: Lennar Posts Upbeat Q4 Profit,2013-01-15 06:30:00-05:00,LEN,positive
757089.0,"Benzinga Market Primer: Tuesday, January 15",2013-01-15 06:26:00-05:00,LEN,neutral
757090.0,US Stock Futures Slightly Lower Ahead Of Economic Data,2013-01-15 06:10:00-05:00,LEN,negative
757091.0,"Earnings Scheduled For January 15, 2013 ",2013-01-15 02:06:00-05:00,LEN,neutral
757092.0,"Stocks To Watch For January 15, 2013",2013-01-15 01:32:00-05:00,LEN,neutral
757093.0,Lennar Earnings Preview: Another Strong Quarter Expected,2013-01-14 12:11:00-05:00,LEN,positive
757094.0,The Week Ahead: Financials in Focus,2013-01-11 17:26:00-05:00,LEN,neutral
757095.0,RRI Offers Update on Status of Peachtree Parkway Sale with Lennar Multifamily Investors,2013-01-10 08:38:00-05:00,LEN,neutral
757096.0,Goldman Sachs and Others That May Beat Earnings,2013-01-08 13:42:00-05:00,LEN,neutral
757097.0,These Markets Look Overbought Already,2013-01-02 12:24:00-05:00,LEN,neutral
757098.0,Is There Something Suspicious About Ackman's Herbalife Timing?,2012-12-21 14:27:00-05:00,LEN,negative
757099.0,KB Home Drops: Is the Housing Rebound Losing Momentum?,2012-12-20 12:49:00-05:00,LEN,negative
757100.0,UPDATE: Topeka Capital Markets Initiates Lennar at Hold on Valuation  ,2012-12-07 09:02:00-05:00,LEN,neutral
757101.0,"Topeka Capital Initiates Coverage on Lennar Corporation at Hold, Announces $33.00 PT",2012-12-07 07:12:00-05:00,LEN,neutral
757102.0,Home-builders Could Be Affected By The Fiscal Cliff,2012-11-29 19:38:00-05:00,LEN,negative
757103.0,Top 4 NYSE Stocks In The Residential Construction Industry With The Highest Dividend Yield,2012-11-26 02:15:00-05:00,LEN,positive
757104.0,Could A Housing Stock Correction Be Overdue?,2012-11-20 13:25:00-05:00,LEN,neutral
757105.0,"After Surging, Homebuilder ETFs Look Pricey ",2012-11-02 12:57:00-04:00,LEN,neutral
757106.0,Benzinga's Top Pre-Market Losers,2012-10-22 08:18:00-04:00,LEN,negative
757107.0,Missed the Home Builder Run? Consider These Ancillary Plays,2012-10-19 08:23:00-04:00,LEN,negative
757108.0,Lennar Proposes To Sell $350 Million Of Senior Notes,2012-10-18 08:39:00-04:00,LEN,neutral
757109.0,Roberts Realty Will Site to Lennar for $7.59M,2012-10-11 16:26:00-04:00,LEN,neutral
757110.0,Use an Industrial ETF for Exposure to Resurgent Real Estate Market ,2012-10-11 07:08:00-04:00,LEN,neutral
757111.0,Home Builders Mixed as Housing Signals Remain Unclear,2012-10-08 10:41:00-04:00,LEN,negative
757112.0,"Deutsche Bank Maintains Lennar Class A at Hold, Raises PT from $32 to $33",2012-10-08 07:00:00-04:00,LEN,neutral
757113.0,Top 4 NYSE Stocks In The Residential Construction Industry With The Highest ROE,2012-10-05 04:04:00-04:00,LEN,positive
757114.0,UPDATE: Citigroup Upgrades Lennar to Neutral on Growth and Margins  ,2012-10-02 07:40:00-04:00,LEN,positive
757115.0,A Peek Into The Market Before The Trading Starts,2012-10-02 07:15:00-04:00,LEN,neutral
757116.0,Benzinga's Top Upgrades,2012-10-02 07:11:00-04:00,LEN,positive
757117.0,"Citigroup Upgrades Lennar Class A from Sell to Neutral, Raises PT from $22 to $35",2012-10-02 07:05:00-04:00,LEN,neutral
757118.0,UPDATE: ISI Group Raises PT to $43 on Lennar on Strong Results  ,2012-09-25 13:58:00-04:00,LEN,positive
757119.0,"UBS Maintains Lennar Class A at Neutral, Raises PT from $30 to $38",2012-09-25 11:50:00-04:00,LEN,neutral
757120.0,"JP Morgan Maintains Lennar Class A at Overweight, Raises PT from $36 to $41",2012-09-25 06:48:00-04:00,LEN,neutral
757121.0,"ISI Group Maintains Lennar Class A at Buy, Raises PT to $43",2012-09-25 06:46:00-04:00,LEN,neutral
757122.0,"Williams Capital Maintains Lennar Class A at Buy, Raises PT from $35 to $43",2012-09-25 06:44:00-04:00,LEN,neutral
757123.0,Lennar Slips Despite Stellar Q3 Results,2012-09-24 14:22:00-04:00,LEN,neutral
757124.0,UPDATE: Lennar Posts Surge In FQ3 Profit,2012-09-24 13:06:00-04:00,LEN,positive
757125.0,"Lennar CEO Stuart Speaks in Conference Call, Says Housing Recovery is Pocketed; Florida California, East Coast Markets Stronger; Move-Up Buyers Stronger Than First-Time Buyers",2012-09-24 12:00:00-04:00,LEN,positive
757126.0,Lennar Chief Operating Officer Jaffe Says Total 5% Increase in Cost of Materials; Materials Are 42% Of Sales Price For Homes; Lumber is 7.5% of Construction Costs and Has Risen 20-25% ,2012-09-24 11:58:00-04:00,LEN,positive
757127.0,"UPDATE: Lennar Says It Has 124k Home Sites, 444 Communities",2012-09-24 11:26:00-04:00,LEN,neutral
757128.0,"UPDATE: Lennar Says Home Prices Going Back to Normal, Not Peak; Labor Shortages in Phoenix, Florida, Texas",2012-09-24 11:22:00-04:00,LEN,positive
757129.0,"Lennar's CEO Says Home Inventories Declining, Mortgage Approval Process Improving; Homebuilding Beginning to Revert to Normal ",2012-09-24 11:08:00-04:00,LEN,positive
757130.0,"Benzinga Market Primer, Monday September 24",2012-09-24 08:11:00-04:00,LEN,neutral
757131.0,Earnings Expectations for the Week of September 24,2012-09-24 07:08:00-04:00,LEN,neutral
757132.0,Lennar Class A Reports Q3 EPS $0.40 vs $0.28 Est; Revenues $1.1B vs $1.05B Est,2012-09-24 06:08:00-04:00,LEN,neutral
757133.0,"Stocks To Watch For September 24, 2012 ",2012-09-24 05:53:00-04:00,LEN,neutral
757134.0,"Earnings Scheduled For September 24, 2012 ",2012-09-24 05:25:00-04:00,LEN,neutral
757135.0,Barron's Recap (9/8/12): Home Prices Headed Up,2012-09-10 08:08:00-04:00,LEN,neutral
757136.0,Lennar Announces Results Of Tender For 5.95% Senior Notes Due 2013; Approx. $204.7M Tendered,2012-08-14 16:36:00-04:00,LEN,positive
757137.0,Top 4 Mid-Cap Stocks In The Residential Construction Industry With The Highest ROE,2012-08-02 00:57:00-04:00,LEN,positive
757138.0,"UPDATE: Goldman Sachs Reiterates Neutral Rating, Raises PT on Lennar Corporation",2012-07-23 09:42:00-04:00,LEN,neutral
757139.0,Fitch Says Double-Digit Growth in Sight for US Homebuilders,2012-07-17 09:50:00-04:00,LEN,positive
757140.0,Lennar Proposes to Sell $300 Million of Senior Notes,2012-07-17 09:30:00-04:00,LEN,neutral
757141.0,MKM Partners Upgrades Lennar Class A from Neutral to Buy,2012-07-16 10:40:00-04:00,LEN,neutral
757142.0,Buffett Is In A Holding Pattern On the Economy,2012-07-12 15:20:00-04:00,LEN,neutral
757143.0,Should Traders Brace for a Rough Q2 Earnings Season?,2012-07-09 17:14:00-04:00,LEN,neutral
757144.0,"Deutsche Bank Maintains Lennar Class A at Hold,  to $30",2012-07-05 06:58:00-04:00,LEN,neutral
757145.0,Five Homebuilders on the Rise,2012-07-03 10:19:00-04:00,LEN,neutral
757146.0,"Arold Sees Homebuilder Rising, Morgan Stanley's Shares Falling",2012-06-28 14:40:00-04:00,LEN,positive
757147.0,"Barclays Maintains Lennar Class A at Overweight, Raises PT from $34 to $35",2012-06-28 12:52:00-04:00,LEN,negative
757148.0,"Goldman Sachs Maintains Lennar Class A at Neutral, Raises PT from $24 to $25",2012-06-28 09:44:00-04:00,LEN,neutral
757149.0,"Compass Point Maintains Lennar Class A at Neutral, Raises PT from $25 to $26",2012-06-28 09:04:00-04:00,LEN,neutral
757150.0,Pending Home Sales Rise More than Expected,2012-06-27 12:34:00-04:00,LEN,neutral
757151.0,"UPDATE: Lennar Says Current Mortgage Process May be Overly Cumbersome, Housing Market is in for Steady Recovery",2012-06-27 12:05:00-04:00,LEN,neutral
757152.0,Lennar's Q2: Further Evidence That Housing Has Bottomed?,2012-06-27 11:41:00-04:00,LEN,neutral
757153.0,"Wednesday Morning Movers (WPRT, LEN, LORL)",2012-06-27 11:22:00-04:00,LEN,neutral
757154.0,UPDATE: Lennar Says Has Thousands of Home Sites Under Contract Yet to Close,2012-06-27 11:22:00-04:00,LEN,neutral
757155.0,"UPDATE: Lennar Says Land Pipeline is Robust, Says Great Number of Exciting Deals Like Chinese Bank Deal; Seeing Some Weakness in Regional Pockets",2012-06-27 11:22:00-04:00,LEN,positive
757156.0,Lennar CEO Says Fundamental Improvement in Home Building in Q2,2012-06-27 11:18:00-04:00,LEN,positive
757157.0,"Social Media Outlook for Wednesday June 27 (MKC, LEN, ORLY, BA)",2012-06-27 11:13:00-04:00,LEN,neutral
757158.0,"Lennar Says Far Fewer Strategic Defaults Now, Housing Demand Will Rise as More Data Becomes Better, Housing Market Not Yet in Full Recovery, Affordability At Very High Levels",2012-06-27 11:11:00-04:00,LEN,positive
757159.0,Earnings Roundup,2012-06-27 09:22:00-04:00,LEN,neutral
757160.0,Premarket Stock Talk: What do 16 Analysts and Facebook Have in Common?,2012-06-27 08:56:00-04:00,LEN,neutral
757161.0,Benzinga's Top Pre-Market Gainers,2012-06-27 08:17:00-04:00,LEN,positive
757162.0,"Financial Breakfast: Morning News Summary for June 27, 2012",2012-06-27 07:25:00-04:00,LEN,neutral
757163.0,Lennar Class A Reports Q2 EPS $0.21 vs $0.17 Est; Revenues $930.2M vs $885.71M Est,2012-06-27 06:30:00-04:00,LEN,neutral
757164.0,UPDATE: Lennar Posts Higher Q2 Profit,2012-06-27 06:23:00-04:00,LEN,positive
757165.0,Earnings Scheduled For June 27,2012-06-27 00:08:00-04:00,LEN,neutral
757166.0,Stocks To Watch For June 27,2012-06-27 00:03:00-04:00,LEN,neutral
757167.0,Earnings Preview: Lennar's Q2 Earnings Seen Up 143% - IBD,2012-06-26 10:55:00-04:00,LEN,neutral
757168.0,UPDATE: Citigroup Downgrades Lennar to Sell on Stretched Valuation  ,2012-06-08 11:21:00-04:00,LEN,neutral
757169.0,Benzinga's Top Pre-Market Losers ,2012-06-08 08:28:00-04:00,LEN,negative
757170.0,Benzinga's Top Downgrades,2012-06-08 07:29:00-04:00,LEN,positive
757171.0,A Peek Into The Market Before The Trading Starts,2012-06-08 07:24:00-04:00,LEN,neutral
757172.0,"Citigroup Downgrades Lennar Corporation from Neutral to Sell, Lowers PT from $26 to $22",2012-06-08 06:19:00-04:00,LEN,negative
757173.0,UPDATE: Williams Financial Group Upgrades Lennar Corporation to Buy on Housing Turn  ,2012-05-17 11:22:00-04:00,LEN,neutral
757174.0,"Williams Financial Group Upgrades Lennar Class A from Hold to Buy, Raises PT from $28 to $35",2012-05-17 10:42:00-04:00,LEN,neutral
757175.0,"Williams Financial Group Upgrades Lennar Class A from Hold to Buy, Raises PT from $28 to $35",2012-05-17 09:53:00-04:00,LEN,neutral
757176.0,Homebuilders Topping Lenders On Better Housing News,2012-05-16 13:19:00-04:00,LEN,positive
757177.0,Lennar Enters Into $525M Unsecured Revolving Credit Facility Agreement ,2012-05-03 16:30:00-04:00,LEN,positive
757178.0,Home Builders Spike Higher on Housing Numbers,2012-04-24 10:05:00-04:00,LEN,neutral
757179.0,UPDATE: Compass Point Raises PT to $25 on Lennar Corporation  ,2012-04-18 06:30:00-04:00,LEN,neutral
757180.0,"Builders Upgraded on Housing Outlook, But Shares Fall - IBD",2012-04-13 13:43:00-04:00,LEN,positive
757181.0,Benzinga's Top Pre-Market Gainers,2012-04-13 08:03:00-04:00,LEN,positive
757182.0,"Goldman Sachs Maintains Lennar Class A at Neutral, Raises PT from $26 to $28",2012-03-28 09:53:00-04:00,LEN,neutral
757183.0,UPDATE: ISI Raises Lennar's PT,2012-03-28 08:28:00-04:00,LEN,neutral
757184.0,Lennar Trading at 52-Week High After Q1 Report,2012-03-27 12:42:00-04:00,LEN,neutral
757185.0,Lennar Says Credit Standards Getting Towards Normal; People Pushing Harder to Meet Credit Standards; Sees Loan Approvals with Lower FICO Scores,2012-03-27 12:15:00-04:00,LEN,positive
757186.0,"Florida, Texas and Pacific NW Lead Lennar's Land Buys",2012-03-27 12:09:00-04:00,LEN,neutral
757187.0,"CNBC Street Signs Summary for March 27 (BWLD, CMG, LEN, AIG)",2012-03-27 11:24:00-04:00,LEN,neutral
757188.0,"Lennar's CEO Says Traffic Up in Home Centers, Housing Market Isn't in Full Recovery But Isolated Pockets of Strength are Growing; Buyers Starting to Feel Pressure Not to Miss Moment; Cautiously Optimistic We'll See Recovery",2012-03-27 11:21:00-04:00,LEN,positive
757189.0,"Guggenheim Maintains Lennar Class A at Neutral, Raises PT from $23 to $24",2012-03-27 10:25:00-04:00,LEN,neutral
757190.0,Earnings Roundup,2012-03-27 08:52:00-04:00,LEN,neutral
757191.0,Lennar up 4% Pre-Market on Strong Q1 Earnings ,2012-03-27 08:20:00-04:00,LEN,positive
757192.0,Benzinga's Top Pre-Market Gainers,2012-03-27 08:05:00-04:00,LEN,positive
757193.0,Lennar Class A Reports Q1 EPS $0.08 vs $0.04 Est; Revenues $724.9M vs $699.38M Est,2012-03-27 06:39:00-04:00,LEN,neutral
757194.0,UPDATE: Lennar Reports Surge In Q1 Orders,2012-03-27 06:34:00-04:00,LEN,neutral
757195.0,US Stock Futures Slightly Higher Ahead Of Economic Data,2012-03-27 06:30:00-04:00,LEN,neutral
757196.0,Earnings Scheduled For March 27,2012-03-27 04:05:00-04:00,LEN,neutral
757197.0,Earnings Preview: Lennar,2012-03-26 21:47:00-04:00,LEN,neutral
757198.0,"Earnings Expectations for the Week of March 26 (BBY, FDO, WAG)",2012-03-25 10:58:00-04:00,LEN,neutral
757199.0,Home Builder Stocks Spike Lower on Disappointing New Home Data,2012-03-23 10:03:00-04:00,LEN,negative
757200.0,KB Home Earnings Preview: A Surge in Q1 Revenue Expected,2012-03-22 07:05:00-04:00,LEN,neutral
757201.0,Home-Builder Stocks Show Early Weakness,2012-02-28 10:13:00-05:00,LEN,negative
757202.0,December Case-Schiller Shows Falling Home Prices ,2012-02-28 09:35:00-05:00,LEN,negative
757203.0,Lennar Hits 52-Week High of $24.11,2012-02-15 10:00:00-05:00,LEN,neutral
757204.0,Lennar Hits 52-Week High of $23.83,2012-02-13 14:36:00-05:00,LEN,neutral
757205.0,FBN Securities Downgrades Lennar Class A from Sector Perform to Underperform,2012-02-10 07:33:00-05:00,LEN,positive
757206.0,"Option Alert: Lennar March 24 Call; Block Trade, 3,000 Contracts",2012-02-09 10:37:00-05:00,LEN,negative
757207.0,Lennar Hits 52-Week High of $23.54,2012-02-09 10:00:00-05:00,LEN,neutral
757208.0,Gabelli & Company Initiates Lennar at Buy,2012-02-03 12:15:00-05:00,LEN,neutral
757209.0,Lennar Hits 52-Week High of $23.12,2012-02-03 10:40:00-05:00,LEN,neutral
757210.0,Small Cap Top Performers in January,2012-01-30 06:19:00-05:00,LEN,positive
757211.0,ETF Showdown: The Battle For The American Dream,2012-01-20 12:40:00-05:00,LEN,negative
757212.0,UBS Downgrades Lennar to Neutral,2012-01-19 10:39:00-05:00,LEN,neutral
757213.0,Positive Housing Data Powers Pulte,2012-01-18 11:57:00-05:00,LEN,positive
757214.0,Lennar Class A Hits 52-Week High of $22.54,2012-01-18 10:00:00-05:00,LEN,neutral
757215.0,Home-Builders Are Nearing Extended Levels,2012-01-11 11:18:00-05:00,LEN,neutral
757216.0,Hearing Barclays Making Positive Comments on Lennar,2012-01-11 10:10:00-05:00,LEN,positive
757217.0,Lennar Class A Hits 52-Week High of $21.54,2012-01-11 09:44:00-05:00,LEN,neutral
757218.0,"Financial Breakfast: Morning News Summary for January 11, 2012",2012-01-11 07:23:00-05:00,LEN,neutral
757219.0,Lennar Reports Q4 EPS $0.16 vs $0.17 Est; Revenues $952.7M vs $913.95M Est			 ,2012-01-11 06:55:00-05:00,LEN,neutral
757220.0,Lennar Earnings Preview,2012-01-10 21:55:00-05:00,LEN,neutral
757221.0,DR Horton and Home Depot to Open Near 52-Week Highs,2012-01-09 06:38:00-05:00,LEN,neutral
757222.0,Earnings Expectations for the Week of January 9,2012-01-08 09:41:00-05:00,LEN,neutral
757223.0,5 Stocks For A Real Estate Rebound,2012-01-06 14:11:00-05:00,LEN,neutral
757224.0,Notable Put Options Activity in Lennar,2011-12-21 11:47:00-05:00,LEN,neutral
757225.0,Lennar Announces Entry Into the Pacific Northwest,2011-12-19 08:32:00-05:00,LEN,neutral
757226.0,Top 4 Stocks In The Residential Construction Industry With The Lowest PEG Ratio,2011-12-19 04:03:00-05:00,LEN,negative
757227.0,KeyBanc Upgrades Lennar to Buy,2011-12-12 07:29:00-05:00,LEN,neutral
757228.0,The Oxen Group Downgrades Lennar to Hold,2011-12-09 14:36:00-05:00,LEN,neutral
