Unnamed: 0,title,date,stock,sentiment
756760.0,"Earnings Scheduled For March 19, 2015",2015-03-19 05:09:00-04:00,LEN,neutral
756761.0,"10 Stocks To Watch For March 19, 2015",2015-03-19 04:21:00-04:00,LEN,neutral
756762.0,TD Ameritrade Chief Strategist On Lennar Ahead Of Earnings,2015-03-18 20:59:00-04:00,LEN,neutral
756763.0,"Deutsche Bank Boosts Q1 Orders Prediction For Lennar, KB Home",2015-03-18 15:26:00-04:00,LEN,positive
756764.0,"With Peak Housing Season Upon Us, What Guidance Will Lennar Give?",2015-03-18 13:49:00-04:00,LEN,neutral
756765.0,Oppenheimer Is Watching These 5 Consumer Discretionary Stocks...And They're Bullish,2015-03-18 11:03:00-04:00,LEN,neutral
756766.0,RBC Mostly Positive On Lennar Ahead Of Earnings,2015-03-18 10:48:00-04:00,LEN,positive
756767.0,Why Homebuilder Lennar Is Looking Better,2015-03-18 07:50:00-04:00,LEN,positive
756768.0,Hearing Sterne Agee Suggesting to Purchase Homebuilder Stocks Following Miss in Housing Starts,2015-03-17 10:25:00-04:00,LEN,negative
756769.0,"Nike, FedEx & Oracle Bring Earnings Season Near A Close This Week",2015-03-15 11:36:00-04:00,LEN,neutral
756770.0,3 Important ETFs Sitting On Support,2015-03-12 16:26:00-04:00,LEN,positive
756771.0,Buckingham Research Downgrades Lennar to Neutral,2015-03-09 08:16:00-04:00,LEN,neutral
756772.0,"Keefe, Bruyette & Woods Raises 4 Homebuilder Price Targets, Plus 1 Outperform Pick",2015-03-07 08:05:00-05:00,LEN,neutral
756773.0,5 Stocks That Have JPMorgan Analysts Talking,2015-02-20 12:48:00-05:00,LEN,neutral
756774.0,Why 1 Analyst Just Raised Price Targets On These 7 Homebuilders,2015-02-19 09:10:00-05:00,LEN,neutral
756775.0,"Option Alert: LEN March $45 Call 25,214 Contracts on Ask at $5.90",2015-02-18 12:01:00-05:00,LEN,positive
756776.0,Lennar Prices $250M Of Senior Notes,2015-02-11 16:30:00-05:00,LEN,neutral
756777.0,"Citi Dishes On Housing, Details 'The Good, The (Less) Bad And The (Not So) Ugly'",2015-02-11 14:05:00-05:00,LEN,negative
756778.0,BofA On The U.S. Housing Market: 'Feelin' Alright',2015-02-10 14:11:00-05:00,LEN,positive
756779.0,Charts Of The Day: Note How Well Homebuilders Are Doing,2015-02-10 12:07:00-05:00,LEN,positive
756780.0,"With Housing Stocks Mixed, This Analyst Says A Recovery 'Is Still Barely On First Base'",2015-01-27 12:02:00-05:00,LEN,neutral
756781.0,Homebuilding Stocks Fall Amid Housing Market Index Report,2015-01-20 13:11:00-05:00,LEN,neutral
756782.0,"Keefe, Bruyette & Woods Cuts Lennar's Price Target",2015-01-16 10:47:00-05:00,LEN,negative
756783.0,"Compass Point Reiterates Rating, Raises Price Target On Lennar On 2016 Valuation",2015-01-16 07:50:00-05:00,LEN,neutral
756784.0,Morgan Stanley Mostly Lukewarm On Homebuilders,2015-01-15 12:32:00-05:00,LEN,neutral
756785.0,Lennar Sees 2015 Margins Down to 24% From 25%,2015-01-15 11:39:00-05:00,LEN,neutral
756786.0,Lennar Says Mothballed Communities Affecting 2015 Margin Rate,2015-01-15 11:38:00-05:00,LEN,neutral
756787.0,"Lennar Says Margins Down On Less Pricing Power, More Entry Homes",2015-01-15 11:36:00-05:00,LEN,neutral
756788.0,Housing Stocks Tumble On Mixed Results From 2 Big Players,2015-01-15 11:26:00-05:00,LEN,neutral
756789.0,Lennar Conference Call Begins,2015-01-15 11:01:00-05:00,LEN,neutral
756790.0,"Thursday Morning Movers: Best Buy, Target Go In Opposite Directions",2015-01-15 09:37:00-05:00,LEN,positive
756791.0,Notes From The Street: The Swiss Currency Shock That Came 'Out Of Left Field!',2015-01-15 08:58:00-05:00,LEN,negative
756792.0,Morgan Stanley on Homebuilders:,2015-01-15 07:44:00-05:00,LEN,neutral
756793.0,US Stock Futures Tumble; Citigroup Earnings In Focus,2015-01-15 07:24:00-05:00,LEN,neutral
756794.0,UPDATE: Lennar Q1 Profit Tops Estimates,2015-01-15 07:04:00-05:00,LEN,positive
756795.0,Lennar Says Avg. Home Sale Price Was $329K,2015-01-15 06:01:00-05:00,LEN,neutral
756796.0,Lennar Reports Q4 EPS of $1.07 vs $0.96 Est; Revenue of $2.58B vs $2.59B Est,2015-01-15 06:00:00-05:00,LEN,neutral
756797.0,"Earnings Scheduled For January 15, 2015",2015-01-15 04:25:00-05:00,LEN,neutral
756798.0,Homebuilding Stocks To Watch Following KB Home's Q4 Results,2015-01-13 11:40:00-05:00,LEN,neutral
756799.0,Housing-Related Stocks Move Higher Ahead of Obama Speech,2015-01-08 11:39:00-05:00,LEN,neutral
756800.0,President Obama to Speak at 12:45 PM ET About Housing Market,2015-01-08 11:37:00-05:00,LEN,neutral
756801.0,Is It Time To Cycle Into Housing?,2015-01-07 14:16:00-05:00,LEN,neutral
756802.0,"Hombuilders Trending Lower Following Housing Starts, Building Permits Readings",2014-12-16 10:55:00-05:00,LEN,negative
756803.0,Why This Expert Is Cashing Out His Portfolio,2014-12-16 10:31:00-05:00,LEN,neutral
756804.0,"Homebuilder Confidence Dips, Sector Stocks Follow",2014-12-15 15:19:00-05:00,LEN,positive
756805.0,Fitch Says More Normal Cyclical Up-Tick Likely in 2015 for U.S. Housing,2014-12-12 09:37:00-05:00,LEN,neutral
756806.0,"Keefe Bruyette & Woods Maintains Outperform on Lennar Corporation, Raises PT to $53.00",2014-12-05 04:08:00-05:00,LEN,neutral
756807.0,Best And Worst ETFs Of November,2014-12-04 11:30:00-05:00,LEN,neutral
756808.0,This Is What Lennar's CEO Had To Say On The U.S. Housing Recovery,2014-11-24 15:45:00-05:00,LEN,neutral
756809.0,CNBC's Stock Pops & Drops From November 20,2014-11-21 07:07:00-05:00,LEN,neutral
756810.0,Lennar Prices $350M Senior Notes Offering,2014-11-18 16:59:00-05:00,LEN,neutral
756811.0,How Positive Housing Numbers Are Helping 2 ETFs Break Out,2014-11-18 15:22:00-05:00,LEN,positive
756812.0,Lennar Announces Launch Of Redevelopment Of Candlestick Park In San Francisco,2014-11-17 09:01:00-05:00,LEN,neutral
756813.0,Shares of Home Builders Rise on Upbeat Guidance from DR Horton,2014-11-11 10:31:00-05:00,LEN,positive
756814.0,A Technical Breakdown Of Mega-Homebuilder Lennar,2014-10-29 10:50:00-04:00,LEN,neutral
756815.0,Buckingham Initiates Coverage On Several Homebuilders,2014-10-20 13:23:00-04:00,LEN,neutral
756816.0,Benzinga's Top Initiations,2014-10-20 09:14:00-04:00,LEN,positive
756817.0,Buckingham Research Initiates Lennar At Buy,2014-10-20 08:51:00-04:00,LEN,neutral
756818.0,"Buckingham Research Initiates Coverage on Lennar Corporation at Buy, Announces $50.00 PT",2014-10-20 08:38:00-04:00,LEN,neutral
756819.0, Compass Point Research Offers 'The Home Builder Hope Trade',2014-10-13 11:49:00-04:00,LEN,positive
756820.0,Home Construction Stocks In Play,2014-10-13 09:02:00-04:00,LEN,positive
756821.0,"Compass Point Maintains Neutral on Lennar Corporation, Raises PT to $40.00",2014-10-13 06:07:00-04:00,LEN,neutral
756822.0,"Option Alert: LEN Jan 15 $42 Call; 30,201 Traded vs 2,326 OI; Currently $39.22",2014-10-10 14:09:00-04:00,LEN,positive
756823.0,Lennar Corporation Retraces Some Of Its Recent Gains,2014-10-03 09:28:00-04:00,LEN,positive
756824.0,Homebuilders Under Pressure Following KB Home Earnings Miss,2014-09-24 10:59:00-04:00,LEN,negative
756825.0,Homebuilders Reverse Rally On August Construction News,2014-09-18 13:37:00-04:00,LEN,neutral
756826.0,Lennar Corporation Explodes To The Upside Wednesday; Is There Still More To Come For The Bulls?,2014-09-18 08:16:00-04:00,LEN,neutral
756827.0,"#PreMarket Primer: Thursday, September 18: Scotland Heads To The Polls ",2014-09-18 07:43:00-04:00,LEN,neutral
756828.0,Compass Point Maintains Neutral on Lennar Corporation,2014-09-18 06:40:00-04:00,LEN,neutral
756829.0,Stocks Gain On Federal Reserve Update,2014-09-17 16:50:00-04:00,LEN,positive
756830.0,Lennar Corporation Conference Call Highlights,2014-09-17 16:10:00-04:00,LEN,neutral
756831.0,U.S. Stocks Gain After Fed Statement; General Mills Shares Fall On Downbeat Results,2014-09-17 15:29:00-04:00,LEN,positive
756832.0,"Homebuilders Up On Bullish Trade Data, Lennar Corporation Q3 Beat",2014-09-17 14:04:00-04:00,LEN,neutral
756833.0,"Midday Gainers From September 17 - Auxilium Pharmaceuticals, Inc., Steel Dynamics, Inc. And More",2014-09-17 13:27:00-04:00,LEN,positive
756834.0,Lennar Gains On Upbeat Earnings; Adobe Shares Slide,2014-09-17 12:37:00-04:00,LEN,positive
756835.0,Markets Gain; FedEx Profit Beats Street View,2014-09-17 11:14:00-04:00,LEN,positive
756836.0,"Option Alert: Lennar Oct 14 $43 Call; 2,501 Traded vs 115 OI; Currently $41.20",2014-09-17 10:12:00-04:00,LEN,positive
756837.0,Morning Market Movers ,2014-09-17 09:38:00-04:00,LEN,neutral
756838.0,Benzinga's Top #PreMarket Gainers,2014-09-17 08:08:00-04:00,LEN,positive
756839.0,"#PreMarket Primer: Wednesday, September 17: NFL Faces Pressure From Sponsors Due To Domestic Abuse Issues",2014-09-17 07:30:00-04:00,LEN,negative
756840.0,US Stock Futures Flat; All Eyes On FOMC Decision,2014-09-17 07:19:00-04:00,LEN,neutral
756841.0,"UPDATE: Lennar Posts Upbeat FQ3 Results, Shares Surge",2014-09-17 06:43:00-04:00,LEN,positive
756842.0,Lennar Corporation Reports Q3 EPS of $0.78 vs $0.67 Est; Revenue of $2.01B vs $1.96B Est,2014-09-17 06:00:00-04:00,LEN,neutral
756843.0,"Earning, Economic and IPO Calendar for Wednesday September 17, 2014",2014-09-17 05:52:00-04:00,LEN,neutral
756844.0,"Earnings Scheduled For September 17, 2014",2014-09-17 04:59:00-04:00,LEN,neutral
756845.0,"Stocks To Watch For September 17, 2014",2014-09-17 04:08:00-04:00,LEN,neutral
756846.0,"Citadel Reports 5.4% Passive Stake in Lennar as of September 9, 2014",2014-09-15 09:34:00-04:00,LEN,positive
756847.0,13G Filing from Citadel Advisors on Lennar Shows Raised Stake from 2.09% as of Jun. 30th to 5.2%,2014-09-15 09:33:00-04:00,LEN,neutral
756848.0,Earnings Expectations For The Week Of September 15,2014-09-14 16:15:00-04:00,LEN,neutral
756849.0,Benzinga Weekly Preview: Fed Meeting In Focus,2014-09-13 16:12:00-04:00,LEN,neutral
756850.0,Benzinga's Top Upgrades,2014-09-09 09:06:00-04:00,LEN,positive
756851.0,JP Morgan Upgrades Lennar To Overweight,2014-09-09 06:52:00-04:00,LEN,neutral
756852.0,"JP Morgan Upgrades Lennar Corporation to Overweight, Raises PT to $49.00",2014-09-09 05:41:00-04:00,LEN,neutral
756853.0,UPDATE: Bank Of America Initiates Coverage On Lennar Corporation,2014-09-05 11:41:00-04:00,LEN,neutral
756854.0,"Bank of America Initiates Coverage on Lennar Corporation at Buy, Announces $49.00 PT",2014-09-05 09:19:00-04:00,LEN,neutral
756855.0,Could Lennar Be Building The Foundation For A Rally?,2014-08-27 08:33:00-04:00,LEN,neutral
756856.0,"Financials, Bond And Housing ETFs To Watch This Week ",2014-08-25 09:20:00-04:00,LEN,neutral
756857.0,Homebuilder Stocks Higher On Better Home Construction Numbers,2014-08-19 09:07:00-04:00,LEN,positive
756858.0,Housing Stocks Building Up Following NAHB Release,2014-08-18 11:14:00-04:00,LEN,neutral
756859.0,Top 4 Mid-Cap Stocks In The Residential Construction Industry With The Highest ROE,2014-08-11 04:58:00-04:00,LEN,positive
756860.0,"Lennar CEO Miller Sells 100,000 Shares $36.43/Share -Form 4",2014-08-05 16:54:00-04:00,LEN,positive
756861.0,Amended 13D Filing from Gabelli's GAMCO on Lennar Shows 8.25% Stake,2014-08-01 11:40:00-04:00,LEN,neutral
756862.0,Homebuilders Bring Down The House Following June Pending Home Sales,2014-07-28 14:03:00-04:00,LEN,neutral
756863.0,3 Homebuilder Stocks To Watch Ahead of Earnings,2014-07-23 09:17:00-04:00,LEN,neutral
756864.0,Barclays Revises Price Targets On Homebuilders,2014-06-30 15:33:00-04:00,LEN,neutral
756865.0,"#PreMarket Primer: Friday, June 27: U.S. Data Fuels Fed Rate Hike Debate",2014-06-27 07:07:00-04:00,LEN,neutral
756866.0,Markets Slightly Lower As Bullard Hints Higher Rates Could Come Sooner Than Expected,2014-06-26 16:34:00-04:00,LEN,negative
756867.0,Bed Bath & Beyond Falls On Downbeat Results; Iron Mountain Shares Jump,2014-06-26 12:41:00-04:00,LEN,positive
756868.0,Lennar CEO Says He Expects to Overcome Newhall Lawsuits,2014-06-26 11:24:00-04:00,LEN,negative
756869.0,2 ETFs That Movement In Lennar And Apple Could Drive,2014-06-26 10:59:00-04:00,LEN,neutral
756870.0,Mid-Morning Market Update: Markets Open Lower; Lennar Profit Tops Estimates,2014-06-26 10:10:00-04:00,LEN,positive
756871.0,"US Stock Futures Flat Ahead Of Jobless Claims, Consumer Spending Data",2014-06-26 07:43:00-04:00,LEN,neutral
756872.0,"#PreMarket Primer: Thursday, June 26: Doubts Raised About US Recovery",2014-06-26 07:10:00-04:00,LEN,negative
756873.0,UPDATE: Lennar Posts Upbeat FQ2 Earnings,2014-06-26 06:58:00-04:00,LEN,neutral
756874.0,Shares Of Lennar Fall To $41.65,2014-06-26 06:52:00-04:00,LEN,positive
756875.0,"Earning, Economic and IPO Calendar for Thursday June 26, 2014",2014-06-26 06:20:00-04:00,LEN,neutral
756876.0,"Shares Of Lennar Jump 2 Percent On Top And Bottom Line Beat, Currently Trading $42.65",2014-06-26 06:05:00-04:00,LEN,positive
756877.0,"Lennar 2Q New Orders Dollar Value $2B, Up 21%",2014-06-26 06:03:00-04:00,LEN,positive
756878.0,"Lennar 2Q Gross Margin On Home Sales 25.5%, Up 140 Basis Points",2014-06-26 06:02:00-04:00,LEN,negative
756879.0,Lennar Corporation Reports Q2 EPS of $0.61 vs $0.51 Est; Revenue of $1.80B vs $1.68B Est,2014-06-26 06:01:00-04:00,LEN,neutral
756880.0,"Earnings Scheduled For June 26, 2014",2014-06-26 05:28:00-04:00,LEN,neutral
756881.0,"Stocks To Watch For June 26, 2014",2014-06-26 04:04:00-04:00,LEN,neutral
756882.0,"Lennar Increases Unsecured Revolving Credit Facility From $950 M To $1.5B, Includes $263M Accordion Feature ",2014-06-25 16:01:00-04:00,LEN,neutral
756883.0,Shares of SPDR S&P Homebuilder ETF Spiked 1+% Following Very Strong New Home Sales Reading,2014-06-24 10:09:00-04:00,LEN,positive
756884.0,"Option Alert: Lennar Jan $49 Call; 7,202 Contracts Traded vs 11 OI: Currently $41.25",2014-06-19 11:17:00-04:00,LEN,positive
756885.0,Top 4 Mid-Cap Stocks In The Residential Construction Industry With The Highest ROE,2014-06-18 04:44:00-04:00,LEN,positive
756886.0,Spring Thaw: Is The Housing Sector Ready To Move?,2014-06-03 16:15:00-04:00,LEN,positive
756887.0,Market Shrugs Off Lower April Pending Home Sales,2014-05-29 11:10:00-04:00,LEN,negative
756888.0,Top 4 NYSE Stocks In The Residential Construction Industry With The Highest Revenue,2014-05-06 04:57:00-04:00,LEN,positive
756889.0,Gundlach: Rents are Headed Higher,2014-05-05 12:51:00-04:00,LEN,neutral
756890.0,Gundlach: Most Homes Being Bought by Investor Pools; New Home Sales are Weak,2014-05-05 12:44:00-04:00,LEN,negative
756891.0,Gundlach: Single Family Housing is Overrated,2014-05-05 12:42:00-04:00,LEN,neutral
756892.0,Jeffrey Gundlach from Doubleline Recommending Investors Short Homebuilders - Reuters,2014-04-25 15:50:00-04:00,LEN,neutral
756893.0,Home Sales Data Hits Homebuilder ETFs,2014-04-23 14:04:00-04:00,LEN,neutral
756894.0,Amended 13D Filing from Gabelli's GAMCO on Lennar Shows 7.17% Stake,2014-03-27 16:37:00-04:00,LEN,neutral
756895.0,Top 4 NYSE Stocks In The Residential Construction Industry With The Highest Revenue,2014-03-27 04:36:00-04:00,LEN,positive
756896.0,"Housing Sector: ETF Or Stocks? (ITB, XHB, DHI)",2014-03-25 14:17:00-04:00,LEN,neutral
756897.0,UPDATE: Susquehanna Downgrades Lennar,2014-03-21 15:23:00-04:00,LEN,neutral
756898.0,"Compass Point Maintains Neutral on Lennar Corporation, Raises PT to $37.00",2014-03-21 08:43:00-04:00,LEN,neutral
756899.0,Benzinga's Top Downgrades,2014-03-21 07:58:00-04:00,LEN,positive
756900.0,Susquehanna Downgrades Lennar Corporation to Neutral,2014-03-21 07:45:00-04:00,LEN,neutral
756901.0,Market Wrap For March 20: Investors Showing No Post-Fed Decision Hangover,2014-03-20 16:44:00-04:00,LEN,negative
756902.0,Mid-Afternoon Market Update: Walter Energy Gets Pounded as Markets Rise,2014-03-20 16:02:00-04:00,LEN,positive
756903.0,Mid-Day Market Update: Guess? Drops On Weak Forecast; Burlington Stores Shares Gain,2014-03-20 12:32:00-04:00,LEN,positive
756904.0,From Lennar Call: CEO Sees Gross Margin Levels Remaining High Moving Forward,2014-03-20 11:49:00-04:00,LEN,negative
756905.0,"From Lennar Call: CEO Sees Volumes in 2015, 2016 Growing Amid Price Increase Earlier This Year",2014-03-20 11:49:00-04:00,LEN,positive
756906.0,"From Lennar Call: Expecting Delivery of 21-22K Homes This Year, Will Have 600-625 Communities by Year End",2014-03-20 11:32:00-04:00,LEN,neutral
756907.0,"From Lennar Earnings Conf. Call: CEO Miller Said Labor, Material Costs Were Up 9.8% YoY",2014-03-20 11:14:00-04:00,LEN,neutral
756908.0,Lennar Q1 Earnings Conf. Call Beginning,2014-03-20 11:08:00-04:00,LEN,neutral
756909.0,Mid-Morning Market Update: Markets Edge Higher; Lennar Earnings Beat Street View,2014-03-20 10:24:00-04:00,LEN,neutral
756910.0,US Stock Futures Drop Ahead Of Jobless Claims Report,2014-03-20 07:25:00-04:00,LEN,negative
756911.0,UPDATE: Lennar Posts Higher Q1 Earnings,2014-03-20 06:49:00-04:00,LEN,neutral
756912.0,"Lennar Q1 2014-End Backlog 5,662 Homes, Up 15%",2014-03-20 06:08:00-04:00,LEN,neutral
756913.0,"Lennar Q1 2014 New Orders 4,465 Homes, Up 10% ",2014-03-20 06:07:00-04:00,LEN,neutral
756914.0,"Lennar Q1 2014 Deliveries 3,609 Homes, Up 13% ",2014-03-20 06:06:00-04:00,LEN,neutral
756915.0,Lennar Corporation Reports Q1 EPS of $0.35 vs $0.28 Est; Revenue of $1.36B vs $1.28B Est,2014-03-20 06:01:00-04:00,LEN,neutral
756916.0,"Earnings Scheduled For March 20, 2014",2014-03-20 05:12:00-04:00,LEN,neutral
756917.0,"Stocks To Watch For March 20, 2014",2014-03-20 04:27:00-04:00,LEN,neutral
756918.0,UPDATE: KB Homes Shares Rise 7% Premarket; Shares of Other Homebuilder Stocks Also Higher,2014-03-19 08:43:00-04:00,LEN,positive
756919.0,"Earnings Expectations For The Week Of March 17: FedEx, Nike, Oracle And More",2014-03-16 15:52:00-04:00,LEN,neutral
756920.0,Five Star Stock Watch: Lennar Corporation,2014-03-06 11:51:00-05:00,LEN,neutral
756921.0,S&P Affirms Ratings on Lennar; Outlook Raised from Stable to Positive,2014-03-04 17:14:00-05:00,LEN,positive
756922.0,"KeyBanc Offers Pair Trade: Upgrades Pulte, Downgrades Lennar",2014-03-04 16:01:00-05:00,LEN,neutral
756923.0,"KeyBanc Downgrades Lennar Corporation to Hold, Removes $41.00 PT",2014-03-04 07:45:00-05:00,LEN,neutral
756924.0,Raymond James Downgrades Lennar Corporation to Outperform,2014-02-11 07:23:00-05:00,LEN,neutral
756925.0,Market Wrap For February 6: Stocks Higher With All Eyes On Friday's Jobs Report,2014-02-06 16:37:00-05:00,LEN,neutral
756926.0,"UPDATE: Goldman Sacks Upgraded Lennar Corporation From Neutral to Conviction Buy, PT Raised to $48",2014-02-06 11:10:00-05:00,LEN,neutral
756927.0,Benzinga's Top Upgrades,2014-02-06 07:52:00-05:00,LEN,positive
756928.0,"Goldman Sachs Upgrades Lennar Corporation to Buy, Added to Conviction Buy List, Raises PT to $48.00",2014-02-06 07:20:00-05:00,LEN,neutral
756929.0,"Moody's Affirms CFR on Lennar, Assigns Ba3 Rating to New Notes; Outlook Raised from Stable to Positive",2014-02-04 14:17:00-05:00,LEN,positive
756930.0,"Market Wrap For January 27: China Concerns, Declining Home Sales, Tomorrow's Fed Meeting and Obama's Speech Keep Markets Lower",2014-01-27 16:48:00-05:00,LEN,negative
756931.0,Cautious Analyst Note from Barclays & New Sales Data Drag Homebuilders Lower,2014-01-27 13:45:00-05:00,LEN,negative
756932.0,Top 4 Mid-Cap Stocks In The Residential Construction Industry With The Highest EPS,2014-01-27 04:36:00-05:00,LEN,positive
756933.0,"Data Reveals Stunning Housing Sales Decor, Concern over Mortgage Applications Structural Damage",2013-12-24 13:12:00-05:00,LEN,negative
756934.0,"Homebuilding Stocks Strong Following Citi's Upgrade Of KB, Ahead Of Home Sales Data",2013-12-23 14:41:00-05:00,LEN,positive
756935.0,Compass Point Anticipates Slightly Higher Order Growth for Lennar,2013-12-23 09:57:00-05:00,LEN,positive
756936.0,"#PreMarket Primer: Thursday, December 19: Fed Taper Begins",2013-12-19 07:01:00-05:00,LEN,neutral
756937.0,Market Wrap For December 18: Markets Surge Following the Fed's Taper Announcement,2013-12-18 16:46:00-05:00,LEN,neutral
756938.0,Mid-Afternoon Market Update: In Bernanke's Final FOMC Statement Fed Begins Taper,2013-12-18 15:33:00-05:00,LEN,neutral
756939.0,Mid-Day Market Update: Stocks Turn Mostly Lower; VeriFone Shares Fall On Downbeat Guidance,2013-12-18 12:33:00-05:00,LEN,neutral
756940.0,Mid-Morning Market Update: Markets Open Higher; FedEx Q2 Earnings Miss Estimates,2013-12-18 10:21:00-05:00,LEN,negative
756941.0,Benzinga's Top #PreMarket Gainers,2013-12-18 08:36:00-05:00,LEN,positive
756942.0,"#PreMarket Primer: Wednesday, December 18: Markets Hold Breath Ahead Of Fed Outcome",2013-12-18 06:58:00-05:00,LEN,neutral
756943.0,US Stock Futures Up; Fed Decision In Focus,2013-12-18 06:48:00-05:00,LEN,neutral
756944.0,UPDATE: Lennar Posts Higher FQ4 Profit,2013-12-18 06:38:00-05:00,LEN,positive
756945.0,Lennar Corporation Reports Q4 EPS of $0.73 vs $0.62 Est; Revenue of $1.90B vs $1.88B Est,2013-12-18 06:08:00-05:00,LEN,neutral
756946.0,"Earnings Scheduled For December 18, 2013",2013-12-18 04:34:00-05:00,LEN,neutral
756947.0,"Homebuilding Sector Getting Some Attention Amid Analyst Note, Upcoming Earnings Data ",2013-12-17 16:37:00-05:00,LEN,neutral
756948.0,Benzinga Weekly Preview: Markets Anxiously Await Fed Meeting,2013-12-13 16:34:00-05:00,LEN,negative
756949.0,"Citigroup Maintains Neutral on Lennar Corporation, Raises PT to $37.00",2013-12-13 08:28:00-05:00,LEN,neutral
756950.0,Toll Bros. CEO Doug Yearley on CNBC Says Housing is a 'Long Way' from a Bubble,2013-12-10 15:47:00-05:00,LEN,neutral
756951.0,Is the Housing Market Recovery a Mirage?,2013-12-10 10:52:00-05:00,LEN,neutral
756952.0,Toll Brothers Earnings Preview: What The Analysts are Saying ,2013-12-09 13:59:00-05:00,LEN,neutral
756953.0,Sterne Agee Adjusts Lennar Estimates for Convertible Debt Conversion,2013-12-06 11:27:00-05:00,LEN,negative
756954.0,UPDATE: Lennar Says 'Collecting Award is Doubtful',2013-12-03 16:34:00-05:00,LEN,positive
756955.0,Lennar Confirms Jury Has Awarded $1B in Damages,2013-12-03 16:32:00-05:00,LEN,negative
756956.0,UPDATE: Lennar Doubtful It Can Collect from Nicolas Marsch,2013-12-03 16:09:00-05:00,LEN,negative
756957.0,Lennar Wins $1B Jury Award In Defamation Case,2013-12-03 16:08:00-05:00,LEN,positive
756958.0,Raymond James Upgrades Homebuilders ,2013-11-20 16:27:00-05:00,LEN,neutral
756959.0,Raymond James Upgrades Lennar Corporation to Strong Buy,2013-11-20 09:14:00-05:00,LEN,positive
756960.0,"Option Alert: Lennar January 35/38 Call Spread; 7,000 Contract Trade; Currently $32.71",2013-11-08 13:18:00-05:00,LEN,positive
756961.0,Top 4 Mid-Cap Stocks In The Residential Construction Industry With The Highest EPS Estimates,2013-10-31 05:37:00-04:00,LEN,positive
756962.0,How Are Home Builders Holding Up?,2013-10-25 15:42:00-04:00,LEN,neutral
756963.0,Homebuilder Stocks Making New Highs,2013-10-16 13:47:00-04:00,LEN,neutral
756964.0,Amended 13D Filing from GAMCO Shows 6.16% Stake in Lennar,2013-10-15 16:31:00-04:00,LEN,neutral
756965.0,"UPDATE: Susquehanna Upgrades Lennar on Fundamental Trends, Seasonal Tailwinds",2013-10-11 11:17:00-04:00,LEN,neutral
756966.0,Susquehanna Upgrades Lennar Corporation to Positive,2013-10-11 07:18:00-04:00,LEN,positive
756967.0,"Swings in Home Builder Short Interest (KBH, RYL, TMHC)",2013-09-28 11:56:00-04:00,LEN,positive
756968.0,Top 4 Mid-Cap Stocks In The Residential Construction Industry With The Highest Cash,2013-09-26 05:13:00-04:00,LEN,positive
756969.0,Home Builder Stocks Spike Higher on New Home Sales Data,2013-09-25 10:04:00-04:00,LEN,neutral
756970.0,"Compass Point Maintains Neutral on Lennar Corporation, Lowers PT to $38.00",2013-09-25 08:03:00-04:00,LEN,negative
756971.0,"Market Primer: Wednesday, September 25: Investors Hesitant, US In Focus",2013-09-25 06:43:00-04:00,LEN,negative
756972.0,Mid-Afternoon Market Update: Carnival Sinks on Weak Guidance; Markets Go Into The Red,2013-09-24 16:00:00-04:00,LEN,negative
756973.0,Mid-Day Market Update: US Stocks Edge Higher; Facebook Shares Surge On Citi Upgrade,2013-09-24 12:37:00-04:00,LEN,positive
756974.0,Mid-Morning Market Update: Markets Decline; Lennar Profit Beats Estimates,2013-09-24 10:53:00-04:00,LEN,positive
756975.0,"From Lennar Q3 Call: CEO Miller Believes Housing Market Recovery Likely to Continue, Says Homebuying Soldown is Temporary",2013-09-24 10:47:00-04:00,LEN,neutral
756976.0,"PreMarket Info Recap for September 24, 2013: Trying To Put A Bottom In",2013-09-24 09:28:00-04:00,LEN,neutral
756977.0,US Stock Futures Flat Ahead Of Economic Data,2013-09-24 07:21:00-04:00,LEN,neutral
756978.0,UPDATE: Lennar Q3 Net Profit Surges 39%,2013-09-24 07:15:00-04:00,LEN,positive
756979.0,Lennar Reports Q3 EPS of $0.54 vs $0.45 Est; Revenue of $1.60B vs $1.56B Est,2013-09-24 06:05:00-04:00,LEN,neutral
756980.0,"Earnings Scheduled For September 24, 2013",2013-09-24 05:03:00-04:00,LEN,neutral
756981.0,"Stocks To Watch For September 24, 2013",2013-09-24 04:54:00-04:00,LEN,neutral
756982.0,"Earnings Expectations For The Week Of September 23: BlackBerry, Nike And More",2013-09-22 14:56:00-04:00,LEN,neutral
756983.0,Top 4 Stocks In The Residential Construction Industry With The Highest Dividend Yield,2013-09-05 04:23:00-04:00,LEN,positive
756984.0,"Short Sellers Increase Stakes in Toll Bros., M/I Homes (MHO, TMHC, TOL)",2013-08-28 13:42:00-04:00,LEN,positive
756985.0,Barron's Recap: Beware Falling Profit Estimates,2013-08-17 14:03:00-04:00,LEN,positive
756986.0,GAMCO Reports New 5.08% Stake In Lennar,2013-08-15 16:04:00-04:00,LEN,neutral
756987.0,"Meritage Homes, NVR See Big Short Interest Swings (KBH, MTH, NVR)",2013-08-10 13:25:00-04:00,LEN,positive
756988.0,"Taylor Morrison, TRI Pointe See Big Short Interest Swings (TMHC, TOL, TPH)",2013-07-25 13:26:00-04:00,LEN,positive
756989.0,"Compass Point Downgrades Lennar Corporation to Neutral, Lowers PT to $39.00",2013-07-24 08:55:00-04:00,LEN,negative
756990.0,Home-builder Stocks Could Be Talking Again,2013-07-22 14:38:00-04:00,LEN,neutral
756991.0,"Short Sellers Pile on to Taylor Morrison Home (SPF, TMHC, TOL)",2013-07-14 11:30:00-04:00,LEN,neutral
756992.0,"Market Wrap for Thursday, July 11: Market Jumps on Dovish Bernanke Comments ",2013-07-11 16:14:00-04:00,LEN,neutral
