Unnamed: 0,title,date,stock,sentiment
756528.0,Evercore ISI Group Downgrades Lennar to In-Line,2017-06-21 06:18:00-04:00,LEN,neutral
756529.0,Mid-Afternoon Market Update: Fang Drops After Q1 Results; Invivo Therapeutics Shares Surge,2017-06-20 14:33:00-04:00,LEN,positive
756530.0,10 Biggest Mid-Day Gainers For Tuesday,2017-06-20 12:40:00-04:00,LEN,neutral
756531.0,Mid-Day Market Update: Crude Oil Down Over 3%; Lipocine Shares Spike Higher,2017-06-20 12:01:00-04:00,LEN,negative
756532.0,Lennar's Wild Ride After Q2 Beat,2017-06-20 11:21:00-04:00,LEN,neutral
756533.0,Lennar On Conf. Call Says It Expects Each Of Its Big Business Sentiments To Continue To Grow In Back Half of 2017,2017-06-20 11:13:00-04:00,LEN,neutral
756534.0,Mid-Morning Market Update: Markets Open Lower; Lennar Tops Q2 Expectations,2017-06-20 10:12:00-04:00,LEN,positive
756535.0,20 Stocks Moving In Tuesday's Pre-Market Session,2017-06-20 08:09:00-04:00,LEN,neutral
756536.0,A Peek Into The Markets: U.S. Stock Futures Edge Higher Ahead Of Fed Speakers,2017-06-20 07:19:00-04:00,LEN,neutral
756537.0,Lennar Reports Q2 EPS $0.91 vs $0.78 Est; Revenue $3.3B vs $2.87B Est,2017-06-20 06:03:00-04:00,LEN,neutral
756538.0,"Earnings Scheduled For June 20, 2017",2017-06-20 04:14:00-04:00,LEN,neutral
756547.0,The Top 11 Analysts On TipRanks And What They Cover,2017-05-18 07:50:00-04:00,LEN,positive
756548.0,"Benzinga's Top Upgrades, Downgrades For May 17, 2017",2017-05-17 09:25:00-04:00,LEN,positive
756549.0,Mizuho Initiates Coverage On Lennar with Buy Rating,2017-05-17 06:31:00-04:00,LEN,neutral
756550.0,US Court of Appeals Affirms Judgment in Favor of iStar in Lennar vs iStar,2017-04-14 08:06:00-04:00,LEN,positive
756551.0,Lennar Expects to Record $140M Litigation Charge for Previously Reported Q1 Earnings,2017-04-10 07:31:00-04:00,LEN,negative
756552.0,"Gamco Asset Management Reports 6.01% Stake in Lennar as of March 28, 2017; To Vote for Maintaining Existing Voting Structure, Vote ""Against"" Proposal Requesting All of Co's Outstanding Stock Have One-Vote/Share -13D/A",2017-03-29 06:29:00-04:00,LEN,positive
756553.0,Housing Sector Preview: A Strong Start To 2017,2017-03-23 15:58:00-04:00,LEN,positive
756554.0,"Lennar On Conf. Call Says They Expect To Deliver Between 29,500 and 30,000 Homes For 2017",2017-03-21 11:40:00-04:00,LEN,neutral
756555.0,A Peek Into The Markets: U.S. Stock Futures Edge Higher Ahead Of Fed Speakers,2017-03-21 07:33:00-04:00,LEN,neutral
756556.0,"Lennar Q1 EPS $0.56, Sales $2.34B, No Estimates",2017-03-21 06:02:00-04:00,LEN,negative
756557.0,"Earnings Scheduled For March 21, 2017",2017-03-21 04:11:00-04:00,LEN,neutral
756558.0,Q1 2017 Real-Time Call Brief,2017-03-20 20:00:00-04:00,LEN,neutral
756559.0,Spring Is Heating Up For Homebuilders; Stocks Poised For Near-Term Upside,2017-03-07 11:29:00-05:00,LEN,positive
756560.0,"Attention, Income Investors: Homebuilders With The Best Dividend Yields",2017-02-27 10:11:00-05:00,LEN,positive
756561.0,"Benzinga's Top Upgrades, Downgrades For February 8, 2017",2017-02-08 09:51:00-05:00,LEN,positive
756562.0,"The Market In 5 Minutes: Disney, Gilead Investors Not Too Pleased",2017-02-08 09:03:00-05:00,LEN,negative
756563.0,"BTIG Research Initiates Coverage On Lennar At Buy, Announces $56 Price Target",2017-02-08 07:33:00-05:00,LEN,neutral
756564.0,S&P Dow Jones Indices Announces Cooper Tire to Replace comScore in S&P MidCap 400; Hersha Hospitality Will Replace WCI Communities in S&P SmallCap 600,2017-02-07 17:24:00-05:00,LEN,neutral
756565.0,Benzinga's Option Alert Recap From January 27,2017-01-27 16:55:00-05:00,LEN,positive
756566.0,Option Alert: Lennar Mar 50.0 Calls: 750 @  ASK  $0.37: 750 traded vs 27 OI:  Earnings 3/22 Before Open (est)  $46.20 Ref,2017-01-27 09:49:00-05:00,LEN,positive
756567.0,Benzinga's Option Alert Recap From January 23,2017-01-23 17:12:00-05:00,LEN,positive
756568.0,"Option Alert: Lennar Feb $44 Calls Sweep at the Bid: Volume of 1,527 at $1.061 vs Open Interest 673",2017-01-23 10:58:00-05:00,LEN,positive
756569.0,Trump And Interest Rates: A 2017 Homebuilder Preview,2017-01-11 10:52:00-05:00,LEN,positive
756570.0,"Barclays Initiates Coverage On Lennar at Overweight, Announces $50.00 Target",2017-01-06 06:00:00-05:00,LEN,negative
756571.0,Mid-Afternoon Market Update: Dow Gains Over 50 Points; Globalstar Shares Surge Following FCC News,2016-12-19 14:27:00-05:00,LEN,positive
756572.0,15 Biggest Mid-Day Gainers For Monday,2016-12-19 12:43:00-05:00,LEN,neutral
756573.0,Mid-Day Market Update: Allied World Climbs On Acquisition News; JAKKS Pacific Shares Slide,2016-12-19 12:11:00-05:00,LEN,positive
756574.0,UPDATE: Lennar Exec on Call Guided FY17 Gross Margin 22-22.5%,2016-12-19 11:50:00-05:00,LEN,negative
756575.0,UPDATE: Lennar Sees Delivering 28.5K-29K Homes in 2017,2016-12-19 11:37:00-05:00,LEN,neutral
756576.0,UPDATE: Lennar Exec on Call Making Cautious Comments on Gross Margins,2016-12-19 11:36:00-05:00,LEN,negative
756577.0,Lennar Shares Down ~$0.50 Over Last Few Min as Conference Call Currently Ongoing,2016-12-19 11:35:00-05:00,LEN,positive
756578.0,"Lennar Shares Just Off Session Highs, Up 3+% for Session; Q4 Conference Call Scheduled for 11 a.m. EDT",2016-12-19 10:25:00-05:00,LEN,positive
756579.0,Mid-Morning Market Update: Markets Rise; Lennar Tops Q4 Estimates,2016-12-19 09:56:00-05:00,LEN,positive
756580.0,18 Stocks Moving In Monday's Pre-Market Session,2016-12-19 08:27:00-05:00,LEN,neutral
756581.0,A Peek Into The Markets: U.S. Stock Futures Rise Ahead Of Yellen Speech,2016-12-19 07:39:00-05:00,LEN,neutral
756582.0,"Lennar Q4 EPS $1.34, Revenue $3.4B",2016-12-19 06:01:00-05:00,LEN,neutral
756583.0,5 Stocks You Should Be Watching Today,2016-12-19 04:44:00-05:00,LEN,neutral
756584.0,"Earnings Scheduled For December 19, 2016",2016-12-19 04:27:00-05:00,LEN,neutral
756585.0,Benzinga's Top Initiations,2016-11-15 09:38:00-05:00,LEN,positive
756586.0,Evercore ISI Group Initiates Coverage On Lennar Corporation Class A Common Stock at Buy,2016-11-15 07:24:00-05:00,LEN,neutral
756587.0,Wall Street's M&A Chatter From November 10,2016-11-11 06:35:00-05:00,LEN,neutral
756588.0,"Lennar, Pulte Shares Volatile Here, Largely Unch as Traders Passing Around Unconfirmed Chatter of a Merger",2016-11-10 14:10:00-05:00,LEN,positive
756589.0,Consolidation In The Homebuilding Sector Continues As Toll Brothers Buys Coleman Homes,2016-11-07 11:51:00-05:00,LEN,neutral
756590.0,"Citigroup On Homebuilding M&A Possibilities: DR Horton, Toll Brothers And PulteGroup Targets In Focus",2016-11-01 09:29:00-04:00,LEN,neutral
756591.0,Benzinga's Top Upgrades,2016-10-31 09:17:00-04:00,LEN,positive
756592.0,Raymond James Upgrades Lennar Corporation Class A Common Stock to Strong Buy,2016-10-31 06:34:00-04:00,LEN,positive
756593.0,WCI Communities Reports Expiration of 'Go Shop' Period; Board Did Not Receive Any Superior Proposals vs $23.50/Share Offer from Lennar,2016-10-27 07:00:00-04:00,LEN,negative
756594.0,Lennar's Recovery May Take Longer Than Previously Thought,2016-10-19 14:26:00-04:00,LEN,neutral
756595.0,Benzinga's Top Upgrades,2016-10-17 09:00:00-04:00,LEN,positive
756596.0,Buckingham Upgrades Lennar Corporation Class A Common Stock to Buy,2016-10-17 08:34:00-04:00,LEN,neutral
756597.0,"10 Notable Stocks Trading Ex-Dividend Monday, October 3",2016-09-30 12:03:00-04:00,LEN,neutral
756598.0,Watch for Near-Term Weakness in Housing Stocks as Hearing Chatter Pending Home Sales Data for Aug. (Released at 10 a.m. EDT) Will Be Weaker Than Expected,2016-09-29 09:41:00-04:00,LEN,negative
756599.0,The Market In 5 Minutes: OPEC's Deal And Gary Johnson's Moment,2016-09-29 09:00:00-04:00,LEN,neutral
756600.0,Wells Fargo Initiates Coverage on Lennar at Market Perform,2016-09-29 06:10:00-04:00,LEN,positive
756601.0,Mid-Afternoon Market Update: Crude Oil Up 2.2%; OMNOVA Shares Drop On Earnings Miss,2016-09-22 15:29:00-04:00,LEN,negative
756602.0,15 Biggest Mid-Day Gainers For Thursday,2016-09-22 12:43:00-04:00,LEN,neutral
756603.0,Mid-Day Market Update: WCI Communities Climbs Following Lennar Deal; Herman Miller Shares Slide,2016-09-22 12:09:00-04:00,LEN,positive
756604.0,Benzinga's Volume Movers,2016-09-22 11:00:00-04:00,LEN,neutral
756605.0,Mid-Morning Market Update: Markets Open Higher; AutoZone Profit Tops Estimates,2016-09-22 10:30:00-04:00,LEN,positive
756606.0,The Market In 5 Minutes: No Interest Rate Hike...Yet,2016-09-22 09:04:00-04:00,LEN,positive
756607.0,15 Stocks Moving In Thursday's Pre-Market Session,2016-09-22 08:26:00-04:00,LEN,neutral
756608.0,Homebuilding Stocks In Focus Following Lennar-WCI Deal,2016-09-22 08:23:00-04:00,LEN,neutral
756609.0,A Peek Into The Markets: U.S. Stock Futures Rise Ahead Of Economic Data,2016-09-22 07:46:00-04:00,LEN,neutral
756610.0,"Watch Other Homebuilder Stocks Amid Lennar, WCI Deal: KB Home, Pulte, Toll, LGI, MDC, Taylor Morrison, AV Homes",2016-09-22 06:57:00-04:00,LEN,neutral
756611.0,"UPDATE: Lennar Says Current Expectation for Merger Consideration is $11.75/Share in Cash, Fraction of a Share of LEN Stock with Value of $11.75, or Option of Varying Portions of $23.50/Share in Cash",2016-09-22 06:55:00-04:00,LEN,positive
756612.0,"Lennar, WCI Communities Report Deal for Lennar to Buy All Outstanding Shares of WCI for $23.50/Share",2016-09-22 06:53:00-04:00,LEN,positive
756613.0,Mid-Afternoon Market Update: Ascena Retail Drops On Earnings Miss; DTS Shares Spike Higher,2016-09-20 14:37:00-04:00,LEN,positive
756614.0,Mid-Day Market Update: Tobira Therapeutics Jumps Following Allergan Buyout; HNI Shares Slide,2016-09-20 12:16:00-04:00,LEN,positive
756615.0,Mid-Morning Market Update: Markets Open Higher; Lennar Tops Q3 Expectations,2016-09-20 10:15:00-04:00,LEN,positive
756616.0,The Market In 5 Minutes: Traders In A Standstill Ahead Of FOMC Meeting,2016-09-20 08:49:00-04:00,LEN,neutral
756617.0,A Peek Into The Markets: U.S. Stock Futures Gain; Fed Meeting In Focus,2016-09-20 07:47:00-04:00,LEN,positive
756618.0,Investors Happily Greet Lennar's Q3 Results,2016-09-20 07:27:00-04:00,LEN,positive
756619.0,"Lennar Q3 EPS $1.01, Revenue $2.83B, No Estimates",2016-09-20 06:01:00-04:00,LEN,negative
756620.0,"Earnings Scheduled For September 20, 2016",2016-09-20 04:03:00-04:00,LEN,neutral
756621.0,"Wedbush Initiates Coverage on Lennar at Neutral, Announces $18.00 PT",2016-09-20 02:30:00-04:00,LEN,neutral
756622.0,Technical Alert: Lennar Corp Fails To Reach $46 And Retreats,2016-09-19 16:01:00-04:00,LEN,negative
756623.0,Upcoming Earnings In The Housing Sector,2016-09-19 13:54:00-04:00,LEN,neutral
756624.0,Homebuillders at Highs of the Day,2016-08-30 13:16:00-04:00,LEN,neutral
756625.0,Option Alert: Lennar Oct $49 Calls Sweep at the bid: 1798 @ 1.125 vs. Open Interest 38,2016-08-24 13:35:00-04:00,LEN,positive
756626.0,"Option Alert: LEN Aug $49 Call; 3,750 @Bid @$0.09",2016-08-03 10:03:00-04:00,LEN,positive
756627.0,"Homebuilding Stocks Pulling Back from Session Highs, Now Up ~0.2%; Hearing Pending Home Sales (Due Out In ~5 Mins) Could Be Nearly Unch MoM vs Economist Est. for Up 1.4%",2016-07-27 09:55:00-04:00,LEN,neutral
756628.0,"Moody's Says Outlook for Homebuilders Positive on Employment Growth, Tight Inventory",2016-07-26 13:52:00-04:00,LEN,positive
756629.0,Argus Director Of Research Picks Salesforce For List Of Analyst Ideas,2016-07-18 14:15:00-04:00,LEN,neutral
756630.0,"Argus Adds Three Names To 'Focus List': Cerner, Chevron, & Lennar",2016-07-18 08:58:00-04:00,LEN,neutral
756631.0,Lennar Corp. Wins Dismisal Of Reis Inc Lawsuit Alleging Data Piracy,2016-07-05 16:43:00-04:00,LEN,positive
756632.0,Benzinga's Top Initiations,2016-07-05 09:22:00-04:00,LEN,positive
756633.0,"Argus Sees 27% Upside For Lennar Corporation; Starts With Buy, $59 PT",2016-07-05 09:21:00-04:00,LEN,neutral
756634.0,"Argus Research Initiates Coverage on Lennar at Buy, Announces $59.00 PT",2016-07-05 07:16:00-04:00,LEN,neutral
756635.0,Pending Home Sales for May Down 3.7% to Index Reading of 110.8 vs Down 1.1% Est.,2016-06-29 10:00:00-04:00,LEN,neutral
756636.0,Most Homebuilders Trading Up 1-2%; Watch for Near-Term Downside as Hearing Pending Home Sales Data at 10 a.m. EDT Will Be Weaker-Than-Expected,2016-06-29 09:50:00-04:00,LEN,negative
756637.0,Raymond James Upgrades Lund Enterprises to Outperform,2016-06-27 08:32:00-04:00,LEN,neutral
756638.0,From Conf Call: Lennar Says Backlog Includes Lower Priced Homes; Expect ASP to Fall to $350K's in H2,2016-06-21 11:47:00-04:00,LEN,negative
756639.0,Lennar Relinquishes Gains After Q2 Beat,2016-06-21 11:26:00-04:00,LEN,positive
756640.0,The Market In 5 Minutes: #TrumpSoPoor And More,2016-06-21 08:47:00-04:00,LEN,neutral
756641.0,12 Stocks Moving In Tuesday's Pre-Market Session,2016-06-21 08:18:00-04:00,LEN,neutral
756642.0,A Peek Into The Markets: U.S. Stock Futures Gain; Yellen Speech In Focus,2016-06-21 07:48:00-04:00,LEN,positive
756643.0,"Lennar Reports Q2 EPS $0.95 vs $0.79 in Same Qtr. Last Year, Sales $2.75B, Deliveries Up 12%, New Orders Up 10%",2016-06-21 06:01:00-04:00,LEN,neutral
756644.0,"Earnings Scheduled For June 21, 2016",2016-06-21 04:43:00-04:00,LEN,neutral
756645.0,MKM Thinks Potential Earnings-Related Boost For Lennar Will Be Short-Term Catalyst,2016-06-14 16:36:00-04:00,LEN,positive
756646.0,Option Alert: LEN Jun16 47.0 Calls: 500 @  ASK  $0.45: 2507 traded vs 857 OI:  Earnings 6/22  $45.54 Ref,2016-05-26 12:16:00-04:00,LEN,positive
756647.0,"Goldman Sachs Sees Potential Headwinds For Co's In Houston's Flood Region, Positive On HOV, KBH, LEN Ability To Maintain High Percentage Of Contract Closing",2016-04-22 08:45:00-04:00,LEN,positive
756648.0,William Pulte Leeter Says under Richard Dugas there has been No Value Creation for Shareholders,2016-04-12 16:28:00-04:00,LEN,positive
756649.0,UPDATE: Gabelli Says Can Go Long Lennar B Shares and Short LEN,2016-04-08 12:48:00-04:00,LEN,positive
756650.0,Gabelli Mentions Lennar as Favorite Housing Play,2016-04-08 12:46:00-04:00,LEN,positive
756651.0,"Deutsche Bank Maintains Hold on Lennar, Raises PT to $49.00",2016-03-30 07:10:00-04:00,LEN,neutral
756652.0,"Barclays Maintains Overweight on Lennar, Raises PT to $56.00",2016-03-30 06:39:00-04:00,LEN,negative
756653.0,"Keefe Bruyette & Woods Maintains Outperform on Lennar, Lowers PT to $59.00",2016-03-30 06:39:00-04:00,LEN,negative
756654.0,"Susquehanna Maintains Positive on Lennar, Raises PT to $56.00",2016-03-30 06:39:00-04:00,LEN,positive
756655.0,Mid-Afternoon Market Update: Dow Surges 100 Points; Sunedison Shares Tumble Following Report Of SEC Probe,2016-03-29 14:50:00-04:00,LEN,positive
756656.0,Lennar Q1 Earnings Conference Call: Full Transcript,2016-03-29 14:37:00-04:00,LEN,neutral
756657.0,Lennar Higher After Q4 Beat,2016-03-29 13:01:00-04:00,LEN,neutral
756658.0,Mid-Day Market Update: Crude Oil Down Over 3%; Keryx Biopharmaceuticals Shares Rise Following Positive Kidney Disease Drug Data,2016-03-29 12:08:00-04:00,LEN,positive
756659.0,From Conf Call: Lennar Says Seeing Real Recovery in Labor Picture,2016-03-29 11:47:00-04:00,LEN,neutral
756660.0,"From Conf Call: Lennar CEO Says Modest Moves In Interest Rates, Tight-Low Unemployment, Some Wage Growth Will Be A Net Positive For Housing""",2016-03-29 11:10:00-04:00,LEN,positive
756661.0,Lennar Gains 2% Following Top And Bottom Line Beat,2016-03-29 11:07:00-04:00,LEN,positive
756662.0,Mid-Morning Market Update: Markets Open Lower; Lennar Beats Q1 Expectations,2016-03-29 10:03:00-04:00,LEN,negative
756663.0,"Lennar Announces Q1 EPS $0.63 vs $0.52 est, Revenue $1.99B vs $1.86B est",2016-03-29 06:01:00-04:00,LEN,neutral
756664.0,7 Stocks You Should Be Watching Today,2016-03-29 04:44:00-04:00,LEN,neutral
756665.0,"Earnings Scheduled For March 29, 2016",2016-03-29 04:15:00-04:00,LEN,neutral
756666.0,"Housing In Focus Over Next Couple Weeks: Numerous Data Points, Homebuilder Earnings",2016-03-24 11:19:00-04:00,LEN,neutral
756667.0,Benzinga's Top Initiations,2016-03-22 09:10:00-04:00,LEN,positive
756668.0,Evercore ISI Group Initiates Coverage on Lennar at Buy,2016-03-22 07:16:00-04:00,LEN,neutral
756669.0,How Is Housing Shaping Up For 2016?,2016-03-16 11:26:00-04:00,LEN,neutral
756670.0,"JP Morgan Assumes Lennar at Neutral, Announces $54.00 PT",2016-03-14 08:34:00-04:00,LEN,positive
756671.0,"Credit Suisse Maintains Neutral on Lennar, Lowers PT to $45.00",2016-02-08 04:12:00-05:00,LEN,positive
756672.0,Susquehanna Upgrades Lennar; Sees Attractive Entry Point At Current Levels,2016-01-20 08:48:00-05:00,LEN,positive
756673.0,"UPDATE: Susquehanna on Lennar: 'shares have historically traded at a premium to the peer group, but that premium has compressed in recent weeks.'",2016-01-20 08:25:00-05:00,LEN,positive
756674.0,UPDATE: Susquehanna on Lennar Upgrade: 'Current levels offer an attractive entry point to a highly regarded homebuilder',2016-01-20 08:24:00-05:00,LEN,positive
756675.0,Susquehanna Upgrades Lennar to Positive,2016-01-20 06:41:00-05:00,LEN,positive
756676.0,Sterne Agee CRT Upgrades Lennar to Buy,2016-01-19 07:44:00-05:00,LEN,neutral
756677.0,Benzinga's Top Upgrades,2016-01-15 09:01:00-05:00,LEN,positive
756678.0,"UBS Upgrades Lennar to Buy, Lowers to $50.00",2016-01-15 06:08:00-05:00,LEN,negative
756679.0,"Homebuilder Stocks See Volatile Mid-Day Trading, Regain Ground",2016-01-04 13:57:00-05:00,LEN,neutral
756680.0,Homebuilders Selloff on Volume,2016-01-04 13:02:00-05:00,LEN,neutral
756681.0,Home Sales Rise In November; Homebuilding Stocks Winning,2015-12-24 09:41:00-05:00,LEN,positive
756682.0,"Lennar Reports Q4 EPS $1.21 Vs Prior $1.07, Sales $281.6M Vs Prior $245.3M",2015-12-18 06:01:00-05:00,LEN,neutral
756683.0,"Keep an Eye on These 7 Stocks for December 18, 2015",2015-12-18 04:37:00-05:00,LEN,neutral
756684.0,"Earnings Scheduled For December 18, 2015",2015-12-18 04:31:00-05:00,LEN,neutral
756685.0,The Fate Of Homebuilder Stocks Is Tied To This Data Point,2015-11-18 10:07:00-05:00,LEN,neutral
756686.0,"Tepper's Appaloosa Shows Liquidated Stakes in Lennar, Masco, Mohawk Industries",2015-11-13 16:15:00-05:00,LEN,neutral
756687.0,Strength in Homebuilder Stocks May be Attributed to Several Analyst PT Raises for DR Horton on Wednesday,2015-11-11 11:26:00-05:00,LEN,positive
756688.0,UPDATE: Report Homebuilders Next Industry to Come Under Federal Scrutiny,2015-11-04 15:09:00-05:00,LEN,neutral
756689.0,Hearing Negative Report on Lennar from Inside Mortgage Finance,2015-11-04 15:05:00-05:00,LEN,negative
756690.0,Nailed It: This Leveraged ETF Is On Fire,2015-10-21 08:04:00-04:00,LEN,negative
756691.0,23 Stocks With Growth 'Cheaper Than Value',2015-10-17 10:28:00-04:00,LEN,positive
756692.0,How Morgan Stanley Is Playing Homebuilders In 2016,2015-10-14 14:22:00-04:00,LEN,positive
756693.0,"Lennar: Morgan Stanley Says The Street Undervalues Ancillary Business, Calls Co. Top Pick",2015-10-13 04:25:00-04:00,LEN,positive
756694.0,Top 4 NYSE Stocks In The Residential Construction Industry With The Highest Revenue,2015-10-08 04:57:00-04:00,LEN,positive
756695.0,"Jim Cramer Gives His Opinion On Caterpillar, KB Home, Lennar, Kansas City Southern And General Electric",2015-09-25 07:09:00-04:00,LEN,neutral
756696.0,This Analyst Is Using Lennar To Bet On A Housing Recovery,2015-09-22 15:01:00-04:00,LEN,neutral
756697.0,"Fast Money Trader Share Their Thoughts On Lennar, GoPro, Alibaba And Lululemon",2015-09-22 06:44:00-04:00,LEN,positive
756698.0,"Housing Data, Earnings Are Backdrop To Fed's Yellen Appearance",2015-09-21 12:48:00-04:00,LEN,neutral
756699.0,From Conf Call: Lennar Says Expecting 24K-24.5K Home Deliveries for 2015,2015-09-21 11:28:00-04:00,LEN,neutral
756700.0,From Conf Call: Lennar Says Still Expect Gross Margins to Average ~24% for Full Year,2015-09-21 11:25:00-04:00,LEN,negative
756701.0,Mid-Morning Market Update: Markets Open Higher; Lennar Tops Q3 Views,2015-09-21 10:29:00-04:00,LEN,positive
756702.0,Morning Market Gainers,2015-09-21 09:42:00-04:00,LEN,neutral
756703.0,US Stock Futures Surge Ahead Of Existing Home Sales Data,2015-09-21 07:30:00-04:00,LEN,neutral
756704.0,Lennar Beats Q3 Expectations,2015-09-21 07:21:00-04:00,LEN,neutral
756705.0,"Lennar Q3 EPS $0.96 vs $0.79 est, Revenue $2.5B vs $2.4B est",2015-09-21 06:00:00-04:00,LEN,neutral
756706.0,"Must Watch Stocks for September 21, 2015",2015-09-21 05:06:00-04:00,LEN,neutral
756707.0,"Earnings Scheduled For September 21, 2015",2015-09-21 04:01:00-04:00,LEN,neutral
756708.0,"Goldman's New Index Shows Increasing Mortgage Demand, Signals More Housing Sector Strength To Come",2015-08-06 11:14:00-04:00,LEN,positive
756709.0,"Credit Suisse Sees Home Builder EPS Expectations For '2H and 2016 as generally too optimistic', Sees Better Pricing From Builders Being Offset By Higher Lands & Labor Prices",2015-07-20 07:48:00-04:00,LEN,positive
756710.0,Lennar Multifamily JV Strategies Gaining Momentum,2015-07-17 10:11:00-04:00,LEN,positive
756711.0,Bill Miller Says Builders are Big Part of Portfolio; Likes Pulte Better than Lennar #DeliveringAlpha,2015-07-15 11:09:00-04:00,LEN,positive
756712.0,Credit Suisse Bumps Lennar On Five Point IPO Valuation,2015-07-09 11:30:00-04:00,LEN,positive
756713.0,"Homebuilder Pair Trade? Morgan Stanley Likes Lennar, KB Homes...Not So Much",2015-06-30 09:27:00-04:00,LEN,positive
756714.0,Mid-Afternoon Market Update: Dow Drops Over 150 Points; Nektar Therapeutics Shares Spike Higher,2015-06-24 14:58:00-04:00,LEN,positive
756715.0,Mid-Day Market Update: Box Surges Following Announcement Of Partnership With IBM On Cloud; Sunedison Semiconductor Shares Fall,2015-06-24 14:34:00-04:00,LEN,positive
756716.0,"Wednesday's Mid-Day Movers: Fitbit, Transition Therapeutics Losing Big; Celator Pharma, MeetMe Up",2015-06-24 14:26:00-04:00,LEN,negative
756717.0,"From Lennar Q2 Earnings Conference Call: Cuts Expected Q3 Backlog Conversion Ratio from 80-85% to 75%, Sees Conversion 90-95% in Q4",2015-06-24 11:31:00-04:00,LEN,negative
756718.0,Benzinga's Volume Movers,2015-06-24 10:23:00-04:00,LEN,neutral
756719.0,Mid-Morning Market Update: Markets Open Lower; Lennar Beats Q2 Estimates,2015-06-24 10:20:00-04:00,LEN,negative
756720.0,Morning Market Gainers,2015-06-24 09:42:00-04:00,LEN,neutral
756721.0,Benzinga's Top #PreMarket Gainers,2015-06-24 08:13:00-04:00,LEN,positive
756722.0,US Stock Futures Slide Ahead Of GDP Data,2015-06-24 07:13:00-04:00,LEN,neutral
756723.0,Lennar Tops Q2 Expectations,2015-06-24 07:08:00-04:00,LEN,positive
756724.0,"Lennar Reports Q2 EPS $0.79 vs $0.64 Est., Sales $2.4B vs $2.02B Est.",2015-06-24 06:00:00-04:00,LEN,neutral
756725.0,"Earning, Economic & IPO Calendar for Wednesday June 24, 2015",2015-06-24 05:12:00-04:00,LEN,neutral
756726.0,"Keep an Eye on These 7 Stocks for June 24, 2015",2015-06-24 04:46:00-04:00,LEN,neutral
756727.0,"Earnings Scheduled For June 24, 2015",2015-06-24 04:03:00-04:00,LEN,neutral
756728.0,Can Lennar Post Low-Teens EPS Growth? Experts & Crowd Disagree,2015-06-23 16:28:00-04:00,LEN,neutral
756729.0,"Stocks To Clear First Half Above Water, But Challenges Haven't Changed",2015-06-22 15:01:00-04:00,LEN,positive
756730.0,Homebuilders Higher On May's Existing Home Sales Report,2015-06-22 11:29:00-04:00,LEN,neutral
756731.0,Lennar CEO Explains Housing Recovery's Shortcomings,2015-06-03 13:02:00-04:00,LEN,neutral
756732.0,"Attention Investors: Watch Housing, Volatility And Semiconductor ETFs",2015-05-25 13:08:00-04:00,LEN,neutral
756733.0,April Housing Data Obliterates Expectations; Investors Buy In,2015-05-19 08:52:00-04:00,LEN,neutral
756734.0,Raymond James' Mass Downgrade Of Homebuilders Shows...It Doesn't Like Them Very Much,2015-05-15 15:11:00-04:00,LEN,negative
756735.0,Benzinga's Top Downgrades,2015-05-15 09:34:00-04:00,LEN,positive
756736.0,Raymond James Downgrades Lennar to Market Perform,2015-05-15 08:48:00-04:00,LEN,neutral
756737.0,Benzinga's Top Upgrades,2015-05-08 09:10:00-04:00,LEN,positive
756738.0,Barclays Upgrades Lennar To Overweight,2015-05-08 08:47:00-04:00,LEN,negative
756739.0,Barclays Upgrades Lennar Thanks To FivePoint Undervaluation,2015-05-08 07:53:00-04:00,LEN,positive
756740.0,"Barclays Upgrades Lennar to Overweight, Raises PT to $53.00",2015-05-08 06:29:00-04:00,LEN,negative
756741.0,"Barclays Upgrades Lennar to Overweight, Raises PT to $53.00",2015-05-08 04:04:00-04:00,LEN,negative
756742.0,Citdel Reports 5.3% Passive Stake in Lennar as of Apr 23,2015-04-30 09:35:00-04:00,LEN,positive
756743.0,Why Wunderlich Likes This NYC-Focused Retail REIT,2015-04-28 10:37:00-04:00,LEN,positive
756744.0,Urstadt Biddle Properties Inc. Announces Contract to Sell Its Westchester Pavilion Property,2015-04-06 16:12:00-04:00,LEN,neutral
756745.0,Stocks Hitting 52-Week Highs,2015-04-02 10:12:00-04:00,LEN,neutral
756746.0,Homebuilders Lifted By Pending Sales Data,2015-03-30 13:33:00-04:00,LEN,neutral
756747.0,"Morgan Stanley: Homebuilders At Mercy Of Rising Interest Rates, Slow Demand In Spring",2015-03-30 12:57:00-04:00,LEN,positive
756748.0,4 Stock Charts That Oppenheimer Likes,2015-03-29 10:36:00-04:00,LEN,positive
756749.0,Miller Says Home Builders are Easiest to Make Money on in Next 3-5 Years; Mentions Lennar,2015-03-27 12:29:00-04:00,LEN,positive
756750.0,Housing ETFs Near 8-Year Highs,2015-03-24 15:51:00-04:00,LEN,neutral
756751.0,Here's What The Street's Saying About Lennar,2015-03-20 10:24:00-04:00,LEN,neutral
756752.0,Credit Suisse Raises Estimates On 1Q Beat For Lennar,2015-03-20 08:51:00-04:00,LEN,positive
756753.0,Sell The News In Lennar After Q1 Beat,2015-03-19 15:15:00-04:00,LEN,neutral
756754.0,Morning Market Gainers,2015-03-19 10:02:00-04:00,LEN,neutral
756755.0,Benzinga's Top #PreMarket Gainers,2015-03-19 08:13:00-04:00,LEN,positive
756756.0,US Stock Futures Edge Lower Ahead Of Jobless Claims Report,2015-03-19 07:43:00-04:00,LEN,negative
756757.0,"Lennar Q1 Profit Tops Estimates, Shares Rise",2015-03-19 07:29:00-04:00,LEN,positive
756758.0,"Lennar Q1 EPS $0.50 vs $0.45 est, Revenue $1.4B vs $1.5B est",2015-03-19 06:00:00-04:00,LEN,neutral
756759.0,"Earning & Economic Calendar for Thursday March 19, 2015",2015-03-19 05:16:00-04:00,LEN,neutral
