Unnamed: 0,title,date,stock,sentiment
762562.0,LightInTheBox shares are trading higher after the company reported Q4 EPADS and sales are up year over year.,2020-04-22 16:41:00-04:00,LITB,positive
762563.0,"LightInTheBox Holding Q4 EPADS $(0.030) Up From $(0.370) YoY, Sales $74.720M Up From $57.539M YoY",2020-04-22 16:35:00-04:00,LITB,neutral
762564.0,"LightInTheBox Shares Unaffected Premarket Following 2 Earlier 13D Filings, Vision Knight Showed 7.9% Stake, Conner Growth Showed 10.4%",2020-03-06 09:00:00-05:00,LITB,positive
762565.0,LightInTheBox shares are trading higher after the company reported Q3 EPS and sales are up from the same quarter last year.,2019-12-10 09:19:00-05:00,LITB,positive
762566.0,LightInTheBox Sees Q4 Sales $71M-$75M,2019-12-10 06:10:00-05:00,LITB,neutral
762567.0,"LightInTheBox Holding Q3 EPS $0.15 Up From $(0.27) YoY, Sales $59.9M Up From $44.503M YoY",2019-12-10 06:10:00-05:00,LITB,neutral
762568.0,"LightInTheBox Holding Q2 EPS $(0.05) Up From $(0.14) YoY, Sales $55.443M, Same YoY",2019-09-09 07:23:00-04:00,LITB,neutral
762569.0,"CORRECTION: LightInTheBox Holding Q1 EPS $(0.21) Down From $(0.12) YoY, Sales $50.873M Miss $78.49M Estimate",2019-06-24 06:58:00-04:00,LITB,negative
762570.0,LightInTheBox Regains Compliance with NYSE Listing Requirements,2019-04-03 06:04:00-04:00,LITB,neutral
762571.0,"LightInTheBox Holding Co Q4 EPS $(0.36) Down From $(0.05) YoY, Sales $57.539M Miss $78.49M Estimate",2019-03-29 07:54:00-04:00,LITB,negative
762572.0,LightInTheBox Announces Wenyu Liu Acting CFO,2019-03-11 06:53:00-04:00,LITB,neutral
762573.0,"Stocks Which Set New 52-Week Low The Last Trading Session, Fri., Dec. 7, 2018",2018-12-10 11:01:00-05:00,LITB,negative
762574.0,LightInTheBox Reports Resignation Of CEO Mr. Zhiping Qi; Jian He Appointed CeOP,2018-11-16 07:55:00-05:00,LITB,negative
762575.0,LightInTheBox To Acquire Leading Southeast Asian Cross-Border E-commerce Platform Ezbuy For $85.55M,2018-11-08 08:28:00-05:00,LITB,neutral
762576.0,LightInTheBox Receives Continued Listing Standard Notice From NYSE Due To Average Closing Price Of Co.'s ADSs Being Less Than $1 Over A Consecutive 30-Day Period; Co. Has Six Months To Regain Compliance,2018-10-30 06:06:00-04:00,LITB,neutral
762577.0,"Stocks Which Set New 52-Week Low Yesterday, September 20th",2018-09-21 08:19:00-04:00,LITB,negative
762578.0,"LightInTheBox Holding Co Q2 EPS $0.14 Up From $(0.03) YoY, Sales $55.4M Miss $78.49M Estimate",2018-09-20 06:02:00-04:00,LITB,negative
762579.0,"Stocks Which Set New 52-Week Low Yesterday, September 17th",2018-09-18 09:27:00-04:00,LITB,negative
762580.0,"Stocks Which Set New 52-Week Low Yesterday, September 5th",2018-09-06 08:49:00-04:00,LITB,negative
762581.0,"Stocks Which Set New 52-Week Low Yesterday, September 4th",2018-09-05 10:26:00-04:00,LITB,negative
762582.0,"LightInTheBox Reports Q1 Loss Per ADS $(0.12) vs $(0.03) In Same Qtr. Last Year, Sales $70.1M vs $72.7M YoY",2018-06-29 16:06:00-04:00,LITB,negative
762583.0,LightInTheBox Shares Up 11.1% Premarket After Co. Reported Partnership With CyberMiles For Launch Of Cryptocurrency Rebate Promotional Campaign,2018-06-05 09:29:00-04:00,LITB,positive
762584.0,LightInTheBox Reports Partnership With CyberMiles For Launch Of Cryptocurrency Rebate Promotional Campaign,2018-06-05 09:08:00-04:00,LITB,neutral
762585.0,LightInTheBox Reports Launch Of Cash On Delivery In India,2018-05-16 08:40:00-04:00,LITB,neutral
762586.0,LightInTheBox Reports Strategic North American Distribution Deal With Xiaomi,2018-04-04 08:06:00-04:00,LITB,neutral
762587.0,"LightInTheBox Reports Q4 EPS $(0.05) vs $(0.04) In Prior Year Period, Sales $91.6M vs $95.1M In Prior Year Period",2018-03-23 09:02:00-04:00,LITB,neutral
762588.0,LightInTheBox Establishes Experimental Cryptocurrency Mining Operation in North America,2018-03-15 07:32:00-04:00,LITB,neutral
762589.0,"LightInTheBox Shares Move On PR Announcing ""Cloud Fitting Room"" Service Allowing Customers to Try on Wedding Gowns at Home",2018-02-01 10:05:00-05:00,LITB,positive
762590.0,LightInTheBox Shares Up 9.33% After Earlier Announcement Will Open Blockchain Research Lab,2018-01-18 12:08:00-05:00,LITB,positive
762591.0,LightInTheBox Announces its Chairman and CEO Purchased 114K Shares,2017-12-22 07:40:00-05:00,LITB,positive
762592.0,"LightInTheBox Shares Down 2.59%; Earlier Co. Reported Q3 EPS $(0.04) vs $(0.01) Est., Sales $77.1M vs $70.73M Est.; Co. Sees Q4 Sales $97M-$100M",2017-12-13 09:42:00-05:00,LITB,positive
762593.0,LightInTheBox Singles Day Sales Increased 15.6% YoY,2017-11-13 08:38:00-05:00,LITB,positive
762594.0,LightInTheBox Sees Q3 Sales $75M to $78M vs $71M Est.,2017-09-18 06:05:00-04:00,LITB,neutral
762595.0,"LightInTheBox Q2 EPS $0.00 vs $0.00 Est., Sales $78.49M vs $77.04M Est.",2017-09-18 06:04:00-04:00,LITB,neutral
762596.0,LightInTheBox Sees Q2 Sales $76M-$79M vs $69.7M Est.,2017-06-15 06:04:00-04:00,LITB,neutral
762597.0,"LightInTheBox Extends Buyback Plan From Jun. 15, 2017 To Jun. 14, 2018",2017-06-15 06:04:00-04:00,LITB,positive
762598.0,"LightInTheBox Reports Q1 Adj. EPS $(0.01)/ADS vs $0.02 In Same Qtr. Last Year, Sales $72.7M vs $67.3M YoY",2017-06-15 06:04:00-04:00,LITB,neutral
762599.0,"LightInTheBox Reports Q1 EPS $(0.04) vs $(0.03) In Prior Year Period, Sales $67.29M vs $72.70M In Prior Year Period",2017-06-15 06:01:00-04:00,LITB,neutral
762600.0,LightInTheBox Sees Q1 Sales $70M-$72M vs $70.9M Est.,2017-03-16 07:19:00-04:00,LITB,neutral
762601.0,"LightInTheBox Reports Q4 Adj. EPS $(0.01) vs $0.02 Est., Sales $95.2M vs $92.5M Est.",2017-03-16 07:18:00-04:00,LITB,neutral
762602.0,LightInTheBox Announces Final Court Approval of Settlement in Securities Class Action Litigation,2015-05-11 07:04:00-04:00,LITB,positive
762603.0,"LightInTheBox Reports Q3 EPS of $(0.09), Inline; Revenue of $99.0M vs $94.40M Est",2014-11-19 06:04:00-05:00,LITB,neutral
762604.0,"LightInTheBox, Baidu Dianxin form Strategic Partnership to Develop Global Mobile Markets",2014-11-10 06:04:00-05:00,LITB,neutral
762605.0,"LightInTheBox Reports Q2 EPS of $(0.11), Inline; Revenue of $89.80M vs $84.80M Est",2014-08-20 06:09:00-04:00,LITB,neutral
762606.0,LightInTheBox Raises Q2 Sales Guidance from $84.0M-86.0M to $86.0M-88.0M,2014-06-27 09:17:00-04:00,LITB,neutral
762607.0,LightInTheBox Reports Q1 EPS of $(0.09) vs $(0.10) Est; Revenue of $81.50M vs $79.69M Est,2014-05-21 06:10:00-04:00,LITB,neutral
762608.0,Oppenheimer Downgrades LightInTheBox to Perform,2014-02-27 07:21:00-05:00,LITB,neutral
762609.0, LightInTheBox Holding Reports Q4 EPS of $(0.06) vs $(0.03) Est; Revenue of $78.80M vs $75.32M Est,2014-02-26 06:48:00-05:00,LITB,neutral
762610.0,LightInTheBox Launches Mobile Flash Sales App -Marbridge,2014-02-13 10:38:00-05:00,LITB,neutral
762611.0,LightInTheBox Announces CFO Leaving Co.,2014-01-27 10:02:00-05:00,LITB,neutral
762612.0,LightInTheBox Holding Acquires Ador for Undisclosed Amount of Cash,2014-01-06 08:17:00-05:00,LITB,neutral
762613.0,Stocks Hitting 52-Week Lows,2013-12-16 10:35:00-05:00,LITB,negative
762614.0,"Top Performing Industries For December 16, 2013 ",2013-12-16 10:18:00-05:00,LITB,positive
762615.0,US Stock Futures Up Ahead Of Economic Data,2013-12-16 07:07:00-05:00,LITB,neutral
762616.0,LightInTheBox Announces $20M Share Buyback Program ,2013-12-16 05:55:00-05:00,LITB,positive
762617.0,Stocks Hitting 52-Week Lows,2013-12-13 10:15:00-05:00,LITB,negative
762618.0,Stocks Hitting 52-Week Lows,2013-12-10 10:10:00-05:00,LITB,negative
762619.0,Stocks Hitting 52-Week Lows,2013-11-22 10:16:00-05:00,LITB,negative
762620.0,Market Wrap For November 19: Home Depot's Strong Earnings Unable To Keep Dow In Positive Territory,2013-11-19 16:34:00-05:00,LITB,positive
762621.0,Morning Market Losers ,2013-11-19 10:38:00-05:00,LITB,negative
762622.0,LightInTheBox Sees Q4 Sales $75.0M-77.0M vs $83.06M Est,2013-11-19 07:04:00-05:00,LITB,neutral
762623.0,LightInTheBox Reports Q3 EPS of $(0.02) vs $0.05 Est; Revenue of $68.10M vs $69.97M Est,2013-11-19 07:03:00-05:00,LITB,neutral
762624.0,"Earnings Scheduled For November 19, 2013 ",2013-11-19 04:25:00-05:00,LITB,neutral
762625.0,Stocks Hitting 52-Week Lows,2013-11-01 09:59:00-04:00,LITB,negative
762626.0,Stocks Hitting 52-Week Lows,2013-08-23 09:56:00-04:00,LITB,negative
762627.0,Mid-Day Market Update: US Stocks Rise; Best Buy Jumps On Upbeat Earnings,2013-08-20 13:37:00-04:00,LITB,positive
762628.0,Mid-Morning Market Update: Markets Mixed; Home Depot Posts Higher Earnings,2013-08-20 10:40:00-04:00,LITB,neutral
762629.0,Benzinga's Top Pre-Market Losers,2013-08-20 08:22:00-04:00,LITB,negative
762630.0,Benzinga's Top Downgrades,2013-08-20 07:41:00-04:00,LITB,positive
762631.0,Credit Suisse Downgrades LightInTheBox to Underperform,2013-08-20 07:39:00-04:00,LITB,positive
762632.0,"Stocks To Watch For August 20, 2013",2013-08-20 04:11:00-04:00,LITB,neutral
762633.0,LightInTheBox Sees Q3 Sales $68.0M-70.0M vs $78.50M Est,2013-08-19 16:07:00-04:00,LITB,neutral
762634.0,LightInTheBox Reports Q2 EPS of $0.10 vs $0.06 Est,2013-08-19 16:07:00-04:00,LITB,neutral
762635.0,"Earnings Scheduled For August 19, 2013",2013-08-19 04:30:00-04:00,LITB,neutral
762636.0,UPDATE: Credit Suisse Initiates LightInTheBox at Neutral on Unique Market Position,2013-07-22 09:18:00-04:00,LITB,positive
762637.0,Benzinga's Top Initiations,2013-07-22 07:33:00-04:00,LITB,positive
762638.0,"Credit Suisse Initiates Coverage on LightInTheBox at Neutral, Announces $16.50 PT",2013-07-22 07:23:00-04:00,LITB,positive
762639.0,UPDATE: Oppenheimer Initiates LightInTheBox with Outperform on Positive Long-Term Outlook,2013-07-02 10:49:00-04:00,LITB,positive
762640.0,"UPDATE: Stifel Nicolaus Initiates LightInTheBox with Hold Rating, Awaiting More Attractive Valuation",2013-07-02 09:02:00-04:00,LITB,positive
762641.0,Stifel Nicolaus Initiates Coverage on LightInTheBox at Hold,2013-07-02 07:52:00-04:00,LITB,neutral
762642.0,"Oppenheimer Initiates Coverage on LightInTheBox at Outperform, Announces $17.00 PT",2013-07-02 06:31:00-04:00,LITB,neutral
762643.0,EXCLUSIVE: OTC Markets CEO Answers the Question: 'Is it Wise to Go Public?',2013-06-12 12:18:00-04:00,LITB,positive
762644.0,Why There May Be an Insatiable Appetite for Chinese IPOs,2013-06-11 09:13:00-04:00,LITB,neutral
762645.0,Afternoon Market Gainers,2013-06-06 15:09:00-04:00,LITB,neutral
762646.0,LightInTheBox Prices 8.3M ADS IPO at $9.50/ADS,2013-06-06 06:18:00-04:00,LITB,neutral
