Unnamed: 0,title,date,stock,sentiment
775795.0,"Shares of several utilities companies are trading lower following an increase in coronavirus cases in some US states that have reopened, leading to concerns of a second wave of the virus.",2020-06-11 10:16:00-04:00,LNT,positive
775796.0,Alliant Energy Announces Six New Solar Projects In Wisconsin,2020-05-26 08:45:00-04:00,LNT,positive
775797.0,"Shares of several utilities companies are trading higher amid market strength as some US states begin easing lockdown measures, which has raised hopes of an economic rebound.",2020-05-18 10:17:00-04:00,LNT,positive
775798.0,"Alliant Energy Highlights Launch Of Newly-Constructed West Riverside Energy Center, Will Create 1K+ Jobs",2020-05-15 12:08:00-04:00,LNT,positive
775799.0,"Wells Fargo Maintains Overweight on Alliant Energy, Lowers Price Target to $55",2020-05-13 08:44:00-04:00,LNT,neutral
775800.0,"Alliant Energy Q1 Adj. EPS $0.720 Beats $0.540 Estimate, Sales $915.700M Miss $1.020B Estimate",2020-05-07 18:00:00-04:00,LNT,positive
775801.0,"Earnings Scheduled For May 7, 2020",2020-05-07 05:02:00-04:00,LNT,neutral
775802.0,"Shares of several utilities companies are trading lower with the overall market on continued downward momentum after oil prices fell to historic lows, partially stemming from weak demand caused by the coronavirus pandemic.",2020-04-21 11:47:00-04:00,LNT,negative
775803.0,Shares of several utility companies are trading lower. The markets dipped on a decline in oil prices. The drop raised concerns over the overall economic impact of the coronavirus pandemic.,2020-04-20 12:54:00-04:00,LNT,negative
775804.0,Shares of several utility companies are trading lower as the coronavirus pandemic continues to take its toll on the economy. The pandemic has forced most non-essential businesses to close thus using less utilities.,2020-04-15 09:36:00-04:00,LNT,negative
775805.0,"Shares of several utility companies are trading higher as markets gain following a Federal Reserve loan program. Additionally, speculation of some coronavirus hotspots peaking could raise hopes of a sooner return to consumer spending.",2020-04-09 10:26:00-04:00,LNT,positive
775806.0,Shares of several utility companies are trading lower amid market weakness as macro concerns continue to grow as a result of the coronavirus pandemic.,2020-04-01 09:06:00-04:00,LNT,negative
775807.0,Shares of several utilities companies are trading higher as markets continue to rebound following last week's US stimulus measures. NOTE: Recent volatility may also potentially be raising investor interest in 'safer' sectors.,2020-03-30 13:34:00-04:00,LNT,positive
775808.0,"Barclays Maintains Overweight on Alliant Energy, Lowers Price Target to $48",2020-03-26 10:38:00-04:00,LNT,negative
775809.0,"Alliant Energy shares are trading lower, not currently seeing company-specific news. Movement appears market related as equities experience volatility amid US stimulus progress. The stock has reversed and is now trading higher.",2020-03-25 11:55:00-04:00,LNT,positive
775810.0,Stocks That Hit 52-Week Lows On Monday,2020-03-23 10:34:00-04:00,LNT,negative
775811.0,Stocks That Hit 52-Week Lows On Friday,2020-03-20 14:26:00-04:00,LNT,negative
775812.0,Shares of several energy and utilities companies are trading higher as markets rebound following Monday's crash.,2020-03-17 13:20:00-04:00,LNT,positive
775813.0,Guggenheim Earlier Upgraded Alliant Energy to Buy,2020-03-16 12:48:00-04:00,LNT,positive
775814.0,Stocks That Hit 52-Week Lows On Thursday,2020-03-12 12:10:00-04:00,LNT,negative
775815.0,Shares of several utilities companies are trading lower as US equities crash amid coronavirus fears and OPEC failing to reach a production agreement.,2020-03-09 10:38:00-04:00,LNT,negative
775816.0,Shares of several utilities companies are trading higher after Joe Biden took the delegate lead on Super Tuesday. Biden's more 'moderate' economic policies have been seen as more favorable for growth.,2020-03-04 11:39:00-05:00,LNT,positive
775817.0,"Mizuho Maintains Neutral on Alliant Energy, Lowers Price Target to $56",2020-03-03 07:15:00-05:00,LNT,positive
775818.0,Shares of several utilities companies are trading higher as investors potentially gravitate towards more stable sectors amid overall market volatility.,2020-03-02 11:39:00-05:00,LNT,positive
775819.0,Mid-Morning Market Update: Markets Open Lower; Coronavirus Spreads Outside China,2020-02-24 10:17:00-05:00,LNT,negative
775820.0,Alliant FY19 Adj. EPS $(0.03) vs $(0.01) In FY18,2020-02-20 18:02:00-05:00,LNT,neutral
775821.0,"Earnings Scheduled For February 20, 2020",2020-02-20 04:17:00-05:00,LNT,neutral
775822.0,Stocks That Hit 52-Week Highs On Tuesday,2020-02-18 11:03:00-05:00,LNT,neutral
775823.0,Stocks That Hit 52-Week Highs On Friday,2020-01-31 10:23:00-05:00,LNT,neutral
775824.0,Stocks That Hit 52-Week Highs On Monday,2020-01-27 10:33:00-05:00,LNT,neutral
775825.0,Stocks That Hit 52-Week Highs On Friday,2020-01-24 10:41:00-05:00,LNT,neutral
775826.0,Stocks That Hit 52-Week Highs On Wednesday,2020-01-22 10:17:00-05:00,LNT,neutral
775827.0,Stocks That Hit 52-Week Highs On Tuesday,2020-01-21 10:11:00-05:00,LNT,neutral
775828.0,Stocks That Hit 52-Week Highs On Friday,2020-01-17 13:23:00-05:00,LNT,neutral
775829.0,Stocks That Hit 52-Week Highs On Thursday,2020-01-16 10:22:00-05:00,LNT,neutral
775830.0,Stocks That Hit 52-Week Highs On Wednesday,2020-01-15 13:14:00-05:00,LNT,neutral
775831.0,"UBS Maintains Neutral on Alliant Energy, Raises Price Target to $57",2020-01-10 10:36:00-05:00,LNT,positive
775832.0,Stocks That Hit 52-Week Highs On Friday,2019-12-20 11:59:00-05:00,LNT,neutral
775833.0,"Benzinga's Top Upgrades, Downgrades For December 20, 2019",2019-12-20 10:01:00-05:00,LNT,positive
775834.0,ScotiaBank Upgrades Alliant Energy to Sector Outperform,2019-12-20 07:37:00-05:00,LNT,positive
775835.0,"Benzinga's Top Upgrades, Downgrades For November 21, 2019",2019-11-21 09:44:00-05:00,LNT,positive
775836.0,"Barclays Upgrades Alliant Energy to Overweight, Raises Price Target to $58",2019-11-21 06:21:00-05:00,LNT,negative
775837.0,5 Utilities Stocks Moving In Thursday's Pre-Market Session,2019-11-14 09:07:00-05:00,LNT,neutral
775838.0,Alliant Energy Reports $195.6M Common Stock Offering,2019-11-14 06:40:00-05:00,LNT,positive
775839.0,11 Stocks With The Highest Gross Margins,2019-10-28 17:10:00-04:00,LNT,negative
775840.0,"UBS Maintains Neutral on Alliant Energy, Raises Price Target to $53",2019-09-06 08:51:00-04:00,LNT,positive
775841.0,Stocks That Hit 52-Week Highs On Wednesday,2019-09-04 11:02:00-04:00,LNT,neutral
775842.0,Stocks That Hit 52-Week Highs On Tuesday,2019-08-27 10:30:00-04:00,LNT,neutral
775843.0,Stocks That Hit 52-Week Highs On Friday,2019-08-23 10:33:00-04:00,LNT,neutral
775844.0,Stocks That Hit 52-Week Highs On Thursday,2019-08-22 10:32:00-04:00,LNT,neutral
775845.0,Stocks That Hit 52-Week Highs On Monday,2019-08-19 10:53:00-04:00,LNT,neutral
775846.0,Stocks That Hit 52-Week Highs On Friday,2019-08-16 10:35:00-04:00,LNT,neutral
775847.0,Stocks That Hit 52-Week Highs Of Monday,2019-08-12 10:31:00-04:00,LNT,neutral
775848.0,A List Of Stocks Reaching New 52-Week Highs,2019-08-09 10:29:00-04:00,LNT,positive
775849.0,Stocks That Set New 52-Week Highs Thursday,2019-08-08 12:19:00-04:00,LNT,neutral
775850.0,"Alliant Energy Late Thursday Reported Q2 EPS $0.4 Missed $0.44 Estimate, Sales $790.2M Missed $857.12M Estimate",2019-08-02 08:43:00-04:00,LNT,negative
775851.0,Alliant Energy Q2 EPS $0.4 Misses $0.44 Estimate,2019-08-01 18:02:00-04:00,LNT,positive
775852.0,"Benzinga's Top Upgrades, Downgrades For June 26, 2019",2019-06-26 09:07:00-04:00,LNT,positive
775853.0,"Bank of America Upgrades Alliant Energy to Buy, Raises Price Target to $54",2019-06-26 06:39:00-04:00,LNT,positive
775854.0,"Alliant Energy Q4 Adj.EPS $0.36 Beats $0.35 Estimate, Sales $873.5M Beat $853.56M Estimate",2019-02-21 18:04:00-05:00,LNT,positive
775855.0,Alliant Energy FY18 Adj. EPS $2.17 vs $1.93 In FY17,2019-02-21 18:01:00-05:00,LNT,positive
775856.0,"Earnings Scheduled For February 21, 2019",2019-02-21 04:27:00-05:00,LNT,neutral
775857.0,Alliant Energy Chairman And CEO Patricia L. Kampling Announces Retirement; John O. Larsen Named New Chairman And CEO,2019-02-13 16:36:00-05:00,LNT,positive
775858.0,7 Biggest Price Target Changes For Wednesday,2019-01-30 09:44:00-05:00,LNT,neutral
775859.0,"Benzinga's Top Upgrades, Downgrades For January 30, 2019",2019-01-30 09:17:00-05:00,LNT,positive
775860.0,"Wells Fargo Upgrades Alliant Energy to Outperform, Raises Price Target to $49",2019-01-30 06:29:00-05:00,LNT,positive
775861.0,"Stocks That Will Be Trading Ex Dividend Wed., Jan. 30, 2019",2019-01-29 10:46:00-05:00,LNT,neutral
775862.0,"Barclays Initiates Coverage On Alliant Energy with Equal-Weight Rating, Announces $45 Price Target",2019-01-18 09:01:00-05:00,LNT,positive
775863.0,Alliant Energy Corporation Late Thursday Announced Pricing Of ~7.27M Share Common Stock Offering At $44.85/Share,2018-12-14 08:31:00-05:00,LNT,positive
775864.0,"5 Stocks To Watch For December 14, 2018",2018-12-14 04:39:00-05:00,LNT,neutral
775865.0,Alliant Energy Corporation Reports $326M Common Stock Offering,2018-12-13 16:25:00-05:00,LNT,positive
775866.0,"Benzinga's Top Upgrades, Downgrades For November 21, 2018",2018-11-21 08:53:00-05:00,LNT,positive
775867.0,"Stocks Which Set New 52-Week High Yesterday, Tues., Nov. 20, 2018",2018-11-21 08:38:00-05:00,LNT,neutral
775868.0,Bank of America Downgrades Alliant Energy to Underperform,2018-11-21 06:34:00-05:00,LNT,positive
775869.0,Alliant Raises FY18 EPS Guidance To $2.13-$2.19,2018-11-06 18:00:00-05:00,LNT,neutral
775870.0,Alliant Energy Corporation Q3 EPS $0.87 Beats $0.83 Estimate,2018-11-06 18:00:00-05:00,LNT,positive
775871.0,"Earnings Scheduled For November 6, 2018",2018-11-06 05:31:00-05:00,LNT,neutral
775872.0,"Stocks That Will Be Trading Ex Dividend Tues., Oct. 30, 2018",2018-10-29 10:06:00-04:00,LNT,neutral
775873.0,"Benzinga's Top Upgrades, Downgrades For October 9, 2018",2018-10-09 09:17:00-04:00,LNT,positive
775874.0,"Mizuho Initiates Coverage On Alliant Energy with Neutral Rating, Announces $44 Price Target",2018-10-09 07:46:00-04:00,LNT,positive
775875.0,"Wells Fargo Maintains Market Perform on Alliant Energy, Raises Price Target to $47",2018-09-17 09:03:00-04:00,LNT,positive
775876.0,"Alliant Energy Q2 EPS $0.43 Misses $0.45 Estimate, Sales $816.1M Beat $791.45M Estimate",2018-08-02 18:08:00-04:00,LNT,positive
775877.0,"Stocks Trading Ex Dividend For Mon., Jul. 30, 2018",2018-07-30 08:41:00-04:00,LNT,neutral
775878.0,NextEra Energy Reports Its Resources Unit And Alliant Energy Agreed To Shorten Term Of Duane Arnold Energy Center Power Purchase Deal: Plant Will Be Retired In Late 2020,2018-07-27 08:41:00-04:00,LNT,positive
775879.0,Scotia Howard Weil Initiates Coverage On Alliant Energy with Sector Perform Rating,2018-07-24 08:59:00-04:00,LNT,positive
775880.0,"Alliant Energy Reports Signing Of Contracts By Which Invenergy Will Complete Development Of 210MW Richland Wind Farm In Sac County, Iowa",2018-07-16 17:02:00-04:00,LNT,positive
775881.0,Mid-Day Market Update: Dow Falls 350 Points; Merrimack Pharmaceuticals Shares Plummet,2018-06-25 12:06:00-04:00,LNT,positive
775882.0,Mid-Morning Market Update: Markets Open Lower; Carnival Cuts Profit Forecast,2018-06-25 10:41:00-04:00,LNT,negative
775883.0,Alliant Energy Sees FY18 EPS $2.04-$2.18 vs $2.11 Est.,2018-05-02 18:01:00-04:00,LNT,positive
775884.0,"Alliant Energy Q1 EPS $0.52 Misses $0.53 Estimate, Sales $916.3M Miss $977.99M Estimate",2018-05-02 18:00:00-04:00,LNT,negative
775885.0,"Earnings Scheduled For May 2, 2018",2018-05-02 05:54:00-04:00,LNT,neutral
775886.0,24 Stocks Moving In Tuesday's Pre-Market Session,2018-03-13 08:00:00-04:00,LNT,neutral
775887.0,Alliant Energy Sees FY18 EPS $2.04-$2.18 vs $2.11 Est.,2018-02-22 17:06:00-05:00,LNT,positive
775888.0,"Alliant Energy Reports Q4 Adj. EPS $0.33 vs $0.36 Est., Sales $856.1M vs $896.94M Est.",2018-02-22 17:05:00-05:00,LNT,positive
775889.0,"Earnings Scheduled For February 22, 2018",2018-02-22 04:19:00-05:00,LNT,neutral
775890.0,"UBS Initiates Coverage On Alliant Energy with Neutral Rating, Announces $40.00 Price Target",2018-02-02 08:13:00-05:00,LNT,positive
775891.0,Wells Fargo Downgrades Alliant Energy to Market Perform,2017-12-18 09:12:00-05:00,LNT,positive
775892.0,Alliant Energy Names John Larsen Pres,2017-12-11 08:05:00-05:00,LNT,positive
775893.0,"Alliant Energy Reports Q3 Adj EPS $0.75 vs $0.85 Est., Sales $906.9M",2017-11-02 18:02:00-04:00,LNT,positive
775894.0,"Alliant Energy Reports Q2 EPS $0.41 vs $0.38 Est., Sales $765.3M vs $726M Est.",2017-08-03 18:01:00-04:00,LNT,positive
775896.0,EDF Renewable Energy Signs Agreement to Sell 50% of Great Western Wind Project to Alliant Energy; Terms Not Disclosed,2017-06-16 06:18:00-04:00,LNT,positive
775897.0,"EDF Renewable Energy Signs Agreement to Sell 50% of Great Western Wind Project to Alliant Energy, Terms Not Disclosed",2017-06-16 06:17:00-04:00,LNT,positive
775898.0,"Benzinga's Top Upgrades, Downgrades For May 26, 2017",2017-05-26 09:31:00-04:00,LNT,positive
775899.0,"Jefferies Initiates Coverage On Alliant Energy with Hold Rating, Announces $42.00 Price Target",2017-05-26 06:12:00-04:00,LNT,positive
775900.0,Filing from Alliant Energy Shows Registration for $125M Common Stock Offering,2017-05-09 17:19:00-04:00,LNT,positive
775901.0,"UBS Initiates Coverage On Alliant Energy With Neutral, Announces $40 Price Target",2017-03-16 09:19:00-04:00,LNT,positive
775902.0,Alliant Sees Fy17 Consolidated EPS $1.92-$2.06,2017-02-23 18:02:00-05:00,LNT,neutral
775903.0,Alliant Energy Reports FY16 Adj. EPS from Continuing Operations $1.88,2017-02-23 18:01:00-05:00,LNT,positive
775904.0,"Big Investments By Utilities Pave Road to Renewability, Profits",2017-02-02 15:03:00-05:00,LNT,positive
775905.0,Macquarie Downgrades Alliant Energy To Neutral,2017-01-24 07:41:00-05:00,LNT,positive
775906.0,"Electric Utilities Up Early: Exelon 3%, Companhia Paranaense de Energia 3%, Enersis Americas 2.5%, Alliant 2%, OGE 2%, AES 2%, Duke 1.5%, Public Service 1%, Dominion 1%",2016-12-02 10:37:00-05:00,LNT,neutral
775907.0,Guggenheim Initiates Coverage On Alliant Energy Corporation Common Stock at Neutral,2016-11-04 07:12:00-04:00,LNT,positive
775908.0,"Alliant Energy Reports Q3 Adj. EPS $0.80 vs $0.90 Est., Sales $924.6M vs $898.9M in Same Qtr. Last Year",2016-11-03 18:02:00-04:00,LNT,positive
775909.0,Mid-Day Market Update: GNC Falls After Weak Q3 Results; Ocwen Financial Shares Surge,2016-10-27 12:06:00-04:00,LNT,negative
775910.0,Alliant Energy reaches agreement with customer groups on proposed wind project Up to 500 MW,2016-10-12 16:30:00-04:00,LNT,positive
775911.0,Alliant Energy Senior Vice President and CFO Tom Hanson announces retirement,2016-09-23 16:32:00-04:00,LNT,positive
775912.0,Alliant Energy Reaffirms FY16 EPS $1.80-$1.95 vs $1.90 Est.,2016-08-01 18:05:00-04:00,LNT,positive
775913.0,"Alliant Energy Reports Q2 Adj. EPS $0.37 vs $0.38 Est., Sales $754.6M vs $733.7M Est.",2016-08-01 18:04:00-04:00,LNT,positive
775914.0,Alliant Energy announces $1 billion wind project to advance clean energy,2016-07-27 16:44:00-04:00,LNT,positive
775915.0,Alliant Energy Awarded 2.3-MW Rock River Solar Project,2016-07-18 12:00:00-04:00,LNT,positive
775916.0,Mid-Afternoon Market Update: Dow Jumps 140 Points; Imperva Shares Slide Following Reduced Q2 Outlook,2016-07-12 14:33:00-04:00,LNT,positive
775917.0,Mid-Day Market Update: Crude Oil Up 3%; Seagate Shares Surge On Strong Revenue Guidance,2016-07-12 12:12:00-04:00,LNT,positive
775918.0,Alliant Energy Pays Approximately 68% Of Its Profit As Dividend,2016-07-08 15:40:00-04:00,LNT,positive
775919.0,S&P Dow Jones Indices Announces 'Alliant Energy Set to Join the S&P 500; Southwest Gas to Join S&P MidCap 400; Shutterstock to Join S&P SmallCap 600',2016-06-29 17:19:00-04:00,LNT,positive
775920.0,"Barclays Downgrades Alliant Energy to Equal-weight, Maintains $39.00 PT",2016-06-10 06:20:00-04:00,LNT,positive
775921.0,Alliant Energy Vice President And Treasurer John Kratchmer Announces Retirement,2016-06-01 16:31:00-04:00,LNT,positive
775922.0,Alliant Energy Sees FY16 EPS $1.80-$1.95,2016-05-04 18:13:00-04:00,LNT,positive
775923.0,"Alliant Energy Reports Q1 EPS $0.86 vs. Est. $0.85, Rev. $843.8M vs. Est. $756M",2016-05-04 18:12:00-04:00,LNT,positive
775924.0,"Argus Research Maintains Buy on Alliant Energy, Raises PT to $77.00",2016-03-21 07:11:00-04:00,LNT,positive
775925.0,"Barclays Maintains Overweight on Alliant Energy, Raises PT to $77.00",2016-03-18 05:53:00-04:00,LNT,negative
775926.0,7 Ways To Play An Improving Utilities Industry,2016-03-02 10:29:00-05:00,LNT,positive
775927.0,"Baird Top Utilities Ideas Are CMS, LNT, NEE, WEC, And WTR",2016-03-02 06:57:00-05:00,LNT,positive
775928.0,Alliant Energy Corp Sees FY 2016 EPS $3.60-$3.90 Vs Est $3.78,2016-02-22 18:04:00-05:00,LNT,positive
775929.0,"Alliant Energy Corp Reports Q4 EPS $0.30 Vs Est $0.43, Sales $740.1M Vs Est $854.51M",2016-02-22 18:03:00-05:00,LNT,positive
775930.0,"Earnings Scheduled For February 22, 2016",2016-02-22 04:09:00-05:00,LNT,neutral
775931.0,Mid-Afternoon Market Update: FedEx Gains On Earnings Beat; Teekay Shares Tumble,2015-12-17 14:55:00-05:00,LNT,positive
775932.0,Mid-Day Market Update: Dow Tumbles 150 Points; Pandora Shares Jump Following Wednesday's CRB Ruling,2015-12-17 12:42:00-05:00,LNT,positive
775933.0,"Barclays Upgrades Alliant Energy to Overweight, Raises PT to $68.00",2015-12-17 10:30:00-05:00,LNT,negative
775934.0,Benzinga's Top Upgrades,2015-11-16 08:54:00-05:00,LNT,positive
775935.0,Wells Fargo Upgrades Alliant Energy to Outperform,2015-11-16 06:38:00-05:00,LNT,positive
775936.0,Alliant Energy Reports Q3 EPS $1.63 Vs Est $1.55; Narrows FY EPS To $3.50-$3.65 Vs Est $3.63; FY 2016 EPS $3.60-$3.90 vs Est $3.83; Raises Fy 2016 Dividend Target To $2.35/Share,2015-11-05 18:35:00-05:00,LNT,positive
775937.0,Alliant Energy to expand solar generation in Iowa that could increase system-wide solar generation by 50%,2015-10-05 16:02:00-04:00,LNT,positive
775938.0,Alliant Energy Reports Q2 Adj. EPS $0.58 vs $0.60; Reaffirms FY15 Guidance,2015-08-05 18:00:00-04:00,LNT,positive
775939.0,"Ahead of Alliant Energy's Chicago Investor Meeting Presentation, Co. Issues Slideshow Showing Expecting FY14-18 Capex ~$5.2B, FY19-23 Capex ~$4.8B",2015-04-10 11:46:00-04:00,LNT,neutral
775940.0,Alliant Energy Announces Closing of ATM Offering,2015-03-30 17:08:00-04:00,LNT,positive
775941.0,Baird Upgrades Alliant Energy to Outperform,2015-03-25 06:34:00-04:00,LNT,positive
775942.0,"Alliant Energy Announces ""At-the-Market"" Equity Offering",2015-03-04 17:16:00-05:00,LNT,positive
775943.0,Alliant Energy Reports Q4 Adj. EPS $0.54 vs $0.55 Est.; Affirms FY15 Outlook,2015-02-23 18:01:00-05:00,LNT,positive
775944.0,Alliant Reports FY14 EPS $3.48,2015-02-23 18:01:00-05:00,LNT,neutral
775945.0,"Earnings Scheduled For February 23, 2015",2015-02-23 05:03:00-05:00,LNT,neutral
775946.0,Alliant Energy Raises Qtr. Dividend from $0.51 to $0.55/Share,2015-01-16 10:01:00-05:00,LNT,positive
775947.0,"Wunderlich Assumes Alliant Energy Corporation at Hold, Raises $64.00 PT",2014-11-21 06:23:00-05:00,LNT,positive
775948.0,Interstate Power And Light Company Announces Pricing Of $250M Debt Offering,2014-11-18 10:36:00-05:00,LNT,negative
775949.0,Top 4 Mid-Cap Stocks In The Electric Utilities Industry With The Highest EPS ,2014-08-25 04:48:00-04:00,LNT,positive
775950.0,Alliant Energy Corporation Reports Q2 EPS of $0.56 vs $0.59 Est; Reaffirms Outlook,2014-08-06 18:04:00-04:00,LNT,positive
775951.0,Alliant Techsystems Reports Q1 Adj. EPS $2.86,2014-07-31 07:23:00-04:00,LNT,neutral
775952.0,Alliant Energy Announces Commencement of Construction on Marshalltown Station,2014-06-04 17:01:00-04:00,LNT,positive
775953.0,Alliant Energy Corporation Reports Q1 EPS of $0.97 vs $0.76 Est,2014-05-01 18:00:00-04:00,LNT,positive
775954.0,"Wunderlich Maintains Buy on Alliant Energy Corporation, Raises PT to $62.00",2014-04-10 06:19:00-04:00,LNT,positive
775955.0,Top 4 Mid-Cap Stocks In The Electric Utilities Industry With The Highest EPS,2014-04-04 04:16:00-04:00,LNT,positive
775956.0,Form 8-K from Alliant Energy Shows Reaffirmed Outlook,2014-04-01 16:44:00-04:00,LNT,positive
775957.0,"Wunderlich Maintains Buy on Alliant Energy Corporation, Raises PT to $60.00",2014-03-26 06:42:00-04:00,LNT,positive
775958.0,"Alliant Energy Reports Deal to Extend Iowa Electric Base Rate Freeze, Offer Customer Credits",2014-03-25 17:01:00-04:00,LNT,positive
775959.0,Market Wrap For March 4: Bulls Take Over As Ukraine Fears Dissipate,2014-03-04 16:37:00-05:00,LNT,negative
775960.0,"Wunderlich Maintains Buy on Alliant Energy Corporation, Raises PT to $58.00",2014-02-26 06:40:00-05:00,LNT,positive
775961.0,Alliant Energy Reports Q4 Adjusted EPS of $0.55 vs $0.52 Est; Revenue of $832.60M vs $772.68M Est,2014-02-25 06:23:00-05:00,LNT,positive
775962.0,Alliant Energy Raises Qtr. Dividend from $0.47 to $0.51/Share,2014-01-17 09:00:00-05:00,LNT,positive
775963.0,"Alliant Energy Receives Final Approval to Upgrade Columbia Energy, Says Investment Will Be ~$130M",2014-01-08 15:13:00-05:00,LNT,positive
775964.0,Alliant Energy Receives Final Approval to Upgrade Columbia Energy Center,2014-01-08 15:12:00-05:00,LNT,positive
775965.0,"Barclays Downgrades Alliant Energy Corporation to Equalweight, Lowers PT to $49.00",2014-01-06 08:20:00-05:00,LNT,positive
775966.0,UPDATE: Macquarie Capital Reiterates on Alliant Energy Following Management Meeting,2013-11-12 11:14:00-05:00,LNT,positive
775967.0,"Wunderlich Maintains Buy on Alliant Energy Corporation, Lowers PT to $56.00",2013-10-17 07:22:00-04:00,LNT,positive
775968.0,Lockheed Martin Spiking on Heavy Volume,2013-09-26 13:01:00-04:00,LNT,neutral
775969.0,KeyBanc Upgrades Alliant Energy Corporation to Hold,2013-09-05 14:06:00-04:00,LNT,positive
775970.0,"Alliant Energy to Sell Minnesota Electric, Natural Gas Distribution Businesses",2013-09-03 17:02:00-04:00,LNT,positive
775971.0,"DA Davidson Maintains Buy on Alliant Energy Corporation, Raises PT to $60.00",2013-08-05 07:08:00-04:00,LNT,positive
775972.0,A Peek Into The Market Before The Trading Starts,2013-08-02 07:40:00-04:00,LNT,neutral
775973.0,UPDATE: Alliant Energy Posts Upbeat Q2 Earnings,2013-08-02 07:28:00-04:00,LNT,positive
775974.0,"Earnings Scheduled For August 2, 2013",2013-08-02 04:41:00-04:00,LNT,neutral
775975.0,Alliant Energy Corporation Reports Q1 EPS of $0.72 vs $0.61 Est,2013-05-03 06:27:00-04:00,LNT,positive
775976.0,"Wunderlich Maintains Buy on Alliant Energy Corporation, Raises PT to $58.00",2013-05-02 06:48:00-04:00,LNT,positive
775977.0,"DA Davidson Maintains Buy on Alliant Energy Corporation, Raises PT to $58.00",2013-04-12 16:01:00-04:00,LNT,positive
775978.0,ClickSoftware's ClickAppStore Selected by Alliant Energy ,2013-03-19 08:09:00-04:00,LNT,positive
775979.0,"DA Davidson Maintains Buy on Alliant Energy Corporation, Raises PT to $53.00",2013-02-14 15:06:00-05:00,LNT,positive
775980.0,Alliant Energy Corporation Reports Q4 EPS of $0.64 vs $0.57 Est; Revenue of $750.90M vs $803.76M Est,2013-02-14 06:30:00-05:00,LNT,positive
775981.0,Alliant Energy Raises Qtr. Dividend from $0.45 to $0.47/Share,2013-01-11 09:24:00-05:00,LNT,positive
775982.0,"Wells Fargo Upgraded Pepco to Outperform, Downgraded Alliant, IDACORP to Market Perform",2013-01-02 11:15:00-05:00,LNT,positive
775983.0,Alliant Subsidiary Wisconsin Power Completes Purchase of Riverside Energy Center ,2013-01-02 06:16:00-05:00,LNT,positive
775984.0,Alliant Energy to Sell RMT,2012-12-12 17:15:00-05:00,LNT,positive
775985.0,IUB Approves Settlement in Alliant's IPL Nat-Gas Rate Case,2012-11-27 10:49:00-05:00,LNT,positive
775986.0,Wisconsin Power and Light Company Announces Pricing of $250M Debt Offering,2012-11-14 17:19:00-05:00,LNT,negative
775987.0,Earnings Analysis: Alliant Energy ,2012-11-13 13:47:00-05:00,LNT,positive
775988.0,"UPDATE: D.A. Davidson Reiterates Buy Rating, Lowers PT on Alliant Energy Corporation",2012-11-12 11:30:00-05:00,LNT,positive
775989.0,US Stock Futures Flat Ahead Of Economic Data,2012-11-09 05:53:00-05:00,LNT,neutral
775990.0,"Earnings Scheduled For November 9, 2012",2012-11-09 01:58:00-05:00,LNT,neutral
775991.0,UPDATE: Wunderlich Securities Upgrades Alliant Energy to Buy on Earnings Growth  ,2012-10-19 11:58:00-04:00,LNT,positive
775992.0,"Wunderlich Securities Upgrdes Alliant Energy from Hold to Buy, Raises PT from $47 to $50",2012-10-19 06:11:00-04:00,LNT,positive
775993.0,Interstate Power and Light Company Settles with IUB,2012-08-16 17:05:00-04:00,LNT,neutral
775994.0,"Bank of America Maintains Alliant Energy at Neutral, Raises PO from $46 to $47",2012-08-07 08:46:00-04:00,LNT,negative
775995.0,"UPDATE: D.A. Davidson Reiterates Buy Rating, Raises PT on Alliant Energy",2012-08-06 09:50:00-04:00,LNT,positive
775996.0,"UPDATE: Wunderlich Reiterates Hold Rating, Raises PT on Alliant Energy",2012-08-06 09:48:00-04:00,LNT,positive
775997.0,"Wunderlich Securities Maintains Alliant Energy at Hold, Raises PT from $45 to $47",2012-08-06 05:49:00-04:00,LNT,positive
775998.0,"DA Davidson Maintains Alliant Energy at Buy, Raises PT from $49 to $53",2012-08-06 05:46:00-04:00,LNT,positive
775999.0,Alliant Energy Reports Q2 EPS $0.58 vs $0.46 Est; Revenues $690.3M vs $699.73M Est,2012-08-03 06:32:00-04:00,LNT,positive
776000.0,US Stock Futures Up; Jobs Data In Focus,2012-08-03 06:31:00-04:00,LNT,neutral
776001.0,"Earnings Scheduled For August 3, 2012",2012-08-03 00:14:00-04:00,LNT,neutral
776002.0,"Robert W. Baird Upgrades Alliant Energy from Neutral to Outperform, Raises PT from $44 to $49",2012-05-14 07:56:00-04:00,LNT,positive
776003.0,"Benzinga's Top Downgrades With Color for May 7, 2012",2012-05-07 09:42:00-04:00,LNT,positive
776004.0,UPDATE: Ladenburg Thalmann Downgrades Alliant Energy to Neutral from Buy; Lowers PT,2012-05-07 09:29:00-04:00,LNT,positive
