Unnamed: 0,title,date,stock,sentiment
826007.0,Several of industrial companies are trading lower amid market weakness as investors await today's Federal Reserve decision and update on the state of the economy. Markets have sold off over the past few sessions following recent surge.,2020-06-10 10:36:00-04:00,MIDD,negative
826008.0,"Shares of several industrial companies are trading higher on continued upward momentum surrounding the economy reopening, which would increase consumer spending and economic activity. New York City moved into phase one of its reopening plan on Monday.",2020-06-08 09:49:00-04:00,MIDD,positive
826009.0,Shares of several industrial companies are trading higher following strong US jobs numbers and continued optimism surrounding the reopening of the US economy. These have lead to hopes of an economic rebound and an uptick in production/shipping activity.,2020-06-05 10:18:00-04:00,MIDD,positive
826010.0,Shares of several industrial companies are trading higher after as equities continue to gain on optimism over an economic reopening which could potentially increase consumer spending and sales demand as well as a smaller-than-expected drop in nonfarm payrolls.,2020-06-03 10:25:00-04:00,MIDD,positive
826011.0,"The Middleby Corp. Reports Exclusive Partnership With Jon Taffer's Taffer's Tavern, No Terms Disclosed",2020-06-03 08:03:00-04:00,MIDD,negative
826012.0,"CL King Reinstates Buy on The Middleby, Announces $86 Price Target",2020-06-02 07:42:00-04:00,MIDD,neutral
826013.0,Shares of several industrial companies are trading higher in sympathy with the overall market as equities rally on coronavirus vaccine hopes as well as a pickup in economic activity as some US states reopen businesses.,2020-05-26 11:26:00-04:00,MIDD,positive
826014.0,"Shares of several industrial companies are trading higher amid market strength as news from a Moderna trial stoked optimism about a potential coronavirus vaccine, which has raised hopes of an economic rebound.",2020-05-18 10:23:00-04:00,MIDD,positive
826015.0,Shares of several industrial companies are trading higher after US unemployment figures came in below consensus estimates. Equities have been strong this week amid a rebound in oil prices and some US states easing lockdown restrictions.,2020-05-08 10:45:00-04:00,MIDD,positive
826016.0,"Citigroup Maintains Neutral on The Middleby, Raises Price Target to $64",2020-05-08 08:01:00-04:00,MIDD,neutral
826017.0,The Middleby shares are trading higher after the company reported Q1 earnings results.,2020-05-07 08:27:00-04:00,MIDD,positive
826018.0,"The Middleby Q1 Adj. EPS $1.330 Down From $1.380 YoY, Sales $677.500M Down From $686.802M YoY",2020-05-07 07:21:00-04:00,MIDD,neutral
826019.0,Shares of several industrial companies are trading lower on market weakness as investor uncertainty grows following quarterly earnings results from multiple companies.,2020-05-01 09:19:00-04:00,MIDD,negative
826020.0,Shares of several industrial companies are trading lower amid market weakness following US jobless claims and consumer spending data.,2020-04-30 10:14:00-04:00,MIDD,negative
826021.0,Shares of several industrial companies are trading higher as equities gain amid oil prices potentially stabilizing following the recent crash.,2020-04-22 10:28:00-04:00,MIDD,positive
826022.0,"Prescience Point Capital Management Issue Short Report On Middleby, Says 'Wall St's V-shaped recovery narrative doesn't account for a flood of used equipment to hit the market, result of fallout from #COVID19. Shares are likely to fall another 50%.'",2020-04-15 10:00:00-04:00,MIDD,positive
826023.0,Shares of several industrial companies are trading higher amid optimism that coronavirus cases in Asia are potentially easing. Strength may also be attributed to optimism that coronavirus cases in several US hotspots appear to be reaching their peak.,2020-04-07 07:34:00-04:00,MIDD,positive
826024.0,Stocks That Hit 52-Week Lows On Monday,2020-03-23 10:34:00-04:00,MIDD,negative
826025.0,10 Biggest Price Target Changes For Monday,2020-03-23 08:19:00-04:00,MIDD,neutral
826026.0,"Citigroup Maintains Neutral on The Middleby, Lowers Price Target to $54",2020-03-23 07:57:00-04:00,MIDD,negative
826027.0,Stocks That Hit 52-Week Lows On Thursday,2020-03-19 10:49:00-04:00,MIDD,negative
826028.0,Stocks That Hit 52-Week Lows On Friday,2020-03-13 11:13:00-04:00,MIDD,negative
826029.0,Stocks That Hit 52-Week Lows On Thursday,2020-03-12 12:10:00-04:00,MIDD,negative
826030.0,Stocks That Hit 52-Week Lows On Wednesday,2020-03-11 11:41:00-04:00,MIDD,negative
826031.0,Stocks That Hit 52-Week Lows On Friday,2020-03-06 11:22:00-05:00,MIDD,negative
826032.0,"Middleby Acquires Deutsche Beverage Technology, Terms Not Disclosed",2020-03-02 07:01:00-05:00,MIDD,neutral
826033.0,The Middleby Corp shares are trading higher after the company reported better-than-expected Q4 EPS and sales results.,2020-02-26 09:13:00-05:00,MIDD,positive
826034.0,"The Middleby Q4 Adj. EPS $2 Beats $1.71 Estimate, Sales $787.626M Beat $759.26M Estimate",2020-02-26 07:24:00-05:00,MIDD,neutral
826035.0,"Earnings Scheduled For February 26, 2020",2020-02-26 04:38:00-05:00,MIDD,neutral
826036.0,Middleby Acquires RAM Fry Dispensers,2020-01-13 09:04:00-05:00,MIDD,neutral
826037.0,"Middleby to Acquires Synesso, Terms Not Disclosed",2019-12-02 08:06:00-05:00,MIDD,neutral
826038.0,"The Middleby Q3 Adj. EPS $1.72 Beats $1.63 Estimate, Sales $724.014M Miss $760.91M Estimate",2019-11-06 09:08:00-05:00,MIDD,negative
826039.0,"Earnings Scheduled For November 6, 2019",2019-11-06 04:13:00-05:00,MIDD,neutral
826040.0,10 Biggest Price Target Changes For Wednesday,2019-08-14 09:11:00-04:00,MIDD,neutral
826041.0,"Citigroup Maintains Neutral on The Middleby, Lowers Price Target to $125",2019-08-14 07:49:00-04:00,MIDD,negative
826042.0,"The Middleby Q2 EPS $1.7 Misses $1.76 Estimate, Sales $761.004M Miss $767.45M Estimate",2019-08-07 08:20:00-04:00,MIDD,negative
826043.0,"The Middleby Q2 EPS $1.7 Misses $1.76 Estimate, Sales $761M Miss $767.45M Estimate",2019-08-07 07:20:00-04:00,MIDD,negative
826044.0,"Earnings Scheduled For August 7, 2019",2019-08-07 04:43:00-04:00,MIDD,neutral
826045.0,24 Industrials Stocks Moving In Thursday's After-Market Session,2019-08-02 04:33:00-04:00,MIDD,neutral
826046.0,"TriFin Advisors Releases Short Report On Middleby Corporation, Sets $86 Price Target",2019-07-30 09:50:00-04:00,MIDD,neutral
826047.0,Middleby Announces Acquires Packaging Progressions; Terms Not Disclosed,2019-07-16 08:26:00-04:00,MIDD,neutral
826048.0,"Middleby to Acquire Ss Brewtech, Terms Not Disclosed",2019-06-17 08:00:00-04:00,MIDD,neutral
826049.0,"The Middleby Earlier Reported Q1 EPS $1.38 Up From $1.2 YoY, Sales $686.802M Up From $584.8M YoY",2019-05-08 09:40:00-04:00,MIDD,neutral
826050.0,"Earnings Scheduled For May 8, 2019",2019-05-08 04:39:00-04:00,MIDD,neutral
826051.0,"CL King Upgrades The Middleby to Strong Buy, Announces $160 Target",2019-04-03 07:47:00-04:00,MIDD,positive
826052.0,Middleby Acquires Powerhouse Dynamics; Financial Terms Not Disclosed,2019-04-02 05:49:00-04:00,MIDD,positive
826053.0,84 Biggest Movers From Yesterday,2019-02-28 05:10:00-05:00,MIDD,neutral
826054.0,"Middleby Reports Purchase Of Standex Cooking Solutions Group, No Terms Disclosed",2019-02-27 17:18:00-05:00,MIDD,negative
826055.0,72 Stocks Moving In Wednesday's Mid-Day Session,2019-02-27 12:20:00-05:00,MIDD,neutral
826056.0,Middleby shares are trading higher after the company reported better than expected Q4 EPS and revenue results.,2019-02-27 09:43:00-05:00,MIDD,positive
826057.0,"The Middleby Q4 Adj. EPS $1.79 Beats $1.65 Estimate, Sales $756.672M Beat $737.6M Estimate",2019-02-27 07:07:00-05:00,MIDD,neutral
826058.0,"Earnings Scheduled For February 27, 2019",2019-02-27 04:03:00-05:00,MIDD,neutral
826059.0,71 Biggest Movers From Yesterday,2019-02-20 04:49:00-05:00,MIDD,neutral
826060.0,54 Stocks Moving In Tuesday's Mid-Day Session,2019-02-19 13:01:00-05:00,MIDD,neutral
826061.0,The Middleby Corporation Names Timothy Fitzgerald CEO,2019-02-19 07:32:00-05:00,MIDD,neutral
826062.0,"Baird Upgrades The Middleby to Outperform, Announces $142 Price Target",2019-01-22 07:06:00-05:00,MIDD,neutral
826063.0,Middleby Acquires EVO America; Terms Not Disclosed,2019-01-01 09:39:00-05:00,MIDD,neutral
826064.0,"The Middleby Corporation Q3 EPS $1.56 Misses $1.57 Estimate, Sales $713.331M Miss $714.01M Estimate",2018-11-07 08:09:00-05:00,MIDD,negative
826065.0,"Earnings Scheduled For November 7, 2018",2018-11-07 03:51:00-05:00,MIDD,neutral
826066.0,"Middleby Acquires M-TEK, Financial Terms Not Disclosed",2018-10-01 18:00:00-04:00,MIDD,neutral
826067.0,10 Biggest Price Target Changes For Monday,2018-09-24 10:04:00-04:00,MIDD,neutral
826068.0,"Benzinga's Top Upgrades, Downgrades For September 24, 2018",2018-09-24 09:17:00-04:00,MIDD,positive
826069.0,"Buckingham Upgrades The Middleby to Buy, Raises Price Target to $174",2018-09-24 08:22:00-04:00,MIDD,neutral
826070.0,10 Biggest Price Target Changes For Friday,2018-09-14 09:44:00-04:00,MIDD,neutral
826071.0,"Citigroup Maintains Neutral on The Middleby, Raises Price Target to $130",2018-09-14 07:18:00-04:00,MIDD,neutral
826072.0,"Baird Maintains Neutral on The Middleby, Raises Price Target to $130",2018-08-09 09:52:00-04:00,MIDD,neutral
826073.0,85 Biggest Movers From Yesterday,2018-08-09 05:15:00-04:00,MIDD,neutral
826074.0,68 Stocks Moving In Wednesday's Mid-Day Session,2018-08-08 12:30:00-04:00,MIDD,neutral
826075.0,"The Middleby Q2 Adj. EPS $1.63 Beats $1.57 Estimate, Sales $668.128M Beat $645.89M Estimate",2018-08-08 07:04:00-04:00,MIDD,neutral
826076.0,"Earnings Scheduled For August 8, 2018",2018-08-08 06:03:00-04:00,MIDD,neutral
826077.0,"Citigroup Maintains Neutral on The Middleby, Lowers Price Target to $116",2018-06-08 08:06:00-04:00,MIDD,negative
826078.0,"Benzinga's Top Upgrades, Downgrades For May 24, 2018",2018-05-24 09:40:00-04:00,MIDD,positive
826079.0,"Buckingham Initiates Coverage On The Middleby with Neutral Rating, Announces $115 Price Target",2018-05-24 08:15:00-04:00,MIDD,neutral
826080.0,Can Middleby's Stock Rebound On Business Buyouts?,2018-05-21 13:30:00-04:00,MIDD,neutral
826081.0,The Middleby Corporation To Acquire Taylor Company From United Technologies For $1B,2018-05-18 16:40:00-04:00,MIDD,positive
826082.0,"Benzinga's Top Upgrades, Downgrades For May 10, 2018",2018-05-10 09:17:00-04:00,MIDD,positive
826083.0,Baird Downgrades The Middleby to Neutral,2018-05-10 07:45:00-04:00,MIDD,neutral
826084.0,54 Biggest Movers From Yesterday,2018-05-10 05:16:00-04:00,MIDD,neutral
826085.0,48 Stocks Moving In Wednesday's Mid-Day Session,2018-05-09 12:56:00-04:00,MIDD,neutral
826086.0,"Middleby Shares Near Session Lows, Down 22%, Following Q1 Earnings, Sales Miss; Traders Circulating Word A Newsletter Is Suggesting Stock As A Long Play",2018-05-09 12:44:00-04:00,MIDD,positive
826087.0,"The Middleby Q1 EPS $1.20 Misses $1.40 Estimate, Sales $584.8M Miss $597.59M Estimate",2018-05-09 07:05:00-04:00,MIDD,negative
826088.0,"Earnings Scheduled For May 9, 2018",2018-05-09 04:05:00-04:00,MIDD,neutral
826089.0,"The Middleby Corp. Reports Purchase Of Josper S.A., No Terms Disclosed",2018-04-20 08:45:00-04:00,MIDD,negative
826090.0,"The Middleby Corp. Reports Purchase Of JoeTap, No Terms Disclosed",2018-04-16 08:00:00-04:00,MIDD,negative
826091.0,"Middleby Acquires Firex Srl, Terms Not Disclosed",2018-04-03 08:04:00-04:00,MIDD,neutral
826092.0,Middleby Acquires Ve.Ma.C. Srl; Terms Not Disclosed,2018-03-26 19:42:00-04:00,MIDD,neutral
826093.0,12 Stocks At Risk Of Rising Steel Costs,2018-03-05 16:19:00-05:00,MIDD,negative
826094.0,"Middleby Corporation Late Tues. Reported Q4 EPS $1.35 vs $1.50 Est., Sales $632.86M vs $645.56M  Est.",2018-02-28 07:48:00-05:00,MIDD,neutral
826095.0,"Earnings Scheduled For February 28, 2018",2018-02-28 04:20:00-05:00,MIDD,neutral
826096.0,"Citigroup Maintains Neutral on The Middleby, Raises Price Target to $150.00",2018-01-30 10:49:00-05:00,MIDD,neutral
826097.0,"The Middleby Corp. Reports Scanico A/S, No Terms Disclosed",2017-12-07 18:00:00-05:00,MIDD,negative
826098.0,"BMO Capital Maintains Outperform on The Middleby, Lowers Price Target to $145.00",2017-11-09 09:47:00-05:00,MIDD,negative
826099.0,32 Stocks Moving In Wednesday's Pre-Market Session,2017-11-08 08:08:00-05:00,MIDD,neutral
826100.0,The Middleby Corporation Acquires Globe Food Equipment Company; Terms Not Disclosed,2017-10-18 04:30:00-04:00,MIDD,neutral
826101.0,KeyBanc Downgrades The Middleby to Sector Weight,2017-10-16 06:44:00-04:00,MIDD,neutral
826102.0,The Middleby Corporation Acquires QualServ Solutions; Terms Not Disclosed,2017-09-01 04:05:00-04:00,MIDD,positive
826103.0,22 Stocks Moving In Tuesday's Pre-Market Session,2017-08-01 08:04:00-04:00,MIDD,neutral
826104.0,Middleby Shares Spike Toward Session Highs Over Last Few Mins As Hearing Wellington Shields Upgraded,2017-07-11 11:37:00-04:00,MIDD,positive
826105.0,"5 Stocks To Watch For July 3, 2017",2017-07-03 05:31:00-04:00,MIDD,neutral
826106.0,The Middleby Corporation Acquires Burford Corporation; Terms Not Disclosed,2017-05-02 04:24:00-04:00,MIDD,neutral
826107.0,"What Success Is Made Of: Investors, Execs And Entrepreneurs Talk About Their Routines And Role Models - Part 2",2017-04-16 16:33:00-04:00,MIDD,positive
826108.0,"What Success Is Made Of: Investors, Execs And Entrepreneurs Talk Routines And Role Models",2017-04-10 15:33:00-04:00,MIDD,positive
826109.0,"KeyBanc Initiates Coverage On The Middleby at Overweight, Announces $157.00 Target",2017-02-13 16:18:00-05:00,MIDD,negative
826110.0,"10 Stocks That Rallied Four Days, Then Sold Off On Friday",2016-11-21 12:08:00-05:00,MIDD,neutral
826111.0,8 Stocks That Rallied Three Days On Increasing Volume,2016-11-18 05:18:00-05:00,MIDD,neutral
826112.0,8 Stocks That Rallied Three Days On Increasing Volume,2016-11-17 05:46:00-05:00,MIDD,neutral
826113.0,10 Stocks That Rallied Three Days On No News,2016-11-04 06:23:00-04:00,MIDD,negative
826114.0,Deutsche Bank Initiates Coverage On 17 U.S. Machinery Stocks,2016-09-07 15:43:00-04:00,MIDD,neutral
826115.0,"Deutsche Bank Initiates Coverage on The Middleby at Hold, Announces $123.00 PT",2016-09-07 06:28:00-04:00,MIDD,neutral
826116.0,"Earnings Scheduled For August 10, 2016",2016-08-10 04:55:00-04:00,MIDD,neutral
826117.0,Middleby Shares Selling Off to Low; Traders Attributing to Short Piece from Grants,2016-06-16 10:31:00-04:00,MIDD,positive
826118.0,Middleby Corporation To Buy Follett Corporation For Undisclosed Terms,2016-05-18 08:05:00-04:00,MIDD,neutral
826119.0,"The MIddleby Corp. Announces Purchase of Follett Corp., No Terms Disclosed",2016-05-18 07:03:00-04:00,MIDD,negative
826120.0,"Earnings Scheduled For May 11, 2016",2016-05-11 04:56:00-04:00,MIDD,neutral
826121.0,"Baird Maintains Outperform on The Middleby, Lowers PT to $116.00",2016-03-03 08:54:00-05:00,MIDD,negative
826122.0,Macquarie Upgrades The Middleby to Outperform,2016-01-13 07:34:00-05:00,MIDD,neutral
826123.0,Middleby Acquires Lynx Grills; Terms Not Disclosed,2015-12-15 19:00:00-05:00,MIDD,neutral
826124.0,Benzinga's Top Upgrades,2015-11-18 08:46:00-05:00,MIDD,positive
826125.0,BMO Capital Upgrades The Middleby to Outperform,2015-11-18 07:12:00-05:00,MIDD,neutral
826126.0,"Middleby Corp Reports Q2 EPS $0.95 Vs Est $1.00, Sales $436.3M Vs Est $466.13M",2015-08-12 16:32:00-04:00,MIDD,neutral
826127.0,The Middleby Corp. Announces Purchase of AGA Rangemaster Group for $200M,2015-07-15 08:01:00-04:00,MIDD,neutral
826128.0,The Middleby Corp. Issues Response to M&A Speculation: Says Discussions with AGA Rangemaster Group 'At a Very Early Stage...Can Be No Certainty Any Formal Offer Will Be Made',2015-06-17 09:53:00-04:00,MIDD,negative
826129.0,Top 4 NASDAQ Stocks In The Diversified Machinery Industry With The Lowest PEG Ratio,2015-05-26 04:10:00-04:00,MIDD,negative
826130.0,"Middleby Q1 EPS $0.67 vs $0.71 est, Revenue $406.6M vs $413.8M est",2015-05-13 18:02:00-04:00,MIDD,neutral
826131.0,"Earnings Scheduled For May 13, 2015",2015-05-13 04:14:00-04:00,MIDD,neutral
826132.0,"Macquarie Initiates Coverage on The Middleby at Neutral, Announces $115.00 PT",2015-03-19 05:27:00-04:00,MIDD,neutral
826133.0,Middleby Reports Q4 EPS $0.91 vs $0.99 Est; Revenue $435M vs $432.5M Est,2015-03-03 19:16:00-05:00,MIDD,neutral
826134.0,Middleby Acquires Marel; No Terms Disclosed,2015-02-23 09:05:00-05:00,MIDD,negative
826135.0,The Middleby Corporation Acquires Marsal & Sons,2015-02-10 20:02:00-05:00,MIDD,neutral
826136.0,Middleby to Acquire Desmon Food Service Equipment Company,2014-12-22 08:01:00-05:00,MIDD,neutral
826137.0,"Cramer Shares His Thoughts On Middleby, Liberty Media",2014-11-06 08:41:00-05:00,MIDD,positive
826138.0,The Middleby Corporation Reports Q3 EPS of $1.05 vs $0.86 Est; Revenue of $404.30M vs $411.42M Est,2014-11-05 19:01:00-05:00,MIDD,neutral
826139.0,"Earnings Scheduled For November 5, 2014",2014-11-05 05:05:00-05:00,MIDD,neutral
826140.0,Top 4 NASDAQ Stocks In The Diversified Machinery Industry With The Highest ROE,2014-10-20 05:09:00-04:00,MIDD,positive
826141.0,"The Middleby Corp. Announces Purchase of U-Line Corp., No Terms Disclosed",2014-10-14 09:15:00-04:00,MIDD,negative
826142.0,"The Middleby Corp. Announces Purchase of Concordia Coffee Co., No Terms Disclosed",2014-09-08 18:01:00-04:00,MIDD,negative
826143.0,Top 4 NASDAQ Stocks In The Diversified Machinery Industry With The Highest ROE,2014-09-02 04:53:00-04:00,MIDD,positive
826144.0,Morning Market Movers ,2014-08-07 09:44:00-04:00,MIDD,neutral
826145.0,The Middleby Corporation Reports Q2 EPS of $0.85 vs $0.75 Est; Revenue of $424.80M vs $407.98M Est,2014-08-06 18:44:00-04:00,MIDD,neutral
826146.0,Middleby Declares 3-for-1 Stock Split,2014-05-30 17:22:00-04:00,MIDD,neutral
826147.0,"BB&T Capital Upgrades The Middleby Corporation to Buy, Announces $260.00 PT",2014-05-15 07:39:00-04:00,MIDD,neutral
826148.0,"Earnings Scheduled For May 7, 2014",2014-05-07 05:15:00-04:00,MIDD,neutral
826149.0,The Middleby Corporation Acquires Assets of Processing Equipment Solutions; Terms Not Disclosed,2014-04-03 19:24:00-04:00,MIDD,positive
826150.0,Stocks Hitting 52-Week Highs,2014-02-26 10:17:00-05:00,MIDD,neutral
826151.0,"Earnings Scheduled For February 25, 2014",2014-02-25 04:28:00-05:00,MIDD,neutral
826152.0,Top 4 NASDAQ Stocks In The Diversified Machinery Industry With The Highest Profit Margin,2014-01-21 04:11:00-05:00,MIDD,positive
826153.0,Middleby Corporation Acquires Market Forge Industries,2014-01-07 19:32:00-05:00,MIDD,neutral
826154.0,Stocks Hitting 52-Week Highs,2014-01-03 10:24:00-05:00,MIDD,neutral
826155.0,"US Stock Futures Slightly Lower Ahead of Jobless Claims, Existing-Home Sales Data",2013-12-19 07:05:00-05:00,MIDD,negative
826156.0,The Middleby Corporation Acquires Automatic Bar Controls,2013-12-19 05:50:00-05:00,MIDD,neutral
826157.0,"BWS Financial Initiates Coverage on The Middleby Corporation at Sell, Announces $160.00 PT",2013-11-15 10:34:00-05:00,MIDD,neutral
826158.0,Stocks Hitting 52-Week Highs,2013-11-06 10:29:00-05:00,MIDD,neutral
826159.0,The Middleby Corporation Reports Q3 EPS of $2.18 vs $1.97 Est; Revenue of $360.0M vs $348.65M Est,2013-11-05 18:37:00-05:00,MIDD,neutral
826160.0,"Earnings Scheduled For November 5, 2013",2013-11-05 04:29:00-05:00,MIDD,neutral
826161.0,Top 4 NASDAQ Stocks In The Diversified Machinery Industry With The Highest Operating Margin,2013-10-22 04:28:00-04:00,MIDD,positive
826162.0,The Middleby Corporation Reports Q2 EPS of $2.00 vs $1.78 Est; Revenue of $363.80M vs $340.92M Est,2013-08-08 16:22:00-04:00,MIDD,neutral
826163.0,"Earnings Scheduled For August 8, 2013",2013-08-08 04:27:00-04:00,MIDD,neutral
826164.0,"Stocks to Watch for June 19, 2013",2013-06-19 09:08:00-04:00,MIDD,neutral
826165.0,Top 4 NASDAQ Stocks In The Diversified Machinery Industry With The Highest Operating Margin,2013-05-02 04:12:00-04:00,MIDD,positive
826166.0,"Wellington Shields Upgrades The Middleby Corporation to Buy, Raises PT to $225.00",2013-02-28 08:27:00-05:00,MIDD,neutral
826167.0,"Earnings Scheduled For February 26, 2013",2013-02-26 04:24:00-05:00,MIDD,neutral
826168.0,"Wellington Downgrades The Middleby Corporation to Gradually Accumulate, Maintains $178.00 PT",2013-02-12 13:23:00-05:00,MIDD,neutral
826169.0,Middleby Corporation Acquires Spooner Vicars Bakery Systems ,2013-01-23 22:22:00-05:00,MIDD,neutral
826170.0,Benzinga's Top Upgrades,2013-01-23 07:22:00-05:00,MIDD,positive
826171.0,US Stock Futures Higher On Fiscal-Cliff Deal,2013-01-02 07:13:00-05:00,MIDD,neutral
826172.0,"Stocks To Watch For January 2, 2013",2013-01-02 01:44:00-05:00,MIDD,neutral
826173.0,"Benzinga's M&A Chatter for Monday December 31, 2012",2013-01-01 12:27:00-05:00,MIDD,neutral
826174.0,Middleby Acquires Viking Range for $380M in Cash,2012-12-31 17:33:00-05:00,MIDD,neutral
826175.0,"BMO Capital Markets Maintains Middleby at Market Perform, Raises PT from $105 to $120",2012-11-08 07:48:00-05:00,MIDD,neutral
826176.0,Middleby Reports Q3 EPS $1.60 vs $1.53 Est; Revenues $257.7M vs $255.92M Est,2012-11-06 18:05:00-05:00,MIDD,neutral
826177.0,"Earnings Scheduled For November 6, 2012",2012-11-06 03:09:00-05:00,MIDD,neutral
826178.0,Top 4 Mid-Cap Stocks In The Diversified Machinery Industry With The Highest Profit Margin,2012-08-28 00:05:00-04:00,MIDD,positive
826179.0,Robert W. Baird Downgrades Middleby from Outperform to Neutral,2012-08-10 09:55:00-04:00,MIDD,neutral
826180.0,"Earnings Scheduled For August 8, 2012",2012-08-08 04:09:00-04:00,MIDD,neutral
826181.0,"BMO Capital Markets Initiates Coverage on Middleby at Market Perform, Announces PT of $95",2012-07-27 09:32:00-04:00,MIDD,neutral
826182.0,Top 4 Small-Cap Stocks In The Diversified Machinery Industry With The Highest EPS,2012-06-04 03:34:00-04:00,MIDD,positive
826183.0,"Middleby Report Q1 EPS $1.20 May Not Compare to $1.17 Est, Sales $228.8M vs $218.12M Est",2012-05-10 16:39:00-04:00,MIDD,neutral
826184.0,Middleby Reports Acquisition of Turkington USA; Terms Not Disclosed,2012-03-13 17:29:00-04:00,MIDD,neutral
826185.0,Middleby Reported Yesterday Q2 EPS $1.06 vs $1.10 Est; Revenues $210.9M vs $199.62M Est			,2011-08-11 06:49:00-04:00,MIDD,neutral
826186.0,Earnings Scheduled For August 10,2011-08-10 04:02:00-04:00,MIDD,neutral
826187.0,The Middleby Corporation Announces Acquisition of Mauer-Atmos,2011-07-08 10:32:00-04:00,MIDD,neutral
826188.0,The Middleby Corporation Acquires Danfotech   ,2011-07-06 11:48:00-04:00,MIDD,neutral
826189.0,Earnings Preview for Middleby (MIDD),2011-05-10 09:28:00-04:00,MIDD,neutral
826190.0,Lincat Group shares surge on takeover offer from Middleby,2011-03-23 05:39:00-04:00,MIDD,positive
826191.0,"Benzinga's Volume Movers (PEET, SLRC, RUSHA, MIDD)",2011-03-02 10:15:00-05:00,MIDD,neutral
826192.0,Middleby Reports Q4 EPS of $1.13,2011-03-02 07:55:00-05:00,MIDD,neutral
826193.0,"Top 4 Small-Cap Stocks In The Diversified Machinery Industry With The Highest EPS Estimates (MIDD, MKSI, TWIN, GLPW)",2011-02-25 04:21:00-05:00,MIDD,positive
826194.0,"Middleby Tops Estimates, Shares Hit New High (MIDD)",2010-11-09 10:46:00-05:00,MIDD,positive
826195.0,"Middleby Goes Parabolic (MIDD, MCD, YUM)",2010-10-21 18:25:00-04:00,MIDD,neutral
826196.0,"RBC Capital Reiterates Ratings On AME, MIDD, OIS, GPC, GDI, FTR, FHN, AGN",2010-10-18 09:37:00-04:00,MIDD,neutral
826197.0,Middleby Beats The Street (MIDD),2010-08-12 10:20:00-04:00,MIDD,neutral
826198.0,"Benzinga’s Volume Movers (MEND, BIIB, GENZ, MIDD)",2010-07-02 14:22:00-04:00,MIDD,neutral
826199.0,FTSE 250 (MIDD) Defending 910 support,2010-06-09 05:23:00-04:00,MIDD,positive
826200.0,Middleby (MIDD) Consistent In Performance,2010-05-14 15:13:00-04:00,MIDD,neutral
826201.0,Middleby Falls On Earnings Miss (MIDD),2010-05-13 14:10:00-04:00,MIDD,negative
826202.0,"Top 5 Small-Cap NASDAQ Stocks In The Industrial Goods Sector With The Highest Return On Equity (RINO, SWHC, AAON, MIDD, MTRX)",2010-05-10 06:44:00-04:00,MIDD,positive
826203.0,Latest Zignals Trading Strategy Signals,2010-04-30 07:13:00-04:00,MIDD,neutral
826204.0,Latest Zignals Trading Strategy Signals,2010-04-27 08:12:00-04:00,MIDD,neutral
826205.0,"A Few Stocks That Hit New 52-Week Highs (MIDD, ANN, ROK, FISV, HON)",2010-04-23 18:36:00-04:00,MIDD,neutral
826206.0,Latest Zignals Trading Strategies Signals,2010-04-21 07:54:00-04:00,MIDD,neutral
826207.0,Zignals Trading Strategies That Work; Buyers Go Into Hiding,2010-03-26 07:14:00-04:00,MIDD,negative
826208.0,Zignals Trading Strategies That Work; Rally with Rally on Top,2010-03-24 07:21:00-04:00,MIDD,positive
826209.0,"Benzinga’s Volume Movers (TIVO, ZUMZ, PETM, SXCI, MIDD)",2010-03-04 14:00:00-05:00,MIDD,neutral
826210.0,Middleby Surpasses Estimates (MIDD),2010-03-04 00:16:00-05:00,MIDD,neutral
