Unnamed: 0,title,date,stock,sentiment
832166.0,UPDATE: Goldman Sachs Downgrades Motorola Mobility to Neutral,2011-08-16 08:15:00-04:00,MMI,neutral
832167.0,"News Summary for August 16, 2011",2011-08-16 07:44:00-04:00,MMI,neutral
832168.0,UPDATE: Jefferies Raising Price Target On Motorola Mobility,2011-08-16 07:43:00-04:00,MMI,neutral
832169.0,Benzinga's Top Downgrades,2011-08-16 07:43:00-04:00,MMI,positive
832170.0,Morgan Stanley Comments On Motorola Mobility Acquisition By Google,2011-08-16 07:36:00-04:00,MMI,neutral
832171.0,Bank of America Reiterates View on Google,2011-08-16 06:56:00-04:00,MMI,neutral
832172.0,Goldman Sachs Downgrades Motorola Mobility To Neutral ,2011-08-16 06:32:00-04:00,MMI,neutral
832173.0,Jefferies Raises PT On Motorola Mobility Holdings To $40,2011-08-16 06:24:00-04:00,MMI,neutral
832174.0,Right Back Where We Started  08-15-2011,2011-08-15 19:20:00-04:00,MMI,neutral
832175.0,Sterne Agee's Wu Talks Deals in a Post Google/Motorola World,2011-08-15 16:51:00-04:00,MMI,neutral
832176.0,A Potential Play for Those Who Missed the Motorola Deal,2011-08-15 16:00:00-04:00,MMI,positive
832177.0,Three Cloud Computing Stocks That Could Be Takeover Candidates,2011-08-15 15:58:00-04:00,MMI,neutral
832178.0,Microsoft Also Was In Talks to Buy Motorola Mobility Holdings - GigaOM,2011-08-15 15:42:00-04:00,MMI,neutral
832179.0,It's beginning to look a lot like December  08-15-2011,2011-08-15 15:25:00-04:00,MMI,positive
832180.0,Carl Icahn Says Jha Gets a Lot of Credit for Google Deal - Bloomberg,2011-08-15 15:17:00-04:00,MMI,positive
832181.0,VirnetX Holding Soaring 14% On Patent Potential,2011-08-15 15:08:00-04:00,MMI,neutral
832182.0,Google-Motorola Puts Microsoft on Call ,2011-08-15 14:08:00-04:00,MMI,neutral
832183.0,How Much Did You Make Today? Not $600 Million I Bet,2011-08-15 13:09:00-04:00,MMI,neutral
832184.0,Search Engine Trends: Google (GOOG) Is Unbeatable,2011-08-15 12:25:00-04:00,MMI,neutral
832185.0,Monday's Mid-Day Options Volume Leaders,2011-08-15 12:25:00-04:00,MMI,neutral
832186.0,"Rodman & Renshaw Discusses Google, Motorola Mobility Deal",2011-08-15 12:10:00-04:00,MMI,neutral
832187.0,Top Narrow Based Indexes For August 15,2011-08-15 10:35:00-04:00,MMI,positive
832188.0,Stocks Hitting 52-Week Highs,2011-08-15 10:18:00-04:00,MMI,neutral
832189.0,"Early Market Strength, Here Is Why",2011-08-15 10:11:00-04:00,MMI,positive
832190.0,Top Performing Industries For August 15,2011-08-15 10:09:00-04:00,MMI,positive
832191.0,"After Motorola Deal, Google WIll be Largest Supplier of Cable TV Boxes",2011-08-15 10:08:00-04:00,MMI,neutral
832192.0,Morning Market Movers,2011-08-15 09:52:00-04:00,MMI,neutral
832193.0,Patent Wars: Attack Of The Clones ,2011-08-15 09:51:00-04:00,MMI,negative
832194.0,Piper Jaffray Comments On Google's Acquisition Of Motorola Mobility,2011-08-15 09:30:00-04:00,MMI,neutral
832195.0,UPDATE: Google Says Protecting Android is Pro-Competitive by Definition ,2011-08-15 08:57:00-04:00,MMI,neutral
832196.0,UPDATE: Google Confident in Regulatory Approval ,2011-08-15 08:57:00-04:00,MMI,positive
832197.0,"Gabelli Discusses Google, Motorola Mobility Merger",2011-08-15 08:56:00-04:00,MMI,neutral
832198.0,UPDATE: Google Says There Will be No Change in Operation of Android,2011-08-15 08:53:00-04:00,MMI,negative
832199.0," Google CFO: Significant Deal But Still ""Plenty"" Of Financial Flexibility",2011-08-15 08:52:00-04:00,MMI,positive
832200.0,Google Will Pay $2.5B Reverse Breakup Fee if Deal Falls Through -WSJ,2011-08-15 08:50:00-04:00,MMI,negative
832201.0,Carl Icahn Comments on Merger of Motorola Mobility and Google  ,2011-08-15 08:47:00-04:00,MMI,neutral
832202.0,"Google CFO: Motorola Mobility Deal To Be ""Mildly Accretive"" To Non-GAAP EPS",2011-08-15 08:46:00-04:00,MMI,neutral
832203.0,UPDATE: Google Says Deal Does Not Affect Google's Core Business or Profit,2011-08-15 08:44:00-04:00,MMI,positive
832204.0,"Google CEO: Motorola Mobility Has Exciting Roadmap, Poised For Growth",2011-08-15 08:42:00-04:00,MMI,positive
832205.0,Benzinga's Top Pre-Market Losers,2011-08-15 08:38:00-04:00,MMI,negative
832206.0,Benzinga's Top Pre-Market Gainers,2011-08-15 08:32:00-04:00,MMI,positive
832207.0,Benchmark Comments On Google's Acquisition of Motorola Mobility,2011-08-15 08:26:00-04:00,MMI,neutral
832208.0,A Peek Into The Market Before The Trading Starts,2011-08-15 08:17:00-04:00,MMI,neutral
832209.0,"Icahn Says Google's Motorola Mobility Purchase Was a ""Great Outcome""",2011-08-15 08:10:00-04:00,MMI,positive
832210.0,Motorola Mobility Shares Jump 60% In Pre-Market On Acquisition News,2011-08-15 08:04:00-04:00,MMI,positive
832211.0,Google to Supercharge Android with Motorola Acquisition,2011-08-15 07:54:00-04:00,MMI,neutral
832212.0,Pre-Market Gainers; Motorola Mobility up 60% on the M&A News,2011-08-15 07:48:00-04:00,MMI,neutral
832213.0,Pre-Market Losers,2011-08-15 07:47:00-04:00,MMI,negative
832214.0,"News Summary for August 15, 2011",2011-08-15 07:46:00-04:00,MMI,neutral
832215.0,"Apple Moves Lower in Pre-Market; Now Trading Almost Flat After Google, Motorola Deal Announced",2011-08-15 07:41:00-04:00,MMI,negative
832216.0,Google Trades Down Almost 3% in Pre-Market After Announcing Purchase of Motorola Mobility ,2011-08-15 07:36:00-04:00,MMI,neutral
832217.0,Google: Will Run Motorola Mobility As A Separate Business,2011-08-15 07:32:00-04:00,MMI,neutral
832218.0,Google to Acquire Motorola Mobility for $40 per Share,2011-08-15 07:30:00-04:00,MMI,positive
832219.0,"5 Trade Ideas for Friday, Aug 12",2011-08-11 17:38:00-04:00,MMI,neutral
832220.0,Motorola Mobility Holdings Spiking Higher on Takeover Rumors,2011-08-10 12:27:00-04:00,MMI,neutral
832221.0,Apple Suing Motorola over Xoom,2011-08-10 11:44:00-04:00,MMI,negative
832222.0,Potential InterDigital Buyout by Samsung,2011-08-08 07:48:00-04:00,MMI,neutral
832223.0,"Motorola Developing New Tablet, Does Anybody Care?",2011-08-05 15:24:00-04:00,MMI,positive
832224.0,Financials and Technology Stocks Lead Market Decline in Early Trading,2011-08-05 11:44:00-04:00,MMI,neutral
832225.0,comScore Reports Reports June Mobile Subscriber Market Share; 2 out of 5 Smartphone Subscribers Use Android ,2011-08-04 14:01:00-04:00,MMI,positive
832226.0,"Motorola Mobility Delivers a Sleek, Slim, and Budget Friendly Smartphone Experience with Motorola XT531",2011-08-04 13:12:00-04:00,MMI,positive
832227.0,Hearing Motorola Mobility Spike Attributed to New Budget-Friendly Phone,2011-08-04 13:11:00-04:00,MMI,neutral
832228.0,Motorola Mobility Spiking Higher on Heavy Volume,2011-08-04 13:07:00-04:00,MMI,neutral
832229.0,Technology and Telecomm Sectors Fueling Afternoon Rally,2011-08-03 14:25:00-04:00,MMI,neutral
832230.0,Tech Stock; Dramatic Growth Expected in Consumer Electronics Industry,2011-08-02 10:46:00-04:00,MMI,positive
832231.0,Pre-Market Losers,2011-07-29 09:28:00-04:00,MMI,negative
832232.0,UPDATE: Rodman & Renshaw Lowers PT on Motorola Mobility Holdings to $30,2011-07-29 09:12:00-04:00,MMI,negative
832233.0,Wells Fargo Downgrading Motorola Mobility,2011-07-29 08:57:00-04:00,MMI,positive
832234.0,Wells Fargo Downgrades Motorola Mobility To Market Perform,2011-07-29 08:33:00-04:00,MMI,positive
832235.0,"Carl Ichan ""Destroyed Both Yahoo and Motorola""",2011-07-28 18:01:00-04:00,MMI,negative
832236.0,Motorola Mobility Guides Q3 EPS $0.00-0.10 vs $0.24 Est,2011-07-28 16:05:00-04:00,MMI,neutral
832237.0,Motorola Mobility Reports Q2 EPS $0.09 vs $0.06 Est; Revenues $3.3B vs $3.12B Est,2011-07-28 16:03:00-04:00,MMI,neutral
832238.0,Earnings Scheduled For July 28,2011-07-28 05:02:00-04:00,MMI,neutral
832239.0,Motorola Mobility up Nearly 16% on Heavy Volume,2011-07-21 14:43:00-04:00,MMI,neutral
832240.0,Carl Icahn Urges Motorola Mobility to Explore Options,2011-07-21 12:50:00-04:00,MMI,neutral
832241.0,Motorola Mobility's Strength Attributed to Positive Analyst Comments,2011-07-21 11:26:00-04:00,MMI,positive
832242.0,IBM: King of the Old-School Tech Giants,2011-07-19 11:53:00-04:00,MMI,neutral
832243.0,Jefferies Previews Q2 Results for Motorola Mobility Holdings,2011-07-19 09:28:00-04:00,MMI,neutral
832244.0,"Stock Trade Ideas for Tuesday, July 19",2011-07-18 18:29:00-04:00,MMI,neutral
832245.0,"QUALCOMM Incorporated Earnings Preview: Analyts Expect Higher Earnings, Revenue from Prior Quarter",2011-07-15 09:49:00-04:00,MMI,neutral
832246.0,Mad Money Lightning Round: Cramer Likes Imax,2011-07-15 03:54:00-04:00,MMI,negative
832247.0,Stocks to Watch for Tuesday 07/12/11: Fresh 52 Week Highs and Lows,2011-07-11 17:09:00-04:00,MMI,positive
832248.0,"As Contract Idles, Aeroflex Shares Fall",2011-07-11 11:09:00-04:00,MMI,positive
832249.0,Citi Maintains Hold On Motorola Mobility Holdings,2011-07-11 07:48:00-04:00,MMI,neutral
832250.0,Stocks to Watch for Monday 07/11/11: Fresh 52 Week Highs and Lows,2011-07-10 18:15:00-04:00,MMI,positive
832251.0,Hottest and Coldest Sectors for Friday 7/8/11,2011-07-08 17:24:00-04:00,MMI,neutral
832252.0,Motorola Mobility Hits New 52 Week Low Of 21.59,2011-07-08 13:13:00-04:00,MMI,negative
832253.0,Momentum Stocks For Next Week,2011-07-02 17:26:00-04:00,MMI,neutral
832254.0,Apple Set To Dramatically Boost iPad 2 Shipments In Quarter,2011-06-30 11:39:00-04:00,MMI,positive
832255.0,Stocks to Watch for 6/29/11: Fresh 52 Week Highs and Lows,2011-06-29 04:11:00-04:00,MMI,positive
832256.0,"Options Brief: Motorola Mobility Holdings, Inc.",2011-06-27 12:04:00-04:00,MMI,neutral
832257.0,Friday Stock Watchlist: 5 Technical Setups to Watch,2011-06-24 06:15:00-04:00,MMI,neutral
832258.0,Options Brief: Motorola Mobility Holdings,2011-06-22 10:35:00-04:00,MMI,neutral
832259.0,Motorola Mobility Down Over 3% on Credit Suisse Downgrade,2011-06-21 11:16:00-04:00,MMI,positive
832260.0,"Options Brief: Motorola Mobility Holdings, Inc.",2011-06-21 10:19:00-04:00,MMI,neutral
832261.0,Benzinga's Top Downgrades,2011-06-21 08:32:00-04:00,MMI,positive
832262.0,Credit Suisse Updates 6/21,2011-06-21 08:02:00-04:00,MMI,positive
832263.0,"Credit Suisse Downgrades Motorola Mobility Holdings To Underperform, $19 PT",2011-06-21 05:50:00-04:00,MMI,positive
832264.0,Some technical setups for next week,2011-06-18 16:54:00-04:00,MMI,neutral
832265.0,Motorola Announces New Smartphone in China,2011-06-17 10:33:00-04:00,MMI,neutral
832266.0,Motorola Mobility and Time Warner Cable Collaborate to Deliver an Advanced Video Gateway Platform,2011-06-14 15:16:00-04:00,MMI,positive
832267.0,Jefferies Raises PT To $27 On MMI,2011-06-14 07:28:00-04:00,MMI,neutral
832268.0,Jefferies Raises PT On Motorola Mobility Holdings To $27,2011-06-14 06:16:00-04:00,MMI,neutral
832269.0,Motorola Mobility Secures DTLA Approval for In-Home Content Streaming Technology ,2011-06-13 08:15:00-04:00,MMI,positive
832270.0,S&P 500's Technology Sector Update 6/9/2011,2011-06-09 12:41:00-04:00,MMI,neutral
832271.0,Sprint and Motorola Forge Renewed Business Relationship That Extends Device Innovation   ,2011-06-09 12:41:00-04:00,MMI,positive
832272.0,Weakest Technology Stocks Right Now,2011-06-08 13:08:00-04:00,MMI,negative
832273.0,Oppenheimer Maintains Perform on Motorola Mobility,2011-06-08 08:19:00-04:00,MMI,neutral
832274.0,"Stock Trade Ideas for Wednesday, June 08",2011-06-07 17:15:00-04:00,MMI,neutral
832275.0,comScore Reports April 2011 U.S. Mobile Subscriber Market Share ,2011-06-03 10:32:00-04:00,MMI,positive
832276.0,Some stock trading ideas for June 3rd,2011-06-02 16:31:00-04:00,MMI,neutral
832277.0,FBR Says Tablet Production Being Cut,2011-06-02 12:38:00-04:00,MMI,negative
832278.0,Nokia Looking To Kill The Symbian,2011-05-31 13:55:00-04:00,MMI,negative
832279.0,Verizon Announces New Motorola DROID X2 - Verizon's First Dual-Core Smartphone,2011-05-19 06:38:00-04:00,MMI,neutral
832280.0,DROID X2 by Motorola Coming to Verizon Wireless ,2011-05-18 08:35:00-04:00,MMI,neutral
832281.0,Why the President of Dell's Consumer Business is Unplugged from Reality: Tablets will Hurt the PC (DELL),2011-05-18 07:04:00-04:00,MMI,negative
832282.0,"Oppenheimer Reports on SanDisk and Motorola (SNDK, MMI)",2011-05-17 07:21:00-04:00,MMI,neutral
832283.0,4 Big Takeaways From NVIDIA's Q1 Results,2011-05-13 11:56:00-04:00,MMI,neutral
832284.0,4 Bubblelicious Chip Stocks for the Smartphone Boom,2011-05-11 12:44:00-04:00,MMI,neutral
832285.0,Motorola Mobility Acquires SunUp Digital Systems (MMI),2011-05-10 09:10:00-04:00,MMI,neutral
832286.0,Motorola Mobility Acquires SunUp Digital Systems; Terms not Disclosed ,2011-05-10 09:03:00-04:00,MMI,neutral
832287.0,comScore Reports March U.S. Mobile Subscriber Market Share ,2011-05-06 13:33:00-04:00,MMI,positive
832288.0,Few trade ideas for the week ahead,2011-04-30 03:17:00-04:00,MMI,neutral
832289.0,"Jeffries Maintains Hold Rating On Motorola Mobility Holdings, Cuts Price Target to $26",2011-04-29 08:24:00-04:00,MMI,negative
832290.0,Deutsche Bank Comments On Motorola Mobility Q1 Results,2011-04-29 07:55:00-04:00,MMI,neutral
832291.0,UPDATE: J.P. Morgan Raising Price Target On Motorola Mobility (MMI),2011-04-29 07:41:00-04:00,MMI,neutral
832292.0,Jefferies Lowers PT On Motorola Mobility Holdings To $26,2011-04-29 06:52:00-04:00,MMI,negative
832293.0,Deutsche Bank Lowers PT On Motorola Mobility To $25,2011-04-29 06:13:00-04:00,MMI,negative
832294.0,Motorola Mobility Reports EPS of $(0.08) vs. $(0.12) Estimate; Revenues $3B vs. $2.84B Estimate (MMI),2011-04-28 16:03:00-04:00,MMI,neutral
832295.0,"Earnings Scheduled For April 28 (MSFT, AET, VIA, XOM, CL, PEP, BMY, MMI, TWC, PG, DOW, S, TYC, CCE, SWY, HOT, EK, EXPE, D, VRSN, EMN)",2011-04-28 02:33:00-04:00,MMI,neutral
832296.0,Jefferies Previews 1Q Earnings for Telecom/Wireless Companies,2011-04-26 10:29:00-04:00,MMI,neutral
832297.0,"Motorola Mobility and NII Holdings Extend iDEN® Handset Supply Agreement (MMI, NIHD)",2011-04-21 09:05:00-04:00,MMI,positive
832298.0,"CEOWORLD Daily Business Roundup- IBM, INTC, AAPL, VMW, MMI, RIMM, NDAQ, AES, DPL, NRG, TM, S, GE…",2011-04-20 06:00:00-04:00,MMI,neutral
832299.0,Trading Ideas For The Week Ahead,2011-04-15 17:30:00-04:00,MMI,neutral
832300.0,More Questions than Answers in Wireless Sector ;  RIMM Recent Upgrade & Out-of-Consensus Preferred Play,2011-04-14 18:05:00-04:00,MMI,positive
832301.0,"Jefferies: Strength In Handset Suppliers Bodes Well For AAPL, MMI",2011-04-14 08:48:00-04:00,MMI,positive
832302.0,ETF Alchemy and Other Evils,2011-04-14 08:20:00-04:00,MMI,negative
832303.0,Four Stocks To Keep An Eye On,2011-04-13 18:27:00-04:00,MMI,neutral
832304.0,Read The Fine Print With The Spin-Off ETF,2011-04-08 15:53:00-04:00,MMI,positive
832305.0,Is Google Launching Chrome OS Tablets? (GOOG),2011-04-08 09:49:00-04:00,MMI,neutral
832306.0,"Hudson's U.S. Cellular Handset Survey (RIM, MMI, NOK)",2011-04-08 09:46:00-04:00,MMI,neutral
832307.0,It's Official: The Motorola Xoom Is A Flop (MMI),2011-04-06 08:46:00-04:00,MMI,negative
832308.0,A Peek Into The Market Before The Trading Starts,2011-03-23 07:25:00-04:00,MMI,neutral
832309.0,Motorola Mobility Announces Intent to Acquire Dreampark ,2011-03-23 06:36:00-04:00,MMI,neutral
832310.0,Motorola Mobility To Buy Dreampark,2011-03-23 05:49:00-04:00,MMI,neutral
832311.0,"Trading Barnes & Noble Amidst Microsoft Lawsuit (MSFT, BKS, MMI, BGP, AAPL, NOK, ORCL)",2011-03-22 08:03:00-04:00,MMI,positive
832312.0,"UBS Upgrades MMM To Buy, Raises Target To $34; NKE Target Reduced To $90",2011-03-18 11:47:00-04:00,MMI,neutral
832313.0,Options Brief: Motorola Mobility Holdings (MMI),2011-03-18 10:38:00-04:00,MMI,neutral
832314.0,UBS Ups MMI To Buy,2011-03-18 07:03:00-04:00,MMI,neutral
832315.0,"Fast Money Pops & Drops, March 17th (AKAM, NBL, UPS, DAL, MMI)",2011-03-17 21:00:00-04:00,MMI,neutral
832316.0,Stock Market alerts for Friday Mar 18,2011-03-17 17:02:00-04:00,MMI,neutral
832317.0,Nomura Ups MMI To Neutral,2011-03-17 05:58:00-04:00,MMI,neutral
832318.0,"Fast Money Pops & Drops, March 16th (IBM, RMBS, IHG, MMI, BTU)",2011-03-16 21:28:00-04:00,MMI,neutral
832319.0,Motorola Xoom WiFi available March 27,2011-03-16 13:23:00-04:00,MMI,neutral
832320.0,What's Hot on TheStreet,2011-03-15 13:17:00-04:00,MMI,neutral
832321.0,Oppenheimer Reduces MMI Target From $36 To $32,2011-03-15 08:05:00-04:00,MMI,neutral
832322.0,"Motorola Xoom Sales ""Awful"" (MMI)",2011-03-09 12:33:00-05:00,MMI,neutral
832323.0,"Who's In The Lead? (AAPL GOOG, RIMM)",2011-03-04 10:24:00-05:00,MMI,neutral
832324.0,"Hudson Securities Comments On MMI, NOK",2011-03-04 09:43:00-05:00,MMI,positive
832325.0,"Gene Munster: iPad 2 Is ""Evolutionary, Not Revolutionary""",2011-03-03 10:38:00-05:00,MMI,neutral
832326.0,Cowen Downs MMI To Neutral,2011-03-03 07:01:00-05:00,MMI,neutral
832327.0,"Fast Money Pops & Drops, March 2nd (JOYG, BUCY, MDR, TIVO, WFT, MMI, AAPL)",2011-03-02 19:23:00-05:00,MMI,neutral
832328.0,"Xoom off to ""Good Start"" (MMI)",2011-02-28 13:26:00-05:00,MMI,positive
832329.0,Momentum Stocks for Next Week,2011-02-25 18:04:00-05:00,MMI,neutral
832330.0,"Top Trade Ideas for Friday, February 25",2011-02-24 16:58:00-05:00,MMI,positive
832331.0,"Verizon Prices Motorola Xoom (VZ, MMI)",2011-02-22 11:02:00-05:00,MMI,neutral
832332.0,4 Stocks Gaining Momentum,2011-02-18 17:37:00-05:00,MMI,positive
832333.0,"Jefferies Comments On Mobile World Congress 2011 (RIMM, AAPL, MMI, SWIR, NVTL)",2011-02-18 07:52:00-05:00,MMI,neutral
832334.0,Motorola Xoom Tablet Priced At $799 (MMI),2011-02-16 17:49:00-05:00,MMI,neutral
832335.0,Motorola Xoom Price Finally Set (MMI),2011-02-16 13:10:00-05:00,MMI,neutral
832336.0,A Peek Into The Market Before The Trading Starts,2011-02-14 07:44:00-05:00,MMI,neutral
832337.0,Motorola Mobility To Buy Start-up 3LM,2011-02-14 01:41:00-05:00,MMI,neutral
832338.0,"UPDATED: Microsoft And Nokia: Together, They Could Make The Worst Phone Ever",2011-02-11 16:43:00-05:00,MMI,negative
832339.0,"J.P. Morgan Launches Monthly Communications Equipment Report (RVBD, ALU, QCOM, MMI)",2011-02-09 08:53:00-05:00,MMI,neutral
832340.0,"Top Trade Ideas for Wednesday, February 9",2011-02-08 17:40:00-05:00,MMI,positive
832341.0,comScore Reports December Mobile Subscriber Market Share ,2011-02-07 16:57:00-05:00,MMI,positive
832342.0,"Motorola Fires A Shot At Apple (MMI, AAPL)",2011-02-07 13:57:00-05:00,MMI,neutral
832343.0,Motorola Mobility Spikes Intraday (MMI),2011-02-02 13:37:00-05:00,MMI,neutral
832344.0,"Fast Money Pops & Drops, February 1st (YHOO, BGP, CBS, MMI, PLL)",2011-01-31 19:50:00-05:00,MMI,neutral
832345.0,Motorola Mobility Underperforms - Analyst Blog,2011-01-27 17:11:00-05:00,MMI,neutral
832346.0,Motorola Mobility Holdings Falls 11.7% (MMI),2011-01-27 11:49:00-05:00,MMI,neutral
832347.0,Hudson Securities Raises Motorola Mobility PT To $38 (MMI),2011-01-27 11:11:00-05:00,MMI,positive
832348.0,Hudson Raises Price Target on Motorola Mobility to $38 (MMI),2011-01-27 11:02:00-05:00,MMI,neutral
832349.0,Morgan Keegan Maintains Market Perform on Motorola Mobility (MMI),2011-01-27 10:16:00-05:00,MMI,neutral
832350.0,Recent Spinoff Motorola Mobility Falls On Slowing Sales,2011-01-27 09:31:00-05:00,MMI,neutral
832351.0,J.P. Morgan Maintains Underweight on Motorola Mobility (MMI),2011-01-27 07:59:00-05:00,MMI,neutral
832352.0,Citi Raises Motorola Mobility Holdings Price Target To $34.50 (MMI),2011-01-27 07:42:00-05:00,MMI,neutral
832353.0,Deutsche Bank Maintains Hold On Motorola Mobility (MMI),2011-01-27 07:34:00-05:00,MMI,neutral
832354.0,Citigroup Raises MMI Target To $34.50 From $31.50,2011-01-27 07:33:00-05:00,MMI,neutral
832355.0,Motorola Mobility Reports Q4 EPS of $.37 vs. $.36,2011-01-26 16:20:00-05:00,MMI,neutral
832356.0,Earnings Scheduled For January 26,2011-01-26 03:40:00-05:00,MMI,neutral
832357.0,Neutral on Motorola Mobility - Analyst Blog,2011-01-25 17:15:00-05:00,MMI,neutral
832358.0,Jefferies Previews Motorola Mobility's 4Q (MMI),2011-01-25 09:44:00-05:00,MMI,negative
832359.0,Hudson Previews Motorola Mobility's 4Q10 (MMI),2011-01-24 10:33:00-05:00,MMI,neutral
