Unnamed: 0,title,date,stock,sentiment
941241.0,"Morgan Stanley Maintains Underweight on New York Community, Raises Price Target to $11",2020-06-08 08:48:00-04:00,NYCB,neutral
941242.0,Shares of several financial services companies are trading higher as equities gain amid coronavirus vaccine hopes as well as a pickup in economic activity as some US states reopen businesses.,2020-05-26 10:33:00-04:00,NYCB,positive
941243.0,"Compass Point Maintains Neutral on New York Community, Lowers Price Target to $10.5",2020-05-13 09:15:00-04:00,NYCB,negative
941244.0,"Morgan Stanley Maintains Underweight on New York Community, Raises Price Target to $10.5",2020-05-06 09:05:00-04:00,NYCB,neutral
941245.0,"B. Riley FBR Maintains Buy on New York Community, Raises Price Target to $14",2020-04-30 11:19:00-04:00,NYCB,neutral
941246.0,"B of A Securities Reiterates Buy on New York Community, Raises Price Target to $13",2020-04-30 08:16:00-04:00,NYCB,positive
941247.0,New York Community Banc Q1 EPS $0.200 Beats $0.160 Estimate,2020-04-29 07:19:00-04:00,NYCB,neutral
941248.0,"B. Riley FBR Upgrades New York Community to Buy, Raises Price Target to $13",2020-04-13 07:20:00-04:00,NYCB,neutral
941249.0,RBC Capital Upgrades New York Community to Outperform,2020-04-13 06:30:00-04:00,NYCB,neutral
941250.0,"Morgan Stanley Maintains Underweight on New York Community, Lowers Price Target to $9.75",2020-04-07 08:26:00-04:00,NYCB,negative
941251.0,"Morgan Stanley Maintains Underweight on New York Community, Lowers Price Target to $11",2020-03-17 10:17:00-04:00,NYCB,negative
941252.0,Shares of several global financial services companies are trading higher as markets rebound after Thursday's crash. The financial sector has been volatile recently as the coronavirus has generated global economic uncertainty.,2020-03-13 11:42:00-04:00,NYCB,negative
941253.0,"Morgan Stanley Maintains Underweight on New York Community, Raises Price Target to $11.25",2020-03-05 08:24:00-05:00,NYCB,neutral
941254.0,"Piper Sandler Upgrades New York Community Banc to Overweight, Announces $13 Price Target",2020-02-10 06:09:00-05:00,NYCB,negative
941255.0,"B. Riley Downgrades New York Community Banc to Neutral, Lowers Price Target to $11.5",2020-01-30 06:32:00-05:00,NYCB,negative
941256.0,"Stephens & Co. Maintains Equal-Weight on New York Community Banc, Lowers Price Target to $11",2020-01-29 16:17:00-05:00,NYCB,negative
941257.0,New York Community Banc Q4 EPS $0.2 Beats $0.19 Estimate,2020-01-29 07:17:00-05:00,NYCB,neutral
941258.0,"RBC Capital Downgrades New York Community Banc to Sector Perform, Announces $13 Price Target",2019-10-31 07:25:00-04:00,NYCB,neutral
941259.0,New York Community Bancorp shares are trading lower after the company reported worse-than-expected Q3 sales results.,2019-10-30 09:54:00-04:00,NYCB,neutral
941260.0,"New York Community Banc Q3 EPS $0.19, Inline, Sales $235.915M Miss $240.04M Estimate",2019-10-30 07:29:00-04:00,NYCB,negative
941261.0,"Top 10 Most Overbought Stocks Via Benzinga Pro's Screener Tool For Fri., August 2, 2019",2019-08-02 14:05:00-04:00,NYCB,positive
941262.0,"Top 10 Most Overbought Stocks Via Benzinga Pro's Screener Tool For Thu., August 1, 2019",2019-08-01 15:04:00-04:00,NYCB,positive
941263.0,"JP Morgan Upgrades New York Community Banc to Neutral, Raises Price Target to $11.5",2019-08-01 06:36:00-04:00,NYCB,positive
941264.0,"Top 10 Most Overbought Stocks Via Benzinga Pro's Screener Tool For Wed., July 30, 2019",2019-07-31 13:10:00-04:00,NYCB,positive
941265.0,"New York Community Banc Q2 EPS $0.19, Inline, Sales $237.69M Miss $239.47M Estimate",2019-07-31 07:59:00-04:00,NYCB,negative
941266.0,"Top 10 Most Overbought Stocks Via Benzinga Pro's Screener Tool For Tue., July 30, 2019",2019-07-30 13:57:00-04:00,NYCB,positive
941267.0,"RBC Capital Reinstates Outperform on New York Community Banc, Announces $12 Price Target",2019-07-12 07:36:00-04:00,NYCB,neutral
941268.0,"Raymond James Highlights Zions, New York Community Had Highest Short Interest Ratios In Its Coverage Universe",2019-07-11 11:48:00-04:00,NYCB,positive
941269.0,"Raymond James On Recent Short Interest In Banking Stocks: Chemical Financial, New York Community, First Community Had Largest Increases In Short Interest, First Horizon, United Bankshares, Fifth Third Saw Largest Declines In Short Interest",2019-07-11 11:48:00-04:00,NYCB,positive
941270.0,"B. Riley Upgrades New York Community Banc to Buy, Announces $12 Price Target",2019-07-11 06:46:00-04:00,NYCB,neutral
941271.0,"New York Community Banc Q1 EPS $0.19, Inline",2019-04-30 07:15:00-04:00,NYCB,neutral
941272.0,Jefferies Initiates Coverage On New York Community Banc with Hold Rating,2019-04-08 09:56:00-04:00,NYCB,neutral
941273.0,"Morgan Stanley Downgrades New York Community Banc to Underweight, Announces $11.50",2019-03-11 07:22:00-04:00,NYCB,neutral
941274.0,"Stocks Trading Ex Dividend For Mon., Feb. 11, 2019",2019-02-11 09:45:00-05:00,NYCB,neutral
941275.0,"UBS Upgrades New York Community Banc to Buy, Raises Price Target to $15",2019-02-06 06:28:00-05:00,NYCB,neutral
941276.0,"New York Community Q4 EPS $0.19, Inline, Net Interest Income $247.24M",2019-01-30 07:13:00-05:00,NYCB,positive
941277.0,Barclays Downgrades New York Community Banc to Underweight,2019-01-10 06:43:00-05:00,NYCB,neutral
941278.0,"UBS Upgrades New York Community Banc to Neutral, Raises Price Target to $10",2019-01-08 07:31:00-05:00,NYCB,neutral
941279.0,"Stocks Trading Ex Dividend For Mon., Nov. 5, 2018",2018-11-05 09:48:00-05:00,NYCB,neutral
941280.0,"Stocks That Will Be Trading Ex Dividend Mon., Oct. 5, 2018",2018-11-02 09:52:00-04:00,NYCB,neutral
941281.0,"PiperJaffray Upgrades New York Community Banc to Neutral, Lowers Price Target to $9",2018-10-26 06:55:00-04:00,NYCB,negative
941282.0,"New York Community Banc Q3 EPS $0.20, Inline, Sales $249.506M Miss $262.78M Estimate",2018-10-24 07:18:00-04:00,NYCB,negative
941283.0,"Stocks Which Set New 52-Week Low Yesterday, October 22nd",2018-10-23 09:54:00-04:00,NYCB,negative
941284.0,"New York Community Bancorp, Inc. Announces Merger Of Subsidiary Banks",2018-10-01 15:20:00-04:00,NYCB,neutral
941285.0,"Stocks Which Set New 52-Week Low Yesterday, September 26th",2018-09-27 09:14:00-04:00,NYCB,negative
941286.0,"Stocks Trading Ex Dividend For Mon., Aug. 6, 2018",2018-08-06 12:06:00-04:00,NYCB,neutral
941287.0,"Stocks Which Set New 52-Week Low Yesterday, July 25th",2018-07-26 11:19:00-04:00,NYCB,negative
941288.0,New York Community Banc Q2 EPS $0.20 Misses $0.21 Estimate,2018-07-25 07:17:00-04:00,NYCB,negative
941289.0,"New York Community Bancorp Reports Q1 EPS $0.20 Inline, Sales $293.16M Beats $273.20M Est.",2018-04-25 07:31:00-04:00,NYCB,neutral
941290.0,"UBS Initiates Coverage On New York Community Banc with Sell Rating, Announces $12.00 Price Target",2018-03-22 09:29:00-04:00,NYCB,neutral
941291.0,13F From Cooperman's Omega Shows New 750K Share Stake In New York Community Bancorp,2018-02-14 12:25:00-05:00,NYCB,positive
941292.0,B. Riley Upgrades New York Community Banc to Neutral,2018-02-12 07:36:00-05:00,NYCB,neutral
941293.0,New York Community Bancorp Reports Q4 EPS $0.26 vs $0.17 Est.,2018-01-31 07:11:00-05:00,NYCB,neutral
941294.0,Bank of America Upgrades New York Community Banc to Buy,2018-01-10 09:20:00-05:00,NYCB,neutral
941295.0,UPDATE: New York Community Bancorp Sees Effective Tax Rate ~27% During FY18,2017-12-28 09:21:00-05:00,NYCB,positive
941296.0,New York Community Bancorp Reports Benefits From Enactment Of Tax Cuts And Jobs Act: Expects To Record After-Tax Benefit Of ~$25M During Q4'17,2017-12-28 09:21:00-05:00,NYCB,positive
941297.0,"RBC Capital Initiates Coverage On New York Community Banc with Sector Perform Rating, Announces $13.00 Price Target",2017-12-21 07:22:00-05:00,NYCB,neutral
941298.0,New York Community Bancorp Reports Q3 EPS $0.21 vs $0.17 Est.,2017-10-25 07:15:00-04:00,NYCB,neutral
941299.0,"Raymond James U.S. Bank Conference Takes Place Today, Attendees Include First Defiance Financial, New York Community Banc, Bank of the Ozarks, and CyrusOne",2017-09-06 09:48:00-04:00,NYCB,neutral
941300.0,New York Community Bancorp Reports Q2 EPS $0.22 vs $0.20 Est.,2017-07-26 07:25:00-04:00,NYCB,neutral
941301.0,"Morgan Stanley Financials Conference Continues Today, Presenters Include OM Asset Management, State Street, New York Bancorp, Fifth Third Bank, Discover Financial, OnDeck, and Ally Financial",2017-06-14 08:00:00-04:00,NYCB,positive
941302.0,New York Community Banc Down Slightly After Earlier Stephens & Co. Initiation With Equal-Weight,2017-04-05 10:11:00-04:00,NYCB,neutral
941303.0,New York Community Bancorp Reports Q4 EPS $0.23 vs $0.26 Est.,2017-01-25 07:04:00-05:00,NYCB,neutral
941304.0,Raymond James Downgrades New York Community Banc to Market Perform,2016-12-21 06:37:00-05:00,NYCB,neutral
941305.0,"FBR Capital Downgrades New York Community Banc to Underperform, Lowers Price Target to $15.00",2016-12-21 05:48:00-05:00,NYCB,negative
941306.0,Morgan Stanley Downgrades New York Community Banc to Equal-Weight,2016-12-21 05:46:00-05:00,NYCB,neutral
941307.0,"Wedbush Initiates Coverage on New York Community Banc at Neutral, Announces $15.00 PT",2016-10-07 06:49:00-04:00,NYCB,neutral
941308.0,FBR Capital Upgrades New York Community Banc to Market Perform,2016-01-19 06:35:00-05:00,NYCB,neutral
941309.0,Sterne Agee CRT Upgrades New York Community Banc to Buy,2016-01-05 07:05:00-05:00,NYCB,neutral
941310.0,Bank of America Upgrades New York Community Banc to Buy,2015-11-30 07:34:00-05:00,NYCB,neutral
941311.0,Keefe Bruyette & Woods Upgrades New York Community Banc to Market Perform,2015-11-02 04:02:00-05:00,NYCB,neutral
941312.0,"Standpoint Research Upgrades New York Community Banc to Buy, Announces $19.00 PT",2015-10-30 14:21:00-04:00,NYCB,neutral
941313.0,"FBR Capital Downgrades New York Community Banc to Underperform, Lowers PT to $15.00",2015-10-30 06:15:00-04:00,NYCB,negative
941314.0,New York Community Bancorp 40.625M Share Stock Offering @$16.00/Share,2015-10-30 04:21:00-04:00,NYCB,positive
941315.0,"Sterne Agee CRT Initiates Coverage on New York Community Banc at Neutral, Announces $18.00 PT",2015-08-19 17:23:00-04:00,NYCB,neutral
941316.0,"Keefe Bruyette & Woods Downgrades New York Community Banc to Underperform, Maintains $15.50 PT",2015-07-08 04:24:00-04:00,NYCB,neutral
941317.0,Bank of America Reinstates Underperform on New York Community Banc,2015-06-24 06:47:00-04:00,NYCB,neutral
941318.0,"Piper Jaffray Initiates Coverage on New York Community Banc at Underweight, Announces $16.00 PT",2015-06-05 10:45:00-04:00,NYCB,neutral
941319.0,Raymond James Initiates Coverage on New York Community Banc at Market Perform,2015-05-01 06:50:00-04:00,NYCB,neutral
941320.0,Standpoint Research Upgrades New York Community Bancorp to Buy,2014-09-16 10:02:00-04:00,NYCB,neutral
941321.0,New York Community Bancorp Reports Q2 EPS of $0.27 vs $0.26 Est,2014-07-23 07:10:00-04:00,NYCB,neutral
941322.0,Keefe Bruyette & Woods Downgrades New York Community Bancorp to Market Perform,2014-01-30 06:22:00-05:00,NYCB,neutral
941323.0,Guggenheim Securities Downgrades New York Community Bancorp to Neutral,2013-12-04 07:51:00-05:00,NYCB,positive
941324.0,"Compass Point Maintains Neutral on New York Community Bancorp, Raises PT to $15.00",2013-10-24 08:29:00-04:00,NYCB,neutral
941325.0,Standpoint Research Downgrades New York Community Bancorp to Hold,2013-10-14 10:35:00-04:00,NYCB,neutral
941326.0,"ISI Group Initiates Coverage on New York Community Bancorp at Neutral, Announces $15.50 PT",2013-10-07 16:47:00-04:00,NYCB,neutral
941327.0,"Barclays Maintains Equal-weight on New York Community Bancorp, Raises PT to $14.00",2013-07-25 08:42:00-04:00,NYCB,neutral
941328.0,New York Community Bancorp Reports Q2 EPS of $0.30 vs $0.26 Est,2013-07-24 08:01:00-04:00,NYCB,neutral
941329.0,"JP Morgan Maintains Neutral on New York Community Bancorp, Raises PT to $14.50",2013-07-09 07:55:00-04:00,NYCB,positive
941330.0,"Deutsche Bank Maintains Hold on New York Community Bancorp, Raises PT to $13.00",2013-06-28 09:07:00-04:00,NYCB,neutral
941331.0,New York Community Bancorp Shares Rise as Guggenheim Upgraded to Buy,2013-05-07 10:38:00-04:00,NYCB,positive
941332.0,"Compass Point Maintains Neutral on New York Community Bancorp, Lowers PT to $12.50",2013-04-25 06:35:00-04:00,NYCB,negative
941333.0,New York Community Bancorp Reports Q1 EPS of $0.29 vs $0.26 Est,2013-04-24 08:11:00-04:00,NYCB,neutral
941334.0,New York Community Bancorp Reports Q1 EPS of $0.29 vs $0.26 Est,2013-04-24 08:01:00-04:00,NYCB,neutral
941335.0,Standpoint Research Upgrades New York Community Bancorp to Buy,2013-03-07 15:39:00-05:00,NYCB,neutral
941336.0,Keefe Bruyette & Woods Upgrades New York Community Bancorp to Outperform,2013-03-07 06:08:00-05:00,NYCB,neutral
941337.0,"Sterne Agee Maintains Underperform on New York Community Bancorp, Raises PT to $11.50",2013-03-05 08:36:00-05:00,NYCB,neutral
941338.0,"Sterne Agee Maintains Underperform on New York Community Bancorp, Raises PT to $11.50",2013-03-05 08:36:00-05:00,NYCB,neutral
941339.0,"JP Morgan Maintains Neutral on New York Community Bancorp, Lowers PT to $13.00",2013-01-10 06:43:00-05:00,NYCB,positive
