Unnamed: 0,title,date,stock,sentiment
948770.0,OGE Energy Reports Q2 EPS $0.95 vs $0.90 Est; Revenues $855M vs $NaN Est,2012-08-02 08:51:00-04:00,OGE,positive
948771.0,OG&E Accepts Settlement In Long-running Rate Case ,2012-07-02 16:17:00-04:00,OGE,positive
948772.0,"Jefferies & Company Maintains OGE Energy at Hold, Raises PT from $56 to $58",2012-05-04 07:07:00-04:00,OGE,positive
948773.0,OGE Energy Reports Q1 EPS $0.38 vs $0.33 Est; Revenues $840.7M,2012-05-03 08:35:00-04:00,OGE,positive
948774.0,"UPDATE: Jefferies Maintains Hold Rating, Lowers PT for OGE Energy",2012-04-18 09:37:00-04:00,OGE,positive
948775.0,"Jefferies & Company Maintains OGE Energy at Hold, Lowers PT from $58 to $56",2012-04-18 07:38:00-04:00,OGE,positive
948776.0,OGE Energy Spiking Higher on Heavy Volume; Currently at $54.03,2012-02-17 12:38:00-05:00,OGE,positive
948777.0,UPDATE: Jefferies Cuts PT to $58 on OGE Energy ,2012-02-17 10:53:00-05:00,OGE,neutral
948778.0,UPDATE: Wunderlich Securities Ups PT to $55 on OGE Energy ,2012-02-17 07:08:00-05:00,OGE,positive
948779.0,"Wunderlich Securities Maintains OGE Energy at Hold, Raises PT from $49 to $55",2012-02-17 06:20:00-05:00,OGE,positive
948780.0,OGE Energy Reports Q4 EPS $0.37 vs $0.35 Est; Revenues $885.2M				,2012-02-16 07:34:00-05:00,OGE,positive
948781.0,UPDATE: Jefferies Downgrades OGE Energy to Hold,2012-01-26 13:15:00-05:00,OGE,positive
948782.0,UPDATE: Jefferies Downgrades OGE Energy to Hold,2012-01-26 07:51:00-05:00,OGE,positive
948783.0,Jefferies Downgrades OGE Energy to Hold,2012-01-26 06:14:00-05:00,OGE,positive
948784.0,OGE Energy Sees FY 2011 EPS of $3.40-3.45 vs $3.41 Est ,2012-01-25 09:06:00-05:00,OGE,positive
948785.0,Top Dividend Stocks of 2011,2011-12-31 14:07:00-05:00,OGE,positive
948786.0,Best Utilities Stocks of 2011,2011-12-28 12:17:00-05:00,OGE,positive
948787.0,Benzinga's Top Upgrades,2011-12-20 08:57:00-05:00,OGE,positive
948788.0,"Financial Breakfast: Morning News Summary for December 20, 2011",2011-12-20 07:27:00-05:00,OGE,neutral
948789.0,A Peek Into The Market Before The Trading Starts,2011-12-20 07:13:00-05:00,OGE,neutral
948790.0,Jefferies Upgrades OGE Energy to Buy,2011-12-20 06:11:00-05:00,OGE,positive
948791.0,OGE Energy Corp Appoints CEO Peter B. Delaney as President,2011-12-07 07:10:00-05:00,OGE,positive
948792.0,OG&E and Oklahoma State University Sign Agreement to Add Wind Power to Support the University's Sustainability Efforts ,2011-12-02 14:37:00-05:00,OGE,positive
948793.0,OGE Energy Boosts Dividend by $0.07 to $1.57/Share,2011-12-01 17:27:00-05:00,OGE,positive
948794.0,"Jefferies Downgrades ED, INTU, OGE from Buy to Hold",2011-10-28 06:48:00-04:00,OGE,neutral
948795.0,Ladenburg Thalmann Reiterates Buy on OGE Energy,2011-10-03 09:04:00-04:00,OGE,positive
948796.0,"Enogex Announces Agreements to Acquire Pipeline Assets, New Acreage Dedications and Increased Processing Capacity ",2011-09-30 14:36:00-04:00,OGE,positive
948797.0,Keith Mitchell Named President of Enogex,2011-09-29 07:02:00-04:00,OGE,neutral
948798.0,Ladenburg Thalmann Reiterates Buy Rating On OGE Energy,2011-09-15 09:16:00-04:00,OGE,positive
948799.0,Ten Utilities Stocks Worth a Look Now,2011-08-09 11:53:00-04:00,OGE,positive
948800.0,"UPDATE: Jefferies Upgrades OGE Energy to Buy, Reduces PT to $47",2011-08-09 07:34:00-04:00,OGE,positive
948801.0,"Jefferies Upgrades OGE Energy To Buy, Lowers PT To $47",2011-08-09 05:57:00-04:00,OGE,positive
948803.0,OG&E Requests 2012 Rate Increase,2011-07-29 07:14:00-04:00,OGE,positive
948804.0,Seven Utilities Stocks Worth a Look Now,2011-07-22 16:58:00-04:00,OGE,positive
948805.0,Stocks Going Ex Dividend the First Week of July,2011-06-30 01:45:00-04:00,OGE,neutral
948806.0,UPDATE: Williams Initiates OGE Energy at Buy,2011-06-21 09:08:00-04:00,OGE,positive
948807.0,Arkansas Regulators Approve New Rates for OG&E,2011-06-20 07:02:00-04:00,OGE,neutral
948808.0,OG&E Issues Stern Rebuttal to EPA's Oklahoma Haze Plan; Could Cost $1B to Comply With EPA,2011-05-23 12:53:00-04:00,OGE,neutral
948809.0,Jefferies Raises PT On OGE To $57,2011-04-20 07:22:00-04:00,OGE,neutral
948810.0,Jefferies Raises PT ON OGE Energy To $57,2011-04-20 06:29:00-04:00,OGE,positive
948811.0,Wunderlich Raising Price Target On OGE Energy (OGE),2011-02-18 07:35:00-05:00,OGE,positive
948812.0,Wunderlich Raises PT On OGE Energy To $49,2011-02-18 06:48:00-05:00,OGE,positive
948813.0,High Yield Utilities that can Benefit from Lower Fossil Fuel Prices,2011-01-26 22:28:00-05:00,OGE,positive
948814.0,Alternative Energy Industry Outlook - Jan. 2011 - Industry Outlook,2011-01-18 16:31:00-05:00,OGE,positive
948815.0,Alternative Energy Industry Outlook - Jan. 2011 - Zacks Analyst Interviews,2011-01-18 16:31:00-05:00,OGE,positive
948816.0,Alternative Energy Industry Outlook - Jan. 2011 - Industry Outlook,2011-01-18 16:31:00-05:00,OGE,positive
948817.0,Alternative Energy Industry Outlook - Jan. 2011 - Industry Outlook,2011-01-18 16:12:00-05:00,OGE,positive
948818.0,Alternative Energy Industry Outlook - Jan. 2011 - Industry Outlook,2011-01-18 00:00:00-05:00,OGE,positive
948819.0,Alternative Energy Industry Outlook - Jan. 2011 - Zacks Analyst Interviews,2011-01-18 00:00:00-05:00,OGE,positive
948820.0,5 Natural Gas Stocks With Upside,2011-01-11 09:42:00-05:00,OGE,positive
948821.0,Get a Charge Out of High Yield Electric Utilities,2010-12-27 00:06:00-05:00,OGE,neutral
948822.0,OGE Energy Hikes Dividend  - Analyst Blog,2010-12-06 18:30:00-05:00,OGE,positive
948823.0,OGE Energy Hikes Dividend  - Analyst Blog,2010-12-06 18:00:00-05:00,OGE,positive
948824.0,Wells Fargo Initiates Coverage On OGE Energy With An Outperform Rating,2010-12-06 09:14:00-05:00,OGE,positive
948825.0,OGE Energy Corp. Increases Annual Dividend from $1.45 to $1.50,2010-12-02 14:07:00-05:00,OGE,positive
948826.0,"Mad Money Lightning Round OT: Cramer Is Bearish On Hecla (HL) (HL, OGE, BAA, AEM, EGO)",2010-11-09 20:02:00-05:00,OGE,negative
948827.0,Strong Numbers from OGE Energy - Analyst Blog,2010-11-02 10:33:00-04:00,OGE,positive
948828.0,"OGE Energy, ArcLight Capital Complete $183M Equity Funding Transaction ",2010-11-01 12:19:00-04:00,OGE,positive
948829.0,OGE Energy Corporation 3Q Operating EPS Above Estimates,2010-11-01 09:36:00-04:00,OGE,positive
948830.0,"Price Target Raised On (SFE, ZUMZ, OGE, LLNW)",2010-10-07 10:54:00-04:00,OGE,neutral
948831.0,Jefferies Upgrades OGE Energy To Buy,2010-10-07 09:14:00-04:00,OGE,positive
948832.0,OGE Energy Corp. Announces Dividend of 36.25 Cents,2010-09-28 14:23:00-04:00,OGE,positive
948833.0,OG&E Proposes $17.7 Million Rate Increase ,2010-09-28 14:07:00-04:00,OGE,positive
948834.0,OGE Energy a Penny Ahead - Analyst Blog,2010-08-08 06:32:00-04:00,OGE,positive
948835.0,A Utility and Natural Gas Play (OGE),2010-07-15 04:48:00-04:00,OGE,positive
948836.0,Stocks Going Ex Dividend the Second Week of April,2010-04-02 13:29:00-04:00,OGE,neutral
948837.0,OGE Energy (OGE) To Double Energy Capacity,2010-01-11 14:08:00-05:00,OGE,positive
948838.0,Oklahoma is OOK,2009-10-29 14:30:00-04:00,OGE,neutral
