Unnamed: 0,title,date,stock,sentiment
948564.0,"Shares of several utilities companies are trading lower following an increase in coronavirus cases in some US states that have reopened, leading to concerns of a second wave of the virus.",2020-06-11 10:16:00-04:00,OGE,positive
948565.0,"Mizuho Upgrades OGE Energy to Buy, Announces $37 Price Target",2020-06-10 06:22:00-04:00,OGE,positive
948566.0,Shares of several utility companies are trading lower as equities sell off following the recent rally. Stocks have rallied over the past week amid optimism towards the US economy reopening and investors have potentially taken some profits following the run up.,2020-06-09 10:41:00-04:00,OGE,positive
948567.0,Shares of several utility companies are trading higher in sympathy with the overall market as equities rally on coronavirus vaccine hopes as well as a pickup in economic activity as some US states reopen businesses.,2020-05-26 11:03:00-04:00,OGE,positive
948568.0,"Shares of several utilities companies are trading higher amid market strength as some US states begin easing lockdown measures, which has raised hopes of an economic rebound.",2020-05-18 10:17:00-04:00,OGE,positive
948569.0,"UBS Maintains Neutral on OGE Energy, Raises Price Target to $31",2020-05-08 13:27:00-04:00,OGE,positive
948570.0,"B of A Securities Upgrades OGE Energy to Buy, Lowers Price Target of $32",2020-05-08 09:19:00-04:00,OGE,positive
948571.0,"OGE Energy Q1 Adj. EPS $0.230 Beats $0.200 Estimate, Sales $431.300M Miss $511.600M Estimate",2020-05-07 07:23:00-04:00,OGE,positive
948572.0,"Shares of several utilities companies are trading lower with the overall market on continued downward momentum after oil prices fell to historic lows, partially stemming from weak demand caused by the coronavirus pandemic.",2020-04-21 11:47:00-04:00,OGE,negative
948573.0,"Evercore ISI Group Upgrades OGE Energy to Outperform, Lowers Price Target to $35",2020-04-20 05:52:00-04:00,OGE,positive
948574.0,Shares of several utility companies are trading higher amid optimistic coronavirus outlook following positive drug data from Gilead. This has raised hopes of a sooner return to spending and economic activity.,2020-04-17 10:00:00-04:00,OGE,positive
948575.0,Shares of several utility companies are trading lower as the coronavirus pandemic continues to take its toll on the economy. The pandemic has forced most non-essential businesses to close thus using less utilities.,2020-04-15 09:36:00-04:00,OGE,negative
948576.0,Shares of several utility companies are trading higher amid positive market sentiment on optimism of cases potentially leveling off in some hotspots globally. Lower cases could mean a sooner return to store openings.,2020-04-07 11:21:00-04:00,OGE,positive
948577.0,"UBS Maintains Neutral on OGE Energy, Lowers Price Target to $30",2020-04-03 10:22:00-04:00,OGE,positive
948578.0,"Wells Fargo Maintains Equal-Weight on OGE Energy, Lowers Price Target to $32",2020-04-02 09:22:00-04:00,OGE,positive
948579.0,Shares of several utility companies are trading lower amid market weakness as macro concerns continue to grow as a result of the coronavirus pandemic.,2020-04-01 09:06:00-04:00,OGE,negative
948580.0,"Wells Fargo Maintains Equal-Weight on OGE Energy, Lowers Price Target to $35",2020-03-31 09:09:00-04:00,OGE,positive
948581.0,"Barclays Maintains Equal-Weight on OGE Energy, Lowers Price Target to $28",2020-03-26 10:58:00-04:00,OGE,positive
948582.0,Stocks That Hit 52-Week Lows On Monday,2020-03-23 10:34:00-04:00,OGE,negative
948583.0,Stocks That Hit 52-Week Lows On Thursday,2020-03-12 12:10:00-04:00,OGE,negative
948584.0,Stocks That Hit 52-Week Lows On Friday,2020-03-06 11:22:00-05:00,OGE,negative
948585.0,Stocks That Hit 52-Week Lows On Friday,2020-02-28 10:16:00-05:00,OGE,negative
948586.0,Shares of several utility companies are trading lower as the global coronavirus spread continues to cause equities across sectors to sell off amid worsened economic outlook.,2020-02-28 10:06:00-05:00,OGE,negative
948587.0,"Wells Fargo Maintains Equal-Weight on OGE Energy, Lowers Price Target to $42",2020-02-28 07:48:00-05:00,OGE,positive
948588.0,OGE Energy Q4 EPS $0.18; Sees FY20 EPS $2.19-$2.31 vs $2.28 Estimate,2020-02-27 06:19:00-05:00,OGE,positive
948589.0,Stocks That Hit 52-Week Highs On Tuesday,2020-02-11 10:17:00-05:00,OGE,neutral
948590.0,Stocks That Hit 52-Week Highs On Friday,2020-01-31 10:23:00-05:00,OGE,neutral
948591.0,Stocks That Hit 52-Week Highs On Friday,2020-01-24 10:41:00-05:00,OGE,neutral
948592.0,Stocks That Hit 52-Week Highs On Tuesday,2020-01-21 10:11:00-05:00,OGE,neutral
948593.0,"UBS Maintains Neutral on OGE Energy, Lowers Price Target to $43",2019-11-26 08:01:00-05:00,OGE,positive
948594.0,OGE Energy Raises FY19 EPS Guidance from $2.05-$2.20 to $2.24-$2.30 vs $2.13 Est,2019-11-07 07:53:00-05:00,OGE,positive
948595.0,"OGE Energy Q3 EPS $1.25 Beats $1.11 Estimate, Sales $755.4M Beat $737.33M Estimate",2019-11-07 07:51:00-05:00,OGE,positive
948596.0,Stocks That Hit 52-Week Highs On Monday,2019-09-30 11:10:00-04:00,OGE,neutral
948597.0,"UBS Maintains Neutral on OGE Energy, Raises Price Target to $49",2019-09-27 08:25:00-04:00,OGE,positive
948598.0,OGE Energy Raises Quarterly Dividend From $0.3650 To $0.3875/Share,2019-09-25 11:13:00-04:00,OGE,positive
948599.0,Stocks That Hit 52-Week Highs On Monday,2019-09-23 12:51:00-04:00,OGE,neutral
948600.0,"Mizuho Maintains Neutral on OGE Energy, Raises Price Target to $45",2019-09-20 07:26:00-04:00,OGE,positive
948601.0,Stocks That Hit 52-Week Highs On Tuesday,2019-09-17 10:40:00-04:00,OGE,neutral
948602.0,Stocks That Hit 52-Week Highs On Friday,2019-09-13 14:58:00-04:00,OGE,neutral
948603.0,"Benzinga's Top Upgrades, Downgrades For September 6, 2019",2019-09-06 09:37:00-04:00,OGE,positive
948604.0,"Bank of America Upgrades OGE Energy to Buy, Raises Price Target to $46",2019-09-06 08:52:00-04:00,OGE,positive
948605.0,"OGE Energy Earlier Reported Q2 EPS $0.5 Misses $0.51 Estimate, Sales $513.7M Miss $573.15M Estimate; Reaffirmed FY19 EPS Guidance $2.05-$2.20",2019-08-08 11:06:00-04:00,OGE,negative
948606.0,"Earnings Scheduled For August 8, 2019",2019-08-08 04:05:00-04:00,OGE,neutral
948607.0,"Benzinga's Top Upgrades, Downgrades For June 17, 2019",2019-06-17 09:10:00-04:00,OGE,positive
948608.0,"Mizuho Initiates Coverage On OGE Energy with Neutral Rating, Announces $43.5 Price Target",2019-06-17 06:59:00-04:00,OGE,positive
948609.0,OGE Energy Reaffirms FY2019 EPS Guidance of $2.05-2.20 vs $2.14 Est.,2019-05-02 08:33:00-04:00,OGE,positive
948610.0,"OGE Energy Q1 EPS $0.24 Beats $0.23 Estimate, Sales $490M Miss $494.43M Estimate",2019-05-02 08:31:00-04:00,OGE,positive
948611.0,"Goldman Sachs Downgrades OGE Energy to Sell, Lowers Price Target to $37",2019-04-08 07:18:00-04:00,OGE,positive
948612.0,OGE Energy Sees FY19 Consolidated EPS $2.05-$2.20 vs $2.14 Estimate,2019-02-21 06:22:00-05:00,OGE,positive
948613.0,"OGE Energy Q4 EPS $0.27 Beats $0.23 Estimate, Sales $511.8M Beat $511.21M Estimate",2019-02-21 06:21:00-05:00,OGE,positive
948614.0,"Earnings Scheduled For February 21, 2019",2019-02-21 04:27:00-05:00,OGE,neutral
948615.0,"Stocks Trading Ex Dividend For Wed., Jan. 9, 2019",2019-01-09 10:53:00-05:00,OGE,neutral
948616.0,"Stocks That Will Be Trading Ex Dividend Wed., Jan. 9, 2019",2019-01-08 10:20:00-05:00,OGE,neutral
948617.0,"OGE Energy Corp. Reports Its Oklahoma Gas & Electric Subsidiary Has Asked Oklahoma Corporation Commission To Review Co.'s Request To Recover ~$534M Investment In Sooner Power Plant, ~$75M In Muskogee Power Plant",2018-12-31 16:19:00-05:00,OGE,positive
948618.0,"Stocks Which Set New 52-Week High Yesterday, Thurs., Dec. 13, 2018",2018-12-14 11:03:00-05:00,OGE,neutral
948619.0,"Stocks Which Set New 52-Week High Yesterday, Tues., Dec. 11, 2018",2018-12-12 11:46:00-05:00,OGE,neutral
948620.0,"Stocks Which Set New 52-Week High The Last Trading Session, Fri., Dec. 7, 2018",2018-12-10 11:01:00-05:00,OGE,neutral
948621.0,"Benzinga's Top Upgrades, Downgrades For November 27, 2018",2018-11-27 09:15:00-05:00,OGE,positive
948622.0,"Bank of America Downgrades OGE Energy to Neutral, Maintains $39 Price Target",2018-11-27 07:51:00-05:00,OGE,positive
948623.0,"Stocks Which Set New 52-Week High Yesterday, Tues., Nov. 20, 2018",2018-11-21 08:38:00-05:00,OGE,neutral
948624.0,"Stocks Which Set New 52-Week Highs Fri., Nov. 16, 2018",2018-11-19 10:15:00-05:00,OGE,neutral
948625.0,"Stocks Which Set New 52-Week High Yesterday, Thurs., Nov. 16, 2018",2018-11-16 10:37:00-05:00,OGE,neutral
948626.0,OGE Energy Raises FY2018 EPS Guidance from $1.43-1.53 to $2.05-2.09 vs $2.04 Est,2018-11-08 09:07:00-05:00,OGE,positive
948627.0,"OGE Energy Corporation Q3 EPS $1.02 Beats $0.94 Estimate, Sales $698.8M Miss $718.37M Estimate",2018-11-08 09:07:00-05:00,OGE,positive
948628.0,"Earnings Scheduled For November 8, 2018",2018-11-08 04:00:00-05:00,OGE,neutral
948629.0,"Stocks Which Set New 52-Week High Yesterday, October 10th",2018-10-11 09:08:00-04:00,OGE,neutral
948630.0,"Stocks That Will Trade Ex Dividend For Tues., Oct. 9, 2018",2018-10-08 09:27:00-04:00,OGE,neutral
948631.0,"Stocks Which Set New 52-Week High Yesterday, September 11th",2018-09-12 12:17:00-04:00,OGE,neutral
948632.0,"Stocks Which Set New 52-Week High Yesterday, August 16th",2018-08-17 10:39:00-04:00,OGE,neutral
948633.0,Evercore ISI Group Downgrades OGE Energy to In-Line,2018-08-13 08:29:00-04:00,OGE,positive
948634.0,OGE Energy Sees FY18 EPS $1.90-$2.05 vs $2.02 Est.,2018-08-09 07:11:00-04:00,OGE,positive
948635.0,"OGE Energy Q2 EPS $0.55 Misses $0.57 Estimate, Sales $567M Miss $592.65M Estimate",2018-08-09 07:10:00-04:00,OGE,negative
948636.0,"OGE Energy Q2 EPS $0.46 Misses $0.57 Estimate, Sales $567M Miss $592.65M Estimate; Sees FY18 Adj. EPS At Upper End Of Previously Guided $1.90-$2.05",2018-08-09 06:24:00-04:00,OGE,negative
948637.0,"Earnings Scheduled For August 9, 2018",2018-08-09 04:31:00-04:00,OGE,neutral
948638.0,"OGE Energy's Favorable Outcome Has Played Out, Goldman Sachs Says",2018-06-25 11:27:00-04:00,OGE,positive
948639.0,"Benzinga's Top Upgrades, Downgrades For June 25, 2018",2018-06-25 09:18:00-04:00,OGE,positive
948640.0,Goldman Sachs Downgrades OGE Energy to Neutral,2018-06-25 08:40:00-04:00,OGE,positive
948641.0,"OGE Energy Says on June 19, OCC Approved Settlement Agreement That Co Entered Into With Several Parties, Associated With Its Requested Rate Increase; Says Settlement Agreement Includes Annual Net Decrease of $64M in OGE Rates to Its Oklahoma Retail Custom",2018-06-20 06:08:00-04:00,OGE,positive
948642.0,OGE Energy Reaffirms FY18 Outlook: EPS $1.90-$2.05 vs $2 Estimate,2018-06-13 13:15:00-04:00,OGE,positive
948643.0,OGE Energy Reports OG&E Subsidiary Reached Deal With Oklahoma Corporation Commission Staff To Settle Pending Review Before Commission,2018-06-13 13:14:00-04:00,OGE,positive
948644.0,"OGE Energy Files For Potential Mixed Shelf Offering, Size Not Disclosed",2018-05-18 15:59:00-04:00,OGE,positive
948645.0,OGE Energy Sees FY18 EPS $1.90-$2.05 vs $2.00,2018-05-03 07:12:00-04:00,OGE,positive
948646.0,"OGE Energy Q1 EPS $0.16 Beats $0.14 Estimate, Sales $492.7M Beat $463.95M Estimate",2018-05-03 07:11:00-04:00,OGE,positive
948647.0,Mid-Afternoon Market Update: Telaria Falls Following Q4 Results; Achillion Pharmaceuticals Shares Surge,2018-02-26 14:31:00-05:00,OGE,positive
948648.0,Mid-Day Market Update: Dow Climbs Over 200 Points; NXT-ID Shares Gain Following Agreement with Discovery Financial Services,2018-02-26 12:02:00-05:00,OGE,positive
948649.0,Mid-Afternoon Market Update: Trade Desk Surges Following Strong Q4 Results; Marin Software Shares Slide,2018-02-23 14:32:00-05:00,OGE,positive
948650.0,Mid-Day Market Update: Crude Oil Up Over 1%; Workiva Shares Plunge,2018-02-23 12:19:00-05:00,OGE,negative
948651.0,Mid-Morning Market Update: Markets Open Higher; Huntsman Earnings Top Estimates,2018-02-23 10:16:00-05:00,OGE,positive
948652.0,Hearing Bank of America Upgraded OGE Energy To Buy,2018-02-23 09:28:00-05:00,OGE,positive
948653.0,OGE Energy Reports Q4 Adj. EPS $0.30 vs $0.28 Est.,2018-02-22 07:16:00-05:00,OGE,positive
948654.0,"UBS Initiates Coverage On OGE Energy with Neutral Rating, Announces $33.00 Price Target",2018-02-02 08:14:00-05:00,OGE,positive
948655.0,Bank of America Upgrades OGE Energy to Neutral,2018-01-18 09:20:00-05:00,OGE,positive
948656.0,Goldman Sachs' 3 Top Utilities Stocks In 2018,2018-01-11 12:02:00-05:00,OGE,positive
948657.0,Goldman Sachs Upgrades OGE Energy to Buy,2018-01-11 08:43:00-05:00,OGE,positive
948658.0,Edward Jones Downgrades OGE Energy to Hold,2017-12-27 10:20:00-05:00,OGE,positive
948659.0,OGE Energy Lowers FY17 EPS From $1.58-$1.70 To $1.50-$1.52,2017-11-02 09:37:00-04:00,OGE,positive
948660.0,"OGE Energy Reports Q3 EPS $0.92 vs. $0.94 Est., Sales $716.8M vs. $750.5M Est.",2017-11-02 09:35:00-04:00,OGE,positive
948661.0,"Benzinga's Top Upgrades, Downgrades For October 6, 2017",2017-10-06 09:24:00-04:00,OGE,positive
948662.0,Wells Fargo Downgrades OGE Energy to Market Perform,2017-10-06 07:26:00-04:00,OGE,positive
948663.0,OGE Energy Raises Qtr. Dividend From $0.3025 To $0.3325/Share,2017-09-26 18:08:00-04:00,OGE,positive
948664.0,"OGE Energy Reports Q2 EPS $0.43 vs $0.45 Est., Sales $586.4M vs $563M Est.",2017-08-03 07:50:00-04:00,OGE,positive
948665.0,"Evercore ISI Group Initiates Coverage On OGE Energy with Outperform Rating, Announces $37.00 Price Target",2017-07-24 09:26:00-04:00,OGE,positive
948666.0,Goldman Sachs Initiates Coverage On OGE Energy to Neutral,2017-07-21 08:58:00-04:00,OGE,positive
948667.0,"OGE Energy's Oklahoma Gas & Electric Co., SunPower Report Signing Of Contract To Build 10-MW Solar Photovoltaic Power Plant In Covington, Oklahoma, No Terms Disclosed",2017-07-18 08:18:00-04:00,OGE,negative
948669.0,OGE Energy Sees OG&E EPS at the Lower End of $1.58-$1.70,2017-05-04 09:45:00-04:00,OGE,neutral
948670.0,"OGE Energy Reports Q1 EPS $0.18 vs $0.15 Est., Sales $456M vs $444M Est.",2017-05-04 09:45:00-04:00,OGE,positive
948671.0,"OGE Energy Q1 EPS $0.18 vs $0.15 Est, Sales $456.0M vs $444.0M Est",2017-05-04 09:45:00-04:00,OGE,positive
948672.0,OG&E Says Disappointed by Oklahoma Rate Case Decision,2017-03-21 04:01:00-04:00,OGE,negative
948673.0,"OGE Energy Reports Q4 EPS $0.29 vs. $0.33 Est., Sales $530.8M vs. $557M Est.",2017-02-23 07:05:00-05:00,OGE,positive
948674.0,"Electric Utilities Up Early: Exelon 3%, Companhia Paranaense de Energia 3%, Enersis Americas 2.5%, Alliant 2%, OGE 2%, AES 2%, Duke 1.5%, Public Service 1%, Dominion 1%",2016-12-02 10:37:00-05:00,OGE,neutral
948675.0,Guggenheim Initiates Coverage On OGE Energy Corporation Common Stock at Buy,2016-11-04 07:12:00-04:00,OGE,positive
948676.0,"OGE Energy Corp. Reports Q3 EPS $0.92 vs. Est. $0.93, Rev. $743.9M vs. Prior Year Quarter $719.8M",2016-11-03 07:21:00-04:00,OGE,positive
948677.0,"10 Notable Stocks Trading Ex-Dividend Friday, October 7",2016-10-06 11:49:00-04:00,OGE,neutral
948678.0,OGE Energy Raises Qtr. Dividend from $0.275 to $0.3025/Share,2016-09-28 11:23:00-04:00,OGE,positive
948679.0,OG&E Sees FY16 EPS $1.72-$1.83 vs. Est. $1.77,2016-08-04 07:36:00-04:00,OGE,neutral
948680.0,"OGE Energy Reports Q2 EPS $0.35 vs. Est. $0.41, Rev. $551.4M vs. Est. $569.6M",2016-08-04 07:35:00-04:00,OGE,positive
948681.0,OGE Energy Sees FY16 EPS $1.72-$1.83 vs. Est. $1.76,2016-05-05 07:06:00-04:00,OGE,positive
948682.0,OGE Energy Reports Q1 EPS $0.13 vs. Est. $0.13,2016-05-05 07:06:00-04:00,OGE,positive
948683.0,OGE Energy Downgraded By Argus Research From Buy To Hold,2016-04-11 07:21:00-04:00,OGE,positive
948684.0,"Barclays Maintains Equal-weight on OGE Energy, Raises PT to $28.00",2016-03-18 05:57:00-04:00,OGE,positive
948685.0,Mid-Afternoon Market Update: Scientific Games Gains Following Q4 Results; Weight Watchers Shares Dip,2016-02-26 14:25:00-05:00,OGE,positive
948686.0,Mid-Morning Market Update: Markets Open Higher; J C Penney Earnings Top Expectations,2016-02-26 10:12:00-05:00,OGE,positive
948687.0,OGE Energy Sees FY 2016 EPS $1.72-$1.83 Vs Est $1.91,2016-02-26 07:04:00-05:00,OGE,positive
948688.0,"OGE Energy Reports Q4 EPS $0.15 Vs Est $0.23, Sales $447.1M Vs Est $532.90M",2016-02-26 07:03:00-05:00,OGE,positive
948689.0,"CenterPoint Energy Announces Exploration Of Strategic Review, Offers 2016 Outlook",2016-02-01 12:49:00-05:00,OGE,positive
948690.0,"BMO Capital Terminates Market Perform Rating on OGE Energy, Removes $32.00 PT",2015-12-29 08:08:00-05:00,OGE,positive
948691.0,"Barclays Downgrades OGE Energy to Equal-weight, Lowers PT to $31.00",2015-11-07 05:41:00-05:00,OGE,positive
948692.0,Mid-Morning Market Update: Markets Decline; Humana Earnings Beat Estimates,2015-11-06 10:03:00-05:00,OGE,neutral
948693.0,OGE Energy Reports Q3 EPS $0.90 vs Est $0.92; Sees FY 2015 EPS Lower Ranger Of $1.76-$1.89 Vs Est $1.86,2015-11-05 06:53:00-05:00,OGE,neutral
948694.0,OGE Energy Raises Qtr. Dividend from $0.25 to $0.275/Share,2015-09-30 12:35:00-04:00,OGE,positive
948695.0,"Jefferies Maintains Hold on OGE Energy, Lowers PT to $31.00",2015-06-08 07:29:00-04:00,OGE,positive
948696.0,"OGE Energy Announces Chair, CEO Pete Delaney Stepped Down; Sean Trauschke Named as Replacement at CEO",2015-06-01 08:13:00-04:00,OGE,positive
948697.0,"OGE Energy's CEO Pete Delaney Steps Down, Names Sean Trauschke CEO",2015-06-01 08:06:00-04:00,OGE,neutral
948698.0,"OGE Energy Reports Q1 EPS $0.22 Vs Est $0.16, Sales $480.1M",2015-05-07 07:19:00-04:00,OGE,positive
948699.0,"Why Goldman Just Launched Sempra Energy At Buy, ITC At Sell, And 4 Other Utilities At Neutral",2015-04-14 06:34:00-04:00,OGE,positive
948700.0,"Goldman Sachs Initiates Coverage on OGE Energy at Neutral, Announces $33.00 PT",2015-04-13 06:22:00-04:00,OGE,positive
948701.0,OGE Energy Q4 EPS $0.29 vs $0.26 est,2015-02-26 07:13:00-05:00,OGE,positive
948702.0,"OGE Energy Reaffirms Q1 Dividend, Long-Term Growth Target",2015-01-26 07:46:00-05:00,OGE,positive
948703.0,OGE Energy Corp Appoints Keith Mitchell As COO of Oklahoma Gas and Electric,2015-01-07 08:46:00-05:00,OGE,positive
948704.0,"Jefferies Downgrades OGE Energy Corporation to Hold, Lowers PT to $35.50",2014-12-15 08:09:00-05:00,OGE,positive
948705.0,OGE Energy Corporation Reports Q3 EPS of $0.94 vs $0.95 Est; Revenue of $754.70M vs $746.95M Est,2014-11-05 07:12:00-05:00,OGE,positive
948706.0,TransData Licenses Wireless Smart Electric Meter Patents to Telensa Limited ,2014-10-20 07:32:00-04:00,OGE,positive
948707.0,UPDATE: Wunderlich Securities Upgrades OGE Energy Corp. As Midstream Exposure Supports Valuation Upside,2014-10-06 08:23:00-04:00,OGE,positive
948708.0,Wunderlich Upgrades OGE Energy Corporation to Buy,2014-10-06 06:13:00-04:00,OGE,positive
948709.0,Dow Down 240 Points; OMNOVA Solutions Shares Dip After Q3 Results,2014-09-25 15:35:00-04:00,OGE,positive
948710.0,NASDAQ Dips 1.5%; HB Fuller Shares Decline On Downbeat Results,2014-09-25 12:09:00-04:00,OGE,positive
948711.0,Markets Tumble; Scholastic Posts Wider Fiscal-First Quarter Loss,2014-09-25 11:12:00-04:00,OGE,negative
948712.0,Tudor Pickering Upgrades OGE Energy Corporation to Buy,2014-09-25 08:15:00-04:00,OGE,positive
948713.0,UPDATE: OGE Energy Says Plans to Raise Dividend 10%/Year Through 2019,2014-09-24 14:08:00-04:00,OGE,positive
948714.0,OGE Energy Raises Qtr. Dividend from $0.225 to $0.25/Share,2014-09-24 14:03:00-04:00,OGE,positive
948715.0,OGE Energy Names Sean Trauschke As President,2014-09-03 08:21:00-04:00,OGE,positive
948716.0,OGE Energy Corporation Reports Q2 EPS of $0.50 vs $0.51 Est; Revenue of $611.80M vs $594.55M Est,2014-08-07 07:12:00-04:00,OGE,positive
948717.0,"Barclays Reinstates Overweight on OGE Energy Corporation, Announces $41.00 PT",2014-05-21 06:35:00-04:00,OGE,negative
948718.0,"Jefferies Upgrades OGE Energy Corporation to Buy, Raises PT to $41.00",2014-05-08 06:17:00-04:00,OGE,positive
948719.0,"Wunderlich Maintains Hold on OGE Energy Corporation, Raises PT to $39.00",2014-05-02 06:30:00-04:00,OGE,positive
948720.0,OGE Energy Corporation Sees FY2014 EPS $1.94-2.06 vs $2.00 Est,2014-05-01 07:28:00-04:00,OGE,positive
948721.0,OGE Energy Corporation Reports Q1 EPS of $0.25 vs $0.23 Est; Revenue of $560.40M vs $471.50M Est,2014-05-01 07:28:00-04:00,OGE,positive
948722.0,Enable Midstream Partners Prices 25M Unit IPO at $20/Unit,2014-04-10 19:32:00-04:00,OGE,neutral
948723.0,Enable Midstream Partners Launches 25M Common Unit Initial Public Offering,2014-04-01 07:24:00-04:00,OGE,neutral
948724.0,OGE Energy Corporation Sees FY2014 EPS $1.94-2.06 vs $1.98 Est,2014-02-25 07:07:00-05:00,OGE,positive
948725.0,OGE Energy Corporation Reports Q4 EPS of $0.29 vs $0.24 Est; Revenue of $508.90M vs $468.10M Est,2014-02-25 07:07:00-05:00,OGE,positive
948726.0,KeyBanc Initiates Coverage on OGE Energy Corporation at Hold,2013-12-23 08:49:00-05:00,OGE,positive
948727.0,OGE Energy Raises Qtr. Dividend from $0.835 to $0.90/Share,2013-12-04 13:09:00-05:00,OGE,positive
948728.0,Benzinga's Top Downgrades,2013-11-27 08:39:00-05:00,OGE,positive
948729.0,UPDATE: Jefferies Downgrades OGE Energy On Low EBITDA 2014 Numbers,2013-11-27 08:30:00-05:00,OGE,neutral
948730.0,"Jefferies Downgrades OGE Energy Corporation to Hold, Lowers PT to $37.50",2013-11-27 06:27:00-05:00,OGE,positive
948731.0,OGE Energy Corporation Reports Q3 EPS of $1.08 vs $0.93 Est; Revenue of $723.20M,2013-11-06 07:05:00-05:00,OGE,positive
948732.0,Appeals Court Denies Petitions Filed by Oklahoma Gas and Electric,2013-10-31 16:45:00-04:00,OGE,negative
948733.0,"Wunderlich Maintains Hold on OGE Energy Corporation, Raises PT to $40.00",2013-08-12 08:02:00-04:00,OGE,positive
948734.0,UPDATE: Jefferies Raises PT on OGE Energy on Compliance Strategy Prep,2013-08-09 12:30:00-04:00,OGE,positive
948735.0,OGE Energy Corporation Reports Q2 EPS of $0.46 vs $0.48 Est; Revenue of $734.20M; Reaffirms Outlook,2013-08-08 07:13:00-04:00,OGE,positive
948736.0,"Jefferies Maintains Buy on OGE Energy Corporation, Lowers PT to $42.50",2013-07-24 09:29:00-04:00,OGE,positive
948737.0,UPDATE: Jefferies Upgrades OGE Energy to Buy on Two Free Earnings Options,2013-06-14 10:14:00-04:00,OGE,positive
948738.0,Benzinga's Top Upgrades,2013-06-14 07:26:00-04:00,OGE,positive
948739.0,"Jefferies Upgrades OGE Energy Corporation to Buy, Raises PT to $76.00",2013-06-14 06:42:00-04:00,OGE,positive
948740.0,Utilities ETFs Could be Vulnerable to Dividend Cuts,2013-06-07 14:29:00-04:00,OGE,negative
948741.0,Bernstein Offers List of Names in Utilities Sector Unlikely to Maintain Dividends,2013-06-07 11:53:00-04:00,OGE,neutral
948742.0,UPDATE: Jefferies Raises PT on OGE Energy Following 1Q13 EPS,2013-05-03 11:32:00-04:00,OGE,positive
948743.0,"Jefferies Maintains Hold on OGE Energy Corporation, Raises PT to $74.00",2013-05-03 07:48:00-04:00,OGE,positive
948744.0,UPDATE: Jefferies Raises PT on OGE Energy on Increased 2013-15 Estimates,2013-04-29 11:15:00-04:00,OGE,positive
948745.0,"Jefferies Maintains Hold on OGE Energy Corporation, Raises PT to $72.00",2013-04-29 09:05:00-04:00,OGE,positive
948746.0,UPDATE: Jefferies Raises PT on OGE Energy on MLP Announcement,2013-03-22 11:06:00-04:00,OGE,positive
948747.0,"Jefferies Maintains Hold on OGE Energy Corporation, Raises PT to $68.50",2013-03-22 06:51:00-04:00,OGE,positive
948748.0,Argus Research Downgrades OGE Energy Corporation to Hold,2013-03-19 07:47:00-04:00,OGE,positive
948749.0,"Wunderlich Maintains Hold on OGE Energy Corporation, Raises PT to $72.00",2013-03-18 07:12:00-04:00,OGE,positive
948750.0,"Market Wrap for Friday, March 15: Dow Snaps Winning Streak; Stocks Record Minor Losses",2013-03-15 16:16:00-04:00,OGE,positive
948751.0,"Mid-Afternoon Market Update: Markets Look Set to Break Their Streak, Great Lakes Dredge Falls",2013-03-15 15:49:00-04:00,OGE,positive
948752.0,"Wunderlich Maintains Hold on OGE Energy Corporation, Raises PT to $62.00",2013-03-15 07:07:00-04:00,OGE,positive
948753.0,"CenterPoint, OGE, Arclight to Form Midstream Partnership",2013-03-14 18:02:00-04:00,OGE,neutral
948754.0,"BMO Capital Maintains Outperform on OGE Energy Corporation, Raises PT to $63.00",2013-02-28 08:02:00-05:00,OGE,positive
948755.0,Benzinga's Top Downgrades,2013-02-28 07:54:00-05:00,OGE,positive
948756.0,UPDATE: Jefferies Downgrades OGE Energy to Hold on Lower Volume Guidance,2013-02-28 07:24:00-05:00,OGE,neutral
948757.0,"Jefferies Downgrades OGE Energy Corporation to Hold, Lowers PT to $59.00",2013-02-28 06:12:00-05:00,OGE,positive
948758.0,OGE Energy Corporation Reports Q4 EPS of $0.39 vs $0.35 Est; Revenue of $862.10M,2013-02-27 07:12:00-05:00,OGE,positive
948759.0,OGE Energy Unit Sees $10M Pretax Gain on Asset Sale,2013-01-07 16:30:00-05:00,OGE,positive
948760.0,OGE Energy Expecting FY12 EPS $3.40-3.60 vs $3.55 Est,2012-12-03 10:17:00-05:00,OGE,positive
948761.0,OGE Energy Raises Annual Dividend from $1.57 to $1.67/Share; Qtr. Dividend is $0.4175/Share,2012-11-28 15:18:00-05:00,OGE,positive
948762.0,Fluor Awarded Power Maintenance Services Contract at Multiple Sites for OG&E,2012-10-24 16:22:00-04:00,OGE,positive
948763.0,UPDATE: Jefferies Upgrades OGE Energy to Buy on Unconventional Play Option  ,2012-10-12 13:59:00-04:00,OGE,positive
948764.0,"Jefferies & Company Upgrades OGE Energy from Hold to Buy, Raises PT from $58.50 to $63.50",2012-10-12 05:59:00-04:00,OGE,positive
948765.0,"BMO Capital Markets Upgrades OGE Energy from Market Perform to Outperform, Raises PT from $58 to $61",2012-09-06 09:16:00-04:00,OGE,positive
948766.0,OGE Energy Guides FY EPS $3.40-3.60,2012-09-05 09:19:00-04:00,OGE,positive
948767.0,"UPDATE: Williams Capital Group Reiterates Buy Rating, Raises PT on OGE Energy",2012-08-15 09:20:00-04:00,OGE,positive
948768.0,"Williams Capital Group  Maintains OGE Energy at Buy, Raises PT from $55 to $60",2012-08-15 08:39:00-04:00,OGE,positive
948769.0,"Barclays Maintains OGE Energy at Overweight, Raises PT from $61 to $63",2012-08-03 14:23:00-04:00,OGE,negative
