Unnamed: 0,title,date,stock,sentiment
975744.0,UPDATE: Wunderlich Securities Lowers PT to $23 on Pacwest Bancorp ,2011-10-21 06:49:00-04:00,PACW,positive
975745.0,Wunderlich Lowers PT On PacWest Bancorp to $23,2011-10-21 05:59:00-04:00,PACW,negative
975746.0,"Keefe, Bruyette & Woods Reports PacWest Beats Street",2011-07-19 08:09:00-04:00,PACW,neutral
975748.0,Earnings Roundup,2011-07-18 09:19:00-04:00,PACW,neutral
975749.0,PacWest Bancorp Reports Q2 EPS of $0.35 vs. $0.27 Estimate,2011-07-18 09:06:00-04:00,PACW,neutral
975750.0,Earnings Scheduled For July 11,2011-07-11 04:30:00-04:00,PACW,neutral
975751.0,"Keefe, Bruyette & Woods Lowers PT on PACW ",2011-06-14 08:44:00-04:00,PACW,negative
975752.0,UPDATE: KBW Raises PT on PacWest Bancorp to $24 (PACW),2011-04-21 08:58:00-04:00,PACW,neutral
975753.0,Wunderlich Maintains Buy on Pacwest Bancorp (PACW),2011-04-21 07:33:00-04:00,PACW,neutral
975754.0,"Keefe, Bruyette & Woods Lowering Rating on PacWest To Market Perform",2011-04-05 07:48:00-04:00,PACW,negative
975755.0,Keefe Bruyette Downs PACW To Market Perform,2011-04-05 05:52:00-04:00,PACW,neutral
975756.0,Wunderlich Maintains Buy on Pacwest Bancorp (PACW),2011-01-24 08:41:00-05:00,PACW,neutral
975757.0,Sterne Agee Reiterates Neutral Rating on PacWest Bancorp (PACW),2010-11-16 10:24:00-05:00,PACW,neutral
975758.0,"DA Davidson Initiates Coverages (CMA, CYN, PACW, ZION)",2010-11-12 12:01:00-05:00,PACW,neutral
975759.0,Wunderlich Securities Reiterates PacWest Bancorp Rating,2010-10-25 10:43:00-04:00,PACW,positive
975760.0,KBW Updates Estimates And Price Target on PacWest Bancrop,2010-09-22 08:26:00-04:00,PACW,neutral
975761.0,"Wunderlich's ""Burn-Down"" Analysis",2010-09-07 10:01:00-04:00,PACW,neutral
975762.0,PacWest Bancorp Announces Quarterly Dividend of $0.01,2010-08-11 16:12:00-04:00,PACW,neutral
975763.0,Calls Sold on PacWest Bancorp (PACW),2010-07-15 10:43:00-04:00,PACW,neutral
975764.0,PacWest Bancorp Initiated With Sell,2010-04-01 09:54:00-04:00,PACW,neutral
975765.0,"Benzinga’s Top Downgrades (ANF, SATC, PACW, ZEP, SAFM)",2010-03-05 13:57:00-05:00,PACW,positive
975766.0,Sterne Agee Downgrades PacWest Bancorp (PACW) To Neutral,2010-03-05 10:29:00-05:00,PACW,neutral
