Unnamed: 0,title,date,stock,sentiment
975550.0,"Shares of several financial services companies are trading lower as markets sell off following recent strength and as investors await today's Federal Reserve decision. UPDATE: Equities spiked following the Fed's decision to leave rates unchanged, with several stocks now up for the session.",2020-06-10 10:22:00-04:00,PACW,positive
975551.0,Shares of several financial services companies are trading lower as equities sell off following recent rally. Stocks have rallied over the past week amid optimism towards the US economy reopening and investors have potentially taken some profits following run up.,2020-06-09 10:34:00-04:00,PACW,positive
975552.0,"Shares of several financial services companies are trading higher on continued optimism amid the reopening of the economy, which would increase consumer spending and economic activity.",2020-06-08 10:03:00-04:00,PACW,positive
975553.0,Shares of several financial services companies are trading higher following strong US jobs data and continued optimism amid the reopening of the economy.,2020-06-05 10:05:00-04:00,PACW,positive
975554.0,Shares of several financial services companies are trading higher as equities continue to gain on optimism over the economy reopening as well as a smaller-than-expected drop in nonfarm payrolls.,2020-06-03 10:22:00-04:00,PACW,positive
975555.0,"Shares of several financial services companies are trading higher as equities gain amid continued optimism towards a rebound in economic activity, which could lead to a potential rebound in spending and borrowing.",2020-06-01 10:57:00-04:00,PACW,positive
975556.0,Shares of several financial services companies are trading lower amid market volatility as investors await Trump's China press conference later today.,2020-05-29 11:58:00-04:00,PACW,positive
975557.0,"Shares of several financial services companies are trading higher amid economic optimism, stemming from some US states reopening businesses, an increase in mortgage demand figures and positive vaccine sentiment.",2020-05-27 09:54:00-04:00,PACW,positive
975558.0,Shares of several financial services companies are trading higher as equities gain amid coronavirus vaccine hopes as well as a pickup in economic activity as some US states reopen businesses.,2020-05-26 10:33:00-04:00,PACW,positive
975559.0,"Shares of several companies in the financial services sector are trading lower. Weakness potentially related to economic uncertainty as a result of the coronavirus pandemic, which has caused businesses to scale back  investment. US states easing lockdown restrictions has led to some investor concerns of a resurgence in cases, which could further hamper economic outlook.",2020-05-12 13:27:00-04:00,PACW,negative
975560.0,"Shares of several financial services companies are trading lower as investors weigh the effects of US states reopening their economies, which has led to concerns of a potential resurgence in coronavirus cases.",2020-05-11 10:17:00-04:00,PACW,neutral
975561.0,Shares of several global financial services companies are trading higher as equities gain after US unemployment figures came in below consensus estimates. Equities have been strong this week amid a rebound in oil prices and some US states easing lockdown restrictions.,2020-05-08 10:08:00-04:00,PACW,positive
975562.0,11 Financial Services Stocks Moving In Friday's Pre-Market Session,2020-05-01 07:39:00-04:00,PACW,neutral
975563.0,Shares of several global financial services companies are trading lower amid market weakness following US jobless claims and consumer spending data.,2020-04-30 09:57:00-04:00,PACW,negative
975564.0,"JMP Securities Maintains Market Outperform on PacWest Banc, Lowers Price Target to $23",2020-04-23 12:31:00-04:00,PACW,positive
975565.0,"Wedbush Maintains Neutral on PacWest Banc, Lowers Price Target to $19",2020-04-22 11:17:00-04:00,PACW,negative
975566.0,"RBC Capital Maintains Outperform on PacWest Banc, Lowers Price Target to $21",2020-04-22 08:00:00-04:00,PACW,negative
975567.0,PacWest Bancorp shares are trading lower after the company reported Q1 earnings results.,2020-04-21 09:23:00-04:00,PACW,neutral
975568.0,PacWest Banc Q1 EPS $(12.230) vs $0.920 YoY,2020-04-21 07:11:00-04:00,PACW,neutral
975569.0,"Shares of several banks and financial services companies are trading lower as equities dip amid mixed earnings results from banks, a significant decline in the price of oil and worse than expected retail sales in March.",2020-04-15 11:08:00-04:00,PACW,negative
975570.0,Shares of several banks and financial services companies are trading lower amid market weakness as macro concerns continue to grow as a result of the coronavirus pandemic. The coronavirus has led to lower investment and economic activity across sectors.,2020-04-01 10:08:00-04:00,PACW,negative
975571.0,"Shares of several financial services and global banks companies are trading lower, selling off from this week's strength. While the US stimulus legislation has boosted economic optimism, demand concerns still exist amid the coronavirus outbreak.",2020-03-27 09:36:00-04:00,PACW,positive
975572.0,Shares of several financial services and global banks companies are trading higher after the Senate passed a $2 trillion stimulus package in relief to the coronavirus outbreak.,2020-03-26 09:39:00-04:00,PACW,positive
975573.0,PacWest Bancorp Temporarily Halts Buyback,2020-03-23 16:46:00-04:00,PACW,neutral
975574.0,PacWest Bancorp Announces Temporary Halt To Buyback,2020-03-23 16:45:00-04:00,PACW,neutral
975575.0,Stocks That Hit 52-Week Lows On Thursday,2020-03-19 10:49:00-04:00,PACW,negative
975576.0,Stocks That Hit 52-Week Lows On Thursday,2020-03-12 12:10:00-04:00,PACW,negative
975577.0,"Shares of several global banks and financial services companies are trading lower as global concerns of the coronavirus continue to grow. The sector has been negatively impacted, as the virus has disrupted economic conditions and hampered growth outlook.",2020-03-12 11:22:00-04:00,PACW,positive
975578.0,Stocks That Hit 52-Week Lows On Wednesday,2020-03-11 11:41:00-04:00,PACW,negative
975579.0,"Shares of several financial services companies are trading lower as global concerns of the coronavirus continue to grow. The sector has been negatively impacted, as the virus has disrupted economic conditions and hampered growth outlook.",2020-03-11 06:41:00-04:00,PACW,positive
975580.0,Stocks That Hit 52-Week Lows On Friday,2020-03-06 11:22:00-05:00,PACW,negative
975581.0,Stocks That Hit 52-Week Lows On Wednesday,2020-03-04 11:12:00-05:00,PACW,negative
975582.0,Stocks That Hit 52-Week Lows On Friday,2020-02-28 10:16:00-05:00,PACW,negative
975583.0,"BMO Capital Maintains Market Perform on PacWest Banc, Lowers Price Target to $37",2020-01-22 10:29:00-05:00,PACW,negative
975584.0,"PacWest Banc Q4 EPS $0.98 Up From $0.93 YoY, Sales $273.795M Down From $295.291M YoY",2020-01-21 07:12:00-05:00,PACW,neutral
975585.0,PacWest Banc Q3 EPS $0.92 Down From $0.94 YoY,2019-10-16 07:02:00-04:00,PACW,neutral
975586.0,"SunTrust Robinson Humphrey Maintains Hold on PacWest Banc, Lowers Price Target to $39",2019-10-03 08:55:00-04:00,PACW,negative
975587.0,"Benzinga's Top Upgrades, Downgrades For August 23, 2019",2019-08-23 09:56:00-04:00,PACW,positive
975588.0,"RBC Capital Initiates Coverage On PacWest Banc with Outperform Rating, Announces $40 Price Target",2019-08-23 06:29:00-04:00,PACW,neutral
975589.0,PacWest Banc Q2 EPS $1.07 Beats $0.94 Estimate,2019-07-16 07:02:00-04:00,PACW,neutral
975590.0,"UPDATE: Raymond James Downgrades 6 Banks As Firm Notes 'We are cutting our EPS estimates for nearly all banks within our collective coverage universe, which primarily reflects a reduction in our NIM and loan growth projections'",2019-07-08 09:57:00-04:00,PACW,positive
975591.0,Raymond James Downgrades PacWest Banc to Market Perform,2019-07-08 08:21:00-04:00,PACW,neutral
975592.0,PacWest Bancorp Names Mark Yung COO,2019-04-24 16:00:00-04:00,PACW,neutral
975593.0,PacWest Banc Q1 EPS $0.92 Beats $0.91 Estimate,2019-04-16 07:06:00-04:00,PACW,neutral
975594.0,"Jim Cramer Shares His Thoughts On Aurora Cannabis, Electronic Arts, Yeti And More",2019-04-11 07:41:00-04:00,PACW,positive
975595.0,10 Biggest Price Target Changes For Monday,2019-02-25 09:53:00-05:00,PACW,neutral
975596.0,"Keefe Bruyette & Woods Downgrades PacWest Banc to Market Perform, Lowers Price Target to $45",2019-02-25 06:43:00-05:00,PACW,negative
975597.0,"Stocks Which Will Be Trading Ex Dividend Tues., Feb. 19, 2019",2019-02-15 11:18:00-05:00,PACW,neutral
975598.0,PacWest Bancorp Q4 EPS $0.93 Beats $0.92 Estimate,2019-01-17 07:05:00-05:00,PACW,neutral
975599.0,PacWest Bancorp Reports Termination Of Pending Purchase Deal With El Dorado Savings Bank,2019-01-09 17:00:00-05:00,PACW,neutral
975600.0,"Stocks Which Set New 52-Week Low Yesterday, Thurs., Dec. 13, 2018",2018-12-14 11:03:00-05:00,PACW,negative
975601.0,"Jim Cramer Shares His Thoughts On CyrusOne, US Steel And More",2018-12-13 07:36:00-05:00,PACW,positive
975602.0,"Stocks Which Set New 52-Week Low The Last Trading Session, Fri., Dec. 7, 2018",2018-12-10 11:01:00-05:00,PACW,negative
975603.0,"Stocks Trading Ex Dividend For Mon., Nov. 19, 2018",2018-11-19 10:13:00-05:00,PACW,neutral
975604.0,"Stocks That Will Trade Ex Dividend Mon., Nov. 19, 2018",2018-11-16 10:35:00-05:00,PACW,neutral
975605.0,"Stocks Which Set New 52-Week Low Yesterday, October 22nd",2018-10-23 09:54:00-04:00,PACW,negative
975606.0,PacWest Banc Q3 EPS $0.94 Beats $0.92 Estimate,2018-10-16 07:02:00-04:00,PACW,neutral
975607.0,PacWest Bancorp To Acquire El Dorado Savings Bank For Approximately $466.7M,2018-09-12 08:08:00-04:00,PACW,neutral
975608.0,UPDATE: El Dorado Shareholders Will Receive 58.2209 Shares Of PacWest Common Stock And $472.92 In Cash For Each El Dorado Share,2018-09-12 08:05:00-04:00,PACW,positive
975609.0,"PacWest Bancorp, El Dorado Savings Bank Report ~$466.7M Merger",2018-09-12 08:05:00-04:00,PACW,neutral
975610.0,"Stocks Trading Ex Dividend Today, August 17th",2018-08-17 09:57:00-04:00,PACW,neutral
975611.0,"Stocks That Will Be Trading Ex Dividend Tomorrow, August 17th",2018-08-16 09:32:00-04:00,PACW,neutral
975612.0,"PacWest Banc Q2 EPS $0.92 Beats $0.88 Estimate, Sales $288.51M Miss $292.33M Estimate",2018-07-17 07:16:00-04:00,PACW,negative
975613.0,"Zurex Pharma, Inc. Announces Capital Raise Of $9M In Advance Of Pending New Drug Application Submission",2018-06-12 08:04:00-04:00,PACW,neutral
975614.0,PacWest Bancorp Raises Qtr. Dividend From $0.50 To $0.60/Share,2018-04-24 16:40:00-04:00,PACW,neutral
975615.0,"Pacwest Bancorp Reports Q1 EPS $0.93 Beats $0.80 Est., Sales $295.06M Beats $286.46M Est.",2018-04-17 07:03:00-04:00,PACW,neutral
975616.0,Raymond James Upgrades PacWest Banc to Strong Buy,2018-04-10 09:07:00-04:00,PACW,positive
975617.0,"PacWest Bancorp Reports Q4 EPS $0.66 vs $0.74 Est., Sales $289.75M vs $291.39M Est.",2018-01-18 07:02:00-05:00,PACW,neutral
975618.0,Stephens' Analysts Present Their Best Ideas For 2018,2018-01-02 14:19:00-05:00,PACW,positive
975619.0,Pacific Western Bank Increases Hourly Minimum Wage to $15,2017-12-26 12:49:00-05:00,PACW,neutral
975620.0,"PacWest Bancorp Announces Loan Portfolio Sale With An Aggregate Carrying Value Of $1.49B as Of Nov. 30th, Expects To Recognize Pre-Tax Gain Of ~$13M; Also Expects To Sell Additional Portfolio With ~$152M Balance",2017-12-11 07:31:00-05:00,PACW,positive
975621.0,PacWest Bancorp 8-K Shows Board Reduced Buyback Plan To $150M,2017-11-16 16:45:00-05:00,PACW,neutral
975622.0,Raymond James Downgrades PacWest Banc to Market Perform,2017-11-01 08:50:00-04:00,PACW,neutral
975623.0,"Benzinga's Top Upgrades, Downgrades For October 18, 2017",2017-10-18 09:28:00-04:00,PACW,positive
975624.0,FBR Capital Downgrades PacWest Banc to Neutral,2017-10-18 07:57:00-04:00,PACW,neutral
975625.0,"PacWest Bancorp Q3 EPS $0.84 vs $0.75 Est., Sales $273.07M vs $279.72M Est.",2017-10-17 07:01:00-04:00,PACW,neutral
975626.0,"SunTrust Robinson Humphrey Initiates Coverage On PacWest Banc with Hold Rating, Announces $49.00 Price Target",2017-08-18 06:01:00-04:00,PACW,neutral
975627.0,"PacWest Q2 EPS $0.77 vs $0.71 Est., Sales $277.76 vs $271.80M Est",2017-07-18 07:01:00-04:00,PACW,neutral
975628.0,"Wedbush Initiates Coverage On PacWest Banc with Neutral Rating, Announces $49.00 Price Target",2017-06-28 07:26:00-04:00,PACW,neutral
975629.0,Stephens & Co. Upgrades PacWest Banc to Overweight,2017-04-24 09:34:00-04:00,PACW,negative
975630.0,"PacWest Bancorp Q1 EPS $0.65 vs $0.72 Est, Sales $252.84M vs $271.89M Est, May Not Compare",2017-04-17 07:01:00-04:00,PACW,neutral
975631.0,"Benzinga's Top Upgrades, Downgrades For April 6, 2017",2017-04-06 09:28:00-04:00,PACW,positive
975632.0,Raymond James Upgrades PacWest Banc to Strong Buy,2017-04-06 08:20:00-04:00,PACW,positive
975633.0,A Peek Into The Markets: U.S. Stock Futures Up Ahead Of Jobless Claims Report,2017-04-06 07:35:00-04:00,PACW,neutral
975634.0,"PacWest Bancorp, CU Bancorp Announce Signing of Merger in Deal Valued at ~$705M",2017-04-06 06:32:00-04:00,PACW,positive
975635.0,PacWest Bancorp Reports Q4 EPS $0.71 vs. Est. $0.71,2017-01-19 07:02:00-05:00,PACW,neutral
975636.0,"Raymond James Initiates Coverage On PacWest Banc at Outperform, Announces $57.00 Target",2016-12-06 17:19:00-05:00,PACW,neutral
975637.0,PacWest Bancorp Reports Q3 EPS $0.77 vs $0.71 Est.,2016-10-18 07:02:00-04:00,PACW,neutral
975638.0,"Netflix CEO Reed Hastings Says,",2016-10-18 07:01:00-04:00,PACW,neutral
975639.0,Benzinga's Top Downgrades,2016-10-04 09:02:00-04:00,PACW,positive
975640.0,Wells Fargo Downgrades PacWest Banc to Market Perform,2016-10-04 06:29:00-04:00,PACW,positive
975641.0,"PacWest Bancorp Enters Agreement to Sell 2 Retail Branches, No Terms Disclosed",2016-10-03 16:36:00-04:00,PACW,positive
975642.0,JMP Securities Initiates Coverage on PacWest Banc at Market Outperform,2016-09-16 08:53:00-04:00,PACW,positive
975643.0,PacWest Downgraded To Neutral By D.A. Davidson,2016-07-18 10:44:00-04:00,PACW,neutral
975644.0,DA Davidson Downgrades PacWest Banc to Neutral,2016-07-18 06:41:00-04:00,PACW,neutral
975645.0,"Bank Earnings Blitz: PNC, UBS, Citigroup And Wells Fargo Deliver Solid Numbers",2016-07-15 10:38:00-04:00,PACW,positive
975646.0,"PacWest Q2 EPS $0.68 vs $0.69 est, Revenue $255.9M vs $264.9M est",2016-07-15 07:02:00-04:00,PACW,neutral
975647.0,PacWest Bancorp Reports Q1 EPS $0.74 vs $0.70 Est.,2016-04-14 07:07:00-04:00,PACW,neutral
975648.0,Cramer Says Sell These 'Completely Untouchable' Stocks,2016-02-10 17:52:00-05:00,PACW,neutral
975649.0,PacWest Bancorp. Reports Q4 EPS $0.70 vs. Est. $0.67,2016-01-21 07:02:00-05:00,PACW,neutral
975650.0,BMO Capital Downgrades PacWest Banc to Market Perform,2016-01-14 09:11:00-05:00,PACW,neutral
975651.0,Wells Fargo Initiates Coverage on PacWest Banc at Outperform,2015-12-21 08:09:00-05:00,PACW,positive
975652.0,Biotechs Among Stocks That Insiders Have Been Buying Lately,2015-11-02 11:53:00-05:00,PACW,neutral
975653.0,Pacwest Bancorp Q3 EPS $0.63 vs $0.71 est,2015-10-15 07:01:00-04:00,PACW,neutral
975654.0,Benzinga's Top Initiations,2015-10-13 10:08:00-04:00,PACW,positive
975655.0,"Piper Jaffray Initiates Coverage on PacWest Banc at Overweight, Announces $51.00 PT",2015-10-13 07:58:00-04:00,PACW,negative
975656.0,Top 4 NASDAQ Stocks In The Regional-Pacific Banks Industry With The Highest Revenue,2015-09-14 04:41:00-04:00,PACW,positive
975657.0,PacWest Bancorp Reports Q2 EPS $0.70 vs. Est. $0.70,2015-07-15 07:01:00-04:00,PACW,neutral
975658.0,KBW Says These Community Banks Could Challenge The Big Guys,2015-06-05 08:59:00-04:00,PACW,positive
975659.0,Top 4 NASDAQ Stocks In The Regional-Pacific Banks Industry With The Highest Revenue,2015-06-05 04:25:00-04:00,PACW,positive
975660.0,Benzinga's Top Initiations,2015-05-26 09:38:00-04:00,PACW,positive
975661.0,"BMO Capital Initiates Coverage on PacWest Banc at Outperform, Announces $51.00 PT",2015-05-26 05:53:00-04:00,PACW,neutral
975662.0,"PacWest Reports Q1 EPS $0.61 vs. Est. $0.68, Rev. $219.946M Vs. Est. $209.63M",2015-04-16 07:05:00-04:00,PACW,neutral
975663.0,"PacWest Bancorp Names Patrick J. Rusnak as New CFO, Replacing Victor R. Santoro;",2015-04-14 06:31:00-04:00,PACW,neutral
975664.0,"Worst Performing Industries For March 23, 2015",2015-03-23 12:07:00-04:00,PACW,negative
975665.0,Top 4 NASDAQ Stocks In The Regional-Pacific Banks Industry With The Highest Revenue,2015-03-06 04:56:00-05:00,PACW,positive
975666.0,"'Merger Monday' Lives Up To Name: From NXP Semiconductors To eBay, There's At Least $20 Billon In Total Deals",2015-03-02 13:19:00-05:00,PACW,neutral
975667.0,PacWest Bancorp to Acquire Square 1 Financial in Deal Valued at ~$849M,2015-03-02 06:35:00-05:00,PACW,positive
975668.0,"Keefe, Bruyette & Woods Slashes Earnings Estimates For 16 Financial Stocks",2015-01-30 15:32:00-05:00,PACW,negative
975669.0,PacWest Reports Q4 Adj. EPS $0.66 vs $0.70 Est.,2015-01-22 07:14:00-05:00,PACW,neutral
975670.0,PacWest Bancorp Reports Q4 EPS from Cont. Ops. $0.69,2015-01-22 07:02:00-05:00,PACW,neutral
975671.0,6 Images Every Regional Bank Investor Should See,2015-01-06 11:19:00-05:00,PACW,neutral
975672.0,"Wunderlich Securities Offers 2015 Banking Outlook: Growth, M&A And Potentially Higher Rates",2014-12-12 10:23:00-05:00,PACW,positive
975673.0,PacWest Bancorp Increases Qtr. Dividend From $0.25/share To $0.50/share ,2014-11-05 11:52:00-05:00,PACW,neutral
975674.0,PacWest Bancorp Reports Q3 EPS of $0.66 vs $0.71 Est,2014-10-22 07:02:00-04:00,PACW,neutral
975675.0,"FBR Capital Reiterates Outperform on PacWest Bancorp, Raises PT to $50.00",2014-09-09 08:25:00-04:00,PACW,neutral
975676.0,PacWest Bancorp Reports Q2 EPS of $0.64 vs $0.62 Est,2014-07-22 07:07:00-04:00,PACW,neutral
975677.0,UPDATE: D.A. Davidson & Co. Upgrades PacWest Bancorp Following CSE Deal Close,2014-06-02 10:41:00-04:00,PACW,neutral
975678.0,"DA Davidson Upgrades PacWest Bancorp to Buy, Raises PT to $47.00",2014-06-02 09:29:00-04:00,PACW,neutral
975679.0,Benzinga's Top Upgrades,2014-05-12 07:55:00-04:00,PACW,positive
975680.0,"FBR Capital Upgrades PacWest Bancorp to Outperform, Maintains $47.00 PT",2014-05-12 06:29:00-04:00,PACW,neutral
975681.0,PacWest Bancorp Reports Q1 EPS of $0.55 vs $0.48 Est; Revenue of $90.70M vs $106.66M Est,2014-04-23 09:02:00-04:00,PACW,neutral
975682.0,PacWest Bancorp Reports Q1 EPS from Cont. Ops. $0.57,2014-04-23 09:02:00-04:00,PACW,neutral
975683.0,"PacWest Will Join S&P MidCap 400, Mantech to Join SmallCap 600",2014-04-02 17:17:00-04:00,PACW,positive
975684.0,"PacWEst, CapitalSource Update on Timing of Deal: See Merger Consummated 'Promptly Following Receipt of Requisite Approval'",2014-03-25 17:38:00-04:00,PACW,positive
975685.0,11 Undervalued US Stocks For 2014: Investment Idea Of The Day,2014-01-30 14:31:00-05:00,PACW,neutral
975686.0,"Dawson James Maintains Neutral on PacWest Bancorp, Raises PT to $45.00",2014-01-24 06:36:00-05:00,PACW,neutral
975687.0,Stocks Hitting 52-Week Highs,2014-01-09 10:23:00-05:00,PACW,neutral
975688.0,Benzinga's Top Upgrades,2014-01-07 07:52:00-05:00,PACW,positive
975689.0,"Evercore Partners Upgrades PacWest Bancorp to Overweight, Raises PT to $46.00",2014-01-07 07:45:00-05:00,PACW,negative
975690.0,PacWest Bancorp Reports Q3 EPS of $0.53 vs $0.49 Est; Revenue of $87.40M vs $83.76M Est,2013-10-23 09:01:00-04:00,PACW,neutral
975691.0,Keefe Bruyette & Woods Upgrades PacWest Bancorp to Outperform,2013-09-23 06:23:00-04:00,PACW,neutral
975692.0,Sterne Agee Reiterates Buy on PacWest Bancorp Following CSE Merger Announcement,2013-08-30 11:40:00-04:00,PACW,neutral
975693.0,"Wunderlich Maintains Buy on PacWest Bancorp, Raises PT to $42.00",2013-07-25 07:22:00-04:00,PACW,neutral
975694.0,"Market Wrap for Tuesday, July 23: Stocks Close Mixed as Investors Focus on Earnings ",2013-07-23 16:19:00-04:00,PACW,neutral
975695.0,Mid-Afternoon Market Update: Domino's Pizza Tumbles on Earnings as Array Rises,2013-07-23 15:36:00-04:00,PACW,neutral
975696.0,"Mid-Day Market Update: Sourcefire Surges On Acquisition News, STMicroelectronics Shares Fall",2013-07-23 12:29:00-04:00,PACW,positive
975697.0,"Mid-Morning Market Update: Markets Mixed, DuPont Posts Upbeat Q2 Profit",2013-07-23 10:21:00-04:00,PACW,positive
975698.0,"Citi Sees Low Chance of Another Bidder for CapitalSource Following PacWest Bid, Maintains Buy Rating",2013-07-23 10:19:00-04:00,PACW,neutral
975699.0,PacWest Bancorp Reports Q2 EPS of $0.39 vs $0.46 Est; Revenue of $68.70M vs $78.67M Est,2013-07-23 09:05:00-04:00,PACW,neutral
975700.0,"UPDATE: PacWest, CapitalSource Report Merger Valued at ~$2.3B",2013-07-22 17:51:00-04:00,PACW,positive
975701.0,"Pacwest Bancorp, CapitalSource Announce Merger, CapitalSource Holders to Get $2.47/Share in Cash, 0.2837 Shares of PACW, Deal Valued at ~$2.3B",2013-07-22 17:35:00-04:00,PACW,positive
975702.0,Benzinga's Top Downgrades,2013-05-30 07:58:00-04:00,PACW,positive
975703.0,Keefe Bruyette & Woods Downgrades PacWest Bancorp to Market Perform,2013-05-30 06:19:00-04:00,PACW,neutral
975704.0,PacWest Bancorp Reports Q1 EPS of $0.37 vs $0.49 Est; Revenue of $68.50M vs $74.72M Est,2013-04-17 09:01:00-04:00,PACW,neutral
975705.0,UPDATE: D.A. Davidson Downgrades PacWest Bancorp to Neutral Pending Acquisition of First California Financial,2013-02-06 10:24:00-05:00,PACW,neutral
975706.0,"DA Davidson Downgrades PacWest Bancorp to Neutral, Maintains $30.00 PT",2013-02-06 08:02:00-05:00,PACW,neutral
975707.0,"DA Davidson Maintains Buy on PacWest Bancorp, Raises PT to $30.00",2013-01-17 06:45:00-05:00,PACW,neutral
975708.0,PacWest Bancorp Reports Q4 EPS of $0.54 vs $0.49 Est,2013-01-16 09:04:00-05:00,PACW,neutral
975709.0,"From Earlier: Evercore Initiates Coverage on PacWest Bancorp at Equal-weight, Announces $27.00 PT",2012-12-20 09:49:00-05:00,PACW,neutral
975710.0,UPDATE: Wunderlich Securities Upgrades PacWest Bancorp to Buy on Accretive Acquisition  ,2012-11-14 07:05:00-05:00,PACW,positive
975711.0,Benzinga's Top Upgrades,2012-11-14 06:58:00-05:00,PACW,positive
975712.0,"Wunderlich Securities Upgrades PacWest Bancorp from Hold to Buy, Raises PT from $25 to $29",2012-11-14 06:04:00-05:00,PACW,positive
975713.0,"DA Davidson Maintains PacWest Bancorp at Buy, Raises PT from $27 to $29",2012-11-07 08:40:00-05:00,PACW,neutral
975714.0,PacWest Bancorp to Acquire First California Financial Group for $8.00/Share,2012-11-06 19:44:00-05:00,PACW,neutral
975715.0,UPDATE: DA Davidson Upgrades PacWest Bancorp to Buy on Risk Profile  ,2012-10-18 07:26:00-04:00,PACW,negative
975716.0,DA Davidson Upgrades PacWest Bancorp from Neutral to Buy,2012-10-18 07:13:00-04:00,PACW,neutral
975717.0,Keefe Bruyette & Woods Upgrades PacWest Bancorp from Market Perform to Outperform,2012-10-18 05:51:00-04:00,PACW,neutral
975718.0,PacWest Bancorp Reports Q3 EPS $0.43 vs $0.45 Est,2012-10-17 09:01:00-04:00,PACW,neutral
975719.0,Opus Bank Completes Acquisition of Ten Banking Offices from Pacific Western Bank ,2012-09-24 07:09:00-04:00,PACW,neutral
975720.0,Benzinga's Top Upgrades,2012-09-11 07:20:00-04:00,PACW,positive
975721.0,Macquarie Upgrades PacWest Bancorp from Neutral to Outperform,2012-09-11 06:28:00-04:00,PACW,neutral
975722.0,Opus Bank Receives Regulatory Approval for Its Acquisition of Ten Banking Offices from Pacific Western Bank ,2012-09-06 07:04:00-04:00,PACW,positive
975723.0,UPDATE: Sterne Agee Upgrades PacWest Bancorp from Neutral to Buy,2012-08-02 09:02:00-04:00,PACW,neutral
975724.0,Pacific Western Bank and Opus Bank Sign Definitive Agreement to Sell 10 Branch Offices to Opus Bank ,2012-07-09 09:05:00-04:00,PACW,positive
975725.0,From Earlier: PacWest Bancorp Discloses Proposal to Acquire First California Financial Group in an All-Stock Merger for $7.25 Per Share  ,2012-05-10 07:56:00-04:00,PACW,positive
975726.0,UPDATE: Sterne Agee Raises PacWest's PT,2012-05-02 08:42:00-04:00,PACW,neutral
975727.0,"Sterne Agee Maintains PacWest Bancorp at Neutral, Raises PT from $25 to $28",2012-05-02 08:04:00-04:00,PACW,neutral
975728.0,"Wunderlich Securities Reiterates Hold, $23 PT on PacWest Bancorp ",2012-04-19 06:56:00-04:00,PACW,positive
975729.0,"Sterne Agee Maintains PacWest Bancorp at Neutral, Raises PT from $24 to $25",2012-04-19 06:52:00-04:00,PACW,neutral
975730.0,"UPDATE: Wunderlich Securities Maintains PacWest Bancorp Hold, $23 PT",2012-04-18 15:54:00-04:00,PACW,positive
975731.0,"D.A. Davidson Maintains PacWest Bancorp at Neutral, Lowers PT from $26 to $25",2012-04-18 15:50:00-04:00,PACW,negative
975732.0,"Wunderlich Securities Maintains PacWest Bancorp at Hold, PT at $23",2012-04-18 15:46:00-04:00,PACW,positive
975733.0,PacWest Bancorp Reports Q1  Revenues $70.9M vs $71.20M Est,2012-04-18 09:02:00-04:00,PACW,neutral
975734.0,Top 4 Small-Cap Stocks In The Regional-Pacific Banks Industry With The Lowest PEG Ratio,2012-03-20 04:26:00-04:00,PACW,negative
975735.0,UPDATE: Wunderlich Securities Downgrades PacWest Bancorp to Hold,2012-02-24 09:51:00-05:00,PACW,positive
975736.0,"Wunderlich Securities Downgrades PacWest Bancorp from Buy to Hold, Maintains PT at $23",2012-02-24 06:06:00-05:00,PACW,positive
975737.0,UPDATE: Sterne Agee Raises Price Target on PacWest Bancorp to $24,2012-01-19 07:20:00-05:00,PACW,neutral
975738.0,PacWest Bancorp Reports Q4 EPS $0.38 vs $0.39 Est; Revenues $72M vs $70.20M Est 			,2012-01-19 06:48:00-05:00,PACW,neutral
975739.0,Pacwest Bancorp Reports Q4 EPS $0.38 vs $0.39 Est,2012-01-18 09:01:00-05:00,PACW,neutral
975740.0,PacWest Bancorp Acquires Marquette Equipment Finance,2012-01-03 16:30:00-05:00,PACW,neutral
975741.0,UPDATE: Keefe Bruyette & Woods Upgrades PacWest Bancorp to Outperform,2012-01-03 15:18:00-05:00,PACW,neutral
975742.0,"Keefe, Bruyette & Woods Upgrades PacWest to Outperform",2012-01-03 07:36:00-05:00,PACW,neutral
975743.0,Pacwest Announces Quarterly Dividend of $0.18 Per Share,2011-11-07 17:54:00-05:00,PACW,positive
