Unnamed: 0,title,date,stock,sentiment
1008594.0,"Shares of several consumer discretionary companies are trading lower following an increase in coronavirus cases in some US states that have reopened, leading to concerns of a second wave of the virus. A potential second wave could keep discretionary spending and economic activity low.",2020-06-11 10:41:00-04:00,PHM,positive
1008595.0,"Benzinga's Top Upgrades, Downgrades For June 11, 2020",2020-06-11 09:38:00-04:00,PHM,positive
1008596.0,"JP Morgan Upgrades PulteGroup to Overweight, Announces $41 Price Target",2020-06-11 07:32:00-04:00,PHM,neutral
1008597.0,"Shares of several consumer discretionary companies are trading higher following strong US jobs data and continued optimism amid the reopening of the economy. As the economy reopens, consumer spending should increase.",2020-06-05 10:31:00-04:00,PHM,positive
1008598.0,"Benzinga's Top Upgrades, Downgrades For May 28, 2020",2020-05-28 10:07:00-04:00,PHM,positive
1008599.0,"Credit Suisse Initiates Coverage On PulteGroup with Neutral Rating, Announces Price Target of $36",2020-05-28 08:24:00-04:00,PHM,positive
1008600.0,"Who Could Win, Lose As US Homebuilding Starts Decline: Home Depot 'Performing Well' During Coronavirus Crisis",2020-05-19 11:25:00-04:00,PHM,negative
1008601.0,KeyBanc Downgrades PulteGroup to Sector Weight,2020-05-15 06:21:00-04:00,PHM,neutral
1008602.0,"JP Morgan Maintains Neutral on PulteGroup, Raises Price Target to $28",2020-05-12 10:57:00-04:00,PHM,positive
1008603.0,"SunTrust Robinson Humphrey Maintains Hold on PulteGroup, Raises Price Target to $32",2020-05-12 09:27:00-04:00,PHM,neutral
1008604.0,"Barron's Picks And Pans: Boyd Gaming, Domino's Pizza, Exxon And More",2020-05-09 15:06:00-04:00,PHM,neutral
1008605.0,"Wells Fargo Maintains Equal-Weight on PulteGroup, Lowers Price Target to $25",2020-04-24 08:54:00-04:00,PHM,positive
1008606.0,"CFRA Maintains Hold on PulteGroup, Raises Price Target to $29",2020-04-23 11:20:00-04:00,PHM,neutral
1008607.0,From PulteGroup Earnings Conference Call: Co. Seeing Minimal Cancellation From Most Buyers,2020-04-23 08:55:00-04:00,PHM,neutral
1008608.0,"PulteGroup Q1 EPS $0.740 Beats $0.700 Estimate, Sales $2.295B Miss $2.310B Estimate",2020-04-23 06:31:00-04:00,PHM,negative
1008609.0,"Earnings Scheduled For April 23, 2020",2020-04-23 04:23:00-04:00,PHM,neutral
1008610.0,"Benzinga's Top Upgrades, Downgrades For April 15, 2020",2020-04-15 09:39:00-04:00,PHM,positive
1008611.0,Citigroup Initiates Coverage On PulteGroup with Buy Rating,2020-04-15 07:21:00-04:00,PHM,neutral
1008612.0,"JP Morgan Downgrades PulteGroup to Neutral, Announces $25.5 Price Target",2020-03-18 05:39:00-04:00,PHM,positive
1008613.0,"Shares of several consumer goods and retail companies are trading lower as global markets continue to experience pressure amid the coronavirus spread, which has negatively impacted companies across sectors.",2020-03-11 08:52:00-04:00,PHM,negative
1008614.0,"Coronavirus Economic Turmoil A Silver Lining For Home Buyers, Builders",2020-03-04 14:43:00-05:00,PHM,negative
1008615.0,"Susquehanna Upgrades PulteGroup to Positive, Raises Price Target to $51",2020-03-03 10:11:00-05:00,PHM,positive
1008616.0,"Benzinga's Top Upgrades, Downgrades For February 26, 2020",2020-02-26 10:02:00-05:00,PHM,positive
1008617.0,"SunTrust Robinson Humphrey Downgrades PulteGroup to Hold, Announces $45 Price Target",2020-02-26 06:02:00-05:00,PHM,neutral
1008618.0,Stocks That Hit 52-Week Highs On Wednesday,2020-02-19 10:32:00-05:00,PHM,neutral
1008619.0,PulteGroup shares are trading lower despite the company reporting better-than-expected Q4 earnings results.,2020-01-29 10:50:00-05:00,PHM,neutral
1008620.0,"Wells Fargo Maintains Equal-Weight on PulteGroup, Raises Price Target to $50",2020-01-29 08:26:00-05:00,PHM,positive
1008621.0,10 Biggest Price Target Changes For Wednesday,2020-01-29 08:11:00-05:00,PHM,neutral
1008622.0,"RBC Capital Maintains Sector Perform on PulteGroup, Raises Price Target to $44",2020-01-29 08:06:00-05:00,PHM,neutral
1008623.0,"KeyBanc Maintains Overweight on PulteGroup, Raises Price Target to $52",2020-01-29 05:58:00-05:00,PHM,negative
1008624.0,Stocks That Hit 52-Week Highs On Tuesday,2020-01-28 11:05:00-05:00,PHM,neutral
1008625.0,PulteGroup shares are trading higher after the company announced better-than-expected Q4 EPS and sales results.,2020-01-28 10:14:00-05:00,PHM,positive
1008626.0,"Benzinga's Top Upgrades, Downgrades For January 28, 2020",2020-01-28 09:43:00-05:00,PHM,positive
1008627.0,Tuesday's Market Minute: Earnings Snapshot,2020-01-28 09:26:00-05:00,PHM,neutral
1008628.0,10 Biggest Price Target Changes For Tuesday,2020-01-28 08:45:00-05:00,PHM,neutral
1008629.0,"PulteGroup Acquires Innovative Construction Group, Terms Not Disclosed",2020-01-28 06:41:00-05:00,PHM,positive
1008630.0,"PulteGroup Q4 EPS $1.14 Beats $1.09 Estimate, Sales $3.017B Beat $2.98B Estimate",2020-01-28 06:40:00-05:00,PHM,neutral
1008631.0,"Evercore ISI Group Upgrades PulteGroup to Outperform, Raises Price Target to $49",2020-01-28 06:28:00-05:00,PHM,neutral
1008632.0,"Earnings Scheduled For January 28, 2020",2020-01-28 04:00:00-05:00,PHM,neutral
1008633.0,Q4 Earnings Preview: PulteGroup,2020-01-27 13:09:00-05:00,PHM,neutral
1008634.0,"Benzinga Pro's Top 5 Stocks To Watch For Mon., Jan. 27, 2020: DHI, NIO, JNPR, CODX, WHR",2020-01-27 09:06:00-05:00,PHM,positive
1008635.0,Stocks That Hit 52-Week Highs On Friday,2020-01-24 10:41:00-05:00,PHM,neutral
1008636.0,Stocks That Hit 52-Week Highs On Wednesday,2020-01-22 10:17:00-05:00,PHM,neutral
1008637.0,Stocks That Hit 52-Week Highs On Tuesday,2020-01-21 10:11:00-05:00,PHM,neutral
1008638.0,Stocks That Hit 52-Week Highs On Friday,2020-01-17 13:23:00-05:00,PHM,neutral
1008639.0,Stocks That Hit 52-Week Highs On Wednesday,2020-01-15 13:14:00-05:00,PHM,neutral
1008640.0,"Benzinga's Top Upgrades, Downgrades For January 7, 2020",2020-01-07 11:17:00-05:00,PHM,positive
1008641.0,"Bank of America Upgrades PulteGroup to Neutral, Announces $44 Price Target",2020-01-07 08:39:00-05:00,PHM,neutral
1008642.0,"UPDATE: Goldman Initiates PulteGroup With Buy, $45 Target Notes 'as we look for it to gradually increase its exposure to the first-time buyer while maintaining its peer-leading ROE and mitigating land risk as we move'",2019-12-06 11:55:00-05:00,PHM,positive
1008643.0,UPDATE: Goldman Initiates 6 Home Builders With A Positive Sector View As Firm Notes 'Our analysis of the housing market points to an acceleration in activity next year given an accommodative rate environment with broader economic expansion',2019-12-06 11:46:00-05:00,PHM,positive
1008644.0,"Benzinga's Top Upgrades, Downgrades For December 6, 2019",2019-12-06 10:24:00-05:00,PHM,positive
1008645.0,"Benzinga Pro's Top 5 Stocks To Watch For Fri., Dec. 6, 2019: TSLA, ONTX, XHB, BIG, SFIX",2019-12-06 08:49:00-05:00,PHM,positive
1008646.0,"Goldman Sachs Initiates Coverage On PulteGroup with Buy Rating, Announces $45 Price Target",2019-12-06 06:32:00-05:00,PHM,neutral
1008647.0,PulteGroup Raises Quarterly Dividend From $0.11 To $0.12/Share,2019-12-05 08:39:00-05:00,PHM,neutral
1008648.0,PulteGroup Option Alert: Jul 17 $46 Calls Sweep (7) near the Ask: 690 @ $1.341 vs 30 OI; Ref=$40.0675,2019-11-27 12:05:00-05:00,PHM,positive
1008649.0,PulteGroup shares are trading lower after Seaport Global downgraded the stock from Buy to Neutral.,2019-11-04 12:27:00-05:00,PHM,neutral
1008650.0,Seaport Global Downgrades PulteGroup to Neutral,2019-11-04 07:54:00-05:00,PHM,neutral
1008651.0,Stocks That Hit 52-Week Highs On Friday,2019-10-25 12:47:00-04:00,PHM,neutral
1008652.0,Stocks That Hit 52-Week Highs On Thursday,2019-10-24 10:13:00-04:00,PHM,neutral
1008653.0,"Buckingham Maintains Neutral on PulteGroup, Raises Price Target to $41",2019-10-24 08:16:00-04:00,PHM,neutral
1008654.0,10 Biggest Price Target Changes For Wednesday,2019-10-23 09:13:00-04:00,PHM,neutral
1008655.0,"Wells Fargo Maintains Market Perform on PulteGroup, Raises Price Target to $42",2019-10-23 07:54:00-04:00,PHM,positive
1008656.0,PulteGroup shares are trading higher after the company reported better-than-expected Q3 EPS and sales results.,2019-10-22 13:58:00-04:00,PHM,positive
1008657.0,"PulteGroup Q3 Adj. EPS $1.01 Beats $0.92 Estimate, Sales $2.71B Beat $2.57B Estimate",2019-10-22 06:30:00-04:00,PHM,neutral
1008658.0,"Earnings Scheduled For October 22, 2019",2019-10-22 05:40:00-04:00,PHM,neutral
1008659.0,Earnings Season Kicks Into Full Gear In Round 3 Of The WeTrader Competition,2019-10-21 11:16:00-04:00,PHM,neutral
1008660.0,"Coca-Cola, Schlumberger Earnings Help Boost Investor Morale Despite China Data",2019-10-18 09:54:00-04:00,PHM,positive
1008661.0,Stocks That Hit 52-Week Highs On Thursday,2019-10-17 11:00:00-04:00,PHM,neutral
1008662.0,"Wedbush Maintains Neutral on PulteGroup, Raises Price Target to $34",2019-10-17 08:02:00-04:00,PHM,neutral
1008663.0,Stocks That Hit 52-Week Highs On Wednesday,2019-10-16 10:42:00-04:00,PHM,neutral
1008664.0,Stocks That Hit 52-Week Highs On Tuesday,2019-10-15 10:32:00-04:00,PHM,neutral
1008665.0,Stocks That Hit 52-Week Highs On Friday,2019-10-11 10:18:00-04:00,PHM,neutral
1008666.0,Stocks That Hit 52-Week Highs On Friday,2019-10-04 12:45:00-04:00,PHM,neutral
1008667.0,Stocks That Hit 52-Week Highs On Wednesday,2019-10-02 10:52:00-04:00,PHM,neutral
1008668.0,Stocks That Hit 52-Week Highs On Tuesday,2019-10-01 14:25:00-04:00,PHM,neutral
1008669.0,Stocks That Hit 52-Week Highs On Monday,2019-09-23 12:51:00-04:00,PHM,neutral
1008670.0,Stocks That Hit 52-Week Highs On Friday,2019-09-13 14:58:00-04:00,PHM,neutral
1008671.0,Stocks That Hit 52-Week Highs On Monday,2019-09-09 12:43:00-04:00,PHM,neutral
1008672.0,Stocks That Hit 52-Week Highs On Friday,2019-09-06 12:23:00-04:00,PHM,neutral
1008673.0,Stocks That Hit 52-Week Highs On Thursday,2019-09-05 12:29:00-04:00,PHM,neutral
1008674.0,Stocks That Hit 52-Week Highs On Wednesday,2019-09-04 11:02:00-04:00,PHM,neutral
1008675.0,"Benzinga's Top Upgrades, Downgrades For August 23, 2019",2019-08-23 09:56:00-04:00,PHM,positive
1008676.0,"Seaport Global Initiates Coverage On PulteGroup with Buy Rating, Announces $44 Price Target",2019-08-23 07:04:00-04:00,PHM,neutral
1008677.0,"Benzinga's Top Upgrades, Downgrades For August 13, 2019",2019-08-13 09:46:00-04:00,PHM,positive
1008678.0,"SunTrust Robinson Humphrey Initiates Coverage On PulteGroup with Buy Rating, Announces $38 Price Target",2019-08-13 07:16:00-04:00,PHM,neutral
1008679.0,"Benzinga's Top Upgrades, Downgrades For July 24, 2019",2019-07-24 11:52:00-04:00,PHM,positive
1008680.0,RBC Capital Upgrades PulteGroup to Sector Perform,2019-07-24 06:33:00-04:00,PHM,neutral
1008681.0,"PulteGroup shares trading lower following better-than-expected Q2 results. On the company's earnings conference call, management guided Q3 gross margin 22.8-23.3% and FY19 gross margin 23-23.3%.",2019-07-23 13:52:00-04:00,PHM,negative
1008682.0,"Pultegroup CEO Says House Costs Are Going Up, And Tariffs, While Not Significant Are Impactful",2019-07-23 09:46:00-04:00,PHM,negative
1008683.0,From PulteGroup Q2 Earnings Conference Call: Sees Q3 Gross Margins 22.8-23.3%; FY19 Gross Margin 23-23.3%,2019-07-23 08:57:00-04:00,PHM,negative
1008684.0,"PulteGroup Q2 EPS $0.86 Beats $0.83 Estimate, Sales $2.49B Beat $2.47B Estimate",2019-07-23 06:31:00-04:00,PHM,neutral
1008685.0,"Earnings Scheduled For July 23, 2019",2019-07-23 04:51:00-04:00,PHM,neutral
1008686.0,PulteGroup Option Alert: Aug 2 $35 Calls at the Ask: 10000 @ $0.451 vs 2 OI; Ref=$33.955,2019-07-22 10:31:00-04:00,PHM,positive
1008687.0,"Key Earnings Week As Amazon, Boeing, Alphabet, Facebook Results All Expected",2019-07-22 10:03:00-04:00,PHM,positive
1008688.0,Shares of several homebuilders trading lower following better-than-expected Q2 results but concerning Q3 guidance from Lennar.,2019-06-25 12:22:00-04:00,PHM,neutral
1008689.0,PulteGroup Adds $500M To Buyback,2019-05-16 17:26:00-04:00,PHM,neutral
1008690.0,"Benzinga's Top Upgrades, Downgrades For April 24, 2019",2019-04-24 10:23:00-04:00,PHM,positive
1008691.0,"BTIG Research Upgrades PulteGroup, Inc. Common Stock to Neutral",2019-04-24 07:11:00-04:00,PHM,neutral
1008692.0,"PulteGroup Q1 EPS $0.59 Beats $0.47 Estimate, Sales $1.997B Beat $1.93B Estimate",2019-04-23 06:32:00-04:00,PHM,neutral
1008693.0,"Earnings Scheduled For April 23, 2019",2019-04-23 04:00:00-04:00,PHM,neutral
1008694.0,"Buckingham Maintains Neutral on PulteGroup, Raises Price Target to $31",2019-04-16 08:48:00-04:00,PHM,neutral
1008695.0,"Benzinga's Top Upgrades, Downgrades For April 10, 2019",2019-04-10 09:04:00-04:00,PHM,positive
1008696.0,"JP Morgan Upgrades PulteGroup to Neutral, Raises Price Target From $24 To $25.50",2019-04-10 07:07:00-04:00,PHM,positive
1008697.0,Shares of several homebuilding companies are trading higher after earnings reports from KB Home and Lennar.,2019-03-27 13:02:00-04:00,PHM,positive
1008698.0,"Freddie Mac's Mar. Forecast Report Shows Lower-Than-Expected Mortgage Rates, House Price Moderation Will Help Spring Homebuilding",2019-03-22 09:42:00-04:00,PHM,positive
1008699.0,PulteGroup Reports John Chadwick Promoted To COO,2019-03-21 16:06:00-04:00,PHM,positive
1008700.0,Evercore ISI Group Downgrades PulteGroup to In-Line,2019-02-28 06:43:00-05:00,PHM,neutral
1008701.0,Raymond James Downgrades PulteGroup to Market Perform,2019-02-14 08:01:00-05:00,PHM,neutral
1008702.0,"Pultegroup 'Rise In Interest Rates May Be Better Viewed As The Proverbial Final Straw, Rather Than A Trigger As It Came On Top Of Several Years Of Home Price Appreciation And Growing Affordability Challenges'",2019-01-29 08:51:00-05:00,PHM,positive
1008703.0,"PulteGroup Q4 EPS $1.11 Beats $1.10 Estimate, Sales $2.999B Beat $2.9B Estimate",2019-01-29 06:38:00-05:00,PHM,neutral
1008704.0,"Earnings Scheduled For January 29, 2019",2019-01-29 04:13:00-05:00,PHM,neutral
1008705.0,PulteGroup's Q4 Earnings Preview,2019-01-28 13:41:00-05:00,PHM,neutral
1008706.0,"Wakeup Call: World, China Growth Data Fail To Impress, Pushing Down Global Markets",2019-01-22 10:18:00-05:00,PHM,positive
1008707.0,Hope Takes Flight: China Optimism Has Markets Looking Strong Ahead of Weekend,2019-01-18 10:16:00-05:00,PHM,positive
1008708.0,"Benzinga's Top Upgrades, Downgrades For January 17, 2019",2019-01-17 09:23:00-05:00,PHM,positive
1008709.0,UPDATE: BTIG Downgrades PulteGroup As Firm Believes 'PHM's order growth will underperform due to inadequate entry-level product mix'; Notes 'Consensus 2019 EPS is 17% above our est. and we believe too optimistic on both growth and margins',2019-01-17 09:02:00-05:00,PHM,positive
1008710.0,"BTIG Research Downgrades PulteGroup to Sell, Announces $23 Price Target",2019-01-17 07:37:00-05:00,PHM,neutral
1008711.0,"Benzinga's Top Upgrades, Downgrades For January 11, 2019",2019-01-11 09:19:00-05:00,PHM,positive
1008712.0,"RBC Capital Downgrades PulteGroup to Underperform, Announces $25",2019-01-11 07:04:00-05:00,PHM,neutral
1008713.0,"KeyBanc Upgrades Homebuilders, Says Stocks Are In Position To Be Cyclical Outperformers",2019-01-07 14:45:00-05:00,PHM,neutral
1008714.0,"KeyBanc Upgrades PulteGroup to Overweight, Announces $32 Price Target",2019-01-07 06:10:00-05:00,PHM,negative
1008715.0,"Stocks Trading Ex Dividend For Mon., Dec. 17, 2018",2018-12-17 10:08:00-05:00,PHM,neutral
1008716.0,"Stocks That Will Be Trading Ex Dividend Mon., Dec. 17, 2018",2018-12-14 11:02:00-05:00,PHM,neutral
1008717.0,PulteGroup Raises Qtr. Dividend From $0.09 To $0.11/Share,2018-12-06 10:45:00-05:00,PHM,neutral
1008718.0,4 Stocks Predicted To Move Higher This Week,2018-11-27 13:56:00-05:00,PHM,neutral
1008719.0,"Home builders trade lower after KB Homes reported after lowering Q4 housing guidance below estimates. LEN down 5.6%,  TOL down 5.8%, DHI down 5.8%, PHM down 3.42%.",2018-11-15 13:20:00-05:00,PHM,negative
1008720.0,"Benzinga's Top Upgrades, Downgrades For November 12, 2018",2018-11-12 09:17:00-05:00,PHM,positive
1008721.0,Bank of America Downgrades PulteGroup to Underperform,2018-11-12 07:27:00-05:00,PHM,neutral
1008722.0,Hearing Fundstrat Strategist Tom Lee Says 'Buy The Homebuilders Now',2018-11-09 13:47:00-05:00,PHM,neutral
1008723.0,Podcast: Should You Buy The Cheap Home Builder Stocks?,2018-10-25 14:51:00-04:00,PHM,neutral
1008724.0,"Evercore ISI Group Upgrades PulteGroup to Outperform, Lowers Price Target to $28",2018-10-25 07:10:00-04:00,PHM,negative
1008725.0,"Benzinga's Top Upgrades, Downgrades For October 24, 2018",2018-10-24 09:19:00-04:00,PHM,positive
1008726.0,"BTIG Research Upgrades PulteGroup to Neutral, Removes $24 Price Target",2018-10-24 06:28:00-04:00,PHM,neutral
1008727.0,"Stocks Which Set New 52-Week Low Yesterday, October 22nd",2018-10-23 09:54:00-04:00,PHM,negative
1008728.0,"PulteGroup Q3 EPS $1.01 Beats $0.95 Estimate, Sales $2.65B Beat $2.62B Estimate",2018-10-23 06:30:00-04:00,PHM,neutral
1008729.0,"Earnings Scheduled For October 23, 2018",2018-10-23 04:22:00-04:00,PHM,neutral
1008730.0,PulteGroup's Q3 Earnings Preview,2018-10-22 15:11:00-04:00,PHM,neutral
1008731.0,"Deutsche Bank Turns Cautious On Homebuilders, But Upgrades Lennar, Meritage",2018-10-22 12:19:00-04:00,PHM,negative
1008732.0,"Deutsche Bank Downgrades PulteGroup to Hold, Lowers Price Target to $24",2018-10-22 08:51:00-04:00,PHM,negative
1008733.0,Bank of America Downgrades PulteGroup,2018-10-18 07:35:00-04:00,PHM,neutral
1008734.0,"Stocks Which Set New 52-Week Low Friday, October 5th",2018-10-08 09:27:00-04:00,PHM,negative
1008735.0,"Stocks Which Set New 52-Week Low Yesterday, October 3rd",2018-10-04 12:38:00-04:00,PHM,negative
1008736.0,"Stocks Which Set New 52-Week Low Yesterday, October 2nd",2018-10-03 13:01:00-04:00,PHM,negative
1008737.0,"Stocks Which Set New 52-Week Low Yesterday, October 1st",2018-10-02 09:24:00-04:00,PHM,negative
1008738.0,Stocks That Made New 52-Week Lows So Far Today Include:,2018-09-27 13:37:00-04:00,PHM,negative
1008739.0,"Stocks Which Set New 52-Week Low Yesterday, September 26th",2018-09-27 09:14:00-04:00,PHM,negative
1008740.0,"Stocks That Made New 52-Week Lows So Far Today Include: Invesco, AutoNation, PulteGroup, Lennar, Whirlpool, Martin Marietta Materials, Affiliated Managers Group, and Willis Towers Watson",2018-09-26 13:00:00-04:00,PHM,negative
1008741.0,"Benzinga's Top Upgrades, Downgrades For September 21, 2018",2018-09-21 09:20:00-04:00,PHM,positive
1008742.0,"JP Morgan Downgrades PulteGroup to Underweight, Lowers Price Target to $28",2018-09-21 07:34:00-04:00,PHM,positive
1008743.0,"Stocks Trading Ex Dividend For Mon., Sep. 17, 2018",2018-09-17 10:24:00-04:00,PHM,neutral
1008744.0,"Stocks That Will Be Trading Ex Dividend For Mon., Sep. 17, 2018",2018-09-14 07:10:00-04:00,PHM,neutral
1008745.0,Pharma Mar To Conduct A Registered Public Offering of American Depositary Shares,2018-09-07 08:32:00-04:00,PHM,positive
1008746.0,"Despite Pre-Market Softness, S&P 500 On Track For Longest Bull Run On Record",2018-08-22 10:04:00-04:00,PHM,neutral
1008747.0,"Homebuilder shares rally after Toll Brothers reported strong Q3 results; Beezer Homes up 3.9%, Pulte Group up 5.2%, Lennar corporation up 4.6%, LGI Homes up 4.4%, KB Home up 5.2%, Meritage Homes up 5.0%.",2018-08-21 13:39:00-04:00,PHM,positive
1008748.0,Toll Brother's Solid Q3 Results Puts Homebuilders On Strong Foundation,2018-08-21 11:37:00-04:00,PHM,positive
1008749.0,"Benzinga's Top Upgrades, Downgrades For August 7, 2018",2018-08-07 09:03:00-04:00,PHM,positive
1008750.0,A Peek Into The Markets: US Stock Futures Signal Higher Start On Wall Street,2018-08-07 06:44:00-04:00,PHM,neutral
1008751.0,Mizuho Downgrades PulteGroup to Neutral,2018-08-07 06:40:00-04:00,PHM,neutral
1008752.0,"PulteGroup Q2 EPS $0.89 Beats $0.74 Estimate, Sales $2.569B Beat $2.37B Estimate",2018-07-26 06:30:00-04:00,PHM,neutral
1008753.0,"Earnings Scheduled For July 26, 2018",2018-07-26 04:20:00-04:00,PHM,neutral
1008754.0,Citigroup Assumes PulteGroup to Neutral,2018-06-19 07:05:00-04:00,PHM,neutral
1008755.0,"PulteGroup Shares Volatile, Near Session Low Down 3.6%; Recently Saw Notable Block Trade Of 1.1M Shares At $32/Share",2018-06-13 10:42:00-04:00,PHM,negative
1008756.0,Raymond James Upgrades PulteGroup to Outperform,2018-04-26 09:11:00-04:00,PHM,neutral
1008757.0,PulteGroup's 'Excellent' Q1 Beat Turns Buckingham Bullish,2018-04-25 12:42:00-04:00,PHM,neutral
1008758.0,"Benzinga's Top Upgrades, Downgrades For April 25, 2018",2018-04-25 09:36:00-04:00,PHM,positive
1008759.0,Buckingham Upgrades PulteGroup to Buy,2018-04-25 08:21:00-04:00,PHM,neutral
1008760.0,B. Riley Upgrades PulteGroup to Buy,2018-04-25 08:13:00-04:00,PHM,neutral
1008761.0,"PulteGroup Q1 EPS $0.59 Beats $0.45 Est., Home Sales $1.9B Beats $1.84B Est.",2018-04-24 06:30:00-04:00,PHM,neutral
1008762.0,"Earnings Scheduled For April 24, 2018",2018-04-24 04:14:00-04:00,PHM,neutral
1008763.0,"Stock Market Seems Directionless, Volatility Low As Investors Await News",2018-04-19 10:42:00-04:00,PHM,negative
1008764.0,"Existing Home Sales Rise In February, Homebuilders Gain",2018-03-22 11:19:00-04:00,PHM,positive
1008765.0,PulteGroup Has Non-Deal Roadshow with BTIG Today,2018-03-06 07:28:00-05:00,PHM,neutral
1008766.0,The Week Ahead: Discount Retailers Close Out Earnings Season,2018-03-05 14:17:00-05:00,PHM,neutral
1008767.0,"Mylan, Hess, And 3 Other Stocks To Have On Your Radar This Week",2018-02-20 15:26:00-05:00,PHM,neutral
1008768.0,Both Electronic Arts And Motorola Have Had Bearish Technical Signals This Week,2018-02-13 09:36:00-05:00,PHM,neutral
1008769.0,"New Tax Law, Rising Costs Could Dampen Housing Momentum",2018-02-12 10:56:00-05:00,PHM,neutral
1008770.0,PulteGroup Q4 Earnings Beat Estimates On Solid Demand,2018-01-30 10:51:00-05:00,PHM,neutral
1008771.0,"PulteGroup Reports Q4 Adj. EPS $0.85 vs $0.85 Est., Sales $2.79B vs $2.82B Est.",2018-01-30 06:33:00-05:00,PHM,neutral
1008772.0,PulteGroup Announces $500M Buyback,2018-01-30 06:32:00-05:00,PHM,neutral
1008773.0,"Earnings Scheduled For January 30, 2018",2018-01-30 04:02:00-05:00,PHM,neutral
1008774.0,"AMD, Intel, PulteGroup, Vipshop: 'Fast Money' Picks For January 26",2018-01-26 07:16:00-05:00,PHM,neutral
1008775.0,Lennar Says the New Tax Bill Could Have an Adverse Impact on its Business,2018-01-25 06:20:00-05:00,PHM,negative
1008776.0,Mizuho Upgrades PulteGroup to Buy,2018-01-18 06:14:00-05:00,PHM,neutral
1008777.0,Mizuho Upgrades PulteGroup to Buy from Neutral; Raises PT to $39 from $31 -Reuters,2018-01-18 04:38:00-05:00,PHM,neutral
1008778.0,The Housing Industry: Checking In Ahead Of Q4 Earnings Reports,2018-01-03 13:49:00-05:00,PHM,neutral
1008779.0,"B. Riley Downgrades PulteGroup to Neutral, Raises Price Target to $36.00",2018-01-03 12:42:00-05:00,PHM,neutral
1008780.0,"JPMorgan Answers Questions On The Homebuilder Sector, Projects 'More Modest' 2018",2017-12-19 17:11:00-05:00,PHM,neutral
1008781.0,How To Use A Basic PEG Screen To Find Value Stocks,2017-12-14 12:37:00-05:00,PHM,positive
1008782.0,NAILing Down A Leveraged Homebuilders ETF,2017-12-11 17:24:00-05:00,PHM,neutral
1008783.0,"AT&T, Goldman Sachs, Micron, PulteGroup: 'Fast Money' Picks For December 5",2017-12-05 07:18:00-05:00,PHM,neutral
1008784.0,"Dollar General, Golar, PulteGroup: Fast Money Picks For November 29",2017-11-29 07:30:00-05:00,PHM,neutral
1008785.0,Existing Home Sales Rise In October: Will The Rally Last?,2017-11-22 11:53:00-05:00,PHM,neutral
1008786.0,PulteGroup Downgraded By Buckingham After 70% Gain,2017-11-14 14:13:00-05:00,PHM,positive
1008787.0,"Benzinga's Top Upgrades, Downgrades For November 14, 2017",2017-11-14 09:13:00-05:00,PHM,positive
1008788.0,Buckingham Downgrades PulteGroup to Neutral,2017-11-14 08:08:00-05:00,PHM,neutral
1008789.0,Homebuilders Are Getting Crushed By Revised Tax Plan,2017-11-02 10:59:00-04:00,PHM,negative
1008790.0,"Homebuilding Stocks Plunge Lower Amid Details Of New Tax Plan: MDC Shares Down 6.5%, Toll, Hovnanian Down 5%, KB Home, TRI Pointe Down 4%, Lennar, Pulte, CalAtlantic, DR Horton Down 3%",2017-11-02 10:17:00-04:00,PHM,neutral
1008791.0,"More Details From House Republican Tax Plan: Home Mortgage Interest Deduction Will Be Available For Loans Of Up To $500K, Down From $1M Previously",2017-11-02 10:13:00-04:00,PHM,positive
1008792.0,"Homebuilder Stocks Falling Quickly Over Past 10 Minutes Including Lennar, Toll Brothers, CalAtlantic, KB Homes, DR Horton",2017-11-02 10:11:00-04:00,PHM,negative
1008793.0,"Intel, PulteGroup, Retail, And Oil: Fast Money Picks For October 31",2017-10-31 07:21:00-04:00,PHM,neutral
1008794.0,9 Stocks That Moved On The Big New Homes Sales Beat,2017-10-25 12:06:00-04:00,PHM,neutral
1008795.0,"Benzinga's Top Upgrades, Downgrades For October 25, 2017",2017-10-25 09:12:00-04:00,PHM,positive
1008796.0,"The Market In 5 Minutes: AMD, AT&T Fall On Earnings, Twitter To Add Political Ad Labels",2017-10-25 08:34:00-04:00,PHM,neutral
1008797.0,"UBS Initiates Coverage On PulteGroup with Buy Rating, Announces $38.00 Price Target",2017-10-25 07:49:00-04:00,PHM,neutral
1008798.0,Mizuho Upgrades PulteGroup to Neutral,2017-10-25 06:35:00-04:00,PHM,neutral
1008799.0,"PulteGroup Q4 Adj. EPS $0.60 vs $0.59 Est., Sales $2.13B vs $2.30B Est.",2017-10-24 06:30:00-04:00,PHM,neutral
1008800.0,"Earnings Scheduled For October 24, 2017",2017-10-24 04:09:00-04:00,PHM,neutral
1008801.0,"Benzinga's Top Upgrades, Downgrades For October 20, 2017",2017-10-20 09:04:00-04:00,PHM,positive
1008802.0,"Celgene, Hain Celestial, PulteGroup: Fast Money Picks For October 20",2017-10-20 08:01:00-04:00,PHM,neutral
1008803.0,Citigroup Downgrades PulteGroup to Sell,2017-10-20 07:27:00-04:00,PHM,neutral
1008804.0,"Exxon Mobil, GM, Golar, PulteGroup: Fast Money Picks For September 27",2017-09-27 07:36:00-04:00,PHM,neutral
1008805.0,Susquehanna Downgrades PulteGroup to Neutral,2017-07-26 09:11:00-04:00,PHM,neutral
1008806.0,"PulteGroup Q2 EPS $0.47 vs $0.41 Est., Sales $2.02B vs $2.03B Est.",2017-07-25 06:34:00-04:00,PHM,neutral
