Unnamed: 0,title,date,stock,sentiment
1008594.0,"Shares of several consumer discretionary companies are trading lower following an increase in coronavirus cases in some US states that have reopened, leading to concerns of a second wave of the virus. A potential second wave could keep discretionary spending and economic activity low.",2020-06-11 10:41:00-04:00,PHM,positive
1008595.0,"Benzinga's Top Upgrades, Downgrades For June 11, 2020",2020-06-11 09:38:00-04:00,PHM,positive
1008596.0,"JP Morgan Upgrades PulteGroup to Overweight, Announces $41 Price Target",2020-06-11 07:32:00-04:00,PHM,neutral
1008597.0,"Shares of several consumer discretionary companies are trading higher following strong US jobs data and continued optimism amid the reopening of the economy. As the economy reopens, consumer spending should increase.",2020-06-05 10:31:00-04:00,PHM,positive
1008598.0,"Benzinga's Top Upgrades, Downgrades For May 28, 2020",2020-05-28 10:07:00-04:00,PHM,positive
1008599.0,"Credit Suisse Initiates Coverage On PulteGroup with Neutral Rating, Announces Price Target of $36",2020-05-28 08:24:00-04:00,PHM,positive
1008600.0,"Who Could Win, Lose As US Homebuilding Starts Decline: Home Depot 'Performing Well' During Coronavirus Crisis",2020-05-19 11:25:00-04:00,PHM,negative
1008601.0,KeyBanc Downgrades PulteGroup to Sector Weight,2020-05-15 06:21:00-04:00,PHM,neutral
1008602.0,"JP Morgan Maintains Neutral on PulteGroup, Raises Price Target to $28",2020-05-12 10:57:00-04:00,PHM,positive
1008603.0,"SunTrust Robinson Humphrey Maintains Hold on PulteGroup, Raises Price Target to $32",2020-05-12 09:27:00-04:00,PHM,neutral
1008604.0,"Barron's Picks And Pans: Boyd Gaming, Domino's Pizza, Exxon And More",2020-05-09 15:06:00-04:00,PHM,neutral
1008605.0,"Wells Fargo Maintains Equal-Weight on PulteGroup, Lowers Price Target to $25",2020-04-24 08:54:00-04:00,PHM,positive
1008606.0,"CFRA Maintains Hold on PulteGroup, Raises Price Target to $29",2020-04-23 11:20:00-04:00,PHM,neutral
1008607.0,From PulteGroup Earnings Conference Call: Co. Seeing Minimal Cancellation From Most Buyers,2020-04-23 08:55:00-04:00,PHM,neutral
1008608.0,"PulteGroup Q1 EPS $0.740 Beats $0.700 Estimate, Sales $2.295B Miss $2.310B Estimate",2020-04-23 06:31:00-04:00,PHM,negative
1008609.0,"Earnings Scheduled For April 23, 2020",2020-04-23 04:23:00-04:00,PHM,neutral
1008610.0,"Benzinga's Top Upgrades, Downgrades For April 15, 2020",2020-04-15 09:39:00-04:00,PHM,positive
1008611.0,Citigroup Initiates Coverage On PulteGroup with Buy Rating,2020-04-15 07:21:00-04:00,PHM,neutral
1008612.0,"JP Morgan Downgrades PulteGroup to Neutral, Announces $25.5 Price Target",2020-03-18 05:39:00-04:00,PHM,positive
1008613.0,"Shares of several consumer goods and retail companies are trading lower as global markets continue to experience pressure amid the coronavirus spread, which has negatively impacted companies across sectors.",2020-03-11 08:52:00-04:00,PHM,negative
1008614.0,"Coronavirus Economic Turmoil A Silver Lining For Home Buyers, Builders",2020-03-04 14:43:00-05:00,PHM,negative
1008615.0,"Susquehanna Upgrades PulteGroup to Positive, Raises Price Target to $51",2020-03-03 10:11:00-05:00,PHM,positive
1008616.0,"Benzinga's Top Upgrades, Downgrades For February 26, 2020",2020-02-26 10:02:00-05:00,PHM,positive
1008617.0,"SunTrust Robinson Humphrey Downgrades PulteGroup to Hold, Announces $45 Price Target",2020-02-26 06:02:00-05:00,PHM,neutral
1008618.0,Stocks That Hit 52-Week Highs On Wednesday,2020-02-19 10:32:00-05:00,PHM,neutral
1008619.0,PulteGroup shares are trading lower despite the company reporting better-than-expected Q4 earnings results.,2020-01-29 10:50:00-05:00,PHM,neutral
1008620.0,"Wells Fargo Maintains Equal-Weight on PulteGroup, Raises Price Target to $50",2020-01-29 08:26:00-05:00,PHM,positive
1008621.0,10 Biggest Price Target Changes For Wednesday,2020-01-29 08:11:00-05:00,PHM,neutral
1008622.0,"RBC Capital Maintains Sector Perform on PulteGroup, Raises Price Target to $44",2020-01-29 08:06:00-05:00,PHM,neutral
1008623.0,"KeyBanc Maintains Overweight on PulteGroup, Raises Price Target to $52",2020-01-29 05:58:00-05:00,PHM,negative
1008624.0,Stocks That Hit 52-Week Highs On Tuesday,2020-01-28 11:05:00-05:00,PHM,neutral
1008625.0,PulteGroup shares are trading higher after the company announced better-than-expected Q4 EPS and sales results.,2020-01-28 10:14:00-05:00,PHM,positive
1008626.0,"Benzinga's Top Upgrades, Downgrades For January 28, 2020",2020-01-28 09:43:00-05:00,PHM,positive
1008627.0,Tuesday's Market Minute: Earnings Snapshot,2020-01-28 09:26:00-05:00,PHM,neutral
1008628.0,10 Biggest Price Target Changes For Tuesday,2020-01-28 08:45:00-05:00,PHM,neutral
1008629.0,"PulteGroup Acquires Innovative Construction Group, Terms Not Disclosed",2020-01-28 06:41:00-05:00,PHM,positive
1008630.0,"PulteGroup Q4 EPS $1.14 Beats $1.09 Estimate, Sales $3.017B Beat $2.98B Estimate",2020-01-28 06:40:00-05:00,PHM,neutral
1008631.0,"Evercore ISI Group Upgrades PulteGroup to Outperform, Raises Price Target to $49",2020-01-28 06:28:00-05:00,PHM,neutral
1008632.0,"Earnings Scheduled For January 28, 2020",2020-01-28 04:00:00-05:00,PHM,neutral
1008633.0,Q4 Earnings Preview: PulteGroup,2020-01-27 13:09:00-05:00,PHM,neutral
1008634.0,"Benzinga Pro's Top 5 Stocks To Watch For Mon., Jan. 27, 2020: DHI, NIO, JNPR, CODX, WHR",2020-01-27 09:06:00-05:00,PHM,positive
1008635.0,Stocks That Hit 52-Week Highs On Friday,2020-01-24 10:41:00-05:00,PHM,neutral
1008636.0,Stocks That Hit 52-Week Highs On Wednesday,2020-01-22 10:17:00-05:00,PHM,neutral
1008637.0,Stocks That Hit 52-Week Highs On Tuesday,2020-01-21 10:11:00-05:00,PHM,neutral
1008638.0,Stocks That Hit 52-Week Highs On Friday,2020-01-17 13:23:00-05:00,PHM,neutral
1008639.0,Stocks That Hit 52-Week Highs On Wednesday,2020-01-15 13:14:00-05:00,PHM,neutral
1008640.0,"Benzinga's Top Upgrades, Downgrades For January 7, 2020",2020-01-07 11:17:00-05:00,PHM,positive
1008641.0,"Bank of America Upgrades PulteGroup to Neutral, Announces $44 Price Target",2020-01-07 08:39:00-05:00,PHM,neutral
1008642.0,"UPDATE: Goldman Initiates PulteGroup With Buy, $45 Target Notes 'as we look for it to gradually increase its exposure to the first-time buyer while maintaining its peer-leading ROE and mitigating land risk as we move'",2019-12-06 11:55:00-05:00,PHM,positive
1008643.0,UPDATE: Goldman Initiates 6 Home Builders With A Positive Sector View As Firm Notes 'Our analysis of the housing market points to an acceleration in activity next year given an accommodative rate environment with broader economic expansion',2019-12-06 11:46:00-05:00,PHM,positive
1008644.0,"Benzinga's Top Upgrades, Downgrades For December 6, 2019",2019-12-06 10:24:00-05:00,PHM,positive
1008645.0,"Benzinga Pro's Top 5 Stocks To Watch For Fri., Dec. 6, 2019: TSLA, ONTX, XHB, BIG, SFIX",2019-12-06 08:49:00-05:00,PHM,positive
1008646.0,"Goldman Sachs Initiates Coverage On PulteGroup with Buy Rating, Announces $45 Price Target",2019-12-06 06:32:00-05:00,PHM,neutral
1008647.0,PulteGroup Raises Quarterly Dividend From $0.11 To $0.12/Share,2019-12-05 08:39:00-05:00,PHM,neutral
1008648.0,PulteGroup Option Alert: Jul 17 $46 Calls Sweep (7) near the Ask: 690 @ $1.341 vs 30 OI; Ref=$40.0675,2019-11-27 12:05:00-05:00,PHM,positive
1008649.0,PulteGroup shares are trading lower after Seaport Global downgraded the stock from Buy to Neutral.,2019-11-04 12:27:00-05:00,PHM,neutral
1008650.0,Seaport Global Downgrades PulteGroup to Neutral,2019-11-04 07:54:00-05:00,PHM,neutral
1008651.0,Stocks That Hit 52-Week Highs On Friday,2019-10-25 12:47:00-04:00,PHM,neutral
1008652.0,Stocks That Hit 52-Week Highs On Thursday,2019-10-24 10:13:00-04:00,PHM,neutral
1008653.0,"Buckingham Maintains Neutral on PulteGroup, Raises Price Target to $41",2019-10-24 08:16:00-04:00,PHM,neutral
1008654.0,10 Biggest Price Target Changes For Wednesday,2019-10-23 09:13:00-04:00,PHM,neutral
1008655.0,"Wells Fargo Maintains Market Perform on PulteGroup, Raises Price Target to $42",2019-10-23 07:54:00-04:00,PHM,positive
1008656.0,PulteGroup shares are trading higher after the company reported better-than-expected Q3 EPS and sales results.,2019-10-22 13:58:00-04:00,PHM,positive
1008657.0,"PulteGroup Q3 Adj. EPS $1.01 Beats $0.92 Estimate, Sales $2.71B Beat $2.57B Estimate",2019-10-22 06:30:00-04:00,PHM,neutral
1008658.0,"Earnings Scheduled For October 22, 2019",2019-10-22 05:40:00-04:00,PHM,neutral
1008659.0,Earnings Season Kicks Into Full Gear In Round 3 Of The WeTrader Competition,2019-10-21 11:16:00-04:00,PHM,neutral
1008660.0,"Coca-Cola, Schlumberger Earnings Help Boost Investor Morale Despite China Data",2019-10-18 09:54:00-04:00,PHM,positive
1008661.0,Stocks That Hit 52-Week Highs On Thursday,2019-10-17 11:00:00-04:00,PHM,neutral
1008662.0,"Wedbush Maintains Neutral on PulteGroup, Raises Price Target to $34",2019-10-17 08:02:00-04:00,PHM,neutral
1008663.0,Stocks That Hit 52-Week Highs On Wednesday,2019-10-16 10:42:00-04:00,PHM,neutral
1008664.0,Stocks That Hit 52-Week Highs On Tuesday,2019-10-15 10:32:00-04:00,PHM,neutral
1008665.0,Stocks That Hit 52-Week Highs On Friday,2019-10-11 10:18:00-04:00,PHM,neutral
1008666.0,Stocks That Hit 52-Week Highs On Friday,2019-10-04 12:45:00-04:00,PHM,neutral
1008667.0,Stocks That Hit 52-Week Highs On Wednesday,2019-10-02 10:52:00-04:00,PHM,neutral
1008668.0,Stocks That Hit 52-Week Highs On Tuesday,2019-10-01 14:25:00-04:00,PHM,neutral
1008669.0,Stocks That Hit 52-Week Highs On Monday,2019-09-23 12:51:00-04:00,PHM,neutral
1008670.0,Stocks That Hit 52-Week Highs On Friday,2019-09-13 14:58:00-04:00,PHM,neutral
1008671.0,Stocks That Hit 52-Week Highs On Monday,2019-09-09 12:43:00-04:00,PHM,neutral
1008672.0,Stocks That Hit 52-Week Highs On Friday,2019-09-06 12:23:00-04:00,PHM,neutral
1008673.0,Stocks That Hit 52-Week Highs On Thursday,2019-09-05 12:29:00-04:00,PHM,neutral
1008674.0,Stocks That Hit 52-Week Highs On Wednesday,2019-09-04 11:02:00-04:00,PHM,neutral
1008675.0,"Benzinga's Top Upgrades, Downgrades For August 23, 2019",2019-08-23 09:56:00-04:00,PHM,positive
1008676.0,"Seaport Global Initiates Coverage On PulteGroup with Buy Rating, Announces $44 Price Target",2019-08-23 07:04:00-04:00,PHM,neutral
1008677.0,"Benzinga's Top Upgrades, Downgrades For August 13, 2019",2019-08-13 09:46:00-04:00,PHM,positive
1008678.0,"SunTrust Robinson Humphrey Initiates Coverage On PulteGroup with Buy Rating, Announces $38 Price Target",2019-08-13 07:16:00-04:00,PHM,neutral
1008679.0,"Benzinga's Top Upgrades, Downgrades For July 24, 2019",2019-07-24 11:52:00-04:00,PHM,positive
1008680.0,RBC Capital Upgrades PulteGroup to Sector Perform,2019-07-24 06:33:00-04:00,PHM,neutral
1008681.0,"PulteGroup shares trading lower following better-than-expected Q2 results. On the company's earnings conference call, management guided Q3 gross margin 22.8-23.3% and FY19 gross margin 23-23.3%.",2019-07-23 13:52:00-04:00,PHM,negative
1008682.0,"Pultegroup CEO Says House Costs Are Going Up, And Tariffs, While Not Significant Are Impactful",2019-07-23 09:46:00-04:00,PHM,negative
1008683.0,From PulteGroup Q2 Earnings Conference Call: Sees Q3 Gross Margins 22.8-23.3%; FY19 Gross Margin 23-23.3%,2019-07-23 08:57:00-04:00,PHM,negative
1008684.0,"PulteGroup Q2 EPS $0.86 Beats $0.83 Estimate, Sales $2.49B Beat $2.47B Estimate",2019-07-23 06:31:00-04:00,PHM,neutral
1008685.0,"Earnings Scheduled For July 23, 2019",2019-07-23 04:51:00-04:00,PHM,neutral
1008686.0,PulteGroup Option Alert: Aug 2 $35 Calls at the Ask: 10000 @ $0.451 vs 2 OI; Ref=$33.955,2019-07-22 10:31:00-04:00,PHM,positive
1008687.0,"Key Earnings Week As Amazon, Boeing, Alphabet, Facebook Results All Expected",2019-07-22 10:03:00-04:00,PHM,positive
1008688.0,Shares of several homebuilders trading lower following better-than-expected Q2 results but concerning Q3 guidance from Lennar.,2019-06-25 12:22:00-04:00,PHM,neutral
1008689.0,PulteGroup Adds $500M To Buyback,2019-05-16 17:26:00-04:00,PHM,neutral
1008690.0,"Benzinga's Top Upgrades, Downgrades For April 24, 2019",2019-04-24 10:23:00-04:00,PHM,positive
1008691.0,"BTIG Research Upgrades PulteGroup, Inc. Common Stock to Neutral",2019-04-24 07:11:00-04:00,PHM,neutral
1008692.0,"PulteGroup Q1 EPS $0.59 Beats $0.47 Estimate, Sales $1.997B Beat $1.93B Estimate",2019-04-23 06:32:00-04:00,PHM,neutral
1008693.0,"Earnings Scheduled For April 23, 2019",2019-04-23 04:00:00-04:00,PHM,neutral
1008694.0,"Buckingham Maintains Neutral on PulteGroup, Raises Price Target to $31",2019-04-16 08:48:00-04:00,PHM,neutral
1008695.0,"Benzinga's Top Upgrades, Downgrades For April 10, 2019",2019-04-10 09:04:00-04:00,PHM,positive
1008696.0,"JP Morgan Upgrades PulteGroup to Neutral, Raises Price Target From $24 To $25.50",2019-04-10 07:07:00-04:00,PHM,positive
1008697.0,Shares of several homebuilding companies are trading higher after earnings reports from KB Home and Lennar.,2019-03-27 13:02:00-04:00,PHM,positive
1008698.0,"Freddie Mac's Mar. Forecast Report Shows Lower-Than-Expected Mortgage Rates, House Price Moderation Will Help Spring Homebuilding",2019-03-22 09:42:00-04:00,PHM,positive
1008699.0,PulteGroup Reports John Chadwick Promoted To COO,2019-03-21 16:06:00-04:00,PHM,positive
1008700.0,Evercore ISI Group Downgrades PulteGroup to In-Line,2019-02-28 06:43:00-05:00,PHM,neutral
1008701.0,Raymond James Downgrades PulteGroup to Market Perform,2019-02-14 08:01:00-05:00,PHM,neutral
1008702.0,"Pultegroup 'Rise In Interest Rates May Be Better Viewed As The Proverbial Final Straw, Rather Than A Trigger As It Came On Top Of Several Years Of Home Price Appreciation And Growing Affordability Challenges'",2019-01-29 08:51:00-05:00,PHM,positive
1008703.0,"PulteGroup Q4 EPS $1.11 Beats $1.10 Estimate, Sales $2.999B Beat $2.9B Estimate",2019-01-29 06:38:00-05:00,PHM,neutral
1008704.0,"Earnings Scheduled For January 29, 2019",2019-01-29 04:13:00-05:00,PHM,neutral
1008705.0,PulteGroup's Q4 Earnings Preview,2019-01-28 13:41:00-05:00,PHM,neutral
1008706.0,"Wakeup Call: World, China Growth Data Fail To Impress, Pushing Down Global Markets",2019-01-22 10:18:00-05:00,PHM,positive
1008707.0,Hope Takes Flight: China Optimism Has Markets Looking Strong Ahead of Weekend,2019-01-18 10:16:00-05:00,PHM,positive
1008708.0,"Benzinga's Top Upgrades, Downgrades For January 17, 2019",2019-01-17 09:23:00-05:00,PHM,positive
1008709.0,UPDATE: BTIG Downgrades PulteGroup As Firm Believes 'PHM's order growth will underperform due to inadequate entry-level product mix'; Notes 'Consensus 2019 EPS is 17% above our est. and we believe too optimistic on both growth and margins',2019-01-17 09:02:00-05:00,PHM,positive
1008710.0,"BTIG Research Downgrades PulteGroup to Sell, Announces $23 Price Target",2019-01-17 07:37:00-05:00,PHM,neutral
1008711.0,"Benzinga's Top Upgrades, Downgrades For January 11, 2019",2019-01-11 09:19:00-05:00,PHM,positive
1008712.0,"RBC Capital Downgrades PulteGroup to Underperform, Announces $25",2019-01-11 07:04:00-05:00,PHM,neutral
1008713.0,"KeyBanc Upgrades Homebuilders, Says Stocks Are In Position To Be Cyclical Outperformers",2019-01-07 14:45:00-05:00,PHM,neutral
1008714.0,"KeyBanc Upgrades PulteGroup to Overweight, Announces $32 Price Target",2019-01-07 06:10:00-05:00,PHM,negative
1008715.0,"Stocks Trading Ex Dividend For Mon., Dec. 17, 2018",2018-12-17 10:08:00-05:00,PHM,neutral
1008716.0,"Stocks That Will Be Trading Ex Dividend Mon., Dec. 17, 2018",2018-12-14 11:02:00-05:00,PHM,neutral
1008717.0,PulteGroup Raises Qtr. Dividend From $0.09 To $0.11/Share,2018-12-06 10:45:00-05:00,PHM,neutral
1008718.0,4 Stocks Predicted To Move Higher This Week,2018-11-27 13:56:00-05:00,PHM,neutral
1008719.0,"Home builders trade lower after KB Homes reported after lowering Q4 housing guidance below estimates. LEN down 5.6%,  TOL down 5.8%, DHI down 5.8%, PHM down 3.42%.",2018-11-15 13:20:00-05:00,PHM,negative
1008720.0,"Benzinga's Top Upgrades, Downgrades For November 12, 2018",2018-11-12 09:17:00-05:00,PHM,positive
1008721.0,Bank of America Downgrades PulteGroup to Underperform,2018-11-12 07:27:00-05:00,PHM,neutral
1008722.0,Hearing Fundstrat Strategist Tom Lee Says 'Buy The Homebuilders Now',2018-11-09 13:47:00-05:00,PHM,neutral
1008723.0,Podcast: Should You Buy The Cheap Home Builder Stocks?,2018-10-25 14:51:00-04:00,PHM,neutral
1008724.0,"Evercore ISI Group Upgrades PulteGroup to Outperform, Lowers Price Target to $28",2018-10-25 07:10:00-04:00,PHM,negative
1008725.0,"Benzinga's Top Upgrades, Downgrades For October 24, 2018",2018-10-24 09:19:00-04:00,PHM,positive
1008726.0,"BTIG Research Upgrades PulteGroup to Neutral, Removes $24 Price Target",2018-10-24 06:28:00-04:00,PHM,neutral
1008727.0,"Stocks Which Set New 52-Week Low Yesterday, October 22nd",2018-10-23 09:54:00-04:00,PHM,negative
1008728.0,"PulteGroup Q3 EPS $1.01 Beats $0.95 Estimate, Sales $2.65B Beat $2.62B Estimate",2018-10-23 06:30:00-04:00,PHM,neutral
1008729.0,"Earnings Scheduled For October 23, 2018",2018-10-23 04:22:00-04:00,PHM,neutral
1008730.0,PulteGroup's Q3 Earnings Preview,2018-10-22 15:11:00-04:00,PHM,neutral
1008731.0,"Deutsche Bank Turns Cautious On Homebuilders, But Upgrades Lennar, Meritage",2018-10-22 12:19:00-04:00,PHM,negative
1008732.0,"Deutsche Bank Downgrades PulteGroup to Hold, Lowers Price Target to $24",2018-10-22 08:51:00-04:00,PHM,negative
1008733.0,Bank of America Downgrades PulteGroup,2018-10-18 07:35:00-04:00,PHM,neutral
1008734.0,"Stocks Which Set New 52-Week Low Friday, October 5th",2018-10-08 09:27:00-04:00,PHM,negative
1008735.0,"Stocks Which Set New 52-Week Low Yesterday, October 3rd",2018-10-04 12:38:00-04:00,PHM,negative
1008736.0,"Stocks Which Set New 52-Week Low Yesterday, October 2nd",2018-10-03 13:01:00-04:00,PHM,negative
1008737.0,"Stocks Which Set New 52-Week Low Yesterday, October 1st",2018-10-02 09:24:00-04:00,PHM,negative
1008738.0,Stocks That Made New 52-Week Lows So Far Today Include:,2018-09-27 13:37:00-04:00,PHM,negative
1008739.0,"Stocks Which Set New 52-Week Low Yesterday, September 26th",2018-09-27 09:14:00-04:00,PHM,negative
1008740.0,"Stocks That Made New 52-Week Lows So Far Today Include: Invesco, AutoNation, PulteGroup, Lennar, Whirlpool, Martin Marietta Materials, Affiliated Managers Group, and Willis Towers Watson",2018-09-26 13:00:00-04:00,PHM,negative
1008741.0,"Benzinga's Top Upgrades, Downgrades For September 21, 2018",2018-09-21 09:20:00-04:00,PHM,positive
1008742.0,"JP Morgan Downgrades PulteGroup to Underweight, Lowers Price Target to $28",2018-09-21 07:34:00-04:00,PHM,positive
1008743.0,"Stocks Trading Ex Dividend For Mon., Sep. 17, 2018",2018-09-17 10:24:00-04:00,PHM,neutral
1008744.0,"Stocks That Will Be Trading Ex Dividend For Mon., Sep. 17, 2018",2018-09-14 07:10:00-04:00,PHM,neutral
1008745.0,Pharma Mar To Conduct A Registered Public Offering of American Depositary Shares,2018-09-07 08:32:00-04:00,PHM,positive
1008746.0,"Despite Pre-Market Softness, S&P 500 On Track For Longest Bull Run On Record",2018-08-22 10:04:00-04:00,PHM,neutral
1008747.0,"Homebuilder shares rally after Toll Brothers reported strong Q3 results; Beezer Homes up 3.9%, Pulte Group up 5.2%, Lennar corporation up 4.6%, LGI Homes up 4.4%, KB Home up 5.2%, Meritage Homes up 5.0%.",2018-08-21 13:39:00-04:00,PHM,positive
1008748.0,Toll Brother's Solid Q3 Results Puts Homebuilders On Strong Foundation,2018-08-21 11:37:00-04:00,PHM,positive
1008749.0,"Benzinga's Top Upgrades, Downgrades For August 7, 2018",2018-08-07 09:03:00-04:00,PHM,positive
1008750.0,A Peek Into The Markets: US Stock Futures Signal Higher Start On Wall Street,2018-08-07 06:44:00-04:00,PHM,neutral
1008751.0,Mizuho Downgrades PulteGroup to Neutral,2018-08-07 06:40:00-04:00,PHM,neutral
1008752.0,"PulteGroup Q2 EPS $0.89 Beats $0.74 Estimate, Sales $2.569B Beat $2.37B Estimate",2018-07-26 06:30:00-04:00,PHM,neutral
1008753.0,"Earnings Scheduled For July 26, 2018",2018-07-26 04:20:00-04:00,PHM,neutral
1008754.0,Citigroup Assumes PulteGroup to Neutral,2018-06-19 07:05:00-04:00,PHM,neutral
1008755.0,"PulteGroup Shares Volatile, Near Session Low Down 3.6%; Recently Saw Notable Block Trade Of 1.1M Shares At $32/Share",2018-06-13 10:42:00-04:00,PHM,negative
1008756.0,Raymond James Upgrades PulteGroup to Outperform,2018-04-26 09:11:00-04:00,PHM,neutral
1008757.0,PulteGroup's 'Excellent' Q1 Beat Turns Buckingham Bullish,2018-04-25 12:42:00-04:00,PHM,neutral
1008758.0,"Benzinga's Top Upgrades, Downgrades For April 25, 2018",2018-04-25 09:36:00-04:00,PHM,positive
1008759.0,Buckingham Upgrades PulteGroup to Buy,2018-04-25 08:21:00-04:00,PHM,neutral
1008760.0,B. Riley Upgrades PulteGroup to Buy,2018-04-25 08:13:00-04:00,PHM,neutral
1008761.0,"PulteGroup Q1 EPS $0.59 Beats $0.45 Est., Home Sales $1.9B Beats $1.84B Est.",2018-04-24 06:30:00-04:00,PHM,neutral
1008762.0,"Earnings Scheduled For April 24, 2018",2018-04-24 04:14:00-04:00,PHM,neutral
1008763.0,"Stock Market Seems Directionless, Volatility Low As Investors Await News",2018-04-19 10:42:00-04:00,PHM,negative
1008764.0,"Existing Home Sales Rise In February, Homebuilders Gain",2018-03-22 11:19:00-04:00,PHM,positive
1008765.0,PulteGroup Has Non-Deal Roadshow with BTIG Today,2018-03-06 07:28:00-05:00,PHM,neutral
1008766.0,The Week Ahead: Discount Retailers Close Out Earnings Season,2018-03-05 14:17:00-05:00,PHM,neutral
1008767.0,"Mylan, Hess, And 3 Other Stocks To Have On Your Radar This Week",2018-02-20 15:26:00-05:00,PHM,neutral
1008768.0,Both Electronic Arts And Motorola Have Had Bearish Technical Signals This Week,2018-02-13 09:36:00-05:00,PHM,neutral
1008769.0,"New Tax Law, Rising Costs Could Dampen Housing Momentum",2018-02-12 10:56:00-05:00,PHM,neutral
1008770.0,PulteGroup Q4 Earnings Beat Estimates On Solid Demand,2018-01-30 10:51:00-05:00,PHM,neutral
1008771.0,"PulteGroup Reports Q4 Adj. EPS $0.85 vs $0.85 Est., Sales $2.79B vs $2.82B Est.",2018-01-30 06:33:00-05:00,PHM,neutral
1008772.0,PulteGroup Announces $500M Buyback,2018-01-30 06:32:00-05:00,PHM,neutral
1008773.0,"Earnings Scheduled For January 30, 2018",2018-01-30 04:02:00-05:00,PHM,neutral
1008774.0,"AMD, Intel, PulteGroup, Vipshop: 'Fast Money' Picks For January 26",2018-01-26 07:16:00-05:00,PHM,neutral
1008775.0,Lennar Says the New Tax Bill Could Have an Adverse Impact on its Business,2018-01-25 06:20:00-05:00,PHM,negative
1008776.0,Mizuho Upgrades PulteGroup to Buy,2018-01-18 06:14:00-05:00,PHM,neutral
1008777.0,Mizuho Upgrades PulteGroup to Buy from Neutral; Raises PT to $39 from $31 -Reuters,2018-01-18 04:38:00-05:00,PHM,neutral
1008778.0,The Housing Industry: Checking In Ahead Of Q4 Earnings Reports,2018-01-03 13:49:00-05:00,PHM,neutral
1008779.0,"B. Riley Downgrades PulteGroup to Neutral, Raises Price Target to $36.00",2018-01-03 12:42:00-05:00,PHM,neutral
1008780.0,"JPMorgan Answers Questions On The Homebuilder Sector, Projects 'More Modest' 2018",2017-12-19 17:11:00-05:00,PHM,neutral
1008781.0,How To Use A Basic PEG Screen To Find Value Stocks,2017-12-14 12:37:00-05:00,PHM,positive
1008782.0,NAILing Down A Leveraged Homebuilders ETF,2017-12-11 17:24:00-05:00,PHM,neutral
1008783.0,"AT&T, Goldman Sachs, Micron, PulteGroup: 'Fast Money' Picks For December 5",2017-12-05 07:18:00-05:00,PHM,neutral
1008784.0,"Dollar General, Golar, PulteGroup: Fast Money Picks For November 29",2017-11-29 07:30:00-05:00,PHM,neutral
1008785.0,Existing Home Sales Rise In October: Will The Rally Last?,2017-11-22 11:53:00-05:00,PHM,neutral
1008786.0,PulteGroup Downgraded By Buckingham After 70% Gain,2017-11-14 14:13:00-05:00,PHM,positive
1008787.0,"Benzinga's Top Upgrades, Downgrades For November 14, 2017",2017-11-14 09:13:00-05:00,PHM,positive
1008788.0,Buckingham Downgrades PulteGroup to Neutral,2017-11-14 08:08:00-05:00,PHM,neutral
1008789.0,Homebuilders Are Getting Crushed By Revised Tax Plan,2017-11-02 10:59:00-04:00,PHM,negative
1008790.0,"Homebuilding Stocks Plunge Lower Amid Details Of New Tax Plan: MDC Shares Down 6.5%, Toll, Hovnanian Down 5%, KB Home, TRI Pointe Down 4%, Lennar, Pulte, CalAtlantic, DR Horton Down 3%",2017-11-02 10:17:00-04:00,PHM,neutral
1008791.0,"More Details From House Republican Tax Plan: Home Mortgage Interest Deduction Will Be Available For Loans Of Up To $500K, Down From $1M Previously",2017-11-02 10:13:00-04:00,PHM,positive
1008792.0,"Homebuilder Stocks Falling Quickly Over Past 10 Minutes Including Lennar, Toll Brothers, CalAtlantic, KB Homes, DR Horton",2017-11-02 10:11:00-04:00,PHM,negative
1008793.0,"Intel, PulteGroup, Retail, And Oil: Fast Money Picks For October 31",2017-10-31 07:21:00-04:00,PHM,neutral
1008794.0,9 Stocks That Moved On The Big New Homes Sales Beat,2017-10-25 12:06:00-04:00,PHM,neutral
1008795.0,"Benzinga's Top Upgrades, Downgrades For October 25, 2017",2017-10-25 09:12:00-04:00,PHM,positive
1008796.0,"The Market In 5 Minutes: AMD, AT&T Fall On Earnings, Twitter To Add Political Ad Labels",2017-10-25 08:34:00-04:00,PHM,neutral
1008797.0,"UBS Initiates Coverage On PulteGroup with Buy Rating, Announces $38.00 Price Target",2017-10-25 07:49:00-04:00,PHM,neutral
1008798.0,Mizuho Upgrades PulteGroup to Neutral,2017-10-25 06:35:00-04:00,PHM,neutral
1008799.0,"PulteGroup Q4 Adj. EPS $0.60 vs $0.59 Est., Sales $2.13B vs $2.30B Est.",2017-10-24 06:30:00-04:00,PHM,neutral
1008800.0,"Earnings Scheduled For October 24, 2017",2017-10-24 04:09:00-04:00,PHM,neutral
1008801.0,"Benzinga's Top Upgrades, Downgrades For October 20, 2017",2017-10-20 09:04:00-04:00,PHM,positive
1008802.0,"Celgene, Hain Celestial, PulteGroup: Fast Money Picks For October 20",2017-10-20 08:01:00-04:00,PHM,neutral
1008803.0,Citigroup Downgrades PulteGroup to Sell,2017-10-20 07:27:00-04:00,PHM,neutral
1008804.0,"Exxon Mobil, GM, Golar, PulteGroup: Fast Money Picks For September 27",2017-09-27 07:36:00-04:00,PHM,neutral
1008805.0,Susquehanna Downgrades PulteGroup to Neutral,2017-07-26 09:11:00-04:00,PHM,neutral
1008806.0,"PulteGroup Q2 EPS $0.47 vs $0.41 Est., Sales $2.02B vs $2.03B Est.",2017-07-25 06:34:00-04:00,PHM,neutral
1008807.0,"Earnings Scheduled For July 25, 2017",2017-07-25 05:52:00-04:00,PHM,neutral
1008808.0,"Benzinga's Top Upgrades, Downgrades For July 13, 2017",2017-07-13 09:22:00-04:00,PHM,positive
1008809.0,Wedbush Upgrades PulteGroup to Neutral,2017-07-13 06:27:00-04:00,PHM,neutral
1008810.0,"Homebuilding Stocks Trade Lower After Barclays Downgraded 4 Stocks, Upgraded 1: Hovnanian Shares Down 5.2%, M/I Homes Down 2.6%, Toll Brothers, Tri Pointe Down 2.4%, Lennar, Beazer Down 2%, Pulte Down 1.8%",2017-07-11 11:43:00-04:00,PHM,neutral
1008811.0,Barclays Downgrades PulteGroup to Equal-Weight,2017-07-11 06:38:00-04:00,PHM,neutral
1008812.0,Mizuho Downgrades PulteGroup to Underperform,2017-07-10 06:10:00-04:00,PHM,neutral
1008813.0,Jon Najarian Sees Unusual Options Activity In D.R. Horton,2017-07-08 08:12:00-04:00,PHM,neutral
1008815.0,"D.R. Horton, PulteGroup Make A Solid Foundation For A Homebuilders Position",2017-06-27 11:44:00-04:00,PHM,positive
1008816.0,"Credit Suisse Initiates Coverage On PulteGroup with Outperform Rating, Announces $27.00 Price Target",2017-06-23 06:32:00-04:00,PHM,positive
1008819.0,"Alibaba, Oracle, PulteGroup, Whirlpool: Fast Money Picks For June 21",2017-06-21 06:59:00-04:00,PHM,neutral
1008822.0,Watch These 8 Huge Call Purchases In Thursday Trade,2017-06-15 04:14:00-04:00,PHM,positive
1008823.0,Benzinga's Option Alert Recap From June 14,2017-06-14 16:10:00-04:00,PHM,positive
1008824.0,Option Alert: Pulte Jul 28th 25.5 Calls Sweep: 500 @  ASK  $0.45: 729 traded vs 0 OI:  Earnings 7/20 Before Open (est)  $24.65 Ref,2017-06-14 11:34:00-04:00,PHM,positive
1008825.0,PulteGroup Sees Recognizing Pre-Tax Impairment Charge of $95M-$125M in Q2,2017-05-08 17:11:00-04:00,PHM,neutral
1008826.0,PulteGroup Sees Planned Actions Adding $425M Previously Realized from Sale of Certain Non-Core Assets Since '11,2017-05-08 17:11:00-04:00,PHM,positive
1008827.0,"UPDATE: Pulte Says Will Sell Certain Currently Inactive Land Parcels, Representing ~4,600 Lots",2017-05-08 17:11:00-04:00,PHM,positive
1008828.0,PulteGroup Reports Plan to Sell Select Non-Core Assets,2017-05-08 17:10:00-04:00,PHM,positive
1008829.0,"PulteGroup, Union Pacific, Thor And Retail: Fast Money Picks For April 27",2017-04-27 07:02:00-04:00,PHM,neutral
1008830.0,15 Biggest Mid-Day Losers For Tuesday,2017-04-25 13:15:00-04:00,PHM,negative
1008831.0,22 Stocks Moving In Tuesday's Pre-Market Session,2017-04-25 08:21:00-04:00,PHM,neutral
1008832.0,"PulteGroup Q1 EPS $0.28 vs $0.29 Est, Sales $1.63B vs $1.76B Est",2017-04-25 06:34:00-04:00,PHM,neutral
1008833.0,"Earnings Scheduled For April 25, 2017",2017-04-25 05:03:00-04:00,PHM,neutral
1008834.0,Housing Sector Preview: A Strong Start To 2017,2017-03-23 15:58:00-04:00,PHM,positive
1008835.0,Watch These 8 Huge Put Purchases In Thursday Trade,2017-03-16 04:01:00-04:00,PHM,positive
1008836.0,Option Alert: Pulte Gp Mar 24th 23.0 Puts Sweep: 500 @  ASK  $0.26: 500 traded vs 163 OI:  Earnings 4/20 Before Open (est)  $23.24 Ref,2017-03-15 12:08:00-04:00,PHM,positive
1008837.0,"DSW, PulteGroup, Viacom And Russia: Fast Money Picks For March 13",2017-03-13 07:15:00-04:00,PHM,neutral
1008838.0,"Aecom, PulteGroup And ETFs: Fast Money Picks For March 10",2017-03-10 06:43:00-05:00,PHM,neutral
1008839.0,Spring Is Heating Up For Homebuilders; Stocks Poised For Near-Term Upside,2017-03-07 11:29:00-05:00,PHM,positive
1008840.0,"Attention, Income Investors: Homebuilders With The Best Dividend Yields",2017-02-27 10:11:00-05:00,PHM,positive
1008841.0,7 Biggest Price Target Changes For Tuesday,2017-02-14 10:41:00-05:00,PHM,neutral
1008842.0,"Benzinga's Top Upgrades, Downgrades For February 14, 2017",2017-02-14 09:27:00-05:00,PHM,positive
1008843.0,"FBR Capital Upgrades PulteGroup to Outperform, Raises Target to $26.00",2017-02-14 07:47:00-05:00,PHM,neutral
1008844.0,BTIG Research Initiates Coverage On PulteGroup At Neutral,2017-02-08 07:31:00-05:00,PHM,neutral
1008845.0,Bank of America Upgrades PulteGroup To Buy,2017-01-27 07:30:00-05:00,PHM,neutral
1008846.0,"PulteGroup Reports Q4 Adj. EPS $0.67 vs $0.59 Est., Sales $2.49B vs $2.32B Est.",2017-01-26 06:32:00-05:00,PHM,neutral
1008847.0,"Earnings Scheduled For January 26, 2017",2017-01-26 06:03:00-05:00,PHM,neutral
1008848.0,"Alphabet, Priceline, PulteGroup: Fast Money Picks For January 10",2017-01-10 07:05:00-05:00,PHM,neutral
1008849.0,"Barclays Initiates Coverage On PulteGroup at Overweight, Announces $21.00 Target",2017-01-06 06:01:00-05:00,PHM,negative
1008850.0,Tim Seymour Is A Buyer Of PulteGroup,2016-12-29 06:54:00-05:00,PHM,neutral
1008851.0,"Najarian Brothers See Unusual Options Activity In PulteGroup, Intel",2016-12-08 14:28:00-05:00,PHM,neutral
1008852.0,Fast Money Traders Share Their Trades After Wednesday's Big Rally,2016-12-08 06:26:00-05:00,PHM,positive
1008853.0,"Honeywell, PulteGroup And ETFs: Fast Money Picks For November 23",2016-11-23 06:37:00-05:00,PHM,neutral
1008854.0,Fast Money Traders Reveal Their Picks At Market Highs,2016-11-23 06:33:00-05:00,PHM,neutral
1008855.0,"Evercore ISI Group Initiates Coverage On PulteGroup, Inc. Common Stock at Hold",2016-11-15 07:33:00-05:00,PHM,neutral
1008856.0,Wall Street's M&A Chatter From November 10,2016-11-11 06:35:00-05:00,PHM,neutral
1008857.0,Watch These 7 Huge Call Purchases In Friday Trade,2016-11-11 02:27:00-05:00,PHM,positive
1008858.0,Option Alert: PHM Dec16 19.0 Calls Sweep: 617 @  ASK  $0.585: 757 traded vs 367 OI:  Earnings 1/26 Before Open (est)  $18.64 Ref,2016-11-10 15:56:00-05:00,PHM,positive
1008859.0,"Lennar, Pulte Shares Volatile Here, Largely Unch as Traders Passing Around Unconfirmed Chatter of a Merger",2016-11-10 14:10:00-05:00,PHM,positive
1008860.0,Option Alert: PHM Fri 11/11 18.5 Calls (Wkly) Sweep: 500 @  ASK  $0.13: 2681 traded vs 25 OI:  Earnings 1/26 Before Open (est)  $18.29 Ref,2016-11-10 14:10:00-05:00,PHM,positive
1008861.0,Consolidation In The Homebuilding Sector Continues As Toll Brothers Buys Coleman Homes,2016-11-07 11:51:00-05:00,PHM,neutral
1008862.0,"Citigroup On Homebuilding M&A Possibilities: DR Horton, Toll Brothers And PulteGroup Targets In Focus",2016-11-01 09:29:00-04:00,PHM,neutral
1008863.0,"The Market In 5 Minutes: Tesla's Announcement, Major Earnings And Jobless Claims",2016-10-20 09:02:00-04:00,PHM,neutral
1008864.0,"A Peek Into The Markets: U.S. Stock Futures Up Ahead Of Earnings, Economic Data",2016-10-20 07:46:00-04:00,PHM,neutral
1008865.0,PulteGroup Q3 Earnings Miss,2016-10-20 07:10:00-04:00,PHM,negative
1008866.0,"PulteGroup Q3 EPS $0.37 vs $0.44 est, Revenue $1.94B vs $1.95B est",2016-10-20 06:35:00-04:00,PHM,neutral
1008867.0,Watch These Huge Put Purchases In Thursday Trade,2016-10-20 02:45:00-04:00,PHM,positive
1008868.0,Option Alert: PHM Jan $17 Put; 3000 @Bid @$0.28; Ref=$19.93,2016-10-19 14:10:00-04:00,PHM,positive
1008869.0,Pulte Shares Indicated Higher Premarket; Hearing Cleveland Research Has Highlighted Co.'s Inline Results Amid an Industry Which is Moderating Slightly,2016-10-18 09:06:00-04:00,PHM,positive
1008870.0,Wells Fargo Initiates Coverage on PulteGroup at Market Perform,2016-09-29 06:34:00-04:00,PHM,positive
1008871.0,Homebuilding Stocks In Focus Following Lennar-WCI Deal,2016-09-22 08:23:00-04:00,PHM,neutral
1008872.0,"Watch Other Homebuilder Stocks Amid Lennar, WCI Deal: KB Home, Pulte, Toll, LGI, MDC, Taylor Morrison, AV Homes",2016-09-22 06:57:00-04:00,PHM,neutral
1008873.0,"Wedbush Initiates Coverage on PulteGroup at Underperform, Announces $16.00 PT",2016-09-20 02:30:00-04:00,PHM,neutral
1008874.0,Upcoming Earnings In The Housing Sector,2016-09-19 13:54:00-04:00,PHM,neutral
1008875.0,PulteGroup Investors Getting Growth Without The Growing Pains,2016-09-15 16:51:00-04:00,PHM,positive
1008876.0,"10 Notable Stocks Trading Ex-Dividend Friday, September 16",2016-09-15 16:34:00-04:00,PHM,neutral
1008877.0,PulteGroup Provides Statement From Newly Appointed Board Member Bill Pulte,2016-09-08 09:02:00-04:00,PHM,neutral
1008878.0,PulteGroup Names Ryan Marshall CEO,2016-09-08 08:32:00-04:00,PHM,neutral
1008879.0,"PulteGroup, JetBlue, Gold And The VIX: Fast Money Picks For August 24",2016-08-24 06:34:00-04:00,PHM,neutral
1008880.0,"Homebuilders In Focus Following Toll Earnings, Ahead Of Housing Data",2016-08-23 09:28:00-04:00,PHM,neutral
1008881.0,Pulte Mortgage Entered into Third Amendment to Amended and Restated Master Purchase Agreement With Comerica Bank,2016-08-17 09:31:00-04:00,PHM,positive
1008882.0,The Most Popular Stocks This 13F Season,2016-08-16 12:07:00-04:00,PHM,positive
1008883.0,13F from Elliott Shows New 5M Share Stake in PulteGroup,2016-08-15 16:19:00-04:00,PHM,positive
1008884.0,Improving Economic Conditions Support Strong Home Buyer Sentiment,2016-08-09 13:32:00-04:00,PHM,positive
1008885.0,PulteGroup Spokesperson Confirms To Benzinga That PulteGroup Management Cancelling Out Of Conference Due To Delta Outage,2016-08-08 10:18:00-04:00,PHM,negative
1008886.0,Option Alert: PHM Oct16 24.0 Calls Sweep: 509 @  ASK  $0.30: 509 traded vs 1428 OI: $21.60 Ref,2016-08-08 10:10:00-04:00,PHM,positive
1008887.0,BZ NOTE: Pulte Was Scheduled to Present at Credit Suisse's Homebuilding & Building Products Conference Today,2016-08-08 10:08:00-04:00,PHM,positive
1008888.0,PulteGroup Shares Relatively Quiet Following Chatter Co. Has Cancelled Out of Upcoming Conference,2016-08-08 10:07:00-04:00,PHM,positive
1008889.0,"Moody's Says Outlook for Homebuilders Positive on Employment Growth, Tight Inventory",2016-07-26 13:52:00-04:00,PHM,positive
1008890.0,Stocks Hitting 52-Week Highs,2016-07-25 10:25:00-04:00,PHM,neutral
1008891.0,Benzinga's Top Upgrades,2016-07-25 08:58:00-04:00,PHM,positive
1008892.0,Deutsche Bank Upgrades PulteGroup to Buy,2016-07-25 06:54:00-04:00,PHM,neutral
1008893.0,JP Morgan Upgrades PulteGroup to Overweight,2016-07-22 09:20:00-04:00,PHM,neutral
1008894.0,UPDATE: Full PR Highlighting PulteGroup Founder Thoughts On Company,2016-07-21 14:25:00-04:00,PHM,neutral
1008895.0,"PulteGroup Founder Comments On Shareholder Victories At PulteGroup, Focus Turns To Growth, Over $1.3B Value Created For Shareholders Since Founder Involvement",2016-07-21 14:24:00-04:00,PHM,positive
1008896.0,CNBC's Scott Wapner Issue Series of Tweets on Conversation with PulteGroup Founder,2016-07-21 13:29:00-04:00,PHM,neutral
1008897.0,15 Biggest Mid-Day Gainers For Thursday,2016-07-21 12:55:00-04:00,PHM,neutral
1008898.0,"CNBC's Scott Wapner Tweets: Elliott did not focus on immediate removal of $PHM CEO Dugas, but rather on new CEO search with new Board members",2016-07-21 11:32:00-04:00,PHM,neutral
1008899.0,CNBC's Scott Wapner Tweets: Sources: Elliott believes $PHM shares should trade at $35-$40 per share with new value creation plan.,2016-07-21 11:30:00-04:00,PHM,positive
1008900.0,18 Stocks Moving In Thursday's Pre-Market Session,2016-07-21 08:23:00-04:00,PHM,neutral
1008901.0,"PulteGroup Raises Buyback Plan by $1B to $1.5B, Says Will Buyback Shares by End of '17",2016-07-21 06:43:00-04:00,PHM,positive
1008902.0,"PulteGroup Reports Q2 GAAP EPS $0.34 vs $0.32 Est., Home Sales$1.8B vs $1.66B Est.",2016-07-21 06:36:00-04:00,PHM,neutral
1008903.0,"Earnings Scheduled For July 21, 2016",2016-07-21 05:18:00-04:00,PHM,neutral
1008904.0,Option Alert: PHM Fri 7/22 21.5 Calls (Wkly): 500 @  ASK  $0.10: 515 traded vs 30 OI:  Earnings tmrrw Before Open  $20.50 Ref,2016-07-20 11:21:00-04:00,PHM,positive
1008905.0,A Look Back And A Look Ahead For Homebuilding Data,2016-07-18 13:27:00-04:00,PHM,neutral
1008906.0,"Credit Suisse's Contrarian Calls On AK Steel, Kellogg's And Others",2016-07-05 13:34:00-04:00,PHM,positive
1008907.0,Board Director Patrick J. O'Leary Sends Letter to William Pulte -8K,2016-06-15 12:23:00-04:00,PHM,neutral
1008908.0,UPDATE: Pulte Founder's Full Letter to Co. Board,2016-06-15 10:02:00-04:00,PHM,neutral
1008909.0,PulteGroup Founder Pulte Sends Letter to Pulte Board: 'Encouraged by Engagement in CEO Search Process and Looks Forward to Working Constructively with the Board to Identify PulteGroup's Next CEO',2016-06-15 10:01:00-04:00,PHM,positive
1008910.0,UPDATE: Scott Wapner @ScottWapnerCNBC Tweet: Told by sources that Elliott's $PHM stake larger than 4% but under 5% threshold that would require SEC filing,2016-06-07 13:34:00-04:00,PHM,neutral
1008911.0,UPDATE: PulteGroup Spikes to High of $19.68 on Rumor of Elliott Management Stake,2016-06-07 13:30:00-04:00,PHM,neutral
1008912.0,CNBC Now @CNBCnow Tweet: BREAKING: Elliott Management takes stake in Pulte Group - sources   (via @ScottWapnerCNBC),2016-06-07 13:28:00-04:00,PHM,neutral
1008913.0,"Raymond James Downgrades PulteGroup, Believes 'Overhangs Linger'",2016-04-25 15:02:00-04:00,PHM,neutral
1008914.0,"The Market In 5 Minutes: Monday, April 25, 2016",2016-04-25 09:55:00-04:00,PHM,neutral
1008915.0,Benzinga's Top Downgrades,2016-04-25 09:12:00-04:00,PHM,positive
1008916.0,"Raymond James Downgrades PulteGroup to Market Perform, Removes $19.00 PT",2016-04-25 06:51:00-04:00,PHM,neutral
1008917.0,"From Conf Call: Pulte Says Saw Positive Traffic,Demand Conditions Across Country During Q1; Trend Continued Into April",2016-04-21 08:59:00-04:00,PHM,positive
1008918.0,"PulteGroup Q1 EPS $0.24 vs $0.20 est, Revenue $1.40B vs $1.36B est",2016-04-21 06:37:00-04:00,PHM,neutral
1008919.0,"Earnings Scheduled For April 21, 2016",2016-04-21 04:14:00-04:00,PHM,neutral
1008920.0,Option Alert: PHM 4/29 19.0 Calls (Wkly) Sweep: 668 @  ASK  $0.64: 668 traded vs 250 OI:  Earnings tmrrw Before Open  $19.10 Ref,2016-04-20 12:45:00-04:00,PHM,positive
1008921.0,PulteGroup Reports ISS Has Recommended Holders Vote FOR All Co. Board Nominees,2016-04-13 07:46:00-04:00,PHM,positive
1008922.0,"8-K from PulteGroup Shows Board's Finance and Investment Committee Member, James Grosfeld, Resigned",2016-04-12 17:52:00-04:00,PHM,negative
1008923.0,William Pulte Leeter Says under Richard Dugas there has been No Value Creation for Shareholders,2016-04-12 16:28:00-04:00,PHM,positive
1008924.0,PulteGroup Founder Vs. Current CEO: The Saga Continues,2016-04-11 13:57:00-04:00,PHM,neutral
1008925.0,PulteGroup Issues Statement Saying They Are Disappointed At The Attacks To Destabilize Leadership,2016-04-11 13:30:00-04:00,PHM,negative
1008926.0,"PulteGroup Founder William Pulte Issues Letter Calling For Replacement Of CEO RIchard Dugas, Highlights Lack Of Experience And No Value Creation Over The Span Of His Tenure",2016-04-11 08:59:00-04:00,PHM,neutral
1008927.0,PulteGroup Founder Sends Letter to Co. Board Urging Replacement of CEO Dugas,2016-04-11 08:59:00-04:00,PHM,neutral
1008928.0,Benzinga's Top Upgrades,2016-04-06 09:12:00-04:00,PHM,positive
1008929.0,"Barclays Upgrades PulteGroup, Says Its Management Concerns Are Overblown",2016-04-06 07:47:00-04:00,PHM,neutral
1008930.0,"Barclays Upgrades PulteGroup to Equal-weight, Maintains $18.00 PT",2016-04-06 04:32:00-04:00,PHM,neutral
1008931.0,JPMorgan Running From PulteGroup After CEO Loss,2016-04-05 10:36:00-04:00,PHM,negative
1008932.0,UPDATE: PulteGroup Lead Independent Director Sends Open Letter to Holders,2016-04-05 09:15:00-04:00,PHM,neutral
1008933.0,UPDATE: PulteGroup Says 'we want to reassure our shareholders that the Board stands firmly behind the Company's Value Creation strategy',2016-04-05 09:15:00-04:00,PHM,positive
1008934.0,"PulteGroup Sends Open Letter to Holders, Offers Board Update",2016-04-05 09:14:00-04:00,PHM,neutral
1008935.0,Benzinga's Top Downgrades,2016-04-05 08:46:00-04:00,PHM,positive
1008936.0,"PulteGroup Founder On Recently-Fired CEO: Extreme Disappointment, Inadequate Performance",2016-04-05 07:52:00-04:00,PHM,negative
1008937.0,"JP Morgan Downgrades PulteGroup to Neutral, Lowers PT to $18.00",2016-04-05 06:02:00-04:00,PHM,positive
1008938.0,UPDATE: William Pulte Letter to PulteGroup Board Shows Reiteration of 'my extreme disappointment in the leadership of CEO Richard Dugas and the lack of performance of PulteGroup under his watch',2016-04-04 16:57:00-04:00,PHM,negative
1008939.0,UPDATE: PulteGroup's William Pulte Sends Letter to Board,2016-04-04 16:55:00-04:00,PHM,neutral
1008940.0,"PulteGroup Founder, Largest Holder, William Pulte, Sends Letter to Co. Board",2016-04-04 16:54:00-04:00,PHM,neutral
1008941.0,"The Stocks That Moved The S&P, Dow And Nasdaq Today",2016-04-04 16:52:00-04:00,PHM,neutral
1008942.0,KeyBanc Downgrades PulteGroup to Sector Perform,2016-04-04 12:48:00-04:00,PHM,neutral
1008943.0,Zelman & Associates Downgrades PulteGroup to Hold,2016-04-04 10:03:00-04:00,PHM,neutral
1008944.0,"PulteGroup Announces Chair, CEO Richard Dugas to Retire; Board Has Formed Special Committee to Find Successor",2016-04-04 06:10:00-04:00,PHM,positive
1008945.0,"PulteGroup Announces Richard Dugas to Retire as Chairman, CEO, Effective May 2017",2016-04-04 06:03:00-04:00,PHM,positive
1008946.0,PulteGroup Price Isn't Right; BoA Downgrades,2016-03-16 11:09:00-04:00,PHM,neutral
1008947.0,"Bank of America Downgrades PulteGroup to Underperform, Maintains $18.00 PT",2016-03-16 07:45:00-04:00,PHM,neutral
1008948.0,Fast Money Picks For February 24,2016-02-24 06:41:00-05:00,PHM,neutral
1008949.0,Earnings Recap For January 28,2016-01-28 16:34:00-05:00,PHM,neutral
1008950.0,"Pultegroup Q4 EPS $0.64 vs $0.49 est, Revenue $2.06B vs $1.85B est",2016-01-28 06:34:00-05:00,PHM,neutral
1008951.0,"Earnings Scheduled For January 28, 2016",2016-01-28 04:04:00-05:00,PHM,neutral
1008952.0,What Fast Money Traders Are Watching In The Housing Sector,2016-01-24 19:57:00-05:00,PHM,neutral
1008953.0,Existing Home Sales Hit 10-Year High For December 2015,2016-01-22 12:07:00-05:00,PHM,neutral
1008954.0,Q&A With Top Real Estate Analyst: 10 Questions Investors Should Know,2016-01-13 15:45:00-05:00,PHM,positive
1008955.0,Benzinga's Top Upgrades,2016-01-13 09:21:00-05:00,PHM,positive
1008956.0,JP Morgan Upgrades PulteGroup to Overweight,2016-01-13 06:35:00-05:00,PHM,neutral
1008957.0,Benzinga's Top Upgrades,2016-01-08 09:09:00-05:00,PHM,positive
1008958.0,Raymond James Upgrades PulteGroup to Outperform,2016-01-08 08:02:00-05:00,PHM,neutral
1008959.0,Option Alert: PHM Fri 1/8 16.5 Puts (Wkly) Sweep: 650 @  ASK  $0.15: 650 traded vs 10 OI:  Earnings 1/28 Before Open  $17.07 Ref,2016-01-04 13:23:00-05:00,PHM,positive
1008960.0,Homebuilders Selloff on Volume,2016-01-04 13:02:00-05:00,PHM,neutral
1008961.0,"Pope Resources Sells Lots to Pulte Homes, Quarant Homes Totaling $4.9M",2015-12-23 20:08:00-05:00,PHM,neutral
1008962.0,"PulteGroup Reports Purchase of Certain Homebuilding Assets of John Wieland Homes, Neighborhoods for $430M-$450M",2015-12-16 09:07:00-05:00,PHM,positive
1008963.0,Credit Suisse Shakes Up Recommendations In Housing Sector: It's All About ROEs,2015-12-15 14:36:00-05:00,PHM,positive
1008964.0,"UPDATE: Credit Suisse Highlights Favorite Long Picks in Homebuilders: CalAtlantic, Toll Bros., William Lyon Homes; Top Underperforms: Pulte, NVR, KB Homes",2015-12-15 08:08:00-05:00,PHM,positive
1008965.0,PulteGroup Increases Buyback From $750M To $1.05B,2015-12-02 16:48:00-05:00,PHM,neutral
1008966.0,"UPDATE: Traders in Homebuilding Sector Attributing Group-Wide Strength to Comments Coming Out of UBS Building, Building Products Annual CEO Conference",2015-11-11 12:16:00-05:00,PHM,positive
1008967.0,Strength in Homebuilder Stocks May be Attributed to Several Analyst PT Raises for DR Horton on Wednesday,2015-11-11 11:26:00-05:00,PHM,positive
1008968.0,UPDATE: Report Homebuilders Next Industry to Come Under Federal Scrutiny,2015-11-04 15:09:00-05:00,PHM,neutral
1008969.0,"Pultegroup Q3 PS $0.30 vs $0.43 est, Revenue $1.51B vs $1.77B est",2015-10-22 06:31:00-04:00,PHM,neutral
1008970.0,Nailed It: This Leveraged ETF Is On Fire,2015-10-21 08:04:00-04:00,PHM,negative
1008971.0,How Morgan Stanley Is Playing Homebuilders In 2016,2015-10-14 14:22:00-04:00,PHM,positive
1008972.0,Benzinga's Top Downgrades,2015-10-13 09:47:00-04:00,PHM,positive
1008973.0,"Morgan Stanley Downgrades PulteGroup to Underweight, Lowers PT to $18.00",2015-10-13 04:23:00-04:00,PHM,negative
1008974.0,18 Contrarian Stock Ideas: From Box To Seaworld,2015-10-09 09:37:00-04:00,PHM,neutral
1008975.0,Top 4 NYSE Stocks In The Residential Construction Industry With The Highest Revenue,2015-10-08 04:57:00-04:00,PHM,positive
1008976.0,Benzinga's Top #PreMarket Gainers,2015-09-04 08:07:00-04:00,PHM,positive
1008977.0,How To Play The Coming New Home Sales Surge,2015-08-12 19:42:00-04:00,PHM,positive
1008978.0,"PulteGroup Reports Q2 EPS $0.28 vs $0.26 Est., Sales $1.28B vs $1.37B Est.",2015-07-23 06:31:00-04:00,PHM,neutral
1008979.0,"Earnings Scheduled For July 23, 2015",2015-07-23 04:46:00-04:00,PHM,neutral
1008980.0,"Credit Suisse Sees Home Builder EPS Expectations For '2H and 2016 as generally too optimistic', Sees Better Pricing From Builders Being Offset By Higher Lands & Labor Prices",2015-07-20 07:48:00-04:00,PHM,positive
1008981.0,Bill Miller Says Builders are Big Part of Portfolio; Likes Pulte Better than Lennar #DeliveringAlpha,2015-07-15 11:09:00-04:00,PHM,positive
1008982.0,Fast Money Picks For June 22,2015-06-21 19:17:00-04:00,PHM,neutral
1008984.0,Sterne Agee CRT: 6 Homebuilders To Buy On Weakness,2015-05-21 07:36:00-04:00,PHM,negative
1008985.0,April Housing Data Obliterates Expectations; Investors Buy In,2015-05-19 08:52:00-04:00,PHM,neutral
1008986.0,Raymond James' Mass Downgrade Of Homebuilders Shows...It Doesn't Like Them Very Much,2015-05-15 15:11:00-04:00,PHM,negative
1008987.0,Raymond James Downgrades PulteGroup to Market Perform,2015-05-15 08:47:00-04:00,PHM,neutral
1008988.0,Zelman Upgrades PulteGroup to Buy,2015-04-24 08:43:00-04:00,PHM,neutral
1008989.0,Morning Market Losers,2015-04-23 09:54:00-04:00,PHM,negative
1008990.0,Benzinga's Top #PreMarket Losers,2015-04-23 08:29:00-04:00,PHM,negative
1008991.0,"JP Morgan Downgrades PulteGroup to Underweight, Maintains $21.00 PT",2015-04-09 06:33:00-04:00,PHM,positive
1008992.0,Housing ETFs Near 8-Year Highs,2015-03-24 15:51:00-04:00,PHM,neutral
1008993.0,3 Important ETFs Sitting On Support,2015-03-12 16:26:00-04:00,PHM,positive
1008994.0,CORRECTION: Buckingham Research Upgrades PulteGroup to Buy,2015-03-09 08:40:00-04:00,PHM,neutral
1008996.0,"Pulte Group Director Hawaux Buys 6,000 Shares $21.80/Share -Form 4",2015-03-05 14:05:00-05:00,PHM,positive
1008997.0,Why 1 Analyst Just Raised Price Targets On These 7 Homebuilders,2015-02-19 09:10:00-05:00,PHM,neutral
1008998.0,"Citi Dishes On Housing, Details 'The Good, The (Less) Bad And The (Not So) Ugly'",2015-02-11 14:05:00-05:00,PHM,negative
1008999.0,BofA On The U.S. Housing Market: 'Feelin' Alright',2015-02-10 14:11:00-05:00,PHM,positive
1009000.0,Will The Fed's Interest Rate Hike Hit Homebuilders?,2015-02-01 10:55:00-05:00,PHM,positive
1009001.0,CNBC's Stock Pops & Drops From January 29,2015-01-30 07:01:00-05:00,PHM,neutral
1009002.0,Wells Fargo Downgrades PulteGroup to Market Perform,2015-01-30 06:17:00-05:00,PHM,positive
1009003.0,UPDATE: PulteGroup Posts Upbeat Q4 Results,2015-01-29 07:34:00-05:00,PHM,neutral
1009004.0,Pulte Reports Q4 EPS $0.58 vs $0.40 Est; Revenue $1.82B vs $1.76B Est,2015-01-29 06:32:00-05:00,PHM,neutral
1009005.0,"With Housing Stocks Mixed, This Analyst Says A Recovery 'Is Still Barely On First Base'",2015-01-27 12:02:00-05:00,PHM,neutral
1009006.0,Credit Suisse Analyst: Headwinds Blast Homebuilders' Outlook,2015-01-20 17:13:00-05:00,PHM,positive
1009007.0,Homebuilding Stocks Fall Amid Housing Market Index Report,2015-01-20 13:11:00-05:00,PHM,neutral
1009008.0,"Buckingham Research Downgrades PulteGroup to Neutral, Lowers PT to $23.00",2015-01-20 09:31:00-05:00,PHM,negative
1009009.0,Benzinga's Top Downgrades,2015-01-20 09:11:00-05:00,PHM,positive
1009010.0,Credit Suisse Lowers Expectations On Housing,2015-01-20 08:20:00-05:00,PHM,positive
1009011.0,Credit Suisse Downgrades PulteGroup To Underperform,2015-01-20 08:14:00-05:00,PHM,positive
1009012.0,"Credit Suisse Downgrades PulteGroup to Underperform, Lowers PT to $19.00",2015-01-20 04:19:00-05:00,PHM,positive
1009013.0,Morgan Stanley Mostly Lukewarm On Homebuilders,2015-01-15 12:32:00-05:00,PHM,neutral
1009014.0,Morgan Stanley on Homebuilders:,2015-01-15 07:44:00-05:00,PHM,neutral
1009015.0,Homebuilding Stocks To Watch Following KB Home's Q4 Results,2015-01-13 11:40:00-05:00,PHM,neutral
1009016.0,"With Home Builders In Focus, It's Time To Look At What The Experts Are Saying",2015-01-08 14:59:00-05:00,PHM,neutral
1009017.0,Housing-Related Stocks Move Higher Ahead of Obama Speech,2015-01-08 11:39:00-05:00,PHM,neutral
1009018.0,President Obama to Speak at 12:45 PM ET About Housing Market,2015-01-08 11:37:00-05:00,PHM,neutral
1009019.0,Will SUPERVALU Surprise Q3 Earnings Estimates?,2015-01-06 16:07:00-05:00,PHM,positive
1009020.0,"Sterne Agee's Housing Outlook: YOY Growth Expected, Mortgage Availability A Concern",2015-01-02 08:49:00-05:00,PHM,positive
1009021.0,How To Find The Best Home Builders In 7 Easy Steps,2014-12-31 08:12:00-05:00,PHM,positive
1009022.0,"Homebuilder Confidence Dips, Sector Stocks Follow",2014-12-15 15:19:00-05:00,PHM,positive
1009023.0,Best And Worst ETFs Of November,2014-12-04 11:30:00-05:00,PHM,neutral
1009024.0,How Positive Housing Numbers Are Helping 2 ETFs Break Out,2014-11-18 15:22:00-05:00,PHM,positive
1009025.0,Homebuilders Surge On Toll Brothers' Positive Sales,2014-11-10 15:20:00-05:00,PHM,positive
1009026.0,"Bank of America Maintains Buy on PulteGroup, Inc., Raises PT to $25.00",2014-11-10 06:53:00-05:00,PHM,neutral
1009027.0,"Fast Money Halftime Report Final Trade From October 29: Macy's, PulteGroup, Boardwalk Pipeline",2014-10-29 15:44:00-04:00,PHM,neutral
1009028.0,"PulteGroup's Stock Looks Cheap, But What Do The Technicals Show?",2014-10-29 14:04:00-04:00,PHM,neutral
1009029.0,"PulteGroUp, Inc. Reports Q3 EPS of $0.37 vs $0.36 Est; Revenue of $1.59B vs $1.58B Est",2014-10-23 06:40:00-04:00,PHM,neutral
1009030.0,PulteGroup to Buyback Up to Additional $750M of Shares; Raises Dividend 60% to $0.08/Share,2014-10-23 06:35:00-04:00,PHM,positive
1009031.0,Buckingham Initiates Coverage On Several Homebuilders,2014-10-20 13:23:00-04:00,PHM,neutral
1009032.0,"Buckingham Research Initiates Coverage on PulteGroup, Inc. at Buy, Announces $24.00 PT",2014-10-20 08:38:00-04:00,PHM,neutral
1009033.0,Sterne Agee Previews Homebuilder Sector Earnings: Exercise Caution,2014-10-15 14:29:00-04:00,PHM,neutral
1009034.0, Compass Point Research Offers 'The Home Builder Hope Trade',2014-10-13 11:49:00-04:00,PHM,positive
1009035.0,Home Construction Stocks In Play,2014-10-13 09:02:00-04:00,PHM,positive
1009036.0,"Compass Point Maintains Neutral on PulteGroup, Inc., Raises PT to $19.00",2014-10-13 06:07:00-04:00,PHM,neutral
1009037.0,"#PreMarket Primer: Friday, October 10: Amazon To Offer Face-To-Face Interaction ",2014-10-10 08:49:00-04:00,PHM,positive
1009038.0,"Goldman Sachs Upgrades PulteGroup, Inc. to Neutral, Maintains $18.50 PT",2014-10-02 05:36:00-04:00,PHM,neutral
1009039.0,Homebuilders Reverse Rally On August Construction News,2014-09-18 13:37:00-04:00,PHM,neutral
1009040.0,5 Industrial Goods Stocks With The Lowest PEG Ratio,2014-09-10 09:25:00-04:00,PHM,negative
1009041.0,JP Morgan Still Likes Housing,2014-09-09 16:07:00-04:00,PHM,positive
1009042.0,"JP Morgan Upgrades PulteGroup, Inc. to Neutral, Raises PT to $22.00",2014-09-09 05:38:00-04:00,PHM,positive
1009043.0,Toll Brothers Inc 6% Decline In Q3 Contracts Drags Down Sector,2014-09-03 13:59:00-04:00,PHM,negative
1009044.0,New Home Sales Miss Estimates; Housing Stocks Weaken,2014-08-25 11:46:00-04:00,PHM,negative
1009045.0,PulteGroup Acquires Real Estate Assets Of Dominion Homes; Financial Terms Not Disclosed ,2014-08-25 07:02:00-04:00,PHM,positive
1009046.0,Homebuilder Stocks Higher On Better Home Construction Numbers,2014-08-19 09:07:00-04:00,PHM,positive
1009047.0,Top 4 Mid-Cap Stocks In The Residential Construction Industry With The Highest ROE,2014-08-11 04:58:00-04:00,PHM,positive
1009048.0,Is Housing Raising Questions About The Recovery?,2014-07-31 12:46:00-04:00,PHM,neutral
1009049.0,Homebuilders Bring Down The House Following June Pending Home Sales,2014-07-28 14:03:00-04:00,PHM,neutral
1009050.0,3 More Homebuilder Stocks To Watch Ahead Of Earnings,2014-07-28 13:08:00-04:00,PHM,neutral
1009051.0,PulteGroup Reports Q2 EPS of $0.11 Which May Not Compare $0.25 Est; Revenue of $1.29B Which May Not Compare $1.34B Est,2014-07-24 06:32:00-04:00,PHM,neutral
1009052.0,3 Homebuilder Stocks To Watch Ahead of Earnings,2014-07-23 09:17:00-04:00,PHM,neutral
1009053.0,Barclays Revises Price Targets On Homebuilders,2014-06-30 15:33:00-04:00,PHM,neutral
1009054.0,Shares of SPDR S&P Homebuilder ETF Spiked 1+% Following Very Strong New Home Sales Reading,2014-06-24 10:09:00-04:00,PHM,positive
1009055.0,Top 4 Mid-Cap Stocks In The Residential Construction Industry With The Highest ROE,2014-06-18 04:44:00-04:00,PHM,positive
1009056.0,Spring Thaw: Is The Housing Sector Ready To Move?,2014-06-03 16:15:00-04:00,PHM,positive
1009057.0,Market Shrugs Off Lower April Pending Home Sales,2014-05-29 11:10:00-04:00,PHM,negative
1009058.0,"Option Alert: PulteGroup May 30 $20 Call; 8,478 Contracts Traded vs 36 OI; Currently $19.00",2014-05-14 10:36:00-04:00,PHM,positive
1009059.0,"Option Alert: Pultegroup Oct $21 Call; 7,230 Contracts Traded vs 264 OI; Currently $18.35",2014-05-08 12:55:00-04:00,PHM,positive
1009060.0,Top 4 NYSE Stocks In The Residential Construction Industry With The Highest Revenue,2014-05-06 04:57:00-04:00,PHM,positive
1009061.0,Jeffrey Gundlach from Doubleline Recommending Investors Short Homebuilders - Reuters,2014-04-25 15:50:00-04:00,PHM,neutral
1009062.0,"ETF Outlook for Thursday, April 24, 2014 (XLK, SOCL, ITB, FXE, AAPL, FB)",2014-04-24 10:06:00-04:00,PHM,neutral
1009063.0,PulteGroup Reports Q1 EPS of $0.19 vs $0.20 Est; Revenue of $1.12B vs $1.18B Est,2014-04-24 06:34:00-04:00,PHM,neutral
1009064.0,Home Sales Data Hits Homebuilder ETFs,2014-04-23 14:04:00-04:00,PHM,neutral
1009065.0,"Option Alert: Pultegroup Oct $20 Call; 5,000 Contracts Traded vs 289 OI; Currently $18.84",2014-04-17 10:57:00-04:00,PHM,positive
1009066.0,Top 4 NYSE Stocks In The Residential Construction Industry With The Highest Revenue,2014-03-27 04:36:00-04:00,PHM,positive
1009067.0,"Housing Sector: ETF Or Stocks? (ITB, XHB, DHI)",2014-03-25 14:17:00-04:00,PHM,neutral
1009068.0,#Premarket Prep Technical Update - PulteGroup Trading Higher,2014-03-25 11:43:00-04:00,PHM,neutral
1009069.0,"Homebuilding Near-Term Deceleration Will Reward Stock Pickers, Analyst Offers Picks",2014-03-25 11:22:00-04:00,PHM,positive
1009070.0,Benzinga's Top Downgrades,2014-03-25 08:22:00-04:00,PHM,positive
1009071.0,Benzinga's Top #PreMarket Losers,2014-03-25 08:15:00-04:00,PHM,negative
1009072.0,"Barclays Downgrades PulteGroup, Inc. to Underweight, Lowers PT to $20.00",2014-03-25 08:08:00-04:00,PHM,negative
1009073.0,S&P Upgrades PulteGroup from BB to BB+,2014-03-21 11:50:00-04:00,PHM,neutral
1009074.0,UPDATE: KB Homes Shares Rise 7% Premarket; Shares of Other Homebuilder Stocks Also Higher,2014-03-19 08:43:00-04:00,PHM,positive
1009075.0,Homebuilding Sector At Credit Suisse: What You Need To Know,2014-03-13 16:00:00-04:00,PHM,positive
1009076.0,UPDATE: Credit Suisse Downgrades Home Builders Amid 'Lackluster Demand',2014-03-12 12:57:00-04:00,PHM,positive
1009077.0,"Credit Suisse Downgrades PulteGroup, Inc. to Neutral, Maintains $20.00 PT",2014-03-12 07:12:00-04:00,PHM,positive
1009078.0,Fitch Upgrades PulteGroup's IDR to BB+; Outlook Stable,2014-03-10 08:43:00-04:00,PHM,positive
1009079.0,"KeyBanc Offers Pair Trade: Upgrades Pulte, Downgrades Lennar",2014-03-04 16:01:00-05:00,PHM,neutral
1009080.0,Benzinga's Top Upgrades,2014-03-04 08:48:00-05:00,PHM,positive
1009081.0,"KeyBanc Upgrades PulteGroup, Inc. to Buy, Announces $26.00 PT",2014-03-04 07:44:00-05:00,PHM,neutral
1009082.0,"#PreMarket Primer: Thursday, February 27: Markets Anxious To Hear Yellen",2014-02-27 07:24:00-05:00,PHM,negative
1009083.0,"#PreMarket Primer: Tuesday, February 25: Mt. Gox Disappears, Bitcoin Down 20%",2014-02-25 07:01:00-05:00,PHM,negative
1009084.0,"Compass Point Maintains Neutral on PulteGroup, Inc., Raises PT to $18.00",2014-02-03 08:42:00-05:00,PHM,neutral
1009085.0,"Susquehanna Upgrades PulteGroup, Inc. to Positive, Raises PT to $25.00",2014-02-03 08:14:00-05:00,PHM,positive
1009086.0,"Raymond James Upgrades PulteGroup, Inc. to Outperform, Announces $23.00 PT",2014-01-31 08:09:00-05:00,PHM,neutral
1009087.0,Pulte Reports Q4 EPS of $0.57 vs $0.44 Est; Revenue of $1.66B vs $1.68B Est,2014-01-30 06:32:00-05:00,PHM,neutral
1009088.0,Top 4 Mid-Cap Stocks In The Residential Construction Industry With The Highest EPS,2014-01-27 04:36:00-05:00,PHM,positive
1009089.0,Form 8-K from PulteGroup Shows Co. Borrowing Capacity Under Pact Reduced to $99.8M,2014-01-13 14:09:00-05:00,PHM,neutral
1009090.0,"JP Morgan Downgrades PulteGroup, Inc. to Underweight, Maintains $18.00 PT",2014-01-10 08:45:00-05:00,PHM,positive
1009091.0,"FBN Securities Downgrades PulteGroup, Inc. to Underperform",2013-12-30 16:22:00-05:00,PHM,positive
1009092.0,"Homebuilding Stocks Strong Following Citi's Upgrade Of KB, Ahead Of Home Sales Data",2013-12-23 14:41:00-05:00,PHM,positive
1009093.0,"PulteGroup, JC Penney Move Higher After-Hours on Comments from Bill Miller on CNCB",2013-12-19 16:44:00-05:00,PHM,neutral
1009094.0,"Homebuilding Sector Getting Some Attention Amid Analyst Note, Upcoming Earnings Data ",2013-12-17 16:37:00-05:00,PHM,neutral
1009095.0,"Citigroup Maintains Neutral on PulteGroup, Inc., Lowers PT to $19.00",2013-12-13 08:40:00-05:00,PHM,negative
1009096.0,Toll Bros. CEO Doug Yearley on CNBC Says Housing is a 'Long Way' from a Bubble,2013-12-10 15:47:00-05:00,PHM,neutral
1009097.0,Bank of America Comments on PulteGroup CEO's Presentation at Industrials and Materials Conference,2013-12-10 12:33:00-05:00,PHM,neutral
1009098.0,Top 4 Mid-Cap Stocks In The Residential Construction Industry With The Highest EPS Estimates,2013-10-31 05:37:00-04:00,PHM,positive
1009099.0,"Market Wrap for October 24: Microsoft, Amazon Earnings Cheer Investors as Stocks Rally",2013-10-24 17:20:00-04:00,PHM,positive
1009100.0,Shares of Pulte Moving Lower Despite Q3 Beat,2013-10-24 07:20:00-04:00,PHM,neutral
1009101.0,"Earnings Scheduled For October 24, 2013",2013-10-24 04:42:00-04:00,PHM,neutral
1009102.0,"UPDATE: Susquehanna Raises PT on PulteGroup on Fundamental Trends, Seasonal Tailwinds",2013-10-11 11:17:00-04:00,PHM,neutral
1009103.0,"Swings in Home Builder Short Interest (KBH, RYL, TMHC)",2013-09-28 11:56:00-04:00,PHM,positive
1009104.0,Top 4 Mid-Cap Stocks In The Residential Construction Industry With The Highest Cash,2013-09-26 05:13:00-04:00,PHM,positive
1009105.0,"Benzinga Market Primer: Monday, September 9: Futures Up As Japan Starts The Week Off With A Bang      ",2013-09-09 06:29:00-04:00,PHM,neutral
1009106.0,"Short Sellers Increase Stakes in Toll Bros., M/I Homes (MHO, TMHC, TOL)",2013-08-28 13:42:00-04:00,PHM,positive
1009107.0,"The Top 10 Financial Tweets For Monday, August 26",2013-08-26 13:50:00-04:00,PHM,positive
1009108.0,Benzinga's Top Upgrades,2013-08-19 08:20:00-04:00,PHM,positive
1009109.0,"Wells Fargo Upgrades PulteGroup, Inc. to Outperform",2013-08-19 08:15:00-04:00,PHM,positive
1009110.0,"RBC Capital Downgrades PulteGroup, Inc. to Outperform, Lowers PT to $20.00",2013-08-15 08:37:00-04:00,PHM,negative
1009111.0,"Meritage Homes, NVR See Big Short Interest Swings (KBH, MTH, NVR)",2013-08-10 13:25:00-04:00,PHM,positive
1009112.0,Traders in PulteGroup Considering 20K Buy from Director Thomas Folliard on Aug. 2nd,2013-08-02 14:55:00-04:00,PHM,neutral
1009113.0,"Compass Point Maintains Neutral on PulteGroup, Inc., Lowers PT to $17.50",2013-07-31 10:08:00-04:00,PHM,negative
1009114.0,UPDATE: Williams Financial Group Upgrades PulteGroup on Favorable Long-Term Outlook,2013-07-30 09:16:00-04:00,PHM,positive
1009115.0,"UBS Upgrades PulteGroup, Inc. to Buy",2013-07-30 09:14:00-04:00,PHM,neutral
1009116.0,"Raymond James Downgrades PulteGroup, Inc. to Market Perform, Removes $26.00 PT",2013-07-30 08:45:00-04:00,PHM,neutral
1009117.0,Benzinga's Top Upgrades,2013-07-30 07:56:00-04:00,PHM,positive
1009118.0,"Williams Financial Upgrades PulteGroup, Inc. to Buy",2013-07-30 07:49:00-04:00,PHM,neutral
1009119.0,ISI Downgraded PulteGroup from Buy to Neutral,2013-07-26 09:24:00-04:00,PHM,neutral
1009120.0,"Barclays Downgrades PulteGroup to Equalweight, Lowers PT to $18.00",2013-07-26 07:51:00-04:00,PHM,negative
1009121.0,Benzinga's Top Upgrades,2013-07-26 07:39:00-04:00,PHM,positive
1009122.0,"Credit Suisse Upgrades PulteGroup, Inc. to Outperform, Lowers PT to $21.00",2013-07-26 07:18:00-04:00,PHM,positive
1009123.0,"Market Wrap for Thursday, July 25: Facebook Leads Nasdaq Higher; SAC Capital Indicted ",2013-07-25 16:21:00-04:00,PHM,neutral
1009124.0,Mid-Afternoon Market Update: Sequenom Plummets as ONEOK Rises on News That it Will Spin Off Natural Gas Unit,2013-07-25 15:37:00-04:00,PHM,positive
1009125.0,"Taylor Morrison, TRI Pointe See Big Short Interest Swings (TMHC, TOL, TPH)",2013-07-25 13:26:00-04:00,PHM,positive
1009126.0,"Mid-Day Market Update: Facebook Shares Rise On Strong Results, Crocs Falls",2013-07-25 12:28:00-04:00,PHM,positive
1009127.0,"Mid-Morning Market Update: Markets Mostly Lower, GM Posts Upbeat Profit",2013-07-25 11:29:00-04:00,PHM,positive
1009128.0,Benzinga's Top Pre-Market Losers,2013-07-25 08:26:00-04:00,PHM,negative
1009129.0,PulteGroup Announces Quarterly Cash Dividend Of $0.05 Per Share And Increased Share Repurchase Authorization To $352 Million,2013-07-24 17:02:00-04:00,PHM,positive
1009130.0,"Compass Point Downgrades PulteGroup, Inc. to Neutral, Lowers PT to $19.50",2013-07-24 09:04:00-04:00,PHM,negative
1009131.0,"Stocks to Watch for the Week of July 22, 2013",2013-07-22 14:41:00-04:00,PHM,neutral
1009132.0,"Short Sellers Pile on to Taylor Morrison Home (SPF, TMHC, TOL)",2013-07-14 11:30:00-04:00,PHM,neutral
1009133.0,"Short Interest Continues to Rise in NVR and Taylor Morrison (NVR, TMHC, TOL)",2013-06-29 11:56:00-04:00,PHM,positive
1009134.0,SLIDESHOW: Top Stocks For The DOMA Ruling,2013-06-26 12:14:00-04:00,PHM,positive
1009135.0,S&P Upgrades PulteGroup from BB- to BB; Outlook to Stable,2013-06-26 11:12:00-04:00,PHM,positive
1009136.0,UPDATE: Bank of America Initiates PulteGroup at Neutral on Early Transition Stages,2013-06-26 09:34:00-04:00,PHM,neutral
1009137.0,Benzinga's Top Initiations,2013-06-26 07:54:00-04:00,PHM,positive
1009138.0,"Bank of America Initiates Coverage on PulteGroup, Inc. at Neutral, Announces $23.00 PO",2013-06-26 06:37:00-04:00,PHM,negative
1009139.0,PGT(R) Announces Partnership With PulteGroup ,2013-06-25 10:55:00-04:00,PHM,neutral
1009140.0,"Benzinga Market Primer: Tuesday, June 25: Housing In Focus",2013-06-25 06:23:00-04:00,PHM,neutral
1009141.0,UPDATE: Goldman Sachs Resumes PulteGroup at Sell on Slower Growth Markets,2013-06-24 08:43:00-04:00,PHM,positive
1009142.0,"Goldman Sachs Reinstates Sell on PulteGroup, Inc., Announces $18.00 PT",2013-06-24 06:32:00-04:00,PHM,neutral
1009143.0,"Market Wrap for Thursday, June 20: Sell-Off Intensifies as Prices Plunge Across Asset Classes ",2013-06-20 16:28:00-04:00,PHM,positive
1009144.0,"Stocks to Watch for the Week of June 17, 2013",2013-06-17 11:00:00-04:00,PHM,neutral
1009145.0,"Short Interest Swings in Home Builder Stocks (KBH, NVR, TMHC)",2013-06-14 10:03:00-04:00,PHM,positive
1009146.0,"Form 8-K from PulteGroup Shows $27-32M Lease Termination/Other Exit Costs, ~$10-15M in Relocation Costs, $500K-1M in Asset Impairments, $17-22M in Employee Severance, Relocation Costs",2013-06-05 16:31:00-04:00,PHM,positive
1009147.0,"Deutsche Bank Maintains Hold on PulteGroup, Inc., Raises PT to $19.00",2013-06-03 09:48:00-04:00,PHM,neutral
1009148.0,Michigan-Based Homebuilder Pulte Group Moving to Atlanta,2013-05-31 13:33:00-04:00,PHM,neutral
1009149.0,"PulteGroup Announces Plan to Relocate Corporate Offices to Atlanta, Georgia in 2014",2013-05-31 07:55:00-04:00,PHM,neutral
1009150.0,Hovnanian Enterprises: Small Cap Analysis,2013-05-23 10:51:00-04:00,PHM,neutral
1009151.0,KeyBanc Downgrades PulteGroup to Hold,2013-05-22 08:13:00-04:00,PHM,neutral
1009152.0,Believe It: A Bear Call on Homebuilder ETFs,2013-04-30 16:22:00-04:00,PHM,neutral
1009153.0,UPDATE: J.P. Morgan Downgrades PulteGroup to Neutral on Valuation,2013-04-30 10:21:00-04:00,PHM,neutral
1009154.0,Benzinga's Top Downgrades,2013-04-30 07:18:00-04:00,PHM,positive
1009155.0,"Benzinga Market Primer: Tuesday, April 30",2013-04-30 06:38:00-04:00,PHM,neutral
1009156.0,"JP Morgan Downgrades PulteGroup, Inc. to Neutral, Raises PT to $24.00",2013-04-30 06:27:00-04:00,PHM,positive
1009157.0,Top Stock Picks for Next Week,2013-04-29 10:16:00-04:00,PHM,positive
1009158.0,Short Interest in Home Builder Stocks ,2013-04-26 13:26:00-04:00,PHM,positive
1009159.0,"RBC Capital Upgrades PulteGroup, Inc. to Top Pick, Raises PT to $32.00",2013-04-26 07:23:00-04:00,PHM,positive
1009160.0,"PulteGroup, Inc. Reports Q1 EPS of $0.21 vs $0.15 Est; Revenue of $1.16B vs $1.19B Est",2013-04-25 06:33:00-04:00,PHM,neutral
1009161.0,PulteGroup to Redeem All Outstanding 2014 Notes Totaling $399M in Aggregate Principal Amount,2013-04-24 16:14:00-04:00,PHM,positive
1009162.0,"Barclays Upgrades PulteGroup, Inc. to Overweight, Raises PT to $23.00",2013-04-23 06:49:00-04:00,PHM,negative
1009163.0,Top 4 Mid-Cap Stocks In The Residential Construction Industry With The Highest EPS,2013-04-19 05:53:00-04:00,PHM,positive
1009164.0,"Short Interest Swings Home Builder Stocks (NVR, SPF, TPH)",2013-04-11 12:46:00-04:00,PHM,positive
1009165.0,"FBN Securities Upgrades PulteGroup, Inc. to Sector Perform",2013-04-03 16:52:00-04:00,PHM,positive
1009166.0,"Short Interest in Home Builder Stocks Rises (MTH, SPF, TPH)",2013-03-29 14:30:00-04:00,PHM,positive
1009167.0,Tuesday March 26th Watchlist,2013-03-26 08:18:00-04:00,PHM,neutral
1009168.0,"Short Interest in Home Builder Stocks Returns (HOV, MDC, TPH)",2013-03-14 12:53:00-04:00,PHM,positive
1009169.0,Benzinga's Top Initiations,2013-03-14 09:06:00-04:00,PHM,positive
1009170.0,UPDATE: Sterne Agee Initiates PulteGroup at Buy; Long-Term Value at Current Levels,2013-03-14 08:16:00-04:00,PHM,positive
1009171.0,"Sterne Agee Initiates Coverage on PulteGroup, Inc. at Buy, Announces $24.00 PT",2013-03-13 16:09:00-04:00,PHM,neutral
1009172.0,Benzinga's Top Pre-Market Losers,2013-03-13 08:50:00-04:00,PHM,negative
1009173.0,"Short Interest in Homebuilder Stocks Shrinks (DHI, MDC, PHM)",2013-03-02 09:56:00-05:00,PHM,positive
1009174.0,Cracking Foundations For Homebuilders ETFs?,2013-02-20 14:15:00-05:00,PHM,neutral
1009175.0,"Short Interest in Homebuilder Stocks Falls (HOV, MTH, PHM)",2013-02-12 16:42:00-05:00,PHM,positive
1009176.0,"Barclays Downgraded KB Home, Pulte and Realogy from Overweight to Equalweight and Toll from Equalweight to Underweight",2013-02-05 11:03:00-05:00,PHM,negative
1009177.0,"Deutsche Bank Maintains Hold on PulteGroup, Inc., Raises PT to $17.00",2013-02-05 08:33:00-05:00,PHM,neutral
1009178.0,2013 Housing Outlook: What If The Consensus Is Wrong,2013-02-04 14:22:00-05:00,PHM,negative
1009179.0,UPDATE: Williams Financial Group Downgrades PulteGroup to Hold Post In-Line Ratings,2013-02-01 08:51:00-05:00,PHM,neutral
1009180.0,"Williams Capital Markets Downgrades PulteGroup, Inc. to Hold, Raises PT to $23.00",2013-02-01 07:57:00-05:00,PHM,neutral
1009181.0,"Mid-Morning Market Update: Facebook Hurting Post-Earnings, JDS Uniphase Boosts",2013-01-31 10:29:00-05:00,PHM,negative
1009182.0,"PulteGroUp, Inc. Reports Q4 EPS of $0.15 vs $0.30 Est; Revenue of $1.57B vs $1.50B Est",2013-01-31 06:43:00-05:00,PHM,neutral
1009183.0,"Earnings Scheduled For January 31, 2013",2013-01-31 02:16:00-05:00,PHM,neutral
1009184.0,S&P Bearish on Home Builders ETF,2013-01-30 16:55:00-05:00,PHM,neutral
1009185.0,"Home Builders D.R. Horton, Ryland Show No Quit",2013-01-30 08:42:00-05:00,PHM,negative
1009186.0,"Credit Suisse Maintains Neutral on PulteGroup, Inc., Raises PT to $23.50",2013-01-30 07:23:00-05:00,PHM,positive
1009187.0,Home Builders: No; Mortgage Service Providers: Yes,2013-01-18 13:25:00-05:00,PHM,positive
1009188.0,These Housing Stocks are Staging a Big Rally This Year,2013-01-18 10:25:00-05:00,PHM,neutral
1009189.0,"Topeka Capital Suspends Buy Rating on PulteGroup, Inc., Removes $22.00 PT",2013-01-15 07:43:00-05:00,PHM,neutral
1009190.0,Lennar Earnings Preview: Another Strong Quarter Expected,2013-01-14 12:11:00-05:00,PHM,positive
1009191.0,Stocks Hitting 52-Week Highs,2012-12-18 10:20:00-05:00,PHM,neutral
1009192.0,UPDATE: Topeka Capital Markets Initiates PulteGroup at Buy; Move-Up Buyer Focus To Yield Growth  ,2012-12-07 07:50:00-05:00,PHM,positive
1009193.0,"Topeka Capital Initiates Coverage on PulteGroup, Inc. at Buy, Announces $22.00 PT",2012-12-07 07:13:00-05:00,PHM,neutral
1009194.0,UPDATE: Compass Point Raises PT to $21 on Pulte Homes on Strong Earnings Fundamentals  ,2012-11-29 10:41:00-05:00,PHM,positive
1009195.0,"Compass Point Reiterates Buy on PulteGroup, Inc., Raises PT to $21.00",2012-11-29 09:20:00-05:00,PHM,neutral
1009196.0,Could A Housing Stock Correction Be Overdue?,2012-11-20 13:25:00-05:00,PHM,neutral
1009197.0,Benzinga's Top Pre-Market Losers,2012-11-16 08:22:00-05:00,PHM,negative
1009198.0,Top 4 Mid-Cap Stocks In The Residential Construction Industry With The Highest Cash,2012-11-12 02:25:00-05:00,PHM,positive
1009199.0,"After Surging, Homebuilder ETFs Look Pricey ",2012-11-02 12:57:00-04:00,PHM,neutral
1009200.0,RBC Capital Upgraded Pulte Group from Sector Perform to Outperform,2012-10-26 10:06:00-04:00,PHM,neutral
1009201.0,Benzinga's Top Upgrades,2012-10-26 07:26:00-04:00,PHM,positive
1009202.0,FROM EARLIER: Pulte Group Reports Q3 EPS $0.30 vs $0.20 Est,2012-10-25 13:25:00-04:00,PHM,neutral
1009203.0,PulteGroup Announces Cash Tender Offers For Up To $1B Aggregate Principal Amount Of Certain Outstanding Notes,2012-10-24 17:06:00-04:00,PHM,positive
1009204.0,Missed the Home Builder Run? Consider These Ancillary Plays,2012-10-19 08:23:00-04:00,PHM,negative
1009205.0,Benzinga Mid-Morning Market Update,2012-10-17 10:36:00-04:00,PHM,neutral
1009206.0,Should Traders Chase the Builders At These Levels?,2012-09-21 10:08:00-04:00,PHM,neutral
1009207.0,UPDATE: Compass Point Upgrades PulteGroup to Buy on Mortgage Buyback Exposure  ,2012-09-20 12:56:00-04:00,PHM,neutral
1009208.0,"UBS Maintains Pulte Group at Neutral, Raises PT from $11 to $17",2012-09-20 11:02:00-04:00,PHM,neutral
1009209.0,Compass Point Upgrades Pulte Group from Market Perform to Buy,2012-09-20 07:47:00-04:00,PHM,neutral
1009210.0,"Stocks Watchlist For Thursday, September 13",2012-09-13 09:35:00-04:00,PHM,neutral
1009211.0,"Pulte Upgrade Lifts Homebuilders (PHM, KBH, LEN)",2012-09-13 07:30:00-04:00,PHM,neutral
1009212.0,"UPDATE: Williams Financial Group Upgrades PulteGroup to Buy, Raises PT",2012-09-12 09:57:00-04:00,PHM,neutral
1009213.0,"Williams Capital Upgrades Pulte Group from Hold to Buy, Raises PT from $13 to $17",2012-09-12 08:16:00-04:00,PHM,neutral
1009214.0,"Watchlist for Thursday, September 6",2012-09-06 09:21:00-04:00,PHM,neutral
1009215.0,"PHM Holder Pulte Obligated to Deliver 7M Shares, Will Deliver 6M Shares on August 19, 2011 Contract",2012-08-31 16:38:00-04:00,PHM,positive
1009216.0,Stock Picks for Friday August 17,2012-08-17 10:00:00-04:00,PHM,neutral
1009217.0,Homebuilder and Constructing Stocks Trading Up in Market : Builder Confidence Grows Reports NAHB ,2012-08-16 12:38:00-04:00,PHM,positive
1009218.0,Stock Picks for Wednesday August 15,2012-08-15 10:23:00-04:00,PHM,neutral
1009219.0,"Home Depot Beats Earnings Estimates, Raises Guidance",2012-08-14 12:02:00-04:00,PHM,neutral
1009220.0,Homebuilders Are Either Dead or Dead Money,2012-08-13 11:49:00-04:00,PHM,negative
1009221.0,"Friday's Stocks to Watch, Aug 10",2012-08-10 10:24:00-04:00,PHM,neutral
1009222.0,UPDATE: JP Morgan Upgrades PulteGroup to Overweight on Attractive Valuation  ,2012-08-09 07:22:00-04:00,PHM,positive
1009223.0,"JP Morgan Upgrades Pulte Group from Neutral to Overweight, Raises PT from $11.50 to $15",2012-08-09 05:44:00-04:00,PHM,neutral
1009224.0,"UBS Maintains Pulte Group at Neutral, Raises PT from $9 to $11",2012-08-02 12:15:00-04:00,PHM,neutral
1009225.0,"UPDATE: Citigroup Downgrades PulteGroup to Neutral, Raises PT",2012-07-30 11:25:00-04:00,PHM,neutral
1009226.0,"UPDATE: Williams Financial Reiterates Hold Rating, Raises PT on PulteGroup",2012-07-30 09:45:00-04:00,PHM,neutral
1009227.0,"Williams Capital Markets Maintains Pulte Group at Hold, Raises PT from $11 to $13",2012-07-30 07:45:00-04:00,PHM,neutral
1009228.0,Benzinga's Top Downgrades,2012-07-30 07:19:00-04:00,PHM,positive
1009229.0,"Citigroup Downgrades Pulte Group from Buy to Neutral, Raises PT from $10.50 to $13",2012-07-30 06:33:00-04:00,PHM,neutral
1009230.0,"UPDATE: ISI Group Reiterates Buy Rating, Raises PT on PulteGroup",2012-07-27 12:19:00-04:00,PHM,neutral
1009231.0,"ISI Group Maintains Pulte Group at Buy, Raises PT to $14",2012-07-27 08:11:00-04:00,PHM,neutral
1009232.0,PulteGroup Climbs on Strong EPS,2012-07-26 14:49:00-04:00,PHM,positive
1009233.0,PulteGroup Says Will Spend $900M on Land Development in 2012,2012-07-26 08:57:00-04:00,PHM,neutral
1009234.0,Pulte Group Reports Q2 EPS $0.13 vs $0.05 Est; Revenues $1.07B vs $1.11B Est,2012-07-26 06:33:00-04:00,PHM,neutral
1009235.0,Benzinga's Top Downgrades,2012-07-24 07:16:00-04:00,PHM,positive
1009236.0,"UPDATE: Goldman Sachs Reiterates Buy Rating, Raises PT on PulteGroup",2012-07-23 09:44:00-04:00,PHM,neutral
1009237.0,Housing Starts Rise to Highest Level Since Lehman Collapse,2012-07-18 09:06:00-04:00,PHM,negative
1009238.0,MKM Partners Downgrades Pulte Group from Buy to Neutral,2012-07-16 10:40:00-04:00,PHM,neutral
1009239.0,Buffett Is In A Holding Pattern On the Economy,2012-07-12 15:20:00-04:00,PHM,neutral
1009240.0,Five Homebuilders on the Rise,2012-07-03 10:19:00-04:00,PHM,neutral
1009241.0,S&P: Some ETF Investors Should Look at First-Half Laggards,2012-07-03 07:42:00-04:00,PHM,neutral
1009242.0,Lennar's Q2: Further Evidence That Housing Has Bottomed?,2012-06-27 11:41:00-04:00,PHM,neutral
1009243.0,Lucky Number 7: Case-Shiller Index Rises After Seven Months of Declines,2012-06-26 11:02:00-04:00,PHM,positive
1009244.0,Top Narrow Based Indexes For June 26,2012-06-26 10:17:00-04:00,PHM,positive
1009245.0,"New Home Sales Rise More than Expected, Hit 2-Year High",2012-06-25 13:23:00-04:00,PHM,neutral
1009246.0,Existing Home Sales Rise Less than Expected,2012-06-21 12:39:00-04:00,PHM,neutral
1009247.0,Bullish setups to watch next week,2012-06-15 17:59:00-04:00,PHM,neutral
1009249.0,"Citigroup Upgrades PulteGroup from Neutral to Buy, Raises PT from $9 to $10.50",2012-06-08 06:21:00-04:00,PHM,neutral
1009250.0,"Financial Breakfast: Morning News Summary for June 7, 2012",2012-06-07 07:29:00-04:00,PHM,neutral
1009251.0,Benzinga's Top Upgrades,2012-06-07 07:12:00-04:00,PHM,positive
1009252.0,FBR Capital Markets Upgrades PulteGroup from Market Perform to Outperform,2012-06-07 06:58:00-04:00,PHM,neutral
1009253.0,"Benzinga's Morning Upgrade Summary for June 6, 2012",2012-06-06 12:55:00-04:00,PHM,neutral
1009254.0,Benzinga's Top Pre-Market Gainers,2012-06-06 08:19:00-04:00,PHM,positive
1009255.0,UPDATE: Credit Suisse Upgrades PulteGroup to Outperform on Healthy Buyer Traffic  ,2012-06-06 07:22:00-04:00,PHM,positive
1009256.0,Benzinga's Top Upgrades,2012-06-06 07:16:00-04:00,PHM,positive
1009257.0,"Pending Home Sales Decline, Surprises to the Downside",2012-05-30 10:15:00-04:00,PHM,neutral
1009258.0,MBA Mortgage Applications Decrease 1.3% from Last Week,2012-05-30 10:03:00-04:00,PHM,neutral
1009259.0,MBA Mortgage Applications Increase 3.8% from Last Week,2012-05-23 09:55:00-04:00,PHM,positive
1009260.0,Toll Bros. To Report Amid Signs of Housing Rebound - IBD,2012-05-22 14:45:00-04:00,PHM,neutral
1009261.0,Existing Home Sales Rise Slightly More than Expected,2012-05-22 10:20:00-04:00,PHM,neutral
1009262.0,Homebuilders Topping Lenders On Better Housing News,2012-05-16 13:19:00-04:00,PHM,positive
1009263.0,"Building Permits, Housing Starts Signal Mixed Housing Market",2012-05-16 08:44:00-04:00,PHM,neutral
1009264.0,MBA Mortgage Applications Increase 9.2% from Last Week,2012-05-16 08:38:00-04:00,PHM,positive
1009265.0,MBA Mortgage Applications Increase1.7% from Last Week,2012-05-09 10:34:00-04:00,PHM,neutral
1009266.0,MBA Mortgage Applications Increase 0.1% from Last Week,2012-05-02 08:50:00-04:00,PHM,positive
1009267.0,Six stocks I like for next week,2012-04-28 14:54:00-04:00,PHM,positive
1009268.0,"Guggenheim Maintains Pulte Group at Neutral, Raises PT from $8 to $9",2012-04-26 14:11:00-04:00,PHM,neutral
1009269.0,Pending Home Sales Rise More than Expected,2012-04-26 10:29:00-04:00,PHM,neutral
1009270.0,UPDATE: PulteGroup Posts Narrower Q1 Loss,2012-04-26 07:17:00-04:00,PHM,negative
1009271.0,Pulte Group Reports Q1 EPS $0.03 vs $-0.03 Est; Revenues $881M vs $836.61M Est,2012-04-26 06:35:00-04:00,PHM,neutral
1009272.0,New Home Sales Rise More than Expected,2012-04-24 10:12:00-04:00,PHM,neutral
1009273.0,Existing Home Sales Rise Less than Expected,2012-04-19 10:20:00-04:00,PHM,neutral
1009274.0,"Building Permits, Housing Starts Signal Mixed Housing Market Sentiment",2012-04-17 08:43:00-04:00,PHM,neutral
1009275.0,"Builders Upgraded on Housing Outlook, But Shares Fall - IBD",2012-04-13 13:43:00-04:00,PHM,positive
1009276.0,MBA Mortgage Applications Increase 4.8% from Prior Week,2012-04-04 10:25:00-04:00,PHM,positive
1009277.0,MBA Mortgage Applications Decrease 2.7% from Last Week,2012-03-28 09:07:00-04:00,PHM,neutral
1009278.0,Housing Stocks Fall On Home Sales Data,2012-03-23 13:01:00-04:00,PHM,neutral
1009279.0,New Home Sales Rise Less than Expected,2012-03-23 10:17:00-04:00,PHM,neutral
1009280.0,KB Home Earnings Preview: A Surge in Q1 Revenue Expected,2012-03-22 07:05:00-04:00,PHM,neutral
1009281.0,MBA Mortgage Applications Decrease 7.4% from Last Week,2012-03-21 08:10:00-04:00,PHM,neutral
1009282.0,Building Permits Signal Recovering Housing Market,2012-03-20 09:06:00-04:00,PHM,neutral
1009283.0,MBA Mortgage Applications Decrease 2.4% from Last Week,2012-03-14 07:24:00-04:00,PHM,neutral
1009284.0,UPDATE: Williams Financial Group Initiates PulteGroup at Hold,2012-03-12 14:22:00-04:00,PHM,neutral
1009285.0,Notable Put Options Activity in PulteGroup,2012-03-12 13:23:00-04:00,PHM,neutral
1009286.0,"Williams Financial Group Initiates Coverage on Pulte Group at Hold, Announces PT of $8.75",2012-03-12 09:34:00-04:00,PHM,neutral
1009287.0,Hearing Compass Point Downgrades PulteHome from Neutral to Sell,2012-02-28 08:54:00-05:00,PHM,neutral
1009288.0,Notable Put Options Activity in PulteGroup,2012-02-27 12:25:00-05:00,PHM,neutral
1009289.0,New Home Sales Rise More than Expected,2012-02-24 10:44:00-05:00,PHM,neutral
1009290.0,"Existing Home Sales Rise 4.57M, Less than Expected",2012-02-22 10:17:00-05:00,PHM,neutral
1009291.0,MBA Mortgage Applications Decrease 4.5% from Last Week,2012-02-22 10:03:00-05:00,PHM,neutral
1009292.0,"UBS Downgrades Pulte Group from Buy to Neutral, Raises PT from $8 to $9",2012-02-16 12:47:00-05:00,PHM,neutral
1009293.0,"More New Home Builds Boost Pulte, Beazer, D. R. Horton",2012-02-16 08:53:00-05:00,PHM,positive
1009294.0,Pulte Group Hits 52-Week High of $9.15,2012-02-15 09:31:00-05:00,PHM,neutral
1009295.0,MBA Mortgage Applications Decrease 1.0% from Last Week,2012-02-15 08:40:00-05:00,PHM,neutral
1009296.0,"Hedge Fund 13-F Updates: Berkshire, Greenlight, Paulson & Co., Appaloosa and More!",2012-02-14 17:44:00-05:00,PHM,neutral
1009297.0,"Appaloosa Dissolved Its Stake in Temple Inland, Google, Mosaic, KB Home, Pultegroup, E*Trade, and Tesoro",2012-02-14 16:17:00-05:00,PHM,neutral
1009298.0,"Option Alert: PulteGroup April 8 Call; Block Trade, 4,500 Contracts",2012-02-14 10:29:00-05:00,PHM,negative
1009299.0,Pulte Group Hits 52-Week High of $9.09,2012-02-13 14:54:00-05:00,PHM,neutral
1009300.0,"Bernanke's Pessimism on Housing Might Drag on Pulte, Toll Brothers",2012-02-10 13:36:00-05:00,PHM,negative
1009301.0,Pulte Group Hits 52-Week High of $8.72,2012-02-09 09:34:00-05:00,PHM,neutral
1009302.0,Pulte Group Hits 52-Week High of $8.53,2012-02-08 09:55:00-05:00,PHM,neutral
1009303.0,MBA Mortgage Applications Increase 7.5%,2012-02-08 08:11:00-05:00,PHM,positive
1009304.0,"Wall Street Strategies Reiterates PulteGroup Hold, Raises PT",2012-02-07 15:38:00-05:00,PHM,neutral
1009305.0,Pulte Group Hits 52-Week High of $8.53,2012-02-07 11:07:00-05:00,PHM,neutral
1009306.0,Pulte Group Hits 52-Week High of $8.44,2012-02-06 09:39:00-05:00,PHM,neutral
1009307.0,Pulte Group Reports Q4 EPS $0.11 vs $0.07 Est; Revenues $1.26B vs $1.14B Est				 ,2012-02-02 06:57:00-05:00,PHM,neutral
1009308.0,Earnings Scheduled For February 2,2012-02-02 04:06:00-05:00,PHM,neutral
1009309.0,MBA Mortgage Applications Decrease 2.9% from Last Week,2012-02-01 07:51:00-05:00,PHM,neutral
1009310.0,Small Cap Top Performers in January,2012-01-30 06:19:00-05:00,PHM,positive
1009311.0,MBA Mortgage Applications Decrease 5% from Last Week,2012-01-25 09:53:00-05:00,PHM,neutral
1009312.0,"Benzinga's Top ETF Decliners, January 20th (ZSL, TVIX, UCO, XHB)",2012-01-20 19:06:00-05:00,PHM,positive
1009313.0,ETF Showdown: The Battle For The American Dream,2012-01-20 12:40:00-05:00,PHM,negative
1009314.0,Positive Housing Data Powers Pulte,2012-01-18 11:57:00-05:00,PHM,positive
1009315.0,MBA Mortgage Applications Increase 23.1% from Prior Week,2012-01-18 09:22:00-05:00,PHM,positive
1009316.0,Home Building Stocks Approach The Ceiling,2012-01-17 09:54:00-05:00,PHM,neutral
1009317.0,"UPDATE: Guggenheim Downgrades Pulte to Neutral, Maintains $8 Target",2012-01-13 10:38:00-05:00,PHM,neutral
1009318.0,Guggenheim Downgrades PulteGroup to Neutral,2012-01-13 06:35:00-05:00,PHM,neutral
1009319.0,MBA Mortgage Applications Increase 4.5%,2012-01-11 07:35:00-05:00,PHM,positive
1009320.0,Lennar Earnings Preview,2012-01-10 21:55:00-05:00,PHM,neutral
1009321.0,DR Horton and Home Depot to Open Near 52-Week Highs,2012-01-09 06:38:00-05:00,PHM,neutral
1009322.0,Earnings Expectations for the Week of January 9,2012-01-08 09:41:00-05:00,PHM,neutral
1009323.0,MBA Mortgage Applications Decrease 4.1% from Last Week,2012-01-04 07:34:00-05:00,PHM,neutral
1009324.0,Is It Finally Safe to Buy a Home?,2011-12-29 13:34:00-05:00,PHM,positive
1009325.0,Market Roundup,2011-12-29 11:10:00-05:00,PHM,neutral
1009326.0,PulteGroup Sells Select Colorado Land Assets; Terms Not Disclosed,2011-12-29 08:03:00-05:00,PHM,positive
1009327.0,Notable Put Options Activity on Pultegroup,2011-12-27 11:24:00-05:00,PHM,neutral
1009328.0,Notable Put Options Activity in PulteGroup,2011-12-01 11:02:00-05:00,PHM,neutral
1009329.0,Goldman Sachs Publishes Report on Home Improvement Industry ,2011-11-29 07:54:00-05:00,PHM,positive
1009330.0,"Homebuilders Are Holding Up, How Much Is Left In The Tank?",2011-11-15 15:42:00-05:00,PHM,neutral
1009331.0,Top 4 Mid-Cap Stocks In The Residential Construction Industry With The Highest Cash,2011-11-10 04:43:00-05:00,PHM,positive
1009332.0,Notable Call Options Activity in PulteGroup,2011-11-07 10:56:00-05:00,PHM,neutral
1009333.0,UPDATE: Citi Raises PT to $6 on Pultegroup ,2011-10-31 08:42:00-04:00,PHM,neutral
1009334.0,Citigroup Raises PT on Pultegroup to $6,2011-10-31 06:30:00-04:00,PHM,neutral
1009335.0,PulteGroup Reports Q3 Prelim EPS $(0.34) May Not Compare vs $(0.01) Est; Revenues $1.14B vs $1.05B Est			,2011-10-27 06:37:00-04:00,PHM,neutral
1009336.0,Earnings Expectations for the Week of October 24,2011-10-23 13:40:00-04:00,PHM,neutral
1009337.0,Earnings Season Kicks Off  10-17-2011,2011-10-17 15:09:00-04:00,PHM,neutral
1009338.0,Notable Put Options Activity in PulteGroup,2011-10-17 10:46:00-04:00,PHM,neutral
1009339.0,Goldman Sachs' 3Q2011 Survey Reinforces its Housing Expectations,2011-10-14 08:01:00-04:00,PHM,neutral
1009340.0,"UPDATE: Compass Point Upgrades Pulte Group, Lowers PT",2011-09-28 15:08:00-04:00,PHM,negative
1009341.0,Compass Point Research & Trading Upgrades PulteGroup to Buy,2011-09-28 15:05:00-04:00,PHM,neutral
1009342.0,"Option Alert: Heavy Volume in PulteGroup January 2012 7.5 Call; 35,015 Contracts",2011-09-22 12:29:00-04:00,PHM,positive
1009343.0,UBS Upgrades Pulte Homes,2011-09-20 10:29:00-04:00,PHM,neutral
1009344.0,Benzinga's Top Pre-Market Gainers,2011-09-20 07:50:00-04:00,PHM,positive
1009345.0,UPDATE: Goldman Sachs Removes PulteGroup from Conviction Buy List,2011-09-06 09:59:00-04:00,PHM,neutral
1009346.0,"Goldman Sachs Removes Pulte From CL-Buy List, Lowers PT To $6",2011-09-06 06:15:00-04:00,PHM,negative
1009347.0,Morning Losers; Esterline Technologies Down 11%,2011-09-02 10:29:00-04:00,PHM,negative
1009348.0,Block Trade Alert: Pultegroup Trades 992K Shares at $4.92,2011-08-30 12:56:00-04:00,PHM,positive
1009349.0,Benzinga's Top Upgrades,2011-08-30 07:33:00-04:00,PHM,positive
1009350.0,Midday Gainers; MICROS Systems up 11%,2011-08-26 13:36:00-04:00,PHM,neutral
1009351.0,Moody's Remix  08-24-2011,2011-08-24 15:21:00-04:00,PHM,neutral
1009352.0,PulteGroup Comments on Recent Stock Transactions ,2011-08-24 14:12:00-04:00,PHM,neutral
1009353.0,Puts Rolled on PulteGroup,2011-08-24 10:49:00-04:00,PHM,neutral
1009354.0,Fitch Downgrades PulteGroup IDR to 'BB'; Outlook To Negative ,2011-08-22 10:01:00-04:00,PHM,negative
1009355.0,Thursday's Mid-Day Options Volume Leaders,2011-08-04 12:23:00-04:00,PHM,neutral
1009357.0,PulteGroup Reports Q2 EPS $(0.15) vs $(0.04) Est; Revenues $927.2M vs $974.01M Est ,2011-07-28 09:10:00-04:00,PHM,neutral
1009358.0,Earnings Roundup,2011-07-28 08:42:00-04:00,PHM,neutral
1009359.0,UPDATE: PulteGroup Swings To Q2 Loss,2011-07-28 07:02:00-04:00,PHM,negative
1009360.0,Stocks Took a Breather  07-20-2011,2011-07-20 19:37:00-04:00,PHM,neutral
1009361.0,Chop & Pop  07-20-2011,2011-07-20 14:38:00-04:00,PHM,neutral
1009362.0,Options Brief: PulteGroup,2011-07-20 11:59:00-04:00,PHM,neutral
1009363.0,Options Brief: PulteGroup,2011-07-19 10:26:00-04:00,PHM,neutral
1009364.0,Hottest and Coldest Sectors for Thursday 7/7/2011,2011-07-07 19:35:00-04:00,PHM,neutral
1009365.0,Wednesday's S&P 500 Sector Recap 6/29/11,2011-06-29 17:35:00-04:00,PHM,neutral
1009366.0,Rally Extended  06-29-2011,2011-06-29 15:31:00-04:00,PHM,neutral
1009367.0,Rally Extended  06-29-2011,2011-06-29 15:31:00-04:00,PHM,neutral
1009368.0,Is Your Portfolio Ready to Rebound With Housing?,2011-06-29 13:06:00-04:00,PHM,positive
1009369.0,New XPOUND  06-28-2011,2011-06-28 14:47:00-04:00,PHM,neutral
1009370.0,Mondays Put/Call Ratio Leaders,2011-06-27 12:14:00-04:00,PHM,neutral
1009371.0,Fed Unched.  06-22-2011,2011-06-22 13:41:00-04:00,PHM,neutral
1009372.0,Goldman Sachs Reiterates Buy Rating On PulteGroup,2011-06-22 08:13:00-04:00,PHM,neutral
1009373.0,"S&P Sector Update: Consumer Goods Leading 1.0%, Technology Lagging 0.25%",2011-06-20 12:10:00-04:00,PHM,negative
1009374.0,Sector Recap and Technical Analysis for 6/14/11,2011-06-14 17:26:00-04:00,PHM,neutral
1009375.0,Chief Chops Market  06-07-2011,2011-06-07 19:03:00-04:00,PHM,neutral
1009376.0,Bank of America Merrill Lynch Neutral On PulteGroup,2011-06-01 07:52:00-04:00,PHM,neutral
1009377.0,Headline Away from Adding Volatility  05-31-2011,2011-05-31 18:39:00-04:00,PHM,neutral
1009378.0,"Dollar Weak, Market Pops  05-31-2011",2011-05-31 14:53:00-04:00,PHM,negative
1009379.0,"Options Brief: PulteGroup, Inc.",2011-05-31 10:30:00-04:00,PHM,neutral
1009380.0,Disappointing Data  05-26-2011,2011-05-26 18:23:00-04:00,PHM,negative
1009381.0,"Homebuilder Stocks Trading News Alert; Beazer Homes, Hovnanian, KB Home, PulteGroup",2011-05-24 16:26:00-04:00,PHM,positive
1009382.0,Resistance is Former Support Level  05-24-2011,2011-05-24 14:51:00-04:00,PHM,positive
1009383.0,David Tepper's Appaloosa Looking For A Bottom In Housing? ,2011-05-18 13:04:00-04:00,PHM,neutral
1009384.0,Goldman Sachs Reiterates Buy Rating As PulteGroup Names A New CFO (PHM) ,2011-05-10 07:57:00-04:00,PHM,neutral
1009385.0,Goldman Sachs Reiterates Conviction Buy on PulteGroup (PHM),2011-05-10 07:54:00-04:00,PHM,neutral
1009386.0,PulteGroup Names Robert O'Shaughnessy CFO ,2011-05-09 16:17:00-04:00,PHM,neutral
1009387.0,J.P. Morgan Raises Price Target on PulteGroup (PHM) from $8.50 to $9.00,2011-05-02 09:42:00-04:00,PHM,neutral
1009388.0,Will Consumers Stay Strong?  04-28-2011,2011-04-28 18:55:00-04:00,PHM,positive
1009389.0,Canary in the Coal Mine  04-28-11,2011-04-28 15:27:00-04:00,PHM,neutral
1009390.0,PulteGroup Reports First Quarter 2011 Financial Results ,2011-04-28 07:10:00-04:00,PHM,neutral
1009391.0,Trading Turns Mixed  04-19-2011,2011-04-19 15:28:00-04:00,PHM,neutral
1009392.0,"April 7, 2011: March Housing Stats Weak",2011-04-07 12:49:00-04:00,PHM,negative
1009393.0,Pulte Group Outlook Negative on Fewer Anticipated Closings - S&P (PHM),2011-04-01 14:27:00-04:00,PHM,negative
1009394.0,Goldman Sachs Adds PulteGroup to Conviction Buy List (PHM),2011-03-23 08:54:00-04:00,PHM,neutral
1009395.0,"Options Brief: PulteGroup, Inc. (PHM)",2011-03-22 15:19:00-04:00,PHM,neutral
1009396.0,Wells Fargo Maintains Market Perform on Pulte Group (PHM),2011-03-09 08:55:00-05:00,PHM,positive
1009397.0,"Fast Money Pops & Drops, March 8th (BWLD, S, HIBB, DKS, EXPE, PHM, DMND)",2011-03-08 20:41:00-05:00,PHM,neutral
1009398.0,Goldman Sachs' Key Thoughts On PHM Pre-Announcement,2011-03-08 09:46:00-05:00,PHM,neutral
1009399.0,J.P. Morgan Maintains $8.50 PT On PHM,2011-03-08 08:48:00-05:00,PHM,neutral
1009400.0,"Leaving on a Jet Plane, Will the Market Come Back Again?  02-24-2011",2011-02-24 15:06:00-05:00,PHM,neutral
1009401.0,Notable Weakness in Small Caps  02-07-2011,2011-02-07 18:26:00-05:00,PHM,negative
1009402.0,Home-builders Remain Weak,2011-02-04 10:06:00-05:00,PHM,negative
1009403.0,"Earnings Scheduled For February 4 (TSN, CEG, AET, FO, CLX, AON, WY, PHM, SPG)",2011-02-04 02:26:00-05:00,PHM,neutral
1009404.0,Money Flows Out of Bonds into Equities  02-01-2011,2011-02-01 17:49:00-05:00,PHM,neutral
1009405.0,"Tuesday's Put/Call Ratio Leaders (TRE, AMLN, PHM, NXY, EXM)",2011-02-01 12:47:00-05:00,PHM,neutral
1009406.0,"Mortgage Activity Rises, Rates Dip",2011-01-19 11:00:00-05:00,PHM,neutral
1009407.0,"January 11, 2011:December Housing Traffic Up. Why?",2011-01-11 14:02:00-05:00,PHM,neutral
1009408.0,KB Home's Lackluster 4Q  - Analyst Blog,2011-01-11 14:01:00-05:00,PHM,negative
1009409.0,KB Home's Lackluster 4Q  - Analyst Blog,2011-01-11 13:43:00-05:00,PHM,negative
1009410.0,"Lennar Strong, Low Revs Trivial - Analyst Blog",2011-01-11 12:31:00-05:00,PHM,positive
1009411.0,"Lennar Strong, Low Revs Trivial - Analyst Blog",2011-01-11 12:00:00-05:00,PHM,positive
1009412.0,Lennar Builds Up on Earnings Beat,2011-01-11 09:17:00-05:00,PHM,neutral
1009413.0,Can Housing Stocks Make a Comeback?,2011-01-11 08:30:00-05:00,PHM,neutral
1009414.0,Mortgage Activity Rises as Rates Dip,2011-01-05 12:53:00-05:00,PHM,neutral
1009415.0,"Lennar, Hovnanian: Homebuilder Winners & Losers",2010-12-22 12:07:00-05:00,PHM,negative
1009416.0,"Stock Market News for Dec 21, 2010 - Market News",2010-12-21 09:36:00-05:00,PHM,neutral
1009417.0,"Stock Market News for Dec 21, 2010 - Market News",2010-12-21 09:08:00-05:00,PHM,neutral
1009418.0,Housing Starts Rise 3.9% in November,2010-12-16 08:58:00-05:00,PHM,neutral
1009419.0,Mortgage Activity Slows as Rates Inch Up,2010-12-08 08:57:00-05:00,PHM,neutral
1009420.0,"Stock Market News for December 3, 2010 - Market News",2010-12-03 09:30:00-05:00,PHM,neutral
1009421.0,"Stock Market News for December 3, 2010 - Market News",2010-12-03 04:16:00-05:00,PHM,neutral
1009422.0,Pending Home Sales Rebound 10.4% in October,2010-12-02 10:14:00-05:00,PHM,neutral
1009423.0,10 Worst-Performing S&P 500 Stocks of 2010,2010-12-01 06:45:00-05:00,PHM,neutral
1009424.0,Home Prices Continue to Cool,2010-11-30 09:12:00-05:00,PHM,positive
1009425.0,New-Home Sales Fall 8.1% in October,2010-11-24 10:02:00-05:00,PHM,neutral
1009426.0,Sovereign Debt Back on Front Burner  11-18-2010,2010-11-18 15:04:00-05:00,PHM,negative
1009427.0,"Wednesday Sector Laggards: General Contractors & Builders, Defense Stocks",2010-11-17 15:20:00-05:00,PHM,positive
1009428.0,"Wednesday Sector Leaders: Music & Electronics Stores, Metals Fabrication & Products",2010-11-17 15:18:00-05:00,PHM,neutral
1009429.0,"Wednesday's ETF Movers: GDXJ, IFNA",2010-11-17 15:17:00-05:00,PHM,neutral
1009430.0,"Homebuilder Weakness Continues After Housing Start Report (DHI, PHM, KBH)",2010-11-17 11:55:00-05:00,PHM,negative
1009431.0,Markets Run in Place at Open,2010-11-17 10:09:00-05:00,PHM,neutral
1009432.0,"Homebuilders Sink Despite Survey Showing Improvement in Confidence (PHM, KBH, LEN)",2010-11-16 14:57:00-05:00,PHM,positive
1009433.0,PulteGroup's Loss Narrows - Analyst Blog,2010-11-04 15:03:00-04:00,PHM,negative
1009434.0,Citigroup Downgrades Pultegroup To Hold,2010-11-04 10:31:00-04:00,PHM,neutral
1009435.0,"Construction Reserves Dominate PulteGroup Earnings Conversations, Deutsche Bank Reports",2010-11-04 08:54:00-04:00,PHM,negative
1009436.0,"Benzinga's Top Upgrades (SMI, PHM, ID, KIM)",2010-11-04 07:45:00-04:00,PHM,positive
1009437.0,Credit Suisse Upgrades PHM To Neutral,2010-11-04 06:39:00-04:00,PHM,positive
1009438.0,"Benzinga's Worst Performing Industries (PWR, CTRP, RURL, PHM, BHS, WBD, COCO, ESI)",2010-11-03 19:41:00-04:00,PHM,negative
1009439.0,PulteGroup Hits 52-Week Low (PHM),2010-11-03 14:32:00-04:00,PHM,negative
1009440.0,"Rough Day For Homebuilders (XHB, PHM, TOL, HOV, KB)",2010-11-03 14:08:00-04:00,PHM,neutral
1009441.0,Calls Rolled on Pulte Homes (PHM),2010-11-03 13:19:00-04:00,PHM,neutral
1009442.0,"Benzinga's After Hours Decliners (ADS, PHM, XLNX)",2010-10-20 19:13:00-04:00,PHM,neutral
1009443.0,"Wednesday's Put/Call Ratio Leaders (RGR, PHM, VLTR, DHI, NYT)",2010-10-20 12:51:00-04:00,PHM,neutral
1009444.0,"Puts Purchased on Pulte Homes, Inc.  (PHM)",2010-10-20 11:55:00-04:00,PHM,neutral
1009445.0,"UBS Upgrades (PHM, FTR, DHI)",2010-10-14 10:47:00-04:00,PHM,neutral
1009446.0,"Monday's Put/Call Ratio Leaders (PHM, AIXG, PWR, SCHW, EXEL)",2010-10-11 13:41:00-04:00,PHM,neutral
1009447.0,Market in a Holding Pattern  09-28-2010,2010-09-28 19:10:00-04:00,PHM,neutral
1009448.0,Bid Still Participating  09-28-2010,2010-09-28 14:39:00-04:00,PHM,neutral
1009449.0,Calls Sold on Pulte Homes (PHM),2010-09-28 12:55:00-04:00,PHM,neutral
1009450.0,Goldman Upgrades Pulte Homes ,2010-09-28 08:20:00-04:00,PHM,neutral
1009451.0,"Benzinga's Top Upgrades (PHM, LVS, SGEN, APSG)",2010-09-28 07:27:00-04:00,PHM,positive
1009452.0,PulteGroup Announces Cash Tender Offers for up to $500 Million of Outstanding Notes ,2010-09-22 16:27:00-04:00,PHM,positive
1009453.0,"Despite Disappointing Housing Outlook, Homebuilders Surge (TOL, PHM, KBH, LEN)",2010-09-20 14:16:00-04:00,PHM,positive
1009454.0,"Stock Market News for September 16, 2010 - Market News",2010-09-16 10:15:00-04:00,PHM,neutral
1009455.0,"Stock Market News for September 3, 2010 - Market News",2010-09-03 09:36:00-04:00,PHM,neutral
1009456.0,"Housing Data Terrible; Homebuilders Rally (XHB, TOL, PHM)",2010-08-24 11:44:00-04:00,PHM,negative
1009457.0,"Housing Starts Released Tomorrow: How To Play It (XHB, PHM)",2010-08-23 13:14:00-04:00,PHM,positive
1009458.0,"Stock Market News for August 18, 2010 - Market News",2010-08-18 09:52:00-04:00,PHM,neutral
1009459.0,Tough to Read Market's Current Tea Leaves,2010-08-16 18:20:00-04:00,PHM,negative
1009460.0,Pulte Group - Bear of the Day,2010-08-13 04:07:00-04:00,PHM,neutral
1009461.0,"Top 4 Stocks In The Residential Construction Industry With The Highest Cash (PHM, DHI, MDC, TOL)",2010-08-09 06:00:00-04:00,PHM,positive
1009462.0,Stocks Slump But Recover Some Losses 08-06-2010,2010-08-06 19:22:00-04:00,PHM,negative
1009463.0,Jobs Report Disappoints 08-06-2010,2010-08-06 15:12:00-04:00,PHM,negative
1009464.0,PulteGroup Returns to Profit  - Analyst Blog,2010-08-04 15:33:00-04:00,PHM,positive
1009465.0,China Orders Stress Tests  08-04-2010,2010-08-04 15:26:00-04:00,PHM,negative
1009466.0,Pulte Homes Posts First Profit Since 2006 (PHM),2010-08-04 11:39:00-04:00,PHM,positive
1009467.0,"Zacks Investment Ideas feature highlights: KB Home, PulteGroup, ProShares Short Real Estate and UltraShort Real Estate ProShares (KBH, PHM, REK, SRS)",2010-07-30 22:09:00-04:00,PHM,neutral
1009468.0,"Stock Market News for July 27, 2010 - Market News",2010-07-27 09:49:00-04:00,PHM,neutral
1009469.0,Options Give Mixed Signals for Pulte (PHM),2010-07-26 10:59:00-04:00,PHM,neutral
1009470.0,"US Homebuilder Permits Rise, Markets Rally",2010-07-20 15:09:00-04:00,PHM,neutral
1009471.0,"Homebuilders Surge After Housing Starts Report (TOL, PHM, HOV)",2010-07-20 11:49:00-04:00,PHM,neutral
1009472.0,PulteGroup COO Announces Retirement (PHM),2010-07-19 11:59:00-04:00,PHM,neutral
1009473.0,"Stocks Re-enter Positive Territory, Driven By Tech Stocks; Banks, Homebuilders Suffer",2010-07-14 12:24:00-04:00,PHM,neutral
1009474.0,"Housing Prices Bottomed? According to Barry RitholtzNo Way (XHB, PHM)",2010-06-30 11:47:00-04:00,PHM,neutral
1009475.0,"Stock Market News for June 24, 2010 - Market News",2010-06-24 10:14:00-04:00,PHM,neutral
1009476.0,China Letting the Yuan Appreciate Will Have an Impact on Commercial Real Estate,2010-06-24 06:00:00-04:00,PHM,positive
1009477.0,Call Buyers Target Pulte Group (PHM),2010-06-21 10:56:00-04:00,PHM,neutral
1009478.0,Protection Purchased on Pulte Group (PHM),2010-06-17 13:53:00-04:00,PHM,neutral
1009479.0,"Gary Shilling Says Housing Price Have Further to Fall (XHB, PHM)",2010-06-17 12:09:00-04:00,PHM,neutral
1009480.0,"Company News for June 14, 2010 - Corporate Summary",2010-06-14 09:39:00-04:00,PHM,neutral
1009481.0,"June 5,2010: Real Estate Flops In May",2010-06-04 22:43:00-04:00,PHM,negative
1009482.0,"Lumber Prices Have Crashed On Weak Outlook For Builders  (WY, LUK, MAS, LPX, IP, FBR, TOL, KBH, LEN, PHM))",2010-05-28 10:14:00-04:00,PHM,negative
1009483.0,Heavy Call Activity in Pulte (PHM),2010-05-27 11:33:00-04:00,PHM,neutral
1009484.0,Look for Opportunity  05-25-2010,2010-05-25 17:55:00-04:00,PHM,positive
