Unnamed: 0,title,date,stock,sentiment
1008807.0,"Earnings Scheduled For July 25, 2017",2017-07-25 05:52:00-04:00,PHM,neutral
1008808.0,"Benzinga's Top Upgrades, Downgrades For July 13, 2017",2017-07-13 09:22:00-04:00,PHM,positive
1008809.0,Wedbush Upgrades PulteGroup to Neutral,2017-07-13 06:27:00-04:00,PHM,neutral
1008810.0,"Homebuilding Stocks Trade Lower After Barclays Downgraded 4 Stocks, Upgraded 1: Hovnanian Shares Down 5.2%, M/I Homes Down 2.6%, Toll Brothers, Tri Pointe Down 2.4%, Lennar, Beazer Down 2%, Pulte Down 1.8%",2017-07-11 11:43:00-04:00,PHM,neutral
1008811.0,Barclays Downgrades PulteGroup to Equal-Weight,2017-07-11 06:38:00-04:00,PHM,neutral
1008812.0,Mizuho Downgrades PulteGroup to Underperform,2017-07-10 06:10:00-04:00,PHM,neutral
1008813.0,Jon Najarian Sees Unusual Options Activity In D.R. Horton,2017-07-08 08:12:00-04:00,PHM,neutral
1008815.0,"D.R. Horton, PulteGroup Make A Solid Foundation For A Homebuilders Position",2017-06-27 11:44:00-04:00,PHM,positive
1008816.0,"Credit Suisse Initiates Coverage On PulteGroup with Outperform Rating, Announces $27.00 Price Target",2017-06-23 06:32:00-04:00,PHM,positive
1008819.0,"Alibaba, Oracle, PulteGroup, Whirlpool: Fast Money Picks For June 21",2017-06-21 06:59:00-04:00,PHM,neutral
1008822.0,Watch These 8 Huge Call Purchases In Thursday Trade,2017-06-15 04:14:00-04:00,PHM,positive
1008823.0,Benzinga's Option Alert Recap From June 14,2017-06-14 16:10:00-04:00,PHM,positive
1008824.0,Option Alert: Pulte Jul 28th 25.5 Calls Sweep: 500 @  ASK  $0.45: 729 traded vs 0 OI:  Earnings 7/20 Before Open (est)  $24.65 Ref,2017-06-14 11:34:00-04:00,PHM,positive
1008825.0,PulteGroup Sees Recognizing Pre-Tax Impairment Charge of $95M-$125M in Q2,2017-05-08 17:11:00-04:00,PHM,neutral
1008826.0,PulteGroup Sees Planned Actions Adding $425M Previously Realized from Sale of Certain Non-Core Assets Since '11,2017-05-08 17:11:00-04:00,PHM,positive
1008827.0,"UPDATE: Pulte Says Will Sell Certain Currently Inactive Land Parcels, Representing ~4,600 Lots",2017-05-08 17:11:00-04:00,PHM,positive
1008828.0,PulteGroup Reports Plan to Sell Select Non-Core Assets,2017-05-08 17:10:00-04:00,PHM,positive
1008829.0,"PulteGroup, Union Pacific, Thor And Retail: Fast Money Picks For April 27",2017-04-27 07:02:00-04:00,PHM,neutral
1008830.0,15 Biggest Mid-Day Losers For Tuesday,2017-04-25 13:15:00-04:00,PHM,negative
1008831.0,22 Stocks Moving In Tuesday's Pre-Market Session,2017-04-25 08:21:00-04:00,PHM,neutral
1008832.0,"PulteGroup Q1 EPS $0.28 vs $0.29 Est, Sales $1.63B vs $1.76B Est",2017-04-25 06:34:00-04:00,PHM,neutral
1008833.0,"Earnings Scheduled For April 25, 2017",2017-04-25 05:03:00-04:00,PHM,neutral
1008834.0,Housing Sector Preview: A Strong Start To 2017,2017-03-23 15:58:00-04:00,PHM,positive
1008835.0,Watch These 8 Huge Put Purchases In Thursday Trade,2017-03-16 04:01:00-04:00,PHM,positive
1008836.0,Option Alert: Pulte Gp Mar 24th 23.0 Puts Sweep: 500 @  ASK  $0.26: 500 traded vs 163 OI:  Earnings 4/20 Before Open (est)  $23.24 Ref,2017-03-15 12:08:00-04:00,PHM,positive
1008837.0,"DSW, PulteGroup, Viacom And Russia: Fast Money Picks For March 13",2017-03-13 07:15:00-04:00,PHM,neutral
1008838.0,"Aecom, PulteGroup And ETFs: Fast Money Picks For March 10",2017-03-10 06:43:00-05:00,PHM,neutral
1008839.0,Spring Is Heating Up For Homebuilders; Stocks Poised For Near-Term Upside,2017-03-07 11:29:00-05:00,PHM,positive
1008840.0,"Attention, Income Investors: Homebuilders With The Best Dividend Yields",2017-02-27 10:11:00-05:00,PHM,positive
1008841.0,7 Biggest Price Target Changes For Tuesday,2017-02-14 10:41:00-05:00,PHM,neutral
1008842.0,"Benzinga's Top Upgrades, Downgrades For February 14, 2017",2017-02-14 09:27:00-05:00,PHM,positive
1008843.0,"FBR Capital Upgrades PulteGroup to Outperform, Raises Target to $26.00",2017-02-14 07:47:00-05:00,PHM,neutral
1008844.0,BTIG Research Initiates Coverage On PulteGroup At Neutral,2017-02-08 07:31:00-05:00,PHM,neutral
1008845.0,Bank of America Upgrades PulteGroup To Buy,2017-01-27 07:30:00-05:00,PHM,neutral
1008846.0,"PulteGroup Reports Q4 Adj. EPS $0.67 vs $0.59 Est., Sales $2.49B vs $2.32B Est.",2017-01-26 06:32:00-05:00,PHM,neutral
1008847.0,"Earnings Scheduled For January 26, 2017",2017-01-26 06:03:00-05:00,PHM,neutral
1008848.0,"Alphabet, Priceline, PulteGroup: Fast Money Picks For January 10",2017-01-10 07:05:00-05:00,PHM,neutral
1008849.0,"Barclays Initiates Coverage On PulteGroup at Overweight, Announces $21.00 Target",2017-01-06 06:01:00-05:00,PHM,negative
1008850.0,Tim Seymour Is A Buyer Of PulteGroup,2016-12-29 06:54:00-05:00,PHM,neutral
1008851.0,"Najarian Brothers See Unusual Options Activity In PulteGroup, Intel",2016-12-08 14:28:00-05:00,PHM,neutral
1008852.0,Fast Money Traders Share Their Trades After Wednesday's Big Rally,2016-12-08 06:26:00-05:00,PHM,positive
1008853.0,"Honeywell, PulteGroup And ETFs: Fast Money Picks For November 23",2016-11-23 06:37:00-05:00,PHM,neutral
1008854.0,Fast Money Traders Reveal Their Picks At Market Highs,2016-11-23 06:33:00-05:00,PHM,neutral
1008855.0,"Evercore ISI Group Initiates Coverage On PulteGroup, Inc. Common Stock at Hold",2016-11-15 07:33:00-05:00,PHM,neutral
1008856.0,Wall Street's M&A Chatter From November 10,2016-11-11 06:35:00-05:00,PHM,neutral
1008857.0,Watch These 7 Huge Call Purchases In Friday Trade,2016-11-11 02:27:00-05:00,PHM,positive
1008858.0,Option Alert: PHM Dec16 19.0 Calls Sweep: 617 @  ASK  $0.585: 757 traded vs 367 OI:  Earnings 1/26 Before Open (est)  $18.64 Ref,2016-11-10 15:56:00-05:00,PHM,positive
1008859.0,"Lennar, Pulte Shares Volatile Here, Largely Unch as Traders Passing Around Unconfirmed Chatter of a Merger",2016-11-10 14:10:00-05:00,PHM,positive
1008860.0,Option Alert: PHM Fri 11/11 18.5 Calls (Wkly) Sweep: 500 @  ASK  $0.13: 2681 traded vs 25 OI:  Earnings 1/26 Before Open (est)  $18.29 Ref,2016-11-10 14:10:00-05:00,PHM,positive
1008861.0,Consolidation In The Homebuilding Sector Continues As Toll Brothers Buys Coleman Homes,2016-11-07 11:51:00-05:00,PHM,neutral
1008862.0,"Citigroup On Homebuilding M&A Possibilities: DR Horton, Toll Brothers And PulteGroup Targets In Focus",2016-11-01 09:29:00-04:00,PHM,neutral
1008863.0,"The Market In 5 Minutes: Tesla's Announcement, Major Earnings And Jobless Claims",2016-10-20 09:02:00-04:00,PHM,neutral
1008864.0,"A Peek Into The Markets: U.S. Stock Futures Up Ahead Of Earnings, Economic Data",2016-10-20 07:46:00-04:00,PHM,neutral
1008865.0,PulteGroup Q3 Earnings Miss,2016-10-20 07:10:00-04:00,PHM,negative
1008866.0,"PulteGroup Q3 EPS $0.37 vs $0.44 est, Revenue $1.94B vs $1.95B est",2016-10-20 06:35:00-04:00,PHM,neutral
1008867.0,Watch These Huge Put Purchases In Thursday Trade,2016-10-20 02:45:00-04:00,PHM,positive
1008868.0,Option Alert: PHM Jan $17 Put; 3000 @Bid @$0.28; Ref=$19.93,2016-10-19 14:10:00-04:00,PHM,positive
1008869.0,Pulte Shares Indicated Higher Premarket; Hearing Cleveland Research Has Highlighted Co.'s Inline Results Amid an Industry Which is Moderating Slightly,2016-10-18 09:06:00-04:00,PHM,positive
1008870.0,Wells Fargo Initiates Coverage on PulteGroup at Market Perform,2016-09-29 06:34:00-04:00,PHM,positive
1008871.0,Homebuilding Stocks In Focus Following Lennar-WCI Deal,2016-09-22 08:23:00-04:00,PHM,neutral
1008872.0,"Watch Other Homebuilder Stocks Amid Lennar, WCI Deal: KB Home, Pulte, Toll, LGI, MDC, Taylor Morrison, AV Homes",2016-09-22 06:57:00-04:00,PHM,neutral
1008873.0,"Wedbush Initiates Coverage on PulteGroup at Underperform, Announces $16.00 PT",2016-09-20 02:30:00-04:00,PHM,neutral
1008874.0,Upcoming Earnings In The Housing Sector,2016-09-19 13:54:00-04:00,PHM,neutral
1008875.0,PulteGroup Investors Getting Growth Without The Growing Pains,2016-09-15 16:51:00-04:00,PHM,positive
1008876.0,"10 Notable Stocks Trading Ex-Dividend Friday, September 16",2016-09-15 16:34:00-04:00,PHM,neutral
1008877.0,PulteGroup Provides Statement From Newly Appointed Board Member Bill Pulte,2016-09-08 09:02:00-04:00,PHM,neutral
1008878.0,PulteGroup Names Ryan Marshall CEO,2016-09-08 08:32:00-04:00,PHM,neutral
1008879.0,"PulteGroup, JetBlue, Gold And The VIX: Fast Money Picks For August 24",2016-08-24 06:34:00-04:00,PHM,neutral
1008880.0,"Homebuilders In Focus Following Toll Earnings, Ahead Of Housing Data",2016-08-23 09:28:00-04:00,PHM,neutral
1008881.0,Pulte Mortgage Entered into Third Amendment to Amended and Restated Master Purchase Agreement With Comerica Bank,2016-08-17 09:31:00-04:00,PHM,positive
1008882.0,The Most Popular Stocks This 13F Season,2016-08-16 12:07:00-04:00,PHM,positive
1008883.0,13F from Elliott Shows New 5M Share Stake in PulteGroup,2016-08-15 16:19:00-04:00,PHM,positive
1008884.0,Improving Economic Conditions Support Strong Home Buyer Sentiment,2016-08-09 13:32:00-04:00,PHM,positive
1008885.0,PulteGroup Spokesperson Confirms To Benzinga That PulteGroup Management Cancelling Out Of Conference Due To Delta Outage,2016-08-08 10:18:00-04:00,PHM,negative
1008886.0,Option Alert: PHM Oct16 24.0 Calls Sweep: 509 @  ASK  $0.30: 509 traded vs 1428 OI: $21.60 Ref,2016-08-08 10:10:00-04:00,PHM,positive
1008887.0,BZ NOTE: Pulte Was Scheduled to Present at Credit Suisse's Homebuilding & Building Products Conference Today,2016-08-08 10:08:00-04:00,PHM,positive
1008888.0,PulteGroup Shares Relatively Quiet Following Chatter Co. Has Cancelled Out of Upcoming Conference,2016-08-08 10:07:00-04:00,PHM,positive
1008889.0,"Moody's Says Outlook for Homebuilders Positive on Employment Growth, Tight Inventory",2016-07-26 13:52:00-04:00,PHM,positive
1008890.0,Stocks Hitting 52-Week Highs,2016-07-25 10:25:00-04:00,PHM,neutral
1008891.0,Benzinga's Top Upgrades,2016-07-25 08:58:00-04:00,PHM,positive
1008892.0,Deutsche Bank Upgrades PulteGroup to Buy,2016-07-25 06:54:00-04:00,PHM,neutral
1008893.0,JP Morgan Upgrades PulteGroup to Overweight,2016-07-22 09:20:00-04:00,PHM,neutral
1008894.0,UPDATE: Full PR Highlighting PulteGroup Founder Thoughts On Company,2016-07-21 14:25:00-04:00,PHM,neutral
1008895.0,"PulteGroup Founder Comments On Shareholder Victories At PulteGroup, Focus Turns To Growth, Over $1.3B Value Created For Shareholders Since Founder Involvement",2016-07-21 14:24:00-04:00,PHM,positive
1008896.0,CNBC's Scott Wapner Issue Series of Tweets on Conversation with PulteGroup Founder,2016-07-21 13:29:00-04:00,PHM,neutral
1008897.0,15 Biggest Mid-Day Gainers For Thursday,2016-07-21 12:55:00-04:00,PHM,neutral
1008898.0,"CNBC's Scott Wapner Tweets: Elliott did not focus on immediate removal of $PHM CEO Dugas, but rather on new CEO search with new Board members",2016-07-21 11:32:00-04:00,PHM,neutral
1008899.0,CNBC's Scott Wapner Tweets: Sources: Elliott believes $PHM shares should trade at $35-$40 per share with new value creation plan.,2016-07-21 11:30:00-04:00,PHM,positive
1008900.0,18 Stocks Moving In Thursday's Pre-Market Session,2016-07-21 08:23:00-04:00,PHM,neutral
1008901.0,"PulteGroup Raises Buyback Plan by $1B to $1.5B, Says Will Buyback Shares by End of '17",2016-07-21 06:43:00-04:00,PHM,positive
1008902.0,"PulteGroup Reports Q2 GAAP EPS $0.34 vs $0.32 Est., Home Sales$1.8B vs $1.66B Est.",2016-07-21 06:36:00-04:00,PHM,neutral
1008903.0,"Earnings Scheduled For July 21, 2016",2016-07-21 05:18:00-04:00,PHM,neutral
1008904.0,Option Alert: PHM Fri 7/22 21.5 Calls (Wkly): 500 @  ASK  $0.10: 515 traded vs 30 OI:  Earnings tmrrw Before Open  $20.50 Ref,2016-07-20 11:21:00-04:00,PHM,positive
1008905.0,A Look Back And A Look Ahead For Homebuilding Data,2016-07-18 13:27:00-04:00,PHM,neutral
1008906.0,"Credit Suisse's Contrarian Calls On AK Steel, Kellogg's And Others",2016-07-05 13:34:00-04:00,PHM,positive
1008907.0,Board Director Patrick J. O'Leary Sends Letter to William Pulte -8K,2016-06-15 12:23:00-04:00,PHM,neutral
1008908.0,UPDATE: Pulte Founder's Full Letter to Co. Board,2016-06-15 10:02:00-04:00,PHM,neutral
1008909.0,PulteGroup Founder Pulte Sends Letter to Pulte Board: 'Encouraged by Engagement in CEO Search Process and Looks Forward to Working Constructively with the Board to Identify PulteGroup's Next CEO',2016-06-15 10:01:00-04:00,PHM,positive
1008910.0,UPDATE: Scott Wapner @ScottWapnerCNBC Tweet: Told by sources that Elliott's $PHM stake larger than 4% but under 5% threshold that would require SEC filing,2016-06-07 13:34:00-04:00,PHM,neutral
1008911.0,UPDATE: PulteGroup Spikes to High of $19.68 on Rumor of Elliott Management Stake,2016-06-07 13:30:00-04:00,PHM,neutral
1008912.0,CNBC Now @CNBCnow Tweet: BREAKING: Elliott Management takes stake in Pulte Group - sources   (via @ScottWapnerCNBC),2016-06-07 13:28:00-04:00,PHM,neutral
1008913.0,"Raymond James Downgrades PulteGroup, Believes 'Overhangs Linger'",2016-04-25 15:02:00-04:00,PHM,neutral
1008914.0,"The Market In 5 Minutes: Monday, April 25, 2016",2016-04-25 09:55:00-04:00,PHM,neutral
1008915.0,Benzinga's Top Downgrades,2016-04-25 09:12:00-04:00,PHM,positive
1008916.0,"Raymond James Downgrades PulteGroup to Market Perform, Removes $19.00 PT",2016-04-25 06:51:00-04:00,PHM,neutral
1008917.0,"From Conf Call: Pulte Says Saw Positive Traffic,Demand Conditions Across Country During Q1; Trend Continued Into April",2016-04-21 08:59:00-04:00,PHM,positive
1008918.0,"PulteGroup Q1 EPS $0.24 vs $0.20 est, Revenue $1.40B vs $1.36B est",2016-04-21 06:37:00-04:00,PHM,neutral
1008919.0,"Earnings Scheduled For April 21, 2016",2016-04-21 04:14:00-04:00,PHM,neutral
1008920.0,Option Alert: PHM 4/29 19.0 Calls (Wkly) Sweep: 668 @  ASK  $0.64: 668 traded vs 250 OI:  Earnings tmrrw Before Open  $19.10 Ref,2016-04-20 12:45:00-04:00,PHM,positive
1008921.0,PulteGroup Reports ISS Has Recommended Holders Vote FOR All Co. Board Nominees,2016-04-13 07:46:00-04:00,PHM,positive
1008922.0,"8-K from PulteGroup Shows Board's Finance and Investment Committee Member, James Grosfeld, Resigned",2016-04-12 17:52:00-04:00,PHM,negative
1008923.0,William Pulte Leeter Says under Richard Dugas there has been No Value Creation for Shareholders,2016-04-12 16:28:00-04:00,PHM,positive
1008924.0,PulteGroup Founder Vs. Current CEO: The Saga Continues,2016-04-11 13:57:00-04:00,PHM,neutral
1008925.0,PulteGroup Issues Statement Saying They Are Disappointed At The Attacks To Destabilize Leadership,2016-04-11 13:30:00-04:00,PHM,negative
1008926.0,"PulteGroup Founder William Pulte Issues Letter Calling For Replacement Of CEO RIchard Dugas, Highlights Lack Of Experience And No Value Creation Over The Span Of His Tenure",2016-04-11 08:59:00-04:00,PHM,neutral
1008927.0,PulteGroup Founder Sends Letter to Co. Board Urging Replacement of CEO Dugas,2016-04-11 08:59:00-04:00,PHM,neutral
1008928.0,Benzinga's Top Upgrades,2016-04-06 09:12:00-04:00,PHM,positive
1008929.0,"Barclays Upgrades PulteGroup, Says Its Management Concerns Are Overblown",2016-04-06 07:47:00-04:00,PHM,neutral
1008930.0,"Barclays Upgrades PulteGroup to Equal-weight, Maintains $18.00 PT",2016-04-06 04:32:00-04:00,PHM,neutral
1008931.0,JPMorgan Running From PulteGroup After CEO Loss,2016-04-05 10:36:00-04:00,PHM,negative
1008932.0,UPDATE: PulteGroup Lead Independent Director Sends Open Letter to Holders,2016-04-05 09:15:00-04:00,PHM,neutral
1008933.0,UPDATE: PulteGroup Says 'we want to reassure our shareholders that the Board stands firmly behind the Company's Value Creation strategy',2016-04-05 09:15:00-04:00,PHM,positive
1008934.0,"PulteGroup Sends Open Letter to Holders, Offers Board Update",2016-04-05 09:14:00-04:00,PHM,neutral
1008935.0,Benzinga's Top Downgrades,2016-04-05 08:46:00-04:00,PHM,positive
1008936.0,"PulteGroup Founder On Recently-Fired CEO: Extreme Disappointment, Inadequate Performance",2016-04-05 07:52:00-04:00,PHM,negative
1008937.0,"JP Morgan Downgrades PulteGroup to Neutral, Lowers PT to $18.00",2016-04-05 06:02:00-04:00,PHM,positive
1008938.0,UPDATE: William Pulte Letter to PulteGroup Board Shows Reiteration of 'my extreme disappointment in the leadership of CEO Richard Dugas and the lack of performance of PulteGroup under his watch',2016-04-04 16:57:00-04:00,PHM,negative
1008939.0,UPDATE: PulteGroup's William Pulte Sends Letter to Board,2016-04-04 16:55:00-04:00,PHM,neutral
1008940.0,"PulteGroup Founder, Largest Holder, William Pulte, Sends Letter to Co. Board",2016-04-04 16:54:00-04:00,PHM,neutral
1008941.0,"The Stocks That Moved The S&P, Dow And Nasdaq Today",2016-04-04 16:52:00-04:00,PHM,neutral
1008942.0,KeyBanc Downgrades PulteGroup to Sector Perform,2016-04-04 12:48:00-04:00,PHM,neutral
1008943.0,Zelman & Associates Downgrades PulteGroup to Hold,2016-04-04 10:03:00-04:00,PHM,neutral
1008944.0,"PulteGroup Announces Chair, CEO Richard Dugas to Retire; Board Has Formed Special Committee to Find Successor",2016-04-04 06:10:00-04:00,PHM,positive
1008945.0,"PulteGroup Announces Richard Dugas to Retire as Chairman, CEO, Effective May 2017",2016-04-04 06:03:00-04:00,PHM,positive
1008946.0,PulteGroup Price Isn't Right; BoA Downgrades,2016-03-16 11:09:00-04:00,PHM,neutral
1008947.0,"Bank of America Downgrades PulteGroup to Underperform, Maintains $18.00 PT",2016-03-16 07:45:00-04:00,PHM,neutral
1008948.0,Fast Money Picks For February 24,2016-02-24 06:41:00-05:00,PHM,neutral
1008949.0,Earnings Recap For January 28,2016-01-28 16:34:00-05:00,PHM,neutral
1008950.0,"Pultegroup Q4 EPS $0.64 vs $0.49 est, Revenue $2.06B vs $1.85B est",2016-01-28 06:34:00-05:00,PHM,neutral
1008951.0,"Earnings Scheduled For January 28, 2016",2016-01-28 04:04:00-05:00,PHM,neutral
1008952.0,What Fast Money Traders Are Watching In The Housing Sector,2016-01-24 19:57:00-05:00,PHM,neutral
1008953.0,Existing Home Sales Hit 10-Year High For December 2015,2016-01-22 12:07:00-05:00,PHM,neutral
1008954.0,Q&A With Top Real Estate Analyst: 10 Questions Investors Should Know,2016-01-13 15:45:00-05:00,PHM,positive
1008955.0,Benzinga's Top Upgrades,2016-01-13 09:21:00-05:00,PHM,positive
1008956.0,JP Morgan Upgrades PulteGroup to Overweight,2016-01-13 06:35:00-05:00,PHM,neutral
1008957.0,Benzinga's Top Upgrades,2016-01-08 09:09:00-05:00,PHM,positive
1008958.0,Raymond James Upgrades PulteGroup to Outperform,2016-01-08 08:02:00-05:00,PHM,neutral
1008959.0,Option Alert: PHM Fri 1/8 16.5 Puts (Wkly) Sweep: 650 @  ASK  $0.15: 650 traded vs 10 OI:  Earnings 1/28 Before Open  $17.07 Ref,2016-01-04 13:23:00-05:00,PHM,positive
1008960.0,Homebuilders Selloff on Volume,2016-01-04 13:02:00-05:00,PHM,neutral
1008961.0,"Pope Resources Sells Lots to Pulte Homes, Quarant Homes Totaling $4.9M",2015-12-23 20:08:00-05:00,PHM,neutral
1008962.0,"PulteGroup Reports Purchase of Certain Homebuilding Assets of John Wieland Homes, Neighborhoods for $430M-$450M",2015-12-16 09:07:00-05:00,PHM,positive
1008963.0,Credit Suisse Shakes Up Recommendations In Housing Sector: It's All About ROEs,2015-12-15 14:36:00-05:00,PHM,positive
1008964.0,"UPDATE: Credit Suisse Highlights Favorite Long Picks in Homebuilders: CalAtlantic, Toll Bros., William Lyon Homes; Top Underperforms: Pulte, NVR, KB Homes",2015-12-15 08:08:00-05:00,PHM,positive
1008965.0,PulteGroup Increases Buyback From $750M To $1.05B,2015-12-02 16:48:00-05:00,PHM,neutral
1008966.0,"UPDATE: Traders in Homebuilding Sector Attributing Group-Wide Strength to Comments Coming Out of UBS Building, Building Products Annual CEO Conference",2015-11-11 12:16:00-05:00,PHM,positive
1008967.0,Strength in Homebuilder Stocks May be Attributed to Several Analyst PT Raises for DR Horton on Wednesday,2015-11-11 11:26:00-05:00,PHM,positive
1008968.0,UPDATE: Report Homebuilders Next Industry to Come Under Federal Scrutiny,2015-11-04 15:09:00-05:00,PHM,neutral
1008969.0,"Pultegroup Q3 PS $0.30 vs $0.43 est, Revenue $1.51B vs $1.77B est",2015-10-22 06:31:00-04:00,PHM,neutral
1008970.0,Nailed It: This Leveraged ETF Is On Fire,2015-10-21 08:04:00-04:00,PHM,negative
1008971.0,How Morgan Stanley Is Playing Homebuilders In 2016,2015-10-14 14:22:00-04:00,PHM,positive
1008972.0,Benzinga's Top Downgrades,2015-10-13 09:47:00-04:00,PHM,positive
1008973.0,"Morgan Stanley Downgrades PulteGroup to Underweight, Lowers PT to $18.00",2015-10-13 04:23:00-04:00,PHM,negative
1008974.0,18 Contrarian Stock Ideas: From Box To Seaworld,2015-10-09 09:37:00-04:00,PHM,neutral
1008975.0,Top 4 NYSE Stocks In The Residential Construction Industry With The Highest Revenue,2015-10-08 04:57:00-04:00,PHM,positive
1008976.0,Benzinga's Top #PreMarket Gainers,2015-09-04 08:07:00-04:00,PHM,positive
1008977.0,How To Play The Coming New Home Sales Surge,2015-08-12 19:42:00-04:00,PHM,positive
1008978.0,"PulteGroup Reports Q2 EPS $0.28 vs $0.26 Est., Sales $1.28B vs $1.37B Est.",2015-07-23 06:31:00-04:00,PHM,neutral
1008979.0,"Earnings Scheduled For July 23, 2015",2015-07-23 04:46:00-04:00,PHM,neutral
1008980.0,"Credit Suisse Sees Home Builder EPS Expectations For '2H and 2016 as generally too optimistic', Sees Better Pricing From Builders Being Offset By Higher Lands & Labor Prices",2015-07-20 07:48:00-04:00,PHM,positive
1008981.0,Bill Miller Says Builders are Big Part of Portfolio; Likes Pulte Better than Lennar #DeliveringAlpha,2015-07-15 11:09:00-04:00,PHM,positive
1008982.0,Fast Money Picks For June 22,2015-06-21 19:17:00-04:00,PHM,neutral
1008984.0,Sterne Agee CRT: 6 Homebuilders To Buy On Weakness,2015-05-21 07:36:00-04:00,PHM,negative
1008985.0,April Housing Data Obliterates Expectations; Investors Buy In,2015-05-19 08:52:00-04:00,PHM,neutral
1008986.0,Raymond James' Mass Downgrade Of Homebuilders Shows...It Doesn't Like Them Very Much,2015-05-15 15:11:00-04:00,PHM,negative
1008987.0,Raymond James Downgrades PulteGroup to Market Perform,2015-05-15 08:47:00-04:00,PHM,neutral
1008988.0,Zelman Upgrades PulteGroup to Buy,2015-04-24 08:43:00-04:00,PHM,neutral
1008989.0,Morning Market Losers,2015-04-23 09:54:00-04:00,PHM,negative
1008990.0,Benzinga's Top #PreMarket Losers,2015-04-23 08:29:00-04:00,PHM,negative
1008991.0,"JP Morgan Downgrades PulteGroup to Underweight, Maintains $21.00 PT",2015-04-09 06:33:00-04:00,PHM,positive
1008992.0,Housing ETFs Near 8-Year Highs,2015-03-24 15:51:00-04:00,PHM,neutral
1008993.0,3 Important ETFs Sitting On Support,2015-03-12 16:26:00-04:00,PHM,positive
1008994.0,CORRECTION: Buckingham Research Upgrades PulteGroup to Buy,2015-03-09 08:40:00-04:00,PHM,neutral
1008996.0,"Pulte Group Director Hawaux Buys 6,000 Shares $21.80/Share -Form 4",2015-03-05 14:05:00-05:00,PHM,positive
1008997.0,Why 1 Analyst Just Raised Price Targets On These 7 Homebuilders,2015-02-19 09:10:00-05:00,PHM,neutral
1008998.0,"Citi Dishes On Housing, Details 'The Good, The (Less) Bad And The (Not So) Ugly'",2015-02-11 14:05:00-05:00,PHM,negative
1008999.0,BofA On The U.S. Housing Market: 'Feelin' Alright',2015-02-10 14:11:00-05:00,PHM,positive
1009000.0,Will The Fed's Interest Rate Hike Hit Homebuilders?,2015-02-01 10:55:00-05:00,PHM,positive
1009001.0,CNBC's Stock Pops & Drops From January 29,2015-01-30 07:01:00-05:00,PHM,neutral
1009002.0,Wells Fargo Downgrades PulteGroup to Market Perform,2015-01-30 06:17:00-05:00,PHM,positive
1009003.0,UPDATE: PulteGroup Posts Upbeat Q4 Results,2015-01-29 07:34:00-05:00,PHM,neutral
1009004.0,Pulte Reports Q4 EPS $0.58 vs $0.40 Est; Revenue $1.82B vs $1.76B Est,2015-01-29 06:32:00-05:00,PHM,neutral
1009005.0,"With Housing Stocks Mixed, This Analyst Says A Recovery 'Is Still Barely On First Base'",2015-01-27 12:02:00-05:00,PHM,neutral
1009006.0,Credit Suisse Analyst: Headwinds Blast Homebuilders' Outlook,2015-01-20 17:13:00-05:00,PHM,positive
1009007.0,Homebuilding Stocks Fall Amid Housing Market Index Report,2015-01-20 13:11:00-05:00,PHM,neutral
1009008.0,"Buckingham Research Downgrades PulteGroup to Neutral, Lowers PT to $23.00",2015-01-20 09:31:00-05:00,PHM,negative
1009009.0,Benzinga's Top Downgrades,2015-01-20 09:11:00-05:00,PHM,positive
1009010.0,Credit Suisse Lowers Expectations On Housing,2015-01-20 08:20:00-05:00,PHM,positive
1009011.0,Credit Suisse Downgrades PulteGroup To Underperform,2015-01-20 08:14:00-05:00,PHM,positive
1009012.0,"Credit Suisse Downgrades PulteGroup to Underperform, Lowers PT to $19.00",2015-01-20 04:19:00-05:00,PHM,positive
1009013.0,Morgan Stanley Mostly Lukewarm On Homebuilders,2015-01-15 12:32:00-05:00,PHM,neutral
1009014.0,Morgan Stanley on Homebuilders:,2015-01-15 07:44:00-05:00,PHM,neutral
1009015.0,Homebuilding Stocks To Watch Following KB Home's Q4 Results,2015-01-13 11:40:00-05:00,PHM,neutral
1009016.0,"With Home Builders In Focus, It's Time To Look At What The Experts Are Saying",2015-01-08 14:59:00-05:00,PHM,neutral
1009017.0,Housing-Related Stocks Move Higher Ahead of Obama Speech,2015-01-08 11:39:00-05:00,PHM,neutral
1009018.0,President Obama to Speak at 12:45 PM ET About Housing Market,2015-01-08 11:37:00-05:00,PHM,neutral
1009019.0,Will SUPERVALU Surprise Q3 Earnings Estimates?,2015-01-06 16:07:00-05:00,PHM,positive
1009020.0,"Sterne Agee's Housing Outlook: YOY Growth Expected, Mortgage Availability A Concern",2015-01-02 08:49:00-05:00,PHM,positive
1009021.0,How To Find The Best Home Builders In 7 Easy Steps,2014-12-31 08:12:00-05:00,PHM,positive
1009022.0,"Homebuilder Confidence Dips, Sector Stocks Follow",2014-12-15 15:19:00-05:00,PHM,positive
1009023.0,Best And Worst ETFs Of November,2014-12-04 11:30:00-05:00,PHM,neutral
1009024.0,How Positive Housing Numbers Are Helping 2 ETFs Break Out,2014-11-18 15:22:00-05:00,PHM,positive
1009025.0,Homebuilders Surge On Toll Brothers' Positive Sales,2014-11-10 15:20:00-05:00,PHM,positive
1009026.0,"Bank of America Maintains Buy on PulteGroup, Inc., Raises PT to $25.00",2014-11-10 06:53:00-05:00,PHM,neutral
1009027.0,"Fast Money Halftime Report Final Trade From October 29: Macy's, PulteGroup, Boardwalk Pipeline",2014-10-29 15:44:00-04:00,PHM,neutral
1009028.0,"PulteGroup's Stock Looks Cheap, But What Do The Technicals Show?",2014-10-29 14:04:00-04:00,PHM,neutral
1009029.0,"PulteGroUp, Inc. Reports Q3 EPS of $0.37 vs $0.36 Est; Revenue of $1.59B vs $1.58B Est",2014-10-23 06:40:00-04:00,PHM,neutral
1009030.0,PulteGroup to Buyback Up to Additional $750M of Shares; Raises Dividend 60% to $0.08/Share,2014-10-23 06:35:00-04:00,PHM,positive
