Unnamed: 0,title,date,stock,sentiment
1009261.0,Existing Home Sales Rise Slightly More than Expected,2012-05-22 10:20:00-04:00,PHM,neutral
1009262.0,Homebuilders Topping Lenders On Better Housing News,2012-05-16 13:19:00-04:00,PHM,positive
1009263.0,"Building Permits, Housing Starts Signal Mixed Housing Market",2012-05-16 08:44:00-04:00,PHM,neutral
1009264.0,MBA Mortgage Applications Increase 9.2% from Last Week,2012-05-16 08:38:00-04:00,PHM,positive
1009265.0,MBA Mortgage Applications Increase1.7% from Last Week,2012-05-09 10:34:00-04:00,PHM,neutral
1009266.0,MBA Mortgage Applications Increase 0.1% from Last Week,2012-05-02 08:50:00-04:00,PHM,positive
1009267.0,Six stocks I like for next week,2012-04-28 14:54:00-04:00,PHM,positive
1009268.0,"Guggenheim Maintains Pulte Group at Neutral, Raises PT from $8 to $9",2012-04-26 14:11:00-04:00,PHM,neutral
1009269.0,Pending Home Sales Rise More than Expected,2012-04-26 10:29:00-04:00,PHM,neutral
1009270.0,UPDATE: PulteGroup Posts Narrower Q1 Loss,2012-04-26 07:17:00-04:00,PHM,negative
1009271.0,Pulte Group Reports Q1 EPS $0.03 vs $-0.03 Est; Revenues $881M vs $836.61M Est,2012-04-26 06:35:00-04:00,PHM,neutral
1009272.0,New Home Sales Rise More than Expected,2012-04-24 10:12:00-04:00,PHM,neutral
1009273.0,Existing Home Sales Rise Less than Expected,2012-04-19 10:20:00-04:00,PHM,neutral
1009274.0,"Building Permits, Housing Starts Signal Mixed Housing Market Sentiment",2012-04-17 08:43:00-04:00,PHM,neutral
1009275.0,"Builders Upgraded on Housing Outlook, But Shares Fall - IBD",2012-04-13 13:43:00-04:00,PHM,positive
1009276.0,MBA Mortgage Applications Increase 4.8% from Prior Week,2012-04-04 10:25:00-04:00,PHM,positive
1009277.0,MBA Mortgage Applications Decrease 2.7% from Last Week,2012-03-28 09:07:00-04:00,PHM,neutral
1009278.0,Housing Stocks Fall On Home Sales Data,2012-03-23 13:01:00-04:00,PHM,neutral
1009279.0,New Home Sales Rise Less than Expected,2012-03-23 10:17:00-04:00,PHM,neutral
1009280.0,KB Home Earnings Preview: A Surge in Q1 Revenue Expected,2012-03-22 07:05:00-04:00,PHM,neutral
1009281.0,MBA Mortgage Applications Decrease 7.4% from Last Week,2012-03-21 08:10:00-04:00,PHM,neutral
1009282.0,Building Permits Signal Recovering Housing Market,2012-03-20 09:06:00-04:00,PHM,neutral
1009283.0,MBA Mortgage Applications Decrease 2.4% from Last Week,2012-03-14 07:24:00-04:00,PHM,neutral
1009284.0,UPDATE: Williams Financial Group Initiates PulteGroup at Hold,2012-03-12 14:22:00-04:00,PHM,neutral
1009285.0,Notable Put Options Activity in PulteGroup,2012-03-12 13:23:00-04:00,PHM,neutral
1009286.0,"Williams Financial Group Initiates Coverage on Pulte Group at Hold, Announces PT of $8.75",2012-03-12 09:34:00-04:00,PHM,neutral
1009287.0,Hearing Compass Point Downgrades PulteHome from Neutral to Sell,2012-02-28 08:54:00-05:00,PHM,neutral
1009288.0,Notable Put Options Activity in PulteGroup,2012-02-27 12:25:00-05:00,PHM,neutral
1009289.0,New Home Sales Rise More than Expected,2012-02-24 10:44:00-05:00,PHM,neutral
1009290.0,"Existing Home Sales Rise 4.57M, Less than Expected",2012-02-22 10:17:00-05:00,PHM,neutral
1009291.0,MBA Mortgage Applications Decrease 4.5% from Last Week,2012-02-22 10:03:00-05:00,PHM,neutral
1009292.0,"UBS Downgrades Pulte Group from Buy to Neutral, Raises PT from $8 to $9",2012-02-16 12:47:00-05:00,PHM,neutral
1009293.0,"More New Home Builds Boost Pulte, Beazer, D. R. Horton",2012-02-16 08:53:00-05:00,PHM,positive
1009294.0,Pulte Group Hits 52-Week High of $9.15,2012-02-15 09:31:00-05:00,PHM,neutral
1009295.0,MBA Mortgage Applications Decrease 1.0% from Last Week,2012-02-15 08:40:00-05:00,PHM,neutral
1009296.0,"Hedge Fund 13-F Updates: Berkshire, Greenlight, Paulson & Co., Appaloosa and More!",2012-02-14 17:44:00-05:00,PHM,neutral
1009297.0,"Appaloosa Dissolved Its Stake in Temple Inland, Google, Mosaic, KB Home, Pultegroup, E*Trade, and Tesoro",2012-02-14 16:17:00-05:00,PHM,neutral
1009298.0,"Option Alert: PulteGroup April 8 Call; Block Trade, 4,500 Contracts",2012-02-14 10:29:00-05:00,PHM,negative
1009299.0,Pulte Group Hits 52-Week High of $9.09,2012-02-13 14:54:00-05:00,PHM,neutral
1009300.0,"Bernanke's Pessimism on Housing Might Drag on Pulte, Toll Brothers",2012-02-10 13:36:00-05:00,PHM,negative
1009301.0,Pulte Group Hits 52-Week High of $8.72,2012-02-09 09:34:00-05:00,PHM,neutral
1009302.0,Pulte Group Hits 52-Week High of $8.53,2012-02-08 09:55:00-05:00,PHM,neutral
1009303.0,MBA Mortgage Applications Increase 7.5%,2012-02-08 08:11:00-05:00,PHM,positive
1009304.0,"Wall Street Strategies Reiterates PulteGroup Hold, Raises PT",2012-02-07 15:38:00-05:00,PHM,neutral
1009305.0,Pulte Group Hits 52-Week High of $8.53,2012-02-07 11:07:00-05:00,PHM,neutral
1009306.0,Pulte Group Hits 52-Week High of $8.44,2012-02-06 09:39:00-05:00,PHM,neutral
1009307.0,Pulte Group Reports Q4 EPS $0.11 vs $0.07 Est; Revenues $1.26B vs $1.14B Est				 ,2012-02-02 06:57:00-05:00,PHM,neutral
1009308.0,Earnings Scheduled For February 2,2012-02-02 04:06:00-05:00,PHM,neutral
1009309.0,MBA Mortgage Applications Decrease 2.9% from Last Week,2012-02-01 07:51:00-05:00,PHM,neutral
1009310.0,Small Cap Top Performers in January,2012-01-30 06:19:00-05:00,PHM,positive
1009311.0,MBA Mortgage Applications Decrease 5% from Last Week,2012-01-25 09:53:00-05:00,PHM,neutral
1009312.0,"Benzinga's Top ETF Decliners, January 20th (ZSL, TVIX, UCO, XHB)",2012-01-20 19:06:00-05:00,PHM,positive
1009313.0,ETF Showdown: The Battle For The American Dream,2012-01-20 12:40:00-05:00,PHM,negative
1009314.0,Positive Housing Data Powers Pulte,2012-01-18 11:57:00-05:00,PHM,positive
1009315.0,MBA Mortgage Applications Increase 23.1% from Prior Week,2012-01-18 09:22:00-05:00,PHM,positive
1009316.0,Home Building Stocks Approach The Ceiling,2012-01-17 09:54:00-05:00,PHM,neutral
1009317.0,"UPDATE: Guggenheim Downgrades Pulte to Neutral, Maintains $8 Target",2012-01-13 10:38:00-05:00,PHM,neutral
1009318.0,Guggenheim Downgrades PulteGroup to Neutral,2012-01-13 06:35:00-05:00,PHM,neutral
1009319.0,MBA Mortgage Applications Increase 4.5%,2012-01-11 07:35:00-05:00,PHM,positive
1009320.0,Lennar Earnings Preview,2012-01-10 21:55:00-05:00,PHM,neutral
1009321.0,DR Horton and Home Depot to Open Near 52-Week Highs,2012-01-09 06:38:00-05:00,PHM,neutral
1009322.0,Earnings Expectations for the Week of January 9,2012-01-08 09:41:00-05:00,PHM,neutral
1009323.0,MBA Mortgage Applications Decrease 4.1% from Last Week,2012-01-04 07:34:00-05:00,PHM,neutral
1009324.0,Is It Finally Safe to Buy a Home?,2011-12-29 13:34:00-05:00,PHM,positive
1009325.0,Market Roundup,2011-12-29 11:10:00-05:00,PHM,neutral
1009326.0,PulteGroup Sells Select Colorado Land Assets; Terms Not Disclosed,2011-12-29 08:03:00-05:00,PHM,positive
1009327.0,Notable Put Options Activity on Pultegroup,2011-12-27 11:24:00-05:00,PHM,neutral
1009328.0,Notable Put Options Activity in PulteGroup,2011-12-01 11:02:00-05:00,PHM,neutral
1009329.0,Goldman Sachs Publishes Report on Home Improvement Industry ,2011-11-29 07:54:00-05:00,PHM,positive
1009330.0,"Homebuilders Are Holding Up, How Much Is Left In The Tank?",2011-11-15 15:42:00-05:00,PHM,neutral
1009331.0,Top 4 Mid-Cap Stocks In The Residential Construction Industry With The Highest Cash,2011-11-10 04:43:00-05:00,PHM,positive
1009332.0,Notable Call Options Activity in PulteGroup,2011-11-07 10:56:00-05:00,PHM,neutral
1009333.0,UPDATE: Citi Raises PT to $6 on Pultegroup ,2011-10-31 08:42:00-04:00,PHM,neutral
1009334.0,Citigroup Raises PT on Pultegroup to $6,2011-10-31 06:30:00-04:00,PHM,neutral
1009335.0,PulteGroup Reports Q3 Prelim EPS $(0.34) May Not Compare vs $(0.01) Est; Revenues $1.14B vs $1.05B Est			,2011-10-27 06:37:00-04:00,PHM,neutral
1009336.0,Earnings Expectations for the Week of October 24,2011-10-23 13:40:00-04:00,PHM,neutral
1009337.0,Earnings Season Kicks Off  10-17-2011,2011-10-17 15:09:00-04:00,PHM,neutral
1009338.0,Notable Put Options Activity in PulteGroup,2011-10-17 10:46:00-04:00,PHM,neutral
1009339.0,Goldman Sachs' 3Q2011 Survey Reinforces its Housing Expectations,2011-10-14 08:01:00-04:00,PHM,neutral
1009340.0,"UPDATE: Compass Point Upgrades Pulte Group, Lowers PT",2011-09-28 15:08:00-04:00,PHM,negative
1009341.0,Compass Point Research & Trading Upgrades PulteGroup to Buy,2011-09-28 15:05:00-04:00,PHM,neutral
1009342.0,"Option Alert: Heavy Volume in PulteGroup January 2012 7.5 Call; 35,015 Contracts",2011-09-22 12:29:00-04:00,PHM,positive
1009343.0,UBS Upgrades Pulte Homes,2011-09-20 10:29:00-04:00,PHM,neutral
1009344.0,Benzinga's Top Pre-Market Gainers,2011-09-20 07:50:00-04:00,PHM,positive
1009345.0,UPDATE: Goldman Sachs Removes PulteGroup from Conviction Buy List,2011-09-06 09:59:00-04:00,PHM,neutral
1009346.0,"Goldman Sachs Removes Pulte From CL-Buy List, Lowers PT To $6",2011-09-06 06:15:00-04:00,PHM,negative
1009347.0,Morning Losers; Esterline Technologies Down 11%,2011-09-02 10:29:00-04:00,PHM,negative
1009348.0,Block Trade Alert: Pultegroup Trades 992K Shares at $4.92,2011-08-30 12:56:00-04:00,PHM,positive
1009349.0,Benzinga's Top Upgrades,2011-08-30 07:33:00-04:00,PHM,positive
1009350.0,Midday Gainers; MICROS Systems up 11%,2011-08-26 13:36:00-04:00,PHM,neutral
1009351.0,Moody's Remix  08-24-2011,2011-08-24 15:21:00-04:00,PHM,neutral
1009352.0,PulteGroup Comments on Recent Stock Transactions ,2011-08-24 14:12:00-04:00,PHM,neutral
1009353.0,Puts Rolled on PulteGroup,2011-08-24 10:49:00-04:00,PHM,neutral
1009354.0,Fitch Downgrades PulteGroup IDR to 'BB'; Outlook To Negative ,2011-08-22 10:01:00-04:00,PHM,negative
1009355.0,Thursday's Mid-Day Options Volume Leaders,2011-08-04 12:23:00-04:00,PHM,neutral
1009357.0,PulteGroup Reports Q2 EPS $(0.15) vs $(0.04) Est; Revenues $927.2M vs $974.01M Est ,2011-07-28 09:10:00-04:00,PHM,neutral
1009358.0,Earnings Roundup,2011-07-28 08:42:00-04:00,PHM,neutral
1009359.0,UPDATE: PulteGroup Swings To Q2 Loss,2011-07-28 07:02:00-04:00,PHM,negative
1009360.0,Stocks Took a Breather  07-20-2011,2011-07-20 19:37:00-04:00,PHM,neutral
1009361.0,Chop & Pop  07-20-2011,2011-07-20 14:38:00-04:00,PHM,neutral
1009362.0,Options Brief: PulteGroup,2011-07-20 11:59:00-04:00,PHM,neutral
1009363.0,Options Brief: PulteGroup,2011-07-19 10:26:00-04:00,PHM,neutral
1009364.0,Hottest and Coldest Sectors for Thursday 7/7/2011,2011-07-07 19:35:00-04:00,PHM,neutral
1009365.0,Wednesday's S&P 500 Sector Recap 6/29/11,2011-06-29 17:35:00-04:00,PHM,neutral
1009366.0,Rally Extended  06-29-2011,2011-06-29 15:31:00-04:00,PHM,neutral
1009367.0,Rally Extended  06-29-2011,2011-06-29 15:31:00-04:00,PHM,neutral
1009368.0,Is Your Portfolio Ready to Rebound With Housing?,2011-06-29 13:06:00-04:00,PHM,positive
1009369.0,New XPOUND  06-28-2011,2011-06-28 14:47:00-04:00,PHM,neutral
1009370.0,Mondays Put/Call Ratio Leaders,2011-06-27 12:14:00-04:00,PHM,neutral
1009371.0,Fed Unched.  06-22-2011,2011-06-22 13:41:00-04:00,PHM,neutral
1009372.0,Goldman Sachs Reiterates Buy Rating On PulteGroup,2011-06-22 08:13:00-04:00,PHM,neutral
1009373.0,"S&P Sector Update: Consumer Goods Leading 1.0%, Technology Lagging 0.25%",2011-06-20 12:10:00-04:00,PHM,negative
1009374.0,Sector Recap and Technical Analysis for 6/14/11,2011-06-14 17:26:00-04:00,PHM,neutral
1009375.0,Chief Chops Market  06-07-2011,2011-06-07 19:03:00-04:00,PHM,neutral
1009376.0,Bank of America Merrill Lynch Neutral On PulteGroup,2011-06-01 07:52:00-04:00,PHM,neutral
1009377.0,Headline Away from Adding Volatility  05-31-2011,2011-05-31 18:39:00-04:00,PHM,neutral
1009378.0,"Dollar Weak, Market Pops  05-31-2011",2011-05-31 14:53:00-04:00,PHM,negative
1009379.0,"Options Brief: PulteGroup, Inc.",2011-05-31 10:30:00-04:00,PHM,neutral
1009380.0,Disappointing Data  05-26-2011,2011-05-26 18:23:00-04:00,PHM,negative
1009381.0,"Homebuilder Stocks Trading News Alert; Beazer Homes, Hovnanian, KB Home, PulteGroup",2011-05-24 16:26:00-04:00,PHM,positive
1009382.0,Resistance is Former Support Level  05-24-2011,2011-05-24 14:51:00-04:00,PHM,positive
1009383.0,David Tepper's Appaloosa Looking For A Bottom In Housing? ,2011-05-18 13:04:00-04:00,PHM,neutral
1009384.0,Goldman Sachs Reiterates Buy Rating As PulteGroup Names A New CFO (PHM) ,2011-05-10 07:57:00-04:00,PHM,neutral
1009385.0,Goldman Sachs Reiterates Conviction Buy on PulteGroup (PHM),2011-05-10 07:54:00-04:00,PHM,neutral
1009386.0,PulteGroup Names Robert O'Shaughnessy CFO ,2011-05-09 16:17:00-04:00,PHM,neutral
1009387.0,J.P. Morgan Raises Price Target on PulteGroup (PHM) from $8.50 to $9.00,2011-05-02 09:42:00-04:00,PHM,neutral
1009388.0,Will Consumers Stay Strong?  04-28-2011,2011-04-28 18:55:00-04:00,PHM,positive
1009389.0,Canary in the Coal Mine  04-28-11,2011-04-28 15:27:00-04:00,PHM,neutral
1009390.0,PulteGroup Reports First Quarter 2011 Financial Results ,2011-04-28 07:10:00-04:00,PHM,neutral
1009391.0,Trading Turns Mixed  04-19-2011,2011-04-19 15:28:00-04:00,PHM,neutral
1009392.0,"April 7, 2011: March Housing Stats Weak",2011-04-07 12:49:00-04:00,PHM,negative
1009393.0,Pulte Group Outlook Negative on Fewer Anticipated Closings - S&P (PHM),2011-04-01 14:27:00-04:00,PHM,negative
1009394.0,Goldman Sachs Adds PulteGroup to Conviction Buy List (PHM),2011-03-23 08:54:00-04:00,PHM,neutral
1009395.0,"Options Brief: PulteGroup, Inc. (PHM)",2011-03-22 15:19:00-04:00,PHM,neutral
1009396.0,Wells Fargo Maintains Market Perform on Pulte Group (PHM),2011-03-09 08:55:00-05:00,PHM,positive
1009397.0,"Fast Money Pops & Drops, March 8th (BWLD, S, HIBB, DKS, EXPE, PHM, DMND)",2011-03-08 20:41:00-05:00,PHM,neutral
1009398.0,Goldman Sachs' Key Thoughts On PHM Pre-Announcement,2011-03-08 09:46:00-05:00,PHM,neutral
1009399.0,J.P. Morgan Maintains $8.50 PT On PHM,2011-03-08 08:48:00-05:00,PHM,neutral
1009400.0,"Leaving on a Jet Plane, Will the Market Come Back Again?  02-24-2011",2011-02-24 15:06:00-05:00,PHM,neutral
1009401.0,Notable Weakness in Small Caps  02-07-2011,2011-02-07 18:26:00-05:00,PHM,negative
1009402.0,Home-builders Remain Weak,2011-02-04 10:06:00-05:00,PHM,negative
1009403.0,"Earnings Scheduled For February 4 (TSN, CEG, AET, FO, CLX, AON, WY, PHM, SPG)",2011-02-04 02:26:00-05:00,PHM,neutral
1009404.0,Money Flows Out of Bonds into Equities  02-01-2011,2011-02-01 17:49:00-05:00,PHM,neutral
1009405.0,"Tuesday's Put/Call Ratio Leaders (TRE, AMLN, PHM, NXY, EXM)",2011-02-01 12:47:00-05:00,PHM,neutral
1009406.0,"Mortgage Activity Rises, Rates Dip",2011-01-19 11:00:00-05:00,PHM,neutral
1009407.0,"January 11, 2011:December Housing Traffic Up. Why?",2011-01-11 14:02:00-05:00,PHM,neutral
1009408.0,KB Home's Lackluster 4Q  - Analyst Blog,2011-01-11 14:01:00-05:00,PHM,negative
1009409.0,KB Home's Lackluster 4Q  - Analyst Blog,2011-01-11 13:43:00-05:00,PHM,negative
1009410.0,"Lennar Strong, Low Revs Trivial - Analyst Blog",2011-01-11 12:31:00-05:00,PHM,positive
1009411.0,"Lennar Strong, Low Revs Trivial - Analyst Blog",2011-01-11 12:00:00-05:00,PHM,positive
1009412.0,Lennar Builds Up on Earnings Beat,2011-01-11 09:17:00-05:00,PHM,neutral
1009413.0,Can Housing Stocks Make a Comeback?,2011-01-11 08:30:00-05:00,PHM,neutral
1009414.0,Mortgage Activity Rises as Rates Dip,2011-01-05 12:53:00-05:00,PHM,neutral
1009415.0,"Lennar, Hovnanian: Homebuilder Winners & Losers",2010-12-22 12:07:00-05:00,PHM,negative
1009416.0,"Stock Market News for Dec 21, 2010 - Market News",2010-12-21 09:36:00-05:00,PHM,neutral
1009417.0,"Stock Market News for Dec 21, 2010 - Market News",2010-12-21 09:08:00-05:00,PHM,neutral
1009418.0,Housing Starts Rise 3.9% in November,2010-12-16 08:58:00-05:00,PHM,neutral
1009419.0,Mortgage Activity Slows as Rates Inch Up,2010-12-08 08:57:00-05:00,PHM,neutral
1009420.0,"Stock Market News for December 3, 2010 - Market News",2010-12-03 09:30:00-05:00,PHM,neutral
1009421.0,"Stock Market News for December 3, 2010 - Market News",2010-12-03 04:16:00-05:00,PHM,neutral
1009422.0,Pending Home Sales Rebound 10.4% in October,2010-12-02 10:14:00-05:00,PHM,neutral
1009423.0,10 Worst-Performing S&P 500 Stocks of 2010,2010-12-01 06:45:00-05:00,PHM,neutral
1009424.0,Home Prices Continue to Cool,2010-11-30 09:12:00-05:00,PHM,positive
1009425.0,New-Home Sales Fall 8.1% in October,2010-11-24 10:02:00-05:00,PHM,neutral
1009426.0,Sovereign Debt Back on Front Burner  11-18-2010,2010-11-18 15:04:00-05:00,PHM,negative
1009427.0,"Wednesday Sector Laggards: General Contractors & Builders, Defense Stocks",2010-11-17 15:20:00-05:00,PHM,positive
1009428.0,"Wednesday Sector Leaders: Music & Electronics Stores, Metals Fabrication & Products",2010-11-17 15:18:00-05:00,PHM,neutral
1009429.0,"Wednesday's ETF Movers: GDXJ, IFNA",2010-11-17 15:17:00-05:00,PHM,neutral
1009430.0,"Homebuilder Weakness Continues After Housing Start Report (DHI, PHM, KBH)",2010-11-17 11:55:00-05:00,PHM,negative
1009431.0,Markets Run in Place at Open,2010-11-17 10:09:00-05:00,PHM,neutral
1009432.0,"Homebuilders Sink Despite Survey Showing Improvement in Confidence (PHM, KBH, LEN)",2010-11-16 14:57:00-05:00,PHM,positive
1009433.0,PulteGroup's Loss Narrows - Analyst Blog,2010-11-04 15:03:00-04:00,PHM,negative
1009434.0,Citigroup Downgrades Pultegroup To Hold,2010-11-04 10:31:00-04:00,PHM,neutral
1009435.0,"Construction Reserves Dominate PulteGroup Earnings Conversations, Deutsche Bank Reports",2010-11-04 08:54:00-04:00,PHM,negative
1009436.0,"Benzinga's Top Upgrades (SMI, PHM, ID, KIM)",2010-11-04 07:45:00-04:00,PHM,positive
1009437.0,Credit Suisse Upgrades PHM To Neutral,2010-11-04 06:39:00-04:00,PHM,positive
1009438.0,"Benzinga's Worst Performing Industries (PWR, CTRP, RURL, PHM, BHS, WBD, COCO, ESI)",2010-11-03 19:41:00-04:00,PHM,negative
1009439.0,PulteGroup Hits 52-Week Low (PHM),2010-11-03 14:32:00-04:00,PHM,negative
1009440.0,"Rough Day For Homebuilders (XHB, PHM, TOL, HOV, KB)",2010-11-03 14:08:00-04:00,PHM,neutral
1009441.0,Calls Rolled on Pulte Homes (PHM),2010-11-03 13:19:00-04:00,PHM,neutral
1009442.0,"Benzinga's After Hours Decliners (ADS, PHM, XLNX)",2010-10-20 19:13:00-04:00,PHM,neutral
1009443.0,"Wednesday's Put/Call Ratio Leaders (RGR, PHM, VLTR, DHI, NYT)",2010-10-20 12:51:00-04:00,PHM,neutral
1009444.0,"Puts Purchased on Pulte Homes, Inc.  (PHM)",2010-10-20 11:55:00-04:00,PHM,neutral
1009445.0,"UBS Upgrades (PHM, FTR, DHI)",2010-10-14 10:47:00-04:00,PHM,neutral
1009446.0,"Monday's Put/Call Ratio Leaders (PHM, AIXG, PWR, SCHW, EXEL)",2010-10-11 13:41:00-04:00,PHM,neutral
1009447.0,Market in a Holding Pattern  09-28-2010,2010-09-28 19:10:00-04:00,PHM,neutral
1009448.0,Bid Still Participating  09-28-2010,2010-09-28 14:39:00-04:00,PHM,neutral
1009449.0,Calls Sold on Pulte Homes (PHM),2010-09-28 12:55:00-04:00,PHM,neutral
1009450.0,Goldman Upgrades Pulte Homes ,2010-09-28 08:20:00-04:00,PHM,neutral
1009451.0,"Benzinga's Top Upgrades (PHM, LVS, SGEN, APSG)",2010-09-28 07:27:00-04:00,PHM,positive
1009452.0,PulteGroup Announces Cash Tender Offers for up to $500 Million of Outstanding Notes ,2010-09-22 16:27:00-04:00,PHM,positive
1009453.0,"Despite Disappointing Housing Outlook, Homebuilders Surge (TOL, PHM, KBH, LEN)",2010-09-20 14:16:00-04:00,PHM,positive
1009454.0,"Stock Market News for September 16, 2010 - Market News",2010-09-16 10:15:00-04:00,PHM,neutral
1009455.0,"Stock Market News for September 3, 2010 - Market News",2010-09-03 09:36:00-04:00,PHM,neutral
1009456.0,"Housing Data Terrible; Homebuilders Rally (XHB, TOL, PHM)",2010-08-24 11:44:00-04:00,PHM,negative
1009457.0,"Housing Starts Released Tomorrow: How To Play It (XHB, PHM)",2010-08-23 13:14:00-04:00,PHM,positive
1009458.0,"Stock Market News for August 18, 2010 - Market News",2010-08-18 09:52:00-04:00,PHM,neutral
1009459.0,Tough to Read Market's Current Tea Leaves,2010-08-16 18:20:00-04:00,PHM,negative
1009460.0,Pulte Group - Bear of the Day,2010-08-13 04:07:00-04:00,PHM,neutral
1009461.0,"Top 4 Stocks In The Residential Construction Industry With The Highest Cash (PHM, DHI, MDC, TOL)",2010-08-09 06:00:00-04:00,PHM,positive
1009462.0,Stocks Slump But Recover Some Losses 08-06-2010,2010-08-06 19:22:00-04:00,PHM,negative
1009463.0,Jobs Report Disappoints 08-06-2010,2010-08-06 15:12:00-04:00,PHM,negative
1009464.0,PulteGroup Returns to Profit  - Analyst Blog,2010-08-04 15:33:00-04:00,PHM,positive
1009465.0,China Orders Stress Tests  08-04-2010,2010-08-04 15:26:00-04:00,PHM,negative
1009466.0,Pulte Homes Posts First Profit Since 2006 (PHM),2010-08-04 11:39:00-04:00,PHM,positive
1009467.0,"Zacks Investment Ideas feature highlights: KB Home, PulteGroup, ProShares Short Real Estate and UltraShort Real Estate ProShares (KBH, PHM, REK, SRS)",2010-07-30 22:09:00-04:00,PHM,neutral
1009468.0,"Stock Market News for July 27, 2010 - Market News",2010-07-27 09:49:00-04:00,PHM,neutral
1009469.0,Options Give Mixed Signals for Pulte (PHM),2010-07-26 10:59:00-04:00,PHM,neutral
1009470.0,"US Homebuilder Permits Rise, Markets Rally",2010-07-20 15:09:00-04:00,PHM,neutral
1009471.0,"Homebuilders Surge After Housing Starts Report (TOL, PHM, HOV)",2010-07-20 11:49:00-04:00,PHM,neutral
1009472.0,PulteGroup COO Announces Retirement (PHM),2010-07-19 11:59:00-04:00,PHM,neutral
1009473.0,"Stocks Re-enter Positive Territory, Driven By Tech Stocks; Banks, Homebuilders Suffer",2010-07-14 12:24:00-04:00,PHM,neutral
1009474.0,"Housing Prices Bottomed? According to Barry RitholtzNo Way (XHB, PHM)",2010-06-30 11:47:00-04:00,PHM,neutral
1009475.0,"Stock Market News for June 24, 2010 - Market News",2010-06-24 10:14:00-04:00,PHM,neutral
1009476.0,China Letting the Yuan Appreciate Will Have an Impact on Commercial Real Estate,2010-06-24 06:00:00-04:00,PHM,positive
1009477.0,Call Buyers Target Pulte Group (PHM),2010-06-21 10:56:00-04:00,PHM,neutral
1009478.0,Protection Purchased on Pulte Group (PHM),2010-06-17 13:53:00-04:00,PHM,neutral
1009479.0,"Gary Shilling Says Housing Price Have Further to Fall (XHB, PHM)",2010-06-17 12:09:00-04:00,PHM,neutral
1009480.0,"Company News for June 14, 2010 - Corporate Summary",2010-06-14 09:39:00-04:00,PHM,neutral
1009481.0,"June 5,2010: Real Estate Flops In May",2010-06-04 22:43:00-04:00,PHM,negative
1009482.0,"Lumber Prices Have Crashed On Weak Outlook For Builders  (WY, LUK, MAS, LPX, IP, FBR, TOL, KBH, LEN, PHM))",2010-05-28 10:14:00-04:00,PHM,negative
1009483.0,Heavy Call Activity in Pulte (PHM),2010-05-27 11:33:00-04:00,PHM,neutral
1009484.0,Look for Opportunity  05-25-2010,2010-05-25 17:55:00-04:00,PHM,positive
1009485.0,John Paulson's Q1 2010 Moves,2010-05-18 08:38:00-04:00,PHM,neutral
1009486.0,PulteGroup Suit Against LIUNA Dismissed ,2010-05-12 14:52:00-04:00,PHM,neutral
1009487.0,US Stocks Rally On Impressive Home Sales Data ,2010-04-23 12:18:00-04:00,PHM,positive
1009488.0,US Stock Ended In Positive Territory After Losing 100 Points,2010-04-23 07:03:00-04:00,PHM,positive
1009489.0,"Stock Market News for April 7, 2010 - Market News",2010-04-07 09:30:00-04:00,PHM,neutral
1009490.0,"Market Roundup (HD, AAPL, NOK, HPQ, KBH, NVR, PHM, HOT, RBS)",2010-04-06 14:39:00-04:00,PHM,neutral
1009491.0,"Stifel Nicolaus initiates Coverage Of Pulte Homes, Inc. (PHM) With Sell Rating",2010-04-06 13:03:00-04:00,PHM,neutral
1009492.0,PHM Slashed to Underperform,2010-04-06 09:16:00-04:00,PHM,negative
1009493.0,Real Estate ETFs Will Continue To Face Major Hurdles Ahead,2010-03-25 15:57:00-04:00,PHM,neutral
1009494.0,Large Public Homebuilders Benefit from Tax Aid - Lobbyists Win Again,2010-03-18 15:23:00-04:00,PHM,positive
1009495.0,"""Mad Money:"" Jim Cramer Bullish On Gold, Foreign Stocks",2010-03-16 08:29:00-04:00,PHM,negative
1009496.0,"Stock Market News for March 5, 2010 - Market News",2010-03-05 09:21:00-05:00,PHM,neutral
1009497.0,"Stock Market News for February 25, 2010 - Market News",2010-02-25 09:40:00-05:00,PHM,neutral
1009498.0,"Housing Sector Experiences Free Fall After Weak Housing Loan Data (PHM, LEN, KBH, CHCI, DHI)",2010-02-24 10:32:00-05:00,PHM,positive
1009499.0,"Hovnanian Chief Says His Stock is Undervalued on CNBC (HOV, XHB, PHM)",2010-02-16 13:02:00-05:00,PHM,neutral
1009500.0,"Stock Market News for February 12, 2010 - Market News",2010-02-12 09:12:00-05:00,PHM,neutral
1009501.0,"Earnings Roundup (PHM, MCD, TAP, CAM)",2010-02-09 10:29:00-05:00,PHM,neutral
1009502.0,Pulte Homes Inc. (PHM) Reports $116.9 Million Loss,2010-02-09 08:23:00-05:00,PHM,negative
1009503.0,Homebuilding Shares (XHB) On The Rise,2010-02-08 13:15:00-05:00,PHM,positive
1009504.0,"Top 5 Stocks In The Residential Construction Industry With The Highest Cash (AIG, GS, MS, MAC, GNW)",2010-02-03 04:31:00-05:00,PHM,positive
1009505.0,"US Existing Home Purchases Take A Plunge (KBH, PHM, TOL, LEN, XHB, PKB)",2010-01-25 15:38:00-05:00,PHM,neutral
1009506.0,"January 9, 2010: Seven Ideas For 2010, So Says The Screen",2010-01-08 18:51:00-05:00,PHM,neutral
1009507.0,Mobility At Record Low Due To Housing Bust,2010-01-07 07:12:00-05:00,PHM,negative
1009508.0,"November Saw Pending Home Sales Plummeting (PHM, KBH, TOL, XHB, LEN)",2010-01-05 11:48:00-05:00,PHM,neutral
1009509.0,"Stock Market News for December 24, 2009 - Market News",2009-12-24 08:42:00-05:00,PHM,neutral
1009510.0,A Call for the Bottom in DR Horton,2009-12-23 14:09:00-05:00,PHM,neutral
1009511.0,Stock Market Hit by a Sharp Decline in New Home Sales in November ,2009-12-23 13:46:00-05:00,PHM,neutral
1009512.0,Heavy Action in Pulte Homes,2009-12-23 10:08:00-05:00,PHM,neutral
1009513.0,"Stock Market News for December 23, 2009 - Market News",2009-12-23 09:22:00-05:00,PHM,neutral
1009514.0,"Strong Home Sales Lifted The Market  (PHM, DHI, KBH, LEN, TOL, XHB)",2009-12-22 13:19:00-05:00,PHM,positive
1009515.0,Odd Play in Pulte Homes,2009-12-17 12:29:00-05:00,PHM,neutral
1009516.0,"Positive Economic Data Triggers Stock Prices (FCX, XOM, PHM)",2009-12-16 14:21:00-05:00,PHM,positive
1009517.0,"Stock Market News for December 02, 2009 - Market News",2009-12-02 09:10:00-05:00,PHM,neutral
1009518.0,"Stock Market News for November 19, 2009 - Market News",2009-11-19 09:21:00-05:00,PHM,neutral
1009519.0,"Benzingas Top Upgrades (SII, PHM, FIS, ARUN, OHI, ZMH) ",2009-11-18 12:04:00-05:00,PHM,positive
