Unnamed: 0,title,date,stock,sentiment
1009031.0,Buckingham Initiates Coverage On Several Homebuilders,2014-10-20 13:23:00-04:00,PHM,neutral
1009032.0,"Buckingham Research Initiates Coverage on PulteGroup, Inc. at Buy, Announces $24.00 PT",2014-10-20 08:38:00-04:00,PHM,neutral
1009033.0,Sterne Agee Previews Homebuilder Sector Earnings: Exercise Caution,2014-10-15 14:29:00-04:00,PHM,neutral
1009034.0, Compass Point Research Offers 'The Home Builder Hope Trade',2014-10-13 11:49:00-04:00,PHM,positive
1009035.0,Home Construction Stocks In Play,2014-10-13 09:02:00-04:00,PHM,positive
1009036.0,"Compass Point Maintains Neutral on PulteGroup, Inc., Raises PT to $19.00",2014-10-13 06:07:00-04:00,PHM,neutral
1009037.0,"#PreMarket Primer: Friday, October 10: Amazon To Offer Face-To-Face Interaction ",2014-10-10 08:49:00-04:00,PHM,positive
1009038.0,"Goldman Sachs Upgrades PulteGroup, Inc. to Neutral, Maintains $18.50 PT",2014-10-02 05:36:00-04:00,PHM,neutral
1009039.0,Homebuilders Reverse Rally On August Construction News,2014-09-18 13:37:00-04:00,PHM,neutral
1009040.0,5 Industrial Goods Stocks With The Lowest PEG Ratio,2014-09-10 09:25:00-04:00,PHM,negative
1009041.0,JP Morgan Still Likes Housing,2014-09-09 16:07:00-04:00,PHM,positive
1009042.0,"JP Morgan Upgrades PulteGroup, Inc. to Neutral, Raises PT to $22.00",2014-09-09 05:38:00-04:00,PHM,positive
1009043.0,Toll Brothers Inc 6% Decline In Q3 Contracts Drags Down Sector,2014-09-03 13:59:00-04:00,PHM,negative
1009044.0,New Home Sales Miss Estimates; Housing Stocks Weaken,2014-08-25 11:46:00-04:00,PHM,negative
1009045.0,PulteGroup Acquires Real Estate Assets Of Dominion Homes; Financial Terms Not Disclosed ,2014-08-25 07:02:00-04:00,PHM,positive
1009046.0,Homebuilder Stocks Higher On Better Home Construction Numbers,2014-08-19 09:07:00-04:00,PHM,positive
1009047.0,Top 4 Mid-Cap Stocks In The Residential Construction Industry With The Highest ROE,2014-08-11 04:58:00-04:00,PHM,positive
1009048.0,Is Housing Raising Questions About The Recovery?,2014-07-31 12:46:00-04:00,PHM,neutral
1009049.0,Homebuilders Bring Down The House Following June Pending Home Sales,2014-07-28 14:03:00-04:00,PHM,neutral
1009050.0,3 More Homebuilder Stocks To Watch Ahead Of Earnings,2014-07-28 13:08:00-04:00,PHM,neutral
1009051.0,PulteGroup Reports Q2 EPS of $0.11 Which May Not Compare $0.25 Est; Revenue of $1.29B Which May Not Compare $1.34B Est,2014-07-24 06:32:00-04:00,PHM,neutral
1009052.0,3 Homebuilder Stocks To Watch Ahead of Earnings,2014-07-23 09:17:00-04:00,PHM,neutral
1009053.0,Barclays Revises Price Targets On Homebuilders,2014-06-30 15:33:00-04:00,PHM,neutral
1009054.0,Shares of SPDR S&P Homebuilder ETF Spiked 1+% Following Very Strong New Home Sales Reading,2014-06-24 10:09:00-04:00,PHM,positive
1009055.0,Top 4 Mid-Cap Stocks In The Residential Construction Industry With The Highest ROE,2014-06-18 04:44:00-04:00,PHM,positive
1009056.0,Spring Thaw: Is The Housing Sector Ready To Move?,2014-06-03 16:15:00-04:00,PHM,positive
1009057.0,Market Shrugs Off Lower April Pending Home Sales,2014-05-29 11:10:00-04:00,PHM,negative
1009058.0,"Option Alert: PulteGroup May 30 $20 Call; 8,478 Contracts Traded vs 36 OI; Currently $19.00",2014-05-14 10:36:00-04:00,PHM,positive
1009059.0,"Option Alert: Pultegroup Oct $21 Call; 7,230 Contracts Traded vs 264 OI; Currently $18.35",2014-05-08 12:55:00-04:00,PHM,positive
1009060.0,Top 4 NYSE Stocks In The Residential Construction Industry With The Highest Revenue,2014-05-06 04:57:00-04:00,PHM,positive
1009061.0,Jeffrey Gundlach from Doubleline Recommending Investors Short Homebuilders - Reuters,2014-04-25 15:50:00-04:00,PHM,neutral
1009062.0,"ETF Outlook for Thursday, April 24, 2014 (XLK, SOCL, ITB, FXE, AAPL, FB)",2014-04-24 10:06:00-04:00,PHM,neutral
1009063.0,PulteGroup Reports Q1 EPS of $0.19 vs $0.20 Est; Revenue of $1.12B vs $1.18B Est,2014-04-24 06:34:00-04:00,PHM,neutral
1009064.0,Home Sales Data Hits Homebuilder ETFs,2014-04-23 14:04:00-04:00,PHM,neutral
1009065.0,"Option Alert: Pultegroup Oct $20 Call; 5,000 Contracts Traded vs 289 OI; Currently $18.84",2014-04-17 10:57:00-04:00,PHM,positive
1009066.0,Top 4 NYSE Stocks In The Residential Construction Industry With The Highest Revenue,2014-03-27 04:36:00-04:00,PHM,positive
1009067.0,"Housing Sector: ETF Or Stocks? (ITB, XHB, DHI)",2014-03-25 14:17:00-04:00,PHM,neutral
1009068.0,#Premarket Prep Technical Update - PulteGroup Trading Higher,2014-03-25 11:43:00-04:00,PHM,neutral
1009069.0,"Homebuilding Near-Term Deceleration Will Reward Stock Pickers, Analyst Offers Picks",2014-03-25 11:22:00-04:00,PHM,positive
1009070.0,Benzinga's Top Downgrades,2014-03-25 08:22:00-04:00,PHM,positive
1009071.0,Benzinga's Top #PreMarket Losers,2014-03-25 08:15:00-04:00,PHM,negative
1009072.0,"Barclays Downgrades PulteGroup, Inc. to Underweight, Lowers PT to $20.00",2014-03-25 08:08:00-04:00,PHM,negative
1009073.0,S&P Upgrades PulteGroup from BB to BB+,2014-03-21 11:50:00-04:00,PHM,neutral
1009074.0,UPDATE: KB Homes Shares Rise 7% Premarket; Shares of Other Homebuilder Stocks Also Higher,2014-03-19 08:43:00-04:00,PHM,positive
1009075.0,Homebuilding Sector At Credit Suisse: What You Need To Know,2014-03-13 16:00:00-04:00,PHM,positive
1009076.0,UPDATE: Credit Suisse Downgrades Home Builders Amid 'Lackluster Demand',2014-03-12 12:57:00-04:00,PHM,positive
1009077.0,"Credit Suisse Downgrades PulteGroup, Inc. to Neutral, Maintains $20.00 PT",2014-03-12 07:12:00-04:00,PHM,positive
1009078.0,Fitch Upgrades PulteGroup's IDR to BB+; Outlook Stable,2014-03-10 08:43:00-04:00,PHM,positive
1009079.0,"KeyBanc Offers Pair Trade: Upgrades Pulte, Downgrades Lennar",2014-03-04 16:01:00-05:00,PHM,neutral
1009080.0,Benzinga's Top Upgrades,2014-03-04 08:48:00-05:00,PHM,positive
1009081.0,"KeyBanc Upgrades PulteGroup, Inc. to Buy, Announces $26.00 PT",2014-03-04 07:44:00-05:00,PHM,neutral
1009082.0,"#PreMarket Primer: Thursday, February 27: Markets Anxious To Hear Yellen",2014-02-27 07:24:00-05:00,PHM,negative
1009083.0,"#PreMarket Primer: Tuesday, February 25: Mt. Gox Disappears, Bitcoin Down 20%",2014-02-25 07:01:00-05:00,PHM,negative
1009084.0,"Compass Point Maintains Neutral on PulteGroup, Inc., Raises PT to $18.00",2014-02-03 08:42:00-05:00,PHM,neutral
1009085.0,"Susquehanna Upgrades PulteGroup, Inc. to Positive, Raises PT to $25.00",2014-02-03 08:14:00-05:00,PHM,positive
1009086.0,"Raymond James Upgrades PulteGroup, Inc. to Outperform, Announces $23.00 PT",2014-01-31 08:09:00-05:00,PHM,neutral
1009087.0,Pulte Reports Q4 EPS of $0.57 vs $0.44 Est; Revenue of $1.66B vs $1.68B Est,2014-01-30 06:32:00-05:00,PHM,neutral
1009088.0,Top 4 Mid-Cap Stocks In The Residential Construction Industry With The Highest EPS,2014-01-27 04:36:00-05:00,PHM,positive
1009089.0,Form 8-K from PulteGroup Shows Co. Borrowing Capacity Under Pact Reduced to $99.8M,2014-01-13 14:09:00-05:00,PHM,neutral
1009090.0,"JP Morgan Downgrades PulteGroup, Inc. to Underweight, Maintains $18.00 PT",2014-01-10 08:45:00-05:00,PHM,positive
1009091.0,"FBN Securities Downgrades PulteGroup, Inc. to Underperform",2013-12-30 16:22:00-05:00,PHM,positive
1009092.0,"Homebuilding Stocks Strong Following Citi's Upgrade Of KB, Ahead Of Home Sales Data",2013-12-23 14:41:00-05:00,PHM,positive
1009093.0,"PulteGroup, JC Penney Move Higher After-Hours on Comments from Bill Miller on CNCB",2013-12-19 16:44:00-05:00,PHM,neutral
1009094.0,"Homebuilding Sector Getting Some Attention Amid Analyst Note, Upcoming Earnings Data ",2013-12-17 16:37:00-05:00,PHM,neutral
1009095.0,"Citigroup Maintains Neutral on PulteGroup, Inc., Lowers PT to $19.00",2013-12-13 08:40:00-05:00,PHM,negative
1009096.0,Toll Bros. CEO Doug Yearley on CNBC Says Housing is a 'Long Way' from a Bubble,2013-12-10 15:47:00-05:00,PHM,neutral
1009097.0,Bank of America Comments on PulteGroup CEO's Presentation at Industrials and Materials Conference,2013-12-10 12:33:00-05:00,PHM,neutral
1009098.0,Top 4 Mid-Cap Stocks In The Residential Construction Industry With The Highest EPS Estimates,2013-10-31 05:37:00-04:00,PHM,positive
1009099.0,"Market Wrap for October 24: Microsoft, Amazon Earnings Cheer Investors as Stocks Rally",2013-10-24 17:20:00-04:00,PHM,positive
1009100.0,Shares of Pulte Moving Lower Despite Q3 Beat,2013-10-24 07:20:00-04:00,PHM,neutral
1009101.0,"Earnings Scheduled For October 24, 2013",2013-10-24 04:42:00-04:00,PHM,neutral
1009102.0,"UPDATE: Susquehanna Raises PT on PulteGroup on Fundamental Trends, Seasonal Tailwinds",2013-10-11 11:17:00-04:00,PHM,neutral
1009103.0,"Swings in Home Builder Short Interest (KBH, RYL, TMHC)",2013-09-28 11:56:00-04:00,PHM,positive
1009104.0,Top 4 Mid-Cap Stocks In The Residential Construction Industry With The Highest Cash,2013-09-26 05:13:00-04:00,PHM,positive
1009105.0,"Benzinga Market Primer: Monday, September 9: Futures Up As Japan Starts The Week Off With A Bang      ",2013-09-09 06:29:00-04:00,PHM,neutral
1009106.0,"Short Sellers Increase Stakes in Toll Bros., M/I Homes (MHO, TMHC, TOL)",2013-08-28 13:42:00-04:00,PHM,positive
1009107.0,"The Top 10 Financial Tweets For Monday, August 26",2013-08-26 13:50:00-04:00,PHM,positive
1009108.0,Benzinga's Top Upgrades,2013-08-19 08:20:00-04:00,PHM,positive
1009109.0,"Wells Fargo Upgrades PulteGroup, Inc. to Outperform",2013-08-19 08:15:00-04:00,PHM,positive
1009110.0,"RBC Capital Downgrades PulteGroup, Inc. to Outperform, Lowers PT to $20.00",2013-08-15 08:37:00-04:00,PHM,negative
1009111.0,"Meritage Homes, NVR See Big Short Interest Swings (KBH, MTH, NVR)",2013-08-10 13:25:00-04:00,PHM,positive
1009112.0,Traders in PulteGroup Considering 20K Buy from Director Thomas Folliard on Aug. 2nd,2013-08-02 14:55:00-04:00,PHM,neutral
1009113.0,"Compass Point Maintains Neutral on PulteGroup, Inc., Lowers PT to $17.50",2013-07-31 10:08:00-04:00,PHM,negative
1009114.0,UPDATE: Williams Financial Group Upgrades PulteGroup on Favorable Long-Term Outlook,2013-07-30 09:16:00-04:00,PHM,positive
1009115.0,"UBS Upgrades PulteGroup, Inc. to Buy",2013-07-30 09:14:00-04:00,PHM,neutral
1009116.0,"Raymond James Downgrades PulteGroup, Inc. to Market Perform, Removes $26.00 PT",2013-07-30 08:45:00-04:00,PHM,neutral
1009117.0,Benzinga's Top Upgrades,2013-07-30 07:56:00-04:00,PHM,positive
1009118.0,"Williams Financial Upgrades PulteGroup, Inc. to Buy",2013-07-30 07:49:00-04:00,PHM,neutral
1009119.0,ISI Downgraded PulteGroup from Buy to Neutral,2013-07-26 09:24:00-04:00,PHM,neutral
1009120.0,"Barclays Downgrades PulteGroup to Equalweight, Lowers PT to $18.00",2013-07-26 07:51:00-04:00,PHM,negative
1009121.0,Benzinga's Top Upgrades,2013-07-26 07:39:00-04:00,PHM,positive
1009122.0,"Credit Suisse Upgrades PulteGroup, Inc. to Outperform, Lowers PT to $21.00",2013-07-26 07:18:00-04:00,PHM,positive
1009123.0,"Market Wrap for Thursday, July 25: Facebook Leads Nasdaq Higher; SAC Capital Indicted ",2013-07-25 16:21:00-04:00,PHM,neutral
1009124.0,Mid-Afternoon Market Update: Sequenom Plummets as ONEOK Rises on News That it Will Spin Off Natural Gas Unit,2013-07-25 15:37:00-04:00,PHM,positive
1009125.0,"Taylor Morrison, TRI Pointe See Big Short Interest Swings (TMHC, TOL, TPH)",2013-07-25 13:26:00-04:00,PHM,positive
1009126.0,"Mid-Day Market Update: Facebook Shares Rise On Strong Results, Crocs Falls",2013-07-25 12:28:00-04:00,PHM,positive
1009127.0,"Mid-Morning Market Update: Markets Mostly Lower, GM Posts Upbeat Profit",2013-07-25 11:29:00-04:00,PHM,positive
1009128.0,Benzinga's Top Pre-Market Losers,2013-07-25 08:26:00-04:00,PHM,negative
1009129.0,PulteGroup Announces Quarterly Cash Dividend Of $0.05 Per Share And Increased Share Repurchase Authorization To $352 Million,2013-07-24 17:02:00-04:00,PHM,positive
1009130.0,"Compass Point Downgrades PulteGroup, Inc. to Neutral, Lowers PT to $19.50",2013-07-24 09:04:00-04:00,PHM,negative
1009131.0,"Stocks to Watch for the Week of July 22, 2013",2013-07-22 14:41:00-04:00,PHM,neutral
1009132.0,"Short Sellers Pile on to Taylor Morrison Home (SPF, TMHC, TOL)",2013-07-14 11:30:00-04:00,PHM,neutral
1009133.0,"Short Interest Continues to Rise in NVR and Taylor Morrison (NVR, TMHC, TOL)",2013-06-29 11:56:00-04:00,PHM,positive
1009134.0,SLIDESHOW: Top Stocks For The DOMA Ruling,2013-06-26 12:14:00-04:00,PHM,positive
1009135.0,S&P Upgrades PulteGroup from BB- to BB; Outlook to Stable,2013-06-26 11:12:00-04:00,PHM,positive
1009136.0,UPDATE: Bank of America Initiates PulteGroup at Neutral on Early Transition Stages,2013-06-26 09:34:00-04:00,PHM,neutral
1009137.0,Benzinga's Top Initiations,2013-06-26 07:54:00-04:00,PHM,positive
1009138.0,"Bank of America Initiates Coverage on PulteGroup, Inc. at Neutral, Announces $23.00 PO",2013-06-26 06:37:00-04:00,PHM,negative
1009139.0,PGT(R) Announces Partnership With PulteGroup ,2013-06-25 10:55:00-04:00,PHM,neutral
1009140.0,"Benzinga Market Primer: Tuesday, June 25: Housing In Focus",2013-06-25 06:23:00-04:00,PHM,neutral
1009141.0,UPDATE: Goldman Sachs Resumes PulteGroup at Sell on Slower Growth Markets,2013-06-24 08:43:00-04:00,PHM,positive
1009142.0,"Goldman Sachs Reinstates Sell on PulteGroup, Inc., Announces $18.00 PT",2013-06-24 06:32:00-04:00,PHM,neutral
1009143.0,"Market Wrap for Thursday, June 20: Sell-Off Intensifies as Prices Plunge Across Asset Classes ",2013-06-20 16:28:00-04:00,PHM,positive
1009144.0,"Stocks to Watch for the Week of June 17, 2013",2013-06-17 11:00:00-04:00,PHM,neutral
1009145.0,"Short Interest Swings in Home Builder Stocks (KBH, NVR, TMHC)",2013-06-14 10:03:00-04:00,PHM,positive
1009146.0,"Form 8-K from PulteGroup Shows $27-32M Lease Termination/Other Exit Costs, ~$10-15M in Relocation Costs, $500K-1M in Asset Impairments, $17-22M in Employee Severance, Relocation Costs",2013-06-05 16:31:00-04:00,PHM,positive
1009147.0,"Deutsche Bank Maintains Hold on PulteGroup, Inc., Raises PT to $19.00",2013-06-03 09:48:00-04:00,PHM,neutral
1009148.0,Michigan-Based Homebuilder Pulte Group Moving to Atlanta,2013-05-31 13:33:00-04:00,PHM,neutral
1009149.0,"PulteGroup Announces Plan to Relocate Corporate Offices to Atlanta, Georgia in 2014",2013-05-31 07:55:00-04:00,PHM,neutral
1009150.0,Hovnanian Enterprises: Small Cap Analysis,2013-05-23 10:51:00-04:00,PHM,neutral
1009151.0,KeyBanc Downgrades PulteGroup to Hold,2013-05-22 08:13:00-04:00,PHM,neutral
1009152.0,Believe It: A Bear Call on Homebuilder ETFs,2013-04-30 16:22:00-04:00,PHM,neutral
1009153.0,UPDATE: J.P. Morgan Downgrades PulteGroup to Neutral on Valuation,2013-04-30 10:21:00-04:00,PHM,neutral
1009154.0,Benzinga's Top Downgrades,2013-04-30 07:18:00-04:00,PHM,positive
1009155.0,"Benzinga Market Primer: Tuesday, April 30",2013-04-30 06:38:00-04:00,PHM,neutral
1009156.0,"JP Morgan Downgrades PulteGroup, Inc. to Neutral, Raises PT to $24.00",2013-04-30 06:27:00-04:00,PHM,positive
1009157.0,Top Stock Picks for Next Week,2013-04-29 10:16:00-04:00,PHM,positive
1009158.0,Short Interest in Home Builder Stocks ,2013-04-26 13:26:00-04:00,PHM,positive
1009159.0,"RBC Capital Upgrades PulteGroup, Inc. to Top Pick, Raises PT to $32.00",2013-04-26 07:23:00-04:00,PHM,positive
1009160.0,"PulteGroup, Inc. Reports Q1 EPS of $0.21 vs $0.15 Est; Revenue of $1.16B vs $1.19B Est",2013-04-25 06:33:00-04:00,PHM,neutral
1009161.0,PulteGroup to Redeem All Outstanding 2014 Notes Totaling $399M in Aggregate Principal Amount,2013-04-24 16:14:00-04:00,PHM,positive
1009162.0,"Barclays Upgrades PulteGroup, Inc. to Overweight, Raises PT to $23.00",2013-04-23 06:49:00-04:00,PHM,negative
1009163.0,Top 4 Mid-Cap Stocks In The Residential Construction Industry With The Highest EPS,2013-04-19 05:53:00-04:00,PHM,positive
1009164.0,"Short Interest Swings Home Builder Stocks (NVR, SPF, TPH)",2013-04-11 12:46:00-04:00,PHM,positive
1009165.0,"FBN Securities Upgrades PulteGroup, Inc. to Sector Perform",2013-04-03 16:52:00-04:00,PHM,positive
1009166.0,"Short Interest in Home Builder Stocks Rises (MTH, SPF, TPH)",2013-03-29 14:30:00-04:00,PHM,positive
1009167.0,Tuesday March 26th Watchlist,2013-03-26 08:18:00-04:00,PHM,neutral
1009168.0,"Short Interest in Home Builder Stocks Returns (HOV, MDC, TPH)",2013-03-14 12:53:00-04:00,PHM,positive
1009169.0,Benzinga's Top Initiations,2013-03-14 09:06:00-04:00,PHM,positive
1009170.0,UPDATE: Sterne Agee Initiates PulteGroup at Buy; Long-Term Value at Current Levels,2013-03-14 08:16:00-04:00,PHM,positive
1009171.0,"Sterne Agee Initiates Coverage on PulteGroup, Inc. at Buy, Announces $24.00 PT",2013-03-13 16:09:00-04:00,PHM,neutral
1009172.0,Benzinga's Top Pre-Market Losers,2013-03-13 08:50:00-04:00,PHM,negative
1009173.0,"Short Interest in Homebuilder Stocks Shrinks (DHI, MDC, PHM)",2013-03-02 09:56:00-05:00,PHM,positive
1009174.0,Cracking Foundations For Homebuilders ETFs?,2013-02-20 14:15:00-05:00,PHM,neutral
1009175.0,"Short Interest in Homebuilder Stocks Falls (HOV, MTH, PHM)",2013-02-12 16:42:00-05:00,PHM,positive
1009176.0,"Barclays Downgraded KB Home, Pulte and Realogy from Overweight to Equalweight and Toll from Equalweight to Underweight",2013-02-05 11:03:00-05:00,PHM,negative
1009177.0,"Deutsche Bank Maintains Hold on PulteGroup, Inc., Raises PT to $17.00",2013-02-05 08:33:00-05:00,PHM,neutral
1009178.0,2013 Housing Outlook: What If The Consensus Is Wrong,2013-02-04 14:22:00-05:00,PHM,negative
1009179.0,UPDATE: Williams Financial Group Downgrades PulteGroup to Hold Post In-Line Ratings,2013-02-01 08:51:00-05:00,PHM,neutral
1009180.0,"Williams Capital Markets Downgrades PulteGroup, Inc. to Hold, Raises PT to $23.00",2013-02-01 07:57:00-05:00,PHM,neutral
1009181.0,"Mid-Morning Market Update: Facebook Hurting Post-Earnings, JDS Uniphase Boosts",2013-01-31 10:29:00-05:00,PHM,negative
1009182.0,"PulteGroUp, Inc. Reports Q4 EPS of $0.15 vs $0.30 Est; Revenue of $1.57B vs $1.50B Est",2013-01-31 06:43:00-05:00,PHM,neutral
1009183.0,"Earnings Scheduled For January 31, 2013",2013-01-31 02:16:00-05:00,PHM,neutral
1009184.0,S&P Bearish on Home Builders ETF,2013-01-30 16:55:00-05:00,PHM,neutral
1009185.0,"Home Builders D.R. Horton, Ryland Show No Quit",2013-01-30 08:42:00-05:00,PHM,negative
1009186.0,"Credit Suisse Maintains Neutral on PulteGroup, Inc., Raises PT to $23.50",2013-01-30 07:23:00-05:00,PHM,positive
1009187.0,Home Builders: No; Mortgage Service Providers: Yes,2013-01-18 13:25:00-05:00,PHM,positive
1009188.0,These Housing Stocks are Staging a Big Rally This Year,2013-01-18 10:25:00-05:00,PHM,neutral
1009189.0,"Topeka Capital Suspends Buy Rating on PulteGroup, Inc., Removes $22.00 PT",2013-01-15 07:43:00-05:00,PHM,neutral
1009190.0,Lennar Earnings Preview: Another Strong Quarter Expected,2013-01-14 12:11:00-05:00,PHM,positive
1009191.0,Stocks Hitting 52-Week Highs,2012-12-18 10:20:00-05:00,PHM,neutral
1009192.0,UPDATE: Topeka Capital Markets Initiates PulteGroup at Buy; Move-Up Buyer Focus To Yield Growth  ,2012-12-07 07:50:00-05:00,PHM,positive
1009193.0,"Topeka Capital Initiates Coverage on PulteGroup, Inc. at Buy, Announces $22.00 PT",2012-12-07 07:13:00-05:00,PHM,neutral
1009194.0,UPDATE: Compass Point Raises PT to $21 on Pulte Homes on Strong Earnings Fundamentals  ,2012-11-29 10:41:00-05:00,PHM,positive
1009195.0,"Compass Point Reiterates Buy on PulteGroup, Inc., Raises PT to $21.00",2012-11-29 09:20:00-05:00,PHM,neutral
1009196.0,Could A Housing Stock Correction Be Overdue?,2012-11-20 13:25:00-05:00,PHM,neutral
1009197.0,Benzinga's Top Pre-Market Losers,2012-11-16 08:22:00-05:00,PHM,negative
1009198.0,Top 4 Mid-Cap Stocks In The Residential Construction Industry With The Highest Cash,2012-11-12 02:25:00-05:00,PHM,positive
1009199.0,"After Surging, Homebuilder ETFs Look Pricey ",2012-11-02 12:57:00-04:00,PHM,neutral
1009200.0,RBC Capital Upgraded Pulte Group from Sector Perform to Outperform,2012-10-26 10:06:00-04:00,PHM,neutral
1009201.0,Benzinga's Top Upgrades,2012-10-26 07:26:00-04:00,PHM,positive
1009202.0,FROM EARLIER: Pulte Group Reports Q3 EPS $0.30 vs $0.20 Est,2012-10-25 13:25:00-04:00,PHM,neutral
1009203.0,PulteGroup Announces Cash Tender Offers For Up To $1B Aggregate Principal Amount Of Certain Outstanding Notes,2012-10-24 17:06:00-04:00,PHM,positive
1009204.0,Missed the Home Builder Run? Consider These Ancillary Plays,2012-10-19 08:23:00-04:00,PHM,negative
1009205.0,Benzinga Mid-Morning Market Update,2012-10-17 10:36:00-04:00,PHM,neutral
1009206.0,Should Traders Chase the Builders At These Levels?,2012-09-21 10:08:00-04:00,PHM,neutral
1009207.0,UPDATE: Compass Point Upgrades PulteGroup to Buy on Mortgage Buyback Exposure  ,2012-09-20 12:56:00-04:00,PHM,neutral
1009208.0,"UBS Maintains Pulte Group at Neutral, Raises PT from $11 to $17",2012-09-20 11:02:00-04:00,PHM,neutral
1009209.0,Compass Point Upgrades Pulte Group from Market Perform to Buy,2012-09-20 07:47:00-04:00,PHM,neutral
1009210.0,"Stocks Watchlist For Thursday, September 13",2012-09-13 09:35:00-04:00,PHM,neutral
1009211.0,"Pulte Upgrade Lifts Homebuilders (PHM, KBH, LEN)",2012-09-13 07:30:00-04:00,PHM,neutral
1009212.0,"UPDATE: Williams Financial Group Upgrades PulteGroup to Buy, Raises PT",2012-09-12 09:57:00-04:00,PHM,neutral
1009213.0,"Williams Capital Upgrades Pulte Group from Hold to Buy, Raises PT from $13 to $17",2012-09-12 08:16:00-04:00,PHM,neutral
1009214.0,"Watchlist for Thursday, September 6",2012-09-06 09:21:00-04:00,PHM,neutral
1009215.0,"PHM Holder Pulte Obligated to Deliver 7M Shares, Will Deliver 6M Shares on August 19, 2011 Contract",2012-08-31 16:38:00-04:00,PHM,positive
1009216.0,Stock Picks for Friday August 17,2012-08-17 10:00:00-04:00,PHM,neutral
1009217.0,Homebuilder and Constructing Stocks Trading Up in Market : Builder Confidence Grows Reports NAHB ,2012-08-16 12:38:00-04:00,PHM,positive
1009218.0,Stock Picks for Wednesday August 15,2012-08-15 10:23:00-04:00,PHM,neutral
1009219.0,"Home Depot Beats Earnings Estimates, Raises Guidance",2012-08-14 12:02:00-04:00,PHM,neutral
1009220.0,Homebuilders Are Either Dead or Dead Money,2012-08-13 11:49:00-04:00,PHM,negative
1009221.0,"Friday's Stocks to Watch, Aug 10",2012-08-10 10:24:00-04:00,PHM,neutral
1009222.0,UPDATE: JP Morgan Upgrades PulteGroup to Overweight on Attractive Valuation  ,2012-08-09 07:22:00-04:00,PHM,positive
1009223.0,"JP Morgan Upgrades Pulte Group from Neutral to Overweight, Raises PT from $11.50 to $15",2012-08-09 05:44:00-04:00,PHM,neutral
1009224.0,"UBS Maintains Pulte Group at Neutral, Raises PT from $9 to $11",2012-08-02 12:15:00-04:00,PHM,neutral
1009225.0,"UPDATE: Citigroup Downgrades PulteGroup to Neutral, Raises PT",2012-07-30 11:25:00-04:00,PHM,neutral
1009226.0,"UPDATE: Williams Financial Reiterates Hold Rating, Raises PT on PulteGroup",2012-07-30 09:45:00-04:00,PHM,neutral
1009227.0,"Williams Capital Markets Maintains Pulte Group at Hold, Raises PT from $11 to $13",2012-07-30 07:45:00-04:00,PHM,neutral
1009228.0,Benzinga's Top Downgrades,2012-07-30 07:19:00-04:00,PHM,positive
1009229.0,"Citigroup Downgrades Pulte Group from Buy to Neutral, Raises PT from $10.50 to $13",2012-07-30 06:33:00-04:00,PHM,neutral
1009230.0,"UPDATE: ISI Group Reiterates Buy Rating, Raises PT on PulteGroup",2012-07-27 12:19:00-04:00,PHM,neutral
1009231.0,"ISI Group Maintains Pulte Group at Buy, Raises PT to $14",2012-07-27 08:11:00-04:00,PHM,neutral
1009232.0,PulteGroup Climbs on Strong EPS,2012-07-26 14:49:00-04:00,PHM,positive
1009233.0,PulteGroup Says Will Spend $900M on Land Development in 2012,2012-07-26 08:57:00-04:00,PHM,neutral
1009234.0,Pulte Group Reports Q2 EPS $0.13 vs $0.05 Est; Revenues $1.07B vs $1.11B Est,2012-07-26 06:33:00-04:00,PHM,neutral
1009235.0,Benzinga's Top Downgrades,2012-07-24 07:16:00-04:00,PHM,positive
1009236.0,"UPDATE: Goldman Sachs Reiterates Buy Rating, Raises PT on PulteGroup",2012-07-23 09:44:00-04:00,PHM,neutral
1009237.0,Housing Starts Rise to Highest Level Since Lehman Collapse,2012-07-18 09:06:00-04:00,PHM,negative
1009238.0,MKM Partners Downgrades Pulte Group from Buy to Neutral,2012-07-16 10:40:00-04:00,PHM,neutral
1009239.0,Buffett Is In A Holding Pattern On the Economy,2012-07-12 15:20:00-04:00,PHM,neutral
1009240.0,Five Homebuilders on the Rise,2012-07-03 10:19:00-04:00,PHM,neutral
1009241.0,S&P: Some ETF Investors Should Look at First-Half Laggards,2012-07-03 07:42:00-04:00,PHM,neutral
1009242.0,Lennar's Q2: Further Evidence That Housing Has Bottomed?,2012-06-27 11:41:00-04:00,PHM,neutral
1009243.0,Lucky Number 7: Case-Shiller Index Rises After Seven Months of Declines,2012-06-26 11:02:00-04:00,PHM,positive
1009244.0,Top Narrow Based Indexes For June 26,2012-06-26 10:17:00-04:00,PHM,positive
1009245.0,"New Home Sales Rise More than Expected, Hit 2-Year High",2012-06-25 13:23:00-04:00,PHM,neutral
1009246.0,Existing Home Sales Rise Less than Expected,2012-06-21 12:39:00-04:00,PHM,neutral
1009247.0,Bullish setups to watch next week,2012-06-15 17:59:00-04:00,PHM,neutral
1009249.0,"Citigroup Upgrades PulteGroup from Neutral to Buy, Raises PT from $9 to $10.50",2012-06-08 06:21:00-04:00,PHM,neutral
1009250.0,"Financial Breakfast: Morning News Summary for June 7, 2012",2012-06-07 07:29:00-04:00,PHM,neutral
1009251.0,Benzinga's Top Upgrades,2012-06-07 07:12:00-04:00,PHM,positive
1009252.0,FBR Capital Markets Upgrades PulteGroup from Market Perform to Outperform,2012-06-07 06:58:00-04:00,PHM,neutral
1009253.0,"Benzinga's Morning Upgrade Summary for June 6, 2012",2012-06-06 12:55:00-04:00,PHM,neutral
1009254.0,Benzinga's Top Pre-Market Gainers,2012-06-06 08:19:00-04:00,PHM,positive
1009255.0,UPDATE: Credit Suisse Upgrades PulteGroup to Outperform on Healthy Buyer Traffic  ,2012-06-06 07:22:00-04:00,PHM,positive
1009256.0,Benzinga's Top Upgrades,2012-06-06 07:16:00-04:00,PHM,positive
1009257.0,"Pending Home Sales Decline, Surprises to the Downside",2012-05-30 10:15:00-04:00,PHM,neutral
1009258.0,MBA Mortgage Applications Decrease 1.3% from Last Week,2012-05-30 10:03:00-04:00,PHM,neutral
1009259.0,MBA Mortgage Applications Increase 3.8% from Last Week,2012-05-23 09:55:00-04:00,PHM,positive
1009260.0,Toll Bros. To Report Amid Signs of Housing Rebound - IBD,2012-05-22 14:45:00-04:00,PHM,neutral
