Unnamed: 0,title,date,stock,sentiment
1044537.0,Cramer's 11 Stocks To Buy During Fed-Fear Selloffs,2016-09-13 12:21:00-04:00,PVH,neutral
1044538.0,Benzinga's Top Initiations,2016-09-12 09:02:00-04:00,PVH,positive
1044539.0,Wells Fargo Assumes PVH at Outperform,2016-09-12 07:07:00-04:00,PVH,positive
1044540.0,Citi Stays Sidelined On PVH Despite Q2 Beat And Raise,2016-08-26 09:55:00-04:00,PVH,neutral
1044541.0,7 Biggest Price Target Changes For Friday,2016-08-26 09:36:00-04:00,PVH,neutral
1044542.0,The Market In 5 Minutes: Earnings And EpiPens,2016-08-25 09:07:00-04:00,PVH,neutral
1044543.0,"12 Stocks To Watch For August 25, 2016",2016-08-25 04:14:00-04:00,PVH,neutral
1044544.0,"5 After-Hours Movers: HP, Workday, Guess, Williams-Sonona, PVH",2016-08-24 16:59:00-04:00,PVH,neutral
1044545.0,PVH Sees Q3 Adj. EPS $2.35-$2.40 vs $2.39 Est.,2016-08-24 16:20:00-04:00,PVH,neutral
1044546.0,"PVH Issues FY16 EPS Guidance $6.55-6.65 vs $6.54 Est, Up From $6.45-$6.55 Prior Guidance",2016-08-24 16:17:00-04:00,PVH,neutral
1044547.0,PVH Raises FY Outlook,2016-08-24 16:17:00-04:00,PVH,neutral
1044548.0,"PVH Reports Q2 Non-GAAP EPS $1.47 vs $1.29 Est, Rev $1.93B vs $1.94B Est",2016-08-24 16:15:00-04:00,PVH,neutral
1044549.0,Expect Downside Pressure In Retail Following Express' Big Whiff,2016-08-24 09:30:00-04:00,PVH,negative
1044550.0,"Keep an Eye on These 10 Stocks for August 24, 2016",2016-08-24 05:11:00-04:00,PVH,neutral
1044551.0,"Earnings Scheduled For August 24, 2016",2016-08-24 04:40:00-04:00,PVH,neutral
1044552.0,Brean Maintains Buy On PVH Corp Heading Into Q2 Results,2016-08-23 11:45:00-04:00,PVH,neutral
1044553.0,Speedo And Ralph Lauren Drop Ryan Lochte,2016-08-22 14:30:00-04:00,PVH,negative
1044554.0,"After A Strong Q2 In Retail, Can Investors Find The Matching Trade In Apparel Stocks?",2016-08-18 09:51:00-04:00,PVH,positive
1044555.0,Turning Point Technical Analysis: Try A UA/XLY Pair Trade,2016-08-17 10:32:00-04:00,PVH,neutral
1044556.0,"PVH Corp Has Recouped Most Of Its Brexit Loss, BlueFin Sees It As An Attractive Stock",2016-07-26 08:30:00-04:00,PVH,positive
1044557.0,"Shares of Luxottica Plunge Into Negative Territory, Now Down 2%; Also Watching for Price Action in Tiffany, Michael Kors, PVH, Williams-Sonoma",2016-07-25 12:00:00-04:00,PVH,negative
1044558.0,Watching Luxury Apparel/Retail Stocks Now as Luxottica Just Reported Earnings,2016-07-25 11:56:00-04:00,PVH,neutral
1044559.0,Detwiler Fenton Sees Possible Positve Outlier Catalysts Among The Apparel Markets' Carnage,2016-06-15 09:29:00-04:00,PVH,neutral
1044560.0,PVH Unveils Euro 350 Million Senior Notes Of Private Offering,2016-06-10 09:59:00-04:00,PVH,neutral
1044561.0,"PVH, Coach, Sequential Brands: Piper's Most Compelling Names Heading Into 36th Consumer Conference",2016-06-08 15:51:00-04:00,PVH,positive
1044562.0,"12 Stocks To Watch For May 26, 2016",2016-05-26 04:51:00-04:00,PVH,neutral
1044563.0,PVH Shares Up 8.4% After Q1 Beat,2016-05-25 16:23:00-04:00,PVH,positive
1044564.0,PVH Shares Spike to High of $98.75 Following Earnings Report,2016-05-25 16:18:00-04:00,PVH,positive
1044565.0,"PVH Reports Q1 Sales $1.92B vs. $1.90B, EPS $1.50 vs. $1.43 Est",2016-05-25 16:17:00-04:00,PVH,neutral
1044566.0,"Keep an Eye on These 12 Stocks for May 25, 2016",2016-05-25 05:00:00-04:00,PVH,neutral
1044567.0,"Earnings Scheduled For May 25, 2016",2016-05-25 04:22:00-04:00,PVH,neutral
1044568.0,Brean Likes PVH's Risk/Reward Heading Into Wednesday's Earnings Release,2016-05-23 12:05:00-04:00,PVH,positive
1044569.0,PVH's Q1 Might Be 'Obscured' By FX Issues,2016-05-23 09:14:00-04:00,PVH,neutral
1044570.0,The Market In 5 Minutes: Merger Monday Mania,2016-05-23 08:58:00-04:00,PVH,neutral
1044571.0,"PVH Corp. and Grupo Axo Announce Mexican JV TO License Rights TO Operate/Manage Distribution Of Calvin Klein, Tommy Hilfiger, Warner's, Olga And Speedo Brands",2016-05-19 16:32:00-04:00,PVH,neutral
1044572.0,13F Season: David Einhorn's New Positions,2016-05-17 06:34:00-04:00,PVH,neutral
1044573.0,"13F from Einhorn's Greenlight Shows Initiated Stake In PVH Corp, Lamar Advertising, Hatteras Financial, Globalstar, Community Health",2016-05-16 16:19:00-04:00,PVH,neutral
1044574.0,Goldman: 4 Retail Stocks Being Unfairly Punished For Macy's Earnings,2016-05-12 13:31:00-04:00,PVH,negative
1044575.0,Jim Cramer On VF Corp's Earnings: 'They Really Delivered',2016-05-03 12:41:00-04:00,PVH,neutral
1044576.0,All You Need To Know From David Einhorn's Q1 Letter To Greenlight Investors,2016-05-02 18:29:00-04:00,PVH,neutral
1044577.0,"Deutsche Bank Maintains Buy on PVH, Raises PT to $110.00",2016-03-28 06:58:00-04:00,PVH,neutral
1044578.0,"Brean Capital Maintains Buy on PVH, Raises PT to $111.00",2016-03-28 06:58:00-04:00,PVH,neutral
1044579.0,Mid-Afternoon Market Update: PVH Rises On Upbeat Results; Portola Pharmaceuticals Shares Slide,2016-03-24 14:37:00-04:00,PVH,positive
1044580.0,PVH Corp Sharply Higher After Q4 Beat,2016-03-24 13:48:00-04:00,PVH,neutral
1044581.0,Benzinga's Volume Movers,2016-03-24 10:21:00-04:00,PVH,neutral
1044582.0,"Brean Capital Remains Positive On PVH Corp, Sees Int'l Growth Strength, Says N. America Remains Challenged, Maintains Buy And $102",2016-03-24 07:35:00-04:00,PVH,positive
1044583.0,"JP Morgan Positive On PVH Corp, Says Underloved & Under-owned Stock Means Rally Time, Maintain Neutral And $100 PT",2016-03-24 07:10:00-04:00,PVH,positive
1044584.0,"7 Stocks To Watch For March 24, 2016",2016-03-24 04:18:00-04:00,PVH,neutral
1044585.0,Why These 5 Stocks Are Moving After Hours,2016-03-23 16:55:00-04:00,PVH,neutral
1044586.0,Earnings Recap For March 23,2016-03-23 16:41:00-04:00,PVH,neutral
1044587.0,"UPDATE: PVH Corp Says Heritage Brands Q4 Revs Decreased 10% Y/Y To $447M, Tommy Hilfiger Revs Up 5% Y/Y To $919M, Calvin Klein Revs Up 21% Y/Y To $703M",2016-03-23 16:21:00-04:00,PVH,neutral
1044588.0,PVH Corp Sees Q1 2016 EPS $1.40-$1.45 Vs Est $1.33,2016-03-23 16:19:00-04:00,PVH,neutral
1044589.0,PVH Corp. Sees FY16 Adj. EPS $6.30-$6.50 vs $6.57 Est.,2016-03-23 16:18:00-04:00,PVH,neutral
1044590.0,"PVH Corp. Reports Q4 Adj EPS $1.52 Vs Est $1.46, Sales $2.1B Vs Est $2.07B",2016-03-23 16:17:00-04:00,PVH,neutral
1044591.0,"Keep an Eye on These 10 Stocks for March 23, 2016",2016-03-23 04:48:00-04:00,PVH,neutral
1044592.0,"Earnings Scheduled For March 23, 2016",2016-03-23 04:16:00-04:00,PVH,neutral
1044593.0,"JP Morgan Maintains Neutral on PVH, Raises PT to $100.00",2016-03-21 06:00:00-04:00,PVH,positive
1044594.0,The MAGIC Apparel Trade Show Just Shed Light On These Stocks,2016-02-18 11:06:00-05:00,PVH,neutral
1044595.0,"PVH Corp. and Apax Partners Announce Agreement for PVH to Acquire the Remaining Interests in the Tommy Hilfiger China Joint Venture, Deal For $172M Net Of ~$100M In Cash",2016-02-02 16:15:00-05:00,PVH,positive
1044596.0,"PVH, G-III Apparel Group Report License Agreement For Tommy Hilfiger Womenswear Collection In Canada, U.S.",2016-02-01 16:26:00-05:00,PVH,positive
1044597.0,PVH Corp Sees FY 2015 EPS At Or Above $7.00 vs Est $6.97,2016-02-01 16:21:00-05:00,PVH,neutral
1044598.0,"Bank of America Maintains Underperform on PVH, Lowers PT to $75.00",2015-12-16 09:20:00-05:00,PVH,negative
1044599.0,UPDATE: Citigroup Cuts PVH Q4 2016 EPS Est By 12% To $1.47 On Expectations Of Weak Revenues & Contracting Gross Margins,2015-12-04 16:01:00-05:00,PVH,negative
1044600.0,Citigroup Suspects Mgmt Language May Imply Limitation To Price Increases As Retail Environment Remains Challenging,2015-12-04 15:58:00-05:00,PVH,negative
1044601.0,"Citigroup Maintains Neutral on PVH, Lowers PT to $93.00",2015-12-04 15:55:00-05:00,PVH,negative
1044602.0,Mid-Afternoon Market Update: Dow Tumbles Over 250 Points; Verint Systems Shares Slip On Weak Results,2015-12-03 15:16:00-05:00,PVH,negative
1044603.0,PVH Corp Tanks After Q3 Report,2015-12-03 13:24:00-05:00,PVH,neutral
1044604.0,Mid-Day Market Update: Avago Jumps On Earnings Beat; PVH Shares Dip,2015-12-03 12:22:00-05:00,PVH,positive
1044605.0,Morning Market Losers,2015-12-03 09:59:00-05:00,PVH,negative
1044606.0,"10 Stocks To Watch For December 3, 2015",2015-12-03 04:08:00-05:00,PVH,neutral
1044607.0,"PVH Q3 Profit Beats Views, Shares Rise",2015-12-03 01:51:00-05:00,PVH,positive
1044608.0,PVH Sees Q4 Adj. EPS $1.37-$1.47 vs $1.60 Est.,2015-12-02 16:18:00-05:00,PVH,neutral
1044609.0,PVH Reaffirms FY Adj. EPS $6.90-$7 vs $6.96 Est.,2015-12-02 16:16:00-05:00,PVH,neutral
1044610.0,"PVH Reports Q3 Adj. EPS $2.66 vs $2.47 Est., Sales $2.165B vs $2.16B Est.",2015-12-02 16:16:00-05:00,PVH,neutral
1044611.0,7 Stocks You Should Be Watching Today,2015-12-02 04:21:00-05:00,PVH,neutral
1044612.0,"Earnings Scheduled For December 2, 2015",2015-12-02 04:05:00-05:00,PVH,neutral
1044613.0,These Brands Just Went All-Out On Black Friday Promotions,2015-11-27 13:07:00-05:00,PVH,neutral
1044614.0,"Risk/Reward On PVH 'Remains Compelling,' According To Brean",2015-11-24 13:11:00-05:00,PVH,neutral
1044615.0,"Brean Capital Maintains Buy on PVH, Lowers PT to $111.00, Says Risk/Reward Continues To Be Appealing",2015-11-24 05:29:00-05:00,PVH,negative
1044616.0,"Brean: Eight Branded Apparel, Footwear Stocks Worth Buying",2015-10-16 14:07:00-04:00,PVH,positive
1044617.0,"Brean Capital Initiates Coverage on PVH at Buy, Announces $125.00 PT",2015-10-15 16:12:00-04:00,PVH,neutral
1044618.0,"PVH Corp.'s Tommy Hilfiger Reports License Agreement with G-III Apparel Group, Ltd. for Women's Dress Collection",2015-10-02 09:00:00-04:00,PVH,positive
1044619.0,Lululemon's Results Might Wear On These 5 Apparel Stocks,2015-09-11 15:31:00-04:00,PVH,neutral
1044620.0,"Calvin Klein, Inc. to Reacquire Calvin Klein Platinum Label Accessories License from CK21",2015-09-03 09:00:00-04:00,PVH,neutral
1044621.0,US Stock Futures Jump Ahead Of Economic Data,2015-08-27 08:00:00-04:00,PVH,neutral
1044622.0,"Keep an Eye on These 10 Stocks for August 27, 2015",2015-08-27 05:13:00-04:00,PVH,neutral
1044623.0,"PVH Posts Upbeat Q2 Earnings, Lifts Full-Year Forecast",2015-08-26 16:57:00-04:00,PVH,neutral
1044624.0,"PVH Sees Q3 Adj. EPS $2.45-$2.50 vs $2.46 Est., Sales Up ~3% on Constant Currency Basis",2015-08-26 16:08:00-04:00,PVH,neutral
1044625.0,"UPDATE: PVH Corp Sees FY 2015 EPS $6.90-$7.00 vs Est $6.92, Had Seen $6.85-$6.95",2015-08-26 16:02:00-04:00,PVH,neutral
1044626.0,PVH Corp Reports Q2 EPS $1.37 Vs Est $1.29,2015-08-26 16:01:00-04:00,PVH,neutral
1044627.0,PVH Raises FY EPS Guidance,2015-08-26 16:01:00-04:00,PVH,neutral
1044628.0,7 Stocks You Should Be Watching Today,2015-08-26 04:23:00-04:00,PVH,neutral
1044629.0,"Earnings Scheduled For August 26, 2015",2015-08-26 04:12:00-04:00,PVH,neutral
1044630.0,The Most Sustainable Apparel & Footwear Companies Might Surprise You,2015-08-20 15:42:00-04:00,PVH,positive
1044631.0,7 Stocks You Should Be Watching Today,2015-06-02 05:04:00-04:00,PVH,neutral
1044632.0,"PVH Corp, Atlantic Power, Carlyle Group Lead Monday's After-Hours Movers",2015-06-01 17:54:00-04:00,PVH,neutral
1044633.0,"PVH Posts Upbeat Q1 Earnings, Lifts Forecast",2015-06-01 16:46:00-04:00,PVH,neutral
1044634.0,PVH Corp. Announces $500M 3-Year Buyback,2015-06-01 16:01:00-04:00,PVH,neutral
1044635.0,PVH Corp. Raises FY15 EPS Guidance From $6.75-$6.90 To $6.85-$6.95,2015-06-01 16:00:00-04:00,PVH,neutral
1044636.0,"PVH Corp Reports Q1 EPS $1.50 Vs Exp $1.38, Sales $1.88B Vs Exp $1.86B",2015-06-01 16:00:00-04:00,PVH,neutral
1044637.0,PVH Corp: FX Headwinds And Volatility Could Lead To Weak Results,2015-06-01 11:34:00-04:00,PVH,negative
1044638.0,"Earnings Scheduled For June 1, 2015",2015-06-01 04:45:00-04:00,PVH,neutral
1044639.0,"Must Watch Stocks for June 1, 2015",2015-06-01 04:02:00-04:00,PVH,neutral
1044641.0,PVH Corp. Announces License Agreement with Accutime Watch Corp. for Van Heusen Men's and Boys' Watches in the U.S. & Canada,2015-05-27 09:02:00-04:00,PVH,positive
1044642.0,Billionaire-Tracking ETF Just Bulked Up On Health Care,2015-05-24 16:07:00-04:00,PVH,positive
1044643.0,A Trans-Pacific Partnership Would Affect Retailers,2015-05-05 11:19:00-04:00,PVH,neutral
1044644.0,"Morgan Stanley Reiterates Equal-Weight, Lowers PT On PVH On Reset EPS Expectations",2015-03-30 07:51:00-04:00,PVH,negative
1044645.0,Wunderlich Securities Sees FX Nightmare Become Reality For PVH,2015-03-26 08:21:00-04:00,PVH,positive
1044646.0,"10 Stocks To Watch For March 26, 2015",2015-03-26 05:07:00-04:00,PVH,neutral
1044647.0,"PVH Q4 Profit Tops Estimates, Issues Weak Forecast",2015-03-25 16:45:00-04:00,PVH,positive
1044648.0,"PVH Reports Q4 EPS $1.76 vs. Est. $1.73, Rev. $1.97B vs. Est. $2.1B",2015-03-25 16:03:00-04:00,PVH,neutral
1044649.0,UPDATE: PVH Sees Q1 Adj EPS $1.35-$1.40,2015-03-25 16:02:00-04:00,PVH,neutral
1044650.0,"Keep an Eye on These 7 Stocks for March 25, 2015",2015-03-25 05:46:00-04:00,PVH,neutral
1044651.0,"Earning, Economic & IPO Calendar for Wednesday March 25, 2015",2015-03-25 04:59:00-04:00,PVH,neutral
1044652.0,"Earnings Scheduled For March 25, 2015",2015-03-25 04:31:00-04:00,PVH,neutral
1044653.0,G-III Apparel Group and Genesco Enter into Footwear License for G.H. Bass,2015-03-23 16:01:00-04:00,PVH,neutral
1044654.0,"Wunderlich Securities Reiterates Buy, Lowers PT On PVH On 4Q Preview",2015-03-23 08:12:00-04:00,PVH,negative
1044655.0,15 Upcoming Earnings Reports To Keep An Eye On,2015-03-22 16:57:00-04:00,PVH,neutral
1044656.0,Goldman Sachs Downgrades PVH to Neutral,2015-03-03 06:34:00-05:00,PVH,neutral
1044657.0,"7 Stocks To Watch For January 8, 2015",2015-01-08 04:17:00-05:00,PVH,neutral
1044658.0,PVH Corp. Announces Closing Of Izod Retail Division,2015-01-07 16:00:00-05:00,PVH,neutral
1044659.0,"PVH, Gazal Announce Expansion Of Australian Joint Venture",2014-12-19 08:12:00-05:00,PVH,neutral
1044660.0,PVH Corp. Announces to Its Board of Directors Appointment of Penny McIntyre,2014-12-12 15:45:00-05:00,PVH,neutral
1044661.0,Credit Suisse Sees Earnings Power Turn The Corner For PVH,2014-12-05 09:10:00-05:00,PVH,positive
1044662.0,"#PreMarket Primer: Thursday, December 4: Beige Book Paints Positive Picture Of U.S. Economy",2014-12-04 08:34:00-05:00,PVH,positive
1044663.0,Benzinga's Top #PreMarket Losers,2014-12-04 08:25:00-05:00,PVH,negative
1044664.0,PVH Beats Q3 EPS Expectations,2014-12-03 17:39:00-05:00,PVH,neutral
1044665.0,Markets Inch Higher Following Encouraging Beige Book Commentary,2014-12-03 17:11:00-05:00,PVH,positive
1044666.0,PVH Corp Reports Comparable Store Sales,2014-12-03 16:28:00-05:00,PVH,neutral
1044667.0,PVH Corp. Sees Q4 EPS $1.71-1.76 vs $1.90 Est; Sees Sales $2.10B vs $2.20B Est,2014-12-03 16:25:00-05:00,PVH,neutral
1044668.0,PVH Corp. Lowers FY2014 EPS Guidance from $7.30-7.40 to $7.25-7.30 vs $7.37 Est; Sees Sales $8.30B vs $8.38B Est,2014-12-03 16:04:00-05:00,PVH,negative
1044669.0,PVH Corp. Reports Q3 EPS of $2.56 vs $2.48 Est; Revenue of $2.23B vs $2.27B Est,2014-12-03 16:02:00-05:00,PVH,neutral
1044670.0,PVH Earnings Expected Move  $7.64,2014-12-03 15:27:00-05:00,PVH,neutral
1044671.0,"Notable Earnings After The Close: AVGO, ARO, PVH, SNPS",2014-12-03 15:22:00-05:00,PVH,neutral
1044672.0,"#PreMarket Primer: Wednesday, December 3: Investors Weigh The Possibility Of More Easing In The Eurozone",2014-12-03 08:15:00-05:00,PVH,positive
1044673.0,"Earning, Economic and IPO Calendar for Wednesday December 3, 2014",2014-12-03 06:25:00-05:00,PVH,neutral
1044674.0,"Earnings Scheduled For December 3, 2014",2014-12-03 05:18:00-05:00,PVH,neutral
1044675.0,10 Stocks You Should Be Watching Today,2014-12-03 04:17:00-05:00,PVH,neutral
1044676.0,Deutsche Bank Remains 'Constructive' Ahead of PVH's Q3 Earnings,2014-12-02 13:58:00-05:00,PVH,neutral
1044677.0,5 Stocks To Keep An Eye On This Week,2014-12-02 12:23:00-05:00,PVH,neutral
1044678.0,"How Thanksgiving Sales 'Started Off With A Bang, But Ended With A Whimper'",2014-12-01 17:28:00-05:00,PVH,neutral
1044679.0,"Morgan Stanley Maintains Equal-weight on PVH Corp., Raises PT to $136.00",2014-12-01 14:36:00-05:00,PVH,neutral
1044680.0,Wunderlich Sees Lackluster Q3 For Specialty Apparel Retailers,2014-12-01 10:57:00-05:00,PVH,neutral
1044681.0,Wunderlich Initiates Coverage On Several Apparel Retailers,2014-09-12 11:36:00-04:00,PVH,neutral
1044682.0,UPDATE: Wunderlich Securities Initiates Coverage On PVH Corp As Tommy & Calvin Rule The World,2014-09-12 07:54:00-04:00,PVH,positive
1044683.0,"Wunderlich Initiates Coverage on PVH Corp. at Buy, Announces $150.00 PT",2014-09-12 06:11:00-04:00,PVH,neutral
1044684.0,"Credit Suisse Removes Phillips-Van Heusen From ""U.S. Focus List""",2014-09-10 07:54:00-04:00,PVH,positive
1044685.0,UPDATE: Bank Of America Downgrades PVH Corp,2014-09-05 11:50:00-04:00,PVH,neutral
1044686.0,"Bank of America Downgrades PVH Corp. to Underperform, Maintains $125.00 PT",2014-09-05 08:54:00-04:00,PVH,neutral
1044687.0,"S&P 500 Once Again Unable To Hold 2,000",2014-09-04 16:54:00-04:00,PVH,neutral
1044688.0,"Midday Gainers From Thursday, September 4",2014-09-04 12:54:00-04:00,PVH,neutral
1044689.0,PVH Corp Jumps On Upbeat Earnings; Ciena Corporation Shares Slip,2014-09-04 12:50:00-04:00,PVH,positive
1044690.0,Markets Open Higher; VeriFone Profit Tops Street View,2014-09-04 11:31:00-04:00,PVH,positive
1044691.0,Benzinga's Volume Movers,2014-09-04 10:16:00-04:00,PVH,neutral
1044692.0,Morning Market Movers ,2014-09-04 09:37:00-04:00,PVH,neutral
1044693.0,Morgan Stanley Maintains On PVH Corp,2014-09-04 08:48:00-04:00,PVH,neutral
1044694.0,Benzinga's Top #PreMarket Gainers,2014-09-04 08:05:00-04:00,PVH,positive
1044695.0,"#PreMarket Primer: Thursday, September 4: Talk Of A Ceasefire In Ukraine",2014-09-04 07:46:00-04:00,PVH,neutral
1044696.0,"Stocks To Watch For September 4, 2014",2014-09-04 04:21:00-04:00,PVH,neutral
1044697.0,PVH Corp Beats Q2 Profit Views; Stock Up 7%,2014-09-03 23:21:00-04:00,PVH,positive
1044698.0,"Shares Of PVH Corp Up Over 2.5% On Earnings Beat, Reaffirming Outlook",2014-09-03 16:05:00-04:00,PVH,positive
1044699.0,PVH Corp. Lowers FY2014 Sales Guidance from $8.50B to $8.40B vs $8.47B Est,2014-09-03 16:04:00-04:00,PVH,negative
1044700.0,PVH Corp. Sees Q3 EPS $2.45-2.50 vs $2.49 Est; Sees Sales $2.25B vs $2.33B Est,2014-09-03 16:04:00-04:00,PVH,neutral
1044701.0,PVH Corp. Reports Q2 Sales $1.98B vs $1.99B Est.,2014-09-03 16:02:00-04:00,PVH,neutral
1044702.0,PVH Corp. Reports Q2 EPS of $1.51 vs $1.42 Est; Reaffirms EPS Outlook,2014-09-03 16:02:00-04:00,PVH,neutral
1044703.0,"#PreMarket Primer: Wednesday, September 3: ISIS Releases Another Beheading Video",2014-09-03 07:11:00-04:00,PVH,neutral
1044704.0,"Earning and Economic Calendar for Wednesday September 3, 2014",2014-09-03 05:57:00-04:00,PVH,neutral
1044705.0,"Earnings Scheduled For September 3, 2014",2014-09-03 05:07:00-04:00,PVH,neutral
1044706.0,"Stocks To Watch For September 3, 2014",2014-09-03 04:07:00-04:00,PVH,neutral
1044707.0,Deutsche Bank Previews PVH Corp Second Quarter Earnings,2014-09-02 14:03:00-04:00,PVH,neutral
1044708.0,Benzinga Weekly Preview: Economic Data To Drive Markets,2014-08-31 15:23:00-04:00,PVH,neutral
1044709.0,Stocks Hitting 52-Week Lows,2014-07-17 10:41:00-04:00,PVH,negative
1044710.0,Stocks Hitting 52-Week Lows,2014-07-16 10:27:00-04:00,PVH,negative
1044711.0,"Market Wrap For June 11: Momentum Hit, Dow Suffers Triple Digit Loss",2014-06-11 16:36:00-04:00,PVH,negative
1044712.0,PVH Announces License Pact With Vandale For Warner's and Olga,2014-06-10 13:53:00-04:00,PVH,neutral
1044713.0,S&P 500 Constituent Earnings Update,2014-06-09 16:02:00-04:00,PVH,neutral
1044714.0,Market Wrap For June 6: Markets Higher After In-Line Jobs Report,2014-06-06 16:47:00-04:00,PVH,neutral
1044715.0,Mid-Day Market Update: US Stocks Surge; PVH Shares Slip On Downbeat Results,2014-06-05 14:52:00-04:00,PVH,positive
1044716.0,ISI Group Downgrades PVH Corp. to Buy,2014-06-05 13:18:00-04:00,PVH,neutral
1044717.0,Morning Market Losers ,2014-06-05 09:46:00-04:00,PVH,negative
1044718.0,Morgan Stanley Continues To Have Concerns About PVH,2014-06-05 09:36:00-04:00,PVH,neutral
1044719.0,Benzinga's Top #PreMarket Losers,2014-06-05 08:18:00-04:00,PVH,negative
1044720.0,Why Did PVH Shares Fall After Hours?,2014-06-05 08:11:00-04:00,PVH,positive
1044721.0,"#PreMarket Primer: Thursday, June 5: ECB Meeting To Be The Main Event",2014-06-05 07:09:00-04:00,PVH,neutral
1044722.0,"Stocks To Watch For June 5, 2014",2014-06-05 04:18:00-04:00,PVH,neutral
1044723.0,PVH CEO Chirico: 'Our Asian Business was Good in the First Quarter; The Days of 25% Growth in China are Behind Us' ,2014-06-04 18:19:00-04:00,PVH,positive
1044724.0,PVH CEO Chirico: 'We're Not Counting on a Major Turn in Southern Europe',2014-06-04 18:17:00-04:00,PVH,neutral
1044725.0,PVH CEO Chirico: 'The Trends We Saw in April have Continued into May; The Problem was with the First Two Months of the Year' ,2014-06-04 18:16:00-04:00,PVH,negative
1044726.0,PVH CEO Chirico: 'Right Now We are Seeing More Pressure' ,2014-06-04 18:15:00-04:00,PVH,negative
1044727.0,Jim Cramer Interviews CEO Manny Chirico of PVH on Mad Money,2014-06-04 18:13:00-04:00,PVH,negative
1044728.0,"Market Wrap For June 4: Markets Slightly Higher On Light Volume, Beige Book",2014-06-04 16:38:00-04:00,PVH,neutral
1044729.0,"UPDATE: PVH FY Adj. EPS Guidance Lowered from $7.40-7.50 Previously, Sales Outlook Reaffirmed",2014-06-04 16:05:00-04:00,PVH,negative
1044730.0,PVH Corp. Sees FY2014 EPS $7.30-7.40 vs $7.51 Est,2014-06-04 16:03:00-04:00,PVH,neutral
1044731.0,PVH Corp. Sees Q2 EPS $1.40-1.45 vs $1.48 Est; Sees Sales $2.0B vs $2.0B Est,2014-06-04 16:03:00-04:00,PVH,neutral
1044732.0,PVH Corp. Reports Q1 EPS of $1.47 vs $1.49 Est; Revenue of $1.96B vs $1.98B Est,2014-06-04 16:03:00-04:00,PVH,neutral
1044733.0,Special Message: Traders Never Sleep,2014-06-04 11:19:00-04:00,PVH,positive
1044734.0,"#PreMarket Primer: Wednesday, June 4: Iran Deal Not Likely To Meet July 20 Deadline",2014-06-04 07:07:00-04:00,PVH,neutral
1044735.0,"Earning and Economic Calendar for Wednesday June 4, 2014",2014-06-04 05:52:00-04:00,PVH,neutral
1044736.0,"Earnings Scheduled For June 4, 2014",2014-06-04 05:10:00-04:00,PVH,neutral
1044737.0,"Stocks To Watch For June 4, 2014",2014-06-04 04:19:00-04:00,PVH,neutral
1044738.0,Morgan Stanley Expects Small Positive Catalyst From PVH 1Q EPS Report,2014-06-02 08:29:00-04:00,PVH,positive
1044739.0,Benzinga Weekly Preview: ECB To Make A Bold Move,2014-05-30 16:50:00-04:00,PVH,positive
1044740.0,"Top Ex-Dividend Stocks For May 21, 2014",2014-05-21 10:16:00-04:00,PVH,positive
1044741.0,Market Wrap For May 13: Markets Close Again At Record Highs,2014-05-13 16:36:00-04:00,PVH,neutral
1044742.0,"Speedo Announce Deal with OrthoLite, Will Use OrthoLite Soles in its Shoes",2014-05-13 08:58:00-04:00,PVH,neutral
1044743.0,Calvin Klein Announces Distribution and Retail Store License Agreement for Latin America with American Designer Fashion S.A. ,2014-05-08 09:06:00-04:00,PVH,positive
1044744.0,PVH Announces License Agreement with Leisure Brands for IZOD Brand ,2014-05-06 11:12:00-04:00,PVH,positive
1044745.0,"JC Penney Shares Rise 10%, Following Earlier Comments by PVH's Manny Chirico that he Expects More Positive Results from JCP and is Encouraged by What they have Done",2014-04-28 15:31:00-04:00,PVH,positive
1044746.0,Market Wrap For April 11: Markets Pick Up Exactly Where They Left Off,2014-04-11 16:49:00-04:00,PVH,neutral
1044747.0,"Bank of America Maintains Neutral on PVH Corp., Raises PT to $125.00",2014-04-11 06:55:00-04:00,PVH,neutral
1044748.0,"Benzinga's M&A Chatter for Tuesday April 8, 2014",2014-04-08 16:57:00-04:00,PVH,neutral
1044749.0,"PVH Corp. Reports Minority Investment in Karl Lagerfeld, Terms Not Disclosed",2014-04-08 16:31:00-04:00,PVH,neutral
1044750.0,Market Wrap For April 2: Markets On Four-Day Winning Streak,2014-04-02 16:40:00-04:00,PVH,positive
1044751.0,Market Wrap For March 27: Markets Lower Following Mixed Economic Data,2014-03-27 17:39:00-04:00,PVH,negative
1044752.0,"G-III Apparel Announces PVH Corp Will Design, Market, Distribute G.H. Bass & Co. Brand",2014-03-27 16:31:00-04:00,PVH,neutral
1044753.0,Goldman Sachs Upgrades PVH Corp. to Conviction Buy,2014-03-27 07:23:00-04:00,PVH,neutral
1044754.0,From PVH Call: Largest Risk to Operations is External Environment,2014-03-26 09:27:00-04:00,PVH,negative
1044755.0,"From PVH Corp. Earnings Conf. Call: Still Sees a Challenging Retail Environment in North America, Cites Cold Weather",2014-03-26 09:14:00-04:00,PVH,positive
1044756.0,"Stocks To Watch For March 26, 2014",2014-03-26 04:16:00-04:00,PVH,neutral
1044757.0,PVH CEO Chirico: 'Our Calvin Business in Asia is Strong' ,2014-03-25 18:19:00-04:00,PVH,positive
1044758.0,PVH CEO Chirico: 'Our European Business Overall has Stabilized' ,2014-03-25 18:18:00-04:00,PVH,neutral
1044759.0,PVH CEO Manny Chirico: 'We See a Big Turn Around in Calvin Klein Business in Second Half of the Year',2014-03-25 18:17:00-04:00,PVH,neutral
1044760.0,Jim Cramer Interviews CEO Manny Chirico of PVH on Mad Money,2014-03-25 18:16:00-04:00,PVH,negative
1044761.0,Market Wrap For March 25: Markets Snap Two-Day Losing Steak On Confidence Data,2014-03-25 16:24:00-04:00,PVH,positive
1044762.0,PVH Corp. Reports Q4 EPS of $1.43 vs $1.42 Est; Revenue of $2.05B vs $2.07B Est,2014-03-25 16:03:00-04:00,PVH,neutral
1044763.0,"Earnings Expected After the Close Mar. 25, 2014:",2014-03-25 15:12:00-04:00,PVH,neutral
1044764.0,"Calvin Klein Announces CEO Tom Murry to Retire, Steve Shiffman Promoted to CEO",2014-03-25 08:03:00-04:00,PVH,positive
1044765.0,"Earnings Scheduled For March 25, 2014",2014-03-25 05:08:00-04:00,PVH,neutral
1044766.0,Benzinga Weekly Preview: Crisis In Crimea Still Weighing On Markets,2014-03-21 17:13:00-04:00,PVH,negative
1044767.0,Market Wrap For March 18: Markets Positive Despite Crimea Concerns,2014-03-18 16:35:00-04:00,PVH,positive
1044768.0,"Barclays Initiates Coverage on PVH Corp. at Overweight, Announces $140.00 PT",2014-03-18 07:52:00-04:00,PVH,negative
1044769.0,UPDATE: Morgan Stanley Downgrades PVH Following Warnaco Acquisition,2014-03-13 10:32:00-04:00,PVH,neutral
