Unnamed: 0,title,date,stock,sentiment
1044770.0,Benzinga's Top Downgrades,2014-03-13 07:52:00-04:00,PVH,positive
1044771.0,Wells Fargo Downgrades PVH Corp. to Market Perform,2014-03-13 07:41:00-04:00,PVH,positive
1044772.0,Wells Fargo Downgrades PVH Corp. to Market Perform,2014-03-13 07:40:00-04:00,PVH,positive
1044773.0,"Morgan Stanley Downgrades PVH Corp. to Equal-weight, Removes $139.00 PT",2014-03-13 07:19:00-04:00,PVH,neutral
1044774.0,Moody's Affirms Ratings on PVH; Outlook Raised to Positive,2014-02-24 12:48:00-05:00,PVH,positive
1044775.0,PVH In Talks to Amend Credit Line,2014-02-21 08:18:00-05:00,PVH,positive
1044776.0,"Nomura Cautious On Retail Group, Starts Sector Coverage With Neutral",2014-02-13 15:45:00-05:00,PVH,negative
1044777.0,"Nomura Initiates Coverage on PVH Corp. at Buy, Announces $140.00 PT",2014-02-13 07:42:00-05:00,PVH,neutral
1044778.0,"PVH to Reaffirm Q4, FY 2013 EPS Guidance, Lower Revenue Guidance for Q4, FY 2013 at ICR Xchange Conference ",2014-01-10 18:40:00-05:00,PVH,negative
1044779.0,PVH Corp. Sees FY2013 Sales $8.22B vs $8.25B Est,2014-01-10 17:19:00-05:00,PVH,neutral
1044780.0,PVH Corp. Lowers Q4 Sales Guidance from $2.08B to $2.06B vs $2.08B Est,2014-01-10 17:19:00-05:00,PVH,negative
1044781.0,"Barron's Recap: Bad, Bad Wolf",2013-12-23 06:56:00-05:00,PVH,negative
1044782.0,"Janney Capital Initiates Coverage on PVH Corp. at Buy, Announces $150.00 PT",2013-12-19 08:11:00-05:00,PVH,neutral
1044783.0,"UBS Initiates Coverage on PVH Corp. at Buy, Announces $160.00 PT",2013-12-16 08:48:00-05:00,PVH,neutral
1044784.0,UPDATE: Citigroup Raises PT on PVH Corp. on Further Upside Potential,2013-12-11 13:54:00-05:00,PVH,neutral
1044785.0,"Citigroup Maintains Buy on PVH Corp., Raises PT to $154.00",2013-12-11 07:28:00-05:00,PVH,neutral
1044786.0,GIII CEO Goldfarb: 'We License Many Classifications from PVH',2013-12-10 18:19:00-05:00,PVH,neutral
1044787.0,Benzinga's Volume Movers,2013-12-10 10:30:00-05:00,PVH,neutral
1044788.0,"Stocks To Watch For December 10, 2013",2013-12-10 04:07:00-05:00,PVH,neutral
1044789.0,PVH Corp. Lowers FY2013 Sales Guidance from $8.25B to $8.24B vs $8.26B Est,2013-12-09 16:05:00-05:00,PVH,negative
1044790.0,PVH Corp. Sees Q4 EPS $1.40 vs $1.52 Est,2013-12-09 16:04:00-05:00,PVH,neutral
1044791.0,PVH Corp. Reports Q3 EPS of $2.30 vs $2.24 Est,2013-12-09 16:02:00-05:00,PVH,neutral
1044792.0,"Earnings Scheduled For December 9, 2013",2013-12-09 04:49:00-05:00,PVH,neutral
1044793.0,"Stocks To Watch For December 9, 2013",2013-12-09 04:39:00-05:00,PVH,neutral
1044794.0,Earnings Expectations For The Week Of December 9,2013-12-08 20:09:00-05:00,PVH,neutral
1044795.0,"PVH Corp. License Pacts with Izod, Van Heusen",2013-11-06 16:00:00-05:00,PVH,neutral
1044796.0,"PVH, Gazal Announce Australian JV for Operation of Calvin Klein Businesses in Australia ",2013-10-03 20:38:00-04:00,PVH,neutral
1044797.0,UPDATE: Bank of America Lowers PT on PVH Corp. Following Announcement of G.H. Bass & Co. Assets Sale,2013-10-03 12:06:00-04:00,PVH,positive
1044798.0,"Miller Tabak Reiterates Buy on PVH Corp. on Underlying Brand Strength, Management Confidence",2013-09-12 11:09:00-04:00,PVH,positive
1044799.0,"Benzinga Market Primer: Tuesday, September 10: US Military Strike In Syria Put On Pause",2013-09-10 06:39:00-04:00,PVH,negative
1044800.0,PVH Corp. Sees Q3 EPS $2.20 vs $2.28 Est; Sees Sales $2.20B vs $2.23B Est,2013-09-09 16:13:00-04:00,PVH,neutral
1044801.0,PVH Corp. Reports Q2 EPS of $1.39 vs $1.37 Est; Revenue of $1.97B vs $1.89B Est; Reaffirms Outlook,2013-09-09 16:10:00-04:00,PVH,neutral
1044802.0,UPDATE: Deutsche Bank Raises PT on PVH Corp. Ahead of Expected In-Line 2Q Results,2013-09-09 12:29:00-04:00,PVH,neutral
1044803.0,"Deutsche Bank Maintains Buy on PVH Corp., Raises PT to $145.00",2013-09-09 09:23:00-04:00,PVH,neutral
1044804.0,"Earnings Scheduled For September 9, 2013",2013-09-09 07:01:00-04:00,PVH,neutral
1044805.0,Earnings Expectations For The Week Of September 9,2013-09-08 19:16:00-04:00,PVH,neutral
1044806.0,Benzinga Weekly Preview: Japan And China Take Center Stage; Syria Still In Focus,2013-09-06 16:10:00-04:00,PVH,neutral
1044807.0,UPDATE: Goldman Sachs Resumes Phillips Van Heusen at Buy on Multiple Positive Factors,2013-08-12 10:52:00-04:00,PVH,positive
1044808.0,"Goldman Sachs Reinstates Buy on PVH Corp., Announces $165.00 PT",2013-08-12 07:13:00-04:00,PVH,neutral
1044809.0,Stocks Hitting 52-Week Highs,2013-07-10 10:20:00-04:00,PVH,neutral
1044810.0,UPDATE: Piper Jaffray Upgrades PVH on Visibility Catalysts Improving,2013-06-24 07:51:00-04:00,PVH,positive
1044811.0,Benzinga's Top Upgrades,2013-06-24 07:19:00-04:00,PVH,positive
1044812.0,A Peek Into The Market Before The Trading Starts,2013-06-24 07:16:00-04:00,PVH,neutral
1044813.0,"Piper Jaffray Upgrades PVH Corp. to Overweight, Raises PT to $141.00",2013-06-24 06:23:00-04:00,PVH,negative
1044814.0,SEC Filings on PVH Corp. Showing Two Directors Sold Total of 36K Shares on Friday,2013-06-17 16:56:00-04:00,PVH,positive
1044815.0,"Market Wrap for Thursday, June 13: Strong Economic Reports Trigger Stock Rally ",2013-06-13 16:24:00-04:00,PVH,positive
1044816.0,Afternoon Market Gainers ,2013-06-13 13:06:00-04:00,PVH,neutral
1044817.0,"Benzinga's PreMarket Info Recap for June 13, 2013",2013-06-13 10:19:00-04:00,PVH,neutral
1044818.0,Summary of Important Points from PVH Corp. Earnings Conference Call,2013-06-13 09:35:00-04:00,PVH,positive
1044819.0,From PVH Call: Closing ~25 Stores in Europe,2013-06-13 09:03:00-04:00,PVH,neutral
1044820.0,From PVH Call: FY13 EPS Guidance Reaffirmed at $7,2013-06-13 08:50:00-04:00,PVH,neutral
1044821.0,"Benzinga Market Primer, Thursday June 13",2013-06-13 06:15:00-04:00,PVH,neutral
1044822.0,US Stock Futures Down Ahead Of Economic Data,2013-06-13 06:13:00-04:00,PVH,neutral
1044823.0,"Stocks To Watch For June 13, 2013",2013-06-13 05:20:00-04:00,PVH,neutral
1044824.0,"PVH Corp. Reports Blowout First Quarter Results, Shares Climb",2013-06-12 16:28:00-04:00,PVH,positive
1044825.0,UPDATE: PVH Corp. Reports 2013 First Quarter Results,2013-06-12 16:04:00-04:00,PVH,neutral
1044826.0,PVH Corp. Sees Q2 EPS $1.35 vs $1.35 Est; Sees Sales $1.90B vs $1.84B Est,2013-06-12 16:03:00-04:00,PVH,neutral
1044827.0,PVH Corp. Reports Q1 EPS of $1.91 vs $1.35 Est,2013-06-12 16:03:00-04:00,PVH,neutral
1044828.0,"Benzinga Market Primer: Wednesday, June 12",2013-06-12 06:24:00-04:00,PVH,neutral
1044829.0,US Stock Futures Signal Higher Start On Wall Street,2013-06-12 05:58:00-04:00,PVH,neutral
1044830.0,"Earnings Scheduled For June 12, 2013",2013-06-12 04:56:00-04:00,PVH,neutral
1044831.0,"Stocks To Watch For June 12, 2013",2013-06-12 04:49:00-04:00,PVH,neutral
1044832.0,"Earnings Report Scheduled for June 12, 2013",2013-06-11 13:36:00-04:00,PVH,neutral
1044833.0,"Stocks to Watch for the Week of June 10, 2013",2013-06-10 12:58:00-04:00,PVH,neutral
1044834.0,Earnings Expectations for the Week of June 10,2013-06-10 06:29:00-04:00,PVH,neutral
1044835.0,"Weekly Preview: Retail Sales, Lululemon Earnings to Drive Markets",2013-06-07 16:28:00-04:00,PVH,neutral
1044836.0,"RBC Capital Downgrades PVH Corp. to Outperform, Raises PT to $128.00",2013-06-04 08:20:00-04:00,PVH,neutral
1044837.0,"Weekly Preview: FOMC Minutes in Focus, Earnings Season Wanes",2013-05-17 16:29:00-04:00,PVH,neutral
1044838.0,PVH's Calvin Klein to Rebrand Bridge Apparel Line,2013-05-13 09:07:00-04:00,PVH,neutral
1044839.0,W. P. Carey Acquires Tommy Hilfiger European Distribution Center ,2013-05-01 08:04:00-04:00,PVH,neutral
1044840.0,UPDATE: Bank of America Resumes PVH Corp. with Neutral on Near-Term Headwinds,2013-04-25 09:59:00-04:00,PVH,neutral
1044841.0,"Bank of America Reinstates Neutral on PVH Corp., Announces $115.00 PT",2013-04-25 06:19:00-04:00,PVH,neutral
1044842.0,UPDATE: Piper Jaffray Lowers PT on PVH Corp. Following Q4 Report,2013-03-28 12:35:00-04:00,PVH,negative
1044843.0,Benzinga's Top Pre-Market Losers,2013-03-28 08:55:00-04:00,PVH,negative
1044844.0,"Piper Jaffray Maintains Neutral on PVH Corp., Lowers PT to $115.00",2013-03-28 08:36:00-04:00,PVH,negative
1044845.0,US Stock Futures Up Ahead Economic Data,2013-03-28 07:17:00-04:00,PVH,neutral
1044846.0,"Benzinga Market Primer: Thursday, March 28",2013-03-28 06:28:00-04:00,PVH,neutral
1044847.0,"Stocks To Watch For March 28, 2013",2013-03-28 04:33:00-04:00,PVH,neutral
1044848.0,PVH CEO Chirico: 'Our Warnaco Acquisition is Much More Complicated than When we Bought Tommy Hilfiger',2013-03-27 19:26:00-04:00,PVH,neutral
1044849.0,"PVH CEO Chirico: 'The Jeans Category has been Under Pressure, But We Think It's Stabilizing'",2013-03-27 19:25:00-04:00,PVH,negative
1044850.0,"PVH CEO Chirico: 'For Us, 2013 is Going to be a Major Transition Year'",2013-03-27 19:23:00-04:00,PVH,neutral
1044851.0,Jim Cramer Interviews Manny Chirico of PVH on Mad Money,2013-03-27 19:22:00-04:00,PVH,negative
1044852.0,PVH Corp. Sees Q1 EPS $1.33 vs $1.52 Est; Sees Sales $1.90B vs $1.85B Est,2013-03-27 17:05:00-04:00,PVH,neutral
1044853.0,"PVH Corp. Reports Prelim. FY13 Adj. EPS $7 vs $7.46 Est, Sales $8.2B vs $7.67B Est.",2013-03-27 17:02:00-04:00,PVH,neutral
1044854.0,PVH Corp. Reports Q4 EPS of $1.60 vs $1.50 Est; Revenue of $1.64B vs $1.60B Est,2013-03-27 17:01:00-04:00,PVH,neutral
1044855.0,"Benzinga Market Primer: Wednesday, March 27",2013-03-27 06:26:00-04:00,PVH,neutral
1044856.0,US Stock Futures Down Ahead Of Pending Home Sales Index,2013-03-27 06:15:00-04:00,PVH,neutral
1044857.0,"Earnings Scheduled For March 27, 2013",2013-03-27 04:47:00-04:00,PVH,neutral
1044858.0,"Stocks To Watch For March 27, 2013",2013-03-27 04:05:00-04:00,PVH,neutral
1044859.0,Earnings Expectations for the Week of March 25,2013-03-24 15:51:00-04:00,PVH,neutral
1044860.0,UPDATE: Piper Jaffray Reiterates Neutral on PVH Corporation on Softer Southern European Trends,2013-03-21 12:54:00-04:00,PVH,neutral
1044861.0,"Piper Jaffray Maintains Neutral on PVH Corp., Lowers PT to $123.00",2013-03-21 08:08:00-04:00,PVH,negative
1044862.0,PVH Announces License Agreement with Comercio Excelente for IZOD Brand Apparel and Accessories ,2013-03-20 15:59:00-04:00,PVH,positive
1044863.0,UPDATE: Piper Jaffray Downgrades PVH Corp to Neutral; Going Through Transition,2013-03-12 08:12:00-04:00,PVH,neutral
1044864.0,"Piper Jaffray Downgrades PVH Corp. to Neutral, Raises PT to $127.00",2013-03-12 07:43:00-04:00,PVH,neutral
1044865.0,"Toyota, Movado and Others Analysts Are Bullish On",2013-02-25 14:10:00-05:00,PVH,neutral
1044866.0,"Benzinga's M&A Chatter for Thursday February 21, 2013",2013-02-21 18:07:00-05:00,PVH,neutral
1044867.0,Columbia Sportswear Spokesperson Declines Comment on Sterne Agee Note on Potential PVH and VFC Interest,2013-02-21 14:59:00-05:00,PVH,positive
1044868.0,"Credit Suisse Reinstates Outperform on PVH Corp., Announces $145.00 PT",2013-02-19 08:31:00-05:00,PVH,positive
1044869.0,S&P Announces PVH to Replace Big Lots in S&P 500,2013-02-07 17:18:00-05:00,PVH,neutral
1044870.0,PVH In License Pact with Concept One Accessories for Headwear Under Izod,2013-02-07 14:56:00-05:00,PVH,neutral
1044871.0,Upside in JC Penney Shares Might Be Related to Comment from PVH CEO Izod Shop Sales at JC Penney Are a 'Grand Slam',2013-01-18 11:33:00-05:00,PVH,positive
1044872.0,"PVH Reports License Deal with Stepping Stones for Infant Hosiery, Legwear",2013-01-17 16:12:00-05:00,PVH,neutral
1044873.0,PVH Reaffirms Outlook,2013-01-16 16:03:00-05:00,PVH,neutral
1044874.0,"UPDATE: Morgan Stanley Upgrades PVH Corp. to Overweight, Reiterates $134 PT",2013-01-07 13:06:00-05:00,PVH,negative
1044875.0,"Morgan Stanley Upgrades PVH Corp. to Outperform, Announces $134.00 PT",2013-01-07 08:50:00-05:00,PVH,neutral
1044876.0,Top 4 Mid-Cap Stocks In The Textile-Apparel Clothing Industry With The Highest Revenue,2012-12-21 02:33:00-05:00,PVH,positive
1044877.0,PVH Announces Offering of $500 Million of Senior Notes Due 2022  ,2012-12-06 07:45:00-05:00,PVH,neutral
1044878.0,PVH Corp. Announces $500M Senior Notes Offering,2012-12-06 07:44:00-05:00,PVH,neutral
1044879.0,US Stock Futures Down Ahead Of New-Home Sales Data,2012-11-28 06:00:00-05:00,PVH,neutral
1044880.0,"Stocks To Watch For November 28, 2012",2012-11-28 02:53:00-05:00,PVH,neutral
1044881.0,UPDATE: PVH FQ3 Profit Surges 47%,2012-11-28 02:09:00-05:00,PVH,positive
1044882.0,PVH CEO Chirico: 'Asia Should be 20% of Our Business Next Year',2012-11-27 18:21:00-05:00,PVH,neutral
1044883.0,PVH CEO Chirico: 'We Can Borrow at Very Low Rates Now',2012-11-27 18:20:00-05:00,PVH,negative
1044884.0,PVH CEO Chirico: 'We are Very Happy with How Our Izod Brand is doing at JCP Mini Shops',2012-11-27 18:18:00-05:00,PVH,positive
1044885.0,PVH CEO Chirico: 'We're Expecting a Very Strong 4th Quarter',2012-11-27 18:17:00-05:00,PVH,positive
1044886.0,Jim Cramer Interviews CEO Manny Chirico of PVH on Mad Money,2012-11-27 18:15:00-05:00,PVH,negative
1044887.0,"UPDATE: PVH Sees FY Sales Growth 2%, Had Seen 1-2% Growth",2012-11-27 16:36:00-05:00,PVH,positive
1044888.0,PVH Corp. Sees Q4 EPS $1.48-1.49 vs $1.52 Est; Raises FY EPS $6.37-6.38 vs $6.37 Est,2012-11-27 16:35:00-05:00,PVH,neutral
1044889.0,Phillips-Van Heusen Reports Q3 EPS $2.34 vs $2.30 Est; Revenues $1.64B vs $1.64B Est,2012-11-27 16:34:00-05:00,PVH,neutral
1044890.0,PREVIEW: JIm Cramer to Interview PVH CEO Manny Chirico on Mad Money,2012-11-27 12:33:00-05:00,PVH,negative
1044891.0,US Stock Futures Flat Ahead Of Economic Data,2012-11-27 07:56:00-05:00,PVH,neutral
1044892.0,"Stocks To Watch For November 27, 2012",2012-11-27 00:00:00-05:00,PVH,neutral
1044893.0,"Earnings Scheduled For November 27, 2012",2012-11-26 23:46:00-05:00,PVH,neutral
1044894.0,"PVH, Warnaco Deal Approved",2012-11-26 09:48:00-05:00,PVH,positive
1044895.0,Earnings Expectations for the Week of November 26,2012-11-25 13:19:00-05:00,PVH,neutral
1044896.0,"Looking Ahead: Earnings from Apparel Companies, US Durable Goods",2012-11-23 13:10:00-05:00,PVH,neutral
1044897.0,CL King Upgraded Phillips-Van Heusen from Neutral to Buy,2012-11-23 09:57:00-05:00,PVH,neutral
1044898.0,"Lululemon Athletica Canada, Calvin Klein and G-III Apparel Group, Reached a Settlement Agreement in Design Patent Litigation   ",2012-11-20 16:02:00-05:00,PVH,positive
1044899.0,"UPDATE: Miller Tabak Reiterates Buy Rating, Raises PT on PVH Corp.",2012-11-02 09:18:00-04:00,PVH,neutral
1044900.0,"Miller Tabak Maintains Phillips-Van Heusen at Buy, Raises PT from $100 to $120",2012-11-01 16:16:00-04:00,PVH,neutral
1044901.0,Barclays Restricted Coverage on Phillips-Van Heusen,2012-11-01 12:23:00-04:00,PVH,negative
1044902.0,"Benzinga's M&A Chatter for Wednesday October 31, 2012",2012-10-31 18:49:00-04:00,PVH,neutral
1044903.0,PVH CEO Chirico: 'We Love Strong Brands that Give Us a Niche; Speedo Gives Us That',2012-10-31 18:32:00-04:00,PVH,positive
1044904.0,PVH CEO Chirico: 'I Think his Deal Gives Us Scale and Leverage in Our Calvin Klein Brand',2012-10-31 18:31:00-04:00,PVH,neutral
1044905.0,PVH CEO Chirico: 'I Think Our Acquisition of Warnaco Solidifies Our Brand Position',2012-10-31 18:30:00-04:00,PVH,neutral
1044906.0,Jim Cramer Interviews CEO Emanuel Chirico of PVH on Mad Money,2012-10-31 18:24:00-04:00,PVH,negative
1044907.0,Warnaco Soars on PVH Buyout; Stock Up More Than 37%,2012-10-31 13:53:00-04:00,PVH,neutral
1044908.0,"PVH Rises 21% on Warnaco Purchase, Warnaco Rises 39%",2012-10-31 09:48:00-04:00,PVH,neutral
1044909.0,A Peek Into The Market Before The Trading Starts,2012-10-31 07:20:00-04:00,PVH,neutral
1044910.0,PVH to Acquire Warnaco in $2.9B Cash and Stock Deal,2012-10-31 06:09:00-04:00,PVH,neutral
1044911.0,PVH Corp. Announces Extended Licensing Agreement with Geoffrey Beene Through 2028 if Conditions Met,2012-10-12 14:22:00-04:00,PVH,positive
1044912.0,UPDATE: Bank of America Raises PO to $98 on Phillips-Van Heusen,2012-10-03 11:32:00-04:00,PVH,negative
1044913.0,"Bank of America Maintains Phillips-Van Heusen at Neutral, Raises PO from $95 to $98",2012-10-03 11:02:00-04:00,PVH,negative
1044914.0,PVH Corp Guides 2012 Operating Profit About $725M -Bloomberg,2012-10-02 12:32:00-04:00,PVH,positive
1044915.0,"UPDATE: PVH Guides Q3 EPS $2.28-2.30, Had Seen $2.20-2.25 vs $2.25 Est",2012-10-02 08:34:00-04:00,PVH,neutral
1044916.0,"PVH Boosts FY12 Guidance to $6.32-6.37, Had Seen $6.25-6.32",2012-10-02 08:31:00-04:00,PVH,positive
1044917.0,CL King Upgrades Phillips-Van Heusen from Neutral to Buy,2012-09-26 09:31:00-04:00,PVH,neutral
1044918.0,Benzinga's Top Upgrades,2012-09-26 08:35:00-04:00,PVH,positive
1044919.0,"Top Performing Dividend Payers in Consumer Goods with the Most Upside Potential (CTB, MOV, OXM)",2012-09-24 07:09:00-04:00,PVH,positive
1044920.0,UPDATE: Piper Jaffray Upgrades Phillips-Van Heusen to Overweight on Outlook  ,2012-09-24 06:45:00-04:00,PVH,negative
1044921.0,"Piper Jaffray Upgrades Phillips-Van Heusen from Neutral to Overweight, Raises PT from $93 to $109",2012-09-24 06:02:00-04:00,PVH,negative
1044922.0,Jim Cramer Says Warnaco Should Sell its Calvin Klein Business to PVH,2012-09-18 19:14:00-04:00,PVH,neutral
1044923.0,PVH CEO Chirico: 'We Have 9 of the Top 10 Brands in Shirts and Neckwear',2012-09-06 18:33:00-04:00,PVH,positive
1044924.0,PVH CEO Chirico: 'Inventories are Lean on PVH's Balance Sheet',2012-09-06 18:23:00-04:00,PVH,neutral
1044925.0,"PVH CEO Chirico: 'Our JC Penney Relationship is Positive, A Good Way to Build our Izod Brand'",2012-09-06 18:21:00-04:00,PVH,positive
1044926.0,"PVH CEO Chirico: 'In August, Comps in North America for Calvin Klein and Tommy Hilfiger Were in High Single-Digits'",2012-09-06 18:19:00-04:00,PVH,neutral
1044927.0,PVH CEO Chirico: 'Tommy Hilfiger is Very Strong in Europe',2012-09-06 18:17:00-04:00,PVH,positive
1044928.0,Jim Cramer Interviews CEO Manny Chricio of PVH on Mad Money,2012-09-06 18:15:00-04:00,PVH,negative
1044929.0,PREVIEW: Jim Cramer to Interview CEO Manny Chricio of PVH on Mad Money,2012-09-06 14:39:00-04:00,PVH,negative
1044930.0,"UPDATE: Goldman Sachs Reiterates Buy Rating, Raises PT on PVH Corp.",2012-08-29 13:17:00-04:00,PVH,neutral
1044931.0,"UPDATE: Citigroup Reiterates Buy Rating, Raises PT on PVH Corp.",2012-08-29 13:11:00-04:00,PVH,neutral
1044932.0,"Barclays Maintains Phillips-Van Heusen at Overweight, Raises PT from $100 to $110",2012-08-29 12:22:00-04:00,PVH,negative
1044933.0,"Citigroup Maintains Phillips-Van Heusen at Buy, Raises PT from $104 to $110",2012-08-29 06:43:00-04:00,PVH,neutral
1044934.0,"Goldman Sachs Maintains Phillips-Van Heusen at Buy, Raises PT from $102 to $108",2012-08-29 06:34:00-04:00,PVH,neutral
1044935.0,"Bank of America Maintains Phillips-Van Heusen at Neutral, Raises PO from $82 to $95",2012-08-28 11:38:00-04:00,PVH,negative
1044936.0,PVH 4% Higher Pre-Market on Monday's Solid Earnings Report,2012-08-28 08:00:00-04:00,PVH,positive
1044937.0,"Brean Murray Carret Maintains Phillips-Van Heusen at Buy, Raises PT from $107 to $115",2012-08-28 06:56:00-04:00,PVH,neutral
1044938.0,US Stock Futures Slightly Higher Ahead Of Economic Data,2012-08-28 06:31:00-04:00,PVH,neutral
1044939.0,"Stocks To Watch For August 28, 2012",2012-08-28 00:03:00-04:00,PVH,neutral
1044940.0,"PVH Rises 4% on Solid Earnings Report, Raised Guidance",2012-08-27 17:07:00-04:00,PVH,positive
1044941.0,PVH Rises on Q2 Earnings Results ,2012-08-27 16:48:00-04:00,PVH,neutral
1044942.0,UPDATE: Phillips-Van Heusen Reports Q2 EPS $1.25 vs $1.20 Est; Revenues $1.34B vs $1.34B Est,2012-08-27 16:15:00-04:00,PVH,neutral
1044943.0,PVH Guides Q3 EPS $2.20-2.25 vs $2.20 Est,2012-08-27 16:15:00-04:00,PVH,neutral
1044944.0,"PVH Guides FY EPS $6.25-6.32, Had Seen $6.15-6.25 vs $6.23 Est",2012-08-27 16:14:00-04:00,PVH,neutral
1044945.0,Phillips-Van Heusen Reports Q2 EPS $1.25 vs $1.20 Est,2012-08-27 16:14:00-04:00,PVH,neutral
1044946.0,Companies Reporting Monday After the Close,2012-08-27 15:53:00-04:00,PVH,neutral
1044947.0,"UPDATE: Citigroup Reiterates Buy, $104 on PVH Ahead of Monday's Earnings  ",2012-08-27 10:51:00-04:00,PVH,neutral
1044948.0,"Benzinga Market Primer, Monday August 27",2012-08-27 07:49:00-04:00,PVH,neutral
1044949.0,US Stock Futures Edge Up; Crude Oil Rises,2012-08-27 06:37:00-04:00,PVH,negative
1044950.0,Earnings Expectations for the Week of August 27,2012-08-27 06:18:00-04:00,PVH,neutral
1044951.0,"Earnings Scheduled For August 27, 2012",2012-08-27 01:35:00-04:00,PVH,neutral
1044952.0,"Stocks To Watch For August 27, 2012",2012-08-27 00:10:00-04:00,PVH,neutral
1044953.0,"Earnings Calendar for Monday August 27, 2012 ",2012-08-26 19:07:00-04:00,PVH,neutral
1044954.0,Top 4 Mid-Cap Stocks In The Textile-Apparel Clothing Industry With The Highest Cash,2012-08-15 04:48:00-04:00,PVH,positive
1044955.0,LNK Partners Closes Second $400 Million Fund Dedicated To Investments In Consumer And Retail Businesses ,2012-08-01 07:35:00-04:00,PVH,positive
1044956.0,PVH Corp. Announces Licensing Agreement with the Seidensticker Group for ARROW Brand   ,2012-07-30 16:10:00-04:00,PVH,positive
1044957.0,Benzinga's Top Initiations,2012-07-13 07:56:00-04:00,PVH,positive
1044958.0,"UPDATE: JP Morgan Initiates PVH Corp with Neutral, $89 PT on Pricing, International Uncertainties  ",2012-06-22 10:37:00-04:00,PVH,neutral
1044959.0,"JP Morgan Initiates Coverage On Phillips-Van Heusen at Neutral, Announces PT of $89",2012-06-22 05:58:00-04:00,PVH,positive
1044960.0,PVH Corp. Reaffirms Second Quarter and Full Year 2012 Revenue and Earnings Guidance   ,2012-06-21 06:45:00-04:00,PVH,neutral
1044961.0,"PVH Officer Onnink Sells 23,551 shares at $80.53 Following Gehring's Sale of 116,853 at Same Price",2012-06-08 12:57:00-04:00,PVH,positive
1044962.0,"PVH Director/Officer Gehring sells 116,863 shares at $80.53, total value $9,410,428",2012-06-08 12:50:00-04:00,PVH,positive
1044963.0,UPDATE: Goldman Sachs Raises PT to $102 on PVH Corp on 2H EPS Outlook  ,2012-05-25 07:11:00-04:00,PVH,neutral
1044964.0,"Goldman Sachs Maintains Phillips-Van Heusen at Buy, Raises PT from $101 to $102",2012-05-25 06:34:00-04:00,PVH,neutral
1044965.0,"Bank of America Maintains Phillips-Van Heusen at Neutral, Raises PO from $80 to $85",2012-05-24 12:33:00-04:00,PVH,negative
1044966.0,PVH Rises 6% After Wednesday's Earnings Beat and CEO Manny Chirico's Appearance on Jim Cramer's Mad Money,2012-05-24 09:50:00-04:00,PVH,negative
1044967.0,PVH CEO Chirico: 'We Have Signaled to the Market That We are Seriously Looking at Acquisitions',2012-05-23 18:34:00-04:00,PVH,negative
1044968.0,PVH CEO Chirico: 'We Have Seen Business Accelerate in May',2012-05-23 18:33:00-04:00,PVH,neutral
1044969.0,PVH CEO Chirico: 'The Stock Has Been Getting Pounded Just Because of the Noise in the Market',2012-05-23 18:29:00-04:00,PVH,neutral
1044970.0,Jim Cramer Interviews CEO Emanuel Chirico of PVH on Mad Money,2012-05-23 18:27:00-04:00,PVH,negative
1044971.0,PREVIEW: Jim Cramer to Interview CEO of PVH on Mad Money,2012-05-23 18:13:00-04:00,PVH,negative
1044972.0,"PVH Guides FY Q2 Revenue $1.31-1.33B vs $1.36B Est; Guides Q2 EPS $1.18-1.20 vs $1.20 Est; Guides FY EPS $6.15-6.25, Saw High End $6.10-6.20 vs $6.23 Est; Guides FY Revenue $5.95-6.01B, Had Seen $5.89-5.95B vs $6.07B Est",2012-05-23 16:10:00-04:00,PVH,neutral
1044973.0,Phillips-Van Heusen Reports Q1 EPS $1.30 vs $1.26 Est; Revenues $1.427B vs $1.40B Est,2012-05-23 16:04:00-04:00,PVH,neutral
1044974.0,US Stock Futures Down; All Eyes On EU Summit,2012-05-23 06:27:00-04:00,PVH,neutral
1044975.0,Earnings Scheduled For May 23,2012-05-23 02:32:00-04:00,PVH,neutral
1044976.0,"Earnings Expectations for the Week of May 21 (BBY, LOW, DELL, HPQ)",2012-05-20 09:34:00-04:00,PVH,negative
1044977.0,"Benzinga's Top Downgrades With Color for May 4, 2012",2012-05-04 14:19:00-04:00,PVH,positive
1044978.0,UPDATE: Piper Jaffray Downgrades PVH; Lowers PT,2012-05-04 08:53:00-04:00,PVH,negative
1044979.0,Benzinga's Top Downgrades,2012-05-04 07:23:00-04:00,PVH,positive
1044980.0,"Piper Jaffray Downgrades Phillips-Van Heusen from Overweight to Neutral, Lowers PT from $99 to $93",2012-05-04 06:11:00-04:00,PVH,negative
1044981.0,"VFC, TRLG & PVH: Denim Tears Up Earnings Season ",2012-04-30 14:35:00-04:00,PVH,negative
1044982.0,"VFC, TRLG & PVH: Denim Tears Up Earnings Season ",2012-04-30 14:28:00-04:00,PVH,negative
1044983.0,PVH Corp. Announces Licensing Agreement with USPA Accessories for Van Heusen Headwear and Bags   ,2012-04-26 15:24:00-04:00,PVH,positive
1044984.0,PVH Corp. Reaffirms First Quarter and Full Year 2012 Earnings Per Share Guidance   ,2012-04-23 16:11:00-04:00,PVH,positive
1044985.0,UPDATE: Credit Suisse Upgrades PVH to Outperform ,2012-04-02 06:54:00-04:00,PVH,positive
1044986.0,"Credit Suisse Upgrades Phillips-Van Heusen from Neutral to Outperform, Raises PT from $72 to $105",2012-04-02 05:53:00-04:00,PVH,positive
1044987.0,UPDATE: Miller Tabak Raises PT to $100 on PVH,2012-03-29 12:37:00-04:00,PVH,neutral
1044988.0,"Miller Tabak Maintains Phillips-Van Heusen at Buy, Raises PT from $80 to $100",2012-03-29 10:44:00-04:00,PVH,neutral
1044989.0,"ISI Group Maintains Phillips-Van Heusen at Buy, Raises PT from $90 to $110",2012-03-28 12:57:00-04:00,PVH,neutral
1044990.0,"It's Good to be a ""Tommy""; PVH and Oxford Boast Astonishing Results",2012-03-28 11:12:00-04:00,PVH,positive
1044991.0,"PVH Corp Beats Q4 Guidance, Aided by Acquisition Cost and Revenues",2012-03-28 09:06:00-04:00,PVH,neutral
1044992.0,UPDATE: Brean Murray Carret Raises PVH's PT,2012-03-28 08:41:00-04:00,PVH,neutral
1044993.0,"Brean Murray Carret & Co. Maintains Phillips-Van Heusen at Buy, Raises PT from $105 to $107",2012-03-28 06:39:00-04:00,PVH,neutral
1044994.0,PVH CEO Chirico: 'Europe is Continuing to be Strong for Us',2012-03-27 18:26:00-04:00,PVH,positive
1044995.0,PVH CEO Chirico: 'Affordable Luxury is a Sweet Spot for American Consumers Now',2012-03-27 18:25:00-04:00,PVH,positive
1044996.0,Jim Cramer Interviews CEO Manny Chirico of PVH on Mad Money,2012-03-27 18:23:00-04:00,PVH,negative
1044997.0,"PREVIEW: Jim Cramer to Interview CEO's of PVH, Clorox on Mad Money",2012-03-27 18:12:00-04:00,PVH,negative
