Unnamed: 0,title,date,stock,sentiment
1044308.0,"Benzinga's Top Upgrades, Downgrades For January 22, 2019",2019-01-22 09:14:00-05:00,PVH,positive
1044309.0,"Cowen & Co. Downgrades PVH to Market Perform, Lowers Price Target to $119",2019-01-22 07:33:00-05:00,PVH,negative
1044310.0,44 Biggest Movers From Friday,2019-01-14 04:46:00-05:00,PVH,neutral
1044311.0,33 Stocks Moving In Friday's Mid-Day Session,2019-01-11 12:25:00-05:00,PVH,neutral
1044312.0,PVH shares are trading higher after the company raised Q4 and FY18 guidance.,2019-01-11 10:12:00-05:00,PVH,positive
1044313.0,22 Stocks Moving In Friday's Pre-Market Session,2019-01-11 08:14:00-05:00,PVH,neutral
1044314.0,A Peek Into The Markets: US Stock Futures Fall Ahead Of Consumer Price Index,2019-01-11 07:13:00-05:00,PVH,neutral
1044315.0,"6 Stocks To Watch For January 11, 2019",2019-01-11 03:52:00-05:00,PVH,neutral
1044316.0,5 Stocks Moving In Thursday's After-Hours Session,2019-01-10 18:07:00-05:00,PVH,neutral
1044317.0,PVH Sees FY18 Adj. EPS At Least $9.50 vs $9.35 Estimate,2019-01-10 16:31:00-05:00,PVH,neutral
1044318.0,"UPDATE: PVH Sees Q4 Adj. EPS At Least $1.75, $0.15 Above High End Of Previously-Issued Range",2019-01-10 16:31:00-05:00,PVH,neutral
1044319.0,PVH Raises Guidance,2019-01-10 16:30:00-05:00,PVH,neutral
1044320.0,"PVH's Calvin Klein, Inc. Outlines Strategic Changes To Brand And Organization",2019-01-10 16:30:00-05:00,PVH,neutral
1044321.0,"Benzinga's Top Upgrades, Downgrades For January 9, 2019",2019-01-09 09:26:00-05:00,PVH,positive
1044322.0,"RBC Capital Initiates Coverage On PVH with Outperform Rating, Announces $122 Price Target",2019-01-09 08:41:00-05:00,PVH,neutral
1044323.0,"Calvin Klein Is Stronger Than The Street Thinks, UBS Says In Upgrade Of Parent Company PVH",2019-01-07 15:17:00-05:00,PVH,positive
1044324.0,10 Biggest Price Target Changes For Monday,2019-01-07 10:07:00-05:00,PVH,neutral
1044325.0,"UBS Upgrades PVH to Buy, Lowers Price Target to $145",2019-01-07 08:35:00-05:00,PVH,negative
1044326.0,"Wells Fargo Maintains Outperform on PVH, Lowers Price Target to $125",2019-01-02 09:19:00-05:00,PVH,positive
1044327.0,"Stocks Which Set New 52-Week Low Yesterday, Thurs., Dec. 13, 2018",2018-12-14 11:03:00-05:00,PVH,negative
1044328.0,"Stocks Which Set New 52-Week Low The Last Trading Session, Fri., Dec. 7, 2018",2018-12-10 11:01:00-05:00,PVH,negative
1044329.0,"Buckingham Maintains Buy on PVH, Lowers Price Target to $157",2018-12-03 10:15:00-05:00,PVH,negative
1044330.0,"PVH Corp Analysts: Tommy Hilfiger Is Hot, Calvin Klein Is Not",2018-12-02 17:21:00-05:00,PVH,neutral
1044331.0,"From PVH Earnings Conference Call: Early Holiday Sales, Margins 'Running Ahead' Of Targets",2018-11-30 09:31:00-05:00,PVH,positive
1044332.0,From PVH Q3 Earnings Conference Call: Will Cut Back On A Number Of Planned Investments In Calvin Klein 205 Collection Business,2018-11-30 09:20:00-05:00,PVH,negative
1044333.0,21 Stocks Moving In Friday's Pre-Market Session,2018-11-30 08:04:00-05:00,PVH,neutral
1044334.0,CL King Upgrades PVH to Strong Buy,2018-11-30 08:02:00-05:00,PVH,positive
1044335.0,"Credit Suisse Maintains Outperform on PVH, Lowers Price Target to $125",2018-11-30 07:57:00-05:00,PVH,positive
1044336.0,"A Peek Into The Markets: US Stock Futures Down, Dow Futures Fall Over 100 Points",2018-11-30 06:38:00-05:00,PVH,neutral
1044337.0,"10 Stocks To Watch For November 30, 2018",2018-11-30 05:20:00-05:00,PVH,neutral
1044338.0,UPDATE: PVH Raises FY18 Adj. EPS Guidance From $9.20-$9.25 To $9.33-$9.35 vs $9.33 Estimate,2018-11-29 16:17:00-05:00,PVH,neutral
1044339.0,"PVH Q3 EPS $3.21 Beats $3.14 Estimate, Sales $2.525B Miss $2.53B Estimate; Raises Guidance",2018-11-29 16:15:00-05:00,PVH,negative
1044340.0,Q3 Earnings Outlook For PVH,2018-11-29 07:38:00-05:00,PVH,neutral
1044341.0,"10 Stocks To Watch For November 29, 2018",2018-11-29 05:18:00-05:00,PVH,neutral
1044342.0,"Earnings Scheduled For November 29, 2018",2018-11-29 05:03:00-05:00,PVH,neutral
1044343.0,"PiperJaffray Maintains Overweight on PVH, Lowers Price Target to $175",2018-11-21 08:42:00-05:00,PVH,negative
1044344.0,"Stocks Which Set New 52-Week Low Yesterday, Mon., Nov. 19, 2018",2018-11-20 09:12:00-05:00,PVH,negative
1044345.0,"Stocks Which Set New 52-Week Lows Fri., Nov. 16, 2018",2018-11-19 10:16:00-05:00,PVH,negative
1044346.0,"Credit Suisse Maintains Outperform on PVH, Lowers Price Target to $150",2018-11-19 10:06:00-05:00,PVH,positive
1044347.0,"Stocks Which Set New 52-Week Low Yesterday, Thurs., Nov. 16, 2018",2018-11-16 10:37:00-05:00,PVH,negative
1044348.0,"Stocks Which Set New 52-Week Low Yesterday, Wed., Nov. 14, 2018",2018-11-15 11:37:00-05:00,PVH,negative
1044349.0,8 Biggest Price Target Changes For Friday,2018-11-09 10:26:00-05:00,PVH,neutral
1044350.0,"Benzinga's Top Upgrades, Downgrades For November 9, 2018",2018-11-09 09:02:00-05:00,PVH,positive
1044351.0,"Goldman Sachs Upgrades PVH to Neutral, Lowers Price Target to $130",2018-11-09 06:45:00-05:00,PVH,negative
1044352.0,"Stocks Which Set New 52-Week Low Yesterday, October 22nd",2018-10-23 09:54:00-04:00,PVH,negative
1044353.0,PVH's Calvin Klein Announces Collaboration with Amazon Fashion,2018-10-03 11:01:00-04:00,PVH,positive
1044354.0,"Retail Picks: DA Davidson Bullish On PVH, TJX, Burlington, Canada Goose, Neutral On Lululemon",2018-09-29 09:34:00-04:00,PVH,neutral
1044355.0,"Benzinga's Top Upgrades, Downgrades For September 26, 2018",2018-09-26 09:28:00-04:00,PVH,positive
1044356.0,"DA Davidson Initiates Coverage On PVH with Buy Rating, Announces $167 Price Target",2018-09-26 06:27:00-04:00,PVH,neutral
1044357.0,"PVH CEO Talks Earnings, Calvin Klein and Tommy Hilfiger",2018-08-31 14:24:00-04:00,PVH,neutral
1044358.0,"Lululemon, Paypal, PVH: 'Fast Money' Picks For August 31",2018-08-31 07:26:00-04:00,PVH,neutral
1044359.0,"Deutsche Bank Maintains Buy on PVH, Raises Price Target to $173",2018-08-30 07:59:00-04:00,PVH,neutral
1044360.0,"10 Stocks To Watch For August 30, 2018",2018-08-30 05:31:00-04:00,PVH,neutral
1044361.0,PVH Sees Q3 Adj. EPS $3.10-$3.13 vs $3.13 Est.,2018-08-29 16:19:00-04:00,PVH,neutral
1044362.0,PVH Raises FY18 Adj. EPS Guidance From $9.05-$9.15 To $9.20-$9.25 vs $9.18 Est.,2018-08-29 16:18:00-04:00,PVH,neutral
1044363.0,"PVH Q2 Adj. EPS $2.18 Beats $2.10 Estimate, Sales $2.33B Beat $2.29B Estimate",2018-08-29 16:16:00-04:00,PVH,neutral
1044364.0,"10 Stocks To Watch For August 29, 2018",2018-08-29 05:00:00-04:00,PVH,neutral
1044365.0,"Earnings Scheduled For August 29, 2018",2018-08-29 04:16:00-04:00,PVH,neutral
1044366.0,Burberry Moves For A Comeback Amid A Renaissance In Luxury Brands,2018-08-18 09:18:00-04:00,PVH,neutral
1044367.0,"13F From Omega Shows Reduced Stakes In AMC Networks, DISH Network, First Data, Hess Group, PVH, and Valvoline",2018-08-14 11:28:00-04:00,PVH,neutral
1044368.0,10 Biggest Price Target Changes For Tuesday,2018-06-26 09:51:00-04:00,PVH,neutral
1044369.0,"Goldman Sachs Bullish On Tapestry, VF Corp, Tiffany; Says Sell PVH",2018-06-26 09:45:00-04:00,PVH,neutral
1044370.0,"Credit Suisse Maintains Outperform on PVH, Raises Price Target to $185",2018-06-26 07:32:00-04:00,PVH,positive
1044371.0,"Benzinga's Top Upgrades, Downgrades For June 25, 2018",2018-06-25 09:18:00-04:00,PVH,positive
1044372.0,"Goldman Sachs Initiates Coverage On PVH with Sell Rating, Announces $150 Price Target",2018-06-25 08:45:00-04:00,PVH,neutral
1044373.0,"UBS Initiates Coverage On PVH with Neutral Rating, Announces $180 Price Target",2018-06-21 07:09:00-04:00,PVH,neutral
1044374.0,10 Biggest Price Target Changes For Friday,2018-06-15 09:49:00-04:00,PVH,neutral
1044375.0,"Citigroup Maintains Buy on PVH, Raises Price Target to $188",2018-06-15 06:56:00-04:00,PVH,neutral
1044376.0,"Buckingham Maintains Buy on PVH, Raises Price Target to $188",2018-06-01 09:07:00-04:00,PVH,neutral
1044377.0,10 Biggest Price Target Changes For Thursday,2018-05-31 09:44:00-04:00,PVH,neutral
1044378.0,"PiperJaffray Maintains Overweight on PVH, Raises Price Target to $174",2018-05-31 09:18:00-04:00,PVH,negative
1044379.0,"Citigroup Maintains Buy on PVH, Raises Price Target to $179",2018-05-31 08:56:00-04:00,PVH,neutral
1044380.0,"JP Morgan Maintains Overweight on PVH, Raises Price Target to $180",2018-05-31 08:01:00-04:00,PVH,neutral
1044381.0,"12 Stocks To Watch For May 31, 2018",2018-05-31 04:33:00-04:00,PVH,neutral
1044382.0,"PVH Sees Q2 Adj. EPS $2.05-$2.10 vs $2.02 Est., Sales Growth 10%; FY18 Adj. EPS Outlook Raised From $9-$9.10 to $9.05-$9.15 vs $9.13 Est., Sales Growth 6%",2018-05-30 16:18:00-04:00,PVH,positive
1044383.0,PVH Raises FY18 Outlook,2018-05-30 16:16:00-04:00,PVH,neutral
1044384.0,"PVH Q1 Adj. EPS $2.36 Beats $2.25 Estimate, Sales $2.315B Beat $2.28B Estimate",2018-05-30 16:16:00-04:00,PVH,neutral
1044385.0,"The Week Ahead: Retail Earnings, CEO Conference Appearances In Focus",2018-05-29 11:31:00-04:00,PVH,neutral
1044386.0,7 Biggest Price Target Changes For Friday,2018-05-25 10:20:00-04:00,PVH,neutral
1044387.0,"Deutsche Bank Maintains Buy on PVH, Lowers Price Target to $176",2018-05-25 08:26:00-04:00,PVH,negative
1044388.0,Form 4 Filing Late Tuesday Shows CEO of PVH's Calvin Klein Sold 1.25K Shares at $160.04,2018-04-25 09:28:00-04:00,PVH,positive
1044389.0,"Stocks That Made New 52-Wk Highs Today Include: Citrix Systems, Transociean, Motorola Solutions, Intel, Netflix, NextEra Energy, PVH, Humana, Juniper Networks, and CSX",2018-04-18 11:03:00-04:00,PVH,positive
1044390.0,"Benzinga's Top Analyst Calls From April 2, 2018",2018-04-02 13:16:00-04:00,PVH,positive
1044391.0,"Barclays Maintains Overweight on PVH, Raises Price Target to $173.00",2018-04-02 12:03:00-04:00,PVH,negative
1044392.0,41 Biggest Movers From Thursday,2018-04-02 05:21:00-04:00,PVH,neutral
1044393.0,Wall Street Bullish On PVH After Apparel Retailer Beats Q4 Estimates,2018-03-29 14:44:00-04:00,PVH,neutral
1044394.0,36 Stocks Moving In Thursday's Mid-Day Session,2018-03-29 12:21:00-04:00,PVH,neutral
1044395.0,7 Biggest Price Target Changes For Thursday,2018-03-29 10:19:00-04:00,PVH,neutral
1044396.0,26 Stocks Moving In Thursday's Pre-Market Session,2018-03-29 08:22:00-04:00,PVH,neutral
1044397.0,"Deutsche Bank Maintains Buy on PVH, Raises Price Target to $179.00",2018-03-29 07:58:00-04:00,PVH,neutral
1044398.0,"Credit Suisse Maintains Outperform on PVH, Raises Price Target to $178.00",2018-03-29 07:50:00-04:00,PVH,positive
1044399.0,"A Peek Into The Markets: US Stock Futures Up Ahead Of Jobless Claims, Consumer Sentiment Data",2018-03-29 07:23:00-04:00,PVH,neutral
1044400.0,"10 Stocks To Watch For March 29, 2018",2018-03-29 05:00:00-04:00,PVH,neutral
1044401.0,"PVH Sees Q1 Adj. EPS $2.20-$2.25 vs $1.96 Est., Sales Growth 15%; FY18 Adj. EPs $9-$9.10 vs $7.82 Est., Sales Growth 7%",2018-03-28 16:18:00-04:00,PVH,positive
1044402.0,"PVH Q4 Adj. EPS $1.58 Beats $1.46 Est., Sales $2.499B Beats $2.35B Est.",2018-03-28 16:16:00-04:00,PVH,neutral
1044403.0,"10 Stocks To Watch For March 28, 2018",2018-03-28 04:53:00-04:00,PVH,neutral
1044404.0,"Earnings Scheduled For March 28, 2018",2018-03-28 04:00:00-04:00,PVH,neutral
1044405.0,"Credit Suisse Initiates Coverage On PVH with Outperform Rating, Announces $175.00 Price Target",2018-03-12 16:49:00-04:00,PVH,positive
1044406.0,"Benzinga's Top Upgrades, Downgrades For February 15, 2018",2018-02-15 10:24:00-05:00,PVH,positive
1044407.0,"Instinet Initiates Coverage On PVH Corp with Neutral Rating, Announces $150.00 Price Target",2018-02-15 07:42:00-05:00,PVH,neutral
1044408.0,2 Reasons Deutsche Turned Bullish On PVH Corp,2018-02-07 14:11:00-05:00,PVH,neutral
1044409.0,"Benzinga's Top Upgrades, Downgrades For February 7, 2017",2018-02-07 09:19:00-05:00,PVH,positive
1044410.0,Deutsche Bank Upgrades PVH to Buy,2018-02-07 07:54:00-05:00,PVH,neutral
1044411.0,The Top 10 Value Stocks In The S&P 500,2018-01-19 13:12:00-05:00,PVH,positive
1044412.0,13G Filing Shows JP Morgan Raised Stake In PVH From 2.96M Shares To 5.493M Shares Or 7.1%,2018-01-11 12:15:00-05:00,PVH,positive
1044413.0,"Oxford, PVH: The Retailers In Fashion At B. Riley FBR",2017-12-22 16:24:00-05:00,PVH,neutral
1044414.0,"Benzinga's Top Upgrades, Downgrades For December 22, 2017",2017-12-22 09:59:00-05:00,PVH,positive
1044415.0,"B. Riley Reinstates Buy on PVH, Announces $155.00",2017-12-22 09:12:00-05:00,PVH,neutral
1044416.0,PVH Shares Down 0.53%; Earlier Wells Fargo Maintained Outperform Rating And Raised Price Target From $138 to $158 Citing 'Signs Of Life' Heading Into December And Firm's Increased Estimates For FY17/FY18 EPS From $7.70-$8.68 to $7.80-$8.80,2017-12-05 15:19:00-05:00,PVH,positive
1044417.0,Strong Start To The Holiday Season Aids PVH Corp Outlook,2017-12-05 12:38:00-05:00,PVH,positive
1044418.0,5 Biggest Price Target Changes For Thursday,2017-11-30 09:51:00-05:00,PVH,neutral
1044419.0,UPDATE: PVH Raises FY17 Adj. EPS Outlook From $7.60-$7.70 To $7.78-$7.80 vs $7.72 Est.,2017-11-29 16:16:00-05:00,PVH,neutral
1044420.0,"PVH Corp. Reports Q3 Adj. EPS $3.02 vs $2.91 Est., Sales $2.357B vs $2.34B Est.; Raises Outlook",2017-11-29 16:16:00-05:00,PVH,neutral
1044421.0,"8 Stocks To Watch For November 29, 2017",2017-11-29 04:39:00-05:00,PVH,neutral
1044422.0,"Earnings Scheduled For November 29, 2017",2017-11-29 03:41:00-05:00,PVH,neutral
1044423.0,4 Biggest Price Target Changes For Monday,2017-11-27 09:38:00-05:00,PVH,neutral
1044424.0,Calvin Klein to Sell New Underwear Only on Amazon -DJ,2017-11-16 05:55:00-05:00,PVH,positive
1044425.0,"13F Filing From Greenlight Capital Dissolved Stakes In PVH, And Raised Stake In Adient",2017-11-14 16:47:00-05:00,PVH,neutral
1044426.0,Credit Suisse Adjusts Its Top Picks List In A Record-Breaking Market,2017-11-08 17:10:00-05:00,PVH,positive
1044427.0,"Einhorn's Positions In HPE, Micron, Tempur Sealy Create Curious Volatility",2017-10-24 13:07:00-04:00,PVH,positive
1044428.0,PVH Shares Unaffected Amid Report David Einhorn's Greenlight Exited Long Position In Co. During Q3,2017-10-24 10:39:00-04:00,PVH,positive
1044429.0,"Benzinga's Top Upgrades, Downgrades For October 24, 2017",2017-10-24 09:20:00-04:00,PVH,positive
1044430.0,"Deutsche Bank Initiates Coverage On PVH with Hold Rating, Announces $131.00 Price Target",2017-10-24 07:57:00-04:00,PVH,neutral
1044431.0,From Nike To Netflix: What Teens Love And Hate In 2017,2017-10-17 15:39:00-04:00,PVH,positive
1044432.0,Benzinga's Option Alert Recap From October 16,2017-10-16 16:34:00-04:00,PVH,positive
1044433.0,PVH Option Alert: Nov 17 $120 Calls Sweep (37) at the Bid: 916 @ $6.5 vs 51 OI; Ref=$124.73,2017-10-16 12:40:00-04:00,PVH,positive
1044434.0,Retail Analyst Shares His Department And Specialty Picks,2017-10-10 15:48:00-04:00,PVH,positive
1044435.0,7 Retailers To Play Favorable Q3 Weather,2017-09-26 15:23:00-04:00,PVH,positive
1044436.0,"Benzinga's Top Upgrades, Downgrades For September 20, 2017",2017-09-20 09:12:00-04:00,PVH,positive
1044437.0,"Barclays Initiates Coverage On PVH with Overweight Rating, Announces $147.00 Price Target",2017-09-20 06:11:00-04:00,PVH,negative
1044438.0,"Bernstein Initiates Coverage On PVH with Market Perform Rating, Announces $142.00 Price Target",2017-09-12 06:38:00-04:00,PVH,neutral
1044439.0,"Goldman Sachs Retailing Conference Begins Today, Presenters Include: Gap, Carter's, Dollar Tree, Wayfair, Michaels Companies, PVH, Macy's and Dollar General",2017-09-06 09:17:00-04:00,PVH,neutral
1044440.0,5 Biggest Price Target Changes For Thursday,2017-08-24 09:44:00-04:00,PVH,neutral
1044441.0,25 Stocks Moving In Thursday's Pre-Market Session,2017-08-24 08:12:00-04:00,PVH,neutral
1044442.0,"12 Stocks To Watch For August 24, 2017",2017-08-24 05:20:00-04:00,PVH,neutral
1044443.0,PVH Sees Q3 Adj. EPS $2.88-$2.92 vs $2.82 Est.,2017-08-23 16:18:00-04:00,PVH,neutral
1044444.0,PVH Sees FY17 Adj. EPS $7.60-$7.70 vs $7.54 Est.,2017-08-23 16:17:00-04:00,PVH,neutral
1044445.0,"PVH Reports Q2 Adj. EPS $1.69 vs $1.64 Est., Sales $2.07B vs $2.04B Est.",2017-08-23 16:17:00-04:00,PVH,neutral
1044446.0,"A Peek Into The Markets: U.S. Stock Futures Down Ahead Of Earnings, Economic Data",2017-08-23 07:06:00-04:00,PVH,neutral
1044447.0,"10 Stocks To Watch For August 23, 2017",2017-08-23 05:00:00-04:00,PVH,neutral
1044448.0,"Earnings Scheduled For August 23, 2017",2017-08-23 04:48:00-04:00,PVH,neutral
1044449.0,"13F From Leon Cooperman's Omega Advisors Shows Increased Stake In Shire, Zynga, Valvoline, Time, and PVH",2017-08-14 10:30:00-04:00,PVH,positive
1044450.0,"Lightning Round: Jim Cramer Gives His Opinion On Under Armour, Weight Watchers And More",2017-08-11 07:50:00-04:00,PVH,neutral
1044451.0,"Benzinga's Top Upgrades, Downgrades For August 3, 2017",2017-08-03 09:30:00-04:00,PVH,positive
1044452.0,"Bank of America Reinstates Buy on PVH, Announces $146.00",2017-08-03 07:58:00-04:00,PVH,neutral
1044453.0,"Lightning Round: Jim Cramer Advises His Viewers On Hertz, Macy's And More",2017-07-26 07:13:00-04:00,PVH,neutral
1044454.0,Fast Money Traders Share Their Amazon-Proof Picks,2017-07-18 07:16:00-04:00,PVH,positive
1044455.0,"Benzinga's Top Upgrades, Downgrades For July 17, 2017",2017-07-17 09:30:00-04:00,PVH,positive
1044456.0,"Buckingham Assumes PVH at Buy, Announces price target $127.00",2017-07-17 08:15:00-04:00,PVH,neutral
1044457.0,Fast Money Traders Share Their Picks In Retail Sector,2017-07-14 07:12:00-04:00,PVH,positive
1044459.0,5 Biggest Price Target Changes For Monday,2017-06-26 10:17:00-04:00,PVH,neutral
1044460.0,"Companies Holding Shareholder Meetings Today Include: Abercrombie & Fitch, Time Warner, Airgain, Honda Motor, Hostess Brands, Editas Medicine, Juno Therapeutics, Sony, Semtech, Novovax, PVH, Yelp, and Tailored Brands",2017-06-15 09:14:00-04:00,PVH,neutral
1044463.0,The 19 Stocks On Leon Cooperman's Radar,2017-05-31 16:44:00-04:00,PVH,neutral
1044464.0,Credit Suisse Upgrades PVH to Outperform,2017-05-30 08:40:00-04:00,PVH,positive
1044465.0,15 Biggest Mid-Day Gainers For Thursday,2017-05-25 12:28:00-04:00,PVH,neutral
1044466.0,PVH Pulls Off A Rare Feat In Retail These Days: The Beat And Raise Quarter,2017-05-25 11:45:00-04:00,PVH,neutral
1044467.0,"Benzinga's Top Upgrades, Downgrades For May 25, 2017",2017-05-25 09:35:00-04:00,PVH,positive
1044468.0,The Market In 5 Minutes,2017-05-25 09:00:00-04:00,PVH,neutral
1044469.0,25 Stocks Moving In Thursday's Pre-Market Session,2017-05-25 08:07:00-04:00,PVH,neutral
1044470.0,"McDonald's, PepsiCo, PVH: Fast Money Picks For May 25",2017-05-25 07:07:00-04:00,PVH,neutral
1044471.0,JP Morgan Upgrades PVH to Overweight,2017-05-25 06:25:00-04:00,PVH,neutral
1044472.0,"12 Stocks To Watch For May 25, 2017",2017-05-25 05:33:00-04:00,PVH,neutral
1044473.0,Benzinga's Option Alert Recap From May 24,2017-05-24 16:50:00-04:00,PVH,positive
1044474.0,"PVH Sees Q2 Adj. EPS $1.60-$1.63 vs $1.56 Est., Sales To Increase ~5% YoY; FY17 Adj. EPS $7.40-$7.50 vs $7.39 Est., Sales To Increase ~3%",2017-05-24 16:18:00-04:00,PVH,positive
1044475.0,"PVH Reports Q1 Adj. EPS $1.65 vs $1.60 Est., Sales $1.989B vs $1.95B Est.",2017-05-24 16:16:00-04:00,PVH,neutral
1044476.0,Option Alert: PVH Jun 100 Puts: 1050 @  ASK  $3.50: 1219 traded vs 1390 OI:  Earnings today After Close  $100.27 Ref,2017-05-24 13:55:00-04:00,PVH,positive
1044477.0,"Earnings Scheduled For May 24, 2017",2017-05-24 05:26:00-04:00,PVH,neutral
1044478.0,"12 Stocks To Watch For May 24, 2017",2017-05-24 05:10:00-04:00,PVH,neutral
1044479.0,"World Retail Congress Continues Today; Presenters Include PVH, Estee Lauder's Jo Malone, Facebook, And Coca-Cola",2017-04-05 08:33:00-04:00,PVH,neutral
1044480.0,"Benzinga's Top Upgrades, Downgrades For April 4, 2017",2017-04-04 09:36:00-04:00,PVH,positive
1044481.0,"World Retail Congress Continues Today; Presenters Include PVH, Zebra Technologies, Macy's, Lululemon, Estee Lauder's Jo Malone, And Honeywell",2017-04-04 08:29:00-04:00,PVH,neutral
1044482.0,"B. Riley Initiates Coverage On PVH With Buy, Announces $125 Price Target",2017-04-04 06:30:00-04:00,PVH,neutral
1044483.0,Here's What To Expect From This Year's World Retail Congress,2017-04-03 13:35:00-04:00,PVH,neutral
1044484.0,"PVH, Li & Fung Limited Form New Strategic Supply Chain Partnership",2017-03-24 04:21:00-04:00,PVH,negative
1044485.0,15 Biggest Mid-Day Gainers For Thursday,2017-03-23 12:29:00-04:00,PVH,neutral
1044486.0,"PreMarket Prep Recap, March 23: The Trade In The Financials Just Changed",2017-03-23 12:05:00-04:00,PVH,neutral
1044487.0,5 Biggest Price Target Changes For Thursday,2017-03-23 10:48:00-04:00,PVH,neutral
1044488.0,Bagging The Paisleys: Wunderlich's Bullish Thesis On Vera Bradley And PVH,2017-03-23 09:36:00-04:00,PVH,neutral
1044489.0,18 Stocks Moving In Thursday's Pre-Market Session,2017-03-23 08:23:00-04:00,PVH,neutral
1044490.0,A Peek Into The Markets: U.S. Stock Futures Edge Higher; Yellen Speech In Focus,2017-03-23 07:37:00-04:00,PVH,neutral
1044491.0,"10 Stocks To Watch For March 23, 2017",2017-03-23 05:14:00-04:00,PVH,neutral
1044492.0,PVH Adds $750M to Buyback Plan,2017-03-22 16:15:00-04:00,PVH,neutral
1044493.0,"PVH Corp. Sees FY17 EPS $7.30-$7.40 vs. $7.27 Est., Q1 EPS $1.58-$1.60 vs. $1.57 Est.",2017-03-22 16:15:00-04:00,PVH,neutral
1044494.0,"PVH Reports Q4 Adj. EPS $1.23 vs $1.19 Est., Sales $2.1B vs $2.09B Est.",2017-03-22 16:15:00-04:00,PVH,neutral
1044495.0,"8 Stocks To Watch For March 22, 2017",2017-03-22 06:15:00-04:00,PVH,neutral
1044496.0,"Earnings Scheduled For March 22, 2017",2017-03-22 04:55:00-04:00,PVH,neutral
1044497.0,"PVH Announces Will Buy True&Co., No Terms Disclosed",2017-03-16 16:30:00-04:00,PVH,negative
1044498.0,Wells Fargo's Retail Analyst Is Bullish On The Sector: Here's Why,2017-02-27 14:38:00-05:00,PVH,positive
1044499.0,Will Sequins Once More Grace This Weekend's Red Carpet?,2017-02-24 14:59:00-05:00,PVH,positive
1044500.0,Kate Spade Is For Sale; Wunderlich Says 'We Believe It Will Happen',2017-02-16 14:50:00-05:00,PVH,neutral
1044501.0,Nordstrom The Latest To Cut Business Ties With A Trump,2017-02-03 10:54:00-05:00,PVH,negative
1044502.0,Evercore ISI Group Downgrades PVH To Hold,2017-02-01 08:40:00-05:00,PVH,neutral
1044503.0,Benzinga's Option Alert Recap From January 30,2017-01-30 17:15:00-05:00,PVH,positive
1044504.0,Option Alert: PVH Feb 85.0 Puts Sweep: 637 @  ASK  $0.75: 950 traded vs 4606 OI:  Earnings 3/22 After Close (est)  $90.56 Re,2017-01-30 10:28:00-05:00,PVH,positive
1044505.0,"PVH Reports Will Buy Tommy Hilfiger Men's Tailored Clothing Unit for North America from Marcraft, No Terms Disclosed",2017-01-24 16:12:00-05:00,PVH,negative
1044506.0,"PVH Corp. to Acquire Tommy Hilfiger Men's Tailored Clothing Business for North America from Marcraft, Terms Not Disclosed",2017-01-24 16:02:00-05:00,PVH,neutral
1044507.0,Why PVH Is Bucking The Retail Trend,2017-01-06 10:06:00-05:00,PVH,neutral
1044508.0,"PVH's Prelim Results Show Luxury Brands May Be Immune To Woes At Partners Like Macy's, Kohl's",2017-01-05 13:37:00-05:00,PVH,positive
1044509.0,"Leon Cooperman on CNBC, Out Positive On PVH",2017-01-05 12:21:00-05:00,PVH,positive
1044510.0,"PVH  Says It Sees Q4, FY16 Guidance TO Be At Least At Top End Of Guidance Ranges Of $6.70-$6.75",2017-01-05 09:04:00-05:00,PVH,positive
1044511.0,7 Biggest Price Target Changes For Wednesday,2017-01-04 09:55:00-05:00,PVH,neutral
1044512.0,Look Beyond Trump Policy For Strong Fundamentals In Clothiers,2017-01-04 08:47:00-05:00,PVH,positive
1044513.0,Will A Trump Presidency Be A Blessing Or Curse For American CEOs?,2016-12-19 08:25:00-05:00,PVH,negative
1044514.0,"Designer Clothing, Handbag Stocks Trading Down Today: Ralph Lauren -4.97%, PVH -5.53%, Michael Kors -3.17%, Coach -3.92%, Kate Spade -2.94%",2016-12-15 13:35:00-05:00,PVH,neutral
1044515.0,"Jim Cramer Gives His Opinion On VF Corp, Under Armour And TJX Companies",2016-12-09 08:22:00-05:00,PVH,neutral
1044516.0,How Does Amazon's Q3 Performance Read Through For The Rest Of Retail?,2016-12-08 10:44:00-05:00,PVH,neutral
1044517.0,"Apparel Stocks Trading Higher: G-III Up 8%, Vince Holding 6.5%, lululemon 4%, PVH, Iconix 3%, Under Armour, Columbia 2.5%, Ralph Lauren 2%",2016-12-05 11:45:00-05:00,PVH,neutral
1044518.0,PVH Higher After Q3 Beat,2016-12-01 11:23:00-05:00,PVH,neutral
1044519.0,7 Biggest Price Target Changes For Thursday,2016-12-01 09:39:00-05:00,PVH,neutral
1044520.0,"The Market In 5 Minutes: Fast Food Downgrades, Jobless Claims Hit 5-Month High",2016-12-01 09:01:00-05:00,PVH,neutral
1044521.0,A Peek Into The Markets: U.S. Stock Futures Flat Ahead Of Economic Data,2016-12-01 07:50:00-05:00,PVH,neutral
1044522.0,"Keep an Eye on These 12 Stocks for December 1, 2016",2016-12-01 04:53:00-05:00,PVH,neutral
1044523.0,Q3 2016 Real-Time Call Brief,2016-11-30 19:00:00-05:00,PVH,neutral
1044524.0,Q3 2016 Real-Time Call Brief,2016-11-30 19:00:00-05:00,PVH,neutral
1044525.0,"PVH Sees FY16 EPS $6.70-$6.75, Rev. To Increase 2%",2016-11-30 16:17:00-05:00,PVH,positive
1044526.0,"PVH Corp Reports Q3 EPS $2.60 vs. Prior Year Quarter $2.66, Rev. $2.24B vs. Est. $2.23B",2016-11-30 16:16:00-05:00,PVH,neutral
1044527.0,PVH CEO To Appear On Cramer's Mad Money Tonight,2016-11-30 09:57:00-05:00,PVH,negative
1044528.0,"10 Stocks To Watch For November 30, 2016",2016-11-30 05:17:00-05:00,PVH,neutral
1044529.0,"Earnings Scheduled For November 30, 2016",2016-11-30 04:25:00-05:00,PVH,neutral
1044530.0,Who's Who In Shoe Stocks?,2016-11-28 08:45:00-05:00,PVH,neutral
1044531.0,Your Luxury Brands Earnings Cheat Sheet,2016-11-02 11:53:00-04:00,PVH,negative
1044532.0,Option Alert: PVH Jan17 120 Calls Sweep: 500 @  ASK  $4.80: 500 traded vs 33 OI: $114.64 Ref,2016-10-10 13:24:00-04:00,PVH,positive
1044533.0,Stocks Hitting 52-Week Highs,2016-10-07 10:20:00-04:00,PVH,neutral
1044534.0,"Facebook, PVH, ConAgre: Fast Money Halftime Report Final Trades For October 3",2016-10-03 15:31:00-04:00,PVH,neutral
1044535.0,Guggenheim Initiates Coverage On 21 Retail Stocks,2016-09-30 08:53:00-04:00,PVH,neutral
1044536.0,Guggenheim Securities Initiates Coverage on PVH at Buy,2016-09-30 07:07:00-04:00,PVH,positive
