Unnamed: 0,title,date,stock,sentiment
1044115.0,7 Stocks Moving In Thursday's After-Hours Session,2020-06-11 16:49:00-04:00,PVH,neutral
1044116.0,PVH shares are trading lower after the company reported worse-than-expected Q1 EPS and sales results.,2020-06-11 16:25:00-04:00,PVH,neutral
1044117.0,PVH: Q1 Earnings Insights,2020-06-11 16:24:00-04:00,PVH,neutral
1044118.0,"PVH Q1 Adj. EPS $(3.03) Misses $(1.28) Estimate, Sales $1.34B Miss $1.40B Estimate",2020-06-11 16:15:00-04:00,PVH,negative
1044119.0,"Shares of several retail & apparel companies are trading lower following an increase in coronavirus cases in some US states that have reopened, leading to concerns of a second wave of the virus.",2020-06-11 10:34:00-04:00,PVH,positive
1044120.0,"B of A Securities Maintains Buy on PVH, Raises Price Target to $74",2020-06-11 08:19:00-04:00,PVH,positive
1044121.0,A Peek Into The Markets: US Stock Futures Tumble Ahead Of Jobless Claims Report,2020-06-11 05:56:00-04:00,PVH,neutral
1044122.0,"7 Stocks To Watch For June 11, 2020",2020-06-11 04:45:00-04:00,PVH,neutral
1044123.0,"Earnings Scheduled For June 11, 2020",2020-06-11 04:14:00-04:00,PVH,neutral
1044124.0,Shares of several retail & apparel companies are trading lower as equities sell off following the recent rally. Stocks have rallied over the past week amid optimism towards the US economy reopening and investors have potentially taken some profits following the run up.,2020-06-09 10:51:00-04:00,PVH,positive
1044125.0,"Shares of several retail and apparel companies are trading higher on continued upward momentum surrounding the economy reopening, which would increase consumer spending and economic activity. New York City moved into phase one of its reopening plan on Monday.",2020-06-08 10:55:00-04:00,PVH,positive
1044126.0,"Benzinga's Top Upgrades, Downgrades For June 8, 2020",2020-06-08 09:44:00-04:00,PVH,positive
1044127.0,"Wells Fargo Downgrades PVH to Equal-Weight, Announces $64 Price Target",2020-06-08 07:28:00-04:00,PVH,positive
1044128.0,"Shares of several retail and apparel companies are trading higher following strong US jobs data and continued optimism amid the reopening of the economy. As the economy reopenings, consumer spending in the sector should increase.",2020-06-05 10:21:00-04:00,PVH,positive
1044129.0,Shares of several companies in the broader consumer discretionary space are trading higher as markets continue to gain on optimism over an economic reopening as well as a smaller-than-expected drop in nonfarm payrolls. The economy reopening could mean more consumer spending which is good for the sector.,2020-06-03 10:21:00-04:00,PVH,positive
1044130.0,"Deutsche Bank Maintains Hold on PVH, Lowers Price Target to $44",2020-06-03 08:36:00-04:00,PVH,negative
1044131.0,PVH Reports Daniel Grieder Steeping Down As CEO Of Tommy Hilfiger Global & PVH Europe,2020-06-02 09:05:00-04:00,PVH,neutral
1044132.0,"Shares of several consumer discretionary companies are trading higher as equities gain amid continued optimism towards a rebound in economic activity, which could lead to a potential rebound in spending.",2020-06-01 11:04:00-04:00,PVH,positive
1044133.0,"Cramer Shares His Thoughts On Teva, Oxford Industries And More",2020-05-29 06:40:00-04:00,PVH,positive
1044134.0,Walmart Partners With ThredUp To Woo Millennials With Second-Hand Clothing,2020-05-27 04:49:00-04:00,PVH,positive
1044135.0,Shares of several consumer discretionary companies are trading higher as equities rally on coronavirus vaccine hopes as well as a pickup in economic activity as some US states reopen businesses. A vaccine could mean a faster return to discretionary spending.,2020-05-26 12:24:00-04:00,PVH,positive
1044136.0,PVH Corp. Announces Phased Reopening Of Global Stores,2020-05-19 06:43:00-04:00,PVH,neutral
1044137.0,Shares of several consumer goods companies are trading lower on market weakness as investor uncertainty grows following quarterly earnings results from multiple companies.,2020-05-01 11:33:00-04:00,PVH,negative
1044138.0,Shares of several apparel and footwear companies are trading lower as markets dip following US jobless claims and personal spending data. Lower personal spending could be a negative catalyst for consumer goods such as apparel.,2020-04-30 12:00:00-04:00,PVH,negative
1044139.0,Cramer Weighs In On How The 'New Normal' Will Hurt Kohl's And PVH,2020-04-28 07:48:00-04:00,PVH,negative
1044140.0,Shares of several consumer goods companies are trading higher as equities gain on macro optimism after Gildead's Remdesivir drug showed some effectiveness in treating coronavirus patients. This has raised hopes of a sooner economic recovery.,2020-04-17 10:53:00-04:00,PVH,positive
1044141.0,80 Biggest Movers From Yesterday,2020-04-08 04:12:00-04:00,PVH,neutral
1044142.0,"PVH Reports Drew Down $750M From Its $1B+ Revolving Credit Line; Suspended Buyback, Dividend, Highlights Sale Of Speedo For $170M In Cash",2020-04-07 18:02:00-04:00,PVH,negative
1044143.0,"UPDATE: PVH Says ~75% Of Store, Office, Warehouse Associates Will Be Laid Off",2020-04-07 18:01:00-04:00,PVH,neutral
1044144.0,"PVH Outlines 8 Measures To Protect Liquidity Position, Maintain Financial Strength",2020-04-07 18:00:00-04:00,PVH,positive
1044145.0,Tuesday's Market Minute: Covid-19 Fuels Demise Of The U.S. Mall,2020-04-07 09:28:00-04:00,PVH,neutral
1044146.0,84 Biggest Movers From Yesterday,2020-04-07 05:47:00-04:00,PVH,neutral
1044147.0,"UBS Maintains Buy on PVH, Lowers Price Target to $107",2020-04-06 12:29:00-04:00,PVH,negative
1044148.0,"Benzinga's Top Upgrades, Downgrades For April 3, 2020",2020-04-03 09:54:00-04:00,PVH,positive
1044149.0,"JP Morgan Maintains Neutral on PVH, Raises Price Target to $40",2020-04-03 09:18:00-04:00,PVH,positive
1044150.0,"Citigroup Maintains Neutral on PVH, Lowers Price Target to $35",2020-04-03 09:12:00-04:00,PVH,negative
1044151.0,"Deutsche Bank Reiterates Hold on PVH, Lowers Price Target to $45",2020-04-03 08:58:00-04:00,PVH,negative
1044152.0,RBC Capital Downgrades PVH to Sector Perform,2020-04-03 05:57:00-04:00,PVH,neutral
1044153.0,60 Stocks Moving In Thursday's Mid-Day Session,2020-04-02 12:40:00-04:00,PVH,neutral
1044154.0,"Piper Sandler Maintains Overweight on PVH, Lowers Price Target to $60",2020-04-02 11:31:00-04:00,PVH,negative
1044155.0,"Wells Fargo Maintains Overweight on PVH, Lowers Price Target to $50",2020-04-02 09:08:00-04:00,PVH,negative
1044156.0,"PVH CEO Talks Shock Of Positive Coronavirus Test, 'Painful' Time For Retail",2020-04-02 08:27:00-04:00,PVH,positive
1044157.0,PVH shares are trading higher after the company reported better-than-expected Q4 EPS and sales results. The company also noted it has over $1 billion in cash and available borrowings.,2020-04-02 07:21:00-04:00,PVH,positive
1044158.0,30 Stocks Moving in Thursday's Pre-Market Session,2020-04-02 07:16:00-04:00,PVH,neutral
1044159.0,"A Peek Into The Markets: US Stock Futures Gain, Jobless Claims In Focus",2020-04-02 05:59:00-04:00,PVH,positive
1044160.0,"5 Stocks To Watch For April 2, 2020",2020-04-02 05:10:00-04:00,PVH,neutral
1044161.0,PVH Reports Q4 Earnings Beat,2020-04-01 16:26:00-04:00,PVH,neutral
1044162.0,PVH shares are trading higher after the company reported better-than-expected Q4 EPS and sales results. The company noted it has over $1 billion in cash and available borrowings.,2020-04-01 16:24:00-04:00,PVH,positive
1044163.0,PVH Says Has Over $1B In Cash And Available Borrowings,2020-04-01 16:17:00-04:00,PVH,neutral
1044164.0,PVH Says Q1 And FY20 Results Will Include 'Significant' Negative Impact As A Result Of Coronavirus Pandemic; Says Unable To Provide 2020 Guidance,2020-04-01 16:16:00-04:00,PVH,negative
1044165.0,"PVH Q4 Adj. EPS $1.88 Beats $1.81 Estimate, Sales $2.6B Beat $2.5B Estimate",2020-04-01 16:15:00-04:00,PVH,neutral
1044166.0,Q4 Earnings Outlook For PVH,2020-04-01 08:07:00-04:00,PVH,neutral
1044167.0,"5 Stocks To Watch For April 1, 2020",2020-04-01 05:17:00-04:00,PVH,neutral
1044168.0,"Earnings Scheduled For April 1, 2020",2020-04-01 04:39:00-04:00,PVH,neutral
1044169.0,"Wells Fargo Maintains Overweight on PVH, Lowers Price Target to $55",2020-03-30 12:36:00-04:00,PVH,negative
1044170.0,Stocks That Hit 52-Week Lows On Monday,2020-03-23 10:34:00-04:00,PVH,negative
1044171.0,"Morgan Stanley Maintains Overweight on PVH, Lowers Price Target to $78",2020-03-19 09:15:00-04:00,PVH,negative
1044172.0,"PVH To Temporarily Close All Co.-Operated Retail Stores Across North America, Europe Mar. 17-Mar. 29",2020-03-16 12:07:00-04:00,PVH,neutral
1044173.0,"Wells Fargo Maintains Overweight on PVH, Lowers Price Target to $81",2020-03-16 09:41:00-04:00,PVH,negative
1044174.0,Stocks That Hit 52-Week Lows On Friday,2020-03-13 11:13:00-04:00,PVH,negative
1044175.0,Stocks That Hit 52-Week Lows On Thursday,2020-03-12 12:10:00-04:00,PVH,negative
1044176.0,Stocks That Hit 52-Week Lows On Wednesday,2020-03-11 11:41:00-04:00,PVH,negative
1044177.0,Stocks That Hit 52-Week Lows On Friday,2020-03-06 11:22:00-05:00,PVH,negative
1044178.0,"Morgan Stanley Maintains Overweight on PVH, Lowers Price Target to $112",2020-02-19 08:53:00-05:00,PVH,negative
1044179.0,10 Biggest Price Target Changes For Tuesday,2020-02-18 08:35:00-05:00,PVH,neutral
1044180.0,"Wells Fargo Maintains Overweight on PVH, Lowers Price Target to $110",2020-02-18 07:24:00-05:00,PVH,negative
1044181.0,"Coronavirus Fears Back On Big Earnings Day As Alibaba, PepsiCo, Nvidia All Report",2020-02-13 10:05:00-05:00,PVH,negative
1044182.0,PVH Says Majority Of Chinese Stores Closed Due To Coronavirus Outbreak,2020-02-12 11:03:00-05:00,PVH,neutral
1044183.0,"PVH Reaffirms Q4 Adj. EPS At Least $1.79, FY19 Adj. EPS At Least $9.45",2020-02-12 08:31:00-05:00,PVH,neutral
1044184.0,"UPDATE: PVH Says Stores That Remain Open In China Are Operating For Limited Hours, Experiencing 'Significantly' Lower Traffic, Sales",2020-02-12 08:30:00-05:00,PVH,negative
1044185.0,"PVH Offers Update Amid Coronavirus, Says Majority Of Calvin Klein, Tommy Hilfiger Stores In China Are Temporarily Closed",2020-02-12 08:29:00-05:00,PVH,neutral
1044186.0,"BMO Capital Initiates Coverage On PVH with Market Perform Rating, Announces $94 Price Target",2020-02-04 05:20:00-05:00,PVH,neutral
1044187.0,"B of A Securities Reiterates Buy on PVH, Raises Price Target to $120",2020-01-10 10:20:00-05:00,PVH,positive
1044188.0,"PVH Corp Sees Q4 Adj. EPS $1.79+, FY19 Adj. EPS $9.45+ vs $9.45 Est.",2020-01-09 09:12:00-05:00,PVH,neutral
1044189.0,PVH Reports Will Sell Speedo North America Business To Pentland Group For $170M In Cash,2020-01-09 09:10:00-05:00,PVH,neutral
1044190.0,Shares of retail companies are trading higher amid multiple positive US-China trade developments.,2019-12-12 10:16:00-05:00,PVH,positive
1044191.0,"Shares of several retail and apparel companies are trading higher. Strength may be related to large Black Friday and Cyber Monday sales numbers as well as US-China trade reports, as the sector has heavy China exposure.",2019-12-04 13:01:00-05:00,PVH,positive
1044192.0,"Barclays Maintains Equal-Weight on PVH, Lowers Price Target to $98",2019-11-27 10:12:00-05:00,PVH,negative
1044193.0,"Benzinga's Top Upgrades, Downgrades For November 27, 2019",2019-11-27 09:47:00-05:00,PVH,positive
1044194.0,"DA Davidson Maintains Buy on PVH, Raises Price Target to $115",2019-11-27 09:21:00-05:00,PVH,neutral
1044195.0,10 Biggest Price Target Changes For Wednesday,2019-11-27 07:49:00-05:00,PVH,neutral
1044196.0,"RBC Capital Maintains Outperform on PVH, Raises Price Target to $110",2019-11-27 07:37:00-05:00,PVH,neutral
1044197.0,"Evercore ISI Group Downgrades PVH to In-Line, Lowers Price Target to $110",2019-11-27 06:24:00-05:00,PVH,negative
1044198.0,"Bank of America Maintains Buy on PVH, Raises Price Target to $111",2019-11-26 07:33:00-05:00,PVH,neutral
1044199.0,PVH shares are trading higher after the company reported better-than-expected Q3 EPS and sales results. The company also raised FY19 EPS guidance.,2019-11-25 16:21:00-05:00,PVH,positive
1044200.0,PVH Corp Sees Q4 Adj. EPS $1.77-$1.79 vs $1.83 Est.,2019-11-25 16:18:00-05:00,PVH,neutral
1044201.0,PVH Corp Raises FY19 Adj. EPS Guidance From $9.30-$9.40 To $9.43-$9.45,2019-11-25 16:17:00-05:00,PVH,neutral
1044202.0,"PVH Q3 Adj. EPS $3.10 Beats $2.99 Estimate, Sales $2.6B Beat $2.54B Estimate",2019-11-25 16:16:00-05:00,PVH,neutral
1044203.0,PVH Option Alert: Dec 20 $100 Calls Sweep (52) near the Ask: 548 @ $5.6 vs 1232 OI; Earnings 11/25 After Close Ref=$100.3939,2019-11-25 14:50:00-05:00,PVH,positive
1044204.0,"7 Stocks To Watch For November 25, 2019",2019-11-25 05:49:00-05:00,PVH,neutral
1044205.0,"Earnings Scheduled For November 25, 2019",2019-11-25 05:38:00-05:00,PVH,neutral
1044206.0,"Barclays Initiates Coverage On PVH with Equal-Weight Rating, Announces $100 Price Target",2019-11-13 07:23:00-05:00,PVH,neutral
1044207.0,"PVH corp shares are trading higher, potentially in sympathy with Ralph Lauren, which rallied after reporting better-than-expected Q2 sales.",2019-11-07 10:38:00-05:00,PVH,positive
1044208.0,"Benzinga's Top Upgrades, Downgrades For October 28, 2019",2019-10-28 09:58:00-04:00,PVH,positive
1044209.0,A Peek Into The Markets: US Stock Futures Signal Higher Start On Wall Street,2019-10-28 07:32:00-04:00,PVH,neutral
1044210.0,"JP Morgan Downgrades PVH to Neutral, Announces $93 Price Target",2019-10-28 06:32:00-04:00,PVH,positive
1044211.0,PVH Option Alert: Nov 15 $100 Calls Sweep (2) near the Ask: 2054 @ $0.726 vs 82 OI; Earnings 11/29 After Close [est] Ref=$91.31,2019-10-25 09:42:00-04:00,PVH,positive
1044212.0,"Calvin Klein, Inc. And Swatch Group Agree to End Licensing Agreement",2019-10-22 11:00:00-04:00,PVH,positive
1044213.0,Report: Rising Number Of Working Women Fuels Growth In Designer Handbags,2019-10-18 16:29:00-04:00,PVH,positive
1044214.0,Shares of several retail companies are trading higher in sympathy with the overall market after President Trump made positive remarks on US-China trade talks. Trump is scheduled to meet with Chinese Vice Premier Liu He at the White House today.,2019-10-11 10:57:00-04:00,PVH,positive
1044215.0,"Zipping It Up: Levi's, Wrestling With Wholesale, Manages To Slightly Exceed Analyst Expectations",2019-10-09 09:10:00-04:00,PVH,neutral
1044216.0,"Piper Jaffray Maintains Overweight on PVH, Raises Price Target to $101",2019-09-17 07:38:00-04:00,PVH,negative
1044217.0,"Notable Insider Buys In The Past Week: Coty, LyondellBasell, PVH",2019-09-08 11:04:00-04:00,PVH,neutral
1044218.0,60 Biggest Movers From Yesterday,2019-09-05 05:20:00-04:00,PVH,neutral
1044219.0,Bank of America: G-III Has A Tariff Problem,2019-09-04 14:35:00-04:00,PVH,negative
1044220.0,"Top 10 Movers Via Benzinga Pro's Screener Tool For Mid-Day of Wednesday., September 04, 2019",2019-09-04 12:31:00-04:00,PVH,positive
1044221.0,46 Stocks Moving In Wednesday's Mid-Day Session,2019-09-04 12:27:00-04:00,PVH,neutral
1044222.0,"PVH shares are trading higher after the company's CEO Emanuel Chirico bought 133,155 shares at an average price of $74.99 per share. When an insider buys shares, the market may perceive it as a sign of confidence in the company's outlook.",2019-09-04 09:16:00-04:00,PVH,positive
1044223.0,"Benzinga's Top Upgrades, Downgrades For September 3, 2019",2019-09-03 09:42:00-04:00,PVH,positive
1044224.0,A Peek Into The Markets: US Stock Futures Down; Dow Futures Tumble Over 200 Points,2019-09-03 07:11:00-04:00,PVH,neutral
1044225.0,Bernstein Upgrades PVH to Outperform,2019-09-03 06:44:00-04:00,PVH,neutral
1044226.0,"Bulls And Bears Of The Week: Altria, Apple, Netflix, Slack And More",2019-08-31 15:37:00-04:00,PVH,neutral
1044227.0,"UPDATE: Morgan Stanley Maintains Overweight On PVH, Lowers Target To $140 As Firm Notes 'Despite near term macro uncertainty, we are encouraged by PVH's underlying strengths and its 7.4x P/E remains compelling vs. its 14x 5-yr historical avg'",2019-08-30 12:07:00-04:00,PVH,positive
1044228.0,10 Biggest Price Target Changes For Friday,2019-08-30 09:04:00-04:00,PVH,neutral
1044229.0,"Goldman Sachs Maintains Sell on PVH, Lowers Price Target to $73",2019-08-30 08:13:00-04:00,PVH,negative
1044230.0,"Morgan Stanley Maintains Overweight on PVH, Lowers Price Target to $140",2019-08-30 08:07:00-04:00,PVH,negative
1044231.0,Cowen Slashes PVH Price Target: 'We Need More Clarity On Sustainable Free Cash Flow',2019-08-29 15:29:00-04:00,PVH,positive
1044232.0,"Cowen & Co. Maintains Market Perform on PVH, Lowers Price Target to $80",2019-08-29 13:01:00-04:00,PVH,negative
1044233.0,"UPDATE: Wells Fargo On PVH Also Notes 'What is the primary issue out of the print, in our view? Tommy in NA having problems'",2019-08-29 10:54:00-04:00,PVH,negative
1044234.0,"UPDATE: Wells Fargo Maintains Outperform On PVH, Lowers Target To $95 As Firm Notes 'For a company that does not typically cut numbers, we view the material cut to 2H as a clearing event'",2019-08-29 10:54:00-04:00,PVH,positive
1044235.0,PVH shares are trading higher after the company reported better-than-expected Q2 financial results and analysts reaffirmed positive ratings on the stock.,2019-08-29 10:08:00-04:00,PVH,positive
1044236.0,"Wells Fargo Maintains Outperform on PVH, Lowers Price Target to $95",2019-08-29 09:31:00-04:00,PVH,positive
1044237.0,"Credit Suisse Maintains Outperform on PVH, Raises Price Target to $105",2019-08-29 08:15:00-04:00,PVH,positive
1044238.0,"Bank of America Reiterates Buy on PVH, Lowers Price Target to $93",2019-08-29 08:09:00-04:00,PVH,negative
1044239.0,"12 Stocks To Watch For August 29, 2019",2019-08-29 05:04:00-04:00,PVH,neutral
1044240.0,"PVH Beats Earnings Estimates, Lowers Guidance",2019-08-28 16:34:00-04:00,PVH,negative
1044241.0,PVH Sees FY19 EPS Between $9.30-$9.40 vs $9.98 Est.,2019-08-28 16:22:00-04:00,PVH,neutral
1044242.0,PVH Sees Q3 EPS Between $2.95-$3.00,2019-08-28 16:20:00-04:00,PVH,neutral
1044243.0,"PVH Q2 EPS $2.1 Beats $1.89 Estimate, Sales $2.36B Beat $2.33B Estimate",2019-08-28 16:16:00-04:00,PVH,neutral
1044244.0,"Morgan Stanley Maintains Overweight on PVH, Lowers Price Target to $148",2019-08-28 08:04:00-04:00,PVH,negative
1044245.0,PVH Q2 Earnings Preview,2019-08-28 07:44:00-04:00,PVH,neutral
1044246.0,"10 Stocks To Watch For August 28, 2019",2019-08-28 04:50:00-04:00,PVH,neutral
1044247.0,"Earnings Scheduled For August 28, 2019",2019-08-28 04:09:00-04:00,PVH,neutral
1044248.0,Shares of retail companies are trading lower after Macy's reported weak Q2 results and cut FY19 guidance.,2019-08-14 09:43:00-04:00,PVH,negative
1044249.0,Why The Set Up Ahead Of Retail's Q2 Earnings Season Is 'Poor',2019-08-13 07:40:00-04:00,PVH,neutral
1044250.0,Stocks That Hit 52-Week Lows Of Monday,2019-08-12 11:14:00-04:00,PVH,negative
1044251.0,New 52-Week Lows For Monday Morning,2019-08-05 13:16:00-04:00,PVH,negative
1044252.0,"Benzinga's Top Upgrades, Downgrades For July 17, 2019",2019-07-17 09:16:00-04:00,PVH,positive
1044253.0,"Goldman Sachs Downgrades PVH to Sell, Lowers Price Target to $82",2019-07-17 07:18:00-04:00,PVH,negative
1044254.0,Former Victoria's Secret CMO Jann Parish Joins Green Growth Brands,2019-06-25 11:42:00-04:00,PVH,positive
1044255.0,"UPDATE: UBS Reiterates Buy On PVH, Lowers Target To $144 As Firm Believes 'when macro concerns recede, we anticipate a strong P/E pop'; Firms 'DCF suggests PVH is worth 12.5x FY20E EPS and we see 69% PT upside potential'",2019-06-03 12:41:00-04:00,PVH,positive
1044256.0,"UBS Earlier Reiterated Buy on PVH, Lowered Price Target to $144",2019-06-03 12:37:00-04:00,PVH,negative
1044257.0,"PVH and G-III Apparel Announce an Agreement for G-III to Design, Produce and Distribute Calvin Klein Jeans in the US and Canada",2019-06-03 07:04:00-04:00,PVH,positive
1044258.0,"Nomura Maintains Neutral on PVH, Lowers Price Target to $98",2019-05-31 12:09:00-04:00,PVH,negative
1044259.0,"Morgan Stanley Maintains Overweight on PVH, Lowers Price Target to $151",2019-05-31 11:49:00-04:00,PVH,negative
1044260.0,"Citi Maintains Neutral on PVH, Lowers Price Target to $91",2019-05-31 11:07:00-04:00,PVH,negative
1044261.0,56 Biggest Movers From Yesterday,2019-05-31 06:14:00-04:00,PVH,neutral
1044262.0,Analyst Confident PVH's Growth Story Is Intact,2019-05-30 13:19:00-04:00,PVH,positive
1044263.0,44 Stocks Moving In Thursday's Mid-Day Session,2019-05-30 12:27:00-04:00,PVH,neutral
1044264.0,"UPDATE: Bank Of America Sees Several Tangible Drivers For PVH 'including improved marketing and product to drive better sales at Calvin Klein, the margin benefit from its restructuring initiatives, and the sales and EPS benefit from recent acquisitions'",2019-05-30 11:29:00-04:00,PVH,positive
1044265.0,"Bank Of America Reiterates Buy On PVH, Reiterates $165 Target As Firm Notes 'Nearly every apparel retailer is guiding for a 2H acceleration, but we think PVH is among the best positioned to deliver this acceleration'",2019-05-30 11:29:00-04:00,PVH,positive
1044266.0,"Wells Fargo Maintains Outperform on PVH, Lowers Price Target to $120",2019-05-30 09:58:00-04:00,PVH,positive
1044267.0,"From PVH Q1 Earnings Conference Call: For Q2, Seeing A Soft Macro Picture",2019-05-30 09:57:00-04:00,PVH,neutral
1044268.0,"Deutsche Bank Maintains Buy on PVH, Lowers Price Target to $145",2019-05-30 09:07:00-04:00,PVH,negative
1044269.0,25 Stocks Moving In Thursday's Pre-Market Session,2019-05-30 08:10:00-04:00,PVH,neutral
1044270.0,"PVH Corp shares are trading lower after the company reported worse-than-expected Q1 sales and said the 'volatile and challenging macroeconomic backdrop' has continued into the next quarter, which is expected to pressure Q2 results.",2019-05-30 07:44:00-04:00,PVH,negative
1044271.0,"A Peek Into The Markets: US Stock Futures Gain Ahead Of Earnings, Economic Data",2019-05-30 07:02:00-04:00,PVH,positive
1044272.0,"12 Stocks To Watch For May 30, 2019",2019-05-30 04:51:00-04:00,PVH,neutral
1044273.0,4 Stocks Moving In Wednesday's After-Hours Session,2019-05-29 17:13:00-04:00,PVH,neutral
1044274.0,PVH Shares Fall Despite Q1 Earnings Beat,2019-05-29 16:23:00-04:00,PVH,positive
1044275.0,"PVH Sees FY19 Adj. EPS $10.20-$10.30, Sales Growth ~3% Year Over Year",2019-05-29 16:16:00-04:00,PVH,positive
1044276.0,"PVH Q1 EPS $2.46 Beats $2.44 Estimate, Sales $2.237B Miss $2.37B Estimate",2019-05-29 16:15:00-04:00,PVH,negative
1044277.0,"7 Stocks To Watch For May 29, 2019",2019-05-29 04:53:00-04:00,PVH,neutral
1044278.0,"Earnings Scheduled For May 29, 2019",2019-05-29 04:05:00-04:00,PVH,neutral
1044279.0,28 Stocks Moving In Wednesday's Pre-Market Session,2019-05-22 08:29:00-04:00,PVH,neutral
1044280.0,PVH Names Stefan Larsson Pres,2019-05-21 16:26:00-04:00,PVH,neutral
1044281.0,"PVH Reports Licensing Deal With NIKE For Men's Underwear Business, No Terms Disclosed",2019-04-30 10:02:00-04:00,PVH,negative
1044282.0,A Few Key Takeaways From Cowen's Off-Price Retail Store Visits,2019-04-17 18:09:00-04:00,PVH,neutral
1044283.0,"Calvin Klein Concerns Are Turning Into Positives For PVH, Morgan Stanley Says In Bullish Initiation",2019-04-09 13:24:00-04:00,PVH,positive
1044284.0,"Benzinga's Top Upgrades, Downgrades For April 9, 2019",2019-04-09 09:16:00-04:00,PVH,positive
1044285.0,"Morgan Stanley Initiates Coverage On PVH with Overweight Rating, Announces $164 Price Target",2019-04-09 07:37:00-04:00,PVH,negative
1044286.0,"UBS Maintains Buy on PVH, Raises Price Target to $159",2019-04-01 09:44:00-04:00,PVH,neutral
1044287.0,58 Biggest Movers From Yesterday,2019-03-29 06:13:00-04:00,PVH,neutral
1044288.0,50 Stocks Moving In Thursday's Mid-Day Session,2019-03-28 12:50:00-04:00,PVH,neutral
1044289.0,Mid-Morning Market Update: Markets Open Higher; Accenture Beats Q2 Expectations,2019-03-28 10:22:00-04:00,PVH,neutral
1044290.0,From PVH Q4 Earnings Conference Call: CEO Says Remains Cautious On North American Landscape For 2019,2019-03-28 09:29:00-04:00,PVH,negative
1044291.0,PVH shares are trading higher after the company reported better-than-expected Q4 results and announced a $750M stock buyback program.,2019-03-28 08:30:00-04:00,PVH,positive
1044292.0,36 Stocks Moving In Thursday's Pre-Market Session,2019-03-28 08:11:00-04:00,PVH,neutral
1044293.0,A Peek Into The Markets: US Stock Futures Flat; GDP Report In Focus,2019-03-28 07:07:00-04:00,PVH,neutral
1044294.0,"8 Stocks To Watch For March 28, 2019",2019-03-28 04:33:00-04:00,PVH,neutral
1044295.0,6 Stocks Moving In Wednesday's After-Hours Session,2019-03-27 16:47:00-04:00,PVH,neutral
1044296.0,PVH Corp shares are trading higher after the company reported better-than-expected Q4 results and added $750 million to its buyback.,2019-03-27 16:34:00-04:00,PVH,positive
1044297.0,"PVH Sees Q1 Adj. EPS $2.40-$2.45 vs $2.45 Estimate; Sees FY19 Adj. EPS $10.30-$10.40, Sales Growth 4% Year Over Year",2019-03-27 16:16:00-04:00,PVH,positive
1044298.0,"PVH Adds $750M To Buyback, Extends To Jun. 2023",2019-03-27 16:15:00-04:00,PVH,positive
1044299.0,"PVH Q4 Adj. EPS $1.84 Beats $1.76 Estimate, Sales $2.48B Beat $2.41B Estimate",2019-03-27 16:15:00-04:00,PVH,neutral
1044300.0,"11 Stocks To Watch For March 27, 2019",2019-03-27 04:19:00-04:00,PVH,neutral
1044301.0,"Earnings Scheduled For March 27, 2019",2019-03-27 04:07:00-04:00,PVH,neutral
1044302.0,PVH Corp. Announces Agreement to Reacquire the License for Tommy Hilfiger in Central and South East Asia from Dickson Concepts; Terms Not Disclosed,2019-03-24 20:49:00-04:00,PVH,positive
1044303.0,"Citigroup Assumes PVH With Downgraded Rating, From Buy To Neutral, Lowers Price Target From $140 To $120",2019-03-18 09:22:00-04:00,PVH,negative
1044304.0,PVH Corp. Announces Agreement to Acquire Gazal Corporation Limited for A$6.00/Share,2019-02-21 03:53:00-05:00,PVH,positive
1044305.0,Cooperman's Omega 13F Shows Liquidated ~260K Share Stake In PVH,2019-02-14 14:14:00-05:00,PVH,positive
1044306.0,"Cowen Says PVH's Growth Expectations Are Too High, Downgrades Stock",2019-01-22 13:48:00-05:00,PVH,positive
1044307.0,10 Biggest Price Target Changes For Tuesday,2019-01-22 09:46:00-05:00,PVH,neutral
