Unnamed: 0,title,date,stock,sentiment
1049897.0,Qualcomm Option Alert: Fri $56.5 Calls at the Ask: 3000 @ $1.24 vs 2373 OI; Ref=$56.38,2017-07-19 11:31:00-04:00,QCOM,positive
1049898.0,"Apple Contractors Gang Up On Qualcomm, File Antitrust Complaint",2017-07-19 10:47:00-04:00,QCOM,negative
1049899.0,Caution Still The Watchword But Stocks Hit Record Highs As Earnings Mostly Strong,2017-07-19 10:08:00-04:00,QCOM,positive
1049900.0,A Peek Into The Markets: U.S. Stock Futures Mixed; Morgan Stanley Profit Tops Views,2017-07-19 07:35:00-04:00,QCOM,positive
1049901.0,"10 Stocks To Watch For July 19, 2017",2017-07-19 05:07:00-04:00,QCOM,neutral
1049902.0,"Earnings Scheduled For July 19, 2017",2017-07-19 04:49:00-04:00,QCOM,neutral
1049903.0,"Four Apple Contractors, Including Foxconn Accuse Qualcomm of Violating Sherman Act -Reuters",2017-07-19 04:41:00-04:00,QCOM,negative
1049904.0,Encouraging Signs For Semiconductor ETFs,2017-07-12 08:28:00-04:00,QCOM,positive
1049905.0,"Chip Stocks On the Move: AMD, Nvidia, Xilinx, Rambus And More",2017-07-10 09:39:00-04:00,QCOM,neutral
1049906.0,Apple And Qualcomm: The Drama Continues,2017-07-07 11:46:00-04:00,QCOM,neutral
1049907.0,The Market In 5 Minutes,2017-07-07 09:05:00-04:00,QCOM,neutral
1049908.0,A Peek Into The Markets: U.S. Stock Futures Mostly Flat; All Eyes On Jobs Report,2017-07-07 07:23:00-04:00,QCOM,neutral
1049909.0,"Stocks To Watch For July 7, 2017",2017-07-07 04:32:00-04:00,QCOM,neutral
1049910.0,Qualcomm Files Patent Infringement Complaints Against Apple,2017-07-06 16:54:00-04:00,QCOM,negative
1049911.0,QUALCOMM Shares Indicated Up 0.9% After Hours Following News Of Infringement Complaints Against Apple; Apple Shares Indicated Down 0.2%,2017-07-06 16:34:00-04:00,QCOM,negative
1049912.0,"UPDATE: Qualcomm Seeks A Cease and Desist Order Barring Further Sales Of 'Infringing' Apple Products Including iPhones, Expects ITC Investigation Will Commence In August, Case To Be Tried Next Year",2017-07-06 16:32:00-04:00,QCOM,neutral
1049913.0,"Qualcomm Files Patent Infringment Complaints Against Apple With Int'l Trade Commission, and In U.S. Federal Court",2017-07-06 16:30:00-04:00,QCOM,negative
1049914.0,M&A Roundup: 7 Deals Expected To Close Mid-2017,2017-07-02 17:14:00-04:00,QCOM,neutral
1049915.0,Wall Street Might Still Be Underestimating The Impact Of Qualcomm's Spat With Apple,2017-06-28 09:37:00-04:00,QCOM,neutral
1049916.0,"Benzinga's Top Upgrades, Downgrades For June 28, 2017",2017-06-28 09:26:00-04:00,QCOM,positive
1049919.0,Software And Services Slump Plagues BlackBerry In Q1,2017-06-26 14:17:00-04:00,QCOM,neutral
1049920.0,"The Week In Chip Stocks: AMD, Intel And More",2017-06-26 11:42:00-04:00,QCOM,neutral
1049921.0,Nikkei Asian Review Reports Qualcomm Eyes China's Entry-Level Smartphone Market,2017-06-23 09:39:00-04:00,QCOM,neutral
1049922.0,BlackBerry Q1 Doesn't Connect With Investors,2017-06-23 09:07:00-04:00,QCOM,neutral
1049923.0,"Hello, Mr. Chips: A Look At AMD's Wild Year",2017-06-22 12:42:00-04:00,QCOM,neutral
1049924.0,Taiiwan Receives 7nm Chip Orders from Qualcomm -DigiTimes,2017-06-22 05:01:00-04:00,QCOM,neutral
1049925.0,The Latest On Apple's Legal Battle With Qualcomm,2017-06-21 11:17:00-04:00,QCOM,negative
1049929.0,NXP Shares Spiked Parabolically; Traders Attributed To Street Insider Report Qualcomm Will Have To Raise Its Offer For The Co.,2017-06-20 15:03:00-04:00,QCOM,positive
1049931.0,"Qualcomm Makes Strategic Investment in Amionx, As Part Of Investment, Qualcomm President Derek Aberle To Join Amionx Board",2017-06-20 09:04:00-04:00,QCOM,positive
1049932.0,UBS On The Qualcomm-NXP Deal: 'Significant Uncertainties Persist',2017-06-19 15:22:00-04:00,QCOM,negative
1049933.0,Tech CEOs Descend On The White House: Who Won't Be There?,2017-06-19 12:20:00-04:00,QCOM,neutral
1049934.0,"Deutsche Bank Reinstates Hold on Qualcomm, Announces $62.00",2017-06-19 07:42:00-04:00,QCOM,neutral
1049935.0,5 Biggest Price Target Changes For Thursday,2017-06-15 09:47:00-04:00,QCOM,neutral
1049936.0,Qualcomm Reports Received Antitrust Clearance For NXP Semi By Taiwan FTC,2017-06-15 08:33:00-04:00,QCOM,neutral
1049937.0,BlackBerry's Q1 Earnings Due June 23: Expect Continued Turnaround Progress,2017-06-15 08:22:00-04:00,QCOM,positive
1049943.0,"TMT Players Like Amazon, Facebook Could Readily Get Into Mobile If They Gain Access To Spectrum",2017-06-12 09:08:00-04:00,QCOM,positive
1049946.0,Qualcomm Reports Deal With LifeScan,2017-06-12 07:30:00-04:00,QCOM,neutral
1049947.0,"Qualcomm Says It's Confident It Can Address EU Concerns On NXP Deal, Says Acquisition Is 'Complimentary'",2017-06-09 11:31:00-04:00,QCOM,positive
1049951.0,Hearing BlackBerry Will Introduce A New Hypervisor For Autos; Qualcomm Will Bundle With Auto Chips,2017-06-07 09:49:00-04:00,QCOM,neutral
1049952.0,Fast Money Picks For June 1,2017-06-01 09:10:00-04:00,QCOM,neutral
1049953.0,"Qualcomm Reports Extension of Cash Tender Offer for NXP Semi til Jun. 28, 2018",2017-05-31 07:30:00-04:00,QCOM,neutral
1049954.0,Elliott Management Among Investors Pressuring NXP Semiconductors to Renegotiate Acquisition Deal with Qualcomm -Bloomberg,2017-05-31 06:36:00-04:00,QCOM,negative
1049955.0,BlackBerry Rallies On Qualcomm Settlement Before Tuesday Tank,2017-05-30 16:03:00-04:00,QCOM,neutral
1049956.0,Blackberry Higher Off Confirmation Of Qualcomm Royalty Payment,2017-05-26 11:16:00-04:00,QCOM,neutral
1049957.0,BlackBerry Reports Arbitration Panel in Qualcomm Case Issued Final Award Providing Payment from Qualcomm to BlackBerry for $940M,2017-05-26 08:04:00-04:00,QCOM,positive
1049958.0,Vetr Crowd Downgrades Blackberry After String Of Positive News,2017-05-23 16:42:00-04:00,QCOM,positive
1049959.0,What The Massive SoftBank Investment 'Vision Fund' Means For Tech,2017-05-23 13:42:00-04:00,QCOM,positive
1049960.0,6 Important Questions Apple Investors Should Be Asking,2017-05-23 12:18:00-04:00,QCOM,positive
1049961.0,The Blackberry Comeback Story Continues,2017-05-22 15:14:00-04:00,QCOM,neutral
1049962.0,Alphabet Makes The Case For Its AI Products At Google I/O Event,2017-05-22 12:17:00-04:00,QCOM,neutral
1049963.0,5 Biggest Price Target Changes For Monday,2017-05-22 09:58:00-04:00,QCOM,neutral
1049964.0,"Benzinga's Top Upgrades, Downgrades For May 22, 2017",2017-05-22 09:28:00-04:00,QCOM,positive
1049965.0,The Market In 5 Minutes,2017-05-22 09:07:00-04:00,QCOM,neutral
1049966.0,There's Substantial Upside In Qualcomm If NXP Deal Closes By Year-End,2017-05-22 09:04:00-04:00,QCOM,positive
1049967.0,A Peek Into The Markets: U.S. Stock Futures Edge Higher Ahead Of Fed Speakers,2017-05-22 07:19:00-04:00,QCOM,neutral
1049968.0,JP Morgan Upgrades Qualcomm to Overweight,2017-05-22 06:40:00-04:00,QCOM,neutral
1049969.0,"Qualcomm, Google to Enable Daydream Standalone Virtual Reality Headsets",2017-05-17 14:47:00-04:00,QCOM,neutral
1049970.0,"Qualcomm Files Breach of Contract Complaint against Apple's Manufacturers for Non-Payment of Royalties, Apple Instructs Manufactures To Stop Paying Qualcomm",2017-05-17 07:31:00-04:00,QCOM,negative
1049971.0,Marc Chaikin's Bullish Thesis On 3 Small-Cap Tech Stocks,2017-05-16 15:31:00-04:00,QCOM,neutral
1049972.0,Qualcomm Likely to See AP Shipments Rise 12.7% in China Market in Q2 -DigiTimes,2017-05-15 04:38:00-04:00,QCOM,neutral
1049973.0,13F From Appaloosa Shows Liquidated Stake In Qualcomm,2017-05-12 16:12:00-04:00,QCOM,neutral
1049974.0,Third Point Takes New Stake In Qualcomm,2017-05-12 16:10:00-04:00,QCOM,neutral
1049975.0,Seeing Notable Block Trade In Qualcomm; ~ 1.033M Shares At $54.575,2017-05-11 12:55:00-04:00,QCOM,negative
1049976.0,"From Sprint's Newsroom, Qualcomm, SoftBank and Sprint Announce Collaboration on 2.5 GHz 5G",2017-05-10 12:40:00-04:00,QCOM,neutral
1049977.0,"Qualcomm Expected to Ramp up Shipments of Snapdragon 630, 660 CPUs -DigiTimes",2017-05-10 04:52:00-04:00,QCOM,neutral
1049978.0,Benzinga's Bulls And Bears For The Past Week: Semiconductors And Warren Buffett,2017-05-08 10:08:00-04:00,QCOM,neutral
1049979.0,Hearing Qualcomm Said To Be Seeking U.S. Import Ban On Apple's iPhones,2017-05-03 15:57:00-04:00,QCOM,negative
1049980.0,Seeing Notable Block Trade in Qualcomm: ~1.02M Shares at $54.56/Share,2017-05-03 15:02:00-04:00,QCOM,negative
1049981.0,"Apple Earnings: Analyst Expects Overall 'Solid' Quarter, But Longer-Term Concerns Remain",2017-05-02 10:45:00-04:00,QCOM,neutral
1049982.0,"Qualcomm Reports Extension of Tender Offer for NXPI to 5 p.m. EDT, May 31, 2017",2017-05-02 07:32:00-04:00,QCOM,neutral
1049983.0,Alan Knuckman's Qualcomm Options Trade,2017-05-02 06:30:00-04:00,QCOM,neutral
1049984.0,"EU Antitrust Regulators to Rule on Qualcomm, NXP Deal by June 9 -Reuters",2017-05-02 06:09:00-04:00,QCOM,neutral
1049985.0,"Qualcomm to Set up Smartphone-chip JV with Datang, Beijing Jianguang Asset Management -DigiTimes",2017-05-02 05:55:00-04:00,QCOM,positive
1049986.0,Qualcomm's Future With Apple Remains Unclear,2017-05-01 12:03:00-04:00,QCOM,negative
1049987.0,Watch These 8 Huge Call Purchases In Monday Trade,2017-05-01 04:03:00-04:00,QCOM,positive
1049988.0,Benzinga's Option Alert Recap From April 28,2017-04-28 16:34:00-04:00,QCOM,positive
1049989.0,Option Alert: Qualcomm May 12th 56.5 Calls Sweep: 1841 @  ASK  $0.12: 1843 traded vs 35 OI:  Earnings 7/19 After Close  $53.78 Ref,2017-04-28 15:53:00-04:00,QCOM,positive
1049990.0,Standpoint Research Upgrades Qualcomm to Buy,2017-04-28 14:24:00-04:00,QCOM,neutral
1049991.0,20 Biggest Mid-Day Losers For Friday,2017-04-28 12:20:00-04:00,QCOM,negative
1049992.0,Qualcomm Attempts To Recover,2017-04-28 11:26:00-04:00,QCOM,neutral
1049993.0,"Apple Spokesperson Responds to Qualcomm Release: Co. Has Suspended Payments to Qualcomm, Citing Need for 'Correct Amount' to be Named by Court",2017-04-28 10:30:00-04:00,QCOM,negative
1049994.0,Bitter Bite: Qualcomm Updates Q3 Guidance On Apple Interference,2017-04-28 09:11:00-04:00,QCOM,negative
1049995.0,22 Stocks Moving In Friday's Pre-Market Session,2017-04-28 08:20:00-04:00,QCOM,neutral
1049996.0,UPDATE: Qualcomm Announces Apple Has Indicated Will Continue This Behavior Until Dispute with Qualcomm is Resolved,2017-04-28 07:43:00-04:00,QCOM,negative
1049997.0,"UPDATE: Qualcomm Announces Co. Has Been Informed by Apple That Apple is Withholding Payments to Contract Manufacturers for Royalties Those Manufacturers Owe Under Licenses with Qualcomm for Sales During Qtr. Ended Mar. 31, 2017",2017-04-28 07:42:00-04:00,QCOM,neutral
1049998.0,UPDATE: Qualcomm Says 'Apple Continues to Improperly Interfere with Co.'s Deals with Contract Manufacturers,2017-04-28 07:40:00-04:00,QCOM,neutral
1049999.0,UPDATE: Qualcomm Cuts Q3 Sales Outlook from $5.3B-$6.1B to $4.8B-$5.6B vs $5.94B Est.,2017-04-28 07:39:00-04:00,QCOM,negative
1050000.0,UPDATE: Qualcomm Cuts Q3 Adj. EPS Guidance from $0.90-$1.15 to $0.75-$0.85 vs $1.19 Est.,2017-04-28 07:38:00-04:00,QCOM,negative
1050001.0,Qualcom Cuts Q3 Outlook,2017-04-28 07:38:00-04:00,QCOM,negative
1050002.0,Specialty DRAM Prices to Rise Says One Firm -DigiTimes,2017-04-24 04:34:00-04:00,QCOM,neutral
1050003.0,"Qualcomm Signs 3G/4G Patent License Agreement with Smartron, Adding to More Than 330 Existing Qualcomm Licensees Around the World",2017-04-24 04:18:00-04:00,QCOM,positive
1050004.0,Q1 Earnings Results Collide With Geopolitics And Oil,2017-04-20 12:59:00-04:00,QCOM,negative
1050005.0,"Structural Headwinds, Apple Feud Weigh On Qualcomm's Outlook",2017-04-20 12:29:00-04:00,QCOM,negative
1050006.0,Qualcomm's Apple Quarrel Likely To Remain Overhang Despite Strong Quarter,2017-04-20 09:34:00-04:00,QCOM,negative
1050007.0,25 Stocks Moving In Thursday's Pre-Market Session,2017-04-20 08:12:00-04:00,QCOM,neutral
1050008.0,Qualcomm Rises After Beating Q2 Estimates,2017-04-20 07:01:00-04:00,QCOM,negative
1050009.0,"10 Stocks To Watch For April 20, 2017",2017-04-20 04:53:00-04:00,QCOM,neutral
1050010.0,Qualcomm's Q2 Executive Presentation Includes Slide of 'Apple related items of note',2017-04-19 16:29:00-04:00,QCOM,neutral
1050011.0,"QUALCOMM Sees Q3 Sales $5.3B-$6.1B vs $5.95B Est., Adj. EPS $0.90-$1.15 vs $1.10 Est.",2017-04-19 16:17:00-04:00,QCOM,neutral
1050012.0,"QUALCOMM Reports Q2 Adj. EPS $1.34 vs $1.19 Est., Sales $6B vs $5.9B Est.",2017-04-19 16:16:00-04:00,QCOM,neutral
1050013.0,Qualcomm Downgraded Amid iPhone 8 Share Loss,2017-04-19 10:36:00-04:00,QCOM,neutral
1050014.0,UPDATE: Rosenblatt on Qualcomm: 'Our recent supply chain work suggests that Qualcomm's iPhone 8 market share will be down to 35% from 60%',2017-04-19 09:27:00-04:00,QCOM,positive
1050015.0,"Rosenblatt Downgrades Qualcomm to Neutral, Lowers Price Target to $56",2017-04-19 09:25:00-04:00,QCOM,negative
1050016.0,"10 Stocks To Watch For April 19, 2017",2017-04-19 05:58:00-04:00,QCOM,neutral
1050017.0,"Earnings Scheduled For April 19, 2017",2017-04-19 04:57:00-04:00,QCOM,neutral
1050018.0,BlackBerry Still Has Work To Do After $815-Million Settlement With Qualcomm,2017-04-13 12:04:00-04:00,QCOM,neutral
1050019.0,Hearing Qualcomm 'Possibly Looking' at Xilinx,2017-04-13 09:37:00-04:00,QCOM,neutral
1050020.0,Incremental Value Of Blackberry's Arbitration Award Estimated At $1.54 Per Share,2017-04-13 08:48:00-04:00,QCOM,positive
1050021.0,Watch These 6 Huge Call Purchases In Thursday Trade,2017-04-13 06:40:00-04:00,QCOM,positive
1050022.0,11 Biggest Mid-Day Gainers For Wednesday,2017-04-12 12:38:00-04:00,QCOM,neutral
1050023.0,BlackBerry Shares Above $9 For First Time Since January 2016,2017-04-12 10:24:00-04:00,QCOM,positive
1050024.0,"The BlackBerry-Qualcomm Arbitration Case, Explained",2017-04-12 08:38:00-04:00,QCOM,neutral
1050025.0,"Qualcomm Says Although It Does Not Agree With Arbitration Panel Decision, It Is Binding And Not Appealable; Company Notes This Decision Is Limited To BlackBerry And Has No Impacts On Agreements With Any Other Licensee",2017-04-12 08:07:00-04:00,QCOM,negative
1050026.0,Qualcomm Shares Down 0.6% Following News of BlackBerry Win in Case Against Co.,2017-04-12 07:46:00-04:00,QCOM,positive
1050027.0,Blackberry Awarded $814M In Arbitration Against Qualcomm,2017-04-12 07:45:00-04:00,QCOM,positive
1050028.0,The Market In 5 Minutes,2017-04-11 09:24:00-04:00,QCOM,neutral
1050029.0,Jana's 9% Stake In Whole Foods Doesn't Guarantee Success,2017-04-10 15:58:00-04:00,QCOM,negative
1050030.0,Apple's Move To Ditch A Supplier Was 'Ruthless' But In-Line With Long-Term Vision,2017-04-05 10:03:00-04:00,QCOM,positive
1050031.0,IHS Says 2016 was Year of Recovery for Global Semiconductor Market -DigiTimes,2017-04-05 04:16:00-04:00,QCOM,neutral
1050032.0,"Qualcomm Reports Extension of Tender Offer for NXP from Apr. 3, 2017 to May 2, 2017",2017-04-04 07:32:00-04:00,QCOM,neutral
1050033.0,Qualcomm Seeks Dismissal of FTC Suit Accusing Company of Anticompetitive Behavior -Wall Street Journal,2017-04-04 04:28:00-04:00,QCOM,negative
1050034.0,8 Things We Like About The New Samsung Galaxy S8,2017-03-31 14:21:00-04:00,QCOM,positive
1050035.0,Macquarie Initiates Coverage On Qualcomm at Neutral,2017-03-31 07:03:00-04:00,QCOM,neutral
1050036.0,Qualcomm Shares Quiet as Co. Issues Press Release Highlighting Snapdragon 835 Platform Will Power the Gigabit LTE on Samsung's New Galaxy S8,2017-03-29 11:21:00-04:00,QCOM,positive
1050037.0,Fast Money Traders Share Their Picks After Dow Jones Records Longest Losing Streak In 6 Years,2017-03-28 08:51:00-04:00,QCOM,negative
1050038.0,"PreMarket Prep Recap, March 20: Major Volatility At Friday's Close And Why Disney Is In For A Big Quarter",2017-03-20 10:47:00-04:00,QCOM,neutral
1050039.0,4 Lessons Latin American Startups Can Teach U.S. Businesses In The Trump Era,2017-03-16 17:08:00-04:00,QCOM,neutral
1050040.0,NXP Semi Shares Volatile Over Last Hour; CTFN M&A Reporting Just Issued Alert on NXP/Qualcomm,2017-03-16 12:15:00-04:00,QCOM,positive
1050041.0,ParkerVision's 80% Gains Have Evaporated,2017-03-14 11:48:00-04:00,QCOM,positive
1050042.0,"Qualcomm Contracted Win Semiconductors to Manufacture GaAs Power Amplifier, RF Solutions -DigiTimes",2017-03-14 04:26:00-04:00,QCOM,positive
1050043.0,Gadfly's Ovide: Intel Is Spending Money 'Like It's 1999',2017-03-13 14:15:00-04:00,QCOM,positive
1050044.0,"Taiwan Semiconductor Manufacturing Receives Orders for HPC Chips from Nvidia, Qualcomm -DigiTimes",2017-03-13 04:24:00-04:00,QCOM,neutral
1050045.0,The Challenges Of Building A Successful Business In Latin America: Accomplished Entrepreneur Shares His Experience,2017-03-11 19:50:00-05:00,QCOM,positive
1050046.0,Your Guide To Patent Play Exposure,2017-03-11 19:34:00-05:00,QCOM,positive
1050047.0,Watch These 5 Huge Put Purchases In Friday Trade,2017-03-10 04:24:00-05:00,QCOM,positive
1050048.0,Benzinga's Option Alert Recap From March 9,2017-03-09 17:14:00-05:00,QCOM,positive
1050049.0,Rumors Abound The iPhone 8 May Be Delayed: Winners And Losers,2017-03-09 12:58:00-05:00,QCOM,negative
1050051.0,18 Biggest Mid-Day Gainers For Wednesday,2017-03-08 12:58:00-05:00,QCOM,neutral
1050052.0,ParkerVision: Another Case Of 'Sell The News',2017-03-08 11:32:00-05:00,QCOM,neutral
1050053.0,Mid-Morning Market Update: Markets Mostly Higher; Childrens Place Profit Tops Estimates,2017-03-08 10:05:00-05:00,QCOM,positive
1050054.0,Qualcomm Partners with Microsoft to Accelerate Cloud Services on 10nm Qualcomm Centriq 2400 Platform,2017-03-08 09:55:00-05:00,QCOM,neutral
1050055.0,22 Stocks Moving In Wednesday's Pre-Market Session,2017-03-08 08:12:00-05:00,QCOM,neutral
1050056.0,"ParkerVision Receives 3 Favorable Decisions, Qualcomm Gets 2 Favorable Decisions in Patent Case",2017-03-08 07:12:00-05:00,QCOM,positive
1050057.0,"Hearing ParkerVision Receives 3 Full, 1 Partial Win Against Qualcomm In 4 IPR Final Determinations With Regards To '940 Patent Claims",2017-03-07 15:41:00-05:00,QCOM,positive
1050058.0,Qualcomm Extends Cash Tender Offer for All Outstanding NXP Shares,2017-03-07 07:31:00-05:00,QCOM,positive
1050059.0,Qualcomm Increases Quarterly Dividend From $0.53 To $0.57/Share,2017-03-07 07:30:00-05:00,QCOM,neutral
1050060.0,Apple to Use its Own Fingerprint ID Solution for OLED iPhone -DigiTimes,2017-03-03 04:37:00-05:00,QCOM,positive
1050061.0,Qualcomm Shares Close Down 1.12%; Apple Today Reported To Have Filed Suit Against Qualcomm In The UK,2017-03-02 16:35:00-05:00,QCOM,positive
1050062.0,Ambarella Doesn't Believe GoPro's 'Competitive Solution' Changes The Competitive Landscape,2017-03-01 14:47:00-05:00,QCOM,positive
1050063.0,"With The Mobile Industry Upgrading To 5G, Buy Cavium",2017-03-01 10:03:00-05:00,QCOM,neutral
1050064.0,"Ericsson, Qualcomm, Vodafone Collaborate on 5G New Radio Trial",2017-02-27 04:13:00-05:00,QCOM,neutral
1050065.0,Intel's Market Share In Apple's iPhone 8 Could Hit 65% This Year,2017-02-24 10:36:00-05:00,QCOM,positive
1050066.0,"Qualcomm, ZTE, China Mobile Announce Collaboration on 5G New Radio Trials",2017-02-22 04:17:00-05:00,QCOM,neutral
1050067.0,"13F from Tepper's Appaloosa Shows Increased Stakes in Facebook, Qualcomm, Southwest Air",2017-02-14 16:23:00-05:00,QCOM,positive
1050068.0,"Biotech, Qualcomm, Twitter, Uranium: Fast Money Picks For February 14",2017-02-14 06:44:00-05:00,QCOM,neutral
1050069.0,"Qualcomm, NXP Semi Shares Relatively Quiet Following CTFN M&A Reporting Report 'Qualcomm's EC Filing for NXP Imminent'",2017-02-13 13:23:00-05:00,QCOM,positive
1050070.0,ParkerVision Increases German Infringement Case Against Apple,2017-02-13 07:03:00-05:00,QCOM,negative
1050071.0,"SoftBank Near First Round Closing of $100B Tech Fund; Said to Include $45B from Saudi Arabia, $25B from Softbank; $1B Each from Apple, Qualcomm, Oracle",2017-02-09 05:04:00-05:00,QCOM,neutral
1050072.0,"Apple's 'iPhone X' To Cost $1,000?",2017-02-08 16:01:00-05:00,QCOM,neutral
1050073.0,Benzinga's Option Alert Recap From February 6,2017-02-06 16:52:00-05:00,QCOM,positive
1050074.0,"Qualcomm President Amon Cristiano Acquires 18,815 Shares At Price Range From $53.115 To $53.15",2017-02-06 16:29:00-05:00,QCOM,positive
1050075.0,Option Alert: Qualcomm Feb 10th 54.0 Calls: 1900 @  ASK  $0.22: 2203 traded vs 1525 OI:  Earnings 4/19 After Close  $53.24 Ref,2017-02-06 10:30:00-05:00,QCOM,positive
1050076.0,Qualcomm Extends Offer for NXP Semiconductor Through March 7,2017-02-06 07:34:00-05:00,QCOM,positive
1050077.0,"Qualcomm, TDK Report Launch of Joint Venture Under Name RF360 Holdings Singapore PTE. Ltd.",2017-02-03 07:32:00-05:00,QCOM,neutral
1050078.0,"Jim Cramer Shares His Thoughts On Electronic Arts, Skyworks Solutions And NXP Semiconductors",2017-02-02 06:38:00-05:00,QCOM,positive
1050079.0,7 Big Highlights From Apple's Q1 Conference Call,2017-02-01 10:30:00-05:00,QCOM,neutral
1050080.0,"From Apple Call: Tim Cook Says He 'Doesn't Like Litigation' and Implies If Litigation Can Be Avoided, It Will; However Does Not See A Different Route",2017-01-31 17:52:00-05:00,QCOM,negative
1050081.0,Apple Shares Tick Away from Session Highs as Analyst During Q&A Section of Call Asks About Litigation,2017-01-31 17:50:00-05:00,QCOM,positive
1050082.0,Your Primer For Apple's Q1 Earnings Report,2017-01-30 14:23:00-05:00,QCOM,neutral
1050083.0,What To Expect From Semiconductor Earnings This Week,2017-01-29 16:57:00-05:00,QCOM,neutral
1050084.0,NXP Shareholders Approve All Items Proposed Relating To Qualcomm's Tender Offer Of $110/Share,2017-01-27 08:29:00-05:00,QCOM,neutral
1050085.0,Qualcomm's Legal Issues Not Likely To Interrupt NXP Takeover,2017-01-26 15:33:00-05:00,QCOM,positive
1050086.0,18 Biggest Mid-Day Losers For Thursday,2017-01-26 13:03:00-05:00,QCOM,negative
1050087.0,Qualcomm Legal Woes Take The Spotlight,2017-01-26 12:47:00-05:00,QCOM,negative
1050088.0,"The Market In 5 Minutes: Earnings, Trump And Dow20k",2017-01-26 09:02:00-05:00,QCOM,neutral
1050089.0,25 Stocks Moving In Thursday's Pre-Market Session,2017-01-26 08:19:00-05:00,QCOM,neutral
1050090.0,A Peek Into The Markets: U.S. Stock Futures Up Ahead Of Earnings,2017-01-26 07:24:00-05:00,QCOM,neutral
1050091.0,"Boeing, GM, Qualcomm And More: Fast Money Picks For January 26",2017-01-26 06:40:00-05:00,QCOM,neutral
1050092.0,"15 Stocks To Watch For January 26, 2017",2017-01-26 06:35:00-05:00,QCOM,neutral
1050093.0,Watch These 10 Huge Put Purchases In Thursday Trade,2017-01-26 05:58:00-05:00,QCOM,positive
1050094.0,Qualcomm On Conf. Call Says It Intends TO Remain A Supplier To Apple During The Dispute,2017-01-25 16:54:00-05:00,QCOM,negative
1050095.0,Qualcomm On Conf. Call Says It's Progressing On Regulatory Filings With Regard To NXP Deal,2017-01-25 16:53:00-05:00,QCOM,neutral
1050096.0,From Qualcomm Q1 Earnings Conference Call: Co. Intends to Remain Supplier to Apple During Dispute,2017-01-25 16:52:00-05:00,QCOM,negative
1050097.0,"Qualcomm Falls After Q1 Results, CEO Speaks On Apple Lawsuit",2017-01-25 16:38:00-05:00,QCOM,negative
1050098.0,"Qualcomm Sees Q2 Adj. EPS $1.15-$1.25 vs $1.20 Est., Sales $5.5B-$6.3B vs $5.9B Est.",2017-01-25 16:06:00-05:00,QCOM,neutral
1050099.0,"Qualcomm Reports Q1 Adj. EPS $1.19 vs $1.18 Est., Sales $5.99B vs $6.12B Est.",2017-01-25 16:03:00-05:00,QCOM,neutral
1050100.0,"Qualcomm Comments On Apple Suit In China, Says It Is Part Of Apple's Efforts To Find Ways To Pay Less For Qualcomm Technology, Prepared To Defend Its Business Model Anywhere In The World",2017-01-25 12:57:00-05:00,QCOM,positive
1050101.0,Option Alert: Qualcomm Jan 27th 50.5 Puts Sweep: 2229 @  ASK  $0.09: 2257 traded vs 36 OI:  Earnings today After Close  $56.04 Ref,2017-01-25 12:47:00-05:00,QCOM,positive
1050102.0,Apple Files Lawsuits Against Qualcomm In Beijing,2017-01-25 12:34:00-05:00,QCOM,negative
1050103.0,Apple Has Reportedly Filed Suit Against Qualcomm In Beijing,2017-01-25 12:30:00-05:00,QCOM,neutral
1050104.0,How CEVA Will Benefit From The Apple/Qualcomm Litigation,2017-01-25 12:29:00-05:00,QCOM,positive
1050105.0,A Peek Into The Markets: U.S. Stock Futures Surge Ahead Of Earnings,2017-01-25 07:27:00-05:00,QCOM,neutral
1050106.0,"Keep an Eye on These 15 Stocks for January 25, 2017",2017-01-25 05:31:00-05:00,QCOM,neutral
1050107.0,"Earnings Scheduled For January 25, 2017",2017-01-25 04:42:00-05:00,QCOM,neutral
1050108.0,Benzinga's Option Alert Recap From January 24,2017-01-24 17:26:00-05:00,QCOM,positive
1050109.0,7 Biggest Price Target Changes For Tuesday,2017-01-24 11:27:00-05:00,QCOM,neutral
1050110.0,Option Alert: Qualcomm Jan 27th 55.5 Calls Sweep: 1147 @  ASK  $1.57: 1586 traded vs 850 OI:  Earnings tmrrw After Close  $55.48 Ref,2017-01-24 10:45:00-05:00,QCOM,positive
1050111.0,Mid-Afternoon Market Update: Crude Oil Down Over 1%; Brookfield Canada Office Properties Shares Spike Higher,2017-01-23 14:48:00-05:00,QCOM,negative
1050112.0,Apple Gets Litigious: Qualcomm The Latest In A String Of Lawsuits,2017-01-23 14:39:00-05:00,QCOM,negative
1050113.0,Dealreporter Says The FTC Could Drop Qualcomm Litigation,2017-01-23 13:36:00-05:00,QCOM,negative
1050114.0,"FTC Commissioner Calls FTC's Action Against Qualcomm 'Flawed,' Voted Against Complaint",2017-01-23 13:23:00-05:00,QCOM,negative
1050115.0,12 Biggest Mid-Day Losers For Monday,2017-01-23 13:19:00-05:00,QCOM,negative
1050116.0,Mid-Day Market Update: Marinus Pharma Surges Following Preliminary Study Update; QUALCOMM Shares Slide,2017-01-23 12:15:00-05:00,QCOM,positive
1050117.0,Apple Sues Qualcomm; Company's Legal Woes Begin To Pile Up,2017-01-23 10:42:00-05:00,QCOM,negative
1050118.0,Qualcomm Shares See Big-Time Follow Through On Friday's Beatdown,2017-01-23 10:33:00-05:00,QCOM,positive
1050119.0,"Traders Circulating Qualcomm FTC Document Of Dissenting Statement From Commissioner Maureeen Ohlhausen From Jan. 17th, 2017 Regarding FTC Suit From The Same Day; Ohlhausen Says She Was Presented 'No Robust Economic Evidence Of Anticompetitive Effects'",2017-01-23 10:24:00-05:00,QCOM,positive
1050120.0,Mid-Morning Market Update: Markets Open Slightly Lower; McDonald's Beats Q4 Estimates,2017-01-23 09:57:00-05:00,QCOM,negative
1050121.0,7 Biggest Price Target Changes For Monday,2017-01-23 09:38:00-05:00,QCOM,neutral
