Unnamed: 0,title,date,stock,sentiment
1049332.0,Qualcomm Option Alert: Oct 19 $72.5 Calls at the Ask: 2877 @ $3.0 vs 22191 OI; Earnings 11/7 After Close Ref=$73.69,2018-09-13 09:37:00-04:00,QCOM,positive
1049333.0,Qualcomm shares are up 3.0% after the company earlier announced a $16 billion accelerated buyback plan.,2018-09-13 08:59:00-04:00,QCOM,positive
1049334.0,A Peek Into The Markets: US Stock Futures Edge Higher Ahead Of Inflation Report,2018-09-13 06:20:00-04:00,QCOM,neutral
1049335.0,Qualcomm Announces $16B Accelerated Buyback Plan,2018-09-13 05:56:00-04:00,QCOM,neutral
1049336.0,Investors Try To Read The Trade Tea Leaves In The Latest IMX Report,2018-09-12 15:15:00-04:00,QCOM,neutral
1049337.0,"Market Appears To Be in Wait-and-See Mode Ahead of Apple, Central Bank Events",2018-09-12 10:27:00-04:00,QCOM,neutral
1049338.0,A Chip ETF Bleeds Cash; Some Of It May Be Going Here,2018-09-11 11:53:00-04:00,QCOM,neutral
1049339.0,Investor Movement Index August Summary,2018-09-11 11:08:00-04:00,QCOM,neutral
1049340.0,NXP Plans To Stick With Pre-Qualcomm Strategy Focused On Chips For Autos,2018-09-10 15:14:00-04:00,QCOM,positive
1049341.0,"Stocks That Made New 52-Week Highs Yesterday, September 6th",2018-09-07 16:47:00-04:00,QCOM,neutral
1049342.0,Qualcomm and Ericsson Conduct 1st Announced 3GPP-Compliant 5G Call From A Mobile Test Device,2018-09-06 16:01:00-04:00,QCOM,neutral
1049343.0,"Telecom Stock Roundup: Ericsson-Liberty Global Deal, AT&T's 5G Deployment And More",2018-09-06 15:36:00-04:00,QCOM,neutral
1049344.0,Stocks That Made New 52-Week Highs So Far Today include: FirstEnergy,2018-09-06 12:02:00-04:00,QCOM,neutral
1049345.0,"Stocks Which Set New 52-Week High Yesterday, September 5th",2018-09-06 08:48:00-04:00,QCOM,neutral
1049346.0,Qualcomm Option Alert: Apr 18 $75 Calls Sweep (32) near the Ask: 1387 @ $3.397 vs 298 OI; Ref=$70.22,2018-09-05 09:51:00-04:00,QCOM,positive
1049347.0,Qualcomm Option Alert: Jan 18 $75 Calls at the Ask: 1000 @ $2.0 vs 8315 OI; Ref=$69.82,2018-09-04 13:33:00-04:00,QCOM,positive
1049348.0,"Stocks Trading Ex Dividend For Tues., Sep. 4, 2018",2018-09-04 10:16:00-04:00,QCOM,neutral
1049349.0,10 Biggest Price Target Changes For Tuesday,2018-09-04 09:45:00-04:00,QCOM,neutral
1049350.0,"Macquarie Upgrades Qualcomm to Outperform, Raises Price Target to $84",2018-09-04 08:39:00-04:00,QCOM,neutral
1049351.0,"Nomura Maintains Buy on Qualcomm, Raises Price Target to $80",2018-09-04 07:56:00-04:00,QCOM,neutral
1049352.0,"Stocks That Will Be Trading Ex Dividend Tues., Sept. 4, 2018",2018-08-31 10:49:00-04:00,QCOM,neutral
1049353.0,Qualcomm Gives Results For Tender Offer: Accepted For Purchase ~76.2M Common Shares At $67.50/Share,2018-08-31 07:33:00-04:00,QCOM,positive
1049354.0,"Stocks Which Set New 52-Week High Yesterday, August 28th",2018-08-29 11:13:00-04:00,QCOM,neutral
1049355.0,Qualcomm Trades Higher After Tender Offer,2018-08-28 16:23:00-04:00,QCOM,neutral
1049356.0,Qualcomm Reports Prelim. Tender Offer Of 76.205M Shares At $67.50/Share,2018-08-28 07:45:00-04:00,QCOM,positive
1049357.0,Taiwan Semiconductor to Begin Fabricating Qualcomm Snapdragon Chips in Q4 2018,2018-08-23 04:11:00-04:00,QCOM,neutral
1049358.0,"Rosenblatt Turns Bullish On Qualcomm, Highlights 5G Opportunity",2018-08-20 12:40:00-04:00,QCOM,positive
1049359.0,10 Biggest Price Target Changes For Monday,2018-08-20 09:38:00-04:00,QCOM,neutral
1049360.0,"Benzinga's Top Upgrades, Downgrades For August 20, 2018",2018-08-20 08:53:00-04:00,QCOM,positive
1049361.0,"Rosenblatt Upgrades Qualcomm to Buy, Raises Price Target to $70",2018-08-20 07:03:00-04:00,QCOM,neutral
1049362.0,"13F From Paulson Shows Increased Stake In T-Mobile, Exited Stake In Qualcomm, Reduced Stake In Caesars Entertainment",2018-08-14 17:24:00-04:00,QCOM,positive
1049363.0,"13F Filing From Tiger Global Shows New Stake In Qualcomm (20K Shares), Redfin (115.831K Shares), Home Depot (7K Shares), Citigroup (20K Shares), and Guess (15K Shares)",2018-08-14 15:21:00-04:00,QCOM,neutral
1049364.0,Qualcomm and Taiwan Fair Trade Commission Reach Settlement Over Qualcomm's Licensing Business Practices,2018-08-10 04:20:00-04:00,QCOM,positive
1049365.0,"Qualcomm's Risk-Reward Is Too Favorable to Ignore, Cowen Says In Upgrade",2018-08-06 14:16:00-04:00,QCOM,positive
1049366.0,10 Biggest Price Target Changes For Monday,2018-08-06 09:40:00-04:00,QCOM,neutral
1049367.0,"Benzinga's Top Upgrades, Downgrades For August 6, 2018",2018-08-06 09:13:00-04:00,QCOM,positive
1049368.0,"Cowen & Co. Upgrades Qualcomm to Outperform, Raises Price Target to $80",2018-08-06 07:15:00-04:00,QCOM,neutral
1049369.0,A Peek Into The Markets: US Stock Futures Up Ahead Of Earnings,2018-08-06 06:49:00-04:00,QCOM,neutral
1049370.0,Cowen and Co Upgrades Qualcomm to Outperform from Market Perform; Raises Price Target to $80 from $64,2018-08-06 04:28:00-04:00,QCOM,neutral
1049371.0,UPDATE: Qualcomm Dutch Auction Tender To Be Between $60-$67.50/Share,2018-07-31 08:00:00-04:00,QCOM,neutral
1049372.0,Qualcomm Commences Dutch Auction Tender Offer To Purchase Up To $10B Of Its Shares,2018-07-31 07:33:00-04:00,QCOM,positive
1049373.0,UPDATE: Charter Equity Sees Intel Guidance For Reduced Margins On Ramp In 2H'18 Modem Sales As Indicative Apple's Move Away From Qualcomm Chips In iPhone 'is happening this year',2018-07-27 15:36:00-04:00,QCOM,neutral
1049374.0,No Qualcomm? No Problem: NXP Semiconductors Is Still A 'King',2018-07-27 12:41:00-04:00,QCOM,negative
1049375.0,NXP Semiconductors CEO Says They Don't See A Resurrection Of The Qualcomm Deal,2018-07-27 10:44:00-04:00,QCOM,neutral
1049376.0,China Market Regulator Says Qualcomm's Proposal to Acquire NXP Deal Did Not Adequately Address Anti-trust Concerns; Says Hopes to Continue Communication With Qualcomm to Find a Solution,2018-07-27 04:19:00-04:00,QCOM,positive
1049377.0,"For Qualcomm, Now Comes The 'Really, Really Hard Part'",2018-07-26 15:46:00-04:00,QCOM,negative
1049378.0,"NXP CEO Clemmer Says China Decision Was 'Absolutely Political, Clemmer Says Chinese Review Wasn't A Fair Reasonable Process",2018-07-26 10:04:00-04:00,QCOM,negative
1049379.0,Benzinga Pro's 5 Stocks To Watch Today,2018-07-26 08:42:00-04:00,QCOM,neutral
1049380.0,The Qualcomm-NXP Semiconductors Saga Has Finally Come To An End,2018-07-26 08:25:00-04:00,QCOM,neutral
1049381.0,Treasury Sec. Steve Mnuchin Says 'Very Disappointed' China Did Not Approve Qualcomm Deal,2018-07-26 08:15:00-04:00,QCOM,negative
1049382.0,32 Stocks Moving In Thursday's Pre-Market Session,2018-07-26 08:11:00-04:00,QCOM,neutral
1049383.0,"Stifel Nicolaus Maintains Hold on Qualcomm, Raises Price Target to $58",2018-07-26 07:52:00-04:00,QCOM,neutral
1049384.0,"KeyBanc Maintains Overweight on Qualcomm, Raises Price Target to $72",2018-07-26 07:27:00-04:00,QCOM,negative
1049385.0,"15 Stocks To Watch For July 26, 2018",2018-07-26 04:51:00-04:00,QCOM,neutral
1049386.0,"China's Commerce Ministry Declines Comment on Whether Qualcomm-NXP Deal was Approved; Says it's Anti-Monopoly Issue, Not Trade Issue; Qualcomm Announced Termination of Deal on Wednesday",2018-07-26 04:21:00-04:00,QCOM,positive
1049387.0,Qualcomm Shares Up 6.2% After Hours Following Q3 Earnings Beat,2018-07-25 17:59:00-04:00,QCOM,positive
1049388.0,From Qualcomm Q3 Earnings Conference Call: Sees Apple Exclusively Using Modems From Qualcomm's Competitors In Next Generation Of iPhones,2018-07-25 17:16:00-04:00,QCOM,neutral
1049389.0,11 Stocks Moving In Wednesday's After-Hours Session,2018-07-25 16:56:00-04:00,QCOM,neutral
1049390.0,"Qualcomm Terminates NXP Deal, Co. To Buyback $30B",2018-07-25 16:03:00-04:00,QCOM,neutral
1049391.0,"Qualcomm Q3 EPS $1.01 Beats $0.71 Estimate, Sales $5.6B Beat $5.19B Estimate",2018-07-25 16:02:00-04:00,QCOM,neutral
1049392.0,NXP Semi Shares Fall ~0.7% Over Last Min. Following Report Qualcomm Could Give Up On Its Deal For Co.; Qualcomm Shares Tick $0.02 Lower,2018-07-25 14:47:00-04:00,QCOM,positive
1049393.0,UPDATE: CNBC Reports That Qualcomm Is Planning To Move Forward With Buybacks Instead Of Buying NXP,2018-07-25 14:47:00-04:00,QCOM,neutral
1049394.0,'Qualcomm is preparing to give up on NXP'-CNBC Reports,2018-07-25 14:46:00-04:00,QCOM,neutral
1049395.0,'ICYMI.. @davidfaber reports Qualcomm has heard nothing from Chinese antitrust authorities as of 9am eastern regarding NXP.'-CNBC Producer Sally Shin Tweets,2018-07-25 09:53:00-04:00,QCOM,neutral
1049396.0,Qualcomm Says Has Had No Word As Of 9 a.m. EDT From China Antitrust Authority Related To NXP Semi Deal,2018-07-25 09:40:00-04:00,QCOM,negative
1049397.0,"14 Stocks To Watch For July 25, 2018",2018-07-25 05:31:00-04:00,QCOM,neutral
1049398.0,"Earnings Scheduled For July 25, 2018",2018-07-25 04:23:00-04:00,QCOM,neutral
1049399.0,China's Foreign Ministry Reports Good Communication with Qualcomm Regarding its Proposed Takeover of NXP Semiconductors,2018-07-25 04:08:00-04:00,QCOM,positive
1049400.0,"Q2 Semi Preview: Cowen Confident In AMD, Predicts Near-Term Challenges For Intel",2018-07-24 10:37:00-04:00,QCOM,positive
1049401.0,'If China allows Qualcomm's NXP deal to die that decision will reverberate far beyond the investor base of both companies.' -Tweet From CNBC's David Faber,2018-07-24 10:31:00-04:00,QCOM,negative
1049402.0,CNBC's David Faber Says 'Nothing To Indicate Change In Posture' Related To Qualcomm/NXP Semi Deal,2018-07-24 09:40:00-04:00,QCOM,neutral
1049403.0,Qualcomm/NXP Semi Deal Talks Are In 'Last Minute',2018-07-24 08:23:00-04:00,QCOM,neutral
1049404.0,"South China Morning Post Reports 'As deadline looms, US-China trade war leaves fate of Qualcomm-NXP merger hanging'; Report Says Sources Say Recent Activity By Beijing Indicates A Positive Turn For The Deal, But Uncertainty Remains",2018-07-23 13:38:00-04:00,QCOM,negative
1049405.0,"Qualcomm Reports Extension Of Cash Tender Offer For NXP Semi To Jul. 25, 2018",2018-07-20 07:30:00-04:00,QCOM,neutral
1049406.0,"European Union Antitrust Regulators Charge Qualcomm With New Violation In Case Related To NVIDIA Unit, ICERA",2018-07-19 07:46:00-04:00,QCOM,negative
1049407.0,"Qualcomm CEO Mollenkopf Says If NXP Deal Doesn't Go Through, Co. Will Buyback $20-$30B Stock To Lift Its Stock Price",2018-07-19 06:16:00-04:00,QCOM,neutral
1049408.0,Qualcomm Extends Cash Tender Offer For All Outstanding Shares Of NXP Semiconductor,2018-07-13 07:31:00-04:00,QCOM,positive
1049409.0,Broadcom Shares Plummet After Wall Street Questions Sudden Acquisition Strategy,2018-07-12 13:37:00-04:00,QCOM,positive
1049410.0,Wall Street Sees A Bounce After Trade-Driven Losses,2018-07-12 10:30:00-04:00,QCOM,negative
1049411.0,CNBC Reports That The NXP Deal Is Likely To Be Terminated If Not Approved By July 25th,2018-07-12 09:43:00-04:00,QCOM,negative
1049412.0,NXP Semi Deal Likely To Be Terminated If Not Approved By Jul. 25,2018-07-12 09:40:00-04:00,QCOM,negative
1049413.0,Qualcomm Shares Move ~0.4% Higher Over Last Few Mins. Following Report Dept. Of Commerce Reached Escrow Deal With ZTE,2018-07-11 13:27:00-04:00,QCOM,positive
1049414.0,"NXP Semi, Qualcomm Shares Fall Modestly Following Report China Considering Delaying Approval Of Mergers As Retaliatory Step To US Tariffs",2018-07-11 09:00:00-04:00,QCOM,positive
1049415.0,Analyst: Apple Unlikely To Pivot Away From Intel For 5G Tech,2018-07-10 14:54:00-04:00,QCOM,neutral
1049416.0,"Qualcomm Reports Extension Of Offer For NXP Semi To Jul. 13, 2018",2018-07-06 07:30:00-04:00,QCOM,neutral
1049417.0,"Trade Wars Aside, First Half Of 2018 Sees Highest Value Of Cross-Border M&A In A Decade",2018-07-05 13:30:00-04:00,QCOM,negative
1049418.0,"Barron's Picks And Pans: Apple, Mastercard, Sirius XM, Verizon And More",2018-06-30 18:02:00-04:00,QCOM,neutral
1049419.0,"Qualcomm Extends Cash Tender Offer for All Outstanding Shares of NXP To July 6, 2018",2018-06-29 07:30:00-04:00,QCOM,positive
1049420.0,Apple CEO Cook Expected To Be Deposed By Lawyers From QUALCOMM Related To Those Cos.' Ongoing Litigation,2018-06-27 06:15:00-04:00,QCOM,negative
1049421.0,"ParkerVision Reports August 7th Hearing at Court of Appeals for the Federal Circuit Hearing in IPR For Pending Appeals Of 3 Qualcomm IPRs, Company Intends to Reactivate Case Following Federal Circuit Ruling",2018-06-26 08:31:00-04:00,QCOM,neutral
1049422.0,"The Week Ahead: Senate Weighs Sprint-T-Mobile Merger, Nike Earnings And A Slew Of IPOs",2018-06-25 14:00:00-04:00,QCOM,neutral
1049423.0,Taiwan Semiconductor Likely to Produce Qualcomm 7nm Snapdragon Chips,2018-06-22 03:55:00-04:00,QCOM,neutral
1049424.0,"Apple Shares Down ~1%, Bloomberg Reported Earlier Today That ITC Staff Says Apple Infringed On One Of Three Qualcomm Patents",2018-06-15 15:24:00-04:00,QCOM,positive
1049425.0,Investors 'Wait With Baited Breath' Following Conflicting Reports On Qualcomm-NXP Deal,2018-06-15 10:03:00-04:00,QCOM,negative
1049426.0,"The Market In 5 Minutes: Tariffs, NXPI, Powell And More",2018-06-15 08:59:00-04:00,QCOM,neutral
1049427.0,"Qualcomm, NXP Semi Deal Not Officially Approved By China's State Admin. For Market Regulation",2018-06-15 07:57:00-04:00,QCOM,negative
1049428.0,"Qualcomm Reports Extension Of Cash Tender Offer For NXP Semi to Jun. 22, 2018",2018-06-15 07:31:00-04:00,QCOM,neutral
1049429.0,China has Not Yet Approved Qualcomm's Proposed $44B Acquisition of NXP Semiconductors,2018-06-15 05:05:00-04:00,QCOM,negative
1049430.0,"NXP Semiconductors' Standalone Value Is $119, SunTrust Says In Downgrade",2018-06-11 12:17:00-04:00,QCOM,positive
1049431.0,Taiwan Semiconductor Likely to Brings its 7nm Process Technology to Mass Production Ahead of Schedule,2018-06-08 04:11:00-04:00,QCOM,neutral
1049432.0,"Qualcomm CEO Mollenkopf Said He Hopes US, China Deal On ZTE Means Something Good For Chinese Approval Of Deal With NXP Semi",2018-06-07 09:27:00-04:00,QCOM,positive
1049433.0,Commerce Secretary Wilbur Ross Confirms ZTE Deal,2018-06-07 09:19:00-04:00,QCOM,neutral
1049434.0,"Qualcomm, NXP Semi Shares Spike Higher Premarket Amid Report China Is Said To Be Ready To Clear Deal",2018-06-07 09:16:00-04:00,QCOM,positive
1049435.0,"Qualcomm, Sprint Announce Free Data through 2018 for Snapdragon-Powered Always Connected PCs",2018-06-05 05:05:00-04:00,QCOM,positive
1049436.0,"NXP Semi Shares Fell As Much As 2.2% Immediately Following Dealreporter Speculation Of Possible Qualcomm Deal Stalling In China; Shares Rebound Quickly, Now Down ~1.3% For Session",2018-05-30 15:51:00-04:00,QCOM,positive
1049437.0,NXP Semi Shares Fall Ahead Of Close Amid Circulation Of Speculation Deal With Qualcomm Could Be At Risk Of Being Stalled In China,2018-05-30 15:50:00-04:00,QCOM,negative
1049438.0,"Vuzix Reports Partnership With Qualcomm For New Snapdragon XR1 Platform To Develop Next Gen Augmented Reality Smart Glasses, No Terms Disclosed",2018-05-30 09:11:00-04:00,QCOM,positive
1049439.0,Qualcomm Launches World's First Dedicated XR Platform,2018-05-30 04:03:00-04:00,QCOM,positive
1049440.0,Report: Trump Administration Notifies Congress Of ZTE Deal,2018-05-25 15:59:00-04:00,QCOM,neutral
1049441.0,"Qualcomm Extends Tender Offer For NXP Semi To Jun. 8, 2018",2018-05-25 07:30:00-04:00,QCOM,positive
1049442.0,Qualcomm Unveils The First 5G NR Solution For Small Cells,2018-05-22 13:26:00-04:00,QCOM,positive
1049443.0,ParkerVision Announces August 31 as the Hearing Date in its Case Against Qualcomm and Apple,2018-05-22 08:05:00-04:00,QCOM,neutral
1049444.0,Qualcomm Earlier Filed for Mixed Securities Shelf Offering,2018-05-21 10:47:00-04:00,QCOM,positive
1049445.0,Benzinga Pro's 5 Stocks To Watch Today,2018-05-21 08:59:00-04:00,QCOM,neutral
1049446.0,"Qualcomm and Facebook Announce Partnership to Deliver Internet in Urban Areas With 60GHz Technology, Says 'Only a Fraction of the Cost of Fiber Deployments'",2018-05-21 07:36:00-04:00,QCOM,neutral
1049447.0,The Latest From China: Qualcomm-NXP Semiconductors Tie-Up 'Looking More Optimistic',2018-05-18 12:45:00-04:00,QCOM,positive
1049448.0,"NXP Semi, Qualcomm Shares Move Higher Amid Report Beijing Official Is More Optimistic On Deal",2018-05-18 10:47:00-04:00,QCOM,positive
1049449.0,"Cowen Names 4 Top Semi Picks: AMD, Ambarella, Broadcom, Monolithic Power",2018-05-17 17:56:00-04:00,QCOM,positive
1049450.0,"Cowen & Co. Initiates Coverage On Qualcomm with Market Weight Rating, Announces $58 Price Target",2018-05-17 16:29:00-04:00,QCOM,neutral
1049451.0,"NXP Semi Shares Fall ~3%, Qualcomm Shares Fall ~0.7% Following Comments From Pres Trump He Doesn't Think Trade Talks With China Will Be Successful",2018-05-17 14:02:00-04:00,QCOM,positive
1049452.0,"NXP Semi, Qualcomm Shares Largely Unaffected, Hearing RBC Capital Analyst Highlighted Odds Of China Approval Have Improved",2018-05-17 13:12:00-04:00,QCOM,positive
1049453.0,"Q1 13F Roundup: How Buffett, Einhorn, Ackman And Others Adjusted Their Portfolio",2018-05-16 11:38:00-04:00,QCOM,neutral
1049454.0,"13F From Soros Fund Mgmt. Shows Dissolved Stakes 3M, Qualcomm, Twitter, GE, Southwest Air",2018-05-15 16:58:00-04:00,QCOM,neutral
1049455.0,Dan Nathan Sees Unusual Options Activity In Qualcomm,2018-05-15 07:19:00-04:00,QCOM,neutral
1049456.0,48 Biggest Movers From Yesterday,2018-05-15 04:26:00-04:00,QCOM,neutral
1049457.0,36 Stocks Moving In Monday's Mid-Day Session,2018-05-14 12:50:00-04:00,QCOM,neutral
1049458.0,"NXP Semi Shares Up ~1.8% Following News US, China Working On Deal Related To ZTE Which Would Require Chinese Regulators To Speed Review Of Qualcomm Deal For NXP; Qualcomm Shares Up ~0.4% Since Report",2018-05-14 12:05:00-04:00,QCOM,positive
1049459.0,"UPDATE: Deal Between US, China On ZTE Would Involve Speeding Chinese Review Of Qualcomm Deal For NXP Semi",2018-05-14 12:03:00-04:00,QCOM,neutral
1049460.0,Mid-Morning Market Update: Markets Open Higher; Sears Board Explores Sale Of Assets,2018-05-14 10:15:00-04:00,QCOM,positive
1049461.0,26 Stocks Moving In Monday's Pre-Market Session,2018-05-14 08:18:00-04:00,QCOM,neutral
1049462.0,Chinese Regulators Restart Review of Qualcomm's Application To Buy NXP Semi,2018-05-14 08:14:00-04:00,QCOM,neutral
1049463.0,Telecom Stock Roundup: Trade Restrictions Continue To Haunt,2018-05-11 11:21:00-04:00,QCOM,negative
1049464.0,Qualcomm Extends Cash Tender Offer for All Outstanding Shares of NXP to May 25,2018-05-11 07:30:00-04:00,QCOM,positive
1049465.0,Qualcomm Reports $10B Buyback Plan,2018-05-09 16:30:00-04:00,QCOM,neutral
1049466.0,Qualcomm Plans Exit From Server Chips,2018-05-07 19:13:00-04:00,QCOM,neutral
1049467.0,Microsoft Presents New Technology At Build Conference,2018-05-07 16:00:00-04:00,QCOM,neutral
1049468.0,"Qualcomm Using Lower Cost Licensing Model Which Could Help in Talks with Apple, Samsung",2018-05-01 04:46:00-04:00,QCOM,positive
1049469.0,"Barron's Picks And Pans: Value Stocks, Disney, Chipotle And More",2018-04-29 08:31:00-04:00,QCOM,positive
1049470.0,Qualcomm Extends Cash Tender Offer for All Outstanding Shares of NXP To May 11th At 5 pm ET,2018-04-27 07:31:00-04:00,QCOM,positive
1049471.0,U.S. Government May Start Scrutinizing Informal Partnerships Between American and Chinese Companies in AI,2018-04-27 04:43:00-04:00,QCOM,neutral
1049472.0,"Canaccord Genuity Maintains Buy on Qualcomm, Lowers Price Target to $75.00",2018-04-26 14:13:00-04:00,QCOM,negative
1049473.0,"Stocks That Made New 52-Week Lows Today Include: Goodyear Tire, Kellogg, Philip Morris, Altria, QUALCOMM, Hershey, and American Airlines",2018-04-26 12:12:00-04:00,QCOM,negative
1049474.0,"Macquarie Maintains Neutral on Qualcomm, Lowers Price Target to $55.00",2018-04-26 11:39:00-04:00,QCOM,negative
1049475.0,"BMO Capital Maintains Market Perform on Qualcomm, Lowers Price Target to $55.00",2018-04-26 10:48:00-04:00,QCOM,negative
1049476.0,Qualcomm CEO On CNBC Says Co. Will Do Buyback If NXP Deal Doesn't Happen,2018-04-26 10:26:00-04:00,QCOM,neutral
1049477.0,Qualcomm CEO On CNBC Says He Still Expects Approval Of NXP Deal,2018-04-26 10:25:00-04:00,QCOM,positive
1049478.0,"Stifel Nicolaus Maintains Hold on Qualcomm, Lowers Price Target to $54.00",2018-04-26 07:33:00-04:00,QCOM,negative
1049479.0,QUALCOMM ON Conf. Call Says It Expects Declining Licensing Revenue In Q3 Due In Part To Amended Samsung Agreement,2018-04-25 17:11:00-04:00,QCOM,positive
1049480.0,Qualcomm Q2 Sales $5.3B Beats $5.19B Est.,2018-04-25 16:04:00-04:00,QCOM,neutral
1049481.0,Qualcomm Q2 EPS $0.80 Beats $0.70 Est.,2018-04-25 16:03:00-04:00,QCOM,neutral
1049482.0,"Stocks That Made New 52 Week Lows Today Include: Vulcan Materials, QUALCOMM, Goodyear Tire, Johnson Controls, Skyworks Solutions, Mohawk Industries, Fortune Brands Home, Pepsi, Procter & Gamble, and CenterPoint Energy",2018-04-25 10:17:00-04:00,QCOM,positive
1049483.0,"Earnings Scheduled For April 25, 2018",2018-04-25 04:25:00-04:00,QCOM,neutral
1049484.0,"15 Stocks To Watch For April 25, 2018",2018-04-25 04:04:00-04:00,QCOM,neutral
1049485.0,"The Week Ahead: Sohn Conference, FANG Earnings, DocuSign IPO",2018-04-23 10:44:00-04:00,QCOM,neutral
1049486.0,Android Phone Makers Won't Launch 3D Sensing Models until Q3 2018,2018-04-20 04:06:00-04:00,QCOM,neutral
1049487.0,"Qualcomm Filed Notice With California Employment Development Dept., Showed Will Cut 269 Jobs In Northern California, 1,231 Jobs In San Diego Starting In Jun.",2018-04-19 17:24:00-04:00,QCOM,negative
1049488.0,"NXP Semiconductors Shares Down 4.4% After Qualcomm And Co. Report Agreement To Withdraw, Refile Application For Chinese Regulatory Approval of Merger Deal",2018-04-19 13:44:00-04:00,QCOM,positive
1049489.0,Qualcomm 'Very Concerned' With NXP Deal,2018-04-19 09:48:00-04:00,QCOM,neutral
1049490.0,"Apple, Chips Stocks Falling Amid Taiwan Semiconductor's Weak Guidance",2018-04-19 09:28:00-04:00,QCOM,negative
1049491.0,"Qualcomm, NXP Report Agreement To Withdraw, Refile Deal Application For Chinese Regulatory Approval",2018-04-19 07:32:00-04:00,QCOM,positive
1049492.0,China's Commerce Ministry Spokesperson Says China to Review Qualcomm-NXP Deal in a Fair Manner,2018-04-19 03:53:00-04:00,QCOM,positive
1049493.0,Qualcomm Began Cutting Jobs Related To $1B Cost Reduction Effort,2018-04-18 17:31:00-04:00,QCOM,negative
1049494.0,"Qualcomm To Report Q2 Earnings Wed., Apr. 25 After Market Close",2018-04-16 16:34:00-04:00,QCOM,neutral
1049495.0,"The Week Ahead: Netflix Earnings, Big Bank Results, FDA Actions Abound",2018-04-16 12:10:00-04:00,QCOM,neutral
1049496.0,"The Market In 5 Minutes: Netflix, TPP, Qualcomm, Costco And More",2018-04-16 09:00:00-04:00,QCOM,neutral
1049497.0,UPDATE: Delay By Chinese Regulators Could Scuttle Qualcomm Deal With NXP Semi,2018-04-13 10:05:00-04:00,QCOM,negative
1049498.0,"Chinese Regulators Have Stalled Review Of Qualcomm, Toshiba Deals",2018-04-13 10:05:00-04:00,QCOM,negative
1049499.0,Benzinga Pro's 5 Stocks To Watch Today,2018-04-13 08:30:00-04:00,QCOM,neutral
1049500.0,"Qualcomm Extends Cash Tender Offer For NXP Semi To Apr. 20, '18",2018-04-13 07:33:00-04:00,QCOM,positive
1049501.0,"'For anyone who missed this last night - Former Qcom chairman Paul Jacobs, who was removed from the board in March, is still serious about his plan to take the company public'",2018-04-13 07:15:00-04:00,QCOM,negative
1049502.0,REMINDER: QUALCOMM Tender Ofer for NXP to Expire 5pm ET Today; BZ NOTE: The Expiration Date For This Offer Has Been Repeatedly Extended,2018-04-13 06:59:00-04:00,QCOM,positive
1049503.0,"The Week Ahead: Zuckerberg Goes To Washington, Big Banks Get Earnings Season Underway",2018-04-09 12:38:00-04:00,QCOM,neutral
1049504.0,Qualcomm Extends its Offer for NXP Shares to April 13,2018-04-06 07:31:00-04:00,QCOM,positive
1049505.0,REMINDER: QUALCOMM Tender Offer For NXP Semiconductors Set To Expire Friday at 5pm ET,2018-04-05 17:43:00-04:00,QCOM,neutral
1049506.0,"UBS Initiates On Semis: Intel Is Golden, Micron Is A Sell, Nvidia, AMD And More",2018-04-05 12:39:00-04:00,QCOM,neutral
1049507.0,"UBS Initiates Coverage On Qualcomm with Neutral Rating, Announces $56.00 Price Target",2018-04-05 07:54:00-04:00,QCOM,neutral
1049508.0,Qualcomm Shares Spike ~$0.30 Over Last Min. As Traders Circulate Questionable Activist In Name; Watch For Resistance At $54.30,2018-04-03 09:54:00-04:00,QCOM,neutral
1049509.0,"The Week Ahead: Switch's Lockup Expires, Spotify Debuts, And More",2018-04-02 15:35:00-04:00,QCOM,neutral
1049510.0,Qualcomm Extends its Offer for NXP to April 6,2018-04-02 07:33:00-04:00,QCOM,positive
1049511.0,"REMINDER: QUALCOMM Tender Offer To Acquire NXP Expires Today 5pm ET; BZ NOTE: Regulatory Clearance For This Transaction Expires April 3rd, But The Cos. Will Seek An Extension Should It Become Necessary",2018-04-02 07:06:00-04:00,QCOM,positive
1049512.0,Qualcomm Unsuccessfully Tried To Schedule MOFCOM Meetings,2018-03-28 11:23:00-04:00,QCOM,negative
1049513.0,"Qualcomm Shares Make Near-Term Parabolic, Spike ~$0.90, Quickly Pare Most Gains, As Questionable Source Touting Takeover Chatter On Twitter",2018-03-28 11:20:00-04:00,QCOM,positive
1049514.0,"Qualcomm Announces Preliminary Results of 2018 Annual Meeting of Stockholders, Reports All 10 Qualcomm's Director Nominees Have Been Re-Elected",2018-03-23 12:25:00-04:00,QCOM,neutral
1049515.0,Qualcomm Extends Cash Tender Offer For All Outstanding Shares Of NXP Semi To Apr. 2,2018-03-23 07:33:00-04:00,QCOM,positive
1049516.0,Qualcomm Shares Fail To React Following Chatter Co. Met With MOFCOM This Week,2018-03-22 11:32:00-04:00,QCOM,negative
1049517.0,China Presses Qualcomm to Protect Local Companies in NXP Acquisition -Blomberg,2018-03-21 04:29:00-04:00,QCOM,positive
1049518.0,"Bank Of America Turns Incrementally Bullish On Qualcomm, Highlights Multiple Catalysts",2018-03-20 13:39:00-04:00,QCOM,neutral
1049519.0,"The Week Ahead: AT&T Trial, IBM Think, Nike Earnings, And The IPO Market Comes Alive",2018-03-19 12:21:00-04:00,QCOM,positive
1049520.0,"Fed Week Starts With A Hike Widely Expected, But Also Amid Hopes For More Clarity",2018-03-19 09:54:00-04:00,QCOM,positive
1049521.0,"Morgan Stanley Reinstates Underweight on Qualcomm, Announces $55.00",2018-03-19 07:28:00-04:00,QCOM,neutral
