Unnamed: 0,title,date,stock,sentiment
1048667.0,NASDAQ Closes At All-Time High,2020-06-08 19:12:00-04:00,QCOM,neutral
1048668.0,Why Qualcomm's Stock Is Trading Higher Today,2020-06-05 11:15:00-04:00,QCOM,neutral
1048669.0,"Benzinga's Top Upgrades, Downgrades For June 5, 2020",2020-06-05 09:56:00-04:00,QCOM,positive
1048670.0,Qualcomm shares are trading higher amid overall market strength following strong US jobs data. Rosenblatt analysts initiated coverage on the stock with a Buy rating and $105 price target.,2020-06-05 09:43:00-04:00,QCOM,positive
1048671.0,"Rosenblatt Initiates Coverage On Qualcomm with Buy Rating, Announces Price Target of $105",2020-06-05 06:02:00-04:00,QCOM,neutral
1048672.0,KeyBanc Upgrades Qualcomm On Potential Benefit From HiSilicon Ban,2020-05-28 12:05:00-04:00,QCOM,negative
1048673.0,"UPDATE: KeyBanc Upgrades Qualcomm to Overweight, Announces $105 Price Target As Firm Expects Huawei To Design Qualcomm's Snapdragon Into Its 2021 Flagship Smartphones, Given The Recent Restrictions Placed On HiSilicon Along With Potential Share Gain If Restrictions On Huawei Escalate.",2020-05-28 11:25:00-04:00,QCOM,positive
1048674.0,"Benzinga's Top Upgrades, Downgrades For May 28, 2020",2020-05-28 10:07:00-04:00,QCOM,positive
1048675.0,"KeyBanc Upgrades Qualcomm to Overweight, Announces $105 Price Target",2020-05-28 05:38:00-04:00,QCOM,negative
1048676.0,"Qualcomm, MediaTek to Launch SoC Solutions for Entry-level 5G Phones in Q3 2020",2020-05-27 05:28:00-04:00,QCOM,positive
1048677.0,3 Top 5G Semiconductor Stock Picks From BofA,2020-05-22 12:14:00-04:00,QCOM,positive
1048678.0,"Shares of several technology companies are trading higher as equities gain amid strength in oil, strong earnings from Lowe's, and optimism towards a US economic rebound.",2020-05-20 10:19:00-04:00,QCOM,positive
1048679.0,"Shares of several technology companies are trading higher amid market strength as news from a Moderna trial stoked optimism about a potential coronavirus vaccine, which has raised hopes of an economic rebound.",2020-05-18 10:16:00-04:00,QCOM,positive
1048680.0,"Q1 13F Roundup: How Buffett, Einhorn, Ackman And Others Adjusted Their Portfolios",2020-05-16 10:15:00-04:00,QCOM,neutral
1048681.0,US To Block Shipments Of Semiconductors To Huawei: Report,2020-05-15 11:40:00-04:00,QCOM,negative
1048682.0,Quick Retreat: Impressive Thursday Turnaround Halted in Its Tracks Amid Fresh Trade Tiff,2020-05-15 10:22:00-04:00,QCOM,positive
1048683.0,Why Qualcomm's Stock Is Trading Lower Today,2020-05-15 09:50:00-04:00,QCOM,negative
1048684.0,Qualcomm shares are trading lower on reports the company is among those China could retaliate against after the US announced it will block chip shipments to Huawei.,2020-05-15 09:46:00-04:00,QCOM,negative
1048685.0,"China's Global Times Mentions Qualcomm, Cisco, Apple And Boeing As 'four companies named by Chinese sources as possible targets for retaliation amid US moves against China's Huawei'",2020-05-15 08:25:00-04:00,QCOM,neutral
1048686.0,19 Technology Stocks Moving In Friday's Pre-Market Session,2020-05-15 07:33:00-04:00,QCOM,neutral
1048687.0,Not Just Fun And Games: How Esports Could Offer Potential Investment Opportunities,2020-05-12 06:43:00-04:00,QCOM,neutral
1048688.0,"Bulls And Bears Of The Week: American Airlines, Peloton, Roku And More",2020-05-09 13:59:00-04:00,QCOM,neutral
1048689.0,Shares of several technology companies are trading higher amid market strength after US job loss figures came in better than expected. The sector has been strong recently as several companies reported strong earnings and benefited from online services.,2020-05-08 10:15:00-04:00,QCOM,positive
1048690.0,Shares of several technology companies are trading higher amid positive market sentiment as some US states and China begin easing lockdown restrictions. Investors also weigh recent earnings from companies in the space.,2020-05-06 10:00:00-04:00,QCOM,positive
1048691.0,"Shares of several technology companies are trading higher amid market strength as some US states begin easing lockdown measures, which has raised hopes of an economic rebound. Investors also weigh recent earnings from companies in the space.",2020-05-05 11:34:00-04:00,QCOM,positive
1048692.0,"Qualcomm Is A Victim Of Its Own Success, Says Bearish Wells Fargo",2020-05-04 10:30:00-04:00,QCOM,positive
1048693.0,"Wells Fargo Initiates Coverage On Qualcomm with Underweight Rating, Announces Price Target to $70",2020-05-04 06:44:00-04:00,QCOM,positive
1048694.0,Shares of several technology companies are trading lower on market weakness as investor uncertainty grows following quarterly earnings results from multiple companies. NOTE: This could potentially be a sell-off after the S&P 500 rallied 12.7% over the past month.,2020-05-01 09:10:00-04:00,QCOM,negative
1048695.0,"Canaccord Genuity Maintains Buy on Qualcomm, Raises Price Target to $102",2020-04-30 12:22:00-04:00,QCOM,neutral
1048696.0,"UBS Maintains Neutral on Qualcomm, Raises Price Target to $77",2020-04-30 09:45:00-04:00,QCOM,neutral
1048697.0,"Morgan Stanley Maintains Equal-Weight on Qualcomm, Raises Price Target to $83",2020-04-30 08:53:00-04:00,QCOM,neutral
1048698.0,"Mizuho Maintains Buy on Qualcomm, Lowers Price Target to $91",2020-04-30 08:26:00-04:00,QCOM,negative
1048699.0,Qualcomm Shares Surge As Q2 Earnings Beat Analyst Estimates Despite Pandemic,2020-04-30 06:21:00-04:00,QCOM,positive
1048700.0,"10 Stocks To Watch For April 30, 2020",2020-04-30 04:59:00-04:00,QCOM,neutral
1048701.0,13 Stocks Moving In Wednesday's After-Hours Session,2020-04-29 17:45:00-04:00,QCOM,neutral
1048702.0,Qualcomm shares are trading higher after the company reported better-than-expected Q2 EPS and sales results.,2020-04-29 16:05:00-04:00,QCOM,positive
1048703.0,"Qualcomm Sees Q3 Adj. EPS $0.60-$0.80 vs $0.75 Estimate, Sales $4.4B-$5.2B vs $4.89B Est.",2020-04-29 16:03:00-04:00,QCOM,neutral
1048704.0,"Qualcomm Q2 Adj. EPS $0.880 Beats $0.780 Estimate, Sales $5.200B Beat $5.020B Estimate",2020-04-29 16:03:00-04:00,QCOM,neutral
1048705.0,Morning Market Stats in 5 Minutes,2020-04-29 11:09:00-04:00,QCOM,neutral
1048706.0,"Shares of several technology companies are trading higher amid market strength following positive data from a study of Gilead's Remdesivir, which is being evaluated for coronavirus. A successful treatment could mean a sooner return to economic activity. NOTE: Some names may also be moving in sympathy following recent earnings from Google and some semiconductor companies.",2020-04-29 10:53:00-04:00,QCOM,positive
1048707.0,"Earnings Scheduled For April 29, 2020",2020-04-29 04:50:00-04:00,QCOM,neutral
1048708.0,Shares of several semiconductor companies are trading higher. Strength potentially related to earnings from notable names in the space this week as well as overall market strength amid a rebound in oil.,2020-04-23 11:19:00-04:00,QCOM,positive
1048709.0,"Shares of several semiconductor companies are trading higher, potentially in sympathy with Texas Instruments, which reported better-than-expected Q1 financial results.",2020-04-22 06:28:00-04:00,QCOM,positive
1048710.0,"Goldman Turns Bearish On Apple, Qualcomm, Projects 36% Drop In Q2 iPhone Sales",2020-04-17 12:17:00-04:00,QCOM,negative
1048711.0,"Mizuho Maintains Buy on Qualcomm, Lowers Price Target to $95",2020-04-17 11:40:00-04:00,QCOM,negative
1048712.0,"Benzinga's Top Upgrades, Downgrades For April 17, 2020",2020-04-17 09:31:00-04:00,QCOM,positive
1048713.0,10 Biggest Price Target Changes For Friday,2020-04-17 08:14:00-04:00,QCOM,neutral
1048714.0,"Goldman Sachs Downgrades Qualcomm to Sell, Lowers Price Target to $61",2020-04-17 07:11:00-04:00,QCOM,negative
1048715.0,"Shares of several semiconductor companies are trading higher, potentially in sympathy with Taiwan Semiconductor, which reported better-than-expected Q1 results.",2020-04-16 09:22:00-04:00,QCOM,positive
1048716.0,Every Member Of Trump's 'Great American Economic Revival' Industry Groups,2020-04-15 13:09:00-04:00,QCOM,positive
1048717.0,"Shares of several technology companies are trading lower as equities fall amid mixed earnings results from banks, a significant decline in the price of oil and worse than expected retail sales in March.",2020-04-15 09:14:00-04:00,QCOM,negative
1048718.0,"Shares of several technology companies are trading higher as markets gain on positive coronavirus outlook. Optimism surrounding the virus has led to hopes of an upcoming return to economic activity, which would benefit the sector.",2020-04-14 10:53:00-04:00,QCOM,positive
1048719.0,"Raymond James Maintains Strong Buy on Qualcomm, Lowers Price Target to $110",2020-04-13 08:28:00-04:00,QCOM,positive
1048720.0,"Susquehanna Maintains Positive on Qualcomm, Lowers Price Target to $100",2020-04-09 11:53:00-04:00,QCOM,positive
1048721.0,"Shares of several technology, semiconductor, and software companies are trading higher amid optimism that coronavirus cases in Asia are potentially easing. Global slowing cases could raise hopes of a sooner return to spending and economic activity.",2020-04-07 07:45:00-04:00,QCOM,positive
1048722.0,Shares of several semiconductor and large technology stocks are trading higher with the broader market on optimism that coronavirus cases in several US hotspots appear to be reaching their peak.,2020-04-06 08:55:00-04:00,QCOM,positive
1048723.0,Shares of several semiconductor and chip companies are trading lower amid overall equity weakness. Macro disruption as a result of the coronavirus pandemic has affected businesses across sectors.,2020-04-03 11:41:00-04:00,QCOM,negative
1048724.0,12 Technology Stocks Moving In Wednesday's Pre-Market Session,2020-04-01 07:39:00-04:00,QCOM,neutral
1048725.0,"Citigroup Maintains Buy on Qualcomm, Lowers Price Target to $98",2020-03-30 08:32:00-04:00,QCOM,negative
1048726.0,"Shares of several technology, semiconductor, and software companies are trading lower as a potential sell-off from this week's strength. While US stimulus legislation has boosted economic optimism, demand concerns still exist amid the coronavirus.",2020-03-27 09:27:00-04:00,QCOM,positive
1048727.0,Deutsche Bank Upgrades Qualcomm to Buy,2020-03-27 07:45:00-04:00,QCOM,neutral
1048728.0,Shares of several semiconductor companies are trading higher following a strong Q2 earnings report from Micron.,2020-03-26 09:58:00-04:00,QCOM,positive
1048729.0,Shares of several technology companies are trading higher amid market strength on hopes of a US economic stimulus package agreement.,2020-03-24 09:10:00-04:00,QCOM,positive
1048730.0,"Shares of several technology, software, and semiconductor companies are trading higher as stocks move higher following Monday morning Fed stimulus action.",2020-03-23 09:21:00-04:00,QCOM,positive
1048731.0,"Shares of several technology companies are trading higher. Market strength has been attributed to strong containment measures taken by California, rebound in oil, central bank actions and expectations of increased technology usage amid the virus outbreak.",2020-03-20 08:31:00-04:00,QCOM,positive
1048732.0,"Qualcomm shares are trading higher, potentially rebounding from recent weakness on the coronavirus. Canaccord Genuity analysts maintained a Buy rating on the stock but  lowered the price target from $115 to $95.",2020-03-19 10:17:00-04:00,QCOM,negative
1048733.0,"Canaccord Genuity Maintains Buy on Qualcomm, Lowers Price Target to $95",2020-03-19 09:51:00-04:00,QCOM,negative
1048734.0,"Morgan Stanley Maintains Equal-Weight on Qualcomm, Lowers Price Target to $78",2020-03-18 09:21:00-04:00,QCOM,negative
1048735.0,"Shares of several technology, software and semiconductor companies are trading lower as equities sell off amid continued global coronavirus concerns. The virus has caused global economic disruption and negatively impacted stocks across sectors.",2020-03-18 08:48:00-04:00,QCOM,negative
1048736.0,11 Technology Stocks Moving In Wednesday's Pre-Market Session,2020-03-18 07:49:00-04:00,QCOM,neutral
1048737.0,"Shares of several technology, semiconductor, and software companies are trading higher, rebounding from Monday's crash. Stocks may also potentially be getting a boost from expectations of further stimulus proposals.",2020-03-17 09:19:00-04:00,QCOM,positive
1048738.0,Shares of several technology stocks are trading lower amid demand and supply chain disruption concerns driven by coronavirus.,2020-03-16 08:39:00-04:00,QCOM,negative
1048739.0,"Shares of several technology, software and semiconductor companies are trading higher as equities rebound following Thursday's crash. The sector has been negatively impacted recently as the coronavirus outbreak has disrupted economic outlook globally.",2020-03-13 09:08:00-04:00,QCOM,negative
1048740.0,"Shares of several technology, software and semiconductor companies are trading lower as equities sell off amid continued global coronavirus concerns. The virus has caused global economic disruption and negatively impacted stocks across sectors.",2020-03-12 09:02:00-04:00,QCOM,negative
1048741.0,"Shares of several companies in the technology, software and semiconductor space are trading lower as equities sell off amid coronavirus fears. The virus spread has disrupted economic activity across sectors and caused global macro uncertainty.",2020-03-11 07:17:00-04:00,QCOM,negative
1048742.0,Qualcomm shares are trading higher after Nomura initiated coverage on the stock with a Buy rating and a $98 price target.,2020-03-10 10:28:00-04:00,QCOM,positive
1048743.0,Here's How Much Investing $100 In Broadcom Stock Back In 2010 Would Be Worth Today,2020-03-10 10:17:00-04:00,QCOM,positive
1048744.0,Qualcomm Raises Quarterly Dividend From $0.62 To $0.65/Share,2020-03-10 09:01:00-04:00,QCOM,neutral
1048745.0,"Nomura Initiates Coverage On Qualcomm with Buy Rating, Announces $98 Price Target",2020-03-10 04:57:00-04:00,QCOM,neutral
1048746.0,"Shares of several companies in the technology, software and semiconductor space are trading lower as equities crash amid coronavirus fears. The virus spread has disrupted economic activity across sectors and caused global macro uncertainty.",2020-03-09 10:20:00-04:00,QCOM,negative
1048747.0,Shares of several technology companies are trading lower. Movement appears market related as markets continue to dip amid the global coronavirus outbreak.,2020-03-06 08:46:00-05:00,QCOM,neutral
1048748.0,21 Technology Stocks Moving In Friday's Pre-Market Session,2020-03-06 07:52:00-05:00,QCOM,neutral
1048749.0,"Shares of several technology, semiconductor, and software companies are trading lower as global markets continue to experience volatility amid the coronavirus spread.",2020-03-05 07:33:00-05:00,QCOM,neutral
1048750.0,"Benzinga's Top Upgrades, Downgrades For March 4, 2020",2020-03-04 10:08:00-05:00,QCOM,positive
1048751.0,"Piper Sandler Initiates Coverage On Qualcomm with Neutral Rating, Announces $80 Price Target",2020-03-04 05:17:00-05:00,QCOM,neutral
1048752.0,Spread of Coronavirus Beyond China to Impact 2020 Semiconductor Market,2020-03-03 05:22:00-05:00,QCOM,neutral
1048753.0,Chinese Government Said to Consider Offering Subsidies for 5G Phone Sales,2020-03-02 05:33:00-05:00,QCOM,neutral
1048754.0,"Shares of companies in the software, technology and semiconductor spaces are trading lower as continued coronavirus fears cause weakness across sectors.",2020-02-27 08:28:00-05:00,QCOM,negative
1048755.0,Qualcomm Option Alert: Jun 19 $90 Calls Sweep (52) near the Ask: 1098 @ $2.66 vs 7352 OI; Ref=$80.23,2020-02-25 14:23:00-05:00,QCOM,positive
1048756.0,"Shares of several semiconductor companies are trading higher as markets partially rebound from Monday's dip. NOTE: While some markets recover, coronavirus fears still persist globally.",2020-02-25 08:29:00-05:00,QCOM,negative
1048757.0,"Qualcomm, United Technologies Executives Join Boeing Board Of Directors",2020-02-25 01:35:00-05:00,QCOM,positive
1048758.0,Qualcomm Option Alert: Apr 17 $85 Calls Sweep (39) near the Ask: 501 @ $3.3 vs 1134 OI; Ref=$83.08,2020-02-24 12:13:00-05:00,QCOM,positive
1048759.0,Shares of several semiconductor companies are trading lower amid continued spread of coronavirus including notable upticks in Iran and Italy. NOTE: The virus has raised fear of a global economic slowdown.,2020-02-24 07:45:00-05:00,QCOM,negative
1048760.0,"Shares of several semiconductor companies are trading lower. Weakness potentially related to the ongoing conronavirus outbreak in China, which has hurt economic activity across sectors including the semi sector, which has China exposure.",2020-02-21 10:36:00-05:00,QCOM,negative
1048761.0,Qualcomm Option Alert: Apr 17 $100 Calls at the Ask: 2900 @ $0.921 vs 7435 OI; Ref=$89.8718,2020-02-19 11:32:00-05:00,QCOM,positive
1048762.0,Shares of several semiconductor companies are trading higher potentially on a rebound following weakness in the sector amid concerns of the coronavirus impeding production and demand.,2020-02-19 10:45:00-05:00,QCOM,negative
1048763.0,Unfazed FAANGs: Pullback In Apple Didn't Carry Over To Other Big Tech Names,2020-02-19 09:35:00-05:00,QCOM,neutral
1048764.0,Shares of several semiconductor companies are trading lower. Weakness potentially related to continued coronavirus fears as well as reports suggesting the US is weighing trade restrictions on China that would limit the use of American chip equipment. Apple reported it does not expect to meet its quarterly revenue forecasts due to implications from the coronavirus.,2020-02-18 06:28:00-05:00,QCOM,negative
1048765.0,"Samsung Presents S20 Flagship Lineup, Joins 5G Race",2020-02-12 05:44:00-05:00,QCOM,positive
1048766.0,Daiwa Capital Upgrades Qualcomm to Outperform,2020-02-12 04:43:00-05:00,QCOM,neutral
1048767.0,Qualcomm shares are trading higher after Arrow Financial increased its stake in the company.,2020-02-11 13:54:00-05:00,QCOM,positive
1048768.0,"Qualcomm shares are trading lower. The company on Wednesday issued cautious outlook based on the coronavirus outbreak in China, which has caused uncertainty around its supply chain. Other semi names are trading lower amid similar concerns.",2020-02-07 10:57:00-05:00,QCOM,negative
1048769.0,Qualcomm Analysts Stay On The Sidelines Following Mixed Guidance,2020-02-07 08:05:00-05:00,QCOM,neutral
1048770.0,"Morgan Stanley Maintains Equal-Weight on Qualcomm, Raises Price Target to $92",2020-02-06 10:11:00-05:00,QCOM,neutral
1048771.0,Qualcomm shares are trading lower after the company said the coronavirus could have a material impact on its near-term profit forecasts. JP Morgan also lowered its price target on the stock from $108 to $105 per share.,2020-02-06 10:06:00-05:00,QCOM,positive
1048772.0,10 Biggest Price Target Changes For Thursday,2020-02-06 08:42:00-05:00,QCOM,neutral
1048773.0,"JP Morgan Maintains Overweight on Qualcomm, Lowers Price Target to $105",2020-02-06 08:41:00-05:00,QCOM,negative
1048774.0,"UBS Maintains Neutral on Qualcomm, Raises Price Target to $91",2020-02-06 07:51:00-05:00,QCOM,neutral
1048775.0,A Peek Into The Markets: US Stock Futures Gain As China Cuts Tariffs,2020-02-06 06:11:00-05:00,QCOM,positive
1048776.0,"12 Stocks To Watch For February 6, 2020",2020-02-06 04:51:00-05:00,QCOM,neutral
1048777.0,Qualcomm Shares Dip Even After Q1 Earnings Beat Over China Coronavirus Outlook,2020-02-05 22:54:00-05:00,QCOM,positive
1048778.0,"From Qualcomm Earnings Conference Call: CFO Says There Is Significant Uncertainty Related To Impact From Coronavirus On Handset, Supply Chain",2020-02-05 17:18:00-05:00,QCOM,negative
1048779.0,"Qualcomm Says It Has Signed Over 85 5G License Agreements In QTL Segment, Up From 75 License Agreements Last November",2020-02-05 16:55:00-05:00,QCOM,positive
1048780.0,Qualcomm Reports Q1 Earnings Beat,2020-02-05 16:12:00-05:00,QCOM,neutral
1048781.0,"Qualcomm Sees Q2 Adj. EPS $0.80-$0.95 vs $0.86 Estimate, Sales $4.9B-$5.7B vs $5.08B Est.",2020-02-05 16:04:00-05:00,QCOM,neutral
1048782.0,"Qualcomm Q1 Adj. EPS $0.99 Beats $0.85 Estimate, Sales $5.057B Beat $4.83B Estimate",2020-02-05 16:04:00-05:00,QCOM,neutral
1048783.0,Here's How Much Investing $100 In Qualcomm Stock Back In 2010 Would Be Worth Today,2020-02-05 09:45:00-05:00,QCOM,positive
1048784.0,"Benzinga Pro's Top 5 Stocks To Watch For Wed., Feb. 5, 2020: TSLA, DIS, SNAP, QCOM, GRUB",2020-02-05 08:39:00-05:00,QCOM,positive
1048785.0,Q1 Earnings Outlook For Qualcomm,2020-02-05 07:21:00-05:00,QCOM,neutral
1048786.0,"10 Stocks To Watch For February 5, 2020",2020-02-05 05:28:00-05:00,QCOM,neutral
1048787.0,"Earnings Scheduled For February 5, 2020",2020-02-05 04:26:00-05:00,QCOM,neutral
1048788.0,Shares of several companies in the broader technology sector are trading lower amid global concerns driven by the coronavirus outbreak in China. The technology sector has strong China exposure and the virus has caused some economic disruption concerns in the country.,2020-01-31 11:32:00-05:00,QCOM,positive
1048789.0,UK Allows Huawei To Build Part Of Its 5G Network,2020-01-28 08:49:00-05:00,QCOM,neutral
1048790.0,"Shares of several semiconductor companies are trading lower as concerns about the Wuhan coronavirus continue to grow, prompting travel bans in multiple Chinese cities. Reports say the death toll rose to 80 with more than 2,700 people now infected.",2020-01-27 07:29:00-05:00,QCOM,negative
1048791.0,Qualcomm To Report Q1 Results Wed. Feb 5 AFter The Close,2020-01-24 09:02:00-05:00,QCOM,neutral
1048792.0,Stocks That Hit 52-Week Highs On Friday,2020-01-17 13:23:00-05:00,QCOM,neutral
1048793.0,Qualcomm shares are trading higher after Citigroup upgraded the stock from Neutral to Buy and raised the price target from $89 to $108 per share.,2020-01-17 10:04:00-05:00,QCOM,positive
1048794.0,"UPDATE: Citigroup Upgrades Qualcomm to Buy, Raises Price Target to $108 As Firm Expects 'upside to both revenue and margins for Qualcomm going forward given share gains in 5G, higher ASPs, and increased royalty revenue.'",2020-01-17 09:56:00-05:00,QCOM,positive
1048795.0,10 Biggest Price Target Changes For Friday,2020-01-17 08:27:00-05:00,QCOM,neutral
1048796.0,"A Peek Into The Markets: US Stock Futures Up Ahead Of Earnings, Economic Data",2020-01-17 06:36:00-05:00,QCOM,neutral
1048797.0,"Citigroup Upgrades Qualcomm to Buy, Raises Price Target to $108",2020-01-17 06:20:00-05:00,QCOM,neutral
1048798.0,"Benzinga's Top Upgrades, Downgrades For January 15, 2020",2020-01-15 10:11:00-05:00,QCOM,positive
1048799.0,A Peek Into The Markets: US Stock Futures Edge Lower; Goldman Sachs Earnings In Focus,2020-01-15 07:13:00-05:00,QCOM,negative
1048800.0,"DZ Bank Upgrades Qualcomm to Buy, Announces $104 Price Target",2020-01-15 07:07:00-05:00,QCOM,neutral
1048801.0,Shares of several semiconductor companies are trading higher. Not seeing any news to justify the price action in the sector. NOTE: The sector could be trading higher as CES 2020 continues to unveil new technology that may involve some of these companies.,2020-01-07 11:35:00-05:00,QCOM,positive
1048802.0,22 Technology Stocks Moving In Friday's Pre-Market Session,2020-01-03 07:47:00-05:00,QCOM,neutral
1048803.0,"Rosenblatt On Qualcomm Notes 'Based on recent observations, 5G smartphone sell-throughs in China have not been as strong as China OEMs expected after the OEMs launched several 5G smartphone models in November and December 2019'",2020-01-02 11:48:00-05:00,QCOM,negative
1048804.0,"Rosenblatt On Qualcomm Notes '5G Smartphone Market: December 5G Smartphone Sales below Expectations, QCOM and MediaTek Q1 5G SoC Orders Cut in Half, No Change to our 2020 Estimates'",2020-01-02 11:47:00-05:00,QCOM,negative
1048805.0,24 Technology Stocks Moving In Thursday's Pre-Market Session,2020-01-02 08:11:00-05:00,QCOM,neutral
1048806.0,Pentagon Wants Open-source 5G Plan in Campaign Against Huawei,2019-12-22 12:25:00-05:00,QCOM,neutral
1048807.0,"Why Broadcom's Rumored RF Exit Is Good News For Skyworks, Qorvo",2019-12-19 14:46:00-05:00,QCOM,positive
1048808.0,Report Predicts 816M 5G Users in China by 2025,2019-12-13 05:34:00-05:00,QCOM,neutral
1048809.0,Demand for 5G mmWave Chips Not Picking up Until H2 2020,2019-12-12 05:28:00-05:00,QCOM,negative
1048810.0,5G Stocks Are Heating Up Ahead Of Tariff Deadline,2019-12-11 15:05:00-05:00,QCOM,neutral
1048811.0,Shares of semiconductors are trading higher. Strength is being attributed to catalysts such as potential US-China trade progress as well as the upcoming 5G upgrade cycle.,2019-12-11 10:34:00-05:00,QCOM,positive
1048812.0,Jorjin Chairman Says Smart Glasses May Replace Smartphones,2019-12-09 06:21:00-05:00,QCOM,positive
1048813.0,Shares of several semiconductor companies are trading higher amid a rally in US equities following strong November jobs data as well as positive US-China trade sentiment.,2019-12-06 10:07:00-05:00,QCOM,positive
1048814.0,Hearing Qualcomm Broadens Challenge To Inte; With Chips For Laptops,2019-12-05 14:03:00-05:00,QCOM,positive
1048815.0,Midrange 5G Handset Chips Market to Heat up in H1 2020,2019-12-05 05:38:00-05:00,QCOM,neutral
1048816.0,S&P Revises Qualcomm Inc. Outlook To 'Stable' From 'Negative'; Rating 'A-',2019-12-03 13:38:00-05:00,QCOM,neutral
1048817.0,Shares of technology companies are trading lower on global macro concerns after Trump implied a US-China trade deal may not occur until 2020.,2019-12-03 08:36:00-05:00,QCOM,neutral
1048818.0,"Najarian Brothers Highlight Unusual Option Activity In Qualcomm, Home Depot And More",2019-11-26 17:15:00-05:00,QCOM,positive
1048819.0,"Canaccord Genuity Reiterates Buy, $101 Target On Qualcomm As Firm Notes 'We attended Qualcomm's first Analyst Day in nearly 4 years and came away confident the company is well positioned to benefit from 5G builds'",2019-11-20 12:16:00-05:00,QCOM,positive
1048820.0,"Cascend Reiterates Buy on Qualcomm, Raises Price Target to $110",2019-11-20 11:55:00-05:00,QCOM,neutral
