Unnamed: 0,title,date,stock,sentiment
1050542.0,"F.A.N.G. Trade Dominated 2015, But What If You're Looking To Play Non-Financials In 2016?",2015-12-02 14:51:00-05:00,QCOM,positive
1050543.0,Mid-Day Market Update: Crude Oil Drops Over 2.5%; On Deck Capital Shares Surge Following Partnership With JPMorgan,2015-12-02 12:23:00-05:00,QCOM,negative
1050544.0,Benzinga's Volume Movers,2015-12-02 10:27:00-05:00,QCOM,neutral
1050545.0,Qualcomm Is Surging Following Xiaomi Partnership,2015-12-02 10:12:00-05:00,QCOM,neutral
1050546.0,Mid-Morning Market Update: Markets Edge Higher; SAIC Earnings Top Expectations,2015-12-02 10:06:00-05:00,QCOM,positive
1050547.0,Morning Market Gainers,2015-12-02 09:47:00-05:00,QCOM,neutral
1050548.0,"Qaulcomm +3.37% Premarket @$50.96; Qualcomm, Xiaomi Sign 3G/4G License Agreement",2015-12-02 07:52:00-05:00,QCOM,positive
1050549.0,"Qualcomm, Xiaomi Sign 3G/4G License Agreement",2015-12-02 07:31:00-05:00,QCOM,positive
1050550.0,"Apple iPhone Sales Face Slowdown Risk In March Quarter, Detwiler Fenton Warns",2015-12-01 12:38:00-05:00,QCOM,negative
1050551.0,Detwiler Fenton Sees iPhone Sales At Risk Of Being Down YoY Heading Into March Quarter 2015,2015-12-01 10:45:00-05:00,QCOM,negative
1050552.0,Detwiler Fenton Sees Increasing Inventory Level Reflecting Weakening US Smartphone Market,2015-12-01 08:57:00-05:00,QCOM,negative
1050553.0,Barron's Recap: Impact Investing Done Right,2015-11-30 16:25:00-05:00,QCOM,neutral
1050554.0,"Early Global News: Clinton's $275 Billion Infrastructure Plan, US Proximity Mobile Payment Transactions to Reach $8.71 Billion And More",2015-11-30 08:05:00-05:00,QCOM,neutral
1050555.0,"Summit Research's Srini Sundararajan Names Potential Suitors for Global-Foundries: Samsung, TSMC, Qualcomm, Tsinghua Unigroup, or Chinese Gov't",2015-11-30 07:38:00-05:00,QCOM,neutral
1050556.0,Party Time? Qualcomm Added To BofA's US1 List,2015-11-24 09:15:00-05:00,QCOM,positive
1050557.0,Does Qualcomm's Break-Up Value Hint At Massive Upside?,2015-11-19 12:00:00-05:00,QCOM,positive
1050558.0,Morning Market Losers,2015-11-18 09:50:00-05:00,QCOM,negative
1050559.0,"Early Global News: ON Semiconductor To Buy Fairchild, Stratasys And Autos, Google Maps Vs. Yelp",2015-11-18 08:33:00-05:00,QCOM,neutral
1050560.0,Benzinga's Top #PreMarket Losers,2015-11-18 08:16:00-05:00,QCOM,negative
1050561.0,"Qualcomm Confirms Receipt of Korea Fair Trade Commission Case Examiner's Report; Says Allegations, Conclusions Contained in Report Not Supported by Facts -Reuters",2015-11-17 20:41:00-05:00,QCOM,positive
1050562.0,JANA Shows Reduced Stake in QUALCOMM from ~28.82M Shares to ~2.86M Shares,2015-11-16 15:42:00-05:00,QCOM,positive
1050563.0,China's Tsinghua Unigroup to Invest $47B Over Next 5 Years in Attempt to Become Third Largest Chip Maker -Reuters,2015-11-16 05:32:00-05:00,QCOM,neutral
1050564.0,Why Nomura Just Cut QUALCOMM To Neutral After Reporting Earnings,2015-11-09 11:01:00-05:00,QCOM,negative
1050565.0,"Nomura Downgrades Qualcomm to Neutral, Lowers PT to $60.00",2015-11-09 07:55:00-05:00,QCOM,negative
1050566.0,Dan Nathan Sees Unusual Options Activity In QUALCOMM,2015-11-06 06:47:00-05:00,QCOM,neutral
1050567.0,Stocks Turn Choppy Mid-Week As Fed Weighs In On December Hike,2015-11-05 12:06:00-05:00,QCOM,neutral
1050568.0,Android One Is Making A Comeback… In India,2015-11-05 10:14:00-05:00,QCOM,neutral
1050569.0,Morning Market Losers,2015-11-05 09:47:00-05:00,QCOM,negative
1050570.0,Benzinga's Top #PreMarket Losers,2015-11-05 08:16:00-05:00,QCOM,negative
1050571.0,US Stock Futures Surge Ahead Of Jobless Claims Data,2015-11-05 07:22:00-05:00,QCOM,neutral
1050572.0,"QUALCOMM Posts Upbeat Q4 Earnings, But Issues Weak Profit Outlook",2015-11-05 02:13:00-05:00,QCOM,neutral
1050573.0,QUALCOMM Shares Down 5.5% in After-Hours Trade,2015-11-04 18:37:00-05:00,QCOM,positive
1050574.0,From Conf Call: Qualcomm Says Continue to Expect to Complete Strategic Review by End of Calendar Year,2015-11-04 16:52:00-05:00,QCOM,neutral
1050575.0,"Wednesday's After-Hours Movers Include Facebook, FireEye, Qualcomm, Whole Foods, Homeaway And Expedia",2015-11-04 16:46:00-05:00,QCOM,neutral
1050576.0,Qualcomm shares down ~2% following earnings release,2015-11-04 16:07:00-05:00,QCOM,positive
1050577.0,"Qualcomm Sees Q1 Sales $5.2B-$6B vs $5.79B Est., Adj. EPS $0.80-$0.90 vs $1.08 Est.",2015-11-04 16:06:00-05:00,QCOM,neutral
1050578.0,"QUALCOMM Reports Q4 Sales $5.5B vs $5.21B Est., EPS $0.91 vs $0.86 Est.",2015-11-04 16:04:00-05:00,QCOM,neutral
1050579.0,"Expert Discusses Options Activity In Facebook, Qualcomm, FireEye and Whole Foods Ahead Of Earnings",2015-11-04 15:55:00-05:00,QCOM,neutral
1050580.0,"Keep an Eye on These 10 Stocks for November 4, 2015",2015-11-04 04:59:00-05:00,QCOM,neutral
1050581.0,"Earnings Scheduled For November 4, 2015",2015-11-04 04:03:00-05:00,QCOM,neutral
1050582.0,"Qualcomm,ZTE Sign New 3G/4G License, Increasing Long-Term Partnership",2015-11-02 16:34:00-05:00,QCOM,neutral
1050583.0,"Benzinga's M&A Chatter for Tuesday October 27, 2015",2015-10-27 19:30:00-04:00,QCOM,neutral
1050584.0,Xilinx Spikes Higher; Hearing Unconfirmed Marker Chatter Exploring Sale,2015-10-27 11:19:00-04:00,QCOM,negative
1050585.0,Qualcomm's Snapdragon Flight Platform Expected to Boost Global Demand for Drones -DigiTimes,2015-10-27 04:30:00-04:00,QCOM,positive
1050586.0,Option Alert: $QCOM Nov $57 Put Sweep; 2908 Contracts @Ask @$0.65,2015-10-23 11:42:00-04:00,QCOM,positive
1050587.0,"Canaccord's Walkley Lowers Price Target on QUALCOMM from $75 to $72, Maintains Buy; Cites 'slowing global",2015-10-21 08:27:00-04:00,QCOM,negative
1050588.0,Qualcomm's Capsule Receives FDA Clearance of SmartLinx Vitals Plus™,2015-10-21 07:31:00-04:00,QCOM,positive
1050589.0,UPDATE: PTC To Acquire Vuforia From Qualcomm For $65M,2015-10-12 08:17:00-04:00,QCOM,neutral
1050590.0,Qualcomm To Sell Vuforia Business To PTC,2015-10-12 08:16:00-04:00,QCOM,neutral
1050591.0,"Qualcomm, Xilinx Partner to Deliver Industry-Leading Heterogeneous Computing Solutions for Data Centers with New Levels of Efficiency and Performance",2015-10-08 15:30:00-04:00,QCOM,positive
1050592.0,"Qualcomm and Mellanox Collaborate to Enable Advanced, Cost-Effective Data Center Platforms for Servers and Storage",2015-10-08 15:30:00-04:00,QCOM,positive
1050593.0,"Qualcomm Reports LTE Advanced for Win 10 Notebooks, 2-in-1 Tablets",2015-10-07 16:36:00-04:00,QCOM,positive
1050594.0,Option Alert: $QCOM Oct 9 $56 Put Sweep; 5000 Contracts Above Ask @$0.54; Now $56.07,2015-10-05 11:34:00-04:00,QCOM,positive
1050595.0,"Northland Warning On CRUS, Believes Co Lost SamSung Galaxy 7 Following QCOM Displacement",2015-10-02 10:17:00-04:00,QCOM,negative
1050596.0,Samsung to Use Qualcomm Chips for Some Galaxy S Smartphones - South Korea's Electronic Times,2015-10-02 04:28:00-04:00,QCOM,neutral
1050597.0,5 Charts From Goldman Sachs That Support Carl Icahn's Buyback-Danger Thesis,2015-09-29 13:17:00-04:00,QCOM,positive
1050598.0,"Ikanos Shares Halted with Code 'For Info'; BZ NOTE: Co. Being Acquired by Qualcomm, Shares to No Longer Trade",2015-09-29 08:39:00-04:00,QCOM,positive
1050599.0,Qualcomm to Invest Up to $150M in Indian Startups,2015-09-27 06:39:00-04:00,QCOM,neutral
1050600.0,Option Alert: $QCOM Oct 2 $53.5 Call; 2201 Contracts Above Ask @$0.89; Now $53.86,2015-09-25 09:58:00-04:00,QCOM,positive
1050601.0,Slowing Buybacks Drag On Buyback ETFs,2015-09-24 16:30:00-04:00,QCOM,negative
1050602.0,Handset OEM's Planning Projects Using Qualcomm's Snapdragon 820; Qualcomm's Main Challenge to Come from Apple in 2016 -DigiTimes,2015-09-24 04:29:00-04:00,QCOM,positive
1050603.0,Use 'Best Of Breed' Stocks If You Want To Beat The Market,2015-09-23 12:15:00-04:00,QCOM,positive
1050604.0,Qualcomm Extends Tender Offer Period to Acquire Ikanos Communications,2015-09-15 19:00:00-04:00,QCOM,positive
1050605.0,US Stock Futures Edge Lower Ahead Of Economic Data,2015-09-15 07:05:00-04:00,QCOM,negative
1050606.0,Qualcomm Announces Collaboration with America Movil on Global Pass Program,2015-09-15 04:10:00-04:00,QCOM,neutral
1050607.0,Qualcomm Acquires Capsule Technologies; Terms Not Disclosed,2015-09-14 07:30:00-04:00,QCOM,neutral
1050608.0,Option Alert: $QCOM Sep $55.5 Call Sweeo; 1999 Contracts @Ask @$0.64; Now $54.83,2015-09-11 10:09:00-04:00,QCOM,positive
1050610.0,"JP Morgan Assumes Qualcomm at Neutral, Announces $57.50 PT",2015-09-08 08:22:00-04:00,QCOM,positive
1050611.0,Qualcomm Considers Putting Vuforia Augmented Reality Tech Division Up For Sale,2015-09-03 17:01:00-04:00,QCOM,neutral
1050612.0,Qualcomm Exploring Sale of Vuforia Augmented Reality Unit -re/code,2015-09-03 16:51:00-04:00,QCOM,neutral
1050613.0,"Semiconductors Struggling, These Names Down 2% Or More; Ambarella To Report After Market Closes, Down 6.24% On The Day",2015-09-01 14:46:00-04:00,QCOM,negative
1050614.0,ParkerVision Comments on Inter Partes Review Petitions Filed by Qualcomm,2015-09-01 08:23:00-04:00,QCOM,neutral
1050615.0,Qualcomm Life Announces New Connected Health Collaborations at Connect 2015,2015-08-31 07:30:00-04:00,QCOM,neutral
1050616.0,3 Semiconductor Stocks With Big Swings In Short Interest,2015-08-27 08:10:00-04:00,QCOM,positive
1050617.0,"Stifel Maintains Buy On Ambarella Ahead Of Q2 Results, Sees Recent Sell-Off 'Overreaction'",2015-08-26 09:43:00-04:00,QCOM,neutral
1050618.0,US Stock Futures Signal Higher Start On Wall Street,2015-08-26 07:42:00-04:00,QCOM,neutral
1050619.0,Qualcomm to Sell UK L-Band Spectrum to Vodafone and H3G; Terms Not Disclosed,2015-08-26 04:31:00-04:00,QCOM,neutral
1050620.0,"Qualcomm Sells UK Spectrum Rights to Vodafone, CK Hutchison for ~$313.8M, Accoding to Sources -Bloomberg",2015-08-25 19:23:00-04:00,QCOM,neutral
1050621.0,6 Stocks Ronnie Moas Is Shopping For Amid Market Selloff,2015-08-24 12:26:00-04:00,QCOM,neutral
1050622.0,"Standpiont's Ronnie Moas Says Hes 'Going Shopping' as DJIA Opens Down 800 Points: Upgrades Qualcomm, Wesco to Buy, Initiates Alibaba, Macy's, United Air, Juno Therapeutics with Buys",2015-08-24 10:20:00-04:00,QCOM,positive
1050623.0,Standpoint Research Upgrades Qualcomm to Buy,2015-08-24 10:18:00-04:00,QCOM,neutral
1050624.0,"Taiwan Semiconductor Gains Customers for 16nm FinFET Chips, Including Apple, AMD, Avago, Broadcom, Nvidia, Xilinx, Loses Qualcomm Mobile Chips -DigiTimes",2015-08-24 05:19:00-04:00,QCOM,neutral
1050625.0,"Barry Rosenstein's Jana Partners Like Qualcomm & ConAgra, Sell Out Of eBay & Ashland",2015-08-18 16:23:00-04:00,QCOM,positive
1050626.0,"Qualcomm to Still Supply Modem Chips for New iPhone, in Partnership With Taiwan Semiconductor, According to Sources -DigiTimes",2015-08-18 05:16:00-04:00,QCOM,neutral
1050627.0,20 Stocks With The Highest Exposure To China's Lagging Economy,2015-08-11 11:09:00-04:00,QCOM,negative
1050628.0,20 Dividend Growth Stocks To Buy Today For Your Retirement Portfolio,2015-08-09 17:52:00-04:00,QCOM,positive
1050629.0,"Brean Sees Yellow Flags At Nvidia, Cites Expected FCF Contraction Following Final Intel Royalty Pmt In Q1 2018, Notes Nvidia Litigation Efforts Against Samsung & Qualcomm To Secure Additional IP Revenue Streams",2015-08-07 06:15:00-04:00,QCOM,positive
1050630.0,"Mid-Day Market Update: Thursday's Movers, Jobs Report, Bill Ackman And More",2015-08-06 13:42:00-04:00,QCOM,neutral
1050631.0,Morning Market Gainers,2015-08-06 09:47:00-04:00,QCOM,neutral
1050632.0,Ikanos to Resume Trading @8:00 AM ET,2015-08-06 07:54:00-04:00,QCOM,neutral
1050633.0,Qualcomm's Atheros Unit to Buy Ikanos for $2.75/Share in Cash,2015-08-06 07:34:00-04:00,QCOM,neutral
1050634.0,Cashing In The Pot On Chip ETFs,2015-08-05 08:24:00-04:00,QCOM,neutral
1050635.0,Bill Fleckenstein Is Bearish On Semiconductors,2015-08-04 06:44:00-04:00,QCOM,neutral
1050636.0,U.S. Appeals Rules In Favor Of Qualcomm In Patent Dispute With Parkervision-Reuters,2015-07-31 09:52:00-04:00,QCOM,neutral
1050637.0,Cramer Versus Citron: The Ambarella Debate Rages On,2015-07-29 17:54:00-04:00,QCOM,negative
1050638.0,Qualcomm Unveils Wireless Charging for Mobile Devices with Metal Cases,2015-07-28 07:36:00-04:00,QCOM,neutral
1050639.0,"Qualcomm Upgraded To Overweight At Morgan Stanley, Firm Sees Multiple 'Upside Drivers'",2015-07-27 10:05:00-04:00,QCOM,negative
1050640.0,Benzinga's Top Upgrades,2015-07-27 09:02:00-04:00,QCOM,positive
1050641.0,Morgan Stanley Upgrades Qualcomm to Overweight,2015-07-27 07:18:00-04:00,QCOM,negative
1050642.0,"Weekly Tech Highlights: Apple's Record-Breaking Quarter, Amazon Is A 'Full-On Crusher' And GoPro's 'Very Good' Results",2015-07-24 15:48:00-04:00,QCOM,positive
1050643.0,Why Qualcomm's Restructuring Is Good For Long-Term Investors,2015-07-24 11:45:00-04:00,QCOM,positive
1050644.0,Mid-Day Market Update: SanDisk Jumps On Upbeat Results; QUALCOMM Shares Slide,2015-07-23 12:41:00-04:00,QCOM,positive
1050645.0,Mid-Morning Market Update: Markets Mixed; GM Profit Beats Views,2015-07-23 11:20:00-04:00,QCOM,positive
1050646.0,How Apple Could Affect These 2 Tech Stocks,2015-07-23 10:51:00-04:00,QCOM,neutral
1050647.0,Morning Market Losers,2015-07-23 10:02:00-04:00,QCOM,negative
1050648.0,Benzinga's Top #PreMarket Losers,2015-07-23 08:18:00-04:00,QCOM,negative
1050649.0,"US Stock Futures Rise Ahead Of General Motors, McDonald's Earnings",2015-07-23 06:55:00-04:00,QCOM,neutral
1050650.0,"Qualcomm Will 'Fight' Through Restructuring, 'Start Growing Again At Some Point'",2015-07-23 06:49:00-04:00,QCOM,positive
1050651.0,Fast Money Picks For July 23,2015-07-23 06:35:00-04:00,QCOM,neutral
1050652.0,"10 Stocks To Watch For July 23, 2015",2015-07-23 04:14:00-04:00,QCOM,neutral
1050653.0,"Udall on Qualcomm Restructuring: China Has 'Made Life Difficult...' for Co., Sees Restructuring Potentially Alleviating Some of This 'Business Weakness'",2015-07-22 18:10:00-04:00,QCOM,negative
1050654.0,"The Tech Stock Strategist Sean Udall Comments on Qualcomm's Restructuring News: Believes It Isn't Necessarily Good News, But Says 'Might Be Good News from an Investment Standpoint Long Term'",2015-07-22 18:08:00-04:00,QCOM,negative
1050655.0,Wednesday's After-Hours Movers: Another Earnings-Filled Evening,2015-07-22 17:00:00-04:00,QCOM,neutral
1050656.0,"QUALCOMM Posts Upbeat Q3 Profit, Issues Weak Forecast",2015-07-22 16:28:00-04:00,QCOM,neutral
1050657.0,"Qualcomm Cuts FY15 Sales Guidance from $25B-$27B to $24.5B-$25.5B vs $25.95B Est., Adj. EPS $4.60-$5 to $4.50-$4.70 vs $4.79 Est.",2015-07-22 16:14:00-04:00,QCOM,negative
1050658.0,"Qualcomm Sees Q4 Adj. EPS $0.75-$0.95 vs $1.08 Est., Sales $4.7B-$5.7B vs $6.13B Est.",2015-07-22 16:04:00-04:00,QCOM,neutral
1050659.0,UPDATE: Qualcomm Announces Added Details on Strategic Realignment Plan,2015-07-22 16:03:00-04:00,QCOM,neutral
1050660.0,Qualcomm Announces Added Details on Strategic Realignment Plan,2015-07-22 16:02:00-04:00,QCOM,neutral
1050661.0,"Qualcomm Reports Q3 EPS $0.99 Vs Est $0.95, Sales $5.8B Vs Est $5.86B",2015-07-22 16:01:00-04:00,QCOM,neutral
1050662.0,"Earnings Scheduled For July 22, 2015",2015-07-22 04:34:00-04:00,QCOM,neutral
1050663.0,"Keep an Eye on These 10 Stocks for July 22, 2015",2015-07-22 04:11:00-04:00,QCOM,neutral
1050664.0,1 Reason To Own Qualcomm (Apart From Jana Partners Wish Coming True),2015-07-21 15:45:00-04:00,QCOM,positive
1050665.0,Multiple Negatives Hang Over Qualcomm This Earnings Season,2015-07-21 14:57:00-04:00,QCOM,neutral
1050666.0,8 Internet Stocks Brean Capital Is Watching Ahead Of Earnings,2015-07-21 11:02:00-04:00,QCOM,neutral
1050668.0,Morning Market Gainers,2015-07-21 09:43:00-04:00,QCOM,neutral
1050669.0,Benzinga's Top #PreMarket Gainers,2015-07-21 08:09:00-04:00,QCOM,positive
1050670.0,"Qualcomm Shares Higher Premarket Following Wall Street Journal Report of Potential Strategic Review, Which Could Include Layoffs, Breakup of Co",2015-07-21 05:25:00-04:00,QCOM,positive
1050671.0,"Qualcomm Expected to Conduct Strategic Review, Including Potential of Breakup, According to Sources -Wall Street Journal",2015-07-20 19:22:00-04:00,QCOM,neutral
1050672.0,Qualcomm to Lay Off Thousands of Employees -The Information,2015-07-20 16:04:00-04:00,QCOM,neutral
1050673.0,"iPhone Momentum, China On Apple Analysts' Minds Heading Into Tuesday's Report",2015-07-20 14:20:00-04:00,QCOM,neutral
1050674.0,Hearing The Deal Says Jana Pressuring Qualcomm for a Breakup,2015-07-16 14:58:00-04:00,QCOM,negative
1050675.0,Qualcomm Responds to European Competition Authority Announcement,2015-07-16 05:22:00-04:00,QCOM,positive
1050676.0,"Mizuho Securities Initiates Coverage on Qualcomm at Neutral, Announces $68.00 PT",2015-07-15 07:06:00-04:00,QCOM,positive
1050677.0,Qualcomm Cooperating with Microsoft on Low-Cost Smartphones -DigiTimes,2015-07-15 04:33:00-04:00,QCOM,neutral
1050678.0,"Canaccord Lowers Android, Qualcomm, BlackBerry And China Smartphone Estimates…But Hikes Apple Forecast",2015-07-08 12:41:00-04:00,QCOM,negative
1050679.0,9 Top Sell Ideas From Oppenheimer's Technical Analysis Division,2015-07-06 12:16:00-04:00,QCOM,positive
1050680.0,Top 4 Large-Cap Stocks In The Communication Equipment Industry With The Highest EPS Growth Forecast For Next 5 Years,2015-07-01 03:19:00-04:00,QCOM,positive
1050681.0,"Hearing Chatter That AMD May Be Trying To Sell Its Server & Graphics Chips Biz, Could Be Part Of Preparation For A Sale To Qualcomm - UNCONFIRMED",2015-06-30 09:38:00-04:00,QCOM,negative
1050682.0,CNBC's Stock Pops & Drops From June 29,2015-06-30 07:22:00-04:00,QCOM,neutral
1050683.0,Drexel Hamilton Downgrades Qualcomm As Competition Intensifies,2015-06-29 10:39:00-04:00,QCOM,neutral
1050684.0,Drexel Hamilton Downgrades Qualcomm to Sell,2015-06-29 07:24:00-04:00,QCOM,neutral
1050685.0,Qualcomm-Backed Matterport Raises $30 Million To Enhance Virtual Reality,2015-06-26 07:41:00-04:00,QCOM,neutral
1050686.0,"Android Launch Delays Probably Help Apple, Susquehanna Says",2015-06-24 09:15:00-04:00,QCOM,positive
1050687.0,Summit Research's Srini Sundararajan Issues Note Suggesting Qualcomm is Looking to Buy Co.Which Has 'Expertise in Making Arm-Based Server Processors',2015-06-24 09:12:00-04:00,QCOM,neutral
1050688.0,Report: Texas Instruments Might Do Big Deal,2015-06-20 11:13:00-04:00,QCOM,neutral
1050689.0,Pacific Crest Has Concerns About Chip Suppliers,2015-06-19 15:26:00-04:00,QCOM,neutral
1050690.0,Option Alert: Qualcomm Jun  $67.5 Call; 1111 Contract Trade Above Ask @$0.23,2015-06-18 10:14:00-04:00,QCOM,positive
1050691.0,Hearing Unconfirmed Market Chatter Jana Pressuring Qualcomm to Spinoff Chip Business,2015-06-18 10:13:00-04:00,QCOM,negative
1050692.0,"Applied Micro Circuits Addition of Long-time Shareholder to Board Could Indicate it is Takeover Target for Qualcomm, Others -The Deal",2015-06-16 10:14:00-04:00,QCOM,neutral
1050693.0,Short Sellers Pile On Qualcomm,2015-06-15 08:08:00-04:00,QCOM,neutral
1050694.0,Wedbush Met With Nvidia's CFO; Here's What Happened,2015-06-12 10:02:00-04:00,QCOM,neutral
1050695.0,Qualcomm Names Frank Meng as Chair of Qualcomm China,2015-06-10 08:10:00-04:00,QCOM,neutral
1050696.0,"UPDATE: Lattice Semiconductor CEO Says Wants Bigger Premium Than That Offered By Intel For Altera, Says Qualcomm, Mediatek are Good Fits",2015-06-04 12:22:00-04:00,QCOM,positive
1050697.0,Lattice Semiconductor CEO Says Open To A Sale -Reuters,2015-06-04 12:20:00-04:00,QCOM,neutral
1050698.0,Semiconductor M&As: Who's Next?,2015-06-04 09:34:00-04:00,QCOM,neutral
1050699.0,Mantis Vision Raises $9.7 Million in an Investment Round Lead by Formation 8 to Accelerate MV4D(TM) 3D Core Technology Adaptation,2015-06-03 11:00:00-04:00,QCOM,positive
1050700.0,"Take Advantage Of Weakness In Semiconductors, Citigroup Says",2015-06-02 11:28:00-04:00,QCOM,negative
1050701.0,"Auto Titans, Tech Giants Are Meeting In Detroit This Week",2015-06-01 17:43:00-04:00,QCOM,neutral
1050702.0,"Apple's Critical Acquisition, Google-Tesla Merger Debunked And More Weekly Tech Highlights",2015-05-30 10:34:00-04:00,QCOM,negative
1050703.0,Qualcomm To Power Google's Next Gen. Project Tango Smartphone Development Platform,2015-05-29 16:05:00-04:00,QCOM,neutral
1050704.0,Hearing Unconfirmed Chatter Qualcomm May Come in With Higher Bid for Broadcom,2015-05-29 09:57:00-04:00,QCOM,negative
1050705.0,Ladenburg Analyst Adds That There Were Two Companies Other Than Avago That Could Bid For Broadcom That Would Make 'Financial And Strategic Sense.',2015-05-28 15:31:00-04:00,QCOM,neutral
1050706.0,Why GoPro's Quadcopter Has $17.50/Share Upside (And Could Boost Ambarella),2015-05-28 12:02:00-04:00,QCOM,positive
1050708.0,Ambarella Would Give Qualcomm 'A New Growth Engine',2015-05-28 09:31:00-04:00,QCOM,positive
1050709.0,PacCrest: Broadcom A 'Strategic Fit' For Avago,2015-05-28 08:30:00-04:00,QCOM,positive
1050710.0,"Rally Software Development, VAALCO Energy, TubeMogul Lead Wednesday's After-Hours Movers",2015-05-27 17:27:00-04:00,QCOM,positive
1050711.0,Option Alert: Qualcomm Jul $72.5 Call; 2960 Contract Trade Above Ask @$.88,2015-05-27 14:47:00-04:00,QCOM,positive
1050712.0,Pacific Crest: Qualcomm Buying Ambarella Is 'Plausible',2015-05-27 11:07:00-04:00,QCOM,neutral
1050713.0,Pacific Crest: GoPro Checks Good News For Ambarella,2015-05-27 09:16:00-04:00,QCOM,positive
1050714.0,Pacific Crest Analyst Comments on Qualcomm-Amabarella Rumor: Sees 'Plausible Room for Ambarella-Sized Deal',2015-05-27 08:42:00-04:00,QCOM,neutral
1050715.0,Report: Daimler Working With Baidu And Qualcomm On New Auto Technology,2015-05-26 12:21:00-04:00,QCOM,neutral
1050716.0,Qualcomm Announces NTT DOCOMO Adopts New Qualcomm Snapdragon Sense ID Biometrics Platform,2015-05-26 04:43:00-04:00,QCOM,positive
1050717.0,"Daimler, Qualcomm to Collaborate on Connected Car Technologies",2015-05-23 14:02:00-04:00,QCOM,neutral
1050718.0,Qualcomm Rallies With Accelerated Buyback Plan,2015-05-21 08:45:00-04:00,QCOM,neutral
1050719.0,Qualcomm Announces Accelerated $5B Buyback Plan,2015-05-21 07:30:00-04:00,QCOM,neutral
1050720.0,21 Inc. Finally Reveals Its Secretive Product: A Bitcoin Mining Chip,2015-05-19 13:43:00-04:00,QCOM,neutral
1050721.0,"Barry Rosenstein, Jana Partners' Latest Moves Include Qualcomm, United Rentals And Yum Brands",2015-05-15 13:59:00-04:00,QCOM,positive
1050722.0,"Jana Partners 13-F Shows New Stake In United Rentals, Brookdale Senior Living, Starz, Starwood Hotels, YUM; Increased Stake Qualcomm; Closes PetSmart",2015-05-15 10:58:00-04:00,QCOM,positive
1050723.0,"Intel's Mobile Restructuring Could Be More Crucial Than M&A, BofA Says",2015-05-15 09:41:00-04:00,QCOM,neutral
1050724.0,3 Semiconductor Stocks With Soaring Short Interest,2015-05-14 15:39:00-04:00,QCOM,positive
1050725.0,Every BlackBerry M&A Rumor That Turned Out To Be False,2015-05-14 12:07:00-04:00,QCOM,neutral
1050726.0,Dan Nathan Sees Unusual Bullish Options Activity In QUALCOMM,2015-05-14 06:52:00-04:00,QCOM,neutral
1050727.0,"Barclays Is Overweight Avago, Sees 'Room For M&A'",2015-05-12 06:41:00-04:00,QCOM,negative
1050728.0,EU Source Says Antitrust Regulators Not Investigating Qualcomm Over Patent Licensing Deals -Reuters,2015-05-07 14:09:00-04:00,QCOM,neutral
1050729.0,"SALT 2015: Fighting The Fed, Activists And The Loeb-Buffett Rant",2015-05-07 12:40:00-04:00,QCOM,negative
1050731.0,Qualcomm to have Roadshow for Jumbo Bond -Reuters,2015-05-07 10:03:00-04:00,QCOM,neutral
1050732.0,"Cubic Telecom Announces €18M Co-Investment from Audi, Qualcomm",2015-05-06 05:02:00-04:00,QCOM,neutral
1050733.0,"NXP Semi Announces Qualcomm's Qualcomm Technologies Unit to Integrate Co.'s NFC, eSE Solutions Across Snapdragon 800, 600, 400, 200 Platforms",2015-05-05 12:01:00-04:00,QCOM,negative
1050734.0,Barry Rosenstein: Hopeful QUALCOMM's Management Will Cooperate,2015-05-04 15:50:00-04:00,QCOM,positive
1050735.0,"JANA's Rosenstein Currently Speaking on CNBC Following Ira Sohn Presentation, Says He Has Had 'Many' 'Constructive' Talks with Qualcomm Mgmt",2015-05-04 12:55:00-04:00,QCOM,neutral
1050736.0,"JANA's Rosenstein, at Ira Sohn, Calls Qualcomm Shares 'Significantly Undervalued'",2015-05-04 12:45:00-04:00,QCOM,positive
1050737.0,"Qualcomm Shares Spiking Over $69 as JANA's Barry Rosenstein, at Ira Sohn, Says He's Long",2015-05-04 12:42:00-04:00,QCOM,positive
1050738.0,"Ira Sohn Conference Live Blog: Movers, Shakers, Hedgie Comments",2015-05-04 12:08:00-04:00,QCOM,positive
1050739.0,Wedbush Offers 4 Semiconductor Stocks To Watch Ahead Of Next Week's Earnings,2015-05-01 12:08:00-04:00,QCOM,neutral
1050740.0,"Qualcomm Announces 40 Designs in Pipeline for Premium Tier, High-Volume Mobile Devices in China",2015-04-28 04:47:00-04:00,QCOM,neutral
1050741.0,Does Apple Hide More Cash Abroad Than Anyone?,2015-04-26 13:21:00-04:00,QCOM,negative
1050742.0,Barron's Recap: The Big Money Poll,2015-04-26 10:44:00-04:00,QCOM,neutral
1050743.0,Citi Still Likes Qualcomm,2015-04-23 14:29:00-04:00,QCOM,positive
1050744.0,Benzinga's Top Downgrades,2015-04-23 09:05:00-04:00,QCOM,positive
1050745.0,Exane BNP Paribas Downgrades QUALCOMM To  Neutral,2015-04-23 08:27:00-04:00,QCOM,neutral
1050746.0,Polcari: Now Who Is Spoofing Us?,2015-04-23 07:55:00-04:00,QCOM,neutral
1050747.0,"Qualcomm Still Worth $80/Share, Credit Suisse Says",2015-04-23 07:13:00-04:00,QCOM,positive
1050748.0,Exane BNP Paribas Downgrades Qualcomm to Neutral,2015-04-23 06:39:00-04:00,QCOM,neutral
1050749.0,"10 Stocks To Watch For April 23, 2015",2015-04-23 04:55:00-04:00,QCOM,neutral
1050750.0,"QUALCOMM Posts Upbeat Q2 Results, But Lowers FY Outlook",2015-04-22 17:04:00-04:00,QCOM,negative
1050751.0,"UPDATE: Qualcomm Expecting Q3 Adj. EPS $0.85-$1 vs $1.13 Est., Sales $5.4B-$6.2B vs $6.5B Est.; Cuts FY Outlook from $4.85-$5.05 to $4.60-$5 vs $5 Est.",2015-04-22 16:11:00-04:00,QCOM,negative
1050752.0,"Qualcomm Cuts FY15 Outlook, Cites Customer Share Shifts Related to Premium Tier",2015-04-22 16:03:00-04:00,QCOM,neutral
1050753.0,"Qualcomm Reports Q2 Adj. EPS $1.40 vs $1.34 Est., Sales $6.89B vs $6.82B Est.",2015-04-22 16:01:00-04:00,QCOM,neutral
