Unnamed: 0,title,date,stock,sentiment
1179006.0,"Wedbush Downgrades Stericycle, Inc. to Neutral, Maintains $120.00 PT",2013-08-28 07:40:00-04:00,SRCL,neutral
1179007.0,"Stericycle's ExpertSOLUTIONS Buys Eclipse Marketing, No Terms Disclosed",2013-08-06 10:03:00-04:00,SRCL,negative
1179008.0,"Barrington Research Maintains Outperform on Stericycle, Inc., Raises PT to $127.00",2013-07-29 10:40:00-04:00,SRCL,neutral
1179009.0,"Stericycle, Inc. Reports Q2 EPS of $0.93 vs $0.91 Est; Revenue of $526.50M vs $529.08M Est",2013-07-24 16:21:00-04:00,SRCL,neutral
1179010.0,SLIDESHOW: The Transformer Portfolio That Outperformed the S&P 500,2013-07-23 15:13:00-04:00,SRCL,neutral
1179011.0,UPDATE: Wunderlich Securities Upgrades Stericycle to Buy on Multiple Positive Factors,2013-06-10 08:18:00-04:00,SRCL,positive
1179012.0,Benzinga's Top Upgrades,2013-06-10 07:19:00-04:00,SRCL,positive
1179013.0,"Wunderlich Upgrades Stericycle, Inc. to Buy, Raises PT to $120.00",2013-06-10 07:06:00-04:00,SRCL,neutral
1179014.0,"Stifel Nicolaus Maintains Buy on Stericycle, Inc., Raises PT to $123.00",2013-06-05 08:28:00-04:00,SRCL,neutral
1179015.0,"Barrington Research Maintains Outperform on Stericycle, Inc., Raises PT to $120.00",2013-04-26 10:54:00-04:00,SRCL,neutral
1179016.0,"Stericycle, Inc. Reports Q1 EPS of $0.88, Inline; Revenue of $513.80M vs $520.03M Est",2013-04-24 16:13:00-04:00,SRCL,neutral
1179017.0,UPDATE: Jefferies Initiates Stericycle with Buy on International Expansion,2013-04-16 08:32:00-04:00,SRCL,neutral
1179018.0,"Jefferies Initiates Coverage on Stericycle, Inc. at Buy, Announces $127.00 PT",2013-04-15 16:10:00-04:00,SRCL,neutral
1179019.0,UPDATE: Oppenheimer Raises PT on Stericycle Following CEO Meeting,2013-03-25 13:20:00-04:00,SRCL,neutral
1179020.0,"Oppenheimer Maintains Outperform on Stericycle, Inc., Raises PT to $115.00",2013-03-25 07:42:00-04:00,SRCL,neutral
1179021.0,UPDATE: Wedbush Raises PT on Stericycle on New Service Offering Adoption,2013-03-18 11:06:00-04:00,SRCL,neutral
1179022.0,"Wedbush Maintains Outperform on Stericycle, Inc., Raises PT to $110.00",2013-03-18 10:17:00-04:00,SRCL,neutral
1179023.0,Stocks Hitting 52-Week Highs,2013-03-13 10:45:00-04:00,SRCL,neutral
1179024.0,Benzinga's Top Initiations,2013-03-13 08:32:00-04:00,SRCL,positive
1179025.0,"UPDATE: Goldman Sachs Initiates Stericycle at Buy on Favorable Mix Shift, M&A Catalysts",2013-03-13 07:52:00-04:00,SRCL,positive
1179026.0,"Goldman Sachs Initiates Coverage on Stericycle, Inc. at Buy, Announces $115.00 PT",2013-03-13 06:45:00-04:00,SRCL,neutral
1179027.0,Top 4 Mid-Cap Stocks In The Waste Management Industry With The Lowest PEG Ratio,2013-03-05 04:09:00-05:00,SRCL,negative
1179028.0,UPDATE: Stifel Nicolaus Raises PT to $117 on Stericycle Following Solid Q4,2013-02-07 13:37:00-05:00,SRCL,positive
1179029.0,"Stericycle, Inc. Reports Q4 EPS of $0.88 vs $0.86 Est; Revenue of $503.60M vs $491.39M Est",2013-02-06 16:16:00-05:00,SRCL,neutral
1179030.0,New York Attorney General Announces $2.4M Settlement with Stericycle Related to Overcharging,2013-01-08 10:57:00-05:00,SRCL,neutral
1179031.0,"From Earlier: Barclays Initiates Coverage on Stericycle, Inc. at Equal-weight, Announces $102.00 PT",2013-01-08 10:42:00-05:00,SRCL,neutral
1179032.0,Stericycle Guides FY13 EPS $3.62-3.67 vs $3.68 Est; Guides FY13 Revenue $2.06-2.09B vs $2.06B,2012-10-24 17:14:00-04:00,SRCL,neutral
1179033.0,Stericycle Reports Q3 EPS $0.84 vs $0.82 Est; Revenues $480.5M vs $477.44M Est,2012-10-24 16:04:00-04:00,SRCL,neutral
1179034.0,Top 4 Mid-Cap Stocks In The Waste Management Industry With The Lowest PEG Ratio,2012-09-07 04:20:00-04:00,SRCL,negative
1179035.0,5 Waste Management Stocks With The Lowest PEG Ratio,2012-08-31 07:55:00-04:00,SRCL,negative
1179036.0,Top 4 Mid-Cap Stocks In The Waste Management Industry With The Highest EPS Estimates For The Next Quarter,2012-08-17 04:10:00-04:00,SRCL,negative
1179037.0,Raymond James Initiates Coverage on Stericycle at Outperform,2012-08-09 08:56:00-04:00,SRCL,neutral
1179038.0,Stericycle Reports Q2 EPS $0.81 vs $0.80 Est; Revenues $469M vs $467.90M Est,2012-07-25 16:26:00-04:00,SRCL,neutral
1179039.0,Stericycle Reports Q2 EPS $0.81 vs $0.80 Est; Revenues $468.9M vs $467.90M Est,2012-07-25 16:02:00-04:00,SRCL,neutral
1179040.0,"UPDATE: Barrington Research Initiates Coverage of Stericycle with Outperform Rating, $108 PT",2012-07-11 10:59:00-04:00,SRCL,neutral
1179041.0,Barrington Initiates Coverage on Stericycle at Outperform,2012-07-11 08:51:00-04:00,SRCL,neutral
1179042.0,UPDATE: Bank of America Reinstates Stericycle's Rating and PO,2012-05-01 07:11:00-04:00,SRCL,negative
1179043.0,Stericycle Guides FY Revenue $1.85-1.9B vs $1.88B Est; FY EPS $3.24-3.28 vs $3.23 Est,2012-04-25 17:41:00-04:00,SRCL,neutral
1179044.0,Stericycle Reports Q1 EPS $0.78 vs $0.76 Est; Revenues $460.1M vs $451.88M Est,2012-04-25 16:30:00-04:00,SRCL,neutral
1179045.0,Top 4 Mid-Cap Stocks In The Waste Management Industry With The Lowest PEG Ratio,2012-03-12 04:47:00-04:00,SRCL,negative
1179046.0,Wedbush Doesn't Mind Stericycle CEO Change-Up,2012-02-15 09:08:00-05:00,SRCL,neutral
1179047.0,"Stericycle, Inc. Names Charlie Alutto to Succeed Mark Miller as CEO as of January 1, 2013; Miller to Remain as Executive Chairman   ",2012-02-14 16:02:00-05:00,SRCL,positive
1179048.0,Stericycle Reports Q4 EPS $0.76 vs $0.74 Est; Revenues $446.60M vs $443.00M Est	 			,2012-02-02 16:05:00-05:00,SRCL,neutral
1179049.0,"UPDATE: Stifel Nicolaus Initiates Buy, $103 PT on Stericycle",2012-01-24 10:41:00-05:00,SRCL,neutral
1179050.0,Wunderlich Securities Maintains Hold Rating and $85 PT on Stericycle ,2011-11-15 07:09:00-05:00,SRCL,positive
1179051.0,Notable Call Options Activity in Stericycle,2011-11-04 10:28:00-04:00,SRCL,neutral
1179052.0,Notable Call Options Activity in Stericycle,2011-11-03 13:28:00-04:00,SRCL,neutral
1179053.0,Stericycle Reports Q3 EPS $0.71 vs $0.70 Est; Revenues $420.9M vs $406.26M Est			,2011-10-26 16:19:00-04:00,SRCL,neutral
1179054.0,Notable Call Options Activity in Stericycle,2011-09-09 10:26:00-04:00,SRCL,neutral
1179055.0,Oppenheimer Maintains Outperform on Stericycle,2011-08-25 08:11:00-04:00,SRCL,neutral
1179056.0,Notable Put Options Activity in Stericycle,2011-08-22 12:20:00-04:00,SRCL,neutral
1179057.0,Notable Put Options Activity in Stericycle,2011-08-22 10:34:00-04:00,SRCL,neutral
1179058.0,Stericycle Spiking Higher on Heavy Volume,2011-08-01 10:52:00-04:00,SRCL,neutral
1179059.0,Oppenheimer Reiterates Outperform Rating On Stericycle,2011-07-28 09:16:00-04:00,SRCL,neutral
1179060.0,Stericycle Reports Q2 EPS of $0.69 vs. $0.69 Est; Revenues $410.4M vs. $389.50M                ,2011-07-27 16:38:00-04:00,SRCL,neutral
1179061.0,"Earnings Preview: Republic Services EPS, Revenue Expected to Rise from Previous Quarter",2011-07-25 14:20:00-04:00,SRCL,neutral
1179062.0,Wedbush Maintains Outperform on Stericycle,2011-07-19 08:35:00-04:00,SRCL,neutral
1179063.0,Top 4 Mid-Cap Stocks In The Waste Management Industry With The Highest ROE,2011-07-08 02:02:00-04:00,SRCL,negative
1179064.0,Oppenheimer Reiterates Outperform and PT of $100 on Stericycle,2011-06-23 09:56:00-04:00,SRCL,neutral
1179065.0,UPDATE: Bank of America Merrill Lynch Upgrades Stericycle to Neutral,2011-06-13 08:14:00-04:00,SRCL,neutral
1179066.0,"Bank of America Upgrades Stericycle To Neutral, Raises PO To $88",2011-06-13 07:22:00-04:00,SRCL,negative
1179067.0,ETF Showdown: A Dash For Trash,2011-06-10 15:06:00-04:00,SRCL,neutral
1179068.0,"Mad Money Lightning Round OT: Cramer Is Bullish On PDE (PDE, SRCL, NOV, AMSC)",2011-05-18 19:08:00-04:00,SRCL,negative
1179069.0,Wunderlich Securities Raises SRCL PT To $85,2011-04-28 09:15:00-04:00,SRCL,positive
1179070.0,Wunderlich Securities Raises SRCL PT To $85,2011-04-28 09:15:00-04:00,SRCL,positive
1179071.0,J.P. Morgan Raises PT On SRCL To $85,2011-04-28 08:30:00-04:00,SRCL,neutral
1179072.0,JP Morgan Raises PT On Stericycle To $85,2011-04-28 07:53:00-04:00,SRCL,positive
1179073.0,Stericycle Completes Acquisition of Healthcare Waste Solutions,2011-04-18 16:04:00-04:00,SRCL,negative
1179074.0,Global X Waste Management ETF (WSTE) Launches,2011-04-14 02:00:00-04:00,SRCL,negative
1179075.0,Global X Trash ETF To Debut Today (WSTE),2011-04-13 01:37:00-04:00,SRCL,neutral
1179076.0,"Top 4 Mid-Cap Stocks In The Waste Management Industry With The Highest Cash (CLH, SRCL, BIN, WCN)",2011-04-13 00:11:00-04:00,SRCL,negative
1179077.0,"Puts Purchased on Stericycle, Inc. (SRCL)",2011-04-07 11:09:00-04:00,SRCL,neutral
1179078.0,"Companies Trading at or near 52-week Highs This Morning (FAST, AA, NE, SRCL, HSY, CCE, GENZ, FO, NSM)",2011-04-06 09:47:00-04:00,SRCL,neutral
1179080.0,Morgan Stanley Initiates SRCL With Equal Weight,2011-04-06 06:27:00-04:00,SRCL,neutral
1179081.0,"Top 4 Mid-Cap Stocks In The Waste Management Industry With The Highest EPS Estimates (CLH, SRCL, WCN, BIN)",2011-03-16 02:50:00-04:00,SRCL,negative
1179082.0,"Wunderlich Securities Maintains Stericycle Hold Rating, $80 PT (SRCL)",2011-02-04 09:49:00-05:00,SRCL,positive
1179083.0,"Wunderlich Securities Maintains Hold Rating, $80 PT On SRCL",2011-02-01 07:54:00-05:00,SRCL,positive
1179084.0,"Top 4 Mid-Cap Stocks In The Waste Management Industry With The Highest ROE (SRCL, CLH, WCN, CVA)",2011-02-01 03:17:00-05:00,SRCL,negative
1179085.0,"Options Brief: Stericycle, Inc. (SRCL)",2010-12-29 14:43:00-05:00,SRCL,neutral
1179086.0,"NASDAQ Stocks Hitting 52-Week Highs (IPCM, SRCL, SNIC, RGEN)",2010-12-29 10:52:00-05:00,SRCL,neutral
1179087.0,"NASDAQ Stocks Hitting 52-Week Highs (HELE, MTXX, SNMX, SRCL)",2010-12-14 11:52:00-05:00,SRCL,neutral
1179088.0,Wunderlich Securities Maintains Stericycle Rating And PT,2010-11-10 10:50:00-05:00,SRCL,positive
1179089.0,Stericycle Beats Zacks Estimates - Analyst Blog,2010-10-28 14:03:00-04:00,SRCL,neutral
1179090.0,"Stericycle Beats Q3 Expectations, Continues Momentum",2010-10-28 10:04:00-04:00,SRCL,neutral
1179091.0,UNDER SURVEILLANCE- SMED: The Band-Aid That Looked Like a Miracle Cure,2010-10-18 07:44:00-04:00,SRCL,positive
1179092.0,"Puts Purchased on Stericycle, Inc. (SRCL)",2010-10-07 12:21:00-04:00,SRCL,neutral
1179093.0,"Fast Money Picks For October 6th (YHOO, GS, SRCL, RSX)",2010-10-05 19:35:00-04:00,SRCL,neutral
1179094.0,Jefferies Reiterates Buy On Stericiycle,2010-10-05 08:29:00-04:00,SRCL,neutral
1179095.0,Large Domestic Acquisition Increases SRCL Price Target $13,2010-09-30 13:10:00-04:00,SRCL,neutral
1179096.0,Wunderlich: Hold On Stericycle,2010-09-30 10:36:00-04:00,SRCL,neutral
1179097.0,J.P. Morgan Discusses Stericycle's Acquisition (SRCL),2010-09-30 07:53:00-04:00,SRCL,neutral
1179098.0,"Stericycle, Inc. to Acquire Healthcare Waste Solutions, Inc. for $245M ",2010-09-29 16:04:00-04:00,SRCL,negative
1179099.0,"NASDAQ Stocks Hitting 52-Week Highs (SRCL, ENTR, AXTI, MIPS)",2010-09-09 11:31:00-04:00,SRCL,neutral
1179100.0,"Benzinga’s Top Downgrades (MFE, RIMM, GLW, SRCL)",2010-08-20 07:30:00-04:00,SRCL,positive
1179101.0,"Jefferies Initiates Stericycle, Inc With Buy (SRCL)",2010-07-09 10:40:00-04:00,SRCL,neutral
1179102.0,Stericycle Signs Multi-Year Contract With Premier,2010-07-07 08:23:00-04:00,SRCL,neutral
1179103.0,"Stocks Hitting 52-Week Highs (RBCN, TRS, SRCL, MELI)",2010-06-15 13:08:00-04:00,SRCL,neutral
1179104.0,"Stocks Hitting 52-Week Highs (IIJI, LMNR, SRCL, TTIL)",2010-06-09 14:25:00-04:00,SRCL,neutral
1179105.0,"Fast Money Picks For May 26th (VALE, IBM, BTU, SRCL)",2010-05-25 19:01:00-04:00,SRCL,neutral
1179106.0,"Top NASDAQ Stocks In The Industrial Goods Sector With The Highest Market Capitalization (FAST, JOYG, SRCL, FLIR, BUCY)",2010-05-06 07:14:00-04:00,SRCL,positive
1179107.0,Stericycle Makes Another Acquisition To Retain Its Lead In Market  ,2010-04-27 16:16:00-04:00,SRCL,neutral
1179108.0,"Wunderlich Securities Maintains Sell Rating For Stericycle, Inc. (SRCL)",2010-04-27 12:05:00-04:00,SRCL,positive
1179109.0,"Top NASDAQ Stocks In The Industrial Goods Sector With The Highest Market Capitalization (FAST, JOYG, BUCY, SRCL, FLIR)",2010-03-26 07:36:00-04:00,SRCL,positive
1179110.0,"Top 5 NASDAQ Stocks In The Industrial Goods Sector With The Highest Free Cash Flows (FWLT, JOYG, LECO, FAST, SRCL)",2010-03-26 07:33:00-04:00,SRCL,positive
1179111.0,"Top 5 Mid-Cap Stocks In The Industrial Goods Sector With The Highest 5-Y Earnings Estimate (GFA, DRC, SHAW, FLIR, SRCL)",2010-01-22 07:16:00-05:00,SRCL,positive
1179112.0,Merrill Upgrades Stericycle To Buy,2009-12-07 15:23:00-05:00,SRCL,neutral
1179113.0,"Benzinga’s Top Upgrades (KSS, DFS, AMD, POT, SRCL, AGU) ",2009-12-07 09:45:00-05:00,SRCL,positive
1179114.0,Bank of America/Merrill Downgrades Stericycle (SRCL) To Underperform,2009-10-26 07:51:00-04:00,SRCL,neutral
