Unnamed: 0,title,date,stock,sentiment
1179935.0,ServiceSource Reports Extension Of Partnership With Red Hat,2020-05-14 09:23:00-04:00,SREV,neutral
1179936.0,"B. Riley FBR Maintains Buy on ServiceSource Intl, Raises Price Target to $1.75",2020-05-11 07:14:00-04:00,SREV,neutral
1179937.0,"ServiceSource Intl Q1 EPS $(0.020), Inline, Sales $50.100M Beat $47.250M Estimate",2020-05-07 16:14:00-04:00,SREV,neutral
1179938.0,"B. Riley FBR Maintains Buy on ServiceSource Intl, Lowers Price Target to $1.65",2020-05-04 07:19:00-04:00,SREV,negative
1179939.0,Stocks That Hit 52-Week Lows On Thursday,2020-03-19 10:49:00-04:00,SREV,negative
1179940.0,"B. Riley FBR Maintains Buy on ServiceSource Intl, Raises Price Target to $2.25",2020-02-21 07:51:00-05:00,SREV,neutral
1179941.0,Stocks That Hit 52-Week Highs On Thursday,2020-02-20 10:26:00-05:00,SREV,neutral
1179942.0,"ServiceSource Intl Q4 EPS $0.01 Beats $(0.02) Estimate, Sales $54.9M Beat $53M Estimate",2020-02-19 16:17:00-05:00,SREV,neutral
1179943.0,"ServiceSource Reports Deal With Absolute To Help Accelerate Go-To-Market Strategy, Renew Global Customer Relationships, No Terms Disclosed",2020-02-03 12:01:00-05:00,SREV,positive
1179944.0,Mid-Day Market Update: Crude Oil Rises Over 1%; Acceleron Pharma Shares Spike Higher,2020-01-28 12:08:00-05:00,SREV,negative
1179945.0,Mid-Morning Market Update: Markets Open Higher; Pfizer Earnings Miss Views,2020-01-28 10:22:00-05:00,SREV,negative
1179946.0,Stocks That Hit 52-Week Highs On Monday,2019-11-18 11:01:00-05:00,SREV,neutral
1179947.0,Stocks That Hit 52-Week Highs On Friday,2019-11-15 10:14:00-05:00,SREV,neutral
1179948.0,B. Riley Upgrades ServiceSource Intl to Buy,2019-10-31 06:44:00-04:00,SREV,neutral
1179949.0,"ServiceSource Intl Q3 EPS $(0.01) Down From $0.01 YoY, Sales $53.4M Beat $49M Estimate",2019-10-29 16:14:00-04:00,SREV,neutral
1179950.0,Stocks That Hit 52-Week Lows On Thursday,2019-08-15 11:29:00-04:00,SREV,negative
1179951.0,Stocks That Hit 52-Week Lows On Wednesday,2019-08-14 12:46:00-04:00,SREV,negative
1179952.0,Stocks That Hit 52-Week Lows On Tuesday,2019-08-13 11:08:00-04:00,SREV,negative
1179953.0,"ServiceSource Intl Q2 EPS $(0.02), Inline, Sales $52.4M Miss $55.25M Estimate",2019-08-07 16:10:00-04:00,SREV,negative
1179954.0,"ServiceSource Intl Q1 EPS $(0.01) Beats $(0.03) Estimate, Sales $55.5M Beat $53.16M Estimate",2019-05-08 16:23:00-04:00,SREV,neutral
1179955.0,ServiceSource Says Members Of Board And Management Have Had Constructive Discussions With Cannell And We Expect To Continue That Dialogue Moving Forward,2019-04-03 16:32:00-04:00,SREV,neutral
1179956.0,"BofA Offers Top 10 US Ideas For Q2: Bullish Burlington Stores, Dover, Masco, Norfolk Southern, Pfizer, Synovus, Thermo Fisher, United Rentals, Bearish Hawaiian Air, ServiceMaster",2019-04-01 11:05:00-04:00,SREV,positive
1179957.0,"Benzinga's Top Upgrades, Downgrades For February 21, 2019",2019-02-21 08:53:00-05:00,SREV,positive
1179958.0,"B. Riley FBR Downgrades ServiceSource Intl to Neutral, Lowers Price Target to $1.25",2019-02-21 06:33:00-05:00,SREV,negative
1179959.0,"ServiceSource Q4 Adj. EPS $0.03, Inline, Sales $61.471M Beat $61.1M Estimate",2019-02-20 16:42:00-05:00,SREV,neutral
1179960.0,ServiceSource Deepens Global Partnership With Extreme Networks,2018-11-12 09:30:00-05:00,SREV,neutral
1179961.0,ServiceSource Intl Sees FY2018 EPS $0.03-0.04 vs $0.02 Est; Widens FY2018 Sales Guidance from $238.0M-240.0M to $237.0M-240.0M vs $238.46M Est,2018-11-07 16:59:00-05:00,SREV,neutral
1179962.0,ServiceSource Intl Sees Q4 EPS $0.02-0.04 vs $0.03 Est; Sees Sales $60.0M-63.0M vs $61.78M Est,2018-11-07 16:58:00-05:00,SREV,neutral
1179963.0,"ServiceSource International, Inc. Q3 EPS $0.01 Beats $(0.01) Estimate, Sales $57.173M Beat $56.99M Estimate",2018-11-07 16:57:00-05:00,SREV,neutral
1179964.0,58 Biggest Movers From Friday,2018-10-22 05:11:00-04:00,SREV,neutral
1179965.0,Mid-Afternoon Market Update: NASDAQ Turns Lower; Bank OZK Shares Plummet,2018-10-19 14:52:00-04:00,SREV,neutral
1179966.0,42 Stocks Moving In Friday's Mid-Day Session,2018-10-19 12:53:00-04:00,SREV,neutral
1179967.0,Mid-Day Market Update: Skechers Rises On Upbeat Earnings; Merrimack Pharmaceuticals Shares Slide,2018-10-19 12:04:00-04:00,SREV,positive
1179968.0,Mid-Morning Market Update: Markets Open Higher; Procter & Gamble Profit Tops Estimates,2018-10-19 10:17:00-04:00,SREV,positive
1179969.0,"Benzinga's Top Upgrades, Downgrades For October 19, 2018",2018-10-19 09:17:00-04:00,SREV,positive
1179970.0,JMP Securities Downgrades ServiceSource Intl to Market Perform,2018-10-19 06:33:00-04:00,SREV,positive
1179971.0,ServiceSource Cuts FY18 Sales Guidance From $246M-$249M To $238M-$240M vs $247.9M Estimate,2018-10-18 16:28:00-04:00,SREV,negative
1179972.0,UPDATE: ServiceSource Cuts Q3 Sales Guidance From $60M-$61M To ~$57M vs $60.52M Estimate,2018-10-18 16:27:00-04:00,SREV,negative
1179973.0,ServiceSource Cuts Q3 Sales Guidance,2018-10-18 16:27:00-04:00,SREV,negative
1179974.0,ServiceSource Reports CFO Robert Pinkerton To Leave Co.; Richard Walker Named Replacement,2018-10-18 16:26:00-04:00,SREV,negative
1179975.0,77 Biggest Movers From Yesterday,2018-08-08 06:04:00-04:00,SREV,neutral
1179976.0,"ServiceSource Sees FY18 Adj. EPS $0.09-$0.11 vs $0.10 Est., Sales $246M-$249M vs $247.8M Est.",2018-08-06 16:45:00-04:00,SREV,neutral
1179977.0,"ServiceSource Sees Q3 Adj. EPS $0.01-$0.02 vs $0.03 Est., Sales $60M-$61M vs $60.43M Est.",2018-08-06 16:44:00-04:00,SREV,neutral
1179978.0,"ServiceSource Intl Q2 Adj. EPS $0.01, Inline, Sales $61.111M Beat $59.65M Estimate",2018-08-06 16:42:00-04:00,SREV,neutral
1179979.0,ServiceSource Announces Payoff of $150M Convertible Senior Notes and Entry Into New $40M Revolving Credit Facility,2018-08-01 12:34:00-04:00,SREV,positive
1179980.0,"B. Riley Investor Conference Concludes Today With Presenters Including: SeviceSource, Second Sight Medical, Universal Electronics, Inseego, and Tyler Technologies",2018-05-24 08:40:00-04:00,SREV,neutral
1179981.0,ServiceSource Raises FY18 Sales Outlook From $243M-$246M To $246-$249M vs $244.72M Est.,2018-05-03 17:35:00-04:00,SREV,neutral
1179982.0,"ServiceSource Sees Q2 EPS $(0.01)-$0.01 vs $0.01 Est., Sales $58.5M-$60.5M vs $59.11M Est.",2018-05-03 17:33:00-04:00,SREV,neutral
1179983.0,"ServiceSource Intl Q1 EPS $(0.01) Beats $(0.02) Estimate, Sales $58.6M Beat $54.49M Estimate",2018-05-03 17:31:00-04:00,SREV,neutral
1179984.0,ServiceMaster Shares Unaffected As Traders Circulate Article 'Sixth senior exec at ServiceMaster leaves since arrival of new CEO',2018-03-28 15:28:00-04:00,SREV,positive
1179985.0,"B. Riley Initiates Coverage On ServiceSource Intl with Buy Rating, Announces $5.00 Price Target",2018-03-27 09:01:00-04:00,SREV,neutral
1179986.0,"ServiceSource Reports Significant Expansion Of Footprint In Manila, Philippines; New Office In Okinawa, Japan",2018-03-05 11:00:00-05:00,SREV,positive
1179987.0,13F From Soros Shows Lowered Stake In Servicesource,2018-02-14 16:34:00-05:00,SREV,negative
1179988.0,9 Stocks Moving In Monday's After-Hours Session,2018-02-12 18:09:00-05:00,SREV,neutral
1179989.0,"ServiceSource Reports Signing Of Multi-Year Contract Extensions With 2 Long-Standing Technology Clients, Sees Total Value $225M",2018-02-12 16:10:00-05:00,SREV,positive
1179990.0,"ServiceSource Sees FY18 Adj. EPS $(0.11)-$(0.09) vs $0.05 Est., Sales $243M-$246M vs $243M Est.",2018-02-12 16:09:00-05:00,SREV,neutral
1179991.0,"ServiceSource Sees Q1 Adj. EPS $(0.03)-$(0.01) vs $(0.03) Est., Sales $53.5M-$55.5M vs $54.4M Est.",2018-02-12 16:09:00-05:00,SREV,neutral
1179992.0,"ServiceSource Reports Q4 Adj. EPS $0.06 vs $0.03 Est., Sales $66M vs $62.5M Est.",2018-02-12 16:08:00-05:00,SREV,neutral
1179993.0,"ServiceSource 13G Filing From Soros Fund Mgmt. Shows Increased Stake From ~1M Shares At End OF Last Qtr. To ~7.59M Shares, Or 7.78% Stake",2018-01-03 17:26:00-05:00,SREV,positive
1179994.0,"ServiceSource Sees Q4 Adj. Net Income $1.5M-$3.5M, Sales $61M-$64M vs $68.27M Est.; FY17 Adj. Net Income $3.5M-$5.5M, Sales $234M-$237M vs $239.78M Est.",2017-11-08 17:04:00-05:00,SREV,neutral
1179995.0,"ServiceSource Reports Q3 Adj. EPS $0.02 In-line With Est., Sales $58.1M vs $56.55M Est.",2017-11-08 17:03:00-05:00,SREV,neutral
1179996.0,20 Stocks Moving In Monday's Pre-Market Session,2017-09-25 08:07:00-04:00,SREV,neutral
1179997.0,Mid-Day Market Update: Trivago Drops On Weak Outlook; Verastem Shares Surge,2017-09-06 12:25:00-04:00,SREV,negative
1179998.0,Watch These 8 Huge Call Purchases In Friday Trade,2017-09-01 04:00:00-04:00,SREV,positive
1179999.0,Benzinga's Option Alert Recap From August 31,2017-08-31 16:22:00-04:00,SREV,positive
1180000.0,Service Source Option Alert: Apr 20 $2.5 Calls Sweep (11) at the Bid: 4434 @ $1.45 vs 0 OI; Ref=$3.555,2017-08-31 15:50:00-04:00,SREV,positive
1180001.0,"ServiceSource International Reports Q2 Loss/Share $(0.15) vs. $(0.01) Est., Sales $58.3M vs. $56.25M Est.",2017-08-07 16:35:00-04:00,SREV,neutral
1180002.0,20 Biggest Mid-Day Losers For Tuesday,2017-05-09 12:32:00-04:00,SREV,negative
1180003.0,"ServiceSource Sees Q2 Adj. Net Loss $1M - Net Income $500K; Sees FY17 Adj. Net Income $5M-$7M, Sales $2358M-$243M Est.",2017-05-08 16:57:00-04:00,SREV,negative
1180004.0,ServiceSource Sees Q2 Sales $55.5M-$58.5M vs $59.58M Est.,2017-05-08 16:56:00-04:00,SREV,neutral
1180005.0,"ServiceSource Reports Q1 Adj. EPS $(0.02) vs $(0.03) Est., Sales $56.7M vs $56.81M Est.",2017-05-08 16:56:00-04:00,SREV,neutral
1180006.0,Mid-Afternoon Market Update: Microbot Medical Climbs Amid Technology Patent Allowance; Servicesource International Shares Tumble,2017-02-22 14:36:00-05:00,SREV,positive
1180007.0,18 Biggest Mid-Day Losers For Wednesday,2017-02-22 13:16:00-05:00,SREV,negative
1180008.0,Mid-Day Market Update: Crude Oil Down 1.5%; Lantheus Shares Surge Following Q4 Results,2017-02-22 12:04:00-05:00,SREV,negative
1180009.0,ServiceSource Intl Down More Than 32% After Earlier Northland Downgrade To Market Perform,2017-02-22 10:19:00-05:00,SREV,neutral
1180010.0,Mid-Morning Market Update: Markets Open Lower; DISH Network Profit Beats Expectations,2017-02-22 10:13:00-05:00,SREV,positive
1180011.0,25 Stocks Moving In Wednesday's Pre-Market Session,2017-02-22 08:26:00-05:00,SREV,neutral
1180012.0,"ServiceSource Sees Q1 Rev. $55-$58M vs. Est. $63M Est., FY17 Rev. $248-$258M vs. $270M Est.",2017-02-21 16:38:00-05:00,SREV,neutral
1180013.0,"ServiceSource Reports Q4 Adj. EPS $0.02 vs. $0.03 Est., Rev. $68.7M vs. $70.03M Est.",2017-02-21 16:37:00-05:00,SREV,neutral
1180014.0,"ServiceSource Reports Q3 EPS $0.02 vs. Est. $(0.01), Rev. $62.5M vs. Est. $61.1M",2016-11-09 16:11:00-05:00,SREV,neutral
1180015.0,"ServiceSource Reports Q2 EPS $0.01 vs. Est. $(0.01), Rev. $62M vs. Est. $60.3M",2016-08-08 16:49:00-04:00,SREV,neutral
1180016.0,"UPDATE: ServiceSource Raised Low End of Previously Issued Q2 Sales Guidance from $59.5M-$61.5M vs $60M Est., Adj. EBITDA Outlook from $0-$1.5M, Sees Adj. EPS $(0.01)-$0.00 vs $(0.02) Est.",2016-06-09 09:12:00-04:00,SREV,negative
1180017.0,"ServiceSource Shares Unaffected Immediately After Release of Raised Q2 Sales, Profitability Outlok",2016-06-09 09:11:00-04:00,SREV,positive
1180018.0,"ServiceSource Reports Q1 Adj. EPS $(0.01) vs $(0.03) Est., Sales $59.8M vs $58.4M Est.",2016-05-09 17:25:00-04:00,SREV,neutral
1180019.0,"ServiceSource Q1 EPS ($0.11) vs ($0.03) est, Revenue $59.75M vs $58.36M est",2016-05-09 17:21:00-04:00,SREV,neutral
1180020.0,ServiceSource Appoints Chad Lyne As Head For Global Strategy,2016-04-26 13:58:00-04:00,SREV,neutral
1180021.0,ServiceSource Hires Chad Lyne As Head For Global Strategy,2016-04-26 13:31:00-04:00,SREV,neutral
1180022.0,"ServiceSource Reports Q4 EPS $0.00 vs. Est. $(0.03), Rev. $65M vs. Est. $62.26M",2016-02-22 16:23:00-05:00,SREV,neutral
1180023.0,ServiceMaster Sees FY15 Sales $2.58B-$2.59B vs $2.59B Est.,2015-11-03 07:10:00-05:00,SREV,neutral
1180024.0,"ServiceMaster Reports Q3 Adj. EPS $0.54 vs $0.50 Est., Sales $706M vs $695M Est.",2015-11-03 07:10:00-05:00,SREV,neutral
1180025.0,Mid-Morning Market Update: Markets Edge Lower; Harley-Davidson Profit Misses Estimates,2015-10-20 10:02:00-04:00,SREV,negative
1180026.0,"Servicesource International Shares Falling To $4.07/Share, Down 8.7%",2015-10-20 09:57:00-04:00,SREV,positive
1180027.0,Mid-Morning Market Update: Markets Open Higher; Abercrombie & Fitch Beats Q2 Estimates,2015-08-26 10:18:00-04:00,SREV,neutral
1180028.0,ServiceSource Approves $30M Buyback,2015-08-13 09:00:00-04:00,SREV,positive
1180029.0,"ServiceSource Reports Q2 EPS $(0.02) vs. Est. $ (0.09), Rev. $61.6M vs. Est. $58.86M",2015-08-06 17:51:00-04:00,SREV,neutral
1180030.0,ServiceSource Names Brian Delaney as COO,2015-06-08 08:02:00-04:00,SREV,neutral
1180031.0,MobileIron Names Simon Biddiscombe Interim CFO,2015-05-12 08:32:00-04:00,SREV,neutral
1180032.0,"Friday's After-Hours Movers: Bojangles, Lululemon And More",2015-05-09 11:17:00-04:00,SREV,neutral
1180033.0,Benzinga's Top Upgrades,2015-04-28 09:35:00-04:00,SREV,positive
1180034.0,JMP Securities Upgrades Servicesource International To Market Outperform,2015-04-28 08:32:00-04:00,SREV,positive
1180035.0,"JMP Securities Upgrades ServiceSource Intl to Market Outperform, Announces $7.00 PT",2015-04-28 06:26:00-04:00,SREV,positive
1180036.0,ServiceSource Names Gregory Hopkins Chief Customer Officer,2015-04-20 17:01:00-04:00,SREV,neutral
1180037.0,ServiceSource Names Robert Pinkerton CFO,2015-04-06 16:30:00-04:00,SREV,neutral
1180038.0,Morning Market Gainers,2015-02-27 09:44:00-05:00,SREV,neutral
1180039.0,"ServiceSource Int'l Reports Q4 EPS -$0.01 Vs Est -$0.07, Sales $74.7M Vs Est $67.55M",2015-02-26 16:24:00-05:00,SREV,neutral
1180040.0,ServiceSource Names Christopher M. Carrington CEO,2014-11-17 08:34:00-05:00,SREV,neutral
1180041.0,President Rick Genovese Resigns from ServiceSource ,2014-09-16 16:35:00-04:00,SREV,negative
1180042.0,Morning Market Losers ,2014-08-01 09:51:00-04:00,SREV,negative
1180043.0,"JMP Securities Downgrades ServiceSource International, Inc. to Market Perform, Removes $9.00 PT",2014-08-01 06:56:00-04:00,SREV,positive
1180044.0,"ServiceSource International, Inc. Reports Q2 EPS of $(0.09) vs $(0.06) Est; Revenue of $66.0M vs $69.72M Est",2014-07-31 16:36:00-04:00,SREV,neutral
1180045.0,"General Motors Issues More Recalls, Reach 27 Million Autos Recalled In 2014",2014-06-30 15:52:00-04:00,SREV,positive
1180046.0,MannKind Jumps On FDA Approval; Rayonier Shares Slide,2014-06-30 13:58:00-04:00,SREV,positive
1180047.0,Markets Edge Higher; PPG To Acquire Comex For $2.3 Billion,2014-06-30 10:29:00-04:00,SREV,neutral
1180048.0,Morning Market Movers ,2014-06-30 09:40:00-04:00,SREV,neutral
1180049.0,Benzinga's Top #PreMarket Gainers,2014-06-30 08:05:00-04:00,SREV,positive
1180050.0,Mid-Afternoon Market Update: Markets Shrug Off Strong Jobs Number; Focus On Ukraine,2014-05-02 15:44:00-04:00,SREV,positive
1180051.0,Stocks Hitting 52-Week Lows ,2014-05-02 10:46:00-04:00,SREV,negative
1180052.0,ServiceSource Shares Plunge 30+% Following Q1 Miss; CLSA Downgraded from Buy to Underperform,2014-05-02 10:35:00-04:00,SREV,positive
1180053.0,Benzinga's Top #PreMarket Losers ,2014-05-02 08:53:00-04:00,SREV,negative
1180054.0,"ServiceSource International, Inc. Reports Q1 EPS of $(0.07) vs $(0.05) Est; Revenue of $66.80M, Up 9% YOY",2014-05-01 16:35:00-04:00,SREV,neutral
1180055.0,"Option Alert: Service Source Apr $10 Call; 3,919 Contract Trade Between Bid and Ask @$0.25; Currently $9.10",2014-02-21 14:03:00-05:00,SREV,positive
1180056.0,Morgan Stanley Remains on the Sidelines About ServiceSource International,2014-02-07 08:30:00-05:00,SREV,neutral
1180057.0,"ServiceSource International, Inc. Reports Q4 EPS of $0.04, Inline; Revenue of $77.20M vs $77.49M Est",2014-02-06 16:42:00-05:00,SREV,neutral
1180058.0,"ServiceSource International, Inc. Reports Q3 EPS of $0.02 vs $0.00 Est; Revenue of $66.50M vs $66.10M Est",2013-11-05 16:46:00-05:00,SREV,neutral
1180059.0,Red Hat And Other Software Stocks That May Beat Revenue Estimates (RHT),2013-08-22 13:28:00-04:00,SREV,neutral
1180060.0,ServiceSource Spiking After Strong Earnings,2013-08-01 17:43:00-04:00,SREV,positive
1180061.0,ServiceSource Reports Investment in First Sales Delivery Center in Japan,2013-07-29 08:01:00-04:00,SREV,neutral
1180062.0,"Northland Securities Downgraded ServiceSource International, Inc. to Market Perform",2013-05-10 10:51:00-04:00,SREV,positive
1180063.0,Morning Market Movers,2013-05-10 09:58:00-04:00,SREV,neutral
1180064.0,"ServiceSource International, Inc. Reports Q1 EPS of $(0.02) vs $(0.04) Est; Revenue of $61.10M vs $60.38M Est",2013-05-09 16:27:00-04:00,SREV,neutral
1180065.0,ServiceSource Appoints Ashley Fieglein Johnson Chief Financial Officer ,2013-02-06 16:30:00-05:00,SREV,neutral
1180066.0,"ServiceSource International, Inc. Reports Q4 EPS of $(0.05) vs $0.01 Est; Revenue of $67.30M vs $62.90M Est",2013-02-06 16:18:00-05:00,SREV,neutral
1180067.0,ServiceSource Says David Oppenheimer to Leave,2012-12-05 17:15:00-05:00,SREV,negative
1180068.0,"CLSA Downgrades ServiceSource International from Buy to Outperform, Lowers PT from $19 to $8",2012-11-06 10:51:00-05:00,SREV,negative
1180069.0,Morgan Stanley Downgrades ServiceSource International from Overweight to Equal-weight,2012-11-06 10:50:00-05:00,SREV,negative
1180070.0,"Mid-Morning Market Update: A Nation Votes, Markets Rise",2012-11-06 10:17:00-05:00,SREV,neutral
1180071.0,Stocks Hitting 52-Week Lows,2012-11-06 10:13:00-05:00,SREV,negative
1180072.0,"Servicesource Shares Down 30+% This Morning Amid Weak Outlook; Guided Q4 Sales $62-64M vs $72.1M Est, Cut FY Outlook from $246-249M to $238-240M vs $248.2M Est",2012-11-06 08:58:00-05:00,SREV,negative
1180073.0,UPDATE: Deutsche Bank Downgrades ServiceSource to Hold on Weak Q4 Guidance  ,2012-11-06 08:20:00-05:00,SREV,negative
1180074.0,Benzinga's Top Downgrades,2012-11-06 07:18:00-05:00,SREV,positive
1180075.0,"Deutsche Bank Downgrades ServiceSource International from Buy to Hold, Lowers PT from $15 to $7",2012-11-06 05:53:00-05:00,SREV,negative
1180076.0,ServiceSource International Reports Q3 EPS $0.02 vs $-0.01 Est; Revenues $59.1M vs $58.84M Est,2012-11-05 16:49:00-05:00,SREV,neutral
1180077.0,"Piper Jaffray Maintains ServiceSource International at Overweight, Lowers PT from $19 to $14",2012-11-05 13:20:00-05:00,SREV,negative
1180078.0,ServiceSource Extends Service and Support Program With Agilent Technologies ,2012-10-04 08:23:00-04:00,SREV,positive
1180079.0,"Oppenheimer Suspends Coverage on ServiceSource International at Outperform, Removes PT",2012-08-21 16:11:00-04:00,SREV,neutral
1180080.0,Northland Securities Downgrades ServiceSource International from Outperform to Market Perform,2012-08-01 07:50:00-04:00,SREV,positive
1180081.0,ServiceSource International Reports Q2 EPS $0.02 vs $0.01 Est; Revenues $59.7M vs $59.09M Est,2012-07-31 16:27:00-04:00,SREV,neutral
1180082.0,Northland Securities Initiates Coverage On ServiceSource International at Outperform,2012-06-29 07:52:00-04:00,SREV,positive
1180083.0,"UPDATE: Feltl and Company Upgrades ServiceSource to Buy, Maintains $17 PT",2012-05-21 12:51:00-04:00,SREV,neutral
1180084.0,"Feltl and Company Upgrades ServiceSource International from Hold to Buy, Maintains PT at $17",2012-05-21 08:51:00-04:00,SREV,neutral
1180085.0,ServiceSource International Reports Q1 EPS $0.01; Revenues $57.6M vs $55.82M Est,2012-04-30 16:12:00-04:00,SREV,neutral
1180086.0,UPDATE: Feltl & Company Downgrades ServiceSource to Hold,2012-02-07 11:06:00-05:00,SREV,neutral
1180087.0,"Feltl and Company Downgrades ServiceSource International from Buy to Hold, Raises PT from $16 to $17",2012-02-07 09:00:00-05:00,SREV,neutral
1180088.0,UPDATE: Morgan Stanley Raises PT to $21 on ServiceSource,2012-02-07 08:22:00-05:00,SREV,neutral
1180089.0,ServiceSource International Reports Q4 EPS $0.06 vs $0.02 Est,2012-02-06 16:07:00-05:00,SREV,neutral
1180090.0,ServiceSource CFO David Oppenheimer Says No News Related to Today's Price Spike; Attributes to Portfolio Rebalancing by Fund Managers,2011-12-29 16:24:00-05:00,SREV,negative
1180091.0,ServiceSource Spiking Higher on Heavy Volume,2011-12-29 13:56:00-05:00,SREV,neutral
1180092.0,Morgan Stanley Maintains Overweight Rating on ServiceSource International ,2011-11-15 07:23:00-05:00,SREV,negative
1180093.0,Top Movers; ServiceSource up 15%,2011-11-11 15:51:00-05:00,SREV,positive
1180094.0,"Oppenheimer Retains Outperform, PT on ServiceSource",2011-11-11 10:20:00-05:00,SREV,neutral
1180095.0,"Piper Jaffray Retains Overweight, PT of $19 on ServiceSource ",2011-11-11 09:38:00-05:00,SREV,negative
1180096.0,ServiceSource Guides Q4 EPS $0.04-$0.05 vs $0.02 Est; Revenues $53M-$54M vs $52.1M Est,2011-11-10 16:25:00-05:00,SREV,neutral
1180097.0,ServiceSource Corporation Reports Q3 EPS $0.01 vs $0.01 Est; Revenues $50.10M vs $48.86M Est	,2011-11-10 16:09:00-05:00,SREV,neutral
1180098.0,"Friday's NASDAQ Winners: IPG Photonics, Andatee China Marine Fuel Service, Servicesource International, LCA Vision",2011-10-10 12:14:00-04:00,SREV,positive
1180099.0,Midday Gainers; IPG Photonics up 14%,2011-10-07 12:44:00-04:00,SREV,neutral
1180100.0,Morgan Stanley Maintains Overweight on ServiceSource International,2011-10-07 08:38:00-04:00,SREV,negative
1180101.0,Oppenheimer Outperform on ServiceSource,2011-10-07 08:12:00-04:00,SREV,neutral
1180102.0,ServiceSource Reports Q3 Prelim EPS $(0.01) vs $0.00 Est; Revenue Above $49M vs $46.1M Est,2011-10-06 16:02:00-04:00,SREV,neutral
1180103.0,Wells Fargo Initiates ServiceSource at Outperform,2011-10-06 09:14:00-04:00,SREV,positive
1180104.0,Piper Jaffray Maintains Overweight Rating and Lowers PT to $19 on ServiceSource,2011-10-06 08:11:00-04:00,SREV,negative
1180105.0,Piper Jaffray Lowers PT on ServiceSource to $19,2011-10-06 05:59:00-04:00,SREV,negative
1180106.0,Morning Losers; Yoku.com Down 8%,2011-09-21 11:06:00-04:00,SREV,negative
1180107.0,ServiceSource Tops 14M Technology Assets Under Management  ,2011-09-14 09:00:00-04:00,SREV,positive
1180108.0,ServiceSource Announces EMEA/APAC Relationship With Polycom ,2011-09-01 09:01:00-04:00,SREV,neutral
1180109.0,Afternoon Losers; BroadSoft Down Nearly 17% on Heavy Volume,2011-08-18 15:33:00-04:00,SREV,negative
1180110.0,Morgan Stanley Overweight On ServiceSource International ,2011-08-16 07:28:00-04:00,SREV,negative
1180111.0,Deutsche Bank Has Buy On ServiceSource,2011-08-15 08:01:00-04:00,SREV,neutral
1180113.0,"Oppenheimer Initiates ServiceSources at Outperform, $23 PT",2011-08-08 06:42:00-04:00,SREV,neutral
1180114.0,ServiceSource Prices Follow-On Public Offering of 9M Shares at $17.50/Share,2011-07-29 07:16:00-04:00,SREV,positive
1180115.0,Servicesource International Down 9% on Common Stock Offering,2011-07-18 10:54:00-04:00,SREV,neutral
1180116.0,UPDATE: ServiceSource Files Registration Statement for Follow-On Public Offering,2011-07-18 08:50:00-04:00,SREV,neutral
1180117.0,Servicesource International Files Prospectus for $180M of Shares,2011-07-18 08:35:00-04:00,SREV,positive
1180118.0,NASDAQ Stocks Hitting 52-Week Highs,2011-06-30 11:27:00-04:00,SREV,neutral
1180119.0,Piper Jaffray Reiterates Overweight Rating On ServiceSource,2011-06-30 08:44:00-04:00,SREV,negative
1180120.0,Piper Jaffray Raises PT On ServiceSource To $24,2011-06-30 06:13:00-04:00,SREV,neutral
1180121.0,Servicesource International Trading Almost 6% Higher on the Session,2011-06-23 15:39:00-04:00,SREV,neutral
1180122.0,California Muni Bonds - Is The Reward Worth The Risk? (Part 2),2011-06-01 04:47:00-04:00,SREV,positive
1180123.0,Servicesource International Up Over 6% (SREV),2011-05-17 15:30:00-04:00,SREV,neutral
1180124.0,"Top Narrow Based Indexes For May 10 (MED, FOSL, SREV)",2011-05-11 00:23:00-04:00,SREV,positive
1180125.0,"Top Percentage Gainers and Losers as of 2pm 5/10/11 (FONR, CKXE, TRAK, CPE, SREV, FFHL, MED, FOSL, BMTI, HEAT, PANL, MOBI, MNKD, VRML, USAT, ETM)",2011-05-10 14:07:00-04:00,SREV,negative
1180126.0,Piper Jaffray Comments On ServiceSource After Reporting Strong Earnings,2011-05-10 08:20:00-04:00,SREV,positive
1180127.0,Piper Jaffray Raises PT On ServiceSource To $17.50,2011-05-10 06:16:00-04:00,SREV,neutral
1180128.0,Deutsche Bank Puts Buy And $20 PT On ServiceSource (SREV)  ,2011-05-04 12:36:00-04:00,SREV,neutral
1180129.0,Deutsche Bank Initiates Coverage On ServiceSource (SREV),2011-05-04 08:44:00-04:00,SREV,neutral
1180130.0,Piper Jaffray Initiates Coverage On SREV,2011-05-04 07:35:00-04:00,SREV,neutral
1180131.0,Deutsche Bank Initiates Coverage On SREV,2011-05-04 07:31:00-04:00,SREV,neutral
1180132.0,Trading Begins: ServiceSource,2011-03-25 11:06:00-04:00,SREV,neutral
