Unnamed: 0,title,date,stock,sentiment
1325805.0,"CFRA Maintains Hold on VeriSign, Raises Price Target to $204",2020-04-27 13:26:00-04:00,VRSN,neutral
1325806.0,"Citigroup Maintains Neutral on VeriSign, Raises Price Target to $235",2020-04-27 08:01:00-04:00,VRSN,neutral
1325807.0,"Baird Maintains Outperform on VeriSign, Raises Price Target to $250",2020-04-24 12:38:00-04:00,VRSN,neutral
1325808.0,"VeriSign Q1 EPS $2.860 Does Not Compare To $1.280 Estimate, Sales $313.000M Beat $309.250M Estimate",2020-04-23 16:13:00-04:00,VRSN,neutral
1325809.0,"Earnings Scheduled For April 23, 2020",2020-04-23 04:23:00-04:00,VRSN,neutral
1325810.0,Shares of several technology companies are trading higher as equities continue to rise following last week's rebound amid US stimulus measures.,2020-03-30 10:23:00-04:00,VRSN,positive
1325811.0,Stocks That Hit 52-Week Lows On Monday,2020-03-23 10:34:00-04:00,VRSN,negative
1325812.0,Stocks That Hit 52-Week Lows On Thursday,2020-03-12 12:10:00-04:00,VRSN,negative
1325813.0,"Shares of several software companies are trading higher. Movement appears related to overall market rebound, as the sector has heavily sold off amid recent global weakness.",2020-02-26 10:01:00-05:00,VRSN,negative
1325814.0,"VeriSign Q4 EPS $1.31 Misses $1.33 Estimate, Sales $310.543M Beat $310.25M Estimate",2020-02-06 16:09:00-05:00,VRSN,negative
1325815.0,"Earnings Scheduled For February 6, 2020",2020-02-06 04:30:00-05:00,VRSN,neutral
1325816.0,83 Software—Infrastructure Stocks Moving In Friday's Session,2020-01-17 14:54:00-05:00,VRSN,neutral
1325817.0,Shares of technology companies are trading lower on global macro concerns after Trump implied a US-China trade deal may not occur until 2020.,2019-12-03 08:36:00-05:00,VRSN,neutral
1325818.0,Shares of several technology and growth stocks are trading lower as US equities dip following escalating US-China tensions over Hong Kong. US stocks further fell on worse-than-expected manufacturing data.,2019-12-02 10:21:00-05:00,VRSN,neutral
1325819.0,VeriSign Option Alert: Nov 15 $195 Calls at the Ask: 1130 @ $0.5 vs 687 OI; Ref=$185.31,2019-11-05 11:56:00-05:00,VRSN,positive
1325820.0,12 Stocks With The Highest Returns On Assets,2019-10-29 13:00:00-04:00,VRSN,positive
1325821.0,"VeriSign Q3 EPS $1.36 Beats $1.31 Estimate, Sales $308.421M Beat $308.3M Estimate",2019-10-24 16:44:00-04:00,VRSN,neutral
1325822.0,"Baird Maintains Outperform on VeriSign, Raises Price Target to $240",2019-07-26 10:07:00-04:00,VRSN,neutral
1325823.0,"VeriSign Q2 Adj. EPS $1.33 Beats $1.29 Estimate, Sales $306.29M Miss $306.57M Estimate",2019-07-25 16:39:00-04:00,VRSN,negative
1325824.0,"Shares of technology companies are trading lower with the overall market, which has been relatively rangebound over the last 13 sessions. The technology sector is the second worst performing today.",2019-05-23 15:07:00-04:00,VRSN,negative
1325825.0,VeriSign shares are trading higher after the company reported better-than-expected Q1 EPS and sales.,2019-04-26 09:45:00-04:00,VRSN,positive
1325826.0,"VeriSign Q1 EPS $1.31 Beats $1.25 Estimate, Sales $306.408M Beat $302.6M Estimate",2019-04-25 17:10:00-04:00,VRSN,neutral
1325827.0,"Earnings Scheduled For April 25, 2019",2019-04-25 04:26:00-04:00,VRSN,neutral
1325828.0,"VeriSign Reports Closed Q4 With ~348.7M Domain Name Registrations, Up 1.8% Quarter Over Quarter, Up 4.9% Year Over Year",2019-03-28 16:39:00-04:00,VRSN,neutral
1325829.0,"Citigroup Maintains Neutral on VeriSign, Raises Price Target to $195",2019-03-06 08:59:00-05:00,VRSN,neutral
1325830.0,"VeriSign Q4 EPS $1.58 Beats $1.21 Estimate, Sales $307M Miss $308.64M Estimate",2019-02-07 16:39:00-05:00,VRSN,negative
1325831.0,"VeriSign Q4 Adj. EPS $1.58 Beats $1.21 Estimate, Sales $307M Miss $308.64M Estimate",2019-02-07 16:11:00-05:00,VRSN,negative
1325832.0,"Earnings Scheduled For February 7, 2019",2019-02-07 04:01:00-05:00,VRSN,neutral
1325833.0,74 Biggest Movers From Friday,2018-11-05 04:36:00-05:00,VRSN,neutral
1325834.0,"Baird Maintains Outperform on VeriSign, Raises Price Target to $170",2018-11-02 14:02:00-04:00,VRSN,neutral
1325835.0,"JP Morgan Maintains Neutral on VeriSign, Raises Price Target to $160",2018-11-02 12:56:00-04:00,VRSN,positive
1325836.0,64 Stocks Moving In Friday's Mid-Day Session,2018-11-02 12:44:00-04:00,VRSN,neutral
1325837.0,VeriSign shares are up 17.5% after the company beat Q3 earnings estimates; Analysts at Baird and JP Morgan upgraded their ratings on the stock early Friday.,2018-11-02 11:28:00-04:00,VRSN,positive
1325838.0,10 Biggest Price Target Changes For Friday,2018-11-02 09:43:00-04:00,VRSN,neutral
1325839.0,"Benzinga's Top Upgrades, Downgrades For November 2, 2018",2018-11-02 09:21:00-04:00,VRSN,positive
1325840.0,"A Peek Into The Markets: US Stock Futures Surge, All Eyes On Jobs Report",2018-11-02 07:36:00-04:00,VRSN,neutral
1325841.0,Baird Upgrades VeriSign to Outperform,2018-11-02 06:58:00-04:00,VRSN,neutral
1325842.0,"JP Morgan Upgrades VeriSign to Neutral, Raises Price Target to $160",2018-11-02 06:57:00-04:00,VRSN,positive
1325843.0,"VeriSign, Inc. Q3 EPS $1.23 Beats $1.20 Estimate, Sales $305.777M Beat $305.38M Estimate",2018-10-25 16:55:00-04:00,VRSN,neutral
1325844.0,"Stocks That Made New 52-Week Highs So Far Today Include: Allegion, Boston Scientific, Arthur J. Gallagher, United Technologies, Waste Management, Qualcomm, Pfizer, Mastercard, Nike, Lowe's, Union Pacific, Norfolk Southern, and Aetna",2018-09-18 14:21:00-04:00,VRSN,neutral
1325845.0,"Stocks Which Set New 52-Week High Yesterday, September 17th",2018-09-18 09:25:00-04:00,VRSN,neutral
1325846.0,"Stocks That Made New 52 Week Highs So Far Today Include: Honeywell, Fortive, Roper Tech, Arthur J. Gallagher, Dover, Nike, Clorox, Kellogg, Norfolk Southern, Xylem, Jacobs Engineering, Anthem, VeriSign, F5 Networkds, Conoco Phillips, and American Express",2018-09-17 14:50:00-04:00,VRSN,neutral
1325847.0,"Stocks Which Set New 52-Week High Friday, September 14th",2018-09-17 09:28:00-04:00,VRSN,neutral
1325848.0,"Stocks That Made New 52-Week Highs So Far Today Include: Microsoft, Activision Blizzard, Salesforce, Mastercard, Honeywell, Amgen, Ingersoll-Rand, Express Scripts, American Express, Abbott Labs, Danaher, Qualcomm, and Corning",2018-09-14 11:30:00-04:00,VRSN,neutral
1325849.0,"Stocks Which Set New 52-Week High Yesterday, September 13th",2018-09-14 09:26:00-04:00,VRSN,neutral
1325850.0,"Stocks That Made New 52-Week Highs So Far Today Include: NiSource, Pfizer, United Continental, UDR, Kellogg, Arthur J. Gallagher, PerkinElmer, Paypal, Thermo Fisher, Honeywell, Visa, American Express, Nike, Intuit, Boston Scientific, Microsoft, and AMD",2018-09-13 11:43:00-04:00,VRSN,positive
1325851.0,"Stocks Which Set New 52-Week High Yesterday, September 11th",2018-09-12 12:17:00-04:00,VRSN,neutral
1325852.0,"Stocks Which Set New 52-Week High Yesterday, August 29th",2018-08-30 11:47:00-04:00,VRSN,neutral
1325853.0,"Stocks That Made New 52-Week Highs So Far Today Include: Salesforce, Textron, TJX, Kansas City Southern, Dover, HCA, United Continental, Ingersoll-Rand, Xilinx, Thermo Fisher, Progressive, Microsoft, Apple, Paypal, Cisco, UnitedHealth, Visa & Mastercard",2018-08-29 13:57:00-04:00,VRSN,positive
1325854.0,"Stocks Which Set New 52-Week High Yesterday, August 28th",2018-08-29 11:13:00-04:00,VRSN,neutral
1325855.0,"Stocks Which Set New 52-Week High Friday, July 27th",2018-07-30 12:05:00-04:00,VRSN,neutral
1325856.0,"Stocks Which Set New 52-Week High Yesterday, July 26th:",2018-07-27 10:42:00-04:00,VRSN,neutral
1325857.0,"VeriSign Q2 EPS $1.18 Beats $1.14 Estimate, Sales $302M Miss $302.61M Estimate",2018-07-26 16:29:00-04:00,VRSN,negative
1325858.0,"Stocks Which Set New 52-Week High Yesterday, July 25th",2018-07-26 11:00:00-04:00,VRSN,neutral
1325859.0,"Stocks Which Set New 52-Week High Yesterday, July 24th:",2018-07-25 12:14:00-04:00,VRSN,neutral
1325860.0,"Stocks That Made New 52-Week Highs Earlier Today Include: Tiffany, Visa, SunTrust, Baxter, Medtronics, Intuit, Costco, IHS Markit, Target, VeriSign, Salesforce, Norfolk Southern, Verisk, Facebook, Paypal, and Microsoft",2018-07-24 12:15:00-04:00,VRSN,neutral
1325861.0,"Stocks That Made New 52-Week Highs Today Include: Citrix, TripAdvisor, Microsoft, Alphabet (Both Classes), Medtronic, Accenture, Facebook, NetApp, S&P Global, Amazon, VeriSign, Motorola Solutions, Marsh & McLennan, IDEXX Labs, Eli Lilly, Sysco, and VF",2018-07-17 13:30:00-04:00,VRSN,positive
1325862.0,These 5 Stocks Are In Various Phases Of Downtrends Right Now,2018-06-22 11:21:00-04:00,VRSN,neutral
1325863.0,"Stocks That Made New 52-Week Highs Today Include: Electronic Arts, Intuit, NetApp, Netflix, Republic Services, VeriSign, Union Pacific, Zoetis, Twenty-First Century Fox, Edward Lifesciences, Ansys, and Advance Auto Parts",2018-06-15 13:58:00-04:00,VRSN,neutral
1325864.0,"Stocks That Made New 52 Week Highs Today Include: Zoetis, Fortive, VeriSign, CF Industries, Ansys, Facebook, IDEXX, Fiserv, Global Payments, CA, Akamai, AES, NVIDIA, Align Tech, and Adobe",2018-06-14 15:51:00-04:00,VRSN,neutral
1325865.0,"Stocks That Made New 52-Week Highs Today Include: Host Hotels & Resorts, VeriSign, Twentieth Century Fox (Both Classes), and Nasdaq",2018-05-24 11:02:00-04:00,VRSN,neutral
1325866.0,"Stocks That Made New 52-Week Highs Today Include: Moody's, Macy's, Zions Bancorp, T. Rowe Price, VeriSign, ADP, Boston Scientific, Expeditors International",2018-05-21 11:53:00-04:00,VRSN,neutral
1325867.0,"Stocks That Made New 52-Week Highs Today Include: Hess, Nasdaq, Mastercard, Microsoft, Valero Energy, Expeditors International, VeriSign, ConocoPhillips, Occidental Petroleum, NetApp, And Phillips 66",2018-05-14 11:56:00-04:00,VRSN,positive
1325868.0,"Citigroup Maintains Neutral on VeriSign, Raises Price Target to $123.00",2018-04-30 08:35:00-04:00,VRSN,neutral
1325869.0,"VeriSign Q1 Adj. EPS $1.07 Beats $1.06 Est., Sales $299M Beats $297.74M Est.",2018-04-26 17:00:00-04:00,VRSN,neutral
1325870.0,"Stocks that Made New 52-Wk Highs Today Include: Fiserv, IDEXX Labs, Western Digital, Fastenal, NextEra Energy, Edward Lifesciences, Electronic Arts, VeriSign, Global Payments; Stocks That Made New 52-Wk Lows Include Kraft-Heinz, Dominion Energy, and AIG",2018-03-16 12:58:00-04:00,VRSN,positive
1325871.0,"Stocks That Made New 52-Wk Highs Earlier Include: Accenture, M&T Bank, PNC, Ansys, Lockheed Martin, Deere, Raytheon, Intuit, Comerica, Interpuclic, Northrop Grumman, VeriSign, Estee Lauder, Bristol-Myers, Red Hat, Nike, NVIDIA and Global Payments",2018-02-16 13:03:00-05:00,VRSN,neutral
1325872.0,VeriSign Reports Q4 Domain Name Registrations Up 0.5% YoY,2018-02-15 16:12:00-05:00,VRSN,neutral
1325873.0,"Verisign Reports Q4 Adj. EPS $0.96 vs $0.97 Est., Sales $296M vs $295M Est.",2018-02-08 16:33:00-05:00,VRSN,neutral
1325874.0,What To Expect From VeriSign This Earnings Season?,2018-02-06 11:10:00-05:00,VRSN,neutral
1325875.0,8-K Filing Earlier From Verisign Reports That Previously Disclosed DoJ Investigation Was Closed As Of Jan. 9,2018-01-10 09:45:00-05:00,VRSN,neutral
1325876.0,"Verisign Reports Q3 EPS $1.00 vs. $0.97 Est., Sales $292M vs. $291.7M Est.",2017-10-26 16:36:00-04:00,VRSN,neutral
1325877.0,"Nvidia, Marriott, Verisign, Brazil: Fast Money Picks For August 8",2017-08-08 06:52:00-04:00,VRSN,neutral
1325878.0,"Verisign Reports Q2 Adj. EPS $1.05 vs $0.99 Est., Sales $289M vs $287.6M Est.",2017-07-27 16:59:00-04:00,VRSN,neutral
1325879.0,"Verisign Reports Q1 Adj. EPS $0.96 vs $0.94 Est., Sales $289M vs $284.7M Est.",2017-04-27 17:48:00-04:00,VRSN,neutral
1325880.0,"Benzinga's Top Upgrades, Downgrades For April 12, 2017",2017-04-12 10:13:00-04:00,VRSN,positive
1325881.0,19 Stocks Moving In Wednesday's Pre-Market Session,2017-04-12 09:10:00-04:00,VRSN,neutral
1325882.0,Citigroup Upgrades VeriSign to Neutral,2017-04-12 07:57:00-04:00,VRSN,neutral
1325883.0,"VeriSign Reports Q4 Adj EPS $0.92 vs $0.88 Est, Revenue $286M vs $282.97M Est",2017-02-09 16:36:00-05:00,VRSN,neutral
1325884.0,"Earnings Scheduled For February 9, 2017",2017-02-09 04:43:00-05:00,VRSN,neutral
1325885.0,Verisign Spikes to High of $82.63; Buying in March 80 Call,2017-02-03 14:47:00-05:00,VRSN,neutral
1325886.0,"Verisign Reports Q3 EPS $0.93 vs. Est. $0.87, Rev. $287M vs. Est. $287M",2016-10-27 17:11:00-04:00,VRSN,neutral
1325887.0,VeriSign Shares Trade Lower Courtesy Of Citi And The U.S. Senate,2016-09-22 13:03:00-04:00,VRSN,positive
1325888.0,Versign Shares Volatile As Traders Pass Early Morning Citigroup Comments About Impact To Delays Likely Fueling Concerns Around .com Extension,2016-09-22 09:57:00-04:00,VRSN,positive
1325889.0,Benzinga's Volume Movers,2016-09-02 10:35:00-04:00,VRSN,neutral
1325890.0,Watch These 10 Huge Put Purchases In Tuesday Trade,2016-08-23 02:52:00-04:00,VRSN,positive
1325891.0,Option Alert: VRSN Dec16 65.0 Puts: 2000 @  ASK  $1.24: 2000 traded vs 16 OI: $75.38 Ref,2016-08-22 10:31:00-04:00,VRSN,positive
1325892.0,"Tuesday's Market Wrap: Stocks Pullback From All-Time Highs, Close At Session Lows",2016-08-16 17:41:00-04:00,VRSN,negative
1325893.0,From Verisign Earnings Conference Call: Sales $1.13B-$1.14B vs $1.14B Est.,2016-07-28 16:51:00-04:00,VRSN,neutral
1325894.0,"VeriSign Reports Q2 EPS $0.91 Vs Est $0.86, Sales $286.466M Vs Est $264.22M",2016-07-28 16:15:00-04:00,VRSN,neutral
1325895.0,"Earnings Scheduled For July 28, 2016",2016-07-28 04:03:00-04:00,VRSN,neutral
1325896.0,"Verisign Reports Q1 EPS $0.85 vs. Est. $0.83, Rev. $282M vs. Est. $278M",2016-04-28 16:44:00-04:00,VRSN,neutral
1325897.0,"Oppenheimer's Wald On Tech: Buy IT, Sell Electronic Manufacturing",2016-04-04 12:03:00-04:00,VRSN,neutral
1325898.0,"Verisign Reports Q4 EPS $0.79 vs. Est. $0.78, Rev. $273M vs Est. $270.2M",2016-02-11 16:42:00-05:00,VRSN,neutral
1325899.0,11 Stocks Moving In Friday's After-Hours Session,2016-01-08 17:04:00-05:00,VRSN,neutral
1325900.0,Citigroup Downgrades VeriSign to Sell,2016-01-05 08:19:00-05:00,VRSN,neutral
1325901.0,3 Cybersecurity Plays For The New Year,2015-12-29 09:29:00-05:00,VRSN,positive
1325902.0,Stocks Hitting 52-Week Highs,2015-12-03 10:21:00-05:00,VRSN,neutral
1325903.0,Instart Logic and Verisign Collaborate on Advanced DDoS Scrubbing Capabilities,2015-12-03 08:00:00-05:00,VRSN,positive
1325904.0,10 Stocks Moving In Friday's After-Hours Session,2015-11-20 18:38:00-05:00,VRSN,neutral
1325905.0,Stocks Hitting 52-Week Highs,2015-11-18 10:05:00-05:00,VRSN,neutral
1325906.0,"Verisign Reports Q3 Adj EPS $0.78 vs Est $0.77, Sales $265.8M Vs Est $265.42M",2015-10-22 16:12:00-04:00,VRSN,neutral
1325907.0,Stocks Hitting 52-Week Highs,2015-10-05 10:19:00-04:00,VRSN,neutral
1325908.0,Internet Grows to 296 Million Domain Names in the Second Quarter of 2015,2015-09-16 16:15:00-04:00,VRSN,neutral
1325909.0,Think Buybacks Boost Share Prices? Think Again,2015-07-31 12:53:00-04:00,VRSN,positive
1325910.0,"VeriSign Reports Q2 Adj EPS $0.74 Vs Est $0.75, Sales $262.5M Vs Est $261.89M",2015-07-23 16:35:00-04:00,VRSN,neutral
1325911.0,"After-Hours Movers Friday: Akorn Inc., Weight Watchers International Inc.",2015-04-25 11:35:00-04:00,VRSN,neutral
1325912.0,From Verisign Q1 Earnings Conference Call: Cuts FY15 Sales Guidance from $1.04B-$1.06B to $1.043B-$1.057B vs $1.06B Est.,2015-04-23 17:07:00-04:00,VRSN,negative
1325913.0,"Verisign Reports Q1 Adj. EPS $0.74 vs $0.75 Est., Sales $258.4M vs $259M Est.",2015-04-23 16:39:00-04:00,VRSN,neutral
1325914.0,"Earnings Scheduled For April 23, 2015",2015-04-23 04:03:00-04:00,VRSN,neutral
1325915.0,Verisign Announces Pricing of $500M Offering of Senior Unsecured Notes,2015-03-24 16:05:00-04:00,VRSN,negative
1325916.0,"Fast Money Picks For February 25: General Electric, Southern Co, Verisign, Hewlett-Packard",2015-02-25 06:46:00-05:00,VRSN,neutral
1325917.0,4 Stocks Wall Street Loves This Year...And 4 It Doesn't,2015-02-16 20:59:00-05:00,VRSN,positive
1325918.0,"Earnings Scheduled For February 5, 2015",2015-02-05 05:05:00-05:00,VRSN,neutral
1325919.0,Benzinga's Top Downgrades,2015-01-26 09:21:00-05:00,VRSN,positive
1325920.0,UPDATE: Credit Suisse Downgrades Verisign As Risk/Reward Is Biased To Downside,2015-01-26 08:26:00-05:00,VRSN,negative
1325921.0,Credit Suisse Downgrades VeriSign To Underperform,2015-01-26 07:27:00-05:00,VRSN,positive
1325922.0,"Credit Suisse Downgrades VeriSign to Underperform, Maintains $47.50 PT",2015-01-26 04:22:00-05:00,VRSN,positive
1325923.0,Benzinga's Top Downgrades,2015-01-22 09:05:00-05:00,VRSN,positive
1325924.0,JP Morgan Downgrades VeriSign To Underweight,2015-01-22 07:29:00-05:00,VRSN,positive
1325925.0,"JP Morgan Downgrades VeriSign to Underweight, Maintains $57.50 PT",2015-01-22 06:16:00-05:00,VRSN,positive
1325926.0,Top 4 Mid-Cap Stocks In The Internet Information Providers Industry With The Highest EPS,2015-01-05 04:43:00-05:00,VRSN,positive
1325927.0,"VeriSign, Inc. Reports Q3 EPS of $0.70 vs $0.69 Est; Revenue of $255.0M vs $253.61M Est",2014-10-23 16:06:00-04:00,VRSN,neutral
1325928.0,"Earnings Scheduled For October 23, 2014",2014-10-23 05:11:00-04:00,VRSN,neutral
1325929.0,5 Technology Stocks With The Highest Operating Margin,2014-10-01 09:25:00-04:00,VRSN,neutral
1325930.0,Warren Buffett Portfolio Shuffle Provokes Muted Market Reaction,2014-08-15 11:31:00-04:00,VRSN,negative
1325931.0,Warren Buffett Reveals Quarterly Portfolio Changes As Berkshire Hathaway Shares Hit $200K,2014-08-14 19:23:00-04:00,VRSN,positive
1325932.0,Berkshire Hathaway Reports 10.4% Passive Stake In VeriSign as of July 31 -,2014-08-04 06:06:00-04:00,VRSN,positive
1325933.0,5 Technology Stocks With The Highest Profit Margin,2014-07-28 09:28:00-04:00,VRSN,positive
1325934.0,"VeriSign, Inc. Narrows FY2014 EPS Guidance from $1.0B-1.01B to $1.0B-1.01B vs $1.01B Est",2014-07-24 16:48:00-04:00,VRSN,neutral
1325935.0,"VeriSign, Inc. Reports Q2 EPS of $0.68 vs $0.64 Est; Revenue of $250.40M vs $251.69M Est",2014-07-24 16:48:00-04:00,VRSN,neutral
1325936.0,"Earnings Scheduled For July 24, 2014",2014-07-24 05:31:00-04:00,VRSN,neutral
1325937.0,Benzinga's Top Downgrades,2014-06-27 09:28:00-04:00,VRSN,positive
1325938.0,"Wells Fargo Downgrades VeriSign, Inc. to Market Perform",2014-06-27 06:48:00-04:00,VRSN,positive
1325939.0,Verisign Spikes to High on Volume,2014-05-21 12:26:00-04:00,VRSN,neutral
1325940.0,Validian: Positioning For Growth,2014-05-16 13:35:00-04:00,VRSN,positive
1325941.0,"VeriSign, Inc. Sees Q1 Sales $1.0B-1.05B vs $1.02B Est",2014-04-24 16:45:00-04:00,VRSN,neutral
1325942.0,"VeriSign, Inc. Reports Q1 EPS of $0.64 vs $0.63 Est; Revenue of $249.0M vs $248.98M Est",2014-04-24 16:12:00-04:00,VRSN,neutral
1325943.0,"Earnings Scheduled For April 24, 2014",2014-04-24 05:33:00-04:00,VRSN,neutral
1325944.0,S&P Upgrades Verisign from BB to BB+; Outlook Stable,2014-04-16 15:04:00-04:00,VRSN,positive
1325945.0,Mid-Afternoon Market Update: Markets Up Despite More Crimea Fears,2014-03-17 15:51:00-04:00,VRSN,positive
1325946.0,Mid-Day Market Update: Schawk Gains On Acquisition News; VeriSign Shares Decline,2014-03-17 13:11:00-04:00,VRSN,positive
1325947.0,Mid-Morning Market Update: Markets Open Higher; JA Solar Swings To Q4 Profit,2014-03-17 10:13:00-04:00,VRSN,positive
1325948.0,Morning Market Losers ,2014-03-17 09:45:00-04:00,VRSN,negative
1325949.0,"Verisign Says National Telecommunications and Information Administration's Announcement of Intent to Transition Key Internet Domain Name Functions Does Not Affect Co's .Com, .Net Business",2014-03-17 09:18:00-04:00,VRSN,neutral
1325950.0,"Cowen & Company Downgrades VeriSign, Inc. to Market Perform, Lowers PT to $49.00",2014-03-17 08:09:00-04:00,VRSN,negative
1325951.0,Mid-Afternoon Market Update: Activision Rallies as Market Ignores Poor Jobs Number,2014-02-07 16:19:00-05:00,VRSN,negative
1325952.0,Mid-Day Market Update: Expedia Surges On Strong Results; Genpact Shares Slip,2014-02-07 12:51:00-05:00,VRSN,positive
1325953.0,Mid-Morning Market Update: Markets Open Higher; LinkedIn Issues Downbeat Outlook,2014-02-07 10:20:00-05:00,VRSN,neutral
1325954.0,"Citigroup Downgrades VeriSign, Inc. to Sell",2014-02-07 08:21:00-05:00,VRSN,neutral
1325955.0,"VeriSign, Inc. Sees FY2014 Sales $1.0B-1.02B vs $1.02B Est",2014-02-06 16:50:00-05:00,VRSN,neutral
1325956.0,"VeriSign, Inc. Reports Q4 EPS of $0.65 vs $0.60 Est; Revenue of $292.10M vs $244.68M Est",2014-02-06 16:05:00-05:00,VRSN,neutral
1325957.0,"Earnings Scheduled For February 6, 2014",2014-02-06 04:29:00-05:00,VRSN,neutral
1325958.0,Hearing Cowen Negative on Verisign,2014-01-03 09:34:00-05:00,VRSN,negative
1325959.0,Stocks Hitting 52-Week Highs,2013-12-26 10:44:00-05:00,VRSN,neutral
1325960.0,Stocks Hitting 52-Week Highs,2013-11-29 10:27:00-05:00,VRSN,neutral
1325961.0,Who Would You Rather Be... Bill Gates vs. Warren Buffett,2013-11-25 15:27:00-05:00,VRSN,neutral
1325962.0,2013 3Q 13F Roundup,2013-11-18 13:27:00-05:00,VRSN,neutral
1325963.0,Stocks Hitting 52-Week Highs,2013-11-15 11:33:00-05:00,VRSN,neutral
1325964.0,Lone Pine Capital Showing a Reduced Stake in Verisign from 7.498M Shares to 4.88M Shares,2013-11-14 16:42:00-05:00,VRSN,positive
1325965.0,"13F from Buffett's Berkshire Shows Lowered Stakes in GlaxoSmithKline, Sanofi, ConocoPhilips, DirecTV, Raised Stakes in Suncor Energy, VeriSign, Bank of NY Mellon, US Bancorp",2013-11-14 16:34:00-05:00,VRSN,positive
1325966.0,"13F from Barry Rosenstein's JANA Partners Just Out, Fund Showing Raised Stakes in Charter, Safeway, Lowered Stakes in Agrium, Copart, Verisign",2013-11-14 08:44:00-05:00,VRSN,negative
1325967.0,Two Ways Of Limiting Your Downside In VeriSign,2013-10-28 08:43:00-04:00,VRSN,negative
1325968.0,"VeriSign, Inc. Reports Q3 EPS of $0.59 vs $0.57 Est; Revenue of $243.70M vs $240.61M Est",2013-10-24 16:06:00-04:00,VRSN,neutral
1325969.0,"Earnings Scheduled For October 24, 2013",2013-10-24 04:42:00-04:00,VRSN,neutral
1325970.0,Browsing Minds Looking More Closely At These Computer Stocks,2013-10-02 15:34:00-04:00,VRSN,neutral
1325971.0,Stocks Hitting 52-Week Highs,2013-09-19 10:46:00-04:00,VRSN,neutral
1325972.0,Stocks Hitting 52-Week Highs,2013-09-18 10:17:00-04:00,VRSN,neutral
1325973.0,Accumulated Goodwill Amortization and Unrecorded Goodwill,2013-08-19 12:30:00-04:00,VRSN,positive
1325974.0,"UPDATE: Berkshire Hathaway Discloses Increased Stakes In Mastercard, Media General, Moody's, National Oilwell Varco, Precision Castparts, Sanofi, Torchmark, U.S. Bancorp, UPS, Verisign, Viacom, Visa, Wabco, Washington Post",2013-08-15 07:35:00-04:00,VRSN,positive
1325975.0,"B. Riley Upgrades VeriSign to Buy, Raises PT to $58.00",2013-07-26 07:47:00-04:00,VRSN,neutral
1325976.0,"VeriSign, Inc. Reports Q2 EPS of $0.58 vs $0.55 Est; Revenue of $239.0M vs $237.19M Est",2013-07-25 16:11:00-04:00,VRSN,neutral
1325977.0,"Earnings Scheduled For July 25, 2013",2013-07-25 04:43:00-04:00,VRSN,neutral
1325978.0,Summary of 13F from Tiger Global,2013-05-16 07:19:00-04:00,VRSN,neutral
1325979.0,"Buffett's Berkshire More Than Doubles Stake in Verisign, Wal-Mart Stake Now Over 49M, Wells Fargo Stake Now Over 458M Shares",2013-05-15 16:26:00-04:00,VRSN,positive
1325980.0,Berkshire Raised stake in Verisign,2013-05-15 16:23:00-04:00,VRSN,neutral
1325981.0,"Summary of Jana Partners 13F: Aetna, Expedia and Kinder Morgan All Raised Among Others",2013-05-15 15:24:00-04:00,VRSN,positive
1325982.0,"JANA Raised Stakes in Aetna, Big Lots, Verisign",2013-05-15 09:51:00-04:00,VRSN,neutral
1325983.0,"VeriSign, Inc. Reports Q1 EPS of $0.58 vs $0.54 Est; Revenue of $236.40M vs $232.57M Est",2013-04-25 16:07:00-04:00,VRSN,neutral
1325984.0,"Earnings Scheduled For April 25, 2013",2013-04-25 05:12:00-04:00,VRSN,neutral
1325985.0,Verisign Reports Pricing of $750M Offering of Senior Unsecured Notes,2013-04-11 17:20:00-04:00,VRSN,negative
1325986.0,Should Amazon Be Allowed to Buy the .Book Domain?,2013-04-10 09:00:00-04:00,VRSN,positive
1325987.0,Verisign Announces Proposed Offering of $600M of Senior Unsecured Notes ,2013-04-08 08:01:00-04:00,VRSN,negative
1325988.0,"Citigroup Maintains Neutral on VeriSign, Inc., Raises PT to $50.00",2013-03-28 06:34:00-04:00,VRSN,neutral
1325990.0,UPDATE: Credit Suisse Downgrades VeriSign to Neutral; Risk/Reward Now Balanced,2013-02-27 07:51:00-05:00,VRSN,positive
1325991.0,Benzinga's Top Downgrades,2013-02-27 07:41:00-05:00,VRSN,positive
1325992.0,"Credit Suisse Downgrades VeriSign, Inc. to Neutral",2013-02-27 06:19:00-05:00,VRSN,positive
1325993.0,"Berkshire Adds Archer-Daniels, Verisign; Boosts GM Stake",2013-02-14 17:23:00-05:00,VRSN,positive
1325994.0,"13F from Berkshire Hathaway Showing New Stakes in VeriSign, Archer Daniels Midland, Raised Stake in WABCO",2013-02-14 16:42:00-05:00,VRSN,neutral
1325995.0,UPDATE: Topeka Capital Markets Raises PT to $52 on VeriSign on 2014 Forecast,2013-02-05 14:29:00-05:00,VRSN,neutral
1325996.0,"Topeka Capital Maintains Buy on VeriSign, Inc., Raises PT to $52.00",2013-02-05 08:59:00-05:00,VRSN,neutral
1325997.0,UPDATE: VeriSign Q4 Profit Surges 96%,2013-01-25 02:41:00-05:00,VRSN,positive
1325998.0,"VeriSign, Inc. Sees FY2013 Sales $945.0M-960.0M vs $956.90M Est",2013-01-24 16:51:00-05:00,VRSN,neutral
1325999.0,"VeriSign, Inc. Reports Q4 EPS of $0.59 vs $0.51 Est; Revenue of $230.0M vs $229.20M Est",2013-01-24 16:05:00-05:00,VRSN,neutral
1326000.0,"Earnings Scheduled For January 24, 2013",2013-01-24 02:45:00-05:00,VRSN,neutral
1326001.0,Earnings Expectations for the Week of January 21,2013-01-20 13:14:00-05:00,VRSN,neutral
1326002.0,"B. Riley Caris Initiates Coverage on VeriSign, Inc. at Neutral, Announces $39.00 PT",2013-01-11 09:02:00-05:00,VRSN,neutral
1326003.0,"Topeka Capital Markets Reiterates Buy Rating, $41 PT on Verisign",2012-12-28 11:08:00-05:00,VRSN,neutral
1326004.0,Verisign Announces Increase in .Net Registry fee,2012-12-19 16:10:00-05:00,VRSN,positive
1326005.0,VeriSign Adds $458.8M to Buyback Plan,2012-12-06 08:35:00-05:00,VRSN,neutral
1326006.0,Barron's Recap (12/1/12): The New Philanthropists,2012-12-02 20:20:00-05:00,VRSN,neutral
1326007.0,New Contract Triggers Large Decline in Verisign,2012-11-30 15:27:00-05:00,VRSN,neutral
1326008.0,"Citigroup Reiterates Neutral on VeriSign, Inc., Lowers PT to $35.00",2012-11-30 14:27:00-05:00,VRSN,negative
1326009.0,"Mid-Day Market Update: Markets Flat, Ulta Salon Rallies",2012-11-30 13:09:00-05:00,VRSN,neutral
1326010.0,UPDATE: Verisign Reports US DoC Approval of Newly Revised Dot Com Registry Agreement,2012-11-30 08:43:00-05:00,VRSN,positive
1326011.0,Verisign Resumes Down ~19%,2012-11-30 08:21:00-05:00,VRSN,neutral
1326012.0,PREVIEW: Verisign to Resume Trading at 8:20 AM,2012-11-30 08:07:00-05:00,VRSN,neutral
1326013.0,VeriSign Reports US Department of Commerce Approval of Newly Revised Dot Com Registry Agreement,2012-11-30 08:01:00-05:00,VRSN,positive
1326014.0,Verisign Halted News Pending,2012-11-30 07:59:00-05:00,VRSN,neutral
1326015.0,Winslow Has No Stake in Verisign,2012-11-27 13:12:00-05:00,VRSN,negative
1326016.0,First Analysis Downgrades VeriSign from Overweight to Equalweight,2012-11-26 09:29:00-05:00,VRSN,negative
1326017.0,Verisign Resumes Trading,2012-11-01 14:08:00-04:00,VRSN,neutral
1326018.0,"VeriSign Circuit Breaker, Shares Now Up Almost 14%",2012-11-01 14:03:00-04:00,VRSN,positive
1326019.0,VeriSign Shares Now Up Nearly 6% Following Release Saying DoJ 'Substantially Concluded' Recent .com Registry Review,2012-11-01 14:00:00-04:00,VRSN,positive
1326020.0,"VeriSign, Inc. (NASDAQ: VRSN) today provided a statement on the pending review",2012-11-01 13:57:00-04:00,VRSN,neutral
1326021.0,Verisign Spikes Higher on PR,2012-11-01 13:57:00-04:00,VRSN,neutral
1326022.0,Christopher R. Hansen's Valiant Capital Adds Facebook To Its Portfolio,2012-10-29 17:16:00-04:00,VRSN,neutral
1326023.0,Benzinga Mid-Afternoon Market Update ,2012-10-26 15:46:00-04:00,VRSN,neutral
1326024.0,Benzinga Mid-Day Market Update ,2012-10-26 12:55:00-04:00,VRSN,neutral
1326025.0,Benzinga Mid-Morning Market Update,2012-10-26 11:09:00-04:00,VRSN,neutral
1326026.0,Verisign Guides FY Revenue $870-875M vs $874.7M Est,2012-10-25 16:45:00-04:00,VRSN,neutral
1326027.0,VeriSign Reports Q3 EPS $0.50 vs $0.49 Est; Revenues $224.0M vs $223.56M Est,2012-10-25 16:37:00-04:00,VRSN,neutral
1326028.0,Lone Pine Capital Reports 5.5% Stake in Verisign,2012-08-27 16:44:00-04:00,VRSN,negative
1326029.0,Benzinga's Top Downgrades,2012-08-10 07:16:00-04:00,VRSN,positive
1326030.0,"Stifel Nicolaus Maintains VeriSign at Buy, Raises PT from $45 to $50",2012-07-27 08:52:00-04:00,VRSN,neutral
1326031.0,VeriSign Reports Q2 EPS $0.45 vs $0.45 Est; Revenues $214.1M vs $216.01M Est,2012-07-26 16:05:00-04:00,VRSN,neutral
1326032.0,Earnings Scheduled For July 26,2012-07-26 04:03:00-04:00,VRSN,neutral
1326033.0,Benzinga's Top Downgrades,2012-07-23 07:27:00-04:00,VRSN,positive
1326034.0,"Citigroup Downgrades VeriSign from Buy to Neutral, Lowers PT from $47 to $46",2012-07-23 05:47:00-04:00,VRSN,negative
1326035.0,UPDATE: Oppenheimer Maintains Perform on Verisign,2012-06-26 12:24:00-04:00,VRSN,neutral
1326036.0,Cyberspace Gets Bigger As ICANN Unwraps New Domains - IBD,2012-06-13 10:52:00-04:00,VRSN,neutral
1326037.0,Verisign Announces Participation in ICANN's New gTLD Program  ,2012-06-13 08:32:00-04:00,VRSN,neutral
1326038.0,Small-Cap Corner: IZEA Gets a Lift on Board Announcement (IZEA),2012-06-11 15:40:00-04:00,VRSN,neutral
1326039.0,"UPDATE: J.P. Morgan Maintains Neutral Rating, Raises PT for VeriSign",2012-04-27 11:38:00-04:00,VRSN,neutral
1326040.0,"JP Morgan Maintains VeriSign at Neutral, Raises PT from $40 to $41.5",2012-04-27 08:23:00-04:00,VRSN,positive
1326041.0,VeriSign Reports Q1 EPS $0.42 vs $0.43 Est; Revenues $205.7M vs $208.60M Est,2012-04-26 16:07:00-04:00,VRSN,neutral
1326042.0,Internap Network Services Announces Departure of CFO George Kilguss ,2012-04-26 16:02:00-04:00,VRSN,neutral
1326043.0,"Analysts Upbeat on VeriSign's Q1 Earnings, Revenue - IBD",2012-04-25 14:06:00-04:00,VRSN,neutral
1326044.0,Four Breakout Stocks To Watch on Thursday,2012-04-18 17:03:00-04:00,VRSN,neutral
1326045.0,Stocks on Watch for the 18th of April,2012-04-17 17:50:00-04:00,VRSN,neutral
1326046.0,UPDATE: J.P. Morgan Raises VeriSign's PT,2012-04-10 08:58:00-04:00,VRSN,neutral
1326047.0,"JP Morgan Maintains VeriSign at Neutral, Raises PT from $38 to $40",2012-04-10 06:10:00-04:00,VRSN,positive
1326048.0,UPDATE: Citigroup Raises PT to $46 on Verisign  ,2012-04-03 12:31:00-04:00,VRSN,neutral
1326049.0,"Citigroup Maintains VeriSign at Buy, Raises PT from $39 to $46",2012-04-03 06:34:00-04:00,VRSN,neutral
1326050.0,Notable Call Options Activity in VeriSign,2012-03-09 10:24:00-05:00,VRSN,neutral
1326051.0,Verisign Spiking Lower on Heavy Volume,2012-02-06 12:31:00-05:00,VRSN,negative
1326052.0,Notable Put Options Activity in VeriSign,2012-02-02 13:31:00-05:00,VRSN,neutral
1326053.0,VeriSign Reports Q4 EPS $0.40 vs $0.41 Est; Revenues $204.00M vs $203.52M Est	 			,2012-01-26 16:14:00-05:00,VRSN,neutral
1326054.0,Bank of America Downgrades VeriSign to Underperform,2012-01-09 11:36:00-05:00,VRSN,neutral
1326055.0,CLSA Downgrades VeriSign to Outperform ,2012-01-06 10:18:00-05:00,VRSN,neutral
1326056.0,Notable Call Options Activity in VeriSign,2011-12-08 13:24:00-05:00,VRSN,neutral
1326057.0,Disclosure Insight Maintains Medium Risk Rating on VeriSign ,2011-11-17 06:56:00-05:00,VRSN,negative
1326058.0,Notable Call Options Activity in VeriSign,2011-11-02 10:07:00-04:00,VRSN,neutral
1326059.0,Verisign Spiking Higher on Elevated Volume; May Be Attributed to Takeover Chatter,2011-11-02 09:39:00-04:00,VRSN,neutral
1326060.0,Verisign Spiking Higher; May be Attributable to Takeover Chatter,2011-11-02 09:39:00-04:00,VRSN,neutral
1326061.0,Notable Call Options Activity in VeriSign,2011-10-28 10:32:00-04:00,VRSN,neutral
1326062.0,VeriSign Reports Q3 EPS $0.39 vs $0.37 Est; Revenues $197M vs $196.18M Est			,2011-10-27 16:11:00-04:00,VRSN,neutral
1326063.0,Verisign Names John Calys as Interim Chief Financial Officer  ,2011-09-26 16:05:00-04:00,VRSN,neutral
1326064.0,"JP Morgan Downgrades VRSN, DOX to Neutral",2011-09-21 06:19:00-04:00,VRSN,positive
1326065.0,Pre-Market Movers; Verisign Down 11% ,2011-09-09 09:24:00-04:00,VRSN,neutral
1326066.0,US Stock Futures Signal Lower Start On Wall Street,2011-09-09 06:22:00-04:00,VRSN,negative
1326067.0,Stocks To Watch For September 9,2011-09-09 03:02:00-04:00,VRSN,neutral
1326068.0,Verisign Spiking Lower on Heavy Volume,2011-09-08 16:07:00-04:00,VRSN,negative
1326069.0,Verisign Announces CFO Leaving Company to Pursue New Opportunities  ,2011-09-08 16:05:00-04:00,VRSN,positive
1326070.0,"Light, Slow & Choppy Action  09-08-2011",2011-09-08 15:12:00-04:00,VRSN,neutral
1326071.0,Volatility Weakens  09-07-2011,2011-09-07 15:50:00-04:00,VRSN,negative
1326072.0,Opportunity  09-06-2011,2011-09-07 15:45:00-04:00,VRSN,positive
1326073.0,Hearing CLSA Reiterates Buy and $38PT on VRSN ,2011-09-07 13:07:00-04:00,VRSN,neutral
1326074.0,Hearing VeriSign Cancels Appearance at ThinkEquity Conference,2011-09-07 11:11:00-04:00,VRSN,negative
1326075.0,UPDATE: VersiSign Says They Cancelled out Citi Conference Tomorrow Due to Weather in NY,2011-09-06 14:37:00-04:00,VRSN,negative
1326076.0,"VeriSign IR Confirms They Have Cancelled Out of the Citi Technology Conference Scheduled for September 7, 2011 at 1:45pm",2011-09-06 13:59:00-04:00,VRSN,negative
1326077.0,"VeriSign Screams Higher, Could Have Legs",2011-09-06 13:58:00-04:00,VRSN,negative
1326078.0,Verisign Cancels Out of Citi Conference Without Giving Reason,2011-09-06 13:18:00-04:00,VRSN,negative
1326079.0,$26M for Fashion E-Commerce Company Trendyol.com,2011-08-10 08:19:00-04:00,VRSN,neutral
1326080.0,Monday's Put/Call Ratio Leaders,2011-08-08 13:08:00-04:00,VRSN,neutral
1326081.0,Pre-Market Gainers 8/8,2011-08-08 08:02:00-04:00,VRSN,neutral
1326082.0,Benzinga's Top Pre-Market Losers,2011-08-08 07:43:00-04:00,VRSN,negative
1326083.0,J.P. Morgan Drops PT To $38 On VRSN,2011-07-29 08:13:00-04:00,VRSN,neutral
1326084.0,JP Morgan Lowers PT On VeriSign To $38,2011-07-29 06:34:00-04:00,VRSN,positive
1326085.0,VeriSign Reports Q2 EPS $0.38 May Not Compare to $0.35 Est; Revenues $189.8M vs $191.14M Est            ,2011-07-28 16:08:00-04:00,VRSN,neutral
1326086.0,J.P. Morgan Overweight On VeriSign,2011-07-15 08:02:00-04:00,VRSN,negative
1326088.0,Verisign Announces Increase in .com/.net Domain Name Fees ,2011-07-14 16:11:00-04:00,VRSN,positive
1326089.0,Credit Suisse Updates 7/1,2011-07-01 08:14:00-04:00,VRSN,positive
1326090.0,Wednesday's S&P 500 Sector Recap 6/29/11,2011-06-29 17:35:00-04:00,VRSN,neutral
1326091.0,"Calls Purchased on VeriSign, Inc.",2011-06-29 10:37:00-04:00,VRSN,neutral
1326092.0,ICANN Approves Renewal of .net Registry Contract ,2011-06-28 16:07:00-04:00,VRSN,positive
1326093.0,Citi Adds Verisign To Most Preferred,2011-06-22 08:26:00-04:00,VRSN,neutral
1326094.0,"""Aera!""  06-21-2011",2011-06-21 18:18:00-04:00,VRSN,neutral
1326095.0,Benzinga's Volume Movers,2011-06-21 10:37:00-04:00,VRSN,neutral
1326096.0,"Calls Purchased on VeriSign, Inc.",2011-06-21 10:25:00-04:00,VRSN,neutral
1326097.0,"Puts Purchased on VeriSign, Inc.",2011-06-17 14:47:00-04:00,VRSN,neutral
1326098.0,VeriSign Changes Domain Data Calculation Leading to Unreliable Results for June,2011-06-02 07:25:00-04:00,VRSN,neutral
1326099.0,"Top Software and Programming Stock Picks on 5/6/11- BMC, ERTS, VRNG, VELT, IGTE, CRYP, SXCI, ADAT, FTNT, CYDE, PAR, AZPN, CCGM, MGT",2011-05-06 05:11:00-04:00,VRSN,positive
1326100.0,VeriSign Reports EPS of $0.32 vs. $0.32 Estimate; Revenues $181.5M vs. $184.44M Estimate,2011-04-28 16:43:00-04:00,VRSN,neutral
1326101.0,"Earnings Scheduled For April 28 (MSFT, AET, VIA, XOM, CL, PEP, BMY, MMI, TWC, PG, DOW, S, TYC, CCE, SWY, HOT, EK, EXPE, D, VRSN, EMN)",2011-04-28 02:33:00-04:00,VRSN,neutral
1326102.0,Jefferies on VRSN Contract Renewal,2011-04-12 09:20:00-04:00,VRSN,neutral
1326103.0,Citi Maintains Buy on Verisign (VRSN),2011-04-12 08:02:00-04:00,VRSN,neutral
1326104.0,Deutsche Bank Raises VRSN PT To $42 ,2011-04-12 07:53:00-04:00,VRSN,neutral
1326105.0,Deutsche Bank Raises PT On VeriSign To $42,2011-04-12 07:26:00-04:00,VRSN,neutral
1326106.0,"Puts Purchased on VeriSign, Inc. (VRSN)",2011-04-11 11:47:00-04:00,VRSN,neutral
1326107.0,"Wedbush Maintains Neutral Rating On VRSN, $38 PT",2011-04-04 09:01:00-04:00,VRSN,neutral
1326108.0,Citi Maintains Buy on Verisign (VRSN),2011-03-31 07:30:00-04:00,VRSN,neutral
1326109.0,"VeriSign Tracking Ahead Of Expectations, Wedbush Remains Neutral",2011-03-02 09:15:00-05:00,VRSN,neutral
1326110.0,"Options Brief: VeriSign, Inc. (VRSN)",2011-02-07 10:59:00-05:00,VRSN,neutral
1326111.0,Citi: Verisign (VRSN) Legal Update ,2011-02-07 10:45:00-05:00,VRSN,positive
1326112.0,"VRSN Shares Remain Undervalued, Citigroup Reports",2011-02-07 09:26:00-05:00,VRSN,positive
1326113.0,Revenues Grow at VeriSign  - Analyst Blog,2011-01-28 14:24:00-05:00,VRSN,neutral
1326114.0,Revenues Grow at VeriSign  - Analyst Blog,2011-01-28 13:49:00-05:00,VRSN,neutral
1326115.0,Jefferies Gives Color On VeriSign's Results & Lackluster Revenue Outlook,2011-01-28 09:34:00-05:00,VRSN,neutral
1326116.0,"J.P. Morgan Retains VeriSign PT Of $41, Overweight Rating (VRSN)",2011-01-28 09:04:00-05:00,VRSN,negative
1326117.0,VeriSign Reports Q4 EPS of $.31 vs. $.30,2011-01-27 16:06:00-05:00,VRSN,neutral
1326118.0,"Earnings Scheduled For January 27 (CAT, MSFT, PG, T, BMY, LLY, AMZN, AZN, TWC, SNDK, NOK, CB, JBLU, VRSN, PMCS, CL, MSI, KLAC)",2011-01-27 03:44:00-05:00,VRSN,neutral
1326119.0,"Deutsche Bank Reviews Software Sector (VMW, MSFT, VRSN, CTXS, SYMC)",2011-01-26 11:34:00-05:00,VRSN,neutral
1326120.0,"Going Into Earnings, Deutsche Bank Maintains VRSN Buy Rating, $38 PT",2011-01-24 08:43:00-05:00,VRSN,neutral
1326121.0,"5 Ways To Profit From Ongoing WikiLeaks (VRSN, AKAM, MFE, WBSN, SYMC)",2010-12-28 15:44:00-05:00,VRSN,positive
1326122.0,Oppenheimer Downgrades VeriSign From Outperform To Perform,2010-12-16 11:03:00-05:00,VRSN,neutral
1326123.0,"Benzinga's Top Pre-Market NASDAQ Losers (CRDC, GPIC, VRSN, QGEN)",2010-12-16 09:03:00-05:00,VRSN,negative
1326124.0,Oppenheimer Downgrades VeriSign To Perform,2010-12-16 08:45:00-05:00,VRSN,neutral
1326125.0,Oppenheimer Downgrading VeriSign (VRSN),2010-12-16 07:14:00-05:00,VRSN,neutral
1326126.0,Longs May Need to Marry  12-15-2010,2010-12-15 15:10:00-05:00,VRSN,neutral
1326127.0,Citigroup Raises VeriSign PT From $36 To $43,2010-12-13 09:07:00-05:00,VRSN,neutral
1326128.0,Citi Raises Price Target on Verisign,2010-12-13 07:30:00-05:00,VRSN,neutral
1326129.0,Verisign Up In Pre-Market On Special Dividend,2010-12-10 09:07:00-05:00,VRSN,positive
1326130.0,"Calls Purchased on VeriSign, Inc. (VRSN)",2010-12-09 13:16:00-05:00,VRSN,neutral
1326131.0,Domain Names Grow at VeriSign  - Analyst Blog,2010-11-30 13:00:00-05:00,VRSN,neutral
1326132.0,Domain Names Grow at VeriSign  - Analyst Blog,2010-11-30 07:29:00-05:00,VRSN,neutral
1326133.0,"Options Brief: VeriSign, Inc. (VRSN)",2010-11-29 12:13:00-05:00,VRSN,neutral
1326134.0,"Zacks Analyst Blog Highlights: Monster Worldwide, Yahoo, Merck & Co., Johnson & Johnson and VeriSign     - Press Releases",2010-11-02 11:00:00-04:00,VRSN,neutral
1326135.0,VeriSign Demonstrates Growth - Analyst Blog,2010-10-29 19:12:00-04:00,VRSN,positive
1326136.0,VeriSign Shares Up 5.7% (VRSN),2010-10-29 14:49:00-04:00,VRSN,positive
1326137.0,"Earnings Scheduled For October 28 (DUK, MSFT, XOM, MOT, MMM, MFE, DOW, FO, EXPE, CL, BMC, MXIM, MET, KLAC, VRSN, DBD, GNW, CAH)",2010-10-28 03:58:00-04:00,VRSN,neutral
1326138.0,Citigroup Reviews VeriSign's Court Hearing (VRSN),2010-10-25 09:43:00-04:00,VRSN,neutral
1326139.0,VeriSign Trial Date Expected In December 2011,2010-10-18 08:48:00-04:00,VRSN,neutral
1326140.0,"Puts Purchased on VeriSign, Inc. (VRSN)",2010-10-06 14:21:00-04:00,VRSN,neutral
1326141.0,"Wednesday's Put/Call Ratio Leaders (CX, VRSN, WM, LRCX, HERO)",2010-10-06 12:27:00-04:00,VRSN,neutral
1326142.0,"Coverage Reiterated For WCN, VSRN",2010-10-05 10:46:00-04:00,VRSN,neutral
1326143.0,VeriSign Reinforces Positive Outlook for Stock,2010-09-29 08:41:00-04:00,VRSN,positive
1326144.0,Top Vietnam Stocks,2010-09-15 12:48:00-04:00,VRSN,positive
1326145.0,"Brian Kelly Likes Verisign, Inc.  (VRSN) ",2010-09-08 18:46:00-04:00,VRSN,positive
1326146.0,Jefferies Believes Verisign Potential Acquisition Target (VRSN),2010-09-07 07:51:00-04:00,VRSN,neutral
1326147.0,Lagging Sectors That Need More Momentum  08-31-2010,2010-08-31 14:52:00-04:00,VRSN,negative
1326148.0,J.P. Morgan Overweight On VeriSign (VRSN),2010-08-26 08:12:00-04:00,VRSN,negative
1326149.0,Think Defense  08-13-2010,2010-08-16 13:51:00-04:00,VRSN,positive
1326150.0,A Peek Into The Market Before The Trading Starts,2010-08-10 09:32:00-04:00,VRSN,neutral
1326151.0,JP Morgan Resumes Coverage of VeriSign After Completion of Sale (VRSN),2010-08-10 08:46:00-04:00,VRSN,positive
1326152.0,Oppenheimer Reiterates Outperform on VeriSign (VRSN),2010-08-09 11:37:00-04:00,VRSN,neutral
1326153.0,VeriSign Misses - Analyst Blog,2010-08-04 13:34:00-04:00,VRSN,negative
1326154.0,Rolling Out & Up  08-03-2010,2010-08-03 16:07:00-04:00,VRSN,neutral
1326155.0,VeriSign Authorized New $1.1B Buyback (VRSN),2010-08-03 15:27:00-04:00,VRSN,neutral
1326156.0,"Syniverse Sales Rise 40%, Guidance Upped - Analyst Blog",2010-08-03 14:10:00-04:00,VRSN,neutral
1326157.0,VRSN May Either Sell Or Opt For LBO,2010-08-03 13:08:00-04:00,VRSN,neutral
1326158.0,August Opens Strong Like Bull  08-01-2010,2010-08-02 18:39:00-04:00,VRSN,positive
1326159.0,VeriSign Reports Solid Earnings (VRSN),2010-08-02 17:02:00-04:00,VRSN,positive
1326160.0,"Stocks To Watch For August 2 (VRSN, HUM, VMC, NRG)",2010-08-02 07:23:00-04:00,VRSN,neutral
1326161.0,"Benzinga's Top ETF Decliners (SOXL, IIH, SCO, DTO)",2010-07-29 17:00:00-04:00,VRSN,positive
1326162.0,Calls Purchased on VeriSign Inc. (VRSN),2010-07-14 13:44:00-04:00,VRSN,neutral
1326163.0,Upside Purchased on Verisign Inc. (VRSN),2010-07-07 15:51:00-04:00,VRSN,neutral
1326164.0,DNS Data Trends For 2Q10 Appear Strong: Deutsche Bank,2010-06-09 10:35:00-04:00,VRSN,positive
1326165.0,"Top 5 Mid-Cap NASDAQ Stocks In The Technology Sector With The Highest Return On Equity (WIN, PTR, STX, SINA, VRSN)",2010-06-02 06:45:00-04:00,VRSN,positive
1326166.0,"Infrastructure Software Update (VRSN, SYMC, CA, VRNT)",2010-05-24 11:54:00-04:00,VRSN,neutral
1326167.0,Bear Tracks  05-21-2010,2010-05-21 15:58:00-04:00,VRSN,neutral
1326168.0,Puts Are Your Friend (Again)  05-20-2010,2010-05-20 15:11:00-04:00,VRSN,positive
1326169.0,"Oppenheimer Positive on Verisign, But Stays On the Sidelines (VRSN)",2010-05-20 10:23:00-04:00,VRSN,positive
1326170.0,"Company News for May 20, 2010 - Corporate Summary",2010-05-20 10:10:00-04:00,VRSN,neutral
1326171.0,"Symantec Buys VeriSign’s Authentication Business (SYMC, VRSN)",2010-05-20 07:38:00-04:00,VRSN,neutral
1326172.0,VeriSign to Sell Authentication Services Business to Symantec for $1.28 Billion,2010-05-19 16:49:00-04:00,VRSN,neutral
1326173.0,"VeriSign To Sell Authentication Business (VRSN, SYMC)   ",2010-05-19 11:57:00-04:00,VRSN,neutral
1326174.0,Pete Najarian Spots Unusual Options Action In VRSN,2010-05-18 19:54:00-04:00,VRSN,neutral
1326175.0,It Takes Two to Contango  05-18-2010,2010-05-18 18:26:00-04:00,VRSN,neutral
1326176.0,BRIEF: Symantec Close to $1.3 Billion Buy of Verisign’s Security Business,2010-05-18 16:01:00-04:00,VRSN,positive
1326177.0,Bears Have Momentum  05-18-2010,2010-05-18 15:07:00-04:00,VRSN,neutral
1326178.0,Calls Purchased in Verisign as Stock Rallies (VRSN),2010-05-18 12:04:00-04:00,VRSN,neutral
1326179.0,"Top 5 Mid-Cap NASDAQ Stocks In The Technology Sector With The Highest Return On Equity (WIN, PTNR, STX, SINA, VRSN)",2010-04-29 07:50:00-04:00,VRSN,positive
1326180.0,Blue Water Capital Markets Reiterates Buy Rating On VeriSign (VRSN),2010-04-19 12:27:00-04:00,VRSN,neutral
1326181.0,CLSA Rates VeriSign (NASDAQ: VRSN) As Buy,2010-04-05 12:00:00-04:00,VRSN,neutral
1326182.0,Jefferies & Company Downgrades (VRSN) To Hold,2010-03-29 11:58:00-04:00,VRSN,neutral
1326183.0,"Company News for March 29, 2010 - Corporate Summary",2010-03-29 09:31:00-04:00,VRSN,neutral
1326184.0,"Benzinga’s Top Downgrades (VRSN, BPOP, STI, AKAM, IACI)",2010-03-22 14:49:00-04:00,VRSN,positive
1326185.0,"Benzinga’s News Roundup (KMB, PEP, KELYA, VRSN)",2010-03-22 08:32:00-04:00,VRSN,neutral
1326186.0,"Top 5 Stocks In the Application Software Industry With The Highest ROE (SWI, PWRD, MSFT, VRSN, BMC)",2010-03-17 09:24:00-04:00,VRSN,positive
1326187.0,"Benzinga’s Top Pre-Market Losers (CMCSA, WU, CHRW, QSFT, VRSN, CTRP)",2010-02-03 08:52:00-05:00,VRSN,negative
1326188.0,"A Peek Into The Takeover Market In 2010 (MSFT, GOOG, BBBB, ORCL, VRSN, AOL, JAVA, DELL, PLCM)",2010-01-08 08:13:00-05:00,VRSN,neutral
1326189.0,"Exciting 2010 Outlook For Software Sector (MSFT, CTXS, VMW, SYMC)",2010-01-07 13:52:00-05:00,VRSN,positive
1326190.0,"Technology Sector Update (CHKP, SYMC, CTXS, MFE, VRSN, DBTK)",2010-01-06 11:35:00-05:00,VRSN,neutral
1326191.0,Net Adds Tracking Ahead of Expectations at VRSN,2009-12-22 15:19:00-05:00,VRSN,neutral
1326192.0,VRSN Announces Price Increase,2009-12-18 14:10:00-05:00,VRSN,positive
1326193.0,ICANN Expected To Renew Contract With Verisign (VRSN),2009-12-16 12:23:00-05:00,VRSN,neutral
1326194.0,JPMorgan (JPM) Overweight On VeriSign Inc (VRSN),2009-12-16 11:23:00-05:00,VRSN,negative
1326195.0,VRSN Poised to Benefit from .com/.net Price Increase,2009-12-14 14:07:00-05:00,VRSN,positive
1326196.0,"Benzinga’s Top Downgrades (COMV, CHRD, VRSN, CSX, BOFL)",2009-11-20 10:19:00-05:00,VRSN,positive
1326197.0,"Goldman Sachs Downgrade Verisign, Trades Down Slightly",2009-11-09 17:43:00-05:00,VRSN,neutral
1326198.0,"Today’s Earnings Preview (CBS, SIRI, DTV, TWC, VRSN, TDC)",2009-11-05 06:33:00-05:00,VRSN,neutral
1326199.0,VeriSign and SoftLayer Partnership Brings SSL Protection to Data Center and Web Hosting Customers,2009-08-17 08:00:00-04:00,VRSN,neutral
1326200.0,VeriSign SSL Certificates Soar Past 4 Million Mark,2009-07-27 08:00:00-04:00,VRSN,neutral
