Unnamed: 0,title,date,stock,sentiment
1368533.0,"Piper Sandler Maintains Overweight on WSFS Financial, Raises Price Target to $30",2020-04-29 10:41:00-04:00,WSFS,negative
1368534.0,WSFS Suspends Buybacks,2020-04-27 16:36:00-04:00,WSFS,neutral
1368535.0,WSFS Financial Q1 EPS $0.230 May Not Compare To $0.690 Estimate,2020-04-27 16:35:00-04:00,WSFS,neutral
1368536.0,Stocks That Hit 52-Week Lows On Monday,2020-03-23 10:34:00-04:00,WSFS,negative
1368537.0,Stocks That Hit 52-Week Lows On Monday,2020-03-16 11:51:00-04:00,WSFS,negative
1368538.0,Stocks That Hit 52-Week Lows On Thursday,2020-03-12 12:10:00-04:00,WSFS,negative
1368539.0,Stocks That Hit 52-Week Lows On Wednesday,2020-03-11 11:41:00-04:00,WSFS,negative
1368540.0,Stocks That Hit 52-Week Lows On Friday,2020-03-06 11:22:00-05:00,WSFS,negative
1368541.0,Stocks That Hit 52-Week Lows On Friday,2020-02-28 10:16:00-05:00,WSFS,negative
1368542.0,"Stephens & Co. Maintains Equal-Weight on WSFS Financial, Lowers Price Target to $44",2020-01-28 07:14:00-05:00,WSFS,negative
1368543.0,WSFS Financial Q4 Adj. EPS $0.96 Beats $0.91 Estimate,2020-01-21 16:10:00-05:00,WSFS,neutral
1368544.0,"Earnings Scheduled For January 21, 2020",2020-01-21 03:42:00-05:00,WSFS,neutral
1368545.0,WSFS Financial Files For Mixed-Shelf Offering; Size Not Disclosed,2019-12-18 16:12:00-05:00,WSFS,neutral
1368546.0,"Keefe, Bruyette & Woods Downgrades WSFS Financial to Market Perform, Announces $46 Price Target",2019-10-23 06:37:00-04:00,WSFS,neutral
1368547.0,WSFS Financial Q3 EPS $0.98 Beats $0.87 Estimate,2019-10-21 16:19:00-04:00,WSFS,neutral
1368548.0,"WSFS Financial Q2 EPS $0.88 Beats $0.74 Estimate, Sales $123.232M Beat $114.3M Estimate",2019-07-22 16:34:00-04:00,WSFS,neutral
1368549.0,"WSFS Financial Q2 EPS $0.68 Misses $0.74 Estimate, Sales $123.2M Beat $114.3M Estimate",2019-07-22 16:29:00-04:00,WSFS,negative
1368550.0,Piper Jaffray Initiates Coverage On WSFS Financial with Neutral Rating,2019-07-16 06:59:00-04:00,WSFS,neutral
1368551.0,"WSFS Financial Q1 EPS $0.91 Beats $0.87 Estimate, Sales $83.314M Beat $77.06M Estimate",2019-04-25 16:49:00-04:00,WSFS,neutral
1368552.0,"WSFS Financial, Beneficial Bancorp Receive All Required Approvals For Deal",2019-02-27 17:35:00-05:00,WSFS,positive
1368553.0,Federal Reserve Approves Acquisition By Delaware-Based WSFS Financial Corp Of Beneficial Bancorp Inc BNCL In Pennsylvania,2019-02-27 15:02:00-05:00,WSFS,positive
1368554.0,WSFS Bank Reports Received Key Regulatory Approval To Purchase Beneficial Bank,2019-02-13 17:24:00-05:00,WSFS,positive
1368555.0,WSFS Financial Says Beneficial Bank To Sell 5 New Jersey Banking Offices With $190M In Deposits To Bank OF Princeton; WSFS Committed To Reinvest 50% (~$32M) Of Estimated Cost savings From Consolidation,2019-02-04 17:21:00-05:00,WSFS,positive
1368556.0,"WSFS Financial Q4 EPS $0.94 Beats $0.90 Estimate, Sales $64.674M Beat $63.81M Estimate",2019-01-22 16:16:00-05:00,WSFS,neutral
1368557.0,WSFS Financial Corporation Receives Stockholder Approval To Combine With Beneficial Bancorp,2018-12-12 14:32:00-05:00,WSFS,positive
1368558.0,"Stocks Trading Ex Dividend For Mon., Nov. 5, 2018",2018-11-05 09:48:00-05:00,WSFS,neutral
1368559.0,"Stocks That Will Be Trading Ex Dividend Mon., Oct. 5, 2018",2018-11-02 09:52:00-04:00,WSFS,neutral
1368560.0,Keefe Bruyette & Woods Upgrades WSFS Financial to Outperform,2018-10-11 09:17:00-04:00,WSFS,neutral
1368561.0,WSFS Financial Sees Q3 Pre-Tax EPS Up By $0.35 Given Positive Impacts From Several Items,2018-09-13 16:10:00-04:00,WSFS,positive
1368562.0,"WSFS Financial Sees Q3 Results Being Positive Impacted Following Settlement Of Insurance Claims Related To Universitas Education, Gain On Sale Of Visa Class B Shares, Unrealized Valuation Gain From Ongoing Equity Investment In Visa Class B Shares",2018-09-13 16:09:00-04:00,WSFS,positive
1368563.0,"Stocks Trading Ex Dividend For Thurs., Aug. 9, 2018",2018-08-09 08:42:00-04:00,WSFS,neutral
1368564.0,"Stocks Which Will Trade Ex Dividend On Thurs., Aug. 9, 2018",2018-08-08 11:48:00-04:00,WSFS,neutral
1368565.0,WSFS Financial Says Beneficial Bancorp Shareholders To Receive 0.3013 Shares Of WSFS Common Stock Plus $2.93/Share In Cash,2018-08-08 08:23:00-04:00,WSFS,positive
1368566.0,WSFS Financial Reports Deal To Combine With Beneficial Bancorp In ~$1.5B Deal,2018-08-08 08:22:00-04:00,WSFS,positive
1368567.0,"Stocks Which Set New 52-Week High Yesterday, July 26th:",2018-07-27 10:42:00-04:00,WSFS,neutral
1368568.0,"Stocks Which Set New 52-Week High Yesterday, July 24th:",2018-07-25 12:14:00-04:00,WSFS,neutral
1368569.0,"WSFS Financial Q2 Adj. EPS $0.90 Beats $0.82 Estimate, Core Net Revenue $96M",2018-07-23 16:12:00-04:00,WSFS,neutral
1368570.0,Earnings Outlook For WSFS Financial,2018-07-23 08:40:00-04:00,WSFS,neutral
1368571.0,"WSFS Financial Announces CEO Mark Turner Will Become Exec. Chairman Effective Jan. 1, 2019, COO Rodger Levenson Wil Become CEO",2018-07-11 16:19:00-04:00,WSFS,positive
1368572.0,"WSFS Financial Q1 Core EPS $0.76, Inline, NII $57.714M Beats $57.41M Est.",2018-04-23 16:25:00-04:00,WSFS,neutral
1368573.0,UPDATE: WSFS Settlement For $12M,2018-02-27 17:07:00-05:00,WSFS,neutral
1368574.0,WSFS Financial Reports Settlement Deal With Universitas Education,2018-02-27 17:06:00-05:00,WSFS,neutral
1368575.0,"WSFS Financial Reports Q4 EPS $(0.02) vs $0.56 In Same Qtr. Last Year, Sales $90.2M",2018-01-22 16:26:00-05:00,WSFS,neutral
1368576.0,UPDATE: WSFS Highlights Yearend Actions Related To Tax Cuts And Jobs Act,2018-01-04 16:49:00-05:00,WSFS,negative
1368577.0,WSFS Financial Reports Received $1.5M Generational Grant From WSFS Bank,2018-01-04 16:48:00-05:00,WSFS,positive
1368578.0,Stephens Drops 18 Names From Best Ideas List Before The New Year,2017-12-27 16:17:00-05:00,WSFS,positive
1368579.0,WSFS Financial Raises Qtr. Dividend From $0.07 To $0.09/Share,2017-10-23 17:30:00-04:00,WSFS,neutral
1368580.0,WSFS Financial Reports Q3 EPS $0.64 vs $0.65 Est.,2017-10-23 17:28:00-04:00,WSFS,neutral
1368581.0,WSFS Names Rodger Levenson COO,2017-08-03 17:40:00-04:00,WSFS,neutral
1368582.0,WSFS Reports Q2 Core EPS $0.63 vs $0.64 Est.,2017-07-27 16:32:00-04:00,WSFS,neutral
1368583.0,"Keefe Bruyette & Woods Downgrades WSFS Financial to Market Perform, Announces $50.00 Price Target",2017-05-01 06:54:00-04:00,WSFS,neutral
1368584.0,WSFS Reports Q1 EPS $0.59 vs $0.59 Est.,2017-04-27 16:08:00-04:00,WSFS,neutral
1368585.0,"DA Davidson Initiates Coverage On WSFS Financial at Buy, Announces $55.00 Price Target",2017-03-06 18:12:00-05:00,WSFS,neutral
1368586.0,"WSFS Financial Reports Q4 EPS $0.56 vs $0.61 Est, NII $52.954M",2017-01-26 17:06:00-05:00,WSFS,neutral
1368587.0,"Keefe Bruyette & Woods Upgrades WSFS Financial Corporation - Common Stock to Outperform, Raises to $38.00",2016-10-31 05:22:00-04:00,WSFS,neutral
1368588.0,"WSFS Reports Deal to Buy Assets of Powdermill Financial Solutions, No Terms Disclosed",2016-08-03 18:01:00-04:00,WSFS,positive
1368589.0,WSFS Financial Corporation Announces Deadline For Shareholders To Elect Form Of consideration From Penn Liberty Merger,2016-07-29 16:12:00-04:00,WSFS,positive
1368590.0,Filing from WSFS Financial Shows Registration for Mixed Securities Shelf Offering,2016-06-08 07:50:00-04:00,WSFS,positive
1368591.0,WSFS Reports Q1 EPS $0.52 vs $0.51 Est.,2016-04-28 17:37:00-04:00,WSFS,neutral
1368592.0,WSFS Financial Reports Received All Required Approval for Purchase of Penn Liberty Financial,2016-04-05 17:04:00-04:00,WSFS,positive
1368593.0,WSFS Reports Q4 EPS $0.46 vs. Est. $0.47,2016-01-28 16:34:00-05:00,WSFS,neutral
1368594.0,"WSFS Resumes Search for New Chief Financial Officer, CFO Thomspon Stepped Aside Following A Family Auto Accident",2016-01-27 16:36:00-05:00,WSFS,negative
1368595.0,WSFS Reports Delayed Start Of CFO Kevin Thompson Due To Serious Auto Accident Affecting Immediate Family Members,2016-01-06 16:23:00-05:00,WSFS,negative
1368596.0,"WSFS Financial, Penn Liberty Financial To Combine; Total Transaction Valued At ~$101M, Penn Liberty Shareholders To Receive 0.6601 Shares Of WSFS Stock Or $21.75/Share Cash",2015-11-23 17:05:00-05:00,WSFS,positive
1368597.0,WSFS Names Kevin L. Thompson Chief Financial Officer,2015-11-12 16:17:00-05:00,WSFS,neutral
1368598.0,WSFS Bank And ZenBanx Form Strategic Alliance To Launch New Multi Currency Deposit Account,2015-06-03 16:33:00-04:00,WSFS,neutral
1368599.0,WSFS Reports Q1 EPS $1.34 Vs Est 1.29,2015-04-30 17:26:00-04:00,WSFS,neutral
1368600.0,WSFS Financial Announces 3-For-1 Stock Split,2015-03-17 16:31:00-04:00,WSFS,neutral
1368601.0,WSFS Financial Names Rodger Levenson Interim CFO,2015-03-17 08:06:00-04:00,WSFS,neutral
1368602.0,Morning Market Gainers,2015-03-03 09:52:00-05:00,WSFS,neutral
1368603.0,UPDATE: Alliance Bancorp Shareholders Entitled to Elect Either 0.28955 Shares of WSFS Common Stock or $22/Share in Cash,2015-03-03 08:02:00-05:00,WSFS,positive
1368604.0,"WSFS Financial, Alliance Bancorp Announces Definitive Deal for Merger; Alliance Shares Halted Following Release of News",2015-03-03 08:01:00-05:00,WSFS,positive
1368605.0,WSFS Financial Reports Q4 EPS $1.32 Vs Est. $1.40,2015-01-29 16:21:00-05:00,WSFS,neutral
1368606.0,"UPDATE: Keefe, Bruyette & Woods Downgrades WSFS Financial As Shares Near Target",2014-11-03 08:43:00-05:00,WSFS,positive
1368607.0,Keefe Bruyette & Woods DOw WSFS Financial Corporation ,2014-11-03 08:29:00-05:00,WSFS,neutral
1368608.0,WSFS Financial Corporation Reports Q3 EPS of $1.23 vs $1.40 Est,2014-10-30 16:46:00-04:00,WSFS,neutral
1368609.0,WSFS Increases Dividend to $0.15/share From $0.12/share,2014-09-18 16:27:00-04:00,WSFS,neutral
1368610.0,WSFS Acquires the First National Bank Of Wyoming ,2014-09-08 08:17:00-04:00,WSFS,neutral
1368611.0,"Sandler O'Neill Upgrades WSFS Financial Corporation to Buy, Raises PT to $80.00",2014-07-28 08:59:00-04:00,WSFS,neutral
1368612.0,"UPDATE: Keefe, Bruyette & Woods Upgrades WSFS Financial on Valuation and Expected 2Q Rebound",2014-04-29 07:59:00-04:00,WSFS,neutral
1368613.0,"Keefe Bruyette & Woods Upgrades WSFS Financial Corporation to Outperform, Lowers PT to $80.00",2014-04-29 06:25:00-04:00,WSFS,negative
1368614.0,"UPDATE: WSFS Will Combine with FNB of Wyoming (Delware), Will Pay $32M in Cash, 452,756 Shares",2013-11-25 08:08:00-05:00,WSFS,positive
1368615.0,"WSFS Will Combine with FNB of Wyoming (Delware), Will Pay $32M in Cash, 452,756 Shares",2013-11-25 08:03:00-05:00,WSFS,positive
1368616.0,WSFS Financial Corporation Reports Q3 EPS of $1.54 vs $1.06 Est; Revenue of $33.40M vs $32.89M Est,2013-10-24 16:50:00-04:00,WSFS,neutral
1368617.0,WSFS Financial Corporation Reports Q3 EPS of $1.54 vs $1.06 Est,2013-10-24 16:50:00-04:00,WSFS,neutral
1368618.0,"WSFS Financial to Buy Array Financial, No Terms Disclosed",2013-07-29 08:12:00-04:00,WSFS,negative
1368619.0,WSFS Financial Corporation Reports Q2 EPS of $1.16 vs $0.88 Est,2013-07-25 16:43:00-04:00,WSFS,neutral
1368620.0,"Janney Capital Downgrades WSFS Financial Corporation to Neutral, Raises PT to $48.00",2013-02-04 08:56:00-05:00,WSFS,neutral
1368621.0,"WSFS Financial Says Purchase Warrant for $1.8M from Treasury, Participation in TARP Completed",2012-09-12 16:04:00-04:00,WSFS,positive
1368622.0,WSFS Financial Corporation Prices $55.0 Million of Senior Notes,2012-08-21 16:46:00-04:00,WSFS,neutral
1368623.0,WSFS Financial Corporation Announces Senior Notes Offering ,2012-08-20 09:08:00-04:00,WSFS,neutral
1368624.0,Sandler O'Neill Downgrades WSFS Financial from Buy to Hold,2012-07-30 09:41:00-04:00,WSFS,neutral
1368625.0,"WSFS Files Prospectus for 52,625 Preferred Shares for US Treasury",2012-03-26 09:11:00-04:00,WSFS,positive
1368626.0,The Only Way To Make Serious Money In 2012,2012-01-09 21:07:00-05:00,WSFS,negative
1368627.0,WSFS Announces Small Business Loan Program,2011-09-29 08:17:00-04:00,WSFS,neutral
1368628.0,UPDATE: WSFS Financial Says it Has Ample Capital,2011-09-22 17:04:00-04:00,WSFS,neutral
1368629.0,WSFS Financial Withdraws Application for US Treasury Program,2011-09-22 16:57:00-04:00,WSFS,positive
1368630.0,KBW Revises EPS Estimates For WSFS,2011-08-01 08:57:00-04:00,WSFS,neutral
1368631.0,"Keefe, Bruyette & Woods Leaves WSFS Financial Market Perform, $43 PT Unchanged (WSFS)",2011-02-07 08:31:00-05:00,WSFS,neutral
1368632.0,WSFS Acquires Christiana Bank & Trust From National Penn Bancshares ,2010-12-06 08:50:00-05:00,WSFS,positive
1368633.0,Top Stocks of Delaware,2010-04-12 14:28:00-04:00,WSFS,positive
1368634.0,"Likely Torch Bearers In The Market If The Economic Recovery Sustains, WSFS, PEI, IDTI, MCHP, MWA  ",2009-11-30 10:13:00-05:00,WSFS,neutral
